,post_title,post_user,post_firm,post_position,post_text,post_like,post_comment,post_timestamp,post_url,company
0,Joining team as the first person at Microsoft?,paypur,/company/Amazon/,nan,"I interviewed for an SDE role for a new team being formed at Microsoft and hiring manager said I’d be the first one hired if I accept the offer. It seems like the job posting has been open for a while so I was a bit surprised that I would be the first one. I’m a little worried that if I join the team I might be the only on it for a while or it won’t feel like a cohesive team for a while. Does anyone at Microsoft on how the start of new teams are at Microsoft?Also, this was for an SDE2 level and I didn’t see any job openings for a senior engineer position for the same team. I’d be a bit worried joining a new team if it does not have a senior engineer.",0,5,2020-8-25 18:44:48,/post/Joining-team-as-the-first-person-at-Microsoft-DZ0v3Nh5,Cohesity
0,"3rd year student looking for internship referrals (3 previous internships, incoming at Autodesk)",Tpen48,nan,nan,"Hi everyone! I'm a junior at UWaterloo, and I'm looking for referrals. I've previously worked at a large Canadian telecom and a small hedge fund (Squarepoint Capital).Here is my resume: https://i.imgur.com/QBD1Vhh.jpgI don't really care about prestige or comp or anything, I just want to work on really cool projects!I'll be working at Autodesk for Winter 2021, and I am looking for Fall 2021 jobs or Summer 2022 (though if there are any companies still hiring for Summer 2021, I'd be glad to shoot my shot).Copy pasted hashtags for visibility! :) Thanks so much.#AppliedMaterials #Qualtrics #Cisco #Nvidia #OCI #Microsoft #LinkedIn #Snap #Splunk #Smartsheet #MongoDb #CapitalOne #SAP #Workday #Box #Expedia #Qualcomm #Wayfair #StarbucksIT #Visa #Zoom #Bloomberg #Docusign #Intuit #CarGurus #Charles #SchwabIT #Ford #Squarespace #VerizonMedia #Akamai #Freshworks #Medallia #PayPal #Doordash #Intel #Uber #DEShaw #Lyft #Amex #Unity #Indeed #Spotify #Netflix #Instacart #Cohesity #Salesforce #Cruise #Stripe #Pinterest #Twilio #Airbnb #Adobe #Workday #Indefinitely #Atlassian #Coinbase #Slack #Square #Twitter #Zillow #Zaplabs #Walmart #Okta #Quora #ZeroDown #Booking #VMWare #jobopening #jobsearch #Facebook #Google",4,1,2020-11-26 21:14:35,/post/3rd-year-student-looking-for-internship-referrals-3-previous-internships-incoming-at-Autodesk-XNLG4Pay,Cohesity
0,India best companies list compilation,linkedsys,/company/LinkedIn/,Admin,"I noticed that conversations about top companies and startups on Blind is mostly US-centric.So decided to do some research and made a list of top tech companies in India categorized by factors like pay/wlb/remote-first etc.Just wanted to share it with the community.Also request you to please let me know if the list is missing any company, or if a company is categorized incorrectly.Here is the list:# Highest paying companies (40+ LPA for 3 YOE) ## High pay / Good WLB- Adobe- Apple- Atlassian- Expedia- Flipkart- Google- Indeed- Inmobi- Intel- Intuit- JP Morgan- Linkedin- Microsoft- Morgan Stanley- Nutanix- Nvidia- Salesforce- Twitter- VMWare## High pay / Unknown WLB (Didn't find much data)- AirBnB- Alphonso- App Dynamics- Aviso- Bloomreach- Citrix- Cohesity- Coinbase- Compass- Cure Fit- Directi- Hasura- HealthifyMe- Instabase- Meesho- MotorQ- Myntra- Ola- Oracle (OCI)- Palo Alto Networks- Postman- Practo- Quadeye- Qubole- Rippling- Rubrik- ServiceNow- Sharechat- Snowflake- Stripe- Sumologic- Swiggy- Target- Thoughtspot- Udaan- Urban Company- Vizury- Whatfix- World Quant## High pay / Bad WLB- Amazon- Arcesium- Codenation- DE Shaw- Goldman Sachs- Grab- Harness- Sprinklr- Tekion- Tower Research- Uber- Wissen (Consultancy having high profile clients like Morgan Stanley) - Zomato------------------------------------------------# Lower paying companies## Low pay / Good WLB- ARM- Blackbuck- Broadcom- Cisco- Confluent- Couchbase- Intel- Mathworks- Mentor Graphics- MongoDb- Oracle (other than OCI)- Qualcomm- Samsung- Slack- Texas Instruments- Visa- Walmart## Low pay / Unknown WLB- BigBasket- Box8- Bounce- BrowserStack- Chowbotics (DoorDash)- ClearTax- Cloudera- Coinbase- Cred- Dream11- Dunzo- Esper- Informatica - Jio- Jumbotail- Juniper Networks- Kuvera- MakeMyTrip- Mobikwik- Mindtickle- MokaPos- MX Player- MyGate- Navi- Oyo- Paypal- Razorpay- Redhat- SanDisk- Sprinklr- SuprDaily- Twilio- Unacademy- Upgrad- Zerodha## Low pay / Bad WLB- Grofers- Hotstar- Paytm------------------------------------------------# Unknown compensation- FalconX- Freshworks- Gojek- Groupon- Hackerearth- Policy Bazaar- Rupeek- Tokopedia- Trifacta- Truecaller- Zoom- Zynga------------------------------------------------# Visa-sponsors- Booking Amsterdam- ByteDance Singapore- Databricks Amsterdam- Facebook London- Spotify Stockholm- Yelp London- Zalando Berlin- Plenty of other options on Stackoverflow jobs.------------------------------------------------# Remote-first companies- Atlassian- Auth0- Coinbase- Datadog- Facebook- Github- Gitlab- Shopify- Slack- Square- Stackoverflow- TwitterGood websites to find jobs at startups:- tophire.co- instahyre.com50L TC with 4 YOE.#Linkedin #Google #Uber #Adobe #Apple #Facebook #Salesforce #Intuit#Amazon #Rubrik #Nutanix #Slack #Atlassian #Twitter #Square #Databricks #Visa #Intel #Zoom #Gojek #Grab #Microsoft",240,556,2020-9-20 13:26:45,/post/India-best-companies-list-compilation-QYzFSoX4,Cohesity
0,Looking for Tech Internships,funinsun ,/company/Aon/,nan,"I am looking for a summer 2021 internship in product management, iOS development, backend, or ML.About Me:I am a US Citizen. I am currently a college student in California with an expected graduation date of 2023 (Masters). I can push up my grad date to 2022, if I only do bachelors degree. I am interning with Apple right now, and I will be interning with Snap in the Fall. I have proficiency in Python and C++. I also have experience with Java, HTML, SQL, and CSS.If any hiring manager or company is still looking for interns, I would love to interview or get a referral. I can offer an Apple referral in return.I am open to startups as well!#facebook, #google, #microsoft, #bloomberg, #uber, #adobe, #oracle, #goldmansachs, #bytedance, #linkedin, #ebay, #jpmorgan, #vmware, #citadel, #capitalone, #paypal , #airbnb, #lyft, #atlassian, #twitter, #yandex, #salesforce, #roblox, #expedia, #doordash, #qualtrics, #quora, #dropbox, #wish, #nutanix, #visa, #databricks, #citrix, #zillow, #twilio, #serviceNow, #intuit, #indeed, #tesla, #pinterest, #square, #splunk, #twosigma, #wayfair, #spotify, #akunacapital, #tencent, #flipkart, #palantir, #morganstanley, #robinhood, #audible, #alibaba, #purestorage, #yelp, #ixllearning, #asana, #karat, #houzz, #tripadvisor, #twitch, #codenation, affirm, #didi, #grab, #tableau, #cruiseautomation, #sumologic, #coupang, #quip, #box, #zulily, #cohesity, #postmates, #docusign, #paytm, #pocketgems, #hulu, #netflix, #coursera, #rubrik, #reddit, #factset, #groupon, #cloudera, #deshaw, #appdynamics, #aristanetworks, #triplebyte, #blackrock, #accolite, #zoho, #redfin, #amex, #evernote, #baidu, #booking, #liveramp, #virtufinancial, #garena, #ponyai, #barclays, #duolingo, #drawbridge, #epic, #toptal, #dunzo, #riotgames, #alation, #janestreet, #poshmark, #akamai, #sapient, #zappos, #hotstar, #opendoor, #blizzard, #swiggy, #hrt, #ynga, #MakeMyTrip, #jumptrading, #dataminr #cameo #bumble #tinder#startup #rivian #optimizely #tech #swe #product #intern#engineering #software #hedgefund",3,2,2021-2-15 21:32:50,/post/Looking-for-Tech-Internships-VndFN63R,Cohesity
0,Interview thought process bull sh***,sdblind,nan,nan,"First of all, I am a fan of using leetcode style questions on interviews in large companies with a lot of positions to fill. It's provides a cohesive standard for interviewing that scales well. I believe it should reduce the amount of worthless hires.However, my post is about the notion that these kind of questions provide you insight into the candidates problem solving. Who came up with that bullshit and why do people keep parroting it?Let's say I ask you a leetcode medium/hard you've never seen anything like it before. There is no way that in 45 minutes you'll get it correct. You'll be showing me how bad your thought process is at trying to come up with something that took many people many hours to optimize. Then I will fail you for providing at best n squared algorithm.Now let's say you have seen something like it before. And you spent hours and days optimizing your thought process to get that answer. So all i see is your ability to memorize and recall something. If you were to face a new problem on the job, your thought process would be nothing like that. Plus I will pass you, even though it may have taken you a year to memorize that one question.So please don't say that it provides insights into ones thought process. It's simply a test to weed out people that can't comprehend something enough to memorize and recall it. The thought process you show will be the one you copied from other people.",18,23,2018-9-21 02:42:57,/post/Interview-thought-process-bull-sh-XgjMpp6Q,Cohesity
0,How do I make the most of my experience?,qpPW48,/company/Microchip-Technology/,Eng,"New grad been at my job for 5 monthsLong story short I joined a small team who's go no formal education and very poor fundamentals of software engineering. My code base is older than me in a language that's almost on the top of stack overflows most hated list (don't wanna give too many specifics)Point is that most of the time I spend fixing problems on a code base that I could probably completely re write on my own in under a month of solid work and have it run much better.None of our tables are at all normalized(I asked why and they didn't seem to understand what I was trying to do), duplicated data everywhere across multiple tables, they don't use git and opted for the file share route, no automation, no new technologies (it was almost a miracle I got a new laptop), and most of the time I spend writing docs for myself because there's quite literally nothing documented, but the way the system operates (if that's what you'd call it) doesn't make any sense at all anyway. Zero tests (not that I think we could test the code), and just no cohesive plan of how to maintain any of it. Im quite literally my teams newest hire in the last decade.Most of the time that I've been here I've just been fixing problems and asking why we did the things we did in certain areas, and I just don't know how I can really learn or progress when the things I do implament they don't completely follow because of their lack of fundamentals (things like core concepts of data structures and really utilizing object oriented programming and principles)Any advice of what I should do to make the best of my time? I'm trying to jump ship but even getting phone screens or OA's has been difficult, and I want to at least make the best of the time I have while working here.#engineering #software #swe",4,7,2021-2-14 05:03:59,/post/How-do-I-make-the-most-of-my-experience-w6Wj2ztq,Cohesity
0,In a delicate situation. Need help with referrals for PM roles,kd91,/company/Deloitte/,nan,"Long post alert !!Not at Deloitte. Using a friend's work email since mine is blocked.Hi All,I am currently in the middle of a delicate situation and need help with referrals and maybe some advice.Currently based out of India and was working in a Non tech role at an IT services major (hint : the CEO makes more than all the other WITCH CEOs combined) .Was hired from Tier 1 Indian B School for a Leadership Development Profile and have worked in roles across Strategy, Product and Program Management.Situation : I reported to a CXO initially and then a VP who was in turn reporting to the same CXO.All candidates hired across Tier 1 B schools for this profile typically reports to VPs, SVPs, CXOs in the company.Few months ago, an HR invited me to a meeting, where I found my reporting manager (the VP) as well. I was told that my performance was not upto the mark and that I had to resign immediately with no severance.I asked my manager, to give examples of instances where I did not perform well, and he could not name a single instance. I even mentioned that I had received the highest rating in my last appraisal, and I did not hear about any concern about my performance at that time. But they were not willing to listen to that.I asked them, why they were not putting me on PIP, they did not give any reason.I asked to move to a different team, but they refused giving no reason.Then I asked for a 3-4 months of leeway, so that I can atleast try to find other employment. They did not respond to this request.Then they ended the call and immediately blocked my LAN/official email.Meanwhile, they also stopped my salary without any intimation or explanation.After that, every few weeks someone from the HR team reaches out to me either on phone or emails me on personal mail asking me to send them a resignation email. When I ask them to give me 3-4 months of extension and ask them the reason for stopping my salary, they stop responding.Every few week, someone from HR reaches out asking me to Physically come to office for some so called “discussions”, but they refuse to do so over phone or email.Neither haver I sent them any resignation letter or have they sent me any termination letter. I still haven’t received any salary since then.I even crosschecked my employment contract, and realised that it does not contain any resignation or termination clause. Maybe that’s why they haven’t sent any termination letter yet.Once I find another job, I will formally resign and take legal action against them. What do you guys think ?YOE : 5 years 7 months ( 2 years 7 months post MBA)TC : INR 13 lakhsBefore anyone says so, yes I do know that I am poorly paid. Made the mistake of trusting the management’s verbal promises.I have a student loan as well as need to support parents financially as they are not well off.Looking primarily for Product Management, Program Management and Strategy roles.I have been preparing for a while and would be interview ready in a few weeks.Requesting help from fellow Blinders with referrals at good tech companies.#layoffs #referral #job openings #faang #microsoft #amazon #google #facebook #salesforce #vmware #intuit #expedia #uber #indeed #rippling #apple #walmartlabs #mastercard #paypal #netflix #adobe #linkedin #dell #cisco #ebay #sap #hpe #oracle #oci #amex #goldman sachs #grab #groupon #twitter #confluent #atlassian #cohesity #rubrik #tesco #cloudera #palo alto networks #cloudera #nvidia #centurylink #juniper #paysafe #mcafee #servicenow #directi #slack #twitter #pinterest #square #stripe #instagram #tinder #lyft #spotify #priceline #yelp #zynga #amd #intel #arcesium #cadence #mutanix #booking #phonepe #flipkart #sharechat #hike #zoom #uipath #dell #appdynamics #postman #zoho # freshworks #thoughtspot #zeta #tekion #visa #myntra #mastercardIf any of you is a Hiring manager, or can connect me directly to  hiring managers or recruiters, that would be awesome. I have no location constraints either in India or abroad.Most of my alumni and batchmates are not in the tech industry, so reaching out to you guys for help.Any help I get, would pay it forward.Thanks in advance",7,14,2021-1-15 17:22:55,/post/In-a-delicate-situation-Need-help-with-referrals-for-PM-roles-rfYUBeXd,Cohesity
0,Litmus test for future academic career,internhope,/company/Amazon/,nan,"TLDR; Let me know of a good litmus test to see if I'm wasting my time pursuing theoretical physics/neuroscience. I've added a few options below, but you're welcome to suggest other methods.I'm a new grad who'll be starting at Amazon next week.Over the past few years (and especially this pandemic), I've become increasingly jaded about the idea of spending the rest of my career in tech. Instead, I think theoretical neuroscience research is my true calling; I spent a lot of my childhood learning about the brain (even did a few research internships in neuro labs during high school) and I firmly believe that neuroscience holds the keys to true AGI (which I also think a lot about).As for why theory and not experiment, I noticed that almost everyone in neuroscience runs experiments without trying to organize the results into a cohesive ""theory of everything"". As a result, while we've been able to get a pretty good understanding of individual neurons, we have very little quantitative insight into how those individual neurons determine brain function at a systems level.Thus, I'm a big believer in using the theoretical physics approach - building beautiful models that can generate structured hypotheses for experimental neuroscientists to test. However, unlike in theoretical physics, I believe there are many contributions to be made in neuroscience that can influence our daily lives. For example, an experimentally verified, quantitative model of human memory could let brain-computer interfaces (e.g. Neuralink) keep us from developing dementia.That being said, I'm also a pragmatist. I fully realize that making serious contributions to theoretical fields requires outlier ability and intense dedication (e.g. Ed Witten, Andrew Wiles). Therefore, I'm looking for a 5-10 year litmus test I can perform while working full-time as an SWE that will let me know if it's worth yolo-ing the rest of my life into this pursuit.Here's what I've come up with:1) Success in competitive programming (Codeforces 2200+) and math (Putnam top 100)For pros, competitive programming is somewhat related to tech. For example, an orange-level competitive programmer can likely pass interviews at most tech companies. Also, according to https://events.barcelonagse.eu/live/files/2302-patrickgaule59635pdf, success in competitive math correlates well with productivity in math research. However, neither will involve graduate math or any physics.2) Success in olympiad physics (IPhO gold medal)For pros, the content I learn will cover a large part of an undergraduate physics degree. However, most people say that there's a much weaker correlation between IPhO success and research success (as opposed to in competitive math). Also, IPhO doesn't require much math (not even multivariable calculus, differential equations, or linear algebra).3) Deep understanding of math/physics (acing Harvard math + Princeton physics qualifiers)For pros, this things I learn will be directly applicable to theoretical physics. However, there is a very strong possibility of being a false positive. That is, even though almost all math and physics PhDs can pass qualifying exams in their respective subjects, most PhD graduates do not make any contributions to their field.What do you guys think? Answer the poll or suggest an alternative below.",0,18,2021-2-10 01:04:53,/post/Litmus-test-for-future-academic-career-b2QsMZHs,Cohesity
0,In a delicate situation. Need help with referrals and advice,kd91,/company/Deloitte/,nan,"Long post alert !!Not at Deloitte. Using a friend's work email since mine is blocked.Hi All,I am currently in the middle of a delicate situation and need help with referrals and maybe some advice.Currently based out of India and was working in a Non tech role at an IT services major (hint : the CEO makes more than all the other WITCH CEOs combined) .Was hired from Tier 1 Indian B School for a Leadership Development Profile and have worked in roles across Strategy, Product and Program Management.Situation : I reported to a CXO initially and then a VP who was in turn reporting to the same CXO.All candidates hired across Tier 1 B schools for this profile typically reports to VPs, SVPs, CXOs in the company.Few months ago, an HR invited me to a meeting, where I found my reporting manager (the VP) as well. I was told that my performance was not upto the mark and that I had to resign immediately with no severance.I asked my manager, to give examples of instances where I did not perform well, and he could not name a single instance. I even mentioned that I had received the highest rating in my last appraisal, and I did not hear about any concern about my performance at that time. But they were not willing to listen to that.I asked them, why they were not putting me on PIP, they did not give any reason.I asked to move to a different team, but they refused giving no reason.Then I asked for a 3-4 months of leeway, so that I can atleast try to find other employment. They did not respond to this request.Then they ended the call and immediately blocked my LAN/official email.Meanwhile, they also stopped my salary without any intimation or explanation.After that, every few weeks someone from the HR team reaches out to me either on phone or emails me on personal mail asking me to send them a resignation email. When I ask them to give me 3-4 months of extension and ask them the reason for stopping my salary, they stop responding.Every few week, someone from HR reaches out asking me to Physically come to office for some so called “discussions”, but they refuse to do so over phone or email.Neither haver I sent them any resignation letter or have they sent me any termination letter. I still haven’t received any salary since then.I even crosschecked my employment contract, and realised that it does not contain any resignation or termination clause. Maybe that’s why they haven’t sent any termination letter yet.Once I find another job, I will formally resign and take legal action against them. What do you guys think ?YOE : 5 years 7 months ( 2 years 7 months post MBA)TC : INR 13 lakhsBefore anyone says so, yes I do know that I am poorly paid. Made the mistake of trusting the management’s verbal promises.I have a student loan as well as need to support parents financially as they are not well off.Looking primarily for Product Management, Program Management and Strategy roles.I have been preparing for a while and would be interview ready in a few weeks.Requesting help from fellow Blinders with referrals at good tech companies.#layoffs #referral #job openings #faang #microsoft #amazon #google #facebook #salesforce #vmware #intuit #expedia #uber #indeed #rippling #apple #walmartlabs #mastercard #paypal #netflix #adobe #linkedin #dell #cisco #ebay #sap #hpe #oracle #oci #amex #goldman sachs #grab #groupon #twitter #confluent #atlassian #cohesity #rubrik #tesco #cloudera #palo alto networks #cloudera #nvidia #centurylink #juniper #paysafe #mcafee #servicenow #directi #slack #twitter #pinterest #square #stripe #instagram #tinder #lyft #spotify #priceline #yelp #zynga #amd #intel #arcesium #cadence #mutanix #booking #phonepe #flipkart #sharechat #hike #zoom #uipath #dell #appdynamics #postman #zoho # freshworks #thoughtspot #zeta #tekion #visa #myntra #mastercardIf any of you is a Hiring manager, or can connect me directly to  hiring managers or recruiters, that would be awesome. I have no location constraints either in India or abroad.Most of my alumni and batchmates are not in the tech industry, so reaching out to you guys for help.Any help I get, would pay it forward.Thanks in advance",2,7,2021-1-15 16:42:10,/post/In-a-delicate-situation-Need-help-with-referrals-and-advice-kvEKsZqe,Cohesity
