,post_title,post_user,post_firm,post_position,post_text,post_like,post_comment,post_timestamp,post_url,company
0,Choosing Nutanix over Cohesity,stop-down,/company/FireEye/,nan,"I have had similar offers from both companies, and yesterday I went with Nutanix after much deliberation with my partner, family and mentor. Had to quickly decide coz Cohesity had given me a deadline to give my decision, so didn't have much time.  Main consideration I traded pre IPO upside and potential better learning against was concern of WLB, as given my current physical and mental health condition, I really can't afford to get into stressful startup culture with bad WLB. Also, I'm considering this switch for longer term (2+ years).But now I'm feeling bad and having 2nd thoughts. Cohesity HM seemed very empathetic and considerate(reached out to me proactively to clear my concerns etc). Nutanix HM seemed like a really cool guy.Have I made a mistake? I've known Nutanix to be a nice company till very recently, when I saw many negative reviews on blind. I declined Coheisty very politely, now please guide me if I must call the Cohesity HM/recruiter back :P A few words about your choice will really help me with data points I might have missed.Offered TC:- Level - MTS3Nutanix: 35.5 LPA, Cohesity: 35.2 LPA - 39.5 LPA (considering IPO upside)~3 YoE",0,21,2021-5-22 03:29:12,/post/Choosing-Nutanix-over-Cohesity-SE2nNA0T,Cohesity
0,"Looking for referrals - Cohesity, Rubrik",lQpb40,/company/Qualys/,nan,Current TC - 22 lpaYoe - 6.5#engineering #software #swe,1,15,2021-5-13 04:56:58,/post/Looking-for-referrals---Cohesity-Rubrik-ncGRv54a,Cohesity
0,Cohesity for Frontend role,luffy247,/company/Walmart/,nan,"Hey, I am 4.5 yrs exp. frontend developer planning to switch. Recently got an offer from Cohesity. I work here in consumer facing application. I guess I would have to work with clients there at Cohesity. Only considering Cohesity because its near to IPO and it seems like a rare opportunity to join a pre IPO company. Does it seem like a good move? How is cohesity particularly for frontend devs?TC from Cohesity: 40L (Base) + 2L (Joining) + 4500 RSUsLocation: Remote (India)#cohesity",1,20,2021-4-7 03:30:59,/post/Cohesity-for-Frontend-role-2czYYnx4,Cohesity
0,Cohesity Share price,borntowin,nan,nan,"Anyone insider from Cohesity could share the insider price of the stock currently to evaluate my offer.Cohesity , Santa Clara, CASr. Quality Engineer ( IC3)Base -150KBonus -5% (7500$)RSU - 11000* Share price 50$ by HR, what's actual price ( IPO may be this year or next year expected, 4yr vesting)Yearly TC -295K",0,16,2021-5-6 00:40:09,/post/Cohesity-Share-price-mDdYgMgY,Cohesity
0,Cohesity WLB,nolM66,nan,nan,"TC: ~30 LPAYOE: ~9I have an offer from Cohesity for SMTS (devops, tools, infra) role at Bangalore.Can someone please share how is WLB and work culture at Cohesity India office?",2,16,2021-5-7 13:32:00,/post/Cohesity-WLB-uBFbcJMN,Cohesity
0,How is Cohesity India?,TbHb06,nan,nan,will be interviewing with them for Data protection team as MTS. Can someone please provide few pointers on:* how's data protection team* work quality * WLB* any layoff that happened recently?* Will they really go for IPO this year?* Also what should be the expected tc for 4 yoe?Current TC : 35 LPAYoe: 4#cohesity,5,16,2021-4-28 12:12:25,/post/How-is-Cohesity-India-m5fzjsYN,Cohesity
0,Cohesity Secondary Sell Offer,UszW17,/company/Cohesity/,nan,Got offer today from secondary buyer for $31.50/share. Any one else receive this offer on LinkedIn? #cohesity,9,39,2021-3-11 00:51:17,/post/Cohesity-Secondary-Sell-Offer-KupWhEvW,Cohesity
0,[India] Cohesity SMTS comp,zha2,/company/Flipkart/,Eng,Recruiter has told me that the feedback is positive for my interviews and I'm expecting an offer soon for an SMTS position. Can anyone tell me what is the compensation range for the SMTS at Cohesity?TC - 36LYOE - ~5,2,15,2021-5-4 18:45:06,/post/[India]-Cohesity-SMTS-comp-55kV5Vdm,Cohesity
0,Referral at Cohesity,valoretta,/company/VMware/,nan,Looking for a referral at Cohesity.#software #cohesity #referral,1,4,2021-3-12 20:16:35,/post/Referral-at-Cohesity-EcwwpVJc,Cohesity
0,Cohesity Final rounds,fRPi04,/company/EY/,nan,"I've an upcoming final virtual round for Cohesity SDE. The recruiter said it will be a mix of ""coding, debugging and problem solving skills"" in the first round and ""behavioral"" in the second. Can someone please help?  #cohesity #sde #interview #virtual-onsite #help #techYOE - 2.5 years in India, recent grad in US",0,4,2021-4-1 20:09:25,/post/Cohesity-Final-rounds-mWzjGYJJ,Cohesity
0,Cohesity Going Public via SPAC ?,SelfDriEV,/company/Apple/,nan,"I heard from a friend of mine, who is deep in the VC world that with the transition to subscription based revenue, Cohesity and their competitors are attracting huge interest from what he called SPACs for a buyout. He’s heard Cohesity has been approached at a $20-25 billion valuation.I know the market is high, I’ve seen my Tesla shares explode but what exactly is a SPAC, why would a company use them and how does that all work?#buyside #pe #vc",2,10,2021-3-26 14:12:17,/post/Cohesity-Going-Public-via-SPAC-NOUgki2E,Cohesity
0,Help to choose between cohesity and Microsoft!!!,aries195,/company/Cohesity/,nan,Writing here to get my confusion cleared!I have offer from cohesity and microsoft. Having 4+ YoE.Offer number:Cohesity - 28(base) + other comp = 29.50 LPA + 3500 stocksMicrosoft - 33LPA + 40k stocks(4 year)Location: bangalore(india)I am planning to join cohesity just in hope that it will go public soon but work is not pure development. While in microsoft its development in azure group. #microsoft #microsoftoffer #cohesity,0,15,2021-4-9 15:34:17,/post/Help-to-choose-between-cohesity-and-Microsoft-St1R0iAO,Cohesity
0,Need Help with Microsoft and Cohesity Offer,yWRv50,/company/Citrix/,nan,"Joined Citrix, Fort Lauderdale office a couple of months ago, not enjoying legacy stuff and planning to leave for better brand, culture is goodMicrosoft SWE I L60 Redmond, WA Base: 135k  RSUs: 22K per year Sign-on: 23k (first year only) Performance Bonus: 13.5kTC: 193.5k first year, 170.5k second onwardsInterviewed for SWE II L61/L62 at Microsoft but got L60, negotiated fiercely to get to above numbers.Cohesity MTS3 Bay area, CABase: 145k RSUs : 55k per year (as per secondary market)TC: 200k for 4 yearsThere is a IPO risk here 55k is as per secondary market, also I heard culture is not good at Cohesity, very fast paced.I am slightly inclined towards Microsoft due to the culture and other benefits, also the team suites very well to my profile. Is it worth compromising on dollars to join Microsoft, since from second year onwards my pay would be 20-30k lesser than my current TC and other offer.Please adviseYOE: 4yrsCurrent TC: 200k #microsoft #salaries #salarycomparison #cohesity #citrix",0,14,2021-4-14 23:42:46,/post/Need-Help-with-Microsoft-and-Cohesity-Offer-3Y3byFkB,Cohesity
0,Any tips for Cohesity interviews?,dilemmaSu,/company/Goldman-Sachs/,nan,Title.TC: 25 LPAYOE: 2,2,3,2021-3-3 18:46:27,/post/Any-tips-for-Cohesity-interviews-qgvt3u0d,Cohesity
0,Cohesity MTS-2 salary range bangalore/pune?,MtXI63,/company/Oracle/,nan,What is the salary range (both base and RSU's) for a 2 YoE laterally hired MTS-2 at Bangalore/Pune location? Need it for salary negotiation.Current TC - 22 lpa#cohesity #salary #salarynegotiation #bangalore #pune #bengaluru,0,1,2021-3-4 21:24:55,/post/Cohesity-MTS-2-salary-range-bangalorepune-5mtggEEg,Cohesity
0,What is cohesity IPO reasonable share price ? Is it gonna touch 40 $?,TtoE74,/company/Uber/,nan,#ipo,7,6,2021-4-24 13:53:59,/post/What-is-cohesity-IPO-reasonable-share-price-Is-it-gonna-touch-40-WvEYyNDs,Cohesity
0,Cohesity has scheduled a coding test in CodeSignal. Please let me know the type of coding questions asked.,scaredglvy,/company/Intuit/,nan,Title🙂 Thanks,3,1,2021-4-30 17:00:52,/post/Cohesity-has-scheduled-a-coding-test-in-CodeSignal-Please-let-me-know-the-type-of-coding-questions-asked-R8TTjf5S,Cohesity
0,Cohestiy IPO,dmrast,/company/Flipkart/,nan,Hi cohesity family !Any idea when will cohesity go for IPO and what is the expected stock price for IPO. How likely Cohesity will file for IPO by end of this year ?Base: 40RSU: 5000 / 4 yearsYOE: 5 #tech #ipo #cohesity,0,25,2021-5-15 09:10:25,/post/Cohestiy-IPO-8aJPXGjh,Cohesity
0,Companies to target for infrastructure/distributed systems roles,hateAmz,/company/Amazon/,Eng,"I am trying to curate a list of companies that have good infra/distributed systems SWE roles (not to be confused with DevOps/SREs). I am going to list some I know, please list more in the comments:AWS/Azure/GCPDatabricksConfluentCohesityNutanixFacebook infra (?)#engineering #software #swe #amazon #microsoft #google #facebook",3,36,2021-5-16 07:48:17,/post/Companies-to-target-for-infrastructuredistributed-systems-roles-BHQ7pofE,Cohesity
0,Need Interview opportunity,soLM52,/company/Amazon/,nan,"Looking for opportunities in Oracle OCI, Cohesity, Atlassian.I have good command over DS & Algo and System Design to Some Extent.Experience: 1.5 yearsCurrent CTC: 22LPA#referral #cohesity #oci #oraclecloud #oracle #atlassian",0,10,2021-3-24 06:11:11,/post/Need-Interview-opportunity-WaqtjaOi,Cohesity
0,Cohesity,hashit,/company/Apple/,nan,How is it? Have an offer but having second thoughts.,2,29,2018-4-20 03:53:08,/post/Cohesity-NYTTB0Pw,Cohesity
0,Cohesity stock per share,ycpe13,/company/Visa/,nan,What’s the current stock value per share for Cohesity? Got offered 40k units of RSUs. My current TC is 380k and want to see if 40k RSUs is reasonable.,3,37,2021-1-21 11:03:46,/post/Cohesity-stock-per-share-iTjujC7A,Cohesity
0,Cohesity salaries,xdxi10,/company/SAP/,Eng,What are cohesity salaries in Bangalore/Pune for MTS?,0,17,2019-6-13 10:32:55,/post/Cohesity-salaries-NaCqY5Ot,Cohesity
0,Rubrik and Cohesity TC Bangalore,infinite_d,/company/Goldman-Sachs/,nan,Got done with my on-site rounds and have HM rounds next. Wondering how much I should ask for.Currently am planning on asking around 40 base + 15% bonus + 5000/4 RSUAlso got done with onsite for Cohesity and planning to negotiate with each other. Have 0 idea about Cohesity comp.TC: 31.5 + 25-50% bonus ~ 43LYoe: 2.7#engineering #software #swe #offer #rubrik #cohesity ,6,30,2021-2-11 11:08:36,/post/Rubrik-and-Cohesity-TC-Bangalore-WAZQUube,Cohesity
0,Cohesity offers,mthc65,nan,Eng,Could you all share what’s a good base/stock to join Cohesity?,3,11,2018-8-19 18:17:34,/post/Cohesity-offers-q25pbPpv,Cohesity
0,Cohesity compensation ,tadh,/company/Veritas/,nan,Interviewed with Cohesity recently and went very well. Got a positive feedback from and expecting an offer from them. What should I expect for 4 YOE?,0,7,2019-2-25 08:51:43,/post/Cohesity-compensation-wQZitH3N,Cohesity
0,Evaluate Cohesity Offer,PiP'd,/company/Nutanix/,nan,Hi Everyone anyone has idea about Cohesity current offers? I am being offered bellow numbers :Pay 105KRSU 4KNo Sign Up Bonus or AnythingPosition SREYOE 11 years of IT Experience. #offer #cohesity,0,4,2020-10-26 18:10:40,/post/Evaluate-Cohesity-Offer-FVQaSdvs,Cohesity
0,Cohesity vs Nutanix,sdawg,/company/Arista-Networks/,nan,Can anyone share the expierence with working at Cohesity vs Nutanix?Which one is better to work for? Getting offer from both places.,1,16,2018-12-7 01:11:21,/post/Cohesity-vs-Nutanix-SwbiAy5Q,Cohesity
0,Druva - vs Cohesity & Rubrik,wxp10fx,/company/Expedia/,Eng,How’s Druva compared to #Cohesity and #Rubrik? What are Druva’s competitive advantages?,0,8,2021-2-14 00:16:20,/post/Druva---vs-Cohesity-Rubrik-d13r7vxJ,Cohesity
0,Cohesity vs Sharechat,zkmy12,/company/Qubole/,nan,Which company has better work life balance have received offers from both of them.,3,24,2020-12-11 17:11:28,/post/Cohesity-vs-Sharechat-UM6y3g0q,Cohesity
0,Cohesity vs Atlassian,dark321,nan,nan,"I will be graduating next year and I have offers from both Cohesity and Atlassian. Both are in Bangalore, India. Offer details:Cohesity : 15 lakh INR base + 2 lakh INR joining bonus + 2300 rsu over 4 years(pre-ipo).Atlassian : 12 lakh INR base + 10% bonus + $50k stocks over 4 years.Which is better in terms of culture, growth, easiness to switch etc?",5,13,2019-9-3 15:10:34,/post/Cohesity-vs-Atlassian-KNQRAp7q,Cohesity
0,Compensation at cohesity,oracool,/company/Oracle/,nan,Anyone with recent offers from Cohesity? Could you please share your offer and experience?Sorry didn't find cohesity so tagged nutanix since I understand there are ex employees who where there.,0,14,2018-5-23 15:10:16,/post/Compensation-at-cohesity-y5v6a73Z,Cohesity
0,Cohesity - Beware ,eJaH26,/company/NortonLifeLock/,nan,"Dead already - Looks like with AWS Backup, this company is finished.",1,18,2019-1-23 05:10:29,/post/Cohesity---Beware-z2mDKBpL,Cohesity
0,Cohesity culture,efFI74,/company/Dell/,Eng,I have interview scheduled at Cohesity. How is cohesity culture and how is total TC for ~10 yoe. Does it look they will make it to IPO or acquisition?Thank you.,1,7,2019-4-27 15:51:33,/post/Cohesity-culture-1WvVGi7B,Cohesity
0,Rubrik/Cohesity IPO status update ?,vmware/4.5,/company/VMware/,Mgmt,Are the mass data frag companies planning IPO's this yr or are revised benefits/ acquisitions with current fundings they have currently on the charts ?Also is their valuation going to be higher than the projected $23.5/$11?,1,17,2019-8-10 09:21:39,/post/RubrikCohesity-IPO-status-update-OmbBoHox,Cohesity
0,Offer Cloudera and Cohesity,NXpo08,/company/Nutanix/,nan,Cohesity TC (24 base + 3600 RSU's + 2 signon) Cloudera TC 27L (23 base +  4L stocks + 1 signon)Yoe ~5Current TC 22L (17 base + 5L stocks)Which one is better?I am more inclined towards cohesity... how is the work and culture in cohesity!!#offer #cohesity #cloudera #bangalore @cohesity @cloudera #wlb,1,30,2020-10-17 13:57:24,/post/Offer-Cloudera-and-Cohesity-ZOVWbD7s,Cohesity
0,Cohesity Interview,koolkoder,nan,R&D,"I have Cohesity 1st round of interview (Zoom) next week. What should I expect? I have heard they conduct tough interviews.Location: Pune, IndiaProfile: MTS (New Grad)  #leetcode #interview #newgrad",2,4,2019-12-26 18:33:56,/post/Cohesity-Interview-8Aaqzrnc,Cohesity
0,Cohesity India Research Engineer,xtabc,nan,nan,Is it true that Cohesity India last year offered TC of 62L to freshers from top IITs for their Research Engineer Profile ? Can someone tell what is the compensation they offer to more experienced people as I am looking to switch ? Background mentioned below. YOE-3TC-42LThis article mentions the 62L figure I talked about and it was mentioned domestic.https://timesofindia.indiatimes.com/city/mumbai/microsoft-remains-the-top-paying-recruiter-at-iit-bombay/articleshow/72324059.cms #tech #indiasalary #faang,2,10,2020-10-25 13:11:26,/post/Cohesity-India-Research-Engineer-bk1X4TYM,Cohesity
0,Cohesity salary,jumbo jack,/company/Dell-EMC/,nan,Anyone with recent offers from Cohesity? Could you please share your offer and experience?I had an on site last week and today recruiter called me and asked for salary expectations.I am thinking of asking 175k base and 600k worth rsus.Is it a reasonable ask for 7 YOE.Current salary at Seattle 150k base10% bonus20k LTI.,0,16,2018-9-20 07:44:53,/post/Cohesity-salary-ze33F0J5,Cohesity
0,Cohesity Bonus,kPXa03,/company/VMware/,nan,Does Cohesity give annual bonus? What are typical percentages?,1,3,2018-12-29 19:52:43,/post/Cohesity-Bonus-2f73KkxN,Cohesity
0,Cohesity,eJaH26,/company/NortonLifeLock/,nan,"Thinking of leaving Oracle and applying for a suitable dev position at Cohesity. Thoughts??This is for bay area, san jose.  What is their culture? TC? WLB?",2,8,2019-1-15 08:01:28,/post/Cohesity-nwZbg24Z,Cohesity
0,Compensation at Cohesity,codema,/company/Dell-EMC/,nan,How much stocks and base should you ask for while joining Cohesity as a MTS? What is the current strike price and value?,3,6,2018-2-3 20:12:46,/post/Compensation-at-Cohesity-SBQxbiTh,Cohesity
0,Referral @ cohesity,sfdgfhjcvk,/company/Commvault/,nan,"Hi, I am looking for referral at cohesity, 8+ years of experience.  Leet code hands on (100+ problem solved). Thanks in advance",0,6,2019-4-11 02:36:57,/post/Referral-@-cohesity-kORzzihe,Cohesity
0,Cohesity stock value,cohes,/company/VMware/,nan,What is the current stock price of cohesity ? SoftBank bought at 8$ per stock but cohesity guys are confident of getting it listed at 40$ per stock.,2,5,2019-9-24 16:52:52,/post/Cohesity-stock-value-hNHfJtkH,Cohesity
0,Cohesity Interview,kYuj55,nan,nan,"Anyone who recently attended Cohesity onsite interview, can you please share your experiences and possibly any tips please?",0,2,2018-11-11 09:11:23,/post/Cohesity-Interview-dNNvLdKh,Cohesity
0,Cohesity vs LinkedIn vs VMware,Sky8,/company/SanDisk/,nan,Having an offer from LinkedIn(275k- senior) vs VMware(290k- senior) vs cohesity(230k with private stocks worth 300k).Not able to decide which one to join . Need help. Which company is better suited for career growth?,4,25,2019-3-21 15:52:09,/post/Cohesity-vs-LinkedIn-vs-VMware-TsXAZ1LA,Cohesity
0,#onsite @cohesity,NnCO53,/company/Veritas/,nan,"Hi, Any recent grad who has recently given interview at cohesity for SE position can share their experience and questions please.",4,0,2018-11-18 12:44:20,/post/onsite-@cohesity-2wcKuEfH,Cohesity
0, rubrik vs cohesity,wlaK72,/company/Illumio/,nan,Which one is better?,5,11,2019-4-25 16:12:32,/post/rubrik-vs-cohesity-nNNEPdfa,Cohesity
0,Should I interview at Cohesity ?,greed++,/company/Facebook/,nan,"Considering the craze around joining pre-ipo companies, was trying to think of what pre-ipo companies have the potential to go big.Thought about Cohesity, and wanted some feedback on the below questions :1. What's the current valuation ?2. Does Cohesity have any ipo plans in sight ?3. Why/why not should one work at Cohesity ?obligatory tc - 300K@cohesity  #cohesity #engineering #software #swe",1,5,2021-2-12 04:40:49,/post/Should-I-interview-at-Cohesity-dab60OSz,Cohesity
0,Cohesity Offer,sdawg,/company/Arista-Networks/,nan,What's a good amount of shares for Business App team offer here?,2,5,2018-12-9 21:45:17,/post/Cohesity-Offer-2ct2UUZ6,Cohesity
0,Cohesity new grad salary,!lazy,/company/Dell/,Eng,"Hi,How much pay would a new grad get at Cohesity?TIA",2,5,2018-10-20 23:22:14,/post/Cohesity-new-grad-salary-a1T0UfsW,Cohesity
0,Cohesity Bangalore referral ,TeeCee,/company/Morgan-Stanley/,nan,Looking for a referral at Cohesity Bangalore for backend SWE role.YOE: 1.5Solved ~200 LCAnyone?,0,8,2019-2-18 16:17:01,/post/Cohesity-Bangalore-referral-nThxvNJg,Cohesity
0,Cohesity bay area,ghonada,/company/Microsoft/,Eng,"1. What's the culture there like? 2. Is it a good place to join?3. Do their product have a good future?4. Does their product have significant windows kernel work requirements?5. 15 yoe with solid filesystems, backup and kernel knowledge gets me to what level there?",5,17,2020-2-10 02:08:25,/post/Cohesity-bay-area-kx0pFZ1A,Cohesity
0,Cohesity stock price,newacct,/company/Amazon/,nan,Does anyone know what stock price cohesity is currently offering for the RSUs for new offers? I am expecting an offer and would like to know some numbers beforehand. Current tc : 260k,1,1,2019-6-11 17:00:36,/post/Cohesity-stock-price-UYECFOOc,Cohesity
0,Cohesity vs Google offer comparison,boobjob,nan,Eng,Google: 125/150/40Cohesity: 137.5/300/0YoE: 2.5,1,56,2019-2-21 15:07:18,/post/Cohesity-vs-Google-offer-comparison-bBLGHMHZ,Cohesity
0,Cohesity culture and compensation ,crs1fg,/company/Veritas/,nan,"People at Cohesity, how is the culture and WLB at Cohesity?Also, how is their compensation for 3-4 yoe?TC: 120YOE: 3",1,9,2019-2-2 07:16:50,/post/Cohesity-culture-and-compensation-Gn6RS2qP,Cohesity
0, cohesity also layoffs?,Shinchan6,nan,nan,title says all #layoff,4,9,2020-5-1 00:50:23,/post/cohesity-also-layoffs-xMmdUNeY,Cohesity
0,"Cohesity India,  worth to attend interview?",poornutant,/company/Nutanix/,nan,"Hi Folks,I had got a message from cohesity recruiter for some oppurtunities via linkedi. I am basically from QA side. Just want to know couple of stuffs from cohesity guys..1)Do we have plan for IPO any time soon?2)What is the expected share price for cohesity when it move to IPO?3)Consider I have 7 YOE and I have 1500 Nutanix stock * remaining  to be vested* , how much range of RSU you think I can askI know I can discuss these with HR, but I dont want even to reply back if I am not satisfied.location: India#cohesity ",1,8,2020-9-28 02:59:00,/post/Cohesity-India-worth-to-attend-interview-3OEABQDj,Cohesity
0,Cohesity India interview for SE role,fromIndia,/company/Adobe/,nan,"I’m in interview process with Cohesity. I cleared first coding round. Next round is CS fundamental round.I wanted to know if someone has appeared for this CS fundamental round. Can you share your experience?Update: in CS fundamental round question were asked around file handling, thread safe fund transfer, and DS problem.TC: 23 lpa YOE: 2.7#engineering #software #interview",1,11,2021-2-12 06:33:50,/post/Cohesity-India-interview-for-SE-role-MjAGPPTd,Cohesity
0,What is latest 409A valuation of Cohesity stock price,UPDOWNUP,/company/Intel/,nan,I am a recent grad. Got an offer from Cohesity. The recruiter says stock price is valuated at $40.Is it really $40?Base - 115kRSU - 5000 unitsYoe - 3,3,14,2019-3-15 15:11:21,/post/What-is-latest-409A-valuation-of-Cohesity-stock-price-Qwy4YGTu,Cohesity
0,"Confluent, Nutanix or Cohesity for 6 month internship",vtGn14,nan,nan,"Posting on behalf of a friend.College student. Need help deciding between Confluent, Nutanix, and Cohesity for a six-month internship in Bangalore, India.Stipend per month - Rs. 1L, 90k, and 90k respectively.Information regarding fresher TC, intern to FT conversion rates, work culture, and quality of work done will be appreciated.Also, already have a job offer (TC Rs. 29L) so would I able to use that to negotiate my TC at any of these places. Thanks in advance. #nutanix #cohesity #confluent #software #internship",6,9,2020-12-2 17:00:35,/post/Confluent-Nutanix-or-Cohesity-for-6-month-internship-rbDrNVA1,Cohesity
0,How is Cohesity doing?,dEwb04,/company/Cisco/,nan,Anyone has any insights on how Cohesity is doing? Would they be sustainale against cloud providers in a short to mid term?,0,10,2020-9-25 22:12:42,/post/How-is-Cohesity-doing-3iaDgjLH,Cohesity
0,Cohesity Bangalore: hell of a  Process,i=0;,/company/Oracle/,nan,"well, long story short. . Inteview call. interviews done - all positive vibes - 2 over phone ( tech & domain related) - 4 onsite  (mostly regarding problems they are facing and what you bring to the table to help them solve it)and 1 behavorial. (yuck!). HR keeps in touch- reiterates about good interview feedback every single time- no official mail, only phone calls/messages- says wait for quarter results- finally after 4 months, says interview feedback was bad. . Reiterates my belief of some HRs being pricks!so, be ready for a shitty process if you are interviewing.6 out of the 7 interviews were great. the main guys interview was to prove he knows all the shit and you are a jackass. but not so difficult to top that. the most irritating  was the behavorial (eff!!!) interview.hope this helps.",13,7,2020-5-3 14:49:38,/post/Cohesity-Bangalore-hell-of-a-Process-h7HKTtLC,Cohesity
0,Cohesity culture and prospects?,uhWE56,/company/Google/,nan,Thinking of applying to Cohesity for a business role. Any thoughts on what are the long term prospects of the company and what the day-to-day working environment is like? Some idea of perks would be greatly appreciated as well!TC - 625 YOE - 12Thanks!,1,3,2020-5-10 21:31:41,/post/Cohesity-culture-and-prospects-ONB2pMTY,Cohesity
0,New Grad SDE - Microsoft Vs Houzz Vs Cohesity,vswm48,nan,nan,Microsoft - Seattle - Core Services EngineeringVsHouzz - Palo Alto - Data Infrastructure (Data engineer)VsCohesity - San Jose - Core Data Path (Storage systems engineer)Please share thoughts independent of TC.,1,8,2019-4-26 15:14:18,/post/New-Grad-SDE---Microsoft-Vs-Houzz-Vs-Cohesity-Q3dwUK21,Cohesity
0,Stipend for remote offices @ cohesity,qazxsw2,nan,nan,"Looking at a remote job at #cohesity and I need to update my office/desk at home. I have no problem paying for it myself, but other companies I have talked to offer a stipend to setup your remote office.Does anyone know if Cohesity has a stipend to setup a home office for 100% remote employees?",0,2,2021-1-28 02:00:59,/post/Stipend-for-remote-offices-@-cohesity-RU4s2zoM,Cohesity
0,Comp for Non- technical role at Cohesity and Rubrik,roger2018,/company/Honeywell/,Other,"What compensation should I expect for Director/Sr Manager roles in product management or product marketing at Cohesity and Rubrik in Silicon Valley? I heard from a recruiter that there is no bonus, only base salary and equity with standard vesting schedule. If I am forced to quote expected comp, please suggest numbers for base and total equity (dollar amount). I don’t even know the current strike rate for the stocks of these companies.",0,4,2018-8-22 04:56:45,/post/Comp-for-Non--technical-role-at-Cohesity-and-Rubrik-zMMRE5Z0,Cohesity
0,"Cohesity series D, June 1st",oracool,/company/Oracle/,nan,Any info into that? Apparently offer will change after that date.... Never heard of such a thing. Can anyone elaborate?#nutanix,0,1,2018-5-28 06:30:34,/post/Cohesity-series-D-June-1st-HoCSjRAi,Cohesity
0,Rubrik ( NC)  vs Cohesity ( San Jose) ,jRXq73Snap,/company/Nutanix/,nan,Which Place would be better to start for a new grad support engineer? There is a difference of 15K between the compensation.,0,5,2019-6-16 08:26:48,/post/Rubrik-NC-vs-Cohesity-San-Jose-ept7KP2G,Cohesity
0,Is Cohesity a good company to work for?,ipJt83,/company/IBM/,nan,"Is Cohesity a good company to work for? Role is in NC as SRE, please advise.",2,3,2020-10-30 04:11:53,/post/Is-Cohesity-a-good-company-to-work-for-DYWW5khM,Cohesity
