,post_title,post_user,post_firm,post_position,post_text,post_like,post_comment,post_timestamp,post_url,company
0,Need Referral For Good Companies in Banglore or Hyderabad,zero7,/company/Samsung/,Eng,"I have 2.5 years of experience. I am actively looking for job opportunities. I would be grateful if you guys can give me a Referral.Google, Linkedin, uber, nutanix, ola, swiggy, curefit, qubole, cohesity, inmobi, service now, indeed,Rubrik, Alphonso, App dynamicI have a offer from flipkart.base 21.5stocks 8.5jb 310% performance bonus",3,6,2019-10-13 21:57:06,/post/Need-Referral-For-Good-Companies-in-Banglore-or-Hyderabad-Jp5AA0pW,Cohesity
0,Referral ,lobY20,/company/Cisco/,nan,Looking for a referral in cohesity please dm ne,0,0,2020-2-12 00:42:15,/post/Referral-MGeJHGoZ,Cohesity
0,Need referral for AWS Dresden Kernel & Operating System team,nakedptr,/company/Cohesity/,Eng,"Hello blinders,I aspire to work for AWS KaOS team.Please consider my profile for referral.Please comment if you need more details.I work at Cohesity, India.TC: 50k USD YoE: 2Thanks for your time. Stay safe keep growing :)- - - - - -I have understanding of OS and have problem solving skills. Have done LC.Did have offer from Amazon Pay team Bengaluru for SDE1 in Dec 2019;did not accept it as Cohesity has System Software Programming work. Also my salary was already more than what Amazon could offer to SDE1.For SDE2 I wasn’t considered as I had 1.5 YoE.For 1.5 yrs I worked in Internet domain and application side of things. Developed web and desktop applications.Post that now it’s been ~8 months with Cohesity.I’m passionate about working at lower layer of the stack.I love working with C and C++ and having the ultimate control over hardware.In pursuit of working on lower layer of the system I interviewed and switched to Cohesity after working in an Internet company. Cohesity is a storage management company.Work is good, I get to move protocol buffers by writing distributed code using C++.I have good understanding of how things work at OS / kernel / hardware level. I’m still leaning more on it though.I want to take steps toward my aspiration of working on Kernels.Also it would be great if you could give some prep guidelines.#referral #aws #dresden #kernel #os #cpp #germany",3,1,2020-9-6 18:01:41,/post/Need-referral-for-AWS-Dresden-Kernel-Operating-System-team-EGz40n5W,Cohesity
0,Help with job referral,girliegurl,/company/Micro-Focus/,Other,Posting for a friend who is currently unemployed. She has lot of technical support and security experience. If there are any TSE job openings please let me know if you can help her with referral. She is citizen so no visa issues.#security #techsupport #support #google #amazon #microsoft #paloaltonetworks #apple #AppliedMaterials #Qualtrics #Cisco #Nvidia #OCI #Snap #Splunk #Smartsheet #MongoDb #CapitalOne #SAP #Workday #Box #Expedia #Qualcomm #Wayfair #StarbucksIT #Visa #Zoom #Bloomberg #Docusign #Intuit #VerizonMedia #Akamai #PayPal #Doordash #Intel #Uber #Lyft #Amex #Unity #Indeed #Spotify #Netflix #Instacart #Cohesity #Salesforce #Cruise #Stripe #Pinterest #Twilio #Airbnb #Adobe #Workday #Atlassian #Coinbase #Slack #Square #Twitter #Zillow #Walmart #Okta #Quora #Booking #VMWare #jobopening #jobsearch,2,19,2021-4-3 20:10:12,/post/Help-with-job-referral-p0AdtDHe,Cohesity
0,Looking help with referrals [INDIA],sanchez_,/company/Mentor-Graphics/,nan,"Hi Folks,I am looking for some referrals for the following companies#vmware #deshaw #salesforce #nutanix #linkedin #rubrik #atlassian #intuit #cohesity#paypal #twitter #netapp#visa #walmart Help is really appreciated. I am having hard time getting calls. I have skipped others as i have referrers working over there and have already applied. I have experience in scaling distributed systems but not web based. Looking to change my domain. YOE : 9 TC: 33Edit: i wish to thank all the folks who have openly helped. I have received so many emails  already for referrals!! Thanks a lot guys i want to contribute back to the community!! Of course i would be referring everyone + any suggestions are most welcome to help our fellow jobseekers back :)",2,29,2021-5-11 11:05:12,/post/Looking-help-with-referrals-[INDIA]-XekWs86t,Cohesity
0,Referral help needed,cJyR60,/company/Google/,nan,"Hi everyone,Requesting people from Blind community for a SWE referral for my brother (office location is flexible across various countries/states) - would be of great help during this pandemic time. Please drop a comment so that we can chat over DM.(Tagging some of the companies if it helps, however willing for most of the good options) @Amazon @Microsoft @Adobe @Cisco @Facebook @LinkedIn @Ola @Uber @Grab @Cohesity @Rubrik @Twitter @Hotstar @Zeta @Directi @Oracle @Salesforce @Intuit @Apple @Indeed @Expedia @Nvidia @Intel @Vmware @Flipkart @Morgan Stanley @JP Morgan @Goldman Sachs @Tower Research @Codenation#swe #engineering #software",0,19,2021-1-17 17:30:53,/post/Referral-help-needed-3EP7HOyK,Cohesity
0,Site reliability engineer salary ,ku9212,/company/Cisco/,nan,"Expecting and offer from Cohesity for site reliability engineer Bay Area, can anyone please let me know what would be the base and stocks for 3+ YOE. I don’t wanna low ball myself as I have very less info about the pay online.",0,3,2020-11-16 09:53:43,/post/Site-reliability-engineer-salary-wiRQLHdb,Cohesity
0,System Design Interview iOS,irne,/company/Atlassian/,nan,"Hi!Could you please provide information about this topic?What problems have you been asked?How did you prepare?What do you focus on? (testability, scalability, high cohesion low coupling, concurrency, security, etc.)Thanks in advance!TC: 300k (Stock appreciated prettt well)YoE: 8",2,0,2020-7-22 18:47:35,/post/System-Design-Interview-iOS-ij4X45FS,Cohesity
0,Referrals,BEoF12,/company/Automation-Anywhere/,nan,"Hello,Looking for referrals pretty much anywhere. Masters from a top 3 CS school, 2 publications, 313 LC. On a student visa and don't care about H1B, just want to do solid work and learn. If someone knows of an opening on their team/in their company, would greatly appreciate a referral. I'm mainly interested in backend/ distributed systems/cloud/low level systems roles.Thanks!#google #facebook #apple #netflix #tesla #oci #snowflake #linkedin #microsoft #referral#referral#purestorage #nvidia #vmware #nutanix #cohesity #niantic ",0,9,2020-10-20 15:43:11,/post/Referrals-iHBQJtK7,Cohesity
0,Im requesting blind community for referals,astro-make,/company/AstraZeneca/,Eng,"Hey Blind!I work in Software Engineering, India.Im currently looking for opportunity at other companies, i have already been leetcoding, and im good at DSA.YOE: 2.5TC: ~6 L.P.A :/Please help me out with a referral, if your company is hiring.Requesting referrals  @Twitter @LinkedIn @Microsoft @oci oracle @ola @adobe @google @cohesity @zeta @atlassian @Twitter @rippling @hotstar @gojek @grab @yelp @facebook London @databricks Amsterdam @booking Amsterdam @Samsung @Red Hat #engineering #software #swe #referrals",3,21,2021-3-13 17:42:17,/post/Im-requesting-blind-community-for-referals-EjHaNx7W,Cohesity
0,Could Amazon culture experience being blocker for Google or Facebook?,XtraV,/company/Luxoft/,nan,"As for me Amazon leadership principles might be too harsh for social climate. E.g. :""Leaders have conviction and are tenacious. They do not compromise for the sake of social cohesion...""Is it possible being rejected by Facebook or Google due to these companies could afraid for such culture penetration and spreading?#facebook #google #amazon #interview",2,6,2020-4-12 19:16:39,/post/Could-Amazon-culture-experience-being-blocker-for-Google-or-Facebook-dXbv2UAB,Cohesity
0,Lets list all companies or orgs in companies offering remote jobs,anabxk,/company/Amazon/,nan,"I never want to commute again, also I want to buy a house for a reasonable price.I know I am not alone.Post your sweet knowledge below!👇🏻👇🏻👇🏻#remotework #wfhEDIT:I will compile a list from the comments daily, feel free to contest the list or add details.AdobeAffirmAmazon - select roles/teamsAtlassianAuth0Automation EverywhereAutomatticBrexCanonicalClouderaCohesityCoinbaseCollibraConfluentDatadogDataStaxdocusignDropboxDuckDuckGoElasticFacebook - L5+FastlyFreshworksGitHubGitLabHashiCorpIBMInstagramMattermostMagic LeapMarquetaMozillaOktaPagerDutyPaypalPinterestPostmanPro CoreQuoraRackspaceredditRedHatSalesforceSegmentServiceNowShopifySlackSnapSnowflakeSplunkSprinklrSquareStackOverflowStripeSuseTableauTalkDeskThought SpotTwilioTwitchTwitterUIPathUnityUnqorkVMWareWorkdayYelpZillowZoom",12,11,2020-12-17 06:21:34,/post/Lets-list-all-companies-or-orgs-in-companies-offering-remote-jobs-43iG4VW6,Cohesity
0,"Looking for referrals in Hyderabad , Bangalore",spyfish,/company/The-D-E-Shaw-Group/,IT,"Hi All,I am looking for good companies referral in Bangalore/Hyderabad for  fresher Software Developer Roles.Area of expertise - python,Java, C++ , Backend (Medium)YOE - 4 months ( As intern) Solved 1000+ problems Across all coding platforms , Good in problem solving , DS , AlgorithmsInterested in any companies like Salesforce , Facebook(Singapore), Amazon, LinkedIn, Cloudera, Atlassian, Intuit, Cohesity, Confluent etc. or any other leads are welcomeWill make sure that u get referral bonus 😉Thanks",2,10,2020-2-17 18:53:39,/post/Looking-for-referrals-in-Hyderabad-Bangalore-csFAvVn4,Cohesity
0,"Creative design in corporate environment, is it possible?",hXJQ14,/company/Katerra/,Design,"Is it possible to have positive, well thought through, cohesive design work done in a corporate environment? After working in multiple tech companies I get the feeling I'm just trying to please a manager's personal taste so that they look good to their manager.",0,2,2019-9-7 23:50:52,/post/Creative-design-in-corporate-environment-is-it-possible-NpOJ8BEd,Cohesity
0,Lab126 Director offer,CGpR64,/company/Facebook/,nan,"I have a SDM Director offer coming down from #Lab126 at #Amazon per recruiter. I'm currently an M2 at FB with TC of 750k.How is the culture there? Do they have PIPs at L8 level? I don't care so much about my personal WLB as much as I do about team culture, cohesiveness and trust. I'm always careful about protecting my team, giving them clarity of purpose and room to grow and do what they think its right. Will I be able to do this at Lab126? Is it too political at #Alexa Devices? What do you wish people were doing at this level that they are currently not? Any feedback is appreciated.#engineering #swe #amazon #lab126 #offer #l8",15,26,2020-9-24 00:03:26,/post/Lab126-Director-offer-8o3rREET,Cohesity
0, google service infrastructure team in Kirkland,2019go,/company/Amazon/,nan,"I just talked with a hiring manager for a TPM position in google service infrastructure team in Kirkland which is mostly working on API governance and also managing projects of API upgrades and migrations.. can anyone please share some insights about this team? Work pressure, team cohesiveness, learning opportunities and future growth etc.. much appreciated...",2,0,2019-3-21 01:36:47,/post/google-service-infrastructure-team-in-Kirkland-QYvaRiaa,Cohesity
0,Help Germany/ Berlin Folks : Visa Query | DeliveryHero (Visa Approved) vs Amazon Berlin ,readBooks,/company/Cohesity/,Eng,"Context: I have an offer with DeliveryHero Berlin and have accepted it 4 months back and started with visa process, got it approved as well. Though i am still required to submit my passport for stamping.I recently gave interview with Amazon Berlin, and received positive response and waiting for team match and formal offer while still DeliveryHero is expecting me to join them in next 20 days.In case everything works out with Amazon , I have two optionsQuery :1) Should i cancel my visa with DeliveryHero and restart visa process with Amazon(waiting again for 3 months) ?2) Should i continue with DH, join the team and let amazon figure out the approvals, and in a month or two leave DH , paying back the flight tickets and relocation bonus. I understand there is a lot of bureaucracy in Germany , will this make everything difficult.FYI : DH has lowballed me , reduced my level and by no way are going to match the compensation. also i m stalling on the passport stamping so that i take an informed decision.What option should i choose and why ?Note: I am non EU candidate . I also have an better offer than DH from Yelp London, and wish to join that in case Amazon chooses not to extend an offer. If there's no quarantee on approvals from Amazon i would wish to join Yelp.For Cohesity folks : I don't work with Cohesity :p. Using a friends account to post , because my last company was a small shitty startup from India. #germany #berlin #europe #amazon #help #visa #relocation",1,39,2021-4-10 06:47:22,/post/Help-Germany-Berlin-Folks-Visa-Query-|-DeliveryHero-Visa-Approved-vs-Amazon-Berlin-Qh80Zh1J,Cohesity
0,"Senior PM Referrals for Bangalore, India",ewYV53,nan,Product,"Hi, I am currently working as Product Manager with 5+years B2B SaaS PM experience.Total YoE : 8 Years + MBAProduct YoE : 5 YearsTC : 34LLooking for Senior PM roles based out of bangalore.#bangalore #referrals #product #pm #india #referral #microsoft #salesforce #vmware #intuit #expedia #uber #indeed #rippling #apple #walmartlabs #mastercard #paypal #adobe #linkedin #dell #cisco #ebay #sap #hpe #oci #amex #goldmansachs #twitter #atlassian #cohesity #rubrik #tesco #cloudera #palo alto networks #cloudera #nvidia #centurylink #juniper #paysafe #mcafee #servicenow #directi #slack #twitter #pinterest #square #razorpay #yelp #zynga #amd #intel #arcesium #cadence #mutanix #booking #phonepe #flipkart #sharechat #hike #zoom #uipath #appdynamics #postman #zoho #thoughtspot #zeta #tekion #visa #myntraEdit : Thanks for all the help guys. I will be joining a new org next week.",6,27,2021-3-29 11:59:42,/post/Senior-PM-Referrals-for-Bangalore-India-mciVOUxg,Cohesity
0,Need Referrals @India,nimbuss,nan,nan,"I'm 2021 grad, working as a software development Trainee. I am looking for referralsI am open for startups as well as tech giants.I am Well versed in competitive programming as well as Software Development.can join from 15th may,21Expected TC :- 12-15Looking referrals for (not limited to)#Flipkart#Phonepe#Adobe#Atlassian#Arcesium#Cisco#Samsung#Goldman Sachs #Swiggy#Rubrik#Cohesity#Hotstar#Linkedin#Microsoft#Nutanix#OCI#Mindtickle#Zeta#Twitter#databricks#teradata#Quadeye#towerresearchcapital#de shaw#rippling #dunzo#compass#engineering#software#swe#tech",0,9,2021-4-3 16:31:58,/post/Need-Referrals-@India-KUGuBTgo,Cohesity
0,Top India Startup Comp Guide for experienced professional,grabgp21,/company/Grab/,nan,"Hi All,I am putting up the range of salaries offered by the startups in India for experienced roles - 7+ years which fall in Principal/Architect roles.Startups (top pay) :Architect/Principal:1cr+ : Zeta, Navi, Dunzo SSE 2, MindTickle, Khatabook SDE4, Uber SSE, flipkart, Indeed, Airbnb (Staff?), Google (L5), Coinbase, LinkedIn(staff), Cohesity,  Twitter ?, 85L+ to 1cr: Oracle, Rubrik Staff, PhonePe SSE, Prudential, Salesforce(lmts), Amazon Sde380L + to 85L : Adobe CS, Amazon Sde360L + to 80L : Jumio, Tekion Lead, socnet, cleartax, Hotstar SSE, rupeek, InMobi, unacademy, xoxoday, interface, Arcesium Principal,  Whitehat jr, ExpediaAll figures in INR, 1L = 100000 INRNow we need to drill down on the work culture at these companies and I am looking forward to fellow blinders from these companies to contribute.Source : some assumptions on Instahyre for the companies that hire on that platform. For others, adding on the datapoints available in comments.#tech #india #startups",22,60,2021-3-30 17:58:00,/post/Top-India-Startup-Comp-Guide-for-experienced-professional-tpbZtqpm,Cohesity
0,Advice / Requesting for Referrals in Bangalore/Hyderabad for SDE1,koLe47,/company/Dell/,nan,"-YOE: 1y-College: Tier 2-Have participated in ICPC Regionals, completed GSOC-Leetcode : 310 {43 E, 241 M, 26 H}-Background:--Backend/GeneralistI have been looking for a change actively for the last 3-4 months, as work in my current company is very slow, and disorganized. I was planning to apply to the top companies FANG/Nutanix/Cohesity .. in September as I didn't want to miss out on the opportunity and then wait for another 6-12 months for cool down period {Was aiming for 500 LC questions to cover all topics}But now I see a lot of new job opportunities available and many Linkedin posts about new graduates joining in, which makes me want to apply now, as even currently I have a decent preparation{ Or I think so :|  }. Hence this post asking you all for referrals.Would be great if you could give me a referral for any of these:- Adobe- Apple- Arcesium - Atlassian- Cloudera  - Confluent - DE Shaw- Flipkart- Goldman Sachs- Intuit- JP Morgan- Linkedin- MathWorks- Morgan Stanley- Microsoft {Have read they don't have any cooldown period?}- PayPal- PayTM- Salesforce- VM WareMore inclined towards Fintech rnAlso, any advice whether I should apply to Google/Uber/Nutanix/Cohesity now or should wait would be great {In terms of whether they will be hiring actively in September - October }Open to remote and other areas too.Thanks#referral #bangalore #Hyderabad #softwareengineer #faang #deshaw #goldmansachs #microsoft #paypal",2,24,2020-7-1 20:57:30,/post/Advice-Requesting-for-Referrals-in-BangaloreHyderabad-for-SDE1-71GSg2UM,Cohesity
0,Please refer me! ,exi,/company/Amazon/,IT,"Hi Friends, Can you please add me as a referral, for an SDE position in your company. Request you to DM, I am out of them .YOE 9, Currently working for Amazon India. Spent enough time here and wish to move on.Preferred location:Initially WFH, happy to relocate (once covid situation improves) to any country if work visa is sponsored. Don't want to work in India due to (arguably) low TC here.Interviews already scheduled for Google.Thanks in advance.TC 49 LPA INR ($66617)#AppliedMaterials #Qualtrics #Cisco #Nvidia #OCI #Microsoft #LinkedIn #Snap #Splunk #Smartsheet #MongoDb #CapitalOne #SAP #Workday #Box #Expedia #Qualcomm #Wayfair #StarbucksIT #Visa #Zoom #Bloomberg #Docusign #Intuit #CarGurus #Charles #SchwabIT #Ford #Squarespace #VerizonMedia #Akamai #Freshworks #Medallia #PayPal #Doordash #Intel #Uber #DEShaw #Lyft #Amex #Unity #Indeed #Spotify #Netflix #Instacart #Cohesity #Salesforce #Cruise #Stripe #Pinterest #Twilio #Airbnb #Adobe #Workday #Indefinitely #Atlassian #Coinbase #Slack #Square #Twitter #Zillow #Zaplabs #Walmart #Okta #Quora #ZeroDown #Booking #VMWare #jobopening #jobsearch",0,39,2020-9-11 11:50:06,/post/Please-refer-me-czSudLt4,Cohesity
0,To all full stack developers,jdjdbrj,nan,nan,Does your job responsibilty include UI/UX? What resources help you?As a full stack developer one of the hardest parts of my job is designing sections of a feature.I’ll visit dribbble for inspiration once in awhile but is hard to apply to make the whole app cohesive design wise.TC $85k2 YOE,0,3,2020-7-31 17:34:25,/post/To-all-full-stack-developers-ViCymN40,Cohesity
0,Seeking referrals !,BoJackMan,/company/GE/,nan,"After 5+ months of preparation and 3 offers from (not so interesting) startups, I think I am ready to apply for some companies that I really wanted to go for. So was hoping to get some referrals to put the best foot forward.Although luck favours the prepared mind, I don’t mind your best wishes too !A little about me :YOE : 2.5+ as backend developer with good exposure of data engineering and distributed systems. LC : 450+ with competitive programming background from universitySeeking referrals for :#stripe #rubrik #palantir #nvidia #datadog #snap #yelp #paypal #tomtom #glovo #GetYourGuide #booking #expediagroup #plaid #bumbleWas planning to apply for fast paced, high growth, high returns startup/companies first, hence haven’t included FAANGs in the list yet. I might have misjudged some of the above companies, please do provide feedback if any of them is not worth joining.Do provide referrals for any interesting companies that I might have missed.Also intentionally missed #nutanix #snowflake #rippling #cohesity as I haven’t found perfectly aligned roles for me yet.Thanks a lot in advance!#engineering #software #swe #referral",0,25,2020-10-19 19:11:36,/post/Seeking-referrals-30dFRXKa,Cohesity
0,Apple SRE Bangalore : Offer,WhatToDo😖😖,/company/Intuit/,nan,"Got offered the below tc for apple sre bangalore, havent negotiated yet ... can the folks at apple bangalore give their tc range please?base - 30 lpabonus - 10%rsu-$40k vested over 4 yearsyoe -4.5current tc-25lpaDoes it look right? level was ict3 i guess, was an initial offer over call ... how much can i negotiateAlso interviewing at cohesity, which is pure swe role, more jnclined ro that role as its pure swe and not sre, but if I dont make it, can you apple folks please let me know if apple sre is a glorified ops role? They are building new teams, and their cloud as well ... Interview had coding and sys design, but now a days every company has that ... if its just an ops role, i would like to stay at intuit and get#engineering #software #swe  another offer than move there#engineering #software #swe",0,15,2020-9-28 18:50:47,/post/Apple-SRE-Bangalore-Offer-ornO8ayy,Cohesity
0,Modern Web Service Application Architecture,dhjQ88,/company/Intuit/,nan,"Been developing webapps for a while. Learned about coupling, cohesion, SOLID principles, design patterns, different layering techniques, hexagonal ports and adapters, traditional controller, service, data access layers etc.These days, however, I'm seeing more and more backlash to this kind of code organization - from co-workers, on Twitter and in various blog articles. Basically they say abstractions are imperfect and costly to maintain and YAGNI, so don't bother.I guess what I'd like to know is if layering techniques and encapsulation lead to too much unnecessary abstraction what are some modern ways to organize your code? Or is the recommendation to simply embrace the spaghetti?Book recommendations or blogs appreciated.TC 220k#tech #architecture",1,3,2021-1-18 04:28:45,/post/Modern-Web-Service-Application-Architecture-5bE0WMRm,Cohesity
0,Referral needed for contracts manager position,XGZBB,/company/Renesas-Electronics/,nan,"Hi friends,I’m currently looking for referrals for any contracts manager position. Graduated from law school May 2019 and now working in a legal department for a company in Bay Area. Willing to work remotely or relocate to anywhere in the west coast.Thanks in advance! #legal #counsel #referral#microsoft #slack #paypal #facebook #twitter #dropbox #amazon #atlassian #brex #google #instacart #square #twilio #faang #datadog #snowflake #rubrik #bloomberg #stripe #snap #lyft #uber #spotify #apple #robinhood #yelp #tesla#youtube#netflix#faang #microsoft #amazon #google #facebook #salesforce #vmware #intuit #expedia #uber #indeed #rippling #apple #walmartlabs #mastercard #paypal #netflix #adobe #linkedin #dell #cisco #ebay #sap #hpe #oracle #oci #amex #goldman sachs #grab #groupon #twitter #confluent #atlassian #cohesity #rubrik #tesco #cloudera #palo alto networks #cloudera #nvidia #centurylink #juniper #paysafe #mcafee #servicenow #directi #slack #twitter #pinterest #square #stripe #instagram #tinder #lyft #spotify #priceline #yelp #zynga #amd #intel #arcesium #cadence #mutanix #booking #phonepe #flipkart #sharechat #hike #zoom #uipath #dell #appdynamics #postman #zoho # freshworks #thoughtspot #zeta #tekion #visa #myntra #mastercard",2,2,2021-1-30 22:03:54,/post/Referral-needed-for-contracts-manager-position-HqLA42pR,Cohesity
0,Anyone willing to refer a good candidate to their company?,cJyR60,/company/Google/,nan,"Hi Blind community,Posting this on behalf of a good candidate (“good” because he is having good industry experience and generally does well in Leetcode/InterviewBit questions) - he is looking for a switch to a new company for a software development related position. He is open to most of the good/decent companies (apart from Google since I myself would refer him), hence if you are willing to refer, then please either drop a comment below so that I can DM you or please DM me directly.Tagging some companies below for better visibility, but as said earlier he is open to most of the decent companies.#swe #engineering #software #referrals #jobsearch #newcompany #sde #mts#Qubole #Facebook #Indeed #Twitter #BigBasket #Apple #Yelp #Alphonso #MakeMyTrip #Slack #Adobe #Broadcom #App Dynamics #Facebook #JP Morgan #Directi / Media.net #Intuit #Postman #Deutsche Bank #Slack #Rubrik #Morgan Stanley #Juniper Networks #Nutanix #Practo #Vizury #Target #Zomato #Codenation #World Quant #Stackoverflow #Compass #Uber #Aviso #Flipkart #Truecaller #Redhat #Linkedin #Myntra #Ola #Stripe #Gojek #ByteDance #Cohesity #Cisco #Twitter #Cloudera #Mindtickle #Oyo #Udaan #Hasura #Grab #Rippling #Gitlab #Expedia #Groupon #DE Shaw #Arista #Sprinklr #Square #Ericsson #Palo Alto Networks #Paytm #Blackbuck #Texas Instruments #Sprinklr #Databricks #Zalando #Mentor Graphics #Wissen #Dunzo #Upgrad #Swiggy #Unacademy #BrowserStack #MotorQ #Visa #Quadeye #Shopify #Datadog #Razorpay #Philipps #Cure Fit #Intel #Oracle #Salesforce #Auth0 #HealthifyMe #Walmart #Atlassian #Booking #NetApp #Jio #Atlassian #Inmobi #Tower Research #Dream11 #Twilio #ServiceNow #Samsung #Hotstar #Nvidia #SanDisk #Cred #Qualcomm #Zoom #MyGate #Box8 #Sumologic #Autodesk #Spotify #Paypal #Inmobi #Compass #Snowflake #ARM #Whatfix #LeadSchool #Informatica #Github",3,31,2021-2-14 15:12:36,/post/Anyone-willing-to-refer-a-good-candidate-to-their-company-kPQPGTXG,Cohesity
