,post_title,post_user,post_firm,post_position,post_text,post_like,post_comment,post_timestamp,post_url,company
0,Does cohesity have year end bonus and 401k?,chitchor,/company/Gigamon/,Eng,#401k #401k #tc,1,3,2020-1-11 18:00:55,/post/Does-cohesity-have-year-end-bonus-and-401k-uYeZ4vd6,Cohesity
0,How is Cohesity Pune office? I plan to approach them,BendrDunda,/company/Nutanix/,nan,Planning to move out of Bangalore and also switch to a different company. I heard Cohesity opened a Pune office so was wondering how the work culture is over there.,2,5,2019-11-18 20:33:26,/post/How-is-Cohesity-Pune-office-I-plan-to-approach-them-eNXMxrgT,Cohesity
0,Cohesity data engineer interview for Saas Platform.,hpe_edge,/company/Hewlett-Packard-Enterprise/,nan,"Hello fellows,I recently completed Cohesity initial phone screens for Saas Helios platform team. Both rounds were algorithm questions and now the recruiter is asking me to appear for virtual onsite. It seems to be conducted by technical director. What can I expect in the intercview? Any leetcode (hard? Medium?) or system design? Any help from fellow blind member if appeared for an interview is highly appreciated.I lost my job recently and in urgent need to switch before my visa expires 🙏 TC: 170k #tech #tech",1,1,2021-1-14 03:24:03,/post/Cohesity-data-engineer-interview-for-Saas-Platform-nYwxsEAD,Cohesity
0,Cohesity Product Manager interview,touram-,/company/Amazon/,nan,What should be prepared. Any tips on what is interview like.,0,4,2019-3-4 14:50:22,/post/Cohesity-Product-Manager-interview-N0z7kOmi,Cohesity
0,New Grad | Referral for PureStorage and Cohesity,rev0cat!on,nan,nan,"Hello everyone,I will be graduating this Spring and was wondering if I could get a referral for PureStorage and Cohesity.I'd greatly appreciate it.",1,0,2019-3-4 14:48:12,/post/New-Grad-|-Referral-for-PureStorage-and-Cohesity-YesqOdF0,Cohesity
0,Any thoughts about cohesity ipo valuation if it happens tomorrow?,nym_0,/company/Cohesity/,nan,#tech #ipo,1,6,2020-9-17 19:31:40,/post/Any-thoughts-about-cohesity-ipo-valuation-if-it-happens-tomorrow-TWUUEYNx,Cohesity
0,What's the best way to increase communication and cohesion with engineers segregated into FE-only and BE-only roles?  ,autom8🤖,/company/Knockaway-Inc/,Eng,"Strong communication on engineering teams is crucial in order to efficiently build and ship quality, non-buggy code without friction. The need for strong communication grows even greater on eng teams where engineers are either FE-only or BE-only because, rather than a single full-stack engineer building the FE and BE of a feature, two separate engineers are individually building from each end of a bridge -- hoping that the bridge will connect once they meet in the middle.My last company hired only Full-Stack engineers and they were responsible for building features from the ground-up, FE and BE (yeah yeah, I know I just explained what everyone already knows). This made inter-squad communication more efficient as there were fewer parties partaking in conversation --EX. A single FS Eng. is code-complete on a new feature consisting of FE and BE changes. The authoring eng moves the feature user-story ticket into ""ready for testing"" and assigns it to me, the QA. While testing the branch changes in dev, I find a bug with the new feature. I then file a defect sub-task ticket with details on the bug and assign the sub-task ticket to the authoring Full-Stack dev, at which time the dev and I talk about the bug to make sure we're on the same page. The dev fixes the defect and moves the defect sub-task ticket to ""ready for testing"" and I test it again to make sure the defect has been resolved. Then, after confirming the feature branch is working as expected, I approve the PR and make sure that all sub-tasks are complete and all pre-merge checks are complete before shipping the PR. All of this communication was between only two eng's, the QA and the authoring dev. Easy, low risk.Now, for segregated FE/BE eng teams, a single feature involves multiple devs to complete and thus exposes more risk for miscommunication and misalignment of acceptance criteria. My new company has FE-only and BE-only engineers rather than Full-stack engineers and we have a high-friction feature development process due to failed/misaligned communication. And it sucks. Bad.How do you overcome this? We have Jira and confluence and slack and yadda yadda yadda but communication is still an issue. Oh, and the eng team is fully-remote.",0,4,2019-12-4 19:19:51,/post/Whats-the-best-way-to-increase-communication-and-cohesion-with-engineers-segregated-into-FE-only-and-BE-only-roles-f26qEo6Q,Cohesity
0,Final Recommendation Offer,borntowin,nan,nan,"Blind Mates,  First of all Thank you for all your the inputs in the past, What would you recommend to choose, both offers are Datacenter HW Quality Engineer role, I have 11 YOE in the Quality Area and want to be in the next level in my career, Not sure Amazon name in resume will have more consideration in the future or doesn't matter at all even choose Cohesity.AMZN doesn't increase my old offer with Cohesity offer but Cohesity increased from original offer without mentioned Amazon offer ( Base135K, RSU -8000)AMZN L5 Hardware Quality, Herndon, VABase -145KSign on - 107K (First -60K, Second -47K)RSU - 42 ( 5%,15%,40%,40%)Yearly TC -210KCohesity , Santa Clara, CASr. Quality Engineer ( IC3)Base -150KBonus -5% (7500$)RSU - 11000* Share price 50$,not sure what actual insider price is 20$ ( IPO may be this year or next year expected, 4yr vesting)Yearly TC -295K( per HR) and my calculation 212K ( based on insider price)#cohesity #amazon #amazoncompensation",1,3,2021-5-6 00:33:51,/post/Final-Recommendation-Offer-wGNc8N0y,Cohesity
0,Looking for referral,BkPW645,/company/Oracle/,nan,"In databricks, rubrik, cohesity, confluent.I can dm my resume.Thanks#databricks #cohesity #rubrik #confluent",0,9,2021-3-22 20:27:37,/post/Looking-for-referral-XiBEwGZ3,Cohesity
0,Multiple offers which one to choose,insect,/company/Oracle/,Eng,"Have offers from Rubrik, Cohesity, LOB, Autonomic, Dremio, LinkedIn, Atlassian, and TuneIn. Which one to choose ? 12+ yoeAny insights into company culture and teams will be useful.",3,82,2018-11-3 23:13:38,/post/Multiple-offers-which-one-to-choose-heHOFRQ8,Cohesity
0,Amazon L5 salary negotiation india,rs1rs2,/company/Cohesity/,Eng,"Currently working at Cohesity with base 30 lpa and 800 rsu/year with 4.5 YOEGot an offer from Amazon for L5 positionBase : 31 lpaJB : 18/13RSU : 20As Cohesity isn't public yet, amazon isn't considering the RSUs.I don't have any other offer right now though I've more interviews in pipeline.Is there any scope for further negotiation?",3,12,2020-11-19 19:56:15,/post/Amazon-L5-salary-negotiation-india-7JVsjnfQ,Cohesity
0,Clumio,BadaBada,/company/Cloudera/,nan,Company has approached me 3rd time. Is it good? I did some research. I doubt it can beat cohesity and commvault or rubric who now have competing SaaS#startup  products. How are they and what kind of valuation it has? Worth joining?,7,39,2020-11-1 00:56:26,/post/Clumio-pXjGkFd7,Cohesity
0,Bangalore salaries,PepeHands,nan,Eng,How much does Nutanix/Cohesity/Rubric pay for a MTS in Bangalore. I have a masters and 5 yoe. What are the salary ranges in Bangalore for someone relocating from US with my experience?,5,13,2019-2-3 03:52:14,/post/Bangalore-salaries-E01PLRY1,Cohesity
0,Garden leave cut short?,hsgwnwldq,/company/Microsoft/,nan,"Can the Microsoft HR cut short the garden leave when you go to a competitor? I have a few stocks vesting in middle of my garden leave and want to  know if I'll get them.Anyone who moved from Microsoft to Google, Amazon, Rubrik, Cohesity or any other competitor who faced this issue?YOE: 6TC: 48 LPA",2,6,2021-5-7 13:33:23,/post/Garden-leave-cut-short-BWKRMkdK,Cohesity
0,Bangalore referral needed,surching..,/company/Microsoft/,nan,"Hello Blinders,Looking for referral for SWE roles for companies in Bangalore - Cohesity, Cloudera, Nutanix, cure.fit, Rubrik, confluentYeo: 4+",1,16,2020-2-4 14:34:46,/post/Bangalore-referral-needed-wuatgq0p,Cohesity
0,Leaving start-up in 2-3 months,stop-down,/company/FireEye/,nan,"Hi kind blindmates,This is in connection with my post: https://us.teamblind.com/s/1Rtqcch2So I'm looking to jump from current start up that I joined in March for following reasons in the given order of importance:1) Was heavily lowballed by recruiter, by giving high base raise but really low RSUs, quoting company policy and smartly masking saying these are gonna triple by year end and are much more valuable than my prev company (stuck) stock. So overall TC hike was ~10% but it was made to look like >30% considering potential year end stock appreciation. This was my first ever switch. New offers now, provide a TC bump of >25% on my current TC here.2) Location preference. New offers from Nutanix and Cohesity are at a more preferred location to me, thus not requiring relocation.3) I do feel  the team chemistry is pretty cold and not so much fun here. This could be coz of virtual onboarding and setup.Question now is, would you suggest me to jump to Cohesity/Nutanix; or stay put for at least a year, considering TC bump and other factors mentioned? #tech #jump #dilemma",0,5,2021-5-20 06:17:35,/post/Leaving-start-up-in-2-3-months-byb6ppnX,Cohesity
0,Help with Microsoft extreme lowball offer,1punchman,/company/Amazon/,nan,"Posting this on behalf of my friend.I recently completed my MS in CS and have 4 years of experience in a renowned storage company. I have the 3 offers  listed below and like the work at all the respective teams but am more inclined towards Microsoft if they mqtch my current offer. I need some guidance in negotiation with Microsoft extreme lowball offer.Offers- Citrix - Sr.SWE 2 Base: 155 Stocks: 35K per yr for 3 years - TC: 190K per yearCohesity - MTS3 Base: 140K RSUs : 3k per year for 4 years(Secondary market price: $18 per RSU)TC: 194K per yearMicrosoft - SWE L60Base: 120, Stocks 10k per year for 4 years, Signing Bonus: 15k first year.TC: 145KI am trying to negotiate with Microsoft and see if they can increase the TC ormake it L61 Software Engineer IIAppreciate any insights#microsoftcompensation #microsoft #citrix #cohesity #salarynegotiation",0,16,2021-3-19 19:20:17,/post/Help-with-Microsoft-extreme-lowball-offer-yTCOoZs3,Cohesity
0,Need Referral for SDE2 in India,00_7,/company/Flipkart/,nan,Current Organization: FlipkartTC: 32 LPAYOE: 4 yearLC: 291Can you please give referral me at - Apple- Expedia- Google- Indeed- Intel- Intuit- Linkedin- Morgan Stanley- Nutanix- Nvidia- Salesforce- Twitter- VMWare- AirBnB- StripeAdded More..- Alphonso- App Dynamics- Aviso- Bloomreach- Citrix- Cohesity- Coinbase- Compass- Cure Fit- Directi- Hasura- HealthifyMe- Instabase- MotorQ- Palo Alto Networks- Postman- Practo- Quadeye- Qubole- Sharechat- Snowflake- Sumologic- Target- Thoughtspot- Udaan- Urban Company- Vizury- Whatfix- World Quant- Grab- Harness- SprinklrThanks 🙏  #engineering #software #swe,5,34,2021-5-6 11:27:10,/post/Need-Referral-for-SDE2-in-India-HpLfW7OA,Cohesity
0,Tech Companies in Mumbai/Pune,GoldmanSac,/company/Goldman-Sachs/,nan,Currently working in Goldman Sachs TC 25LPAAny recommendations on tech companies or start-ups in Mumbai or Pune which can pay 35LPA or moreYOE: 3 years#Amazon #microsoft #google #nutanix #cohesity #vmware,2,22,2020-3-9 14:47:41,/post/Tech-Companies-in-MumbaiPune-Xu6Dhbxg,Cohesity
0,Referral ,lobY20,/company/Cisco/,nan,"Looking for referral in cohesity and salesforce , Walmart",0,4,2020-2-12 02:31:00,/post/Referral-BoJTSWrp,Cohesity
0,"How to apply to Google, Uber, Rubrik, Twitter etc as a new grad [ India ]",nerdvana,nan,nan,"For a final year student. Companies like Uber, Cohesity, Rubrik, Apple, Twitter, Sprinklr etc generally don't have openings for new grad roles on their websites. They mostly recruit directly from Old IITs. Can contacting recruiter directly or internal referral help? Or something else?About the candidate (if it matters)-2nd gen IIT, CSE&lt8 cgpaDecent in competitive programming (Expert rated in CF)Good projects and interns",1,20,2021-4-27 14:59:20,/post/How-to-apply-to-Google-Uber-Rubrik-Twitter-etc-as-a-new-grad-[-India-]-4JynDr3v,Cohesity
0,Most satisfying places to work?,barnacles!,/company/Oracle/,nan,"Culture, transparency, cohesive strategy, good brand, pay, stability, etc. What's the closest you've come to this magic land of elves and centaurs?",1,6,2019-8-22 23:02:15,/post/Most-satisfying-places-to-work-e0pUptgY,Cohesity
0,Product Manager salaries India?,pm_r2i,/company/Microsoft/,nan,"Can any of you tell me how much these jobs in India pay?LinkedIn, Product Manager, LinkedIn Lite, 3+ yoe, Bangalorehttps://www.linkedin.com/jobs/view/975202231Cohesity, Product Manager, 5+ yoe, Bangalorehttps://www.linkedin.com/jobs/view/974033726ServiceNow, Senior PM, Hyderabad, 3+ yoehttps://www.linkedin.com/jobs/view/925627302Current TC 220k USD, 4 yoe",1,22,2018-12-5 11:13:47,/post/Product-Manager-salaries-India-cmaa4o7M,Cohesity
0,Work culture at India offices of tech companies,LoruSoren,/company/Nutanix/,nan,"How does the work culture at different enterprise tech companies in India compare. As a benchmark consider VMware, Cohesity, Nutanix, IBM Software Labs, Veritas, Rubrik.What kind of team culture do we see here? What's the quality of work that these places have? How do compensation and care growth opportunities compare?",3,34,2020-12-18 04:52:06,/post/Work-culture-at-India-offices-of-tech-companies-HMLJE8oR,Cohesity
0,Any openings for SDE1 in Bangalore/ Hyderabad ?,zzzzzz-ZZ,nan,Eng,"Currently working at a startup yoe 10 monthstc - 13 lpaNeed referrals at good companies/startups  in Bangalore, or Hyderabad :Google, Linkedin, uber, nutanix, ola, swiggy, curefit, qubole, cohesity, inmobi. Already have offer from Amazon. (TC-16)",5,12,2019-2-14 16:10:15,/post/Any-openings-for-SDE1-in-Bangalore-Hyderabad-nLhBKov1,Cohesity
0,New tech startups worth a try?,UnclesamX,nan,Eng,"https://www.businessinsider.com/tech-startups-unicorns-2018-full-list-2018-11#1-juul-labs-35Now which ones for these are worth a try for Software Engineers. I know Snowflake, Cohesity and Postmates pay quite well.",6,3,2018-11-11 16:30:42,/post/New-tech-startups-worth-a-try-4LGQBOr3,Cohesity
0,The definitive Tech WFH thread,hoolio,/company/Qualtrics/,nan,"Last update below is as of 11/17. Not keeping this updated now.----------------------(In order of wfh end dates)*As of 11/17*11/20Applied Materials12/20Nvidia, OCI01/2021Snap,  Smartsheet, MongoDb, Capital One, Workday, Expedia, Qualcomm, Starbucks IT, Visa, Zoom, Bloomberg, Docusign, CarGurus, Charles Schwab IT, Ford, Squarespace, Verizon Media, Akamai/Freshworks04/2021Doordash06/2021Google, Intel, Uber, DE Shaw, Lyft, Amex, Unity, NetApp, Wayfair07/2021Facebook, Indeed, Spotify, Netflix, Instacart, Cohesity, Salesforce, Intuit, SAP (mid 2021), Qualtrics, Amazon, Microsoft, LinkedIn, Medallia, Cisco08/21Cruise, Stripe, Pinterest, Twilio, Airbnb, Adobe, Workday09/21Splunk, Box, PaypalIndefinitelyAtlassian, Coinbase, Slack, Square, Twitter, Zillow, Zaplabs, Walmart (Engg only), Okta, Quora, ZeroDown, Booking, VMWare, Dropbox#remotework #wfh",118,334,2020-8-11 18:41:19,/post/The-definitive-Tech-WFH-thread-RxNJ80Mo,Cohesity
0,What is asked in Sde2 interviews for data engineers? [India],Sillyppl,/company/Google/,nan,"Currently working as a software engineer in big data. Daily work is in scala, hadoop, spark. Interested in tier 1/ 2 companies and well funded startups.Looking for suggestions from people at different companies about the interview process. Is it based on dsa + design or heavy in big data related questions?PS. Asking for a friend#google #amazon #apple #linkedin #intuit #microsoft #uber #cohesity #nutanix",4,1,2021-5-17 17:52:04,/post/What-is-asked-in-Sde2-interviews-for-data-engineers-[India]-OH2ny7Ts,Cohesity
0,AWS Backup,Amazon#,nan,nan,"With services like AWS Backup around, do you think companies like Rubrik and Cohesity will survive?",1,6,2019-1-25 01:46:23,/post/AWS-Backup-QAiShzWv,Cohesity
0,Referrals in Bangalore,VKHO57,nan,nan,"Hi All,I am looking for top companies referral in Bangalore for SWE (IC / Lead) Roles.Area of expertise - Distributed systems (Backend), AWSYOE - 12+Solved 200+ LC problemsPrevious companies - Amazon, DELL etc.Especially interested in companies like LinkedIn, Rubrik, Cloudera, Grab, Atlassian, Intuit, Cohesity, Confluent etc.Thanks",1,22,2019-11-2 16:03:57,/post/Referrals-in-Bangalore-Y0sGgyin,Cohesity
0,Need referral,zero07,/company/Flipkart/,nan,Need referral @LinkedIn @Microsoft @oci oracle @ola @sumologic @rubrik @rippling @adobe @google @cohesity @zeta @atlassian @Twitter @rippling @hotstar @gojek @grab @yelp @facebook London @databricks Amsterdam @booking AmsterdamYOE 3.6 in Java backend roles Tc : 21 lpa basePs: I am not able to get good company interviews via LinkedIn or naukri.com Thanks for help 😊,1,25,2020-12-7 13:50:00,/post/Need-referral-6MXZ3nXY,Cohesity
0,10 Best Pre IPO Startups to Join in 2021,Tanjiro7,/company/NVIDIA/,nan,"After seeing #Airbnb, #Doordash, and #SnowFlake IPOs (Huge congratulations to all of them), the idea of joining a startup is very tempting to me because of my financial situation even though all the risk it comes with. So last week, I asked about the best pre IPO startups to join in this post (https://us.teamblind.com/s/AtVPh1Nx). The responses were overwhelming where over 130 startups were mentioned. I literally felt 😵‍💫😵‍💫😵‍💫 after going through all comments and getting all startups' names.Now the question is: Out of this huge list of startups below, What are the Top 10 startups to join???The list of all startups mentioned by the community in (https://us.teamblind.com/s/AtVPh1Nx) arranged A-Z:Airtable, Ampere, Anduril, Apeel, Argo AI, Avepoint Technologies, Aviatrix, Better, Blend, Bling, Butterfly Network, ByteDance, Calendy, Cameo, Capsule Pharmacy, Carta, Casai, CCIV, Chime bank, CircleCI, Cloud Flare, Cloud Kitchens, Clubhouse, Coalition Inc, Cockroach Labs, Cohesity, Cohesity, Coinbase, Collective Health, Compass, Confluent, Coupang, Crowdstrike, Cruise, Data rocks, Data stones, Databricks, DataRobot, Datastax, Dave, Dialpad, Didi, Discord, DJI, Domino data lab, Dremio, DriveNets, Figma airtable, Fire bolt, Fivetran, Flexe, Flexport, Flipkart, Forward, Gemini, Gitlab, Gong, Grab, Greenwood, Groq, Harness, Hashicorp, Hinge Health, HOVER, Instabase, Instacart, Iora Health, Ironclad, Klarna, Linode, Lucid motors, MAGA, Mapbox, Metromile, MindGeek, MURAL, Narvar, Netlify, News Break, Nextdoor, Niantic, Notion, Nuro, OfferUp, OnlyFans, Oscar, Outreach.io, Patreon, Pensando, Plaid, Pony.ai, Puppet, Qualia, Quicken, Ramp, Reddit, Rippling, Rivian, Roblox, Rubmaps, Rubrik, Sambanova Systems, Samsara, Scale.ai, Sisu, Sofi, SpaceX, Sprinklr, Standard Cognition, Starburst data, StockX, Stripe, Tanium, Thoughtspot, TikTok, Toast, Traceable ai, Transferwise, Trikspu, TripleLift, Turo, TuSimple, Udemy, UiPath, Vercel Linode, Verkada, Vicarious AI, Wealthfront, Weedmaps, Wework, WSB, Zipline, Ziprecruiter#startup #ipo #money #tech #equity",35,130,2021-2-11 20:08:36,/post/10-Best-Pre-IPO-Startups-to-Join-in-2021-PEriNDXM,Cohesity
0,How is the VM Cloud BU in Palo Alto?,etccrash,/company/NetApp/,nan,I currently have an offer from Cohesity with 180k base and 450k RSUs (6.5yoe) but have heard mixed accounts about the team. I have an interview with the VMC team and am looking for info about comp/work culture.,0,8,2019-6-27 21:12:26,/post/How-is-the-VM-Cloud-BU-in-Palo-Alto-5jwSBn7W,Cohesity
0,Storage startups - what's the deal?, jfkjfjci,/company/Arista-Networks/,nan,"As a networking guy, trying to understand all the storage startups out there as I keep getting calls from them here and there.What's the difference between, say, Cohesity, Rubrik, Pure Storage, Clumio, NetApp, EMC and other such companies in terms of their products / area of innovation.Please help in demystifying.@NetApp @Clumio",2,15,2020-7-2 04:18:14,/post/Storage-startups---whats-the-deal-gsk8nJHU,Cohesity
0,Need referrals for companies in india,AaronRamsy,/company/Microsoft/,nan,"Hi community,I'm currently a software engineer at Microsoft. Joined as a college hire. Looking for new opportunities at Uber, Curefit, Goldman Sachs, Cohesity and some other startups.Edit : 1 YOEThanks.",1,8,2020-6-19 20:30:56,/post/Need-referrals-for-companies-in-india-G2OA6JOO,Cohesity
0,Looking for guidance and referral for a fresher SDE position India,Faangboy!,/company/Cisco/,nan,Currently an intern at Cisco. Final semester of college. Could anyone provide any referral or tell any company that is hiring freshers as of now? Leetcode - 703TC - 17(After conversion)Thanks a lot#engineering #software #swe #google #rubrik #flipkart #linkedin #twilio #twitter #astronomer #oracle #microsoft #gojek #udaan #sap #hasura#adobe #target #apple #intuit #rippling #uber #harness #stripe #atlassian #cloudera #ola #inmobi #expedia #compass #directi #vmware #salesforce #nvidia #towerresearchcapital #cohesity #postman #sprinklr #zomato #rubrik #grab #bytedance #sharechat #nutanix #arcesium,1,6,2021-1-21 15:23:05,/post/Looking-for-guidance-and-referral-for-a-fresher-SDE-position-India-MxL3Mtsk,Cohesity
0,"5 yoe US product manager IC experience, need to find jobs in India",r2i,/company/Microsoft/,nan,"If I were to solve for high pay, what kind of jobs, what kind of companies do I write to? How much does L62/63 Microsoft pay? How much do these US unicorns (like Rubrik, cohesity, thoughtspot etc) pay for PMs in India? Do 'business development' or operations jobs pay higher?  Have high brand value degree, if that helps.",1,10,2018-12-1 08:59:47,/post/5-yoe-US-product-manager-IC-experience-need-to-find-jobs-in-India-qQYJDA08,Cohesity
0,"Requesting Referrals,  :-)",LuckBuck,/company/Red-Hat/,Eng,"looking for referrals @Netflix @Twitter @LinkedIn @Microsoft @oci oracle @ola @adobe @google @cohesity @zeta @atlassian @Twitter @rippling @hotstar @gojek @grab @yelp @facebook London @databricks Amsterdam @booking AmsterdamYOE: 2.5yrs (1 year FTE + SDE-1 internships)  mainly experienced in Java, python, microservices.Strong suite: Core Java.current TC: 10LPA (:/)expected Tc : 20 lpa basePs: I am not able to get good company interviews via LinkedIn or other job portals.any help is appreciated :-) #engineering #software #swe #referrals #needreferrals #netflix #netflixhiring #twitter #twitterhiring",3,36,2021-1-17 10:05:07,/post/Requesting-Referrals---i3Kouimp,Cohesity
0,Referral Needed (India),allhand,/company/Amazon/,Eng,"I am 2020 grad. Currently working with a startup.I am looking for referrals across India, Singapore, UK.TC :- 15YOE :- 9 monthsI am open for startups as well as tech giants.I am Well versed in competitive programming as well as Software Development.Expected TC :- 17-19Looking referrals for (not limited to)#Flipkart#Phonepe#Adobe#Atlassian#Arcesium#Cisco#Samsung#Goldman Sachs UK#Swiggy#Rubrik#Cohesity#Hotstar#Linkedin#Microsoft#Nutanix#OCI#Mindtickle #Zeta#Twitter#databricks #teradata #Quadeye#towerresearchcapital ",0,19,2021-3-9 18:01:13,/post/Referral-Needed-India-r77RzM3G,Cohesity
0,Hedvig Inc ,QBwI85,/company/Hedvig/,nan,How is Hedvig Inc perceived here? It's an enterprise storage company founded by an ex-FB engineer (who created Cassandra and Amazon Dynamo). I have heard quite a bit about Rubrik and Cohesity but not much about Hedvig.,1,3,2018-2-19 06:00:43,/post/Hedvig-Inc-XZHNpvRh,Cohesity
0,Suggestions for next move,louisvill,/company/Microsoft/,nan,"Anyone in marketing and sales that has moved on from Microsoft? Very surprised by how behind, and quite petty, MS marketing culture is in the US and looking for a more modern and cohesive team. Background is in marketing automation.",1,1,2020-7-8 21:36:39,/post/Suggestions-for-next-move-NKEBbgEO,Cohesity
0,Good companies to work for in India?,tokugawa,/company/LinkedIn/,Eng,"Looking for companies in India that satisfy three properties:-1) Good TC2) Decent projects3) Supports international transfersAny idea which all companies fit the bill?I know of the following:-AmazonGoogle (?)MicrosoftTheses companies are out since they don't normally allow international transfers afaik-SalesforceOracle/OCIAtlassianDE ShawIndeedDoes anyone have any idea about the following companies?AppleGoldman SachsUberStripeTwitterTower ResearchRubrikConfluentNutanixCohesity#tech #indiasalaryTC- 55L, YOE- &gt4",8,40,2020-11-1 15:48:30,/post/Good-companies-to-work-for-in-India-LVxL7uQU,Cohesity
0,Bored of building CRUD  Apps,LaPerla,/company/IBM/,Eng,"Hi guys..I am currently working at Oracle building CRUD based apps..I am planning to move to  systems (distributed systems, networking) etc at companies like Rubrik/Cohesity/Vmware etc..Will it be a wise move? Should I stick to the application layer instead?What would be the pros/cons of making this move? #engineering #software #swe #distributedsystems",8,17,2020-10-12 00:00:20,/post/Bored-of-building-CRUD-Apps-BOZMYBL8,Cohesity
0,Has Cisco acquired Springpath?,Gjoh,/company/Cisco/,Eng,I am seeing Springpath employees reporting under UCS. There is a big hype regarding hyper convergence and Cisco wants to compete in that market. Cisco might have funded them but acquisition news is unheard of. Cisco also funded cohesity.,1,0,2017-7-28 03:59:10,/post/Has-Cisco-acquired-Springpath-pPU1PUL3,Cohesity
