,post_title,post_user,post_firm,post_position,post_text,post_like,post_comment,post_timestamp,post_url,company
0,Indeed Technical Business Analyst Interview,microso,/company/Microsoft/,nan,"Recruiter call:- They ask for your current salary. LIE with a higher number. They aren't going to ask for confirmation. - They ask for your salary expectations. This doesn't really matter, but go high.Round 1: 2 programming questions, 1 data science questionThere's a few different programming questions they ask. One is string matching. Another is to find the substring of a string with the highest alphabetical value. Another is to find the highest sum of consecutive numbers in an array where the sum does not exceed a threshold.Data science question was to classify a set of points in a plane as red or blue. Use a clustering algorithm like KNN.Round 2:Business. Suppose a company is telling its employees to leave fake reviews for the company. How are you going to detect that?Design a vertical app for the gig economy (make a map with pins for jobs).Here's a page on Glassdoor, here's a page on Indeed. Give some metrics that I could use to compare the two pages. (number of results, number of results with ratings)How do you tell if a company is incentivising fake reviews?Round 3:Onsite1. Business style - how would you integrate Indeed with an e-Learning company? (Like LinkedIn buying Lynda). How would you assess a competitor?2. Product interview. This one is really casual. 3. Engineering - Make a structure that will add, sample, and delete in constant time.https://leetcode.com/problems/insert-delete-getrandom-o1/4. Business interview - they walk you through how Indeed makes money (ads, click-through rates, a/b testing) and just check your comprehension. 5. TBA interview, Implement the get and set methods for an unrolled linked listEdit:6. Call with program manager. He asks you to compare indeed and Glassdoor, why you want to work at Indeed, etc. #Indeed#TechnicalBusinessAnalyst#interview",2,5,2020-12-19 04:54:07,/post/Indeed-Technical-Business-Analyst-Interview-eKrpF6uH,Indeed
0,Microsoft vs Zillow vs Indeed Offers,rNvT32,nan,Eng,"I have offers from engg teams at these three companies. How do they compare against each other.?TC is similar - $250-300. All positions based out of Seattle.Curious about wlb, office politics, working in silo? I grew up in NC and would fit the description of an introvert.",2,58,2018-5-25 16:06:22,/post/Microsoft-vs-Zillow-vs-Indeed-Offers-mqhEMuWf,Indeed
0,Indeed vs Amazon,TMGv57,nan,Eng,"If you were a new grad having offers from these companies in hands, which would you take and why? Both are software engineering roles. Starting comps are quite similar but Indeed seemed to have better raises.AmazonPros:- bigger brand- broader range of projects- better internal dev toolsCons:- on-call rotation (one week in a month)- frugality (no free food, snacks, soda, ...)- bipolar reviewsIndeedPros:- better perks- better work-life balance (open PTO)- more engineer-centric cultureCons:- weaker brand- limited scope to the job search engine- worse internal dev tools",3,19,2017-12-28 06:46:43,/post/Indeed-vs-Amazon-LMxXCaAg,Indeed
0,Indeed karat phone interview,PFGG85,/company/PayPal/,nan,"I have been approached by an Indeed recruiter recently. After out initial call, I was told to take a karat phone interview. What to expect and any suggestions on how to prepare ?",0,8,2019-5-6 23:04:06,/post/Indeed-karat-phone-interview-HXKxK2LQ,Indeed
0,Indeed vs Cisco,azsx90,/company/Indeed/,nan,"Which company is better overall comparing all aspects like future, career growth, TC, benefits, stability etc. for all functions like SWE, Product Manager, Product Design / UX , QA etc.",1,13,2020-7-15 20:59:38,/post/Indeed-vs-Cisco-X2sCiFtt,Indeed
0,Indeed level:title mappings,dueuh73-:g,/company/Microsoft/,Eng,"What are the industry title mappings at Indeed? Recruiter is being cagey, and saying things like ""L2 maps to industry senior."" Seems a little weird to jump right from SWE 1 to senior in one band...L1 = SWE 1L2 = Senior SWE?L3 = ?",2,26,2019-5-5 01:40:04,/post/Indeed-leveltitle-mappings-pXixRyzT,Indeed
0,Indeed onsite interview,rathnakar,/company/Wipro-Limited/,nan,Hi friendsI have indeed onsite interview scheduled in 10 days.Anyone recently attended virtual onsite.How will be the white board interview. Is the difficulty similar to Amazon Facebook .How will be the system design.What is program execution. What is expected from that round.What do they look for in code review,2,1,2020-10-15 18:25:45,/post/Indeed-onsite-interview-7c0xHYHT,Indeed
0,Indeed timeline,Rusty7,nan,nan,"Cleared the interviews about a month back and got a verbal offer.Post that they collected all data about competing offers, current comp, etc but they have been holding forever.Each time I request for an update, I am asked to wait since the vp approvals are pending since 2 weeks now!I had a favorable view about the firm, but looking at the red tape, having second thoughts about joining and take the other offer in hand. Not criticizing, but trying to collect information if this is common. I talked to a few other guys in the same boat.I understand I shouldn't wait for them any longer, but closure is something I am looking for. What's the point of keeping someone hanging?",1,4,2018-10-24 09:20:45,/post/Indeed-timeline-30uc2eKM,Indeed
0,Indeed just announced hiring freeze!,delizioso,/company/Indeed/,nan,not implementing layoffs they said as they are preparing for economic downturn for a long time. #covid19,7,33,2020-3-18 15:55:13,/post/Indeed-just-announced-hiring-freeze-pOJCzCDo,Indeed
0,Indeed Singapore Offer Timeline,PPBd87,nan,nan,"I interviewed for SWE role for Singapore Office about 7 weeks ago. Around the same time, the recruiter told me that Indeed is going to proceed with an offer and collected the relevant information from me. I have been waiting since then. Each time I emailed to ask, the recruiter would either tell me that the offer is pending approval or finalizing. I read here about the hiring freeze but as far as I know, Singapore office is still hiring. I’m curious about the following:1. Is anyone in the same situation? 2. Indeed folks, what is the average turnaround time?",3,14,2019-6-7 07:38:02,/post/Indeed-Singapore-Offer-Timeline-XJPPiJAG,Indeed
0,Indeed interview,JuBe00,/company/Dell/,nan,"Hello, can somebody share their experience with Indeed and their interview process? @indeed",0,2,2020-1-29 17:28:18,/post/Indeed-interview-W3mFGoJ7,Indeed
0,Indeed karat interview,z3nn,/company/Amazon/,Eng,"So I nailed the knowledge questions, nailed the first coding problem, then struggled to complete the second problem. It was passing half the test cases when I ended the interview.I already scheduled my redo interview. Assuming I at least complete the 2nd coding problem during that interview, do I have a shot?",0,4,2020-12-11 03:46:41,/post/Indeed-karat-interview-UJraUimm,Indeed
0,Indeed Interview Process,KLeonard,/company/Amazon/,nan,"Interviewed for a position at Indeed recently. After the onsite, recruiter emailed me “Congrats we are moving you to next step, team matching”. No mention of offer or anything. How does this work? I get an offer after team matching? Is there a chance I wont get offer after team matching?",2,3,2019-10-14 20:25:14,/post/Indeed-Interview-Process-JiXYNwAh,Indeed
0,Indeed hardware,Probiotic,/company/Amazon/,Eng,"What kind of hardware does Indeed give to Software Engineers? I assume it's MacBooks, but which kind?Do you get an option, or is one just assigned?",1,11,2020-8-11 19:07:07,/post/Indeed-hardware-ECgwG6ea,Indeed
0, indeed offer (japan),jVuo16,/company/Hitachi/,nan,Please evaluate this offer (in jpy)9.8M base/10k LTIP as L1PhD+1.5 yoe,5,8,2018-7-11 01:50:50,/post/indeed-offer-japan-k1YgWLbM,Indeed
0,Promotion at indeed,indeed007,/company/Mindbody/,nan,"When we get promoted at Indeed, do the company give us extra LTIPs along with hike?",1,7,2020-9-21 21:35:32,/post/Promotion-at-indeed-nehk2Wjz,Indeed
0,Indeed Austin offer negotiation,zolk13,/company/Capital-One/,nan,On site went well. Recruiter said I can come in as high L2. What TC should I shoot for?Is 225k + realistic in Austin or is that pricing myself too low?Is there any chance of negotiating remote?10 YOE. Current TC 120 k which I'm not disclosing to the recruiterLC (LeetCode) 500,4,19,2019-4-2 01:54:48,/post/Indeed-Austin-offer-negotiation-qmQEmijj,Indeed
0,Indeed Compensation Expectation,H73848,/company/Microsoft/,nan,What kind of compensation can I expect as a Senior SWE at Indeed in Austin?How much money in ltips/stock should I look for?Thanks!,6,9,2018-5-29 21:19:36,/post/Indeed-Compensation-Expectation-KXwdMMnO,Indeed
0,eBay or indeed or homeaway,Ragnaro,/company/eBay/,Eng,Keep it simple. 6 yeo. TC eBay 150k. TC indeed 160k. HomeAway 155k. Ebay gives RSUs every year and 10-12% bonus. Other companies only bonus. Live in Texas. eBay seems like a 30 hour a week job.,3,28,2019-4-11 22:31:53,/post/eBay-or-indeed-or-homeaway-2smvjGJe,Indeed
0,Indeed vs Apple in Austin,frenchfry,/company/Apple/,nan,"Assuming comp is the same, would you rather work for Indeed or Apple in Austin?",1,22,2017-10-2 16:48:09,/post/Indeed-vs-Apple-in-Austin-jQxKBL6K,Indeed
0,Indeed quarterly bonus %,MDYQ51,/company/Amazon/,Eng,"Indeeed, what's your experience with quarterly bonus percent?Recruiter is trying to tell me that quarterly bonus is 10-30% and that 20% is granted for just meeting your goal. It's hard to get a good grasp of TC when there is such a large gap of bonus amount.Thanks.",0,14,2019-9-26 14:51:04,/post/Indeed-quarterly-bonus-5cau8iW2,Indeed
0,Any word on Indeed?,juOa05,nan,nan,Does Indeed plan on opening hiring anytime soon? Or were they highly impacted by current events?,2,18,2020-6-1 08:30:20,/post/Any-word-on-Indeed-CqWn61ym,Indeed
0,[bay area]: indeed L3 vs amazon L6,a_b_c_d,/company/Facebook/,Eng,"Leaving facebook for personal reasons (E5 current TC 360K)both offers are in the bay area.* indeed: 420k TC  (negotiation is done) * amazon: yet to give numbers WLB is the top priority for me.1. Please share experience working with indeed in terms of WLB, Engineering and Work Stress?2. How much can I negotiate with Amazon (450K ?)3. Eventually, I would like to go on management path, how easy it to move to management role (in both indeed and amazon)",4,29,2019-12-24 03:00:14,/post/[bay-area]-indeed-L3-vs-amazon-L6-ZwHeRnSY,Indeed
0,Working at indeed Hyderabad,n4300,/company/Paysafe/,nan,"Hi Guys,Can anyone share about working for indeed, tech stack, culture etc ? In particular Hyderabad, India. Looks like they are hiring a lot these days and is it worth joining?  @indeed #indeed #tech",1,5,2020-9-19 19:04:21,/post/Working-at-indeed-Hyderabad-fBwNS3E3,Indeed
0, indeed offer ltips,GxME41,/company/Google/,nan,"ask this for a friend who got an offer from indeed.His major question is about ltips part and hopes to get some insight from @indeed folks. Thanks.quote his questions below:""1. The recruiter said from 2015 to 2017 the unit values are about $3. How about unit value for 2018, 2019 and 2020? From blind, it seems people say it has been decreasing recently. Is it true?2. How does refresh work? What's the percentage of people that can get the annual refresh? If you get it, how much you will get comparing with the initial offering? e.g. if their initial ltips is 30k units, what can be a rough number of units like for 1st year's refresh? 10k, 30k?(i assume it will be vested by the end of 4th year, plz correct me if I'm wrong)3. Does the vested value on their 3rd year indeed meet what you were told in their offer?""blind routine:current tc: 180kindeed offer:level: L2base 170k + ltips 50k units + 45k sign-onlocation: bay area #indeed #ltip #ltips",3,16,2020-3-8 06:27:39,/post/indeed-offer-ltips-6emXWeBU,Indeed
0,Discovery vs Indeed offer eval,sheiPh7O,/company/Uber/,nan,"Hi all,Need help comparing offers, and would appreciate some company feedback from insiders as well.Have 2 offers, both SDE2-level:1) Indeed: ~180k+bonus (+ LTips later on);  pros: WLB, benefits, LTips calculated at 1.6 which I believe should grow to 2+ by the time they're vested  cons: somewhat uninspiring project and unfortunate office location (for when everyone's back in office).2) Discovery (video streaming, not credit card): 195k+bonus  pros: shiny new project, ton of opportunities to improve resume (Olympics, etc.), much better office location  cons: streaming division was founded by people from Amazon, and they brought culture with them: forced curve, devplan for bottom 10%, etc. WLB seems to be worse than Indeed, so it's unclear how compatible it is with kids.",3,6,2020-10-9 06:48:53,/post/Discovery-vs-Indeed-offer-eval-j6vUJA0o,Indeed
0,Indeed QA Automation,hasssan ,/company/Dematic/,nan,Has anyone done onsite interview for QA automation at Indeed? What to expect? yoe-3,3,19,2019-9-20 04:29:33,/post/Indeed-QA-Automation-jSQziAUK,Indeed
0,Indeed interview,Zz😴,/company/Microsoft/,Eng,I have an interview coming up with Indeed. Was wondering how does the level map to those of Microsoft. Levels.fyi seem to have a broader category. Curious about the overall growth and culture.,2,6,2020-1-23 02:33:10,/post/Indeed-interview-ELmcCF2a,Indeed
0,"Indeed experience on resume, worth it?",VDmb56,/company/Indeed/,nan,"I am a new grad started working at Indeed as a SRE. As of now, I like pretty much everything here.My plan is to work for 3-3.5 years at Indeed, collect my RSUs and LTIPs, and then make a switch.From posts at blind, I feel there is this image of Indeed promoting slacker culture.This has confused me, how do recruiters value a 2-3 years of experience at Indeed? Would it hamper my chances of getting shortlisted at faangAm I better off switching somewhere else right now (with roughly 1.5 years experience at Indeed)?The goal is to optimise for both TC and career growth.",4,17,2021-3-17 04:33:43,/post/Indeed-experience-on-resume-worth-it-O3wFnB8g,Indeed
0,Indeed APM On-site,oVEb84,nan,nan,"Hi Indeed/Blind,I have an upcoming Associate Product Management final interview with Indeed. I believe I have the skills and the experience, but I really don't know what to expect and how to prep for the final round.Can anyone share their experience interviewing at Indeed? or maybe What to expect in a PM final round? - the best way to prepare for these kinds of interviews?Thanks!  #indeed #productmanagement #apm",1,7,2021-2-14 19:11:01,/post/Indeed-APM-On-site-5YYBZqbo,Indeed
0, Product Scientist @ Indeed,thisisme2,/company/Travelers/,nan,"Hi blind community,I will interview for a position with indeed-product scientist. First round will be with recruiter.Got an impression that this will be product analyst role, with focus on analytics. Any tips on interviewing or insights on product scientist role? Thanks!YOE 9. TC 150k.",2,4,2020-12-3 16:10:35,/post/Product-Scientist-@-Indeed-kF8MNJLf,Indeed
0,Indeed virtual onsite,KBcR21,/company/TDS-Telecommunications-LLC/,nan,"I did my tech interview at indeed today and yesterday. Total 7 hours. 2 white boards, 1 architecture, 1 code review, 1 programming and resume deep dive. I think i did fine on resume and code review. In tech one white board was just 60% code complete, i explained the idea to them. Had a lot of trouble understanding requirements on that one. Second white board, i was able to solve it completely. Architecture, i was able to solve it fully identified all cases and interviewer was satisfied. Programming exercise solved 17 out of 19 test cases.How are my chances to get an offer with the interview i had? What are they looking for in resume deep dive?  What would cause the rejection based on resume? #interview #austin",1,24,2020-8-27 05:42:42,/post/Indeed-virtual-onsite-dunz5Ss6,Indeed
0,Arcesium vs Indeed,JjSi10,/company/Paysafe/,nan,"Which company is better overall comparing all aspects like future, career growth, TC, benefits, stability etc.  I have offer of Engineering lead role from Arcesium and Engieering Manager role from Indeed?  #indeed #arcesium #engineering",1,6,2020-9-29 18:06:03,/post/Arcesium-vs-Indeed-pQysVAqy,Indeed
0,TC ranges at Indeed Tokyo,tokyoite,/company/Indeed/,Eng,I'm currently blind to salary bands at Indeed Tokyo and would love to get concrete numbers from others. I'm curious about my earnings potential at this company. Does anyone have numbers on what TC looks like for different positions?I'm a SWE1 and getting ¥10-11M base + 10k LTIPs,7,14,2018-7-11 15:23:48,/post/TC-ranges-at-Indeed-Tokyo-45acOqRm,Indeed
0,Indeed SWE,Heinric,nan,nan,"How is indeed SWE in respect of brand name, pay, WLB?Heard really good things about them and friends telling me their food, perks is top tier and WLB is amazing. Pay is pretty decent too.Can any one confirm this?",1,10,2019-8-29 22:15:52,/post/Indeed-SWE-ouLJe1ad,Indeed
0,Indeed Hyderabad onsite experience ,iWGw35,/company/Microsoft/,nan,"Hello guys, I have an Indeed onsite coming up and was trying to find out their level of difficulties wrt to the rounds. Getting a hard time to find answers. Anyone who recently cracked Indeed onsite want to help me please? Recruiter said that there are 5 rounds - 2 algo/ds, 1 resume deep dive, 1 code review and 1 system design.Not sure about the code review round. What sort of (length of code?) they give to review? I am interviewing for the Hyderabad locationThanks in advance.YOE: 3TC: 24 Lpa (INR)",0,23,2020-8-5 17:48:30,/post/Indeed-Hyderabad-onsite-experience-CssWfoEm,Indeed
0,"Indeed Singapore, how is it?",adamoppa,/company/Grab/,nan,"Been seeing a lot of good engineers in singapore move to Indeed. Besides the increased pay, curious to know how it is to work there? What kind of projects and technologies do they work on?How is the culture? Would particularly like to hear from ex sg Grab people, if any.",2,21,2019-10-12 05:24:14,/post/Indeed-Singapore-how-is-it-NkC4DhBY,Indeed
0,Amazon vs Grab vs Indeed,Jufbjkkdz,nan,nan,"Recently got verbal offers for them. Assuming compensation is similar, which of these would be a great choice for next switch?I am inclined towards Indeed, hearing great reviews and good wlb. YOE = 7 (not in tech, but in fintech)",0,17,2018-10-8 18:21:36,/post/Amazon-vs-Grab-vs-Indeed-1WgSZaek,Indeed
0,Indeed Prime,xizX84j,nan,IT,"What's your opinion if any about Indeed Prime for getting interviews?YOE ♾️, ~TC 400",0,6,2019-8-22 22:53:24,/post/Indeed-Prime-cJ7WsxX2,Indeed
0,Referral for indeed,garuda020,/company/Johnson-Controls/,Project,"Hello all,As I've recently lost my job and relocated to India, I'm aggressively looking for a new role and found a suitable opening in indeed hyderabad. Can someone please provide me with a referral? Thank you #layoffs #indeed #referral",1,14,2020-9-10 23:18:45,/post/Referral-for-indeed-FUP4hib0,Indeed
0,Negotiate level up at Indeed (with Google as competing),aabc,/company/Microsoft/,nan,"Hi,Update: Thanks for lots of advice! I am over this level up thing now. I think it is just the way it is, or I was simply naive that I can get similar level like in US. I won’t try to negotiate, probably in vain anyway. Update: Got L4 at Google and accepted it. Update: I saw some confusion, I am not aiming for L3 at indeed. I just want to go from SDE II (L2) to Senior (L2). my recruiter told me Indeed break down L2 into two levels. https://www.indeed.jobs/career/JobDetail/Senior-Software-Engineer-Personalization/17979I was applied for the above, receiving an SDE II is not good news for me. Basically SDE II is lower range of L2 and Senior is the upper. that’s what I was told. I have two offers from Indeed and Google (both japan)Yoe: 6, L63 at MicrosoftIndeed: SDE II (TC: 17.6M Yen first 3 years, 22.3M 4th year, LTips 1.6 estimation. base 12.5M, aniversary bonus 3.25M first 3 years, 50K Ltips vest in 4th year, 10-15% target bonus). Revised. Google: L4. Slightly better TC. I thought my interview at Indeed went well, but they said even though I was able to answer all questions in System Design, it lacks depth, so I was only offered SDE II, not senior. The director of the team I am applying really likes me, he even set up a call after the interview to persuade me to join. He also mentioned he and my recruiter got me the maxium offer for SDE II. I tried to push, said how about redo SD interview, since I care about level, but they refused. That’s was a week ago.In days, I will have offer from Google, which is obviously not bad. Still, part of me wants to join Indeed since I believe I can make more impact there compare with Google. I am willing to walk away from either offer, since each has its own advantages and disadvantages?Should I or can I use Google offer as a leverage to make Indeed level up me? I only care about title, I am willing to take an offer which pays less initially as long as the gap is not 30%. Anyone experience this level up negotiation, especially with Indeed.Thanks.",4,44,2020-2-14 23:11:50,/post/Negotiate-level-up-at-Indeed-with-Google-as-competing-514CQFn3,Indeed
0,Promotion hike at indeed,indeed007,/company/Mindbody/,nan,Hi I recently got promoted from L2 to L3 .what is the percentage hike I can expect at indeed,0,6,2021-1-7 19:09:24,/post/Promotion-hike-at-indeed-trEhOxLu,Indeed
0,Indeed new grad offer.,yOxV01,nan,nan,"Hey guys, does Indeed negotiate offers for new grads(Austin office). And if so any tips on how to negotiate the offer? #engineering #software #indeed #newgradsalary.",3,7,2021-3-3 20:27:52,/post/Indeed-new-grad-offer-00xDo48J,Indeed
0,Indeed offer wait time,Jhdcvh,nan,nan,Got the verbal offer from Indeed more than a week back. Recruiter mentioned the actual offer letter is taking so long because the Chief of Staff is out of office.Is anyone in the same boat or is there anyone who did get the offer letter recently?,1,22,2018-10-12 09:40:57,/post/Indeed-offer-wait-time-3rsXGEVM,Indeed
0,Indeed in Seattle?,pawUI,/company/Amazon/,Eng,Thoughts on Indeed in Seattle? What’s the culture like? Management any good? WLB? Comp?Just left Amazon and considering a jump to Indeed as tech manager.,1,8,2019-4-11 00:45:05,/post/Indeed-in-Seattle-FKAScLdK,Indeed
0,Indeed PS through Karat,PichiPulka,/company/Salesforce/,nan,"Whats the level of difficulty , anyone any idea?",1,11,2018-8-7 04:57:55,/post/Indeed-PS-through-Karat-xtZkSwjW,Indeed
0,Indeed vs Walmart,Beta92,/company/Apple/,nan,I have offers to intern as a data scientist at Indeed and Walmart. Which company is more reputable?,2,17,2018-2-19 20:09:47,/post/Indeed-vs-Walmart-CziErV53,Indeed
0,Indeed vs OCI vs Qualtrics,srchjob,/company/Microsoft/,nan,"Got offers from these 3 for Senior SWE positions. TC is comparable and in the range 270 - 300.Indeed is more cash heavy and rest both are RSU heavy.I am mainly looking for more impactful work, flexibility in working hours and better growth prospects.It looks like Qualtrics has lots of room for growth but worse benefits and limited leave and WFH policy. So I am leaning towards OCI or Indeed. Wondering if ppl had similar choices and chose one vs other ?Currently senior(L63) at Microsoft, YOE 8.",1,37,2018-10-16 04:36:08,/post/Indeed-vs-OCI-vs-Qualtrics-MCVscf80,Indeed
0,Should I leave indeed to work at Amazon?,indooooood,/company/Indeed/,nan,Indeed TC 200kAmazon TC 240kBoth jobs are in AustinBeen happy at indeed with the work and culture. Is it worth moving over?,1,19,2020-4-29 03:01:00,/post/Should-I-leave-indeed-to-work-at-Amazon-ybYcU3zS,Indeed
0,Work culture in Indeed,blu,/company/Microsoft/,nan,How is the work culture in Indeed?Is the organization stable? Any layoffs?,1,8,2018-11-11 17:46:11,/post/Work-culture-in-Indeed-jhdWMb33,Indeed
0,Indeed Austin L2 offer,curlyboi,/company/RetailMeNot/,nan,"Got an offer for L2 expressed pretty much as a 'take it or leave it'. Is there wiggle room here? I'm at 7YOE and I want to hedge against the fact that it seems maybe tough to progress from L2.Offer is $130k base, 13-15% expected bonus, $20k signing and anniversary bonuses, 22,000 unit LTIP grant.This seems overall OK, just wondering if there's more flex than is being expressed or if this is really no haggle.",2,17,2019-4-18 19:46:55,/post/Indeed-Austin-L2-offer-VYCyUonh,Indeed
0,"Indeed, GitHub and Zoom referrals",hvLbLio,nan,nan,"Hello fellow blinders, I'm looking for referrals to Indeed, GitHub & Zoom for Privacy Analyst roles.If you could refer me please let me know and I can DM you any details. Very much appreciated.YOE: 4.5",0,13,2021-3-7 00:19:14,/post/Indeed-GitHub-and-Zoom-referrals-p3w5p7K7,Indeed
0,Salary at Indeed Seattle,processDea,/company/Amazon/,nan,any insight into salaries for Senior engineers at Indeed Seattle?,11,4,2017-2-6 03:50:42,/post/Salary-at-Indeed-Seattle-VdYV4UFt,Indeed
0,Indeed offer / H1B visa,dow,/company/Microsoft/,nan,"I have verbal offer for engineering role from Indeed.I am on H1B visa. People working in Indeed on H1B, does company take good care of work visa and any problems related to that?Please let me know.",1,6,2018-12-5 19:03:07,/post/Indeed-offer-H1B-visa-NWXpsFUh,Indeed
0,Indeed onsite interview,damnddd,/company/Oracle/,nan,"Had indeed interview 2nd  week of feb,Architecture,  resume deepdive, code reviews were great,Out of 2 whiteboard session, 1 was great, in another session need some guidance,Code exercise was able to come up with solution but few test cases passedIts a really long day and exhaustive process,  do they consider all those factors in consideration?What do you think about decision?@indeedTc 120k austin",0,4,2020-2-29 20:22:21,/post/Indeed-onsite-interview-reRcOGT5,Indeed
0,Indeed Seattle SWE-2 TC,jobsrch,/company/Microsoft/,nan,I have got an offer from Indeed Seattle for SWE-2. What is the expected TC ?Asking for SWE-3 recruiter says that is a principal/staff in other companies.Currently L63 with 8 YOE,3,11,2018-10-10 16:05:49,/post/Indeed-Seattle-SWE-2-TC-q5VWAdvh,Indeed
