,post_title,post_user,post_firm,post_position,post_text,post_like,post_comment,post_timestamp,post_url,company
0,Question about Indeed interview,kakaroto!,/company/Amazon/,Eng,Any Indeed employees willing to answer one question I have about your interview process? Would like to keep this in DM.Thank you.Sde2240k TC,2,5,2021-5-14 16:37:00,/post/Question-about-Indeed-interview-KfNwO04K,Indeed
0,Indeed interviews?,CornerMind,/company/Microsoft/,nan,"Thinking about applying to Indeed in Seattle. Any tips on what to expect for interviews?180k TC, 2.5 YOE",2,2,2021-4-7 04:02:07,/post/Indeed-interviews-g52yG8KK,Indeed
0,Indeed Offer,indeed007,/company/Mindbody/,nan,"Level: IC3RSU:93kSince Indeed moved to new RSU allocation,  any  idea how the refreshers will look like?",0,7,2021-5-23 23:39:10,/post/Indeed-Offer-hjbGan8V,Indeed
0,Indeed interview process - UX Research ,ghksnfh,/company/McGraw-Hill-Education/,nan,What is the interview process after the initial call with the recruiter?,1,2,2021-4-20 21:12:25,/post/Indeed-interview-process---UX-Research-oOHEYcoo,Indeed
0,Amazon vs Indeed vs Robinhood,bScq55,/company/Microsoft/,nan,"Have offers from these three so far; I have other onsites and feedback pending, but need to make a decision soon. Offer breakdown:Amazon L5 (AWS)Location: SeattleTC 270k - recruiter said I'm basically maxed on this offer.HM said I did really well on the interview and that they'd expect me to hit L6 within a year or two - I'm reading this as ""if you don't hit L6 by two years you're getting PIP'd"".Indeed L2Location: TokyoTC 16M JPY (~145k USD) - trying to negotiate higher here, but the recruiter said that while there might be a little bit of wiggle room, they won't be able to move it significantly higher.Robinhood L2Location: Bay AreaOnly have verbal offer so no numbers yet. My initial call with the recruiter had them mention that they usually pay around 280k to L2.Any thoughts? WLB vs. pay and benefits for these companies? Already have other FANG on my resume so not concerned with brand name.Current TC: 🥜#amazon #amazonaws #indeed #robinhood #offer #offers",3,29,2021-5-19 03:02:59,/post/Amazon-vs-Indeed-vs-Robinhood-aD0RjNkA,Indeed
0,How is Indeed work life balance for software engineers?,42cloud,/company/Microsoft/,nan,And was there any general difference across offices before covid?,3,23,2021-5-24 00:21:51,/post/How-is-Indeed-work-life-balance-for-software-engineers-qcBSOQgz,Indeed
0,Indeed offer negotiation,ocUb83,/company/SparkCognition/,nan,I have received verbal offer for L2 Senior Software Engineer. Looks like very low ball offer based on my total experience and current comp.Offer detailsBase.     118KSign on.  22KStocks.   86KBonus 10%TC = 152K ( base+bonus+stocks)Its for Austin. Experience : 8yCurrent TC :  140K ( just base) and have stock options but its not public.I told i am looking for 200K atleast as TC. Is it unreasonable expectation for L2 austin. What would be reasonable TC for L2 in Austin?Updated offerBase.     129KSign on.  32KRSU.      123K (52K refreshers starting yr2)Bonus      10%TC = 173 ( base+bonus+stocks)No competive offers,1,46,2021-5-6 16:14:19,/post/Indeed-offer-negotiation-GvmuZWsg,Indeed
0,From Indeed to Amazon,xqUD75,/company/Indeed/,nan,"So many Indeedians leaving to go to Amazon, yet I hear it’s not a great place to work at... Is the pay whats attracting them? #thinkingoutloud",2,17,2021-5-18 00:28:32,/post/From-Indeed-to-Amazon-5ft7vPZM,Indeed
0,Indeed/Atlassian Referral Needed,lQpb40,/company/Qualys/,nan,Yoe - 7Current TC - 22 lpa#engineering #software #swe,0,10,2021-5-21 04:52:08,/post/IndeedAtlassian-Referral-Needed-F5B0Q7jr,Indeed
0,Indeed vs Rubrik,IhWR87,/company/IBM/,nan,"I’m fortunate enough to have offers in hand from both Indeed and Rubrik.I’d really appreciate it if any former or current Indeed or Rubrik engineers could give me real, no-bullshit answers to the following:- How’s the work life balance? Does it vary by team, or is it fairly consistent across the company?- How do you feel about your future at the company? Do you feel like your comp and career progression is/will be reasonable?- How are the folks you work with? Are they more competitive, or are they chill/nice? Are they competent and good at their jobs?- (This one is for the Rubrik folks) How confident are you that Rubrik will IPO soonish? It seems like there was tons of buzz about its IPO a couple years ago and then... it just didn’t IPO. What happened? Finally, which would you pick and why(this is open to everyone)? I know “TC or bust” dictates that I go with Rubrik, but I’m not a TC or bust kinda guy you know?Thanks in advance!!!Current TC: 88kIndeed TC: ~130kRubrik TC: ~145k",5,23,2021-3-12 13:05:35,/post/Indeed-vs-Rubrik-djsbrJhh,Indeed
0,Sr Manager Salary at Indeed,zYkh11,/company/Amazon/,nan,Whats a good range for Sr. Manager salary at indeed.com.current tc - 350yoe - 15+,0,4,2021-5-21 06:19:41,/post/Sr-Manager-Salary-at-Indeed-42Nbt5of,Indeed
0,Is Indeed l3 similar to google L4 ot l5?,5cent,/company/Amazon/,nan,"I recently received an offer from indeed for a l3 position. And currently have offer from google l4 & Facebook e5.Question :1. Is indeed l3 equivalent to google l5?2. What's the work pressure in l3 level at indeed?Current tc: ~215k (YOE: 8)New tc:Google : 265k (l4)( no true remote)Facebook: 400k (e5) ( remote possible but didn't talk to hr yet)Indeed : 340k (l3)(fully remote option without any salary deduct)I am inclined towards indeed for its great wlb, what's your thoughts?Some assumptions :1. I need good wlb.2. Unlimited pto.3. Remote.(Fully)4. Benefits don't lure me.#indeed #facebook #google #offer #tech",1,35,2021-5-11 19:36:54,/post/Is-Indeed-l3-similar-to-google-L4-ot-l5-XYy2Uy5i,Indeed
0,Finance at Indeed,dsp0703,nan,nan,Currently interviewing for finance director role at Indeed and stunned at how high the comp is for a corporate finance role.How is the finance group at Indeed?,0,6,2021-5-1 22:22:18,/post/Finance-at-Indeed-TYOScVdd,Indeed
0,Ghost by HR after finish 2 Karat coding Indeed ,DltO45,/company/Shutterfly/,nan,HR was very responsive in the beginning saying they can move fast. So I picked Karat on Saturday finished two coding. HR recommended redo on Mon. I redo on Tue finished 2 coding optimal and got to 3rd question discussing with thoughts.In a follow up call after Karat interview. HR told me I was doing good ect.. I said I have an offer waiting and want to interview ASAP. He told me they can only do around 2 weeks out... Got ghosted after I asked if any update for next round...Waste of time .. #karat #indeed #interview #tech,0,9,2021-5-20 21:26:40,/post/Ghost-by-HR-after-finish-2-Karat-coding-Indeed-ey8OjbkU,Indeed
0,Indeed offer evaluation,narcissist,/company/GE/,nan,I have received a verbal offer for Data Scientist role at Indeed for SeattleBase 150kJoining bonus 20kRSU 60kRecruiter told me about the vesting schedule of RSU of 3 years. What is the refresher schedule at Indeed? Is 60k given every year and vested according to schedule?My current TC at GE is 165k. YOE 5yrs. Level: Data ScientistLet me know how does that sounds?#Indeed#dataanalytics,1,9,2021-4-13 23:58:31,/post/Indeed-offer-evaluation-kksziYGL,Indeed
0,Indeed referral,PxYQ26,/company/Dell/,nan,Anyone willing to refer me at Indeed?,0,2,2021-5-17 03:48:37,/post/Indeed-referral-KgNxezfV,Indeed
0,Tips for indeed onsite,in_my_zone,nan,nan,I have Indeed onsite coming up in about a week. Looks to be a brutal process that will last 6.5 hours split over 2 days.I'm worried about 2 parts. System design and the 90 mins programming exercise. What should I expect in these rounds? What the hell type of exercise would they give that they've budgeted 90 mins for?Thank you.TC 176k at AWS,2,12,2021-3-26 18:57:56,/post/Tips-for-indeed-onsite-saBqiF1y,Indeed
0,Indeed vs Better vs Redfin,dMve55,/company/Cisco/,nan,"Hi folks,I have an offer from the three companies for senior engineer position, all pretty comparable. They end up around 220 with base+bonus+equity, and am confident of getting them to meet at a number. Or should I let them fight?I am finding it very hard to choose, if anyone has any insight, please help!The roles are pretty similar and I will get to work on stuff that will help me grow and at the same time allow me to apply the knowledge I have gathered so far.My interview process was good for all three, and based on what I saw, the culture also seem to fit what I am looking for.Just looking for advice, Thank you for posting!Edit1, I messed up with the leveling, heres what I got.Redfin: Senior SWEIndeed: L2Better: L5 #software #engineering",2,24,2021-4-8 23:36:39,/post/Indeed-vs-Better-vs-Redfin-5yNUuZde,Indeed
0,SWE@Indeed,ylPa30,/company/Amazon/,nan,"How is software engineering like at indeed ? The interviewers seemed pretty nice, and it seemed like a pretty chill place to work. That's pretty much what I got out of interacting with them though.",3,3,2021-2-24 07:29:34,/post/SWE@Indeed-Gi4QSjqZ,Indeed
0,Indeed Technical Business Analyst responsibilities?,kc101ck,/company/Vanguard/,IT,"I'm interviewing for a TBA position at Indeed, and the responsibilities listed in the application description were mainly focused on programming and development.Then, I got an updated responsibilities list from the recruiter after our phone screen, but now it's a bunch of business related responsibilities, like analyze this, research that, and one bullet point for development work.Was this a bait n switch or do TBAs at Indeed do a lot of development work?#engineering #swe",0,5,2021-5-18 18:31:09,/post/Indeed-Technical-Business-Analyst-responsibilities-R8Jm8Ua6,Indeed
0,Indeed Product Management Interview,prod_guy,nan,nan,"Currently entertaining a product role at Indeed (Austin or APAC region).I would like to know more about their PM interview process as I heard they have a unique format. Other posts don't elaborate on that much unfortunately.Should I prep anything special for their unique loop besides the standard frameworks (e.g decode and conquer, tryExponent etc.) ?Thanks! #pm #product #productmanager #indeed #interview",3,9,2021-3-20 02:01:13,/post/Indeed-Product-Management-Interview-QXvduT6c,Indeed
0,Indeed PM Interview ,JTde04,/company/Target/,nan,How does the on-site go virtually? Any tips/thoughts on what being a PM is like at Indeed? Also general culture thoughts..I’ve read through older postings but would like to hear most current. #productmanager #pm #interview,2,5,2021-3-9 17:14:44,/post/Indeed-PM-Interview-yGPn1oFE,Indeed
0,Indeed Product Scientist onsite interview,UFLR18,/company/Rakuten/,nan,"Any info about the Product Scientist onsite interview at Indeed (Japan, not sure if this matters)? My recruiter provided me with an overview of the process, but I'm not sure what/if I should study for. Right now, I'm just practicing LC and generic DS stuff, but would appreciate any specifics someone may have.#datascience",0,1,2021-5-18 09:39:19,/post/Indeed-Product-Scientist-onsite-interview-VTpvk64G,Indeed
0,Indeed frontend interview,MeyerWeb,nan,Legal,Has anyone applied for indeed frontend engineering positions? Are they LC questions or domain specific ones?,0,1,2021-4-21 04:02:17,/post/Indeed-frontend-interview-qNjP4AYO,Indeed
0,Senior engineering manager interview at Indeed,bamz123,/company/AT&T/,nan,"I just started a conversation with a recruiter for senior engineering manager position. I cleared initial screening rounds and they have scheduled virtual onsite loop that includes architecture round, resume deep dive and a management round. Can someone let me know what to expect in architecture round? Is this similar to system design?TC: 160kYOE: 16 years (Around 5 years as manager)",2,1,2021-3-9 06:10:51,/post/Senior-engineering-manager-interview-at-Indeed-nganwSLN,Indeed
0,Post-stripe onsite @_@,Ccse24,/company/Riot-Games/,nan,"Just finished my stripe virtual onsite! Everyone was indeed super nice and the interview loop as a whole was honestly the best I've ever gone through.I _think_ I did pretty well on all my technical interviews (finished early/got deep into bonus rounds), except for the debugging interview :( I think I got close to discovering the actual bug, but I couldn't quite pin point it. Am I screwed? Stripe would be such a dope place to work for I'd be bummed if I ruined it all with one bad interview...",1,29,2021-4-16 23:00:05,/post/Post-stripe-onsite-@_@-CHYt2b60,Indeed
0,Offer evaluation - Indeed Vs Seed Startup,RandomFC,/company/Amazon/,Eng,"I left Amazon in Feb 2021 for a mid sized (~100 people) startup, which is well funded (~$25 mil), and currently in its seed phase.TC Amazon: ~ 19 Lacs, all fixed (stock vesting would have started in Aug 2021)TC startup: ~ 28 Lacs (26 fixed, 11 Lacs/4 in ESOPs)Declined offer : ~ 33 Lacs (30 fixed, 10% bonus)I have cleared all rounds of interview at Indeed, and expecting an offer very soon. What should be the numbers I expect? (Anyone from Indeed India, who can help here?)Is it well advised to switch to indeed if I am looking for work quality?TOE: 1.5",3,13,2021-3-10 19:15:43,/post/Offer-evaluation---Indeed-Vs-Seed-Startup-jBsoFh0B,Indeed
0,Thoughts on TBA role at Indeed?,kc101ck,/company/Vanguard/,IT,"I'm interviewing for a Technical Business Analyst position at Indeed and am wondering if this is a software engineering position with just a different title aimed to pay you less, or if they put software engineering tasks in the job description only to then have me make power points. Thanks.Current TC $90k, not offered yet at Indeed.",1,3,2021-5-12 12:42:13,/post/Thoughts-on-TBA-role-at-Indeed-0ssMpEP6,Indeed
0,From own startup to Indeed as SPM or PM?,changing_,nan,nan,"Hi all. I've been working on my own small startup for the past several years. The product is in the HR/Talent acquisition space servicing a handful of Fortune 500 companies. We've had multiple contacts from Indeed Corp Dev in the past but nothing materialized.Since covid hit, things have been tough from a sales perspective and I'm exploring options.I have been pretty impressed by what Indeed is working on these days and am considering shutting things down (I'm the only full-time employee) and applying for an SPM or PM role at Indeed Incubator either Tokyo or Remote (if it's an option).I'm wondering if anybody here has any insight into the Indeed apply/interview process or if any Indeed PMs or SPMs are able to chime in?Additionally, are there any Indeed folks here who are currently in Tokyo who are able to speak to the environment/WLB? (I have experience living in Tokyo and speak intermediate-level Japanese)Massive thanks for any advice/insight.#indeed #indeedtokyo #productmanager #startup #productmanagement #pm #spm #product",1,4,2021-4-22 16:58:45,/post/From-own-startup-to-Indeed-as-SPM-or-PM-gbCAgYNu,Indeed
0,failed a senior interview because I didn’t drive the system design conversation 🥺,nozama-,/company/Amazon/,nan,"Basically I didn’t keep talking so gave interviewer the chance to say “now let’s define the api” or “now let’s work on the high level architecture “🥺Got down leveled to sde2 levelEven though the feedback is that my design indeed makes sense and I talked about trade offs and my approach of scaling makes sense, but I was not driving it so didn’t meet the senior barDoes it make sense to you?",2,11,2021-5-8 00:00:14,/post/failed-a-senior-interview-because-I-didnt-drive-the-system-design-conversation-🥺-QCvySMPu,Indeed
0,Karat Interview. Should i redo?,quorious,/company/Amazon/,nan,"Had a Karat interview today for Indeed.Solved first question completely with all test cases.For the second question, the code worked fine post which he asked me to perform some code beautifications ( remove global variables and vectors etc), while i was doing them, ran out of time.The interviewer said, you are almost there, so i will give you credit for the same.Shall i redo? Or am i good?Amazon, 4yoe, 240k, Seattle#karat ",0,5,2021-5-8 15:16:24,/post/Karat-Interview-Should-i-redo-ztX2WN1W,Indeed
0,Indeed vs. Microsoft offers,dazedconf,nan,nan,"Senior sw eng at MS. Not sure about Indeed title.Total target comp in the high 200s, Indeed is a bit higher, all cash and there's room to negotiate, potentially bringing it to 10% more than the MS offer. MS probably not much room to negotiate at that level, big part is in stocks with vesting schedule.Edit: also, why one or the other?",5,23,2018-5-7 15:35:47,/post/Indeed-vs-Microsoft-offers-f1E5EBer,Indeed
0,Just Accepted Indeed Senior SWE offer!!,Teal'c,/company/Amazon/,Eng,#indeed,25,73,2020-8-16 20:45:28,/post/Just-Accepted-Indeed-Senior-SWE-offer-KAvXooJN,Indeed
0,A rape at indeed.com,TBiR26,nan,nan,https://www.vice.com/en_us/article/y3zgzj/woman-sues-indeed-alleging-she-was-raped-by-a-coworkerTruly sad. As a former employee I can't say I'm surprised that sales bro culture needed to stop.,13,44,2020-5-19 02:40:07,/post/A-rape-at-indeedcom-xzfqpWP3,Indeed
0,Indeed onsite,IXX,/company/Oath/,nan,How's Indeed at SF doing? Or just overall how's Indeed (engg) work culture? How worth interviewing/accepting offer on a scale of 1-10?TC: 180k,1,20,2018-8-7 06:36:28,/post/Indeed-onsite-oLUYMXRe,Indeed
0,Indeed vs Wayfair offer,VoLd3,/company/Capital-One/,Other,"Indeed - Business Intelligence Analyst role (Austin location).Wayfair - Strategy & Analytics Manager role(Boston location).YOE: 7.5TC is almost same for both(high 140s) but Wayfair’s is in Boston which is more expensive than Austin.I was really impressed by Indeed’s work environment and the team. Also, Indeed has better perks than Wayfair. However, Wayfair’s is a Manager role (with 2 direct reports initially).Which one would you chose? Any pros or cons of either company?Please share your thoughts in comments.I am looking for suggestions in terms of future growth potential, work-life balance, comp/benefits comparison.",0,23,2018-8-7 19:47:32,/post/Indeed-vs-Wayfair-offer-45VcM6JQ,Indeed
0,Indeed Karat Interview,kan12693,/company/Amazon/,nan,"Hi all,I've interview in upcoming Saturday for swe role.I tried to find resources for karat indeed interview, but not able find.Can someone help me to figure out preparation and resources ?I'll very thankful.#indeed",0,9,2021-1-25 03:45:57,/post/Indeed-Karat-Interview-3n2gLv3g,Indeed
0,Dropbox or Indeed?,t23mn2,/company/Facebook/,nan,I am leaving FB (for personal reasons) and have offers from Dropbox and Indeed (both Seattle). Both offers are similar and around $300k (well Indeed's is cash while Dropbox's is RSUs). I met with the folks and liked the people and culture at Indeed way more than Dropbox. Any thoughts or recommendations?,6,36,2017-9-29 01:14:59,/post/Dropbox-or-Indeed-hc5O1VMK,Indeed
0,Indeed IPO ,qkcnfi,/company/Viasat/,nan,I am ready for a career move so started googling random open positions. Found that Indeed was one of the big players that is hiring crazy but don’t see any news of it wanting to IPO. Most of the tech companies all have a plan on going IPO or already IPO. Any reason why Indeed is staying private?,1,17,2019-5-3 19:56:18,/post/Indeed-IPO-tM3vFyXw,Indeed
0,Indeed Comp Drop,IndeedBA,/company/Indeed/,nan,If you're a tech recruiter looking for easy pickings... Reach out to Indeed engineers.  We just got our RSUs and they are garbage. Happy hunting.,3,10,2021-1-22 23:34:17,/post/Indeed-Comp-Drop-qdrQpBSi,Indeed
0,Indeed Singapore Salary,qLGe68,/company/Flipkart/,Eng,"Hi,How much is the TC for a Full Stack Software Engineer with 6 YOE in Indeed Singapore? Please provide break up of the TC as well.",6,12,2018-8-6 11:07:44,/post/Indeed-Singapore-Salary-UNaOFkSs,Indeed
0,Indeed LTIP,egvip,/company/Expedia/,nan,Anyone have historical pricing for LTIPs at Indeed? I have an offer for 60k that vest in 3 years and was wondering about what that would be worth? I’ve found threads on Blind where people mentioned ~$2 per LTIP share was average but that was from a few years ago. Just wondering how 2019 and 2020 looked for LTIP valuation.,2,26,2020-9-22 00:35:56,/post/Indeed-LTIP-OCxMhrYF,Indeed
0,"[🇮🇳] Upcoming Karat inverview, Indeed",i’ll.LC,/company/Microsoft/,nan,"Hello 🙋🏻If someone can share few or all Indeed tagged LC questions (Not preferring to buy LC subscription just for that 🥲)Or, in general if there is some advise / experience with their Karat round?For the TC train, 50.something, 6yoe choo choo 🚂💨While we are at it, folks, fellow Indeedians,Any TC datapoints for Staff engg?Levels .fyi is empty meh 😕",0,32,2020-12-4 12:19:25,/post/[🇮🇳]-Upcoming-Karat-inverview-Indeed-yH2z6L67,Indeed
0,Indeed stock price ,AppleCuter,/company/Apple/,nan,One of my ex-manager is asking me to explore opportunities @ Indeed. It’s a very introductory talk. I wanted to get an understanding of what is the current stock price of Indeed. Revenue profits etc,2,9,2017-10-9 02:23:16,/post/Indeed-stock-price-gB6S8cQJ,Indeed
0, indeed karat interview,ItsNotFair,/company/Wayfair/,nan,"Hi all,i have an interview scheduled with karat for sr.software engineer. can someone please provide any inputs or share previous questions not sure what to expect#indeed #karat #interview #helpinpreparing",2,26,2020-1-30 22:29:40,/post/indeed-karat-interview-BFTth2hf,Indeed
0,"Offer negotiating, Facebook vs Indeed",JbUW27,/company/Mozilla/,nan,"I have one firm offer in hand and in writing from indeed, and have been promised an offer from Facebook (they are trying to get headcount released early before Christmas for me).User Researcher, L4 at indeed, IC5 at Facebook, both remote roles.IndeedBase: $140Sign-on: 10k1 year anniversary: 10k3 year anniversary: 87k10-15% bonusesPlus their new RSU plan starting next yearFacebook, no idea. I have told them I have another offer, but not sure what their comp range is. Recruiter wouldn't share with meShould I wait another couple days for facebook, or just sign with indeed? Do you think I can get a bigger sign-on from indeed? They did come in 5k lower on base than I asked for.  #offer",0,13,2020-12-19 15:51:46,/post/Offer-negotiating-Facebook-vs-Indeed-oygGyN7L,Indeed
0,Anniversary Bonus @ Indeed,jamC27,/company/Indeed/,nan,"I am planning to resign after I complete 12 months at Indeed. My offer letter says I will get an anniversary bonus worth more than 15k USD ""on first payroll after i complete 1 year"".Let's say I joined 1-July-2017. 1. If I give notice to resign on 1-Jul-2018 (and notice period being 30 days) to resign effective 1-Aug, would I still get anniversary bonus?2. If I give notice on 15-Jun and leave the company on 15-Jul, would I still get the bonus?I know i shouldn't risk it and resign effective 1-aug but I really can't stand being in this company and I would like some time to travel before I move.",2,20,2018-5-20 23:41:22,/post/Anniversary-Bonus-@-Indeed-eyOyB0iv,Indeed
0,Facebook vs Indeed,TickTok,/company/LinkedIn/,Biz Dev,I am about to get the offers from both? Need suggestions to pick one and say bye to LinkedIn?Current TC 290kPosition Senior Software EngineerExp: 9 yrsApplied for Senior Software Engineer onlyFB for their internal app team called productivity which is not R&D(Engineering)Indeed for R&D,0,39,2018-10-18 00:57:39,/post/Facebook-vs-Indeed-kSAZ7AZm,Indeed
0,Indeed onsite interview,bzee,/company/Microsoft/,Eng,"I have an onsite coming up for Indeed and I am excited for that. Heard a lot of good reviews about it on blind. Can someone help me in understanding the onsite process. I know it has 2 whiteboard rounds, 1 code review, 1 architecture, 1 coding exercise and 1 resume deep dive. What's the difficulty level for whiteboard and coding exercise? How does the code review work? I have not seen this before in any other interview. Any pointers around this would greatly help. Thanks.",2,15,2019-12-18 20:24:36,/post/Indeed-onsite-interview-hnQd5PKp,Indeed
0,Karat interview - Indeed,KBcR21,/company/TDS-Telecommunications-LLC/,nan,"Hello !I have a Karat interview scheduled for next week for indeed. I looked in the history/search, nothing meaningful came in the search. I'd like to know sample questions to know how to prepare for the interview. I have done almost 300 LC questions so far. 44 hard. Please DM me or I can DM let me know.#indeed #karat",0,7,2020-7-14 20:11:46,/post/Karat-interview---Indeed-6YN1gJqD,Indeed
0,Indeed pay bands?,MDYQ51,/company/Amazon/,Eng,I just had an on-site at Indeed and my lunch buddy mentioned that Indeed had internally released the pay bands for all the different roles and levels. Anyone from Indeed care to share that here?,3,25,2019-9-18 01:04:12,/post/Indeed-pay-bands-wo10gndE,Indeed
0,Indeed Singapore,zvKt41,/company/Visa/,nan,"Hows culture in Indeed Singapore since Its recently setup ( ~ 1 year ). Is It as good as in US ? Also, As per blind, Indeed has good culture while Glassdoor reviews are not encouraging. Is it treated as one of the offshore center ?",5,11,2019-3-21 23:30:11,/post/Indeed-Singapore-oDx5jyzO,Indeed
0,Indeed offer,tchunter,/company/Viasat/,nan,It’s been three weeks since my recruiter said they would extend me an offer. I haven’t seen any number since then. Is Indeed always this slow giving the numbers? My recruiter said it’s waiting for the final approval and has been there for a awhile. Why can’t they improve the process?Also what can I expect for a L2 offer at Indeed Austin?Thanks Blinders.2 YOE  TC 100k,3,17,2019-4-17 19:29:18,/post/Indeed-offer-OU6FZBQW,Indeed
