,post_title,post_user,post_firm,post_position,post_text,post_like,post_comment,post_timestamp,post_url,company
0,Karat interview -- indeed,z3nn,/company/Amazon/,Eng,"I completed 2 karat interviews for Indeed's process.1) Did well on the questions, then the coding problem I didn't finish the 2nd iteration of the problem.2) Did just OK on the questions -- finished the 2nd of the coding problems, and I think my solution was relatively optimal. Not sure if I got the time/space complexity 100% right.Curious from Karat/Indeed folks what they would expect from this -- am I likely to move on to the next step in the process? Additionally, I am curious if someone really sits and watches the entire interviews, and what they look for during that.#engineering #software #swe",1,3,2020-12-25 04:42:19,/post/Karat-interview----indeed-cdSMdQgK,Indeed
0,Indeed,jbBM01,/company/Oracle/,nan,"What's the culture like at Indeed in Austin,TX? And is the pay for Sales managers competitive?",1,25,2016-7-7 21:59:15,/post/Indeed-t1ndswBH,Indeed
0,Indeed Virtual Onsite ,GqnC21,nan,nan,Has anyone gone through indeed virtual onsite? How was your experience?I have done around 700 LC#indeed #interview #engineering #swe,2,9,2021-1-14 11:58:59,/post/Indeed-Virtual-Onsite-ju3q0ihf,Indeed
0,Is Levels.fyi Indeed salaries real?,iks067,nan,nan,"For a SWE2 at Indeed, does Levels.fyi get the salary right? Is this indeed what ""Indeed"" pays out? I've seen previously on here that they offer LTIPs and quarterly bonuses. Where the @Indeed SWE at?",4,8,2018-10-31 02:26:43,/post/Is-Levelsfyi-Indeed-salaries-real-iumpVtGM,Indeed
0,Indeed Tokyo,psanet,/company/Amazon/,nan,I have been offered an engineering manager position at Indeed Tokyo. Does anyone know how the culture at Indeed Tokyo is? Recruiter said that they are growing very fast and it would be a great time to join Indeed. How true is that?,4,62,2017-2-9 05:19:19,/post/Indeed-Tokyo-QUm5S27h,Indeed
0,Indeed manager salary,nfs,nan,nan,"Hey, I have an interview coming up and I'm wondering how much does a Manager (leading team leads) makes annually in Indeed (base + bonuses)?Thanks",2,23,2018-7-27 05:24:39,/post/Indeed-manager-salary-3pAEx7oS,Indeed
0,Indeed vs Amazon ,Starcraft2,nan,nan,"Hypothectically, I got an offer from both of these companies in Austin and both are interesting teams. 2 YOEIndeedBase 120kBonus 12k-24kSignon 10k 10k 10k (Sign on for 3 years)LTIPs 30k (Might be lower but targeted. Vest on 4th year)AmazonBase 117kSignon 23k 23kRSU 25k(average over 4 years)Heard that Indeed has a great working environment and great WLB but not sure about the brand name vs Amazon.Which would you choose?",1,18,2019-7-19 14:28:28,/post/Indeed-vs-Amazon-0Ajc8yy3,Indeed
0,Indeed onsite difficulty?,applebot,/company/Amazon/,nan,"Have an on-site for indeed coming up in some weeks for Senior SDE. Any thought about difficulty?Currently planning to go through Indeed marked questions, revisit Designing Data Intensive Applications.",2,6,2021-1-12 19:54:14,/post/Indeed-onsite-difficulty-oWfJpzT6,Indeed
0,Indeed vs InMobi,babagee,nan,nan,Both the tc are similar at staff level in India except that InMobi is not yet IPO but there might be appreciation when goes ipo. Primarily factors are wlb and tc. yoe: 9Comp for first two years. Indeed comp will be same for first two years while inmobi may give refreshers.Indeed : 50 + 18(annual bonus) = 68Inmobi = 55 + 15(annual stocks) = 70.5,2,19,2020-9-17 05:50:16,/post/Indeed-vs-InMobi-ecr0M8Bj,Indeed
0,Fanatics vs Indeed,120537,/company/Microsoft/,Eng,I have 9 years of experience. Currently I have offer from Fanatics for Senior MTS and Indeed for Software Engineer with similar compensation. Indeed is very secretive about their internal job level. They are not revealing it before employment.What would you advise?,1,23,2018-6-20 10:38:34,/post/Fanatics-vs-Indeed-PEfD4Rnm,Indeed
0,Indeed vs Go daddy,reddysrd,/company/Mindbody/,nan,Hi I have offers from Indeed & Godaddy. total comp is same. Which is better?( indeed is LTIPs),2,25,2020-1-21 01:35:49,/post/Indeed-vs-Go-daddy-PnUu83OL,Indeed
0,Indeed hiring?,PYXJ26,/company/Amazon/,nan,"Hi all, I recently passed the onsite for indeed and am currently stuck at team matching for over a month now. Just wondering if indeed is freezed at the moment or there's been over hiring? Will there be more openings this year? This is for L2 swe in the Seattle location btw.",3,4,2020-9-23 20:23:13,/post/Indeed-hiring-KVTz2g7p,Indeed
0,Join Indeed! - 6k headcount in 2019,unikorn,/company/Indeed/,Other,"I'm over sr. software engineers, leads, and managers. PM me!Indeed:We're a multi-billion dollar company with only 700 SWE's globally. You will be the wheel and NOT the cog.220 Million unique visitors / 7 terabytes of data generated daily / 180 engineering teams spread across 70 different products in various stages of development.When you join you pick the team. Go back into rotation w/o interviewing if you'd like. 4% attrition rate among engineers globally.Our teams are small (7-15), autonomous, release cycles are daily/weekly - we focus on distributed environments, scale and producing beautiful code. 90% of of projects are written in Java or Python.Pick whatever language you want for our interviews.Open PTO.Tech Offices hiring:SF / Mountain View / Seattle / Austin / Singapore / Hyderabad / TokyoPS - engineers work roughly 35 hours a week. Our TC depends on seniority and location but around $200k-$500k easy. We're cash heavy...Comp structure:Base, sign on, anniversary bonus, LTIPS vest on year three - PM me!",25,78,2018-12-3 19:46:46,/post/Join-Indeed---6k-headcount-in-2019-zVXq23Xb,Indeed
0,Indeed APM Interview ,wZnu45,/company/Amazon/,nan,Recently got invited to the second round interviews for the indeed APM program which is their creative product challenge. Does anyone have some info about Indeed’s APM program and what it’s like and interview tips? How does it compare to  Fb Google or Uber’s programs?#pm #product #productmanager #indeed #new grad #apm,2,5,2020-12-10 05:54:53,/post/Indeed-APM-Interview-FrkHrmwT,Indeed
0,Indeed Hyderabad review? ,ObrF06,/company/Apple/,nan,"Looking for TC info, work culture, work quality, refresher and opportunities to move abroadYOE - 8 TC - 80+ LPA INR#indeed #indiasalary",6,22,2020-10-14 10:24:44,/post/Indeed-Hyderabad-review-fvysqFVT,Indeed
0,#indeed #interview ,dragonhead,/company/HBO/,Eng,"Just gave an interview for indeed through karat, we had audio and video issues. Finished first problem and 80% of second . Was unable to run he code it had a couple of compilation issues but worked.Interviewer said his feedback was  I took time to understand question. , obviously due to audio issuesHe said he is going to make a note .I have a redo option and they will send both feedbacks to indeed.Just wondering if I should do a redo or simply wait for the result ?Any suggestions please let me know , I have less than 24 hours to make a choice",0,19,2019-5-12 05:37:06,/post/indeed-interview-7kQSb6ha,Indeed
0,Working at indeed,Orares,/company/Oracle/,nan,"Any blind members working for indeed ? How’s the work culture there ? How’s the comp and package ?Anything to be concerned about ? Recruiter reached out to me , in the area of ML and data science",6,28,2018-2-7 03:35:51,/post/Working-at-indeed-eChEZCPE,Indeed
0,Indeed Team Matching,ocUb83,/company/SparkCognition/,nan,I was told by the recruiter that he received positive feedback after my virtual onsite interview and the next step is finding team match. Does anyone recently went through that process. I was not given any other info like what level its going to be etc.  I am looking for info like how long does the recruiter take to find me a team? Are there chances that he might come back and say sorry couldnt find a team. This process seems very new to me. Would appreciate any more info on this. Its been 3 days that i was told about the team match and have not heard from recruiter.How long should i wait to email recruiter just dont want him to feel that i am desparate #engineering #software #swe ,0,5,2021-4-9 20:07:59,/post/Indeed-Team-Matching-xwSSOM0h,Indeed
0,Indeed india L3 salary,AlexaIndia,/company/Amazon/,nan,"Currently at Amazon L5. Manager promised he will put me for promo in 2021 Q2. Current TC: 53LPA  2021 TC: 67LPA at current stock price and base. YOE - 10Recruiter from Indeed approached with possible opportunity and phone screen scheduled. Wanted to check before wasting my time on interviews, how much Indeed pays for L3 in India ? Also need advice from fellow blinders if I should go through the painful promo process and wait ? How is Indeed doing ?",0,12,2020-10-12 18:46:48,/post/Indeed-india-L3-salary-bfpcsbWn,Indeed
0,Indeed onsite rounds,djang0,/company/Yelp/,nan,I have onsite coming up for indeed. I see they have  unconventional interview rounds.What was the expectation in the code review round? Anything that would help.Also any pointers about the system design focus areas?Thanks!,5,30,2019-4-7 04:33:33,/post/Indeed-onsite-rounds-tSQTr5b4,Indeed
0,Indeed as a company,kelxk,/company/Indeed/,nan,"Not here to promote indeed, we have our problems but want to let the public know more about this company.Pay: Pretty decent but just not FNG decent. Two Data points I have for SWE at 2YOE150k Austin260k SFFood(Austin not sure about other office):1. Buffet style breakfast and lunch. It is really really good.2. Barista, coffee smoothies whole day3. Good pastry whole day4. Deli, sandwiches throughout the day5. Snacks, fruits, ice cream, drinks always stacked fullWLB:1. Real Unlimited PTO, at least AFAIK2. Office is almost empty at 53. Not a lot of pressure if you get things done4. A lot more product than just job searchBad part:1. Promotions seems hard2. Company is going through reorg hence the previous hiring freeze which is being lifted3. Company is promoting brand more now, so people use to think Indeed as a no name company4. Not big in Seattle or Bay AreaNote: I am in the engineering department",10,92,2019-9-2 04:43:33,/post/Indeed-as-a-company-V5bHg3HY,Indeed
0,Indeed manager compensation,griesrt1,nan,Mgmt,"Indeed peeps, What’s it like working at Indeed? Also, I’m looking for a reference for the engineering manager position I applied for.",2,23,2019-7-18 22:26:56,/post/Indeed-manager-compensation-ehNQGSnh,Indeed
0,Indeed Salary Structure,notamanger,/company/LinkedIn/,nan,What are the different rewards other than base salary for a non-eng team member in Indeed? Something like:1. Bonus2. LTIP unitsIs anniversary bonus rewarded to all non-eng team members?Is there anything else I’m missing? Please help#salary,1,4,2019-11-18 17:45:01,/post/Indeed-Salary-Structure-2w8i0nPT,Indeed
0,Indeed offer negotiation ,Ism,/company/Microsoft/,Eng,I got a confirmation from HR that they will go ahead and extend and offer. I have 7 years of experience. I have an offer from Uber too ( TC 36 base+ 14 stocks+ 6 joining ). I got to know indeed has something called LTIPS against RSU. Need help in understanding how LTIPS work and how much base I should as for. Thanks in advance,4,32,2018-9-23 04:06:30,/post/Indeed-offer-negotiation-uGuxXoUV,Indeed
0,Indeed Instituting WFH Globally,velvettaco,/company/Indeed/,nan,"Starting tomorrow.Who’s next in tech?ETA statement (in part):Indeed’s top priority is the health and safety of our employees. As the COVID-19 coronavirus evolves into a global health concern, we have made the decision to ask all employees to work from home until further notice. Our goal is to minimize the risk to employees and help to lower the probability of the spread of the virus to you, your families and the communities where we operate.#coronavirus #covid-19 ",13,43,2020-3-4 04:01:04,/post/Indeed-Instituting-WFH-Globally-Zx4O8aKd,Indeed
0,Come join me at indeed,Zingone,/company/Google/,Eng,"I wasn't thinking about indeed. You are probably not thinking about indeed. But give it a try. The interview process was awesome. Everyone I met was very intelligent but humble. And the offer VERY competitive. Unlimited PTO. Good WLB from everything I am hearing. And good technical challenges to be solved. I am starting February as a Principal Engineer, $600k TC all cash, with no 4 year cliff.",31,152,2019-1-13 20:15:17,/post/Come-join-me-at-indeed-gGYLoZTQ,Indeed
0,Indeed Prime,wokefest,/company/Lyft/,nan,"Received this Indeed Prime email, is this really the base at Indeed?@Indeed #indeed",0,15,2018-2-21 19:56:25,/post/Indeed-Prime-zjH2N7AN,Indeed
0,Karat interview for indeed,ichY13,/company/Fanatics/,nan,Can anyone help let me know what kind of questions will be asked in the karat interview? Understand it's 15 min theory and 45 min coding. Wanted to know experience,1,10,2019-2-7 23:48:39,/post/Karat-interview-for-indeed-NEXyo0bt,Indeed
0,"Help with offer / negotiating, Indeed, Atlassian, Stripe, Zillow",KafeKafe,nan,nan,"Hello all,Thanks to you fine folks in my referral thread, I have been moving forward with these companies in particular, for full-time remote positions. I have an offer from Indeed, 170k TC 3 years, increasing to 210k on year 4. I anticipate an offer from Atlassian, and I haven't had the virtual onsite for Zillow and Stripe yet.I want to know how to handle negotiating with multiple companies. I have not given my current salary out to anyone, but I feel that despite that common advice, when I don't give out my current salary or ""expectation"", I often get lowballed because I live in the Midwest, despite companies being able to offer more (and the fact that I actually have a comparatively high salary for the midwest).Should I tell the other companies I have an offer, and for how much? Should I tell them that what I really want is $x, when I know that some of them (Stripe) could probably pay more than that? If/when I get an offer from one company, how should I handle it with the other companies? If I get a counter-offer, should I return to the first company and give them a chance to respond?I feel that making the right decision here could dramatically impact my finances for years to come.Also, general advice on these companies? Atlassian and Indeed seem to have pretty good culture, from what I can tell.Thanks!#atlassian #indeed #stripe #zillow #tech",2,11,2021-1-17 15:43:02,/post/Help-with-offer-negotiating-Indeed-Atlassian-Stripe-Zillow-Z0FbLX05,Indeed
0,Oracle is Now Indeed Part of FAANG(O) Group of Companies,ClaymEA-II,/company/Oracle/,nan,"Given the accelerating industry recognition of OCI as the first and only advanced Gen2 cloud out there, and increasing customer adoption, we can now clearly make a case for OCI to be added to the FAANG group of companies.OCI has ignited a cultural transformation within Oracle that is spreading like wildfire, and the rest of the company is adopting OCI tools, processes and Gen2 cloud mentality.We have attracted thousands of Gen2 cloud thinkers and veterans from FAANG companies, further reinforcing and accelerating Oracle’s transformation.All of this strongly supports OCI as the newest member of the FAANG group of companies. It will not be long until Wall Street recognizes the “O” in FAANGO as belonging to OCI.Our hard work over the past seven years is starting to pay off in a big way.#engineering #software #swe #cloud #oci",1,54,2021-4-4 19:24:16,/post/Oracle-is-Now-Indeed-Part-of-FAANGO-Group-of-Companies-HvGT1F5g,Indeed
0,Indeed hiring freeze,KjRH32,/company/Expedia/,nan,"I have been inverviewing for a position at Indeed and the recruiter called me today and said that they were just told that all hiring was frozen company-wide. I checked and they have pulled all job postings from their site.Anyone know anything more about this? I know that the world is scary and unpredictable right now with coronavirus, but I was a little surprised by a complete freeze. I wouldn't have expected a material change to a company's resourcing strategy unless they saw covid as an existential, long-term threat to the business. I'm hoping that this is management just hitting the pause button for a couple of months to make sure that the market dosen't fully bottom out, and that my role will open back up soon.But wanted to see if anyone had any more clarity / info. Thanks.#indeed #coronavirus",1,8,2020-3-19 05:23:29,/post/Indeed-hiring-freeze-urHcZA2b,Indeed
0,Indeed onsite ,yclT64,/company/Uber/,nan,I have an interview with Indeed coming . It would be great if someone who recently interviewed can share experience.,0,4,2020-11-30 07:03:59,/post/Indeed-onsite-GmdGDisq,Indeed
0, indeed onsite,LuLs76,/company/IBM/,nan,#software #engineeringHi. I have an onsite round with indeed in a couple of weeks. Would doing leetcode problems with company tag indeed suffice?  Any tips for preparation would really help. Thank you#indeed,1,6,2020-8-14 03:58:23,/post/indeed-onsite-PwYrwKV4,Indeed
0,Indeed career levels,ocktopussy,nan,Eng,"Can anyone explain what career level should a C++ developer with 7 years of experience get in Indeed? Is it SWE 3 or 2?I’m coming from a startup background so I have nothing to compare from. However, I think I’am worthy of being. Senior Developer or VP in Investment Banking.Current compensation is around 16M¥ (160k usd approx)",0,24,2018-9-2 06:52:52,/post/Indeed-career-levels-Yd6Yfxbt,Indeed
0,Indeed l2 band?,zqpqp,/company/Amazon/,nan,"Got an offer last week verbally. Do they match Amazon TC? The interviewers seemed very nice and culture seemed pretty good to be honest.Anyone from Amazon or similar companies move to indeed recently? Any thoughts, even if not?Yoe 3.5Tc 230-250ish",2,2,2021-2-9 06:27:32,/post/Indeed-l2-band-WA1GppaT,Indeed
0,Indeed Tokyo Senior Software Engineer Salary,helpy,/company/PayPal/,Eng,"I have couple of questions for you guys. Please help me out with whatever answer you can. I am being considered for SSE @ Indeed Japan.1. With 6.5 yoe, is SSE a good position to pursue or I should wait and try for Staff Engineer in an year or so? 2. Looks like the max base for SSE is 14.4 million JPY? How much competitive it is for Tokyo? 3. What is the maximum TC I can expect from them? 4. Any first hand experience anyone living in Tokyo in terms of living cost for a single person although I plan to get married next year or so. What are the parameters to consider while deciding on Tokyo salary? 5. How is the culture there?TC: 90k outside US#tech #indeed #sde #software",2,23,2020-11-4 05:32:24,/post/Indeed-Tokyo-Senior-Software-Engineer-Salary-MmidXBvD,Indeed
0,Engineering manager @ Indeed (Sunnyvale),timhortonz,/company/Airbnb/,nan,"I'm fairly happy at Airbnb but thinking about looking around to see if there's a greener grass :) Also, my commute sucks so having a few exploratory calls with LinkedIn, Netflix.Found a role at Indeed that looks interesting. Indeed doesn't have a lot of exposure here so I was wondering if someone could shed light on engineering culture at Sunnyvale office, manager's day-to-day (coding? design/arch decisions or mostly people management?). It seems like a few postings for EMs are evergreen. They couldn't feel them for a long time?Also, how technical are the interviews? I'm a bit rusty with algo/ds problems so would be interested if I should potentially allocate more time to prepare.Location: Bay areaTC: 500kYoE: 10",2,34,2020-2-17 04:10:52,/post/Engineering-manager-@-Indeed-Sunnyvale-h4HXoODY,Indeed
0,Indeed SWE interview,aCVY25,/company/Charles-Schwab/,IT,"Just wondering if anyone can give a good idea of what the software engineering interview at indeed is like? I have one coming up and wasnt getting a good idea from online. I am not sure what level I am interviewing for, but I only have 3 yoe so can't imagine it is very high. I am just trying to gauge what to expect in terms of difficulty and what areas to particularly focus on when studying.How does it compare in difficulty to other companies? Harder or easier than FAANG? The onsite process seemed pretty intense (2 days of interviews) from what my recruiter said and I was a little surprised by that.",1,13,2020-8-28 20:38:09,/post/Indeed-SWE-interview-grjK56SY,Indeed
0,Failed Indeed and Amazon: India,sudo fu,/company/C2FO/,nan,"Yet another post.I interviewed at SDE2 level at Amazon, Indeed. And at SDE3 level at sub top-tier companies. I keep hearing that my design skills aren't at the level they are seeking. Even the offers that I have (from Bangalore), interviewed for SDE3 to SDE2. BUT I did get upgraded from SDE2 to SDE3 from companies in Delhi. I understand the quality difference so ignoring Delhi offers. Not to forget, the various Bangalore companies that keep rejecting my CV, either because I am from Delhi (I know this because the 2 bangalore offers told me) or because maybe due to lack of sys design. (I had to stay in Delhi due to certain family reasons, even chose college in Delhi even though I had cleared better ones.)My question is this: How on earth do I get good enough in System Design for ""senior enough level"" when I don't get any design experience or mentorship at all? And this is not even taking into account the fact that if and when I start it out, I am bound to make mistakes and not really deliver perfect results. I keep hearing you have bookish knowledge and lack of experience shows. Damn right because I keep reading because I want to clear the damn companies. I feel like hitting them with a cricket bat. Caught in this cycle now.I was quite confident of Indeed design round, more so than Amazon. Even if I recall my Indeed interview, I cannot think of what went wrong. All efforts to increase the scope were stopped. It was a simple CRUD they asked and maintained that scope. Now, am scared to join even the offers that I have and looking for a safe job where I just get by. YOE: 6Shortlisted Offers: HealthifyMe (28L + 4L JB), Cyware (34L + 1L JB + 2L Perf Bonus) #offer #techEdit: A little misunderstanding. I am not looking specifically for SDE3. I was interviewing for SDE2 in Amazon, Indeed. I was automatically interviewed for SDE3 at other places, and downgraded automatically as well. I am not choosing anything. I just want a branded company so that I don't plateau 5 years from now.",3,9,2020-10-14 07:51:12,/post/Failed-Indeed-and-Amazon-India-pghQqUe3,Indeed
0,Indeed team match,IhWR87,/company/IBM/,nan,"I just got my results from my Indeed SWE Austin on-site - I passed (woo hoo!) and got leveled as L1, which I expected since I have a little less than 1 YOE. My recruiter told me there are no L1 spots open in Austin right now, so the team match could take a few months or not happen at all (!!)Is this normal or is there something funky going on? And if any Indeed Austin folks have L1 openings on their teams, I’d be much obliged 👀. I really want this to work out (Indeed sounds like a great place to work) and would appreciate any help/advice. Thanks in advance!YOE: ~1TC: 88k#tech #indeed #austin",4,6,2021-3-4 23:38:58,/post/Indeed-team-match-kYp7pddO,Indeed
0,Indeed Austin referral,VwHu6,/company/Wargaming/,nan,Hello! I am interested in TPgM - SMB role in Austin and would like to chat with people who could give me a referral and some insights. Thanks!#indeed #austin,0,2,2021-5-10 18:34:24,/post/Indeed-Austin-referral-tDQASzmf,Indeed
0,Getting fired from Indeed process,l1l0l1ll,/company/Amazon/,Eng,I've been dealing with some mental health issues and my performance has been very bad for some time now. I believe my manager has me in a dev plan and I don't blame her.. she hasn't told me explicitly yet.What does the process look like at Indeed for getting let go due to bad performance? Is it similar to Amazon?,5,10,2021-3-29 17:19:49,/post/Getting-fired-from-Indeed-process-ew7A7mJ5,Indeed
0,Indeed Referral,czNc61,/company/Raytheon/,nan,Found a role at Indeed the aligns really well with both my interests and background and am thus seeking a referral. Can send my resume and LinkedIn over DM!YoE: 2TC: 🥜#referral #indeed,0,4,2021-1-6 00:09:58,/post/Indeed-Referral-Ob21nnvF,Indeed
0,Indeed India,ylSz15,/company/Samsung/,nan,What is work quality at Hyderabad office of Indeed ? #engineering #software #swe,0,1,2021-1-29 23:12:05,/post/Indeed-India-prmSVVyA,Indeed
0,Joining Indeed as SWE3 ,hCUk60,/company/Microsoft/,nan,Joining in a couple of months. What the tech stack typically and any advice on how/what to prepare to get started at Indeed ?TC - 310k,6,34,2019-3-23 06:07:58,/post/Joining-Indeed-as-SWE3-qdLM6dMp,Indeed
0,Karat indeed interview questions?,oDaq14,/company/Microsoft/,nan,Any karat sample questions from folks who interviewed recently in indeed swe position?,1,7,2021-2-13 04:24:02,/post/Karat-indeed-interview-questions-ow1LGKNZ,Indeed
