,post_title,post_user,post_firm,post_position,post_text,post_like,post_comment,post_timestamp,post_url,company
0,Interview advice for Morgan Stanley technology division,Yyzg,/company/NetApp/,nan,"How does Morgan Stanley interview for entry level developer position in Technology division.How is their work culture, learning curve and technology?",2,6,2018-9-21 16:02:26,/post/Interview-advice-for-Morgan-Stanley-technology-division-NU7k6zPV,Morgan-Stanley
0,Base salary for FAAs at Morgan Stanley in Florida?,Magna777,nan,nan,"How much was your base salary while you were an FAA (Financial Advisor Associate) at Morgan Stanley? Pls specify city and state. Most interested in Florida, specifically Aventura / Miami area. I’m brand new to world of finance. #morganstanley #financialadvisor #faa #financialadvisorassociate #finance",0,1,2020-10-12 14:46:58,/post/Base-salary-for-FAAs-at-Morgan-Stanley-in-Florida-sxCVcs43,Morgan-Stanley
0,Morgan Stanley Vs J P Morgan Chase. Which is best for better tech career path?,solo8,/company/IBM/,Eng,I am expecting offers from both of them soon and thinking if there is any preference among these two. I am planning to join as a full stack software developer. Any guidance would be helpful.Thanks.,1,21,2020-7-15 04:21:08,/post/Morgan-Stanley-Vs-J-P-Morgan-Chase-Which-is-best-for-better-tech-career-path-b2UTpEU7,Morgan-Stanley
0,Wayfair vs Morgan Stanley for SWE,lhoh00,/company/Morgan-Stanley/,nan,Which one is overall good for software engineering career?YOE - 3 yrs,1,5,2019-7-22 20:57:51,/post/Wayfair-vs-Morgan-Stanley-for-SWE-ptP8p3Ve,Morgan-Stanley
0,"Need advice to choose from PayPal India, Morgan Stanley India, etc",de123,/company/Fractal/,Data,"Hi, I am a data engineer, need advice for the next job change.YOE :- 4MS offer: - 35 fixed +5 variablePaypal: -Would be similar but more stocks as part of CTC.TC :- 16.25at this YOE what should I select and which companies are better than these in terms of pay, work and wlb?##softwareengineersalary #dataengineer #salarynegotiation #salarycomparison #morganstanley #indiasalary #data #dataanalytics",1,7,2021-3-23 03:38:13,/post/Need-advice-to-choose-from-PayPal-India-Morgan-Stanley-India-etc-JpOKskSh,Morgan-Stanley
0,Interview with Morgan Stanley Algo Trading Services Group ,St_de,/company/Siemens/,IT,I have an upcoming initial telephonic interview for this team. It is for a senior C++ developers position. Please help me with following:1: How to prepare for interviews in MS.2: How to present my answers to resonate with MS and this team?3: Any insights on hiring process in this company.I am already revisiting Leet code and C++ theoretical questions. #MorganStanley #interview #engineering #vicepresident,0,3,2020-9-19 16:08:21,/post/Interview-with-Morgan-Stanley-Algo-Trading-Services-Group-sA32JODf,Morgan-Stanley
0,"Referral for Morgan Stanley  (PhD grad, astronomy+ML)",DKmu87,nan,nan,"Hey all,I graduate in May with a PhD from an R1 state university. My research lies at the intersection of astronomy and ML, in a field called astrostatistics. I have a number of first author papers, and have also presented at NeurIPS. I have identified three jobs at Morgan Stanley (all VP level, according to their website) for which I could be a strong fit, but I don't know anyone there, and would really appreciate it if someone could give me a referral!#finance#referral#morganstanley",1,2,2021-2-5 04:18:27,/post/Referral-for-Morgan-Stanley-PhD-grad-astronomyML-XgLEWips,Morgan-Stanley
0,What’s the ballpark comp for VP positions in IT at Morgan Stanley? ,blackrock,/company/BlackRock/,nan,What’s a a good base + bonus estimate to give when talking to Morgan Stanley recruiters in NYC ?,2,18,2018-4-4 19:55:54,/post/Whats-the-ballpark-comp-for-VP-positions-in-IT-at-Morgan-Stanley-fVprnJx2,Morgan-Stanley
0,Morgan Stanley back office hiring and levels,oldee,nan,nan,"Looking at vp dev at back office. Are they hiring? I ask because I see some post about layoffs. Doesn't sound like it's a good time to join .. or is it?Also, what are the qualifications needed to get ED, which I believe is above vp.Also, what teams are front office at Ms? I hear they get more salary, so what should the JD say?",0,1,2020-2-7 01:53:20,/post/Morgan-Stanley-back-office-hiring-and-levels-zPxY6hco,Morgan-Stanley
0,Do Morgan Stanley sponsors h1b for software engineering roles,selo ,nan,nan,"I am looking for a software Engineering roles at Morgan Stanley but unsure about they sposors software enginners or not. So, wanted to know if they sponsors. Thanks in advance!#engineering #software #swe",0,8,2020-7-2 21:46:02,/post/Do-Morgan-Stanley-sponsors-h1b-for-software-engineering-roles-nwhw2aK1,Morgan-Stanley
0,Seeking referral for Goldman Sachs/Morgan Stanley,FakeDonald,/company/Yahoo/,nan,I am seeking a full time job as a Business Analyst/Program Manager/Product Manager st Goldman Sachs or Morgan Stanley. Can anyone who work their please refer me?,1,0,2017-9-21 21:36:52,/post/Seeking-referral-for-Goldman-SachsMorgan-Stanley-aMKwo4GY,Morgan-Stanley
0,Is Robinhood app allowed for trading in Morgan Stanley for Spouse,RVAE6,/company/Fractal/,nan,I wanted to check if Spouse can use Robinhood app  for trading who doesn’t work in Morgan Stanley,0,7,2020-12-4 23:34:44,/post/Is-Robinhood-app-allowed-for-trading-in-Morgan-Stanley-for-Spouse-nhewWP0y,Morgan-Stanley
0,Does Morgan Stanley have a required YOE for AVP title/comp?,RLXi21,nan,nan,"Interviewing for an AVP position at MS. Only have 2 YOE and the recruiter did mention that I’m interviewing for an AVP role with an AVP salary. Both recruiter and hiring manager have seen my resume and have mentioned my YOE. Was told from a MS friend that when they came aboard, the same thing happened to them and when they were finally offered, MS said they needed to have a certain amount of YOE to be AVP and lowered the offered salary significantly to an associate salary/title. Figured I shouldn’t ask if they haven’t brought it up yet. Have already had a chat with the recruiter and on third round now.Is this a hard company policy/will it happen to me? Or is this something that used to exist and they got rid of? Or maybe an organizational rule?Thanks!#MorganStanley #InvestmentBanking #Finance #IB",1,3,2021-3-28 17:08:11,/post/Does-Morgan-Stanley-have-a-required-YOE-for-AVP-titlecomp-X3FEGTRN,Morgan-Stanley
0,Virtual onsite with Morgan Stanley Trading Systems group,St_de,/company/Siemens/,IT,"Hi All, Any insight on what to expect from this interview? In past when I interviewed with MS it was heavily on C++ and easy leet code. This position is based in NYC. This is my first time for virtual onsite, any input on it is highly appreciated.  #engineering #software #morganstanley #C++seniorDeveloper",0,2,2021-4-13 18:31:55,/post/Virtual-onsite-with-Morgan-Stanley-Trading-Systems-group-Jhd1f5m7,Morgan-Stanley
0,Which company is better for a fresher- Morgan Stanley or VISA? (India),xoRp85,/company/Morgan-Stanley/,nan,I am facing hard time in taking this decision. Morgan Stanley Analyst program vs Software Engineering in Visa.(salary benifits not much difference),2,7,2018-5-19 17:54:00,/post/Which-company-is-better-for-a-fresher--Morgan-Stanley-or-VISA-India-gsbiQiQP,Morgan-Stanley
0,Seeking a Morgan Stanley referral for my wife ,SauceBaus,/company/The-Depository-Trust--Clearing-Corporation-DTCC/,nan,"Hey all,Seeking a referral for an entry level marketing role within PWM for Morgan Stanley for my wife. Would be more than glad to engage further if desired!",0,0,2020-7-27 16:24:37,/post/Seeking-a-Morgan-Stanley-referral-for-my-wife-7LWJ8TEr,Morgan-Stanley
0,Seeking advice about -Frontend/UI developer interview @Morgan Stanley Bangalore,QSob48,nan,nan,"I have received a call for interview from Morgan Stanley for Bangalore location and  cleared the  screening hacker rank test for frontend tech stack which was mainly focused on Angular. Looking for some guidelines on the kind of interview questions being asked in further rounds. Does it includes Data Structures and algorithms too or only specific to frontend technology?Below are few details :Designation : Senior Software EngineerTotal Experience: 5.1 yearSkillset: Frontend Technology stack(HTML, CSS, JS, Angular, ReactJs)Does anyone have came across with similar kind of interview? If so, can you please invest your precious time for assisting me here? #tech #morganstanley #interview #finance",0,1,2021-1-4 14:12:29,/post/Seeking-advice-about--FrontendUI-developer-interview-@Morgan-Stanley-Bangalore-phiPc8Li,Morgan-Stanley
0,Will E*Trade platform migrate onto the Morgan Stanley one?,yOjl47,/company/Yahoo/,nan,"Morgan Stanley/Etrade closed on their merger recently, but no one on accounts moving. Thoughts on Etrade platform migrating to the Morgan Stanley? Etrade is pretty good, not familiar with Morgan Stanley, but hope they don't get rid of Etrade's platform.#etrade #morganstanley",0,0,2020-10-6 19:28:27,/post/Will-ETrade-platform-migrate-onto-the-Morgan-Stanley-one-LP3wdkXc,Morgan-Stanley
0,Seeking advice about -Frontend/UI developer interview @Morgan Stanley Bangalore,QSob48,nan,nan,"I have received a call for interview from Morgan Stanley for Bangalore location and cleared the screening hacker rank test for frontend tech stack which was mainly focused on Angular. Looking for some guidelines on the kind of interview questions being asked in further rounds. Does it includes Data Structures and algorithms too or only specific to frontend technology?Below are few details :Designation : Senior Software EngineerTotal Experience: 5.1 yearSkillset: Frontend Technology stack(HTML, CSS, JS, Angular, ReactJs)Does anyone have came across with similar kind of interview? If so, can you please invest your precious time for assisting me here?#tech #morganstanley #finance #interview",1,1,2021-1-4 14:13:57,/post/Seeking-advice-about--FrontendUI-developer-interview-@Morgan-Stanley-Bangalore-NUaTKfZq,Morgan-Stanley
0,Is Morgan Stanley safe to join in these times?,layofffffs,/company/Informatica/,nan,#engineering #software #swe #morganstanley #jobopening #hiring #investmentbanking,2,2,2020-7-18 01:36:57,/post/Is-Morgan-Stanley-safe-to-join-in-these-times-pu0ync1a,Morgan-Stanley
0,Does anyone use Morgan Stanley wealth management?,determin8r,/company/Google/,nan,Particularly the San Jose office. Anyone have good results?,1,0,2018-1-23 20:49:10,/post/Does-anyone-use-Morgan-Stanley-wealth-management-RUeybLUN,Morgan-Stanley
0,Can anyone help with a refferal for Morgan Stanley or Goldman Sachs? ,Nirvana31,/company/Mars/,nan,would be very thankful for a help,0,17,2020-8-15 08:34:29,/post/Can-anyone-help-with-a-refferal-for-Morgan-Stanley-or-Goldman-Sachs-Wmenbp8S,Morgan-Stanley
0,How long does it take to get money in account from Morgan Stanley? ,claytons,/company/Amazon/,nan,Hey...Need money for a home purchase. How long does it take for money to get to my account after I sell in Morgan Stanley? #investments #investments #Amazon #rsu,0,1,2020-11-12 07:22:56,/post/How-long-does-it-take-to-get-money-in-account-from-Morgan-Stanley-3GV8vUWU,Morgan-Stanley
0,What should i expect in a 30 min phone interview with morgan stanley?,Randomboy,/company/SITA/,nan,Can someone please tell me what shall i expect in a 30 minute morgan stanley phone interview for a java developer profile?HR told me it is with the hiring manager.,1,4,2018-9-19 17:25:18,/post/What-should-i-expect-in-a-30-min-phone-interview-with-morgan-stanley-NUwVA6Gv,Morgan-Stanley
0,"Has jpm, Citi, HSBC, Morgan Stanley provided their employees $200 wfh expense?",highflye,/company/Barclays-Investment-Bank/,nan,When did your companies say you can come back to office?,0,18,2020-6-22 07:51:45,/post/Has-jpm-Citi-HSBC-Morgan-Stanley-provided-their-employees-200-wfh-expense-gEFQpekj,Morgan-Stanley
0,Associate Software Engineer position at Barclays Bank (NJ) vs Morgan Stanley (NY)?,R9704,/company/Deutsche-Bank/,nan,Which one would be a better pick? Similar base compensation. #engineering #software #swe,3,13,2020-10-7 18:59:48,/post/Associate-Software-Engineer-position-at-Barclays-Bank-NJ-vs-Morgan-Stanley-NY-ibT2W2oP,Morgan-Stanley
0,"Looking for referral at Bloomberg, Goldman Sachs, Morgan Stanley, PayPal, Stripe and Visa",rujcsss,/company/Amazon/,nan,Currently Software Engineer at Amazon.YoE 2TC : 18 Lakhs,0,8,2020-5-1 06:27:19,/post/Looking-for-referral-at-Bloomberg-Goldman-Sachs-Morgan-Stanley-PayPal-Stripe-and-Visa-BWdgD0GU,Morgan-Stanley
0,"""Former Morgan Stanley financial adviser charged with stealing $6 million from clients""",acctngsx,/company/Hyundai-Capital-America/,nan,Hmm perhaps another reason I shouldn't use a financial advisor lol... thoughts? Surprised it took 12 years to get noticed.https://www.google.com/amp/s/amp.cnn.com/cnn/2020/07/21/investing/morgan-stanley-adviser-fraud/index.html,0,3,2020-7-23 06:27:14,/post/Former-Morgan-Stanley-financial-adviser-charged-with-stealing-6-million-from-clients-CnL6N5Lm,Morgan-Stanley
0,How does internal mobility work at Morgan Stanley? Can we negotiate on position and TC?,aparichit,/company/Morgan-Stanley/,IT,#tech #mobility,0,9,2020-11-22 23:47:47,/post/How-does-internal-mobility-work-at-Morgan-Stanley-Can-we-negotiate-on-position-and-TC-a5oLMc10,Morgan-Stanley
0,How is work culture at Morgan Stanley Bengaluru?? Can I make my Career there?,googgg,/company/Informatica/,nan,#engineering #software #morganstanley #culture ,2,0,2020-7-14 05:06:47,/post/How-is-work-culture-at-Morgan-Stanley-Bengaluru-Can-I-make-my-Career-there-zqMEKLW3,Morgan-Stanley
0,Interviewing with Morgan Stanley for VP position in Client Connectivity Services team based in NYC,GAXY67,/company/Siemens/,IT,Kindly please help me understand what to expect from interview. I am scheduled for 1st telephonic interview and was told by recruiter that following rounds will be remote with Corona Virus issue. I have 11+ YOE and C++ developer. Also please provide insights on salary expectations. Thank You.#MorgonStanley #CPP #technicalprogrammanager #VP,0,5,2020-3-16 03:45:08,/post/Interviewing-with-Morgan-Stanley-for-VP-position-in-Client-Connectivity-Services-team-based-in-NYC-t7SDuJv8,Morgan-Stanley
0,"What’s it like working as a data scientist for finance companies like Goldman Sachs, Morgan Stanley, S&P Global, etc.?",YsKJ85,/company/Doximity/,nan,Do they use macbook and open source tools like tech companies or stuck with MS stuffs and SAS?,1,4,2019-5-12 03:16:38,/post/Whats-it-like-working-as-a-data-scientist-for-finance-companies-like-Goldman-Sachs-Morgan-Stanley-SP-Global-etc-pxXXxC2F,Morgan-Stanley
0,What is a good wealth management firm?,malc ,/company/Roku/,nan,I am looking at Morgan Stanley and Goldman Sachs to manage my assets. Anyone have experience with them? Is it worth it? Are there better firms?,0,5,2021-5-21 18:19:54,/post/What-is-a-good-wealth-management-firm-EUwRmRck,Morgan-Stanley
0,Advice needed before joining,skdp,/company/Twilio/,nan,"I have recently joined Twilio. I have other offer in hand from Morgan Stanley. Morgan is giving high base, no stocks.I am in dilemma. Shall i stay here or move to Morgan.Twilio has given moderate base + stock as compensation.Twilio TC : 38L (19.5 L base + 14.5L rsu per year till 4yrs  + 3.7L sigon)Morgan Stanley TC: 27.5 L base + 2.5 L relocation bonusCan you guys advice,  should i give more focus upon base or the overall TC. Overall TC of Twilio is more.I am also thinking whether joining investment banking a good choice or should I remain here as Twilio is a tech company and new to India.Can you also provide reasons for your vote.My priorities are good wlb, good techstack to work upon, good TC, growth opportunities.Yoe: 4",4,32,2021-5-12 11:02:58,/post/Advice-needed-before-joining-x48JYUrf,Morgan-Stanley
0,Transfer vested stocks,nice_guy,/company/Amazon/,Eng,How do I transfer vested stocks from Morgan Stanley to Robinhood?,7,10,2018-7-27 15:54:46,/post/Transfer-vested-stocks-JKjaLyXo,Morgan-Stanley
0,Tech scene at BBs,\\m//,nan,nan,"Which BBs invest heavily in tech and have interesting work? How different is technology division in second tier BBs like Citi & Barclays as compared to the top players like Goldman Sachs, Morgan Stanley and JP Morgan?TC: 🥜",4,30,2020-9-17 15:11:13,/post/Tech-scene-at-BBs-gEcqc7vo,Morgan-Stanley
0,Not sure whether JPMC lowballing me.,jravi96,/company/Morgan-Stanley/,nan,"I will be leaving Morgan Stanley soon. I have been given 50+% hike, but I feel JPMC is lowballing me.Exp 8.10 yearsCCTC - 17.16 lpa + variable bonusOffered CTC - 26 lpa + variable bonusTitle - Associate. Grade - 602.Role - software engineerDivision - corporate and investment banking.Please share your thoughts.#jpmorganchase #morganstanley #tech",0,9,2021-5-22 03:24:56,/post/Not-sure-whether-JPMC-lowballing-me-7XBizzKd,Morgan-Stanley
0,How much do you work with financial advisor?,G31,/company/Google/,nan,"For those who use financial advisors (human ones like JP Morgan or Morgan Stanley, not Wealthfront or Titan etc.), how much assets do you have invested with them?",0,31,2019-12-27 21:34:02,/post/How-much-do-you-work-with-financial-advisor-ZyVTHoAC,Morgan-Stanley
0,Expecting offer need help in negotiating,1yearexp,/company/Walmart/,nan,"Expecting offer from Morgan Stanley, How much hike I can negotiateJava developerExperience 8 year'sCurrent CTC fixed : 30LOverall: 44LOffered senior manager",1,10,2021-5-12 18:32:36,/post/Expecting-offer-need-help-in-negotiating-H74pjwU3,Morgan-Stanley
0,Microsoft negotiate offer after accepting(india),yaPL54,/company/Walmart/,nan,Yoe:11L64Fixed :52LPARSU: 115k usdBonus: upto 30% of fixedNo joining bonusI was not happy with this and not able to negotiate as I didn't have any other offer. I was expecting more rsu and joining bonus.But still I accepted it 2 weeks back. Now I got an offer from Morgan Stanley.. yet to get number but I have informed them about my Msft offer so I hope it would be more than Msft offer. Now will I me able to negotiate in Msft with Morgan Stanley offer?#negotiateoffer,1,18,2021-3-12 17:32:15,/post/Microsoft-negotiate-offer-after-acceptingindia-JJYsHVOA,Morgan-Stanley
0,ETRADE - Green card filling,SgMh14,/company/Accenture/,nan,Anybody from ETRADE can suggest what is the green card filling policy? How soon they file after joining? Specially after acquisition by Morgan Stanley.,0,0,2021-4-29 23:55:12,/post/ETRADE---Green-card-filling-gzd06sr8,Morgan-Stanley
0,Top/Prestigious Companies to work for in 2021 Better,Iwish,/company/Wish/,nan,"I've seen one too many garbage company-ranking lists on this site. So here is the official list, methodology is based on senior swe salaries + prestige:Tier 0: HRT, Jane Street (Top Quant Firms)Tier 1: Google, Facebook, Netflix, Snap, Stripe, Robinhood, Pinterest, Airbnb, Two Sigma, Citadel, Databricks (Prestige or $400K+ TC for senior)Tier 1.5: Uber, Lyft, Twitter, TikTok, Apple, Slack, CoinbaseTier 2: Amazon, Microsoft, DoorDash, Snowflake, Roblox, Wish, LinkedIn, Square, Splunk, Salesforce (300K+)Tier 3: Tableau, Bloomberg, Quora, Palantir, Datadog, Yelp, IBM, Oracle, Adobe, PayPal, Twilio, Visa, GS, Morgan Stanley, Nvidia, Walmart Labs, etc (&lt300K)Tier 💩: WITCH (💩 TC < 200K)",310,882,2021-1-2 09:40:13,/post/TopPrestigious-Companies-to-work-for-in-2021-Better-7mwmqWVM,Morgan-Stanley
0,Highest Paid,Hfih57,nan,nan,"How much do investment banking summer analysts make in a summer in New York? JP Morgan , Morgan Stanley, and Goldman Sachs?",1,1,2019-3-4 03:48:21,/post/Highest-Paid-UVDE4VHK,Morgan-Stanley
0,Corporate Swag for Virtual Interns,palisade,/company/Hyundai-Capital-America/,nan,"What kind of corporate swag are your virtual interns getting this summer? Apparently Morgan Stanley is  giving its interns iphone, computer monitor, keyboard and mouse.https://news.efinancialcareers.com/uk-en/3004064/morgan-stanleys-virtual-interns-get-a-temporary-iphone",0,13,2020-7-3 06:43:57,/post/Corporate-Swag-for-Virtual-Interns-LZCPYwFF,Morgan-Stanley
0,Notice Period India,hmcbmcbmcm,nan,nan,"Hi Guys, Can employees from the following please give some information about Notice Period of their company in India offices.- Amazon - 1 Month- Linkedin- Microsoft - 1.5 Month- Google- Atlassian- Adobe - 1 Month- Jio- Salesforce - 1 Month- Intuit- Apple - 2 Month- Twitter - 1 Month- Indeed- Expedia - 1 Month- Nvidia- VMWare - Done- Intel - Done- Flipkart - 1 Month- Inmobi - 1 Month- Nutanix- Morgan Stanley- JP Morgan - Done- Uber - 1 Month- Tower Research- Wissen- Goldman Sachs- Codenation - 2 Month- Zomato- DE Shaw - 2 Months- Sprinklr - 1 Month- Arcesium - Done- Harness- Udaan- Swiggy- Sharechat- Samsung - 2 Months- Paypal - 3 Months- MuSigma - 6 Months- Dunzo - 2 Months#Linkedin #Google #Uber #Adobe #Apple #Facebook #Salesforce #Intuit #india#Amazon #Rubrik #Nutanix #Slack #goldmansachs #Atlassian #Twitter #Square #Databricks #Visa #Intel #Zoom #Gojek #Grab #microsoft #Jio",14,107,2021-2-8 10:43:07,/post/Notice-Period-India-ntD7as2w,Morgan-Stanley
0,Wow Morgan Stanely buys Etrade for 13billion,CTWx26,nan,nan,Dont we have members on Blind from both companies? what do you all think?https://www.nytimes.com/2020/02/20/business/dealbook/morgan-stanley-etrade.html?searchResultPosition=1,2,29,2020-2-20 17:11:00,/post/Wow-Morgan-Stanely-buys-Etrade-for-13billion-6fTEADCh,Morgan-Stanley
0,Will E*Trade platform migrate to Morgan Stanley's?,yOjl47,/company/Yahoo/,nan,"Morgan Stanley/Etrade closed on their merger recently, but no one on accounts moving. Thoughts on Etrade platform migrating to the Morgan Stanley? Etrade is pretty good, not familiar with Morgan Stanley, but hope they don't get rid of Etrade's platform.",0,5,2020-10-6 19:46:02,/post/Will-ETrade-platform-migrate-to-Morgan-Stanleys-HPTqvWfA,Morgan-Stanley
0,Is it a good time to buy QuantumScape?,aplyrpb,/company/Adobe/,nan,Morgan Stanley upgraded price target to 70 and the stock is way below its peak in Dec.#personalfinance #investments,1,3,2021-2-12 17:35:23,/post/Is-it-a-good-time-to-buy-QuantumScape-axR27mTk,Morgan-Stanley
0,Companies pledging no layoffs in the current environment. Inspirational or BS?,kalejuice,/company/Uber/,nan,"CEOs of Salesforce, Morgan Stanley, Visa, Citi have come forward and said no job cuts.How safe do you feel about your situation at your current company?",3,7,2020-3-27 16:09:19,/post/Companies-pledging-no-layoffs-in-the-current-environment-Inspirational-or-BS-BmR5v71v,Morgan-Stanley
0,Salaries,Hfih57,nan,nan,"How much do investment banking summer analysts make in a summer? JP Morgan , Morgan Stanley, and Goldman Sachs?",0,5,2019-3-2 13:09:10,/post/Salaries-3CRttJeZ,Morgan-Stanley
0,Fastest way to get into Finance?,CompToFin,/company/Morgan-Stanley/,nan,"I did my Bachelors and Masters in Computer Science with majors in Data Science and Machine Learning. I completed my CFA Level 1 and appearing for Level 2, this December. I work at Morgan Stanley in the Technology Division.Which is fastest way to get into Financial Research side of Morgan Stanley? Equity research analyst, investment banking analyst, quant research etc..?#finance #career #quant",2,20,2020-5-16 18:27:01,/post/Fastest-way-to-get-into-Finance-pxHz4Kby,Morgan-Stanley
0,Need Referral for SDE2 in India,00_7,/company/Flipkart/,nan,Current Organization: FlipkartTC: 32 LPAYOE: 4 yearLC: 291Can you please give referral me at - Apple- Expedia- Google- Indeed- Intel- Intuit- Linkedin- Morgan Stanley- Nutanix- Nvidia- Salesforce- Twitter- VMWare- AirBnB- StripeAdded More..- Alphonso- App Dynamics- Aviso- Bloomreach- Citrix- Cohesity- Coinbase- Compass- Cure Fit- Directi- Hasura- HealthifyMe- Instabase- MotorQ- Palo Alto Networks- Postman- Practo- Quadeye- Qubole- Sharechat- Snowflake- Sumologic- Target- Thoughtspot- Udaan- Urban Company- Vizury- Whatfix- World Quant- Grab- Harness- SprinklrThanks 🙏  #engineering #software #swe,5,34,2021-5-6 11:27:10,/post/Need-Referral-for-SDE2-in-India-HpLfW7OA,Morgan-Stanley
0,Salary for a Quant in NewYork,shah4,nan,nan,"What is the salary for a recent Masters in Financial Engineering graduate in NewYork for the role of Quantitative Researcher & Quantitative Trader at (A) Hedge Funds like Citadel, TwoSigma (B) Banks like Morgan Stanley, Goldman Sachs?P.S: A breakdown & After tax salary number would be a lot helpful.   #quant #finance #salary",4,10,2021-2-21 03:56:40,/post/Salary-for-a-Quant-in-NewYork-RPBVmphJ,Morgan-Stanley
0,Didn't hear cost cutting or layoffs from banks,Zhao Lee,/company/Indeed/,Consultant,"Is it safe to find a job in banks or investment firms like Goldman, morgan stanley, jpmc etc?#career #tech #layoffs",1,6,2020-5-9 18:16:36,/post/Didnt-hear-cost-cutting-or-layoffs-from-banks-ujK3QD4C,Morgan-Stanley
0,What’s the point of doing Wealth Management at at Bulge Bracket bank?,SippyDarth,/company/Mastercard/,Product,"Does it help for bschool? Do you make good money? I went to a top undergrad business school and it seems like everyone when to Morgan Stanley WM, but it seems kinda like a dead end career. Am I wrong about this? What are your thought?",1,3,2021-4-16 18:00:04,/post/Whats-the-point-of-doing-Wealth-Management-at-at-Bulge-Bracket-bank-Uw2uym2g,Morgan-Stanley
0,Operational Risk Associate TC,assckpmg,/company/KPMG/,nan,Average salary for an operational risk associate at Morgan Stanley?#finance #morganstanley,0,3,2020-10-26 21:59:55,/post/Operational-Risk-Associate-TC-YAFfydJh,Morgan-Stanley
0,Need refferals please. SDE -2 India,noCovid22,nan,Eng,"Hi, Can you please reffer me @- Adobe- Apple- Paypal- Atlassian- Flipkart- Indeed- Inmobi- Intel- Intuit- Linkedin- Morgan Stanley- Nutanix- Nvidia- Twitter- VMWareThanks.Stay safe.  TC - 23. YOE 3. #adobe #Apple #Atlassian #Paypal #Flipkart #Indeed #Intel #Intuit #Linkedin #Nutanix #Nvidia #Twitter #VMWare",0,4,2021-4-28 18:48:27,/post/Need-refferals-please-SDE--2-India-1EataOfe,Morgan-Stanley
