,post_title,post_user,post_firm,post_position,post_text,post_like,post_comment,post_timestamp,post_url,company
0,Alternate apps to Robinhood,CandyJassy,/company/Amazon/,nan,Hey have about 200k invested in Robinhood. I want to move it out to other trading platforms.Which are the free & good ones?I find the ui of fidelity pretty bad and Morgan Stanley has charges.,2,28,2021-1-10 07:45:28,/post/Alternate-apps-to-Robinhood-bORO6xzg,Morgan-Stanley
0,Where to invest for 2021?,ChrisSteve,/company/Qualcomm/,nan,Recently JPM and Morgan Stanley predicted that stock market will jump 25% in 2021. What would be the ideal investment choice to realize those or better gains with low/medium risk?#faang #qqq #stockmarket #nasdaq #facebook #amazon #apple #netflix #google ,3,22,2020-11-26 17:26:28,/post/Where-to-invest-for-2021-Y5NoNWh0,Morgan-Stanley
0,Tech role at Financial services company,jbtsndo,/company/Honeywell/,nan,"What is it like to be a software developer in financial services firms like Blackrock, Morgan Stanley, Goldman Sachs?#engineering #software #swe",1,2,2021-4-13 00:56:20,/post/Tech-role-at-Financial-services-company-G72EStip,Morgan-Stanley
0,Underpaid?,MSC007,/company/Morgan-Stanley/,Finance,Could I be making more at another brokerage house?Currently making $65k/year as a Registered Associate at Morgan Stanley Wealth Management. Fully licensed. 3 years experience. Understand and trade options.,2,16,2019-10-29 19:24:43,/post/Underpaid-eZcuF3zu,Morgan-Stanley
0,Most Ethical Finance workplaces,cV1TCU,/company/Ellie-Mae/,nan,"Wondering which companies in the finance industry we would consider to be the most ethical: BOFA, Wells Fargo, McKinsey, Bain, Paypal, Robinhood, Morgan Stanley, Blackrock, Capital One, Bloomberg etc. Is there even such a thing?",5,55,2019-5-17 00:46:00,/post/Most-Ethical-Finance-workplaces-eMDYBvG8,Morgan-Stanley
0,Referrals at Fintech,GhEv15,/company/Collins-Aerospace/,nan,"Looking for referrals at the following -Bank of AmericaMorgan StanleyMastercardOpen to any referrals, preferably in the NYC location.LC - 300TC - 💩YOE - 1, 2 Intern",0,11,2021-3-26 16:43:08,/post/Referrals-at-Fintech-3YtJu606,Morgan-Stanley
0,Which stock broker to use at Google??,LizardFace,/company/Microsoft/,nan,"Just started at Google today, the nooglers page mentions 2 brokers for receiving stock awards: Charles Schwab and Morgan Stanley. Which one is better? Or is there no big difference?I used Fidelity for stock awards when I was at Microsoft if that matters",0,18,2019-7-16 01:19:58,/post/Which-stock-broker-to-use-at-Google-f4e1sROz,Morgan-Stanley
0,Expected Salary,SenzAcqua,nan,Eng,"For a senior level engineer / lead (15 years+) who has decent full stack experience, but mostly backend experience, what salary range should I expect 1) a startup (with decent runway) to be able to pay? 2) A more established tech firm, like LinkedIn or Google? 3) traditional finance and tech, like JP Morgan Chase or Morgan Stanley?",1,26,2017-7-27 14:02:11,/post/Expected-Salary-oWO2if7B,Morgan-Stanley
0,Look at all finances in one place,nyDG04,/company/Amazon/,nan,"one account to connect cash, stocks (robinhood), rsu morgan stanley , 401k vanguard , credit cards and view a time series. anyone ?I have tried wealthfront and mint. links fail to update",2,13,2020-1-14 23:44:44,/post/Look-at-all-finances-in-one-place-uziXeQrh,Morgan-Stanley
0,H1B transfer to bank,Sw9Xui,/company/Cerner/,nan,"I've heard that some banks are really slow to apply for green card processing. Anyone know what it's like? I'm mostly interested in Chase, GS and Morgan Stanley.",1,16,2019-3-7 15:18:00,/post/H1B-transfer-to-bank-WGt0ov7T,Morgan-Stanley
0,Technology Compensation ,ESaY74,/company/Morgan-Stanley/,nan,How much should a Technology Associate with 10 years of experience make at Morgan Stanley New York?,0,11,2020-5-19 20:57:33,/post/Technology-Compensation-uran34Nw,Morgan-Stanley
0,StockPlan Connect ACATS,sikerro,/company/Microsoft/,nan,Is it possible to transfer vested stocks out to another broker (such as IB) via ACATS or other means from Morgan Stanley StockPlan connect?I only see the sell option after which one can take out the money via a wire transfer (or ACH). I dont want to do this for obvious tax reasons.I also see a button to create and link to a Morgan Stanley brokerage account but don’t want to deal with more Morgan Stanley bs.,3,2,2019-9-26 06:12:17,/post/StockPlan-Connect-ACATS-0kNuRDoz,Morgan-Stanley
0,Recession Bells?,dudeIn,/company/Indeed/,Biz Dev,https://www.bloomberg.com/news/articles/2020-03-17/morgan-stanley-economists-say-global-recession-now-base-case,1,1,2020-3-17 20:00:20,/post/Recession-Bells-wypBaDyQ,Morgan-Stanley
0,Question for stock broker,VFAv26,/company/Amazon/,nan,I am using morgan stanley stockplan connect now and just sold the long term part so now it contains both cash and short-term rsu. Planning to switch to fidelity or other brokers so I can buy or sell stock. How should I proceed? Morgan stanley only has form to authorize for stock transfer. So I have to cash out the cash part to my bank? Thanks,3,4,2020-6-15 08:04:44,/post/Question-for-stock-broker-ijA3YAou,Morgan-Stanley
0,Broker used for FB RSUs,eternally_,/company/Amazon/,nan,"Which broker does FB use for RSUs vesting?  I have read across multiple sources its Morgan Stanley, Fidelity, Charles Schwab. Can someone please confirm which is the existing broker use? #facebookbenefits #facebook",1,2,2021-3-3 18:19:24,/post/Broker-used-for-FB-RSUs-0AiwM2Li,Morgan-Stanley
0,India best companies list compilation,linkedsys,/company/LinkedIn/,Admin,"I noticed that conversations about top companies and startups on Blind is mostly US-centric.So decided to do some research and made a list of top tech companies in India categorized by factors like pay/wlb/remote-first etc.Just wanted to share it with the community.Also request you to please let me know if the list is missing any company, or if a company is categorized incorrectly.Here is the list:# Highest paying companies (40+ LPA for 3 YOE) ## High pay / Good WLB- Adobe- Apple- Atlassian- Expedia- Flipkart- Google- Indeed- Inmobi- Intel- Intuit- JP Morgan- Linkedin- Microsoft- Morgan Stanley- Nutanix- Nvidia- Salesforce- Twitter- VMWare## High pay / Unknown WLB (Didn't find much data)- AirBnB- Alphonso- App Dynamics- Aviso- Bloomreach- Citrix- Cohesity- Coinbase- Compass- Cure Fit- Directi- Hasura- HealthifyMe- Instabase- Meesho- MotorQ- Myntra- Ola- Oracle (OCI)- Palo Alto Networks- Postman- Practo- Quadeye- Qubole- Rippling- Rubrik- ServiceNow- Sharechat- Snowflake- Stripe- Sumologic- Swiggy- Target- Thoughtspot- Udaan- Urban Company- Vizury- Whatfix- World Quant## High pay / Bad WLB- Amazon- Arcesium- Codenation- DE Shaw- Goldman Sachs- Grab- Harness- Sprinklr- Tekion- Tower Research- Uber- Wissen (Consultancy having high profile clients like Morgan Stanley) - Zomato------------------------------------------------# Lower paying companies## Low pay / Good WLB- ARM- Blackbuck- Broadcom- Cisco- Confluent- Couchbase- Intel- Mathworks- Mentor Graphics- MongoDb- Oracle (other than OCI)- Qualcomm- Samsung- Slack- Texas Instruments- Visa- Walmart## Low pay / Unknown WLB- BigBasket- Box8- Bounce- BrowserStack- Chowbotics (DoorDash)- ClearTax- Cloudera- Coinbase- Cred- Dream11- Dunzo- Esper- Informatica - Jio- Jumbotail- Juniper Networks- Kuvera- MakeMyTrip- Mobikwik- Mindtickle- MokaPos- MX Player- MyGate- Navi- Oyo- Paypal- Razorpay- Redhat- SanDisk- Sprinklr- SuprDaily- Twilio- Unacademy- Upgrad- Zerodha## Low pay / Bad WLB- Grofers- Hotstar- Paytm------------------------------------------------# Unknown compensation- FalconX- Freshworks- Gojek- Groupon- Hackerearth- Policy Bazaar- Rupeek- Tokopedia- Trifacta- Truecaller- Zoom- Zynga------------------------------------------------# Visa-sponsors- Booking Amsterdam- ByteDance Singapore- Databricks Amsterdam- Facebook London- Spotify Stockholm- Yelp London- Zalando Berlin- Plenty of other options on Stackoverflow jobs.------------------------------------------------# Remote-first companies- Atlassian- Auth0- Coinbase- Datadog- Facebook- Github- Gitlab- Shopify- Slack- Square- Stackoverflow- TwitterGood websites to find jobs at startups:- tophire.co- instahyre.com50L TC with 4 YOE.#Linkedin #Google #Uber #Adobe #Apple #Facebook #Salesforce #Intuit#Amazon #Rubrik #Nutanix #Slack #Atlassian #Twitter #Square #Databricks #Visa #Intel #Zoom #Gojek #Grab #Microsoft",240,556,2020-9-20 13:26:45,/post/India-best-companies-list-compilation-QYzFSoX4,Morgan-Stanley
0,Questions about Bill Hwang situation,james2467,/company/BlackRock/,nan,"Can someone explain this portion of this article about Bill Hwang to me? What kind of team at Morgan Stanley and Goldman would have made this decision? Risk? Trading? Portfolio managers?Structurally, in terms of how these companies are set up, how is a decision like this made and executed?",0,4,2021-4-9 02:10:56,/post/Questions-about-Bill-Hwang-situation-Sh67qY1w,Morgan-Stanley
0,SWE at Game Studio vs Investment Bank?,mpaoaodbw,nan,nan,"If you got a new grad offer at a game studio like EA or Blizzard and a new grad offer from an investment bank like Goldman Sachs, JP Morgan or Morgan Stanley, which one would you rather choose for career growth, wlb, benefits and resume boost? Assume money is very similar.Please comment if you have any direct experience with either type of companies as a SWE.#tech #SWE",1,9,2021-3-15 21:30:29,/post/SWE-at-Game-Studio-vs-Investment-Bank-Go3cCLbW,Morgan-Stanley
0,Wire transfer from India,qhmX23,/company/Amazon/,nan,"Disclaimer: India specific!Has anyone transferred funds from India to Morgan Stanley US account? This is to pay cash to cover the stock taxes.How do we fill in the beneficiary details? I've seen details are to be entered such as beneficiary contact number, email address and stuff. These are not something that I have.Any recommendations on which bank to use for least additional charges!#tax #rsu #stock",0,7,2021-4-30 20:00:09,/post/Wire-transfer-from-India-5S7OiY6M,Morgan-Stanley
0,Tech Prestige Ranking,Jnhn44,nan,nan,"Inb4 ""omg another google circlejerk""I want to compile a list from a purely >>&gtrecruiter and brand recognition standpoint<<< on the most prestigious companies as a SWE.  The purpose is for us to be able to better compare having which company on our resume will give our careers an advantage when looking for the next step.For me:Tier 0 ""classic top tier tech fixtures"": FB, G, Apple, Amazon, MicrosoftTier 1 ""high valuation consumer tech startups/elite HFTs"": Stripe, Netflix, Airbnb, Lyft, Uber, Square, Dropbox, Twitter, Linkedin, Reddit, Yelp, Two Sigma, HRT, Jump, Citadel, PDTTier 2 ""doing well but less brand penetration"": Salesforce, Pinterest, Cisco, Nvidia, Groupon, Bloomberg, Palantir, Slack, Paypal, Ebay, Peloton, WeworkTier 3 ""banks and less cool tech"": JP Morgan, Cap1, Morgan Stanley, Oscar, Flatiron health, Yext, Wish, Snowflake, Databricks, Robinhood, Oracle, Redhat, Expedia, Zillow, Compass, and other companies among these linesAny recruiters want to chime in?  Other knowledgeable people please comment with your rankings if you disagree.TC 130#prestige",17,76,2020-1-16 22:05:18,/post/Tech-Prestige-Ranking-YAf6dqsp,Morgan-Stanley
0,What's TC like for FB in NYC?,rixman,/company/Raytheon/,Mgmt,"Eng Manager with 10yoe currently at 250TC looking at a few places in NYC, Morgan Stanley would not help with relo. A friend recommended FB as an alternative to fin tech. Any other good places for an EM?",2,3,2019-1-19 20:08:10,/post/Whats-TC-like-for-FB-in-NYC-AqpdCM2Z,Morgan-Stanley
0,How long is Palantir's runway?,J5FT7k,/company/Stripe/,Eng,"They've never been profitable, with flat revenue and no prospect of making money in the foreseeable future. Their valuation is now down 80% to 4.4 billion (per https://www.bloomberg.com/news/articles/2018-09-04/morgan-stanley-s-long-romance-of-palantir-pays-off-as-ipo-nears ).",5,7,2018-9-16 16:48:13,/post/How-long-is-Palantirs-runway-SK77SRZ0,Morgan-Stanley
0,What do you think of fintech companies acquisitions lately? ,rNd7yZ,/company/Capital-One/,nan,"From PayPal buying Honey to Morgan Stanley acquiring E*Trade to most recently Intuit getting Credit Karma, what do you think about all of these fintech acquisitions? Do you see more fintech being bought out?",3,11,2020-2-28 14:28:05,/post/What-do-you-think-of-fintech-companies-acquisitions-lately-YPExSU2r,Morgan-Stanley
0,Investment Banks Pay,idk_,/company/Amazon/,Eng,"So we all know tech companies pay levels from levels.fyi but how much do firms like Morgan Stanley, Goldman Sachs, etc pay for SDEs? Is it on the same level as large cap tech or a notch lower / higher?",2,8,2019-6-9 22:20:52,/post/Investment-Banks-Pay-uRasMihk,Morgan-Stanley
0,Interested in joining a 4 year old unicorn startup?,BkzB38,/company/Symphony/,Eng,"We’ve raised nearly $300M in funding from the likes of Google Ventures and a consortium of banks which includes the likes of Goldman Sachs, Morgan Stanley, JP Morgan and Citibank.We’re looking for mid to senior level software developers and architects to work out of our headquarters in Palo Alto.Company website: https://symphony.comCrunchbase url: https://www.crunchbase.com/organization/symphony-3Interested? PM me.",2,10,2018-10-23 04:30:54,/post/Interested-in-joining-a-4-year-old-unicorn-startup-uNhqsQq2,Morgan-Stanley
0,Student Interns/Coops,LT00227,/company/Dow-Chemical-Company/,Eng,I was wondering if anyone knows about the intern and/or coop programs for SpaceX and Morgan Stanley. Any advice would be greatly appreciated!,0,6,2017-7-28 13:23:26,/post/Student-InternsCoops-BqQuYe2m,Morgan-Stanley
0,Summer 2021 Referrals ,insightr,nan,nan,"Hi Blind Community,Looking for referrals for Summer 2021 Internship into any of these companiesBAML, Goldman Sachs,  JP Morgan, Morgan Stanley, Microsoft, and AmazonThanks in advance#Referrals",0,0,2020-9-2 21:44:23,/post/Summer-2021-Referrals-PnxKx6fW,Morgan-Stanley
0,Referral help needed,cJyR60,/company/Google/,nan,"Hi everyone,Requesting people from Blind community for a SWE referral for my brother (office location is flexible across various countries/states) - would be of great help during this pandemic time. Please drop a comment so that we can chat over DM.(Tagging some of the companies if it helps, however willing for most of the good options) @Amazon @Microsoft @Adobe @Cisco @Facebook @LinkedIn @Ola @Uber @Grab @Cohesity @Rubrik @Twitter @Hotstar @Zeta @Directi @Oracle @Salesforce @Intuit @Apple @Indeed @Expedia @Nvidia @Intel @Vmware @Flipkart @Morgan Stanley @JP Morgan @Goldman Sachs @Tower Research @Codenation#swe #engineering #software",0,19,2021-1-17 17:30:53,/post/Referral-help-needed-3EP7HOyK,Morgan-Stanley
0,Broker for Microsoft Stock Grant,Endgame22,/company/Microsoft/,Eng,"As a new hire, I just accepted my award. Now, I have to choose a broker. Is it better to go with Fidelity since they do our 401k? Choices are Fidelity or Morgan Stanley.",4,5,2019-5-29 04:23:00,/post/Broker-for-Microsoft-Stock-Grant-eZTXOMdn,Morgan-Stanley
0,Electronic Fund vs International wire Transfer,InTheDNA,/company/Expedia/,Eng,How are these 2 different from end user and Broker perspective?Morgan Stanley charges $0 for Electronic while $25 for International Wire.,0,2,2019-6-9 06:53:53,/post/Electronic-Fund-vs-International-wire-Transfer-yRjGNxfL,Morgan-Stanley
0,How long duration to promote from manager to sr manager in morgan,xBIM51,/company/NetApp/,nan,"If u join as technical manager with 8 yoe , how long does it take to promote sr manager in morgan stanley. considering performance is good .",0,0,2020-7-7 05:15:00,/post/How-long-duration-to-promote-from-manager-to-sr-manager-in-morgan-oTaXtC8w,Morgan-Stanley
0,"Who are the technical ""superstars"" at your company?",tsukino,/company/Google/,nan,"Renowned inventors, engineers, and scientists whom almost everyone recognizes internally, and possibly externally as well - for what are they best known?e.g.Google: Jeff Dean and Sanjay Ghemawat - distributed infrastructure (e.g. Spanner, MapReduce), ML (Tensorflow)Morgan Stanley: Bjarne Stroustrup - creator of C++ (although he invented the language earlier, while at Bell Labs)",9,31,2019-3-11 04:01:13,/post/Who-are-the-technical-superstars-at-your-company-qpjckyAA,Morgan-Stanley
0,Robinhood right platform to invest in shares?,pbgoog,/company/Google/,nan,"Is robinhood right platfom to invest in shares. I heard they have isrurance of $500,000. Does these insurances really matters and I can trust on that? or shall i go with some renowned like morgan stanley. looking to invest around 50k.",0,15,2020-2-28 10:23:49,/post/Robinhood-right-platform-to-invest-in-shares-HZyFEZGH,Morgan-Stanley
0,broker tool to recommend,perfectl,/company/Google/,nan,i am using merrill edge and wells fargo advisor to trade stocks etfsi am wondering whether there is a better tool to recommend?should i use morgan stanley or robinhood?,0,10,2020-7-18 00:53:16,/post/broker-tool-to-recommend-PmDPuU4i,Morgan-Stanley
0,Looking for referrals,xager,/company/Infosys/,IT,"Looking for referral in Banking sector or tech giants like Goldman Sachs, Morgan Stanley, Amazon, Facebook, LinkedIn, Tesla #software #engineering #python #referralhttps://repher.me/r/-MAcMu-Ie_w300fZPI1-Thanks",0,1,2020-6-24 22:22:24,/post/Looking-for-referrals-z2fu4vEB,Morgan-Stanley
0,Best brokerage firms for no-fee Options Trading,talkin,/company/LinkedIn/,nan,"I'm looking for best brokerage firms for no-fee Options Trading.My index funds are in Vanguard, Fidelity, M1Finance.My individual stocks are in Morgan Stanley and Merrill Edge.Merrill Edge has 0.65c per contract fee for options trading. I'm looking for no-fee one.Any brokerage firm suggestions?PS: Robinhood is not one, not even close.",2,8,2021-2-19 03:21:40,/post/Best-brokerage-firms-for-no-fee-Options-Trading-QwzfRpqK,Morgan-Stanley
0,All stocks in Robinhood?,nerd_dog,/company/DocuSign/,Eng,Just checked my Robinhood account and it said I can bring all my stocks to it. Anyone tried this? I'm thinking of bringing over all my vested stocks from Morgan Stanley to RH.,2,6,2017-10-14 05:38:16,/post/All-stocks-in-Robinhood-WCb7VW32,Morgan-Stanley
0,"Former Regulator, Current MS Compliance VP. What Now?",KSMMX1289,/company/Morgan-Stanley/,Legal,Regulator for 10yrs. Morgan Stanley Vice Pres in Legal/Compliance for 2yrs. No oppertunity for growth at MS. In Wash DC area. Looking for a change...any suggestions?Plus ive looked into Facebook since theyre growing the compliance/legal/risk dept here in DC. anyone have any connects in that area?,7,11,2019-8-11 16:59:19,/post/Former-Regulator-Current-MS-Compliance-VP-What-Now-xFVGaVbQ,Morgan-Stanley
0,Amazon stock after moving to different company.,h123456789,/company/Amazon/,nan,"People of blind, can I keep the vested stocks when I leave Amazon. Say if I use the same broker like ""Morgan Stanley"" at my new company as well, would it have my Amazon stocks as well?tldr: what's the process to transfer Amazon stocks on leaving?",0,9,2020-8-6 03:23:19,/post/Amazon-stock-after-moving-to-different-company-tFMUpecf,Morgan-Stanley
0,Question to the trading gurus out there,_eBay_,/company/eBay/,nan,"Morgan Stanley will pay $58.74 a share in stock for E-Trade. E-Trade stock is now trading at $34-ish, does this mean if I buy E-Trade now MS will still pay $58.74 for new stock owners after the announcement of the takeover?#investments #personalfinance",1,12,2020-3-31 20:34:05,/post/Question-to-the-trading-gurus-out-there-WCJGpmJb,Morgan-Stanley
0,Ex Palantir folks - How are you exercising your options?,teamespres,/company/Facebook/,nan,"Ex-Palantir here , with the recent jump in stock , I’m thinking this is a good time to divest my options (which is not much considering I stayed only for two yrs)But the options in Morgan Stanley portal are confusing. So here’s my qn to ex-palantir folks who are looking to sell or sold their options. What options did you choose?",2,3,2020-11-20 17:30:18,/post/Ex-Palantir-folks---How-are-you-exercising-your-options-jrOUCCHQ,Morgan-Stanley
0,Which internships would you choose?,pls_refer,/company/IBM/,nan,"Hello! I got internship offers from Microsoft (OXO team), Uber, and Morgan Stanley. I don't know much about the companies reputations in tech and really need help deciding which to go. It would probably be my last summer so I'd be going for return full-time as well!Thanks in advance blind community!TC: Current intern at Facebook",1,11,2020-10-30 05:23:06,/post/Which-internships-would-you-choose-bMhjsG3u,Morgan-Stanley
0,Trader vs Risk Analyst ,Dm20Tr,/company/Morgan-Stanley/,Sales,I got the 2 offers below - 3 YoERates Trader @ Morgan Stanley:Base 120KBonus not discussedRisk Analyst L2 @ Robinhood: Base 120KRSU 75KI was expecting more from RH based on what I read here on Blind. There is probably room for negotiation.Would love to hear the “why” in your comments !,2,6,2020-12-12 01:24:25,/post/Trader-vs-Risk-Analyst-27U1H75C,Morgan-Stanley
0,Investment in US Stock from India,Madari,/company/Microsoft/,nan,"How can I buy US Stocks from India? Looking for help in setting up of brokerage accounts. I do not have SSN.Via my employer (Microsoft), I have accounts set up in Morgan Stanley and Fidelity but they can’t be used to trade stocks other than RSU and ESPO",3,8,2020-9-1 13:59:45,/post/Investment-in-US-Stock-from-India-U0GVXhWL,Morgan-Stanley
0,Would internal mobility affect bonus ? ,QnmS24,/company/Morgan-Stanley/,nan,"Currently working at Morgan Stanley (tech), and I was given my bonus/raise details last week. But the money doesn’t really come in until like Feb 3. If I were to apply to a job posting internally, to move within MS, would I be at risk in forgoing the bonus?",0,6,2021-1-25 17:03:17,/post/Would-internal-mobility-affect-bonus-gVZ6Gr5H,Morgan-Stanley
0,Is working at an investment bank looked down upon in Tech?,[^•^],/company/Morgan-Stanley/,Eng,"I have started my career with Morgan Stanley as a Technology Associate (SWE). 1 YOE. Is working at a bank looked down upon in tech? Will it be difficult for me to transition to real tech companies like Google, Facebook? Does working at a bank hurt my chances to get an interview with them?",2,5,2018-11-13 18:23:37,/post/Is-working-at-an-investment-bank-looked-down-upon-in-Tech-LtCkgPnC,Morgan-Stanley
0,How is the work in Visa inc Bangalore.,funkie,/company/Amazon/,Eng,"Is the director role senior enough with good charter, or it's like a lame role like Engg manager or Sr. engg manager, where u have just to listen. Is this a proactive role? In Bangalore, is it a real director role or it's fake like financial domain companies like Morgan Stanley or Fidelity.",1,4,2018-2-28 17:25:04,/post/How-is-the-work-in-Visa-inc-Bangalore-cHhJB6Gv,Morgan-Stanley
0,Best APM/PM new grad roles in NYC? ,atoms-,/company/Morgan-Stanley/,nan,"I’m graduating next year, and I want to stay in NYC and join a new grad APM/PM role.I know Google/FB have APM rotations in the NYC, and I was wondering if there are ones you’d recommend applying to?I’ve also seen LinkedIn, Uber and Lyft have NYC offices with a few experienced PMs but I don’t think new grads can relocate to them.Would appreciate any thoughts you have :)(I interned previously at Morgan Stanley and I also have a few PM internships)#productmanagement #pm #apm #nyc",2,6,2021-4-18 14:26:18,/post/Best-APMPM-new-grad-roles-in-NYC-WaxpBeJp,Morgan-Stanley
0,How do you file you taxes?,Txhlp,/company/Amazon/,nan,"Trying to file tax for the first time. Which website do you use to file your taxes? Any tips and tricks to make it easy is appreciated!I currently have investments in Morgan Stanley, Betterment and Wealth front. #taxEdit 1Are all tax websites paid or do you use websites which offer free filing too?Edit 2Which websites offer seamless integration with the above mentioned investment websites? I see that import of MorganStanley 1099 fails in TurboTax and  looks like that's a known issue. ",0,15,2021-3-7 03:24:13,/post/How-do-you-file-you-taxes-32ZCWRq6,Morgan-Stanley
0,Vested RSUs after leaving Amazon ,job11,/company/Amazon/,nan,I am planning to leave Amazon and wondering what would happen to my vested RSUs on leaving.Will I still be having access to Morgan Stanley account?Does it cost any annual premium to keep this account active? Will I need to pay it from my pocket from now on?Ex-Amazon please help.#engineering #software #stocks,0,3,2020-11-18 23:14:12,/post/Vested-RSUs-after-leaving-Amazon-K25mpVRc,Morgan-Stanley
0,Comp range for VP at capital one or TD or AMEX,pinwin,/company/Amazon/,nan,"Can someone from financial technology please  share comp range for VP role? Also, what is the comp structure?Please note, VP title at these FIs is much more senior and is NOT the same as VP title at banks like JPM or Morgan Stanley.Thanks!",0,3,2017-7-12 00:26:35,/post/Comp-range-for-VP-at-capital-one-or-TD-or-AMEX-AV7PiYAm,Morgan-Stanley
