,post_title,post_user,post_firm,post_position,post_text,post_like,post_comment,post_timestamp,post_url,company
0,Summer Intership updated offer taking to long,RoboXx,nan,Eng,"I got an internship offer at Siemens in Berkley for this summer, I asked for the housing accommodation 2 weeks ago, in between I got an update that manager has verbally approved the housing stipend and I will receive the updated offer by the end of this week. I have not received it yet, should I be concerned? I have mailed my coordinator asking why it's taking too long and is there any way I can help? Should I be concerned about this taking to long and update the HR?",1,1,2019-1-26 02:38:24,/post/Summer-Intership-updated-offer-taking-to-long-v0HNdmtd,Siemens
0,Tough Times !! Mechanical Engineer Job referral appreciated from Blind community,nUNn87,/company/ABB/,nan,"Asking out for a friend.My friend recently graduated with masters in mechanical engineering in Dec-2019. He is looking out for an entry-level position. He has done all the prep for an interview, but not getting interview calls for full-time opportunities. Please help him out. Any kind of interview help is much appreciatedArea of interest :  ""Design and Manufacturing"" Skills: Design, CAD-CAM,  FEM, Solid Works, BOM, Creo, Abqus, Project Management, Engineering Support, Assembly Drawing, Mechanical Design.YOE : 0 (straight out of bachelors then did masters)TOC : 0#Job #fresher #Mechanical #Manufacturing #Engineer #Microsoft #Google #Apple #Lockheedmartin #ge #waltdisney #ford #tesla #fordmotors #Siemens #Amazon #GE #ABB #Honda #Subaru #Hyundai #Shell",2,10,2020-4-8 03:51:46,/post/Tough-Times-Mechanical-Engineer-Job-referral-appreciated-from-Blind-community-GrnvA45b,Siemens
0,MS in US/Germany post covid?,Ksow07,/company/Siemens/,nan,"Hi, I am a new joinee in the tech industry and I work at Siemens, India. However, lately I have realised that I ain't going to learn much technical stuffs if I continue working here. So, I started planning for masters at the beginning of 2020 but unfortunately covid-19 happened.I am still resilient about Persuing MS  either in US/ Germany.My question to the community: 1)Is it worth sending hefty amount for an ms in us (hardware domain, embedded systems) or getting done from Germany? 2) Eventhough there are lots of hassle in immigration/visa policies , do you think current president elect is going to relax few?Note: I have 2+ years of work experience as of now.Looking forward for suggestions.",1,1,2020-12-28 07:20:25,/post/MS-in-USGermany-post-covid-Z68rov4W,Siemens
0,How to become a Research Scientist after PhD,IEEE75252,/company/IEEE/,nan,"I finished  PhD in electrical engineering from an average university. My coursework and research papers belong to Machine Learning, Robotics, Artificial Intelligence, Computer Vision, Statistics, and Signal processing.I do not have any background in tele-communication, network, electromagnetics, power system, power electronics, integrated circuits, solid-state devices, semiconductors, photonics, MEMS, nono ...   Unfortunately many people think electrical engineering means either power systems or electronic circuits.My H index is 5 and my citation is more than 100. Next year, I can reach to H index of 7 and more than 200 citations.I would like to work as a research scientist, not applied scientist, not data scientist, not research engineer, not other engineers in production lines.I applied to many companies in USA, from FAANG to medium size to start up, from tech companies to auto companies to health companies. However, I do not get any screening call or interview. I get many messages (email and linkedin) for software engineer, software developer, and embedded system but not a research scientist.What is the path to research scientist?#tech #auto #research #scientist #researchscientist #phd #academia #science #machinelearning #AI #artificialintelligence #robotics #robotic #HRI #computervision #statistics #signalprocessing #googlebrain #googleai #googleresearch #google #FAIR #facebook #amazon #apple #adobe #microsoftresarch #microsoft #dataminr #twosigma #bloomberg #ebay #qualcomm #nokia #samsung #samsungelectronicsamerica #deepmind #openai #intel #IBM #nvidia #uber #lyft #waymo #zoox #cruise #ford #toyota #generalmotors #mitsubishielectric #motional #bosch #robertbosch #irobot #intuitivesurgical #siemens #Medtronic #LG #sony #bytedance#horizonrobotics #electrical #datascientist #datascience #engineeringmanager #researchgmanager #researchlead #researchengineer #appliedscientist #career",3,13,2021-2-12 02:24:22,/post/How-to-become-a-Research-Scientist-after-PhD-F4rKEktO,Siemens
0,Seeking Referrals ,owca,/company/Microsoft/,Eng,"Hey everyone!I'm looking for referrals for one of my friends who would be graduating their bachelors program in Computer Science and Engineering this year (2021).  They are looking for a Software Developer position.They have interned at MathWorks and worked with a startup as well in their 2nd year.They are proficient in C/C++, Python, Java, R, Matlab and PyTorch. They have been selected for Regional Level ACM ICPC  and have good competitive programming skills. They are well versed in Web Development technologies like React, JS, MongoDB, Node.JS etc. They also have some research experience in Machine Learning and have a publication in one of the IEEE conferences.As they are from a very small institute, they are facing a lot of problem in getting interviews with many of the big companies. Their preferred location is India but is willing to work outside.If anyone is willing to help them kindly comment below or DM me. I would share their additional details and resume with you.Thank you!#microsoft#google#adobe#facebook#twitter#swiggy#flipkart#dell#Intel#jio#paypal#rubrik#qualcomm#walmartLabs#visa#paytm#startups#linkedin#zomato#jpmorgan#netflix#roblox#oracle#zillow#morningstar#citi#healthcare#siemens#spotify#apple#robinhood#yelp#vmware#atlassian#tech#referral",1,12,2021-4-7 07:59:48,/post/Seeking-Referrals-OgwaT5dz,Siemens
0,Get me an entry Level Job someone ,40two,/company/Apple/,Eng,"Going to keep it simple. I am an international student from India finishing my Bachelors(C.S) in the states. I lost my father 2 weeks ago to pneumonia and he was the bread earner in the family in India. A little sense of relief is I am about to graduate and can provide for the family. However, i still don’t have an offer. I would really appreciate if someone can help me find an entry level job in software engineering/data analytics.My tech experience has been working with IBM(software engineer intern), Microsoft (Sr. Student partner), Siemens(Salesforce Developer intern) & Apple(Tech evangelist)So far I have interviewed with:Apple x 1 (on site)Facebook x 1 (technical phone)Google x 1 (on site)And a few local companies. Happy to share my resume with anyone who can help!Thanks guys!",0,6,2019-3-5 12:16:24,/post/Get-me-an-entry-Level-Job-someone-SRxZgxT1,Siemens
0,My Dad is looking for a late career switch... eng help a sales guy out,CfHJ23,/company/Yext/,nan,"Hey All! Hopefully you brillant engineers can help. Im in sales and half the $hit you all talk about makes no sense to me recruting wise.My Dad is 60, been in computer engineering for 30+ years mostly in C++. Mostly legacy companies (Boeing, Siemens, etc). He’s planning to work for another decade before retiring (when mymom turns 65 so they can avoid paying for healthcare). His newer management has outsourced most of his teams work overseas and he now just has to sit back and fix the errors, rather than writing the code himself. Not what he signed up for, or what he’s really interested in.Ask: If he begins looking for a new role, what languages does he nees to be profiecient in? Any recommendations for training/ learning material?Obviously his age is against him but with 10 years left, he should still have plenty left in the tank. He’s actually pretty excited for a fresh start.He’s in St. Louis, and is open to office work in the area or remote work. He works remote fulltime currently.Thanks in advance.",2,5,2020-2-17 16:24:51,/post/My-Dad-is-looking-for-a-late-career-switch-eng-help-a-sales-guy-out-kcdmzVDX,Siemens
0,"JDA, Dallas, Architect offer evaluation",JunoMills,/company/Siemens/,IT,"Offer is # 133k base # 12% annual performance bonus # 401k: ""The JDA company match is 25% of your contribution with 100% vesting after 2 years of employment""As senior developer with 15 YoE, I currently make 130k + 2% bonus + 6% 401k match.I desperately want the architect title on my CV. On the other hand they were very very happy with my interview performance (had an extra round with Global VP for a more senior position, feedback from referring consultant).According to glassdoor, their band for this position is 115 to 145 base.---Little background on ""desperately want the architect title"": 9 years ago I managed (dotted line) a team of architects, just before that I directly managed team of 20 developers. Then things went south when I moved to US, first a customer went bankrupt, second couldn't get Visa renewed on time and had to quit, third was laid off and now with Siemens currently. Last 3 roles I have/had-to join as a senior developer with promises of team growth followed by promotion etc. None of them happened.Now I can't get foot in the door for a Manager or Architect position because recruiters don't see pray last 2-3 jobs.",0,9,2019-7-13 18:30:15,/post/JDA-Dallas-Architect-offer-evaluation-HFySvb1Q,Siemens
