,post_title,post_user,post_firm,post_position,post_text,post_like,post_comment,post_timestamp,post_url,company
0,Twilio Onsite Questions?,noTCnolife,nan,nan,"Blind folks,I have an onsite interview for a Principal PM role at Twilio coming, and don’t know what to expect. It’s for an API team, which I don’t have much experience in(have previously only managed an API product in my last role).What kinds of questions can I expect from the HM, Twilio Magic(bar raiser), and engineering rounds?YOE 9TC  laid off🥜",0,2,2021-2-23 05:15:02,/post/Twilio-Onsite-Questions-Atsr8FhE,Twilio
0,Twilio,zACj20,/company/Sutherland/,Product,Could someone help me with referral at Twilio. I have relevant background for Twilio PM roles.,1,2,2020-8-18 03:27:06,/post/Twilio-8mzBvj2d,Twilio
0,Twilio Interview Process?,NVRs18,/company/CGI/,Eng,Anyone know what twilio's interview process is for new grads at all?#engineering #software #swe,2,8,2020-9-16 18:56:55,/post/Twilio-Interview-Process-7H24mAA4,Twilio
0,Twilio vs. Zendesk,HHLm58,/company/Salesforce/,nan,"Hi team, I’ve offers from both these companies as a solution architect. Compensation is comparable but I’m wondering if anyone has opinion on which one has a better future and why?",0,25,2019-3-7 21:33:22,/post/Twilio-vs-Zendesk-wHK6t15y,Twilio
0,How is twilio ?,really!,/company/Facebook/,nan,"Thinking of interviewing at twilio. How is it ?In terms of work life balance, tc and culture?What TC can I expect if I join them ?TC: 320kYoe: 5 years",6,6,2019-1-17 01:27:43,/post/How-is-twilio-Xaqwkg7e,Twilio
0,Twilio Interview,canyoudoit,/company/Hitachi-Vantara/,nan,"I have a technical phone interview with Twilio in a couple of days. This is for a Security role mostly related to operations. I'll really appreciate if anyone has insights on what topics I should focus on and prepare for. Also, if you have any onsite recommendations I'll appreciate that as well.Thanks",2,1,2020-3-9 22:59:38,/post/Twilio-Interview-m1Jn6rF1,Twilio
0,Does Twilio sponsors h1-b visa?,whq,/company/Cerner/,nan,Wanted to know if Twilio sponsors h1-b visa to relocate to US sfo.I will be joining Twilio next month. My goal is to shift to US sfo down the line.Any Twilions response would really be helpful.#twilio #tech,3,12,2021-4-23 04:18:01,/post/Does-Twilio-sponsors-h1-b-visa-uFcCDvAy,Twilio
0,Twilio Referral,JYmC17,/company/N27/,nan,"Is anyone willing to refer me to an SWE role in Twilio? I have 10 YoE, mostly IC roles.#twilio #referral",2,6,2021-1-25 22:55:42,/post/Twilio-Referral-4x022aqt,Twilio
0,How’s twilio India ?,mini-12,/company/LinkedIn/,nan,What’s their Sr. software engineer and staff engineer range ?Tc : 32 + 28Yoe : 7,3,4,2020-11-26 04:57:44,/post/Hows-twilio-India-ww577ij5,Twilio
0,Twilio referral,jqh2txch,/company/Skyscanner/,nan,"Hi,I recently got laid off by covid and am interested in a job in Twilio. Any kind soul willing to help?TYoE 9TC 150 (singapore)Seeking a prog manager roleThanks! #twilio",0,4,2020-8-14 03:30:51,/post/Twilio-referral-XnpdxDBL,Twilio
0,Twilio Vs Atlassian ,gTbF82,/company/Siemens/,nan,Could you please help me to decide between these two,0,7,2020-9-17 06:19:32,/post/Twilio-Vs-Atlassian-BSjb2b2G,Twilio
0,Twilio Principal ,checkABD,nan,nan,How does Twilio Principal map to G/FB? TC range?,0,1,2020-9-25 15:43:53,/post/Twilio-Principal-b3DowJNW,Twilio
0,Twilio sign on bonus?,fghakdb,/company/VMware/,nan,"Does Twilio typically offer a sign on bonus for L4 roles in Product Design? If not, is this something that anyone has been able to negotiate?Location: Remote, non-west coastTC: $160k#offer #twilio #ux",1,3,2021-3-31 00:11:07,/post/Twilio-sign-on-bonus-N5beXOLi,Twilio
0,Looking for Twilio referral,oo_00_oo,/company/Facebook/,nan,"Hi there,Everything is in the title :)I found a very interesting role at Twilio, and thought I could maximize my chances to land an interview by getting a referral, unfortunately I don't have any connections working there.Please let me know if you would be willing to refer me.Thanks !!",2,12,2021-3-24 09:54:53,/post/Looking-for-Twilio-referral-toLryMoi,Twilio
0,Twilio offer - IC levels?,insctblond,/company/Facebook/,nan,"Got an offer at Twilio, for a senior level engineer.I however only have 3 yoe and I’m concerned that I will not be able to perform at a senior level.Can anyone at Twilio give details about leveling at Twilio? and their respective expectations?thanks!current TC: 71k€",0,2,2019-7-24 08:13:41,/post/Twilio-offer---IC-levels-8ycm2sYJ,Twilio
0,Twilio Referral,blk coffee,/company/GE/,Eng,I’m looking for a referral to Twilio! Anybody willing to give me one?#referral #twilio,0,8,2020-7-14 22:54:43,/post/Twilio-Referral-ex2gWY5D,Twilio
0,Twilio Solutions Engineer interview,AzMt25,/company/ClearDATA/,nan,I passed the behavioral interview with hiring manager for Solutions Engineer position. Next step is technical interview with Senior Solutions Engineer.Interview questions that someone is willing to share ?Any tips ?,2,11,2020-4-28 22:32:12,/post/Twilio-Solutions-Engineer-interview-aGqChSzz,Twilio
0, autodesk vs twilio ? ,wmw!,/company/Intel/,nan,considering offers from both . people who work in SF - any suggestions ? #offer #tech,1,21,2020-4-23 23:57:41,/post/autodesk-vs-twilio-WpvWUPZb,Twilio
0,Twilio life ,Lmxj11,/company/Cisco/,nan,I want to know how it is like working as a software engineer at Twilio. Glassdoor has mixed reviews. Any insider info will be appreciated.,2,4,2019-12-11 22:33:59,/post/Twilio-life-vKxBGUQO,Twilio
0,Twilio online assessment,gandalf$$,/company/American-Express/,nan,I took the Twilio online assessment that is 2 hours long and has 4 problems. Would I pass if I missed two test cases on one of the problems?,0,10,2019-11-14 22:39:47,/post/Twilio-online-assessment-BbYFuOnx,Twilio
0,Twilio phone screen ,NzkB48,/company/Cisco/,Eng,"What to expect in Twilio phone screen , and how is the interview process in general ?",2,7,2018-5-22 04:11:44,/post/Twilio-phone-screen-LX1ucWny,Twilio
0,"TC Twilio Segment, Solution Engineer?",ALOHA99,/company/Salesforce/,nan,Any tips on TC for IC4 /IC5 Senior Solution Engineer ? RSUs are offered ?10Y exp,2,9,2021-4-9 20:28:36,/post/TC-Twilio-Segment-Solution-Engineer-MDeBeEcC,Twilio
0,Twilio engineering levels?,Qbcm62,/company/Salesforce/,nan,"Did Twilio recently rename Senior 2 to Staff? I see people with the Staff title on LinkedIn, but levels.fyi doesn't have that info.",2,6,2020-6-16 02:56:33,/post/Twilio-engineering-levels-odePfhRL,Twilio
0,Twilio finance salary range ,ldm59,/company/Goldman-Sachs/,nan,"I had a call with the recruiter about a financial analyst position at Twilio. She mentioned base ~100k and RSU package is 40k for 4 years.Is that RSU package low or comparable with finance at Twilio and with nontech roles in general? I just see posts on here about Twilio offers with 140k RSU / 4 years for SWE with 0 YOE. Obviously SWE and non tech is different but is it that much of a difference? Wanted to see if I'm being lowballed.In general how much in equity should you expect for nontech roles (finance, sales ops, strategy & ops) at tech companies?3 YOETC: peanuts at GS#finance #nontech #twilio",1,4,2021-2-1 23:57:15,/post/Twilio-finance-salary-range-0quZKiNd,Twilio
0,Offer Comparsion | GS vs Microsoft vs Twilio,TIdo37,/company/Amazon/,nan,"Got offers for GS VP and Twilio Staff and Microsoft senior engineer.Current TC ~ 45 LPA.YOE ~ 8.Twilio TC - 68 LPA (38 LPA Base + 30 LPA stocks)Goldman TC ~ 66 LPA (56 LPA Base + 10 LPA bonus). The are also providing stocks worth $27k vesting over 3 years.Want to hear what suggestions you guys have, thanks!#offer #tech #microsoft #goldmansachs #twilio",1,49,2020-8-9 03:18:10,/post/Offer-Comparsion-|-GS-vs-Microsoft-vs-Twilio-mu7LuXkf,Twilio
0,Twilio System Design Interview Questions,Trie.Hard,/company/Salesforce/,nan,"I am interviewing onsite as a software engineer at Twilio, what kind of system design questions can I expect and what are they evaluating me on? Thanks!",6,6,2019-1-1 01:03:58,/post/Twilio-System-Design-Interview-Questions-FsaQmjVD,Twilio
0,Twilio interview process,tyeh324,/company/Intel/,nan,I recently applied for a twilio new grad position and got hackerrank link. I am fairly certain I completed both the questions correctly but I haven't still received any follow up communication regarding that! Any ideas what I can do to push the process?,0,9,2018-11-6 17:51:44,/post/Twilio-interview-process-o6mtWJXO,Twilio
0,Twilio Bangalore: How's the pay and work?,HakuMatata,/company/LinkedIn/,nan,"Twilio is setting up new office in bangalore.How's the pay for 2 YOE and work quality, WLB etc?YOE: 2+TC: 🤏",2,19,2020-10-3 09:54:45,/post/Twilio-Bangalore-Hows-the-pay-and-work-GtjhgkOp,Twilio
0,Twilio Referal,Travis Sco,nan,nan,I m a Software Engineering Student and really passionate about twilio products. Would anyone mind taking a look at my CV and possibly refer me ?Thanks,1,6,2018-12-12 22:51:03,/post/Twilio-Referal-q0er5vNj,Twilio
0,Twilio Referral,Timmayyy,nan,nan,"Hello Twilio minions,I’m looking for a Twilio referral. Have over 8 years of experience and know messaging like the back of my hand during a backhand shot against Tiger Woods and Serena Williams, at the same time, while eating Cheetos with my other hand, watching cops at 2x speed, and leetcoding with my toes, and did I mention one of my toes has frostbite.",0,7,2019-7-11 23:54:59,/post/Twilio-Referral-MUUsCHOe,Twilio
0,Twilio vs Uber vs Twitter,jazk27,/company/Cisco/,Eng,"In an hypothetical scenario, where one has offers from Twilio, Uber and Twitter. Where would you go?I would be greatful if you could explaining the reasoning behind your choice. ",0,22,2019-10-22 22:07:04,/post/Twilio-vs-Uber-vs-Twitter-t3BsS2EU,Twilio
0,Twilio H1b transfer,gingerlie,/company/Sam's-Club/,nan,I’m in process of H1 transfer.How’s EIG firm in handling the tranfer?LCA is done. But they are taking more than a week to prepare the filing.#twilio #eig,2,11,2020-6-4 22:23:44,/post/Twilio-H1b-transfer-a0Q0y13S,Twilio
0,Twilio PM interview ,Priam123,/company/Citi/,nan,"Gave the final round of interviews for a Product role @ Twilio last week and haven’t heard any update from the recruiter yet .Would they not share a courtesy NO-GO reply , though it’s the final round/virtual-onsite ?#twilio #product #interview",2,3,2020-9-29 20:53:10,/post/Twilio-PM-interview-RtUzQsAc,Twilio
0,Twilio product manager interview ,bocam,nan,Product,I have an upcoming PM phone screen coming up in 2 weeks for twilio. Anyone been through this? Any pointers on what might be asked?Current TC 165k with stock options of a VC owned AI / ML platform unicorn,3,13,2019-1-30 06:20:56,/post/Twilio-product-manager-interview-dmWuFx1H,Twilio
0,"Twilio Interview Experience and TC, inflated titles ?",Shazam!!,/company/Flipkart/,nan,"A colleague of mine recently had his interview with Twilio Bangalore for Principal Engineer. Apparently they are offering only 35-48L base, no bonus and 145-185k$ stocks over 4 years. This seems like a low L5 offer instead of Principal Engineer. He had a 2 hour hackerrank test , a phone screen and 5 rounds in the virtual onsite. His coding round was taken by an EM and she didn't even have a SWE background (BI and ETL in a bodyshop). He rejected the offer and his glassdoor review was taken down as well. Quite appalling to hear this. I was under the impression that Twilio was one of the better companies!I was approached by a recruiter for a position at Bangalore and scheduled to have my first phone screen in a couple of weeks but now having second thoughts after hearing this. Anyone else had similar experience with twilio ? #twilio #bangalore",4,41,2020-7-1 04:56:49,/post/Twilio-Interview-Experience-and-TC-inflated-titles-8twLnYPC,Twilio
0,Twilio On-site,MGxN00,nan,nan,"Hello,I had given an onsite with Twilio early last week for a position and received a feedback from recruiter call on Monday this week. From the talk it seemed that I did well, but the team decided not to hire anyone and closed the job posting altogether. The recruiter said that he is going to find another hiring manager and speed me up for fit interview. Now I was on a tight deadline (they already knew that when I interviewed) and asked if I can have some direction - whether I am with the hiring committee approval or rejected or in team matching phase. I have sent follow up emails/ voicemail since but haven’t heard back. Has anyone else faced a similar situation?#software #engineering #interview",0,5,2020-9-17 19:36:32,/post/Twilio-On-site-u6ZHSjSE,Twilio
0,Twilio refreshers?,Glasswall,/company/Cisco/,nan,Can anyone from Twilio chime in on how refreshers are given?,6,2,2018-10-20 16:58:28,/post/Twilio-refreshers-vrqyKivu,Twilio
0,Twilio Segment (Staff L4) Bangalore India Interview,sudocoder,nan,nan,"Hi Blinders,Anyone recently attended for twilio Segment (Staff Engineer L4 role) for Bangalore (India) ?Need input on what to expect from the 45min hiring manager round. Also any tips on what to prepare for further rounds. ?Will it be system design focused or problem solving focused.? Does the design question also involve HLD with LLD ?PS : I have cleared the first OA hackerrank round.TC : 🥜#twilio #bangalore #indiasalary #interviewquestions #interviews #design #softwareengineer #systemdesign #leetcode #algorithmrx #engineering #behavioralinterview",0,13,2021-4-16 10:08:08,/post/Twilio-Segment-Staff-L4-Bangalore-India-Interview-0OxrM8YL,Twilio
0,Twilio Vs Amazon for PM?,dreamwalkr,nan,nan,"L6 (Sr. PM) at Amazon Vs PM L3 at Twilio.TC about the same at each, Twilio favours RSUs much more heavilyWould love to hear opinions from people that work at both orgs. Career ladder, potential opportunities etc?#pm #product #productmanager",2,8,2021-3-9 22:25:28,/post/Twilio-Vs-Amazon-for-PM-RnoCAn7q,Twilio
0,Offer Evaluation - Twilio Staff Engineer,tUop80,/company/Clover-Health/,nan,I've just gotten a verbal offer of 190K base with 400K equity over four years for TC of 290K. This is for L4 / Staff Engineer (used to be Senior II) in the SF office.There's some variation on Levels.fyi but this seems to be on the low end. Anybody at Twilio know if this is low? What is realistic to negotiate for? #offer #twilio #compensation,2,6,2020-9-25 00:11:04,/post/Offer-Evaluation---Twilio-Staff-Engineer-3Z2K1FRb,Twilio
0,Twilio Stock,g946,/company/Apple/,nan,Do you think it will bounce back?Howz company doing overall?#investments,2,7,2020-3-15 15:18:19,/post/Twilio-Stock-0Ed45Gia,Twilio
0,Insights on Twilio,Bwnc78,/company/KeepTruckin/,nan,"Insights on Twilio Product Operation & Product Management salaries. Do you like working there, work life balance & what do you think of Flex?",1,4,2020-3-2 02:53:43,/post/Insights-on-Twilio-gVcL3s2u,Twilio
0,Yearly refreshers at Twilio?,Voldy,/company/Box/,nan,Considering interviewing at TwilioCan anyone shed some light on what annual refreshers look like?,0,9,2018-11-18 02:04:54,/post/Yearly-refreshers-at-Twilio-0PxPeVb8,Twilio
0,Twilio onsite interview,TwilioHelp,/company/Veritas/,Eng,"Hello everyone,I've an onsite scheduled. Can people share their experiences?Specifically:Algorithm questions: Leetcode? (if yes, Medium/Hard)Design: Some examples?Any behavioral round?Thanks in advance!",3,3,2018-8-22 04:32:22,/post/Twilio-onsite-interview-Ted8nXjM,Twilio
0,Twilio Senior Director TC,r214,nan,nan,Expecting an offer for a senior director product role at Twilio. Anyone know the comp bands? Is $1mm possible?,3,9,2020-8-9 07:40:30,/post/Twilio-Senior-Director-TC-KMvxHyGC,Twilio
0,Solutions Architect Role @ Twilio?,AlfP07,nan,nan,"Hi 👋🏽 I have an upcoming interview at Twilio for a Solutions Architect role. There’s little to no info about it online. The job description reads like a Pre-Sales Engineering role.Has anyone been in the role or interviewed for it? How technical are the role and interview process?FWIW, I checked out their Solutions Architects on LinkedIn and it seems like most of them have been non-technical for quite some time.#tech #solutionsengineer #solutionsengineering #solutionsarchitect #presales #twilio",2,13,2020-5-14 23:32:48,/post/Solutions-Architect-Role-@-Twilio-RUtUpYvP,Twilio
0,how is working at Twilio ? ,born2ride,nan,nan,"recently i funished my interview ar Twilio anc i am at offer stage . any inputs related to salary negeotiations and work culture , job security , career growth , etc are apperciated. #engineering #software",3,13,2020-6-17 22:35:35,/post/how-is-working-at-Twilio-hJNLcDxs,Twilio
0,Staff TPM@Twilio,vdyat24,/company/Amazon/,nan,"Has anyone recently interviewed for Twilio Staff TPM role, if so, what's the compensation offered and how's the interview process like?",2,0,2021-4-26 18:12:20,/post/Staff-TPM@Twilio-oUnmGOgH,Twilio
0,Referral to Twilio,NotAnother,/company/Alix%20Partners/,nan,Any kind soul willing to refer me to Twilio? Non-tech here looking at Director+ position in Finance. 14 YOE with MBA. Thanks!#twilio,0,4,2021-3-16 16:17:55,/post/Referral-to-Twilio-0HxGTaqn,Twilio
0,Twilio jobs Corona time,orabora,/company/Oracle/,nan,Hi twilios. I see a lot of job openings at Twilio. How things are going there during Corona time? Is it saifty to join now. Any rumors about upcoming layoffs ?#twilo #hiring #jobs,1,9,2020-6-3 10:32:06,/post/Twilio-jobs-Corona-time-gQktJwsh,Twilio
0,Twilio New Grad Offer,vmworld,/company/VMware/,nan,What Does Twilio Offer for a New Grad in SF Office?,7,0,2019-2-13 23:49:28,/post/Twilio-New-Grad-Offer-V3weRxYs,Twilio
0,Twilio Referral,=_-,/company/Uber/,nan,^ Analyst roleTC 100k,0,5,2020-7-4 16:44:52,/post/Twilio-Referral-mN3TMqNY,Twilio
0,Twilio phone interview,REVt37,/company/Express-Scripts/,nan,"I have a phone screen with Twilio soon and was hoping to get insight on what to expect. I had the OA which I did ok on. 4 problems, 80 minutes. Finished 3 with all test cases, didn't finish the last one. It's an hour phone screen. Senior software engineer position.TC ~140k",0,7,2020-3-5 22:26:53,/post/Twilio-phone-interview-cKgXAVDZ,Twilio
0,Twilio India tpm salary,garuda020,/company/Johnson-Controls/,Project,Hello all... I have an interview coming up with twilio for a technical Program Manager role in bangalore and was wondering what kind of salary to expect... I've never worked in India before and hence the question.YOE 13Current ctc $160k without any equityThank you for your help.#tech #twilio,0,6,2020-11-13 03:12:25,/post/Twilio-India-tpm-salary-0QYNYgnm,Twilio
0,Twilio Referral Bengaluru,KSeS56,/company/Cisco/,nan,Looking for referrals for Twilio principal Engineer position in Bengaluru. Applying through LinkedIn seems to have to no use. Appreciate any help.,1,7,2020-8-26 11:00:23,/post/Twilio-Referral-Bengaluru-oe4sxDPF,Twilio
0,Twilio Referral ,AzHG53,/company/Visa/,IT,"Hello,I am looking for a referral in Twilio. It will be really helpful if anyone can referral me.Thanks.#software #twilio #swe #softwareengineer #referral",1,0,2020-12-16 15:10:56,/post/Twilio-Referral-3YQTTBHQ,Twilio
0,Twilio PM Interview ,rr124,nan,nan,How are PM interviews at Twilio? Any take home assignments or technical loops?,4,0,2020-9-3 00:26:45,/post/Twilio-PM-Interview-efzpwt1r,Twilio
0,Staff PM comp at Twilio,AxTi75,/company/Oracle/,nan,I'm about to start interviewing at Twilio for a Staff PM position.What is the base and equity range given to new hires in the Bay Area? How much are yearly refreshes? #pm #compensation,7,2,2020-7-15 05:52:49,/post/Staff-PM-comp-at-Twilio-2dzWrTsW,Twilio
0,Final round of Twilio ,gbSF41,/company/Capital-One/,nan,"Hi allI finished my take home assignment from twilio for software engineer role Colorado office, and waiting for a response from recruitor for next step. Holiday season definitely slows down everything, and I did not get the response yet, maybe she is out of office. I only know I will have to go over my assignment with one engineer. Do you guys know how many interviews at twilio for final round? how many technical (coding)? how many behaviors?#twilio #finalround #software #coloradoThank you for your answers and happy holiday!Current TC 140k, 3 YoE",2,12,2020-12-20 23:59:58,/post/Final-round-of-Twilio-G1uLPkVF,Twilio
0,Twilio PM interviews,EzQs55,nan,Product,Any tips on interviews for Technical PM roles at Twilio? I'm interested in what are things hiring managers like to hear and what they dont.#productmanager #product #pm,3,4,2020-6-21 20:07:36,/post/Twilio-PM-interviews-UMXHGcKR,Twilio
0,Twilio offer validity duration?,dnnda,/company/Amazon/,nan,"I am selected for SDE role in Twilio. I do not want to immediately change the company, but might consider it after few months (after getting the vesting stocks ). Will I be able to reuse this Twilio offer after 3-6 months??",0,3,2021-2-10 20:02:56,/post/Twilio-offer-validity-duration-J22vUsA5,Twilio
0,Twilio Product Manager,hdly77,/company/Google/,nan,"Any feedback on PM role at Twilio? No bonus, 1 year cliff for stocks, and no sign-on.. Heard mixed reviews about companies engg talent and systems as well.",2,10,2019-9-27 03:53:03,/post/Twilio-Product-Manager-R3qTpsPu,Twilio
0,"Moving to Denver, Twilio",UKxz85,/company/Amazon/,nan,"Hey all, looking at moving across to Denver with my partner who's from Colorado originally. Anyone from Twilio, how is the WLB, growth opportunity and engineering culture?Currently at Amazon so anything is beautiful at this point.#software #engineering",2,4,2020-8-12 23:52:30,/post/Moving-to-Denver-Twilio-BiKw45eZ,Twilio
0,Twilio Maternity Benefit,cvlw,/company/Amazon/,nan,Anybody knows what’s Twilio’s maternity benefit? Any min tenure?#parenting #workingparentTC: 200,1,1,2021-1-18 12:53:25,/post/Twilio-Maternity-Benefit-PJVL73tH,Twilio
0,Twilio Mega Backdoor Roth IRA,hbxs436,/company/Adobe/,Mgmt,Considering applying to a role at Twilio. Do they offer a mega backdoor Roth IRA?,2,10,2021-2-26 21:37:32,/post/Twilio-Mega-Backdoor-Roth-IRA-Nd2u6Rmx,Twilio
0,Opportunity at Twilio,EW88,/company/Salesforce/,nan,"Considering applying to a Contracts Analyst role at Twilio. Does anyone have experience interviewing with them, working there, and the compensation range for that role? The recruiter mentioned 80k base but then changed and said the base would be 5-10k lower after another conversation. I’m on the east coast.",0,1,2020-11-24 02:31:06,/post/Opportunity-at-Twilio-BscHhojF,Twilio
0,How is Segment in Twilio?,🆑count,/company/Google/,nan,How is it to work for Segment that Twilio has acquired? How is the business doing? And how is the engineering work and culture?,0,10,2021-2-25 00:22:44,/post/How-is-Segment-in-Twilio-vaU0f7VZ,Twilio
0,Twilio System design interview,sdlo,/company/NortonLifeLock/,nan,What kind of system design questions can be expected at Twilio System design interview? Can someone share recent experience and have any recommendation for interview prep?#design #interviews,2,1,2020-8-31 21:01:00,/post/Twilio-System-design-interview-AxZSQjoC,Twilio
0,Work/life balance at Twilio?,19627bn,/company/VMware/,nan,What is the work / life balance like at Twilio for tech and product roles?#worklifebalance #twilio,2,2,2021-3-6 01:42:58,/post/Worklife-balance-at-Twilio-M2i5VVki,Twilio
0,Twilio Vs Google,VzxF52,/company/Cisco/,nan,Which company would you prefer and why as a software Engineer .  Debating between the growth that might come with Twilio vs the brand name of Google on the resume for future.,1,11,2019-2-1 19:49:27,/post/Twilio-Vs-Google-xATP5whb,Twilio
0,Twilio vs Google Meet,vEPk85,nan,nan,"#pm #product #productmanagerWhich is better and why - Twilio video coference API OR Google Meet as a product, in terms of technical architecture(WebRTC), scalability, latency, quality, ownership, limitations, pricing, when building a video conferencing ecommerce website?P.s. don't want the zoom interface.#twilio #google #product #systemdesign #technicalsolutionsengineer ",0,0,2020-9-7 16:54:19,/post/Twilio-vs-Google-Meet-jWBPtJ6o,Twilio
0,Director pay at twilio,thippali,/company/VMware/,nan,Any insight into compensation for engineering directors at twilio? How are things there at the moment?,2,7,2019-7-23 16:38:04,/post/Director-pay-at-twilio-tD64x1KY,Twilio
0,Amazon SDE3 equivalent at Twilio,♠️♣️♥️♦️,/company/Amazon/,nan,"SDE3 at Amazon Bay Area, recently promoted. What’s the equivalent level at Twilio?TC: 436k",6,16,2018-8-26 03:53:23,/post/Amazon-SDE3-equivalent-at-Twilio-DrCHkheT,Twilio
0,L6 TC at Twilio,nedflandrs,/company/Splunk/,nan,Any guidance is appreciated. Awaiting an offer. ,7,12,2019-5-22 23:58:45,/post/L6-TC-at-Twilio-Swr4FqkS,Twilio
0,Twilio Levels and TC,td12,nan,nan,How do senior/director PM levels at Twilio map to G/FB/etc? Any insight into comp bands?TC: $500k,1,3,2020-8-12 22:46:55,/post/Twilio-Levels-and-TC-4PuGtOET,Twilio
0,Thoughts about Twilio ? ,VzxF52,/company/Cisco/,nan,Culture as  well as TC IC4 190k/ ~400k rsu.,1,17,2019-2-7 05:39:58,/post/Thoughts-about-Twilio-3VLPCH7j,Twilio
0,Design at Twilio,woof808,/company/Dropbox/,nan,Would love to know what the culture is like. I have a very sentimental memory using Twilio for one of my first programming projects and am somewhat interested in a design opportunity there.,3,1,2020-11-20 05:57:58,/post/Design-at-Twilio-SoGJm2Fd,Twilio
0,Twilio referral,PnrV41,/company/American-Airlines/,nan,Looking for Twilio referral for an opening that I am interested in. Would anyone at Twilio be able to provide a referral? #twilio,1,4,2020-5-29 18:28:55,/post/Twilio-referral-jAo1CEKv,Twilio
