,post_title,post_user,post_firm,post_position,post_text,post_like,post_comment,post_timestamp,post_url,company
0,Facebook PMM vs Twilio PM vs Bytedance PM,eCvL45,/company/Facebook/,nan,"Hi guys,I have been a PMM for a bit more than 3 years now at Facebook MPK and would like to transition to a PM role as a next step in my career.The issue is that transitioning from PMM to PM internally is very very hard.That is why I decided to give it a try externally and I am about to finalize interviews with Twilio and Bytedance, and I am pretty confident that I will get offers sometimes next week.If my objective long term is to be in product managent, ideally in FAANG, what would be your recommendation?1) Stay as a PMM at FB and continue to try to move internally as a PM2) Move to Twilio as a PM and try to move back to FAANG, even though the brand name is not that strong, but it will give me real PM experience3) Move to Bytedance as a PM and try to move backcl to FAANG, as the brand name is pretty strong, but it will certainly destroy my WLBPlease share your thoughts in the comment section.Thanks!TC: 230k",4,11,2021-3-31 03:37:06,/post/Facebook-PMM-vs-Twilio-PM-vs-Bytedance-PM-pCN2KpR3,Twilio
0,Senior offer at Twilio,hhvgj,/company/Reddit/,nan,Base: 140kStock: ~220kTarget bonus: ?In Bay Area5 yoeThoughts?,3,13,2019-4-16 00:04:13,/post/Senior-offer-at-Twilio-p3oayfcE,Twilio
0,Twilio onsite interview (Software Engineer),RLRq11,/company/Amazon/,nan,It would be nice if someone can provide some insight into onsite interview at Twilio. What type of questions to expect.Thanks,1,5,2018-9-11 02:10:00,/post/Twilio-onsite-interview-Software-Engineer-MMGRC3pK,Twilio
0,Sr. CSM at Twilio,Derp1,/company/Cision/,Sales,"Came across a Senior Customer Success Manager Role at Twilio. Do we have any CSMs on here from Twilio?If so, what is it like? Quota driven? Heavy focus on product adoption? Since the stock has exploded do they offer RSUs?I know about Twilio from a surface level perspective but want to better understand the sales org and different roles with in the org.Currently Sr. AM making peanuts at a telecom startup - TC 110#sales #customersuccess #midmarket #enterprise",1,1,2021-1-19 19:28:34,/post/Sr-CSM-at-Twilio-46NZgyb2,Twilio
0,"Microsoft, Expedia, Twilio Referrals",NVRs18,/company/CGI/,Eng,"Hello, I've found some roles in interested in st Microsoft, Expedia, and Twilio, I was hoping some of you find people could help me out with a referral?Thank you! :)#engineering #software #swe",0,14,2020-9-10 05:22:20,/post/Microsoft-Expedia-Twilio-Referrals-KpBU4RxZ,Twilio
0,"Twilio, OpenDoor, Square referrals ",Yubfj,/company/Instacart/,nan,"Looking for referrals for new grad software/DS roles at square, OpenDoor, Twilio (and other similar size companies). Thanksss",3,16,2018-9-29 18:01:40,/post/Twilio-OpenDoor-Square-referrals-Eqxw5ewJ,Twilio
0,Twilio TAM Salary ranges?,MHMT42,/company/Microsoft/,nan,"Got contacted by Twilio for TAM (Technical Account Manager) position. I have a call with the recruiter coming up next week. A friend who also spoke to a recruiter told me he was asked for salary expectation. I’m doing my research as I prepare for the conversation.What is the salary range for P3/P4?YOE: 14Location: Remote, US#interview #salary ",0,3,2020-10-28 22:59:27,/post/Twilio-TAM-Salary-ranges-MYMMgw4i,Twilio
0,Twilio Principal Engineer interview,FxJY68,/company/Oracle/,nan,I have a phone screen coming up for principal engineer. What is typically asked in this and in onsite interviews in general? Dont see much info about twilio interview experiences online.,3,1,2020-5-13 20:12:41,/post/Twilio-Principal-Engineer-interview-2p2MsRDP,Twilio
0,Twilio Referral ,hope4all,nan,Biz Dev,"I have applied for a position there, a global telecom regulatory/policy position, any one can refers ne internally, not sure if it would be useful for my applicatioApplicat #twilio",2,0,2019-12-31 05:29:21,/post/Twilio-Referral-Dqww853i,Twilio
0,Need a Twilio referral?,str8ca$h,/company/Twilio/,nan,"Send me a direct message - ton of openings in Engineering, Product, Sales, and more.Happy to provide a referral.",2,9,2021-3-25 22:15:08,/post/Need-a-Twilio-referral-HNrU80Mm,Twilio
0,Can twilio grow?,Voldy,/company/Box/,nan,The stock has gone up decently.. is there potential to grow more?,2,8,2018-4-16 21:04:28,/post/Can-twilio-grow-Hgp07WWG,Twilio
0,Rate my offer - Twilio Product Design L4,BoyIsMine,/company/Expedia/,nan,Base:         $140kRSU:          $285k over 4 yearsTotal TC:    $211k/yrSign on:     NoneLocation:   RemoteCurrent TC:              $160kCurrent Location: Denver#tech #productdesign #uxdesigner #tc #design #ui/ux,7,9,2021-3-31 00:21:56,/post/Rate-my-offer---Twilio-Product-Design-L4-jxHiXTUt,Twilio
0,Twilio Referral,$UBER$,/company/Uber/,nan,^ Referral needed for an analyst position!,1,4,2020-5-21 03:04:26,/post/Twilio-Referral-5CogHAUt,Twilio
0,"Twitter, Twilio Referral ",vNbj30,/company/Goldman-Sachs/,nan,"I am looking for software Engineer referral at Twitter/Twilio, Bay AreaYOE: 2 years of scala/java developmentTC: 250k",1,6,2019-3-19 04:37:08,/post/Twitter-Twilio-Referral-UQH6CMGy,Twilio
0,Going to interview Twilio ,CazP48,/company/Amazon/,Eng,Please recommend what should I be prepared for? This interview is for Sr Software Engineer role.2 rounds of design 1 round of coding 1 round of behavioral,1,7,2018-9-19 04:35:11,/post/Going-to-interview-Twilio-qYFy7Fq8,Twilio
0,Opinions of working at Twilio,RsQL20,nan,Sales,"I'm in the middle of the interview process for a business development role with Twilio. I'm looking for some first hand info. (pros/cons) on Twilio's culture, sales rhythm, employee development, etc.",7,4,2017-8-7 06:01:22,/post/Opinions-of-working-at-Twilio-540dspAJ,Twilio
0,Twilio data science ,es94927,/company/Atlassian/,nan,"Folks at twilio,What do data scientists do there? Are they ML focused or more on the sql / analytics side?",1,1,2020-12-31 20:38:47,/post/Twilio-data-science-g4PBqNg7,Twilio
0,Twilio Technical Account Manager salary,zBHT861,/company/ServiceNow/,nan,I’m expecting an offer from Twilio for technical account manager. What TC I should expect in San Francisco?Experience: 5 yearsLocation: SFCurrent TC: $140k,2,3,2021-1-5 01:09:33,/post/Twilio-Technical-Account-Manager-salary-n71bRwQk,Twilio
0,[India] Twilio Data Engg OA,Cgup05,/company/Morgan-Stanley/,nan,"Hello,Have to take an OA with twilio for the L3/L4 data engineering position. Any pointers would be much appreciated.ThanksTC: 44L#Twilio #dataengineerinterview",0,5,2021-4-22 16:15:30,/post/[India]-Twilio-Data-Engg-OA-RFfXJytU,Twilio
0,Twilio Interview SRE Kafka team,pointblanc,/company/Adobe/,nan,"Anyone pointers for an SRE position interview? Will there be a coding challenge? How many easy, medium hard roughly? Any help is appreciated. #twilio #tech #interview #sre #sreinterview",0,5,2021-1-24 03:12:50,/post/Twilio-Interview-SRE-Kafka-team-u71kns24,Twilio
0,Twilio stock surges to it's highest value yet,LCForTC,/company/Twilio/,Eng,"Its almost $172 now. This is unexpected considering twilio had bigger clients in travel industry ( uber,lyft,airbnb,Expedia ) which got impacted by covid 19. Do you have twilio in your portfolio or planning to buy?#investments",5,22,2020-5-7 17:20:08,/post/Twilio-stock-surges-to-its-highest-value-yet-JHzohUdL,Twilio
0,Twilio onsite Interview event ,lost..,/company/Yahoo/,nan,what type of questions does Twilio ask for Software Engineer positions. Any help would be appreciated.Thanks,0,9,2019-10-4 21:47:15,/post/Twilio-onsite-Interview-event-chr2o7R2,Twilio
0,Twilio PM Interview Process & Culture,mgXz21,/company/TripActions/,nan,Would anyone be able to share the general interview process and PM culture at Twilio?,3,8,2020-7-25 03:44:59,/post/Twilio-PM-Interview-Process-Culture-NBrpSAZU,Twilio
0,Twilio work culture?,Random nam,/company/Microsoft/,nan,How is it working at Twilio? Do we have people from Twilio on blind?,9,2,2016-10-25 03:21:24,/post/Twilio-work-culture-VrnokdN7,Twilio
0,Twilio India culture and TC,Mugwump,/company/Groupon/,Eng,"Hi,I'm planning to apply for Twilio in India. I'm trying to understand how the culture and TC is, given that the office is new here. Can someone please provide some insights?Yoe - 7TC - 30LPA #engineering #software #swe #twilio",7,6,2020-6-24 14:17:16,/post/Twilio-India-culture-and-TC-7W4t6MaQ,Twilio
0,Twilio Messaging Postflight team,fingerchip,/company/Microsoft/,nan,"Looking for feedback on Twilio Messaging Postflight team. Specifically in terms of learning opportunities, work impact and management.",0,0,2021-3-19 08:05:30,/post/Twilio-Messaging-Postflight-team-pQ01beOh,Twilio
0,Twilio TPM interview,crankyTPM,/company/OYO/,nan,I have a TPM interview coming up with twilio. Currently working in a technical consulting role with a boutique consulting. (I'm not at OYO.  Using a friend's account)What should i focus on? Are they really that much into this twilio magic thing that recruiter spent 30 out of 45 mins in our first conversation.TC: 130K,0,1,2021-2-13 19:24:21,/post/Twilio-TPM-interview-3Sj6LEa4,Twilio
0,Morgan Stanley vs Twilio vs Paytm vs Oracle OCI,wander_ww,/company/Cerner/,nan,"I have 4 offer letters in hand for India, YOE - 4.2 years. Which one is better among this.Morgan Stanley:  Designation - Manager, Bangalore, Base - 20L + PF, SignOn- 2.5L (expecting base to get increased based on other competing offers), how much should I ask for?Twilio:  Designation - Software Engineer(L2), Bangalore, Base - 19.5L + PF-gratuity , SignOn - 3.7L, RSU - 80K USD for 4 yrs (14.5L/yr)Paytm: Designation - Senior Software Engineer, MG02A, Noida, Base - 22L + gratuityOracle OCI: Designation - Member of technical staff, Bangalore, Base - 23.5L (incl PF-gratuity), SignOn- 3.5L(1st yr) +3.5L (after 1.5 yr), RSU - 5L/yr for 4 yrsI am thinking to join between Twilio/Morgan Stanley. I am willing to join that company where it is easier for me to move to US after some time. Please suggest me which one to join as per your opinion.If someone is suggesting Twilio or Morgan Stanley if they can also say few pros n cons. It will be really helpful for me. #twilio #morganstanley #oraclecloud #oracle OCI #paytm #engineering #software #swe",2,35,2021-4-1 10:20:46,/post/Morgan-Stanley-vs-Twilio-vs-Paytm-vs-Oracle-OCI-QefFJea4,Twilio
0,Interviewing with Twilio. Any advice?,tGoq36,nan,nan,"Applied online and was assigned an OA. Completed the OA and passed all test cases. Heading into the next round to interview with a hiring manager, which scheduled for about 30 minutes. Any advice on how to prepare to increase my chances from this point forward? This is the furthest I’ve gotten with a big company and it makes me a little anxious. Thanks in advance.",4,2,2021-4-9 04:42:46,/post/Interviewing-with-Twilio-Any-advice-B0pMoUiu,Twilio
0,Twilio Sr. PM TC,Squatch503,nan,Product,"I had my on site loop last week for Sr. PM and, assuming I get an offer, what can I expect wrt base and RSUs?  Does twilio offer RSU refreshers?  Could I ask for guaranteed refreshers in lieu of higher base?Seems like a really great company and I’m hopeful for an offer.4 YOE as PM, 13 prior YOE as dev then SE",3,9,2018-9-12 04:42:10,/post/Twilio-Sr-PM-TC-5fxt0HbM,Twilio
0,Good teams at Twilio,Timmayyy,nan,nan,"What are some good teams at Twilio doing high visibility work? Are any teams working on RCS (successor to SMS)? If you are a twilio SWE, can you please fill out this quick survey to rate the various teamshttps://docs.google.com/forms/d/e/1FAIpQLSdL0HjFsdfkB71YZY5n5_1kiZh3-0gCoZcqYIo1konJegTf-Q/viewformThe ratings include things like leadership, work life balance, on call, ease of deployments, growth, software quality, etc.Timmayyyyy",1,6,2019-7-2 21:49:42,/post/Good-teams-at-Twilio-YoKN1fdY,Twilio
0,twilio referral,jdjwjd,nan,nan,can anyone help me out.  i am out of work.  looking at the messaging channel team for a senior position.  could someone be kind enough to give me a referral. #referral #twilio,0,3,2020-8-17 19:47:20,/post/twilio-referral-vVm6JCnf,Twilio
0,Twilio IC4 TPM,zjik63,/company/Amazon/,nan,I have 12+ years of exp and considering Twilio CA. Any ideas on TC?thanks #twilio,0,6,2021-1-27 02:24:24,/post/Twilio-IC4-TPM-nmrecaMT,Twilio
0,Looking for Twitter / Twilio Referral,tr1m,/company/American-Express/,nan,Looking for referrals for the following positions:Twitter: https://bit.ly/3buGw1fTwilio: https://bit.ly/2NVSvNqLocation: BangaloreRepher me: https://repher.me/r/-MUChM_5kM_7I6kHC3SuTC: 15LYOE: 2#tech #ml #data #datascience #referral #twitter #twilio,0,7,2021-2-23 07:09:54,/post/Looking-for-Twitter-Twilio-Referral-SS1WXwxd,Twilio
0,No bonus at Twilio?,fbemployee,/company/Facebook/,nan,I heard Twilio doesnt give bonuses nor refreshers. How is that possible?what’s the incentive to stay in the company more than 4 years if you never receive refreshers?TC 300k,2,6,2019-9-27 12:53:00,/post/No-bonus-at-Twilio-tMqiO88a,Twilio
0,Twilio engineering levels,burg,/company/LinkedIn/,nan,Couldn't find in levels.fyi. What does the ladder look like I twilio? Friend who is L5 at Google is being offered principal engineer,2,4,2019-10-9 22:26:59,/post/Twilio-engineering-levels-HpHXveaR,Twilio
0,Twilio Interview Insights,dffghgcf,/company/Intuit/,nan,Hi! Any insights on Twilio technical phone interview? Leetcode/hackerrank? Any other tips? This is for a backend position. Thanks,1,6,2018-4-26 00:52:44,/post/Twilio-Interview-Insights-UdWtXksL,Twilio
0,Twilio referral,bbxcu,/company/Workday/,nan,Noticed a JR I have experience and interest in. Please let me know if anyone would be willing to refer.,0,4,2020-7-28 16:09:03,/post/Twilio-referral-GgxRMOdf,Twilio
0,Twilio BI analyst,difek,/company/Intuit/,Data,"Can anyone comment on the senior bi analyst roles at Twilio - day to day work, wlb, tc?#data #twilio #bi",3,0,2020-8-21 14:19:11,/post/Twilio-BI-analyst-C0nG6ccA,Twilio
0,Solutions Architect Interview @Twilio,ProfServ,/company/Guidewire/,nan,"Hi Guys,I am about to attend the interview process for Solutions Architect (Professional Services) role at Twilio. The company seems to be doing pretty well and growing like crazy.I would really appreciate if anyone who was the part of the process before can shed some light.CurrentTitle - Technical Architect (Professional Services)YOE - 6 yearsCTC - 180kThanks!#interview #solutionarchitect #twilio",2,0,2020-10-2 01:06:54,/post/Solutions-Architect-Interview-@Twilio-UfMg01QU,Twilio
0,Twilio Phone Screen,MrCoder,nan,Eng,What can I expect in phone screening round for Sr. Software Engineer?,3,4,2018-9-29 23:44:38,/post/Twilio-Phone-Screen-8FfPVqJ7,Twilio
0,Twilio hiring follow up?,Wait4Me,/company/Mapbox/,nan,I had my final round a little over 2 weeks ago and I haven't heard anything. I followed up with the recruiter yesterday and haven't heard anything back yet and the job has been taken down off the website. Should I shoot a note to the hiring manager as well? How long does it normally take for Twilio to get an offer out? #hiringYOE: 5 TC: 152,0,7,2020-5-19 21:53:15,/post/Twilio-hiring-follow-up-vodS5wNk,Twilio
