,post_title,post_user,post_firm,post_position,post_text,post_like,post_comment,post_timestamp,post_url,company
0,Twilio Interview,bwSw06,/company/Adobe/,nan,"Have an onsite coming up for Software Engineer role at Twilio. It will consist of 4 rounds- Coding, 2 Design, Behavioral. What level of Leetcode questions to expect? How are their system design rounds?",1,7,2019-8-16 23:39:27,/post/Twilio-Interview-W36dO0EJ,Twilio
0,Twilio India salary range?,zozozzz,nan,nan,"Hello guys,I have an upcoming discussion with Twilio. Could you guys please guide me on what should I ask in terms of compensation and stock?Also, what is the interview process of Twilio India? How is the working environment and wlb?YOE-4.5TC- 12.5 Current company- Oracle.Looking forward to some guidance from the community.#tech #oracle #twilio",1,6,2021-3-26 09:49:35,/post/Twilio-India-salary-range-ax4pJktT,Twilio
0,Twilio India vs VMware India,SOHF42,/company/SmartBear-Software/,nan,"I am considering two offers currently, both are MTS2. I have 4 years of experience:VMware (India):Team: VMware on Cloud (AWS)TC: 36 lac (25 cash (base + variable) + 11 equity)Twilio (India):Team: Consumer TrustTC: 34 lac ( 19 base + 15 equity)I need some feedback on wlb, career growth, work culture to make a decision. Would really appreciate any feedback and reviews from the folks at these companies. #engineering #twilio #vmware",0,9,2021-1-24 06:17:36,/post/Twilio-India-vs-VMware-India-LsHQw6LF,Twilio
0,Twilio work and compensation,Jobhunt,/company/Microsoft/,nan,How is Twilio as a company to work for? How is the compensation for 10yoe backend engineer?How is wlb?,1,21,2018-8-23 22:42:17,/post/Twilio-work-and-compensation-hpcgH0zV,Twilio
0,Offer negotiation twilio,LPGM71,/company/Splunk/,nan,I have an offer from segment after twilio acquisition for staff level PM (IC4)They have given me an offer of 200 k base 500 k stocks over 4 yearsWhere is the room for negotiation ?My current tc is 360 k per year and would be 390 k after nexr vesting cycle happens Can someone tell where is the room for negotiation here ?#tech #twilio,1,1,2020-11-10 22:37:34,/post/Offer-negotiation-twilio-pvibH410,Twilio
0,Twilio interview,jobhunt123,/company/Salesforce/,nan,What to expect in phone and onsite Twilio interviews for a Lead engineer position?TC: 245,1,4,2019-9-26 23:03:54,/post/Twilio-interview-fBXSfnr3,Twilio
0,Twilio Interview,ArRF26,nan,Data,"I had an interview for BI analyst yesterday. Questions were pretty straight forward and I was able to answer them all.The last thing they asked was about salary.Do they really give $55,000-$65000 for this position?",2,4,2021-1-7 21:28:33,/post/Twilio-Interview-02mi68XN,Twilio
0,Twilio vs MS vs GS,ywsT11,/company/Amazon/,nan,"Hi, I’ve received 3 offers. I know, not really top of the range but I need to make the choice.. soon. Currently in Ohio, so will need to relocate. TC - 95kTwilio SDE2 4.5 years ExpLocation - DenverTC - 125K 160k/4 yearsMicrosoft SDE1Location - Bellevue TC - 135k 25k 130k/4 yearsGSLocation - DallasTC - Verbal offer only#twilio #microsoft #goldmansachs #offers",2,14,2021-2-19 03:18:24,/post/Twilio-vs-MS-vs-GS-MdO8kBPL,Twilio
0,Twilio Relocation Policy,JocL75,/company/Microsoft/,nan,"Hi, I have interviewed recently at Twilio India and wanted to know their policy to relocate from India to US.Current TC : 32 base + 3.2 bonus + 14 stocksYOE - 5 #twilio",2,10,2021-3-26 19:44:31,/post/Twilio-Relocation-Policy-xDUPMmy1,Twilio
0,Twilio Director comp,njfcll,/company/Atlassian/,nan,What is the compensation for director level at  #Twilio.#twilioTC: 430k,4,2,2020-7-23 05:17:14,/post/Twilio-Director-comp-7zV06ZT6,Twilio
0,Amazon or Twilio ,CazP48,/company/Amazon/,Eng,Going to interview Twilio. Is it a good place to work? Stay at Amazon or move to Twilio?,1,10,2018-9-18 05:52:53,/post/Amazon-or-Twilio-nnpcHHrD,Twilio
0,How's Twilio?,vi9j77,/company/Microsoft/,nan,"TC, culture, growth?",1,8,2021-1-26 20:55:19,/post/Hows-Twilio-uAGhP4Qo,Twilio
0,"Upstart, Twilio, Twitter Offer evaluation",gMNb04,nan,nan,"Hello Fellow Blinders,Please help me with the below offer evaluations and vote for one.Upstart - senior swe 170k base/300k RSU's/10% bonus               tc:262kTwilio - sr swe 190k base/435k RSU's               tc:300kTwitter - swe2  160k base/360k RSU's/10% bonus               tc:266kThough Twilio beats the other offers, I kind of want to make a decision based on the future growth of the above companies.All Roles are in the bay areaCurrent TC: 200k. #swe #software #engineering",1,17,2020-11-11 02:20:46,/post/Upstart-Twilio-Twitter-Offer-evaluation-b5BbKnxc,Twilio
0,Twilio RSU vesting method,ylogy^,/company/Microsoft/,nan,"Hey folks from Twilio could answer this.Lets assume the vesting schedule is as below:25% after 1 year completionremaining 75% divided equally every quarter for next 3 years.I have a doubt regarding the stock unit calculation.In all the orgs i have worked in past who provide RSUs, they calculate the stock units as per the stock rate during the joining date. Accordingly as per the schedule (as shown above) they calculate and lock the stock units for each vesting date in future (4 years).However the wording at Twilio offer shows that they calculate the stock unit quantity during each vesting date (some average of one month). Side effect of this is, one won’t be able to make advantage of the increasing stock price in future.Any Twilio employee could confirm this please?#twilio",4,17,2020-8-1 07:39:19,/post/Twilio-RSU-vesting-method-g8QaMp1o,Twilio
0,Twilio Vs Atlassian india ,gTbF82,/company/Siemens/,nan,"Atlassian - tc 22 lpa, 15 % variable , rsu 35k Usd , gratuity and pf on top of tc Twilio - tc 21.50lpa ,no variable , pf on top of tc , rsu 47k usdYoe -7 Current tc -19 lpa no RSU.Edit: this is for senior  Support role Atlanssian revised the RSU part to 45kAtlanssian ctc 22 lpa+ rsu 45k +15% variableTwilio ctc 21.50 lpa+ rsu 47k#offer #tech",2,24,2020-10-12 10:48:31,/post/Twilio-Vs-Atlassian-india-TGN30NOx,Twilio
0,TAM offer - AWS/GCP/Rippling/Twilio,TEAM_Playr,/company/Atlassian/,nan,"Dear Blinders,Writing to understand the pay breakdown for most TAM roles in India.YOE-5Base: 21LBonus: 10perStocks: 50K USDI am in the last rounds and am positive about receiving an offer from the above companies.What is a good offer and would like to know more about the pay for TAMs in India.Are there any companies for TAMs that pay better ?#gcp #google #microsoft #aws #amazon #twilio #TAM #CSM #cloud #atlassian #rippling",1,1,2021-5-18 05:03:08,/post/TAM-offer---AWSGCPRipplingTwilio-iUnLxioM,Twilio
0,Twilio : Interview Software Engineer,cBCJ82,/company/Visa/,nan,"Hi, All I have an upcoming Hackerrank coding challenge to be taken. I have been given 2 hours to finish it.  Folks who have given completed the test can you please give me a few pointers?#twilio #interview #software #engineering #swe #hackerranktest #hackerrank",1,18,2020-7-12 21:51:56,/post/Twilio-Interview-Software-Engineer-nPU8OgzE,Twilio
0,How's Twilio India?,niks101,nan,nan,"Fellow Twilions, How's twilio Bengaluru in India for SWEs in terms of culture compensation wlb and growth. I know it's really good in the states.TC:20LYOE:4",8,3,2021-2-8 14:36:01,/post/Hows-Twilio-India-8WS8Xvig,Twilio
0,Twilio Bar Raiser Interview,gear9,/company/Synopsys/,nan,"Any insight on how the bar raiser interview at Twilio is conducted, types of questions, etc.?TC: $102k",1,5,2020-9-29 01:53:52,/post/Twilio-Bar-Raiser-Interview-x3sLMD4c,Twilio
0,Twilio,arglebarg3,nan,nan,long term health Looking good? What’s internal morale like? How does TC compare to FAANGs,4,7,2019-1-25 01:28:12,/post/Twilio-GMev6C8L,Twilio
0,Twilio Referral ?,nerdnight,/company/Salesforce/,nan,"Hi everyone,I found a very cool Sr PM opening at Twilio and was wondering if anyone would be willing to do a referral ? Happy to share more of my details.TC: 245k,  yoe-6 yrsLet me know if anyone can help :)#referral #twilio",0,2,2021-5-12 22:45:06,/post/Twilio-Referral-8tuXNWnZ,Twilio
0,Rubrik vs Twilio,PiP'd,/company/Nutanix/,nan,I am in a final stages of Interview at Rubrik & Twilio and wanted to get people's feedback about which company would you recommend to join and why ? (The role is a hybrid of Services & Tech Sales) ? #jobs #interview,1,1,2020-9-26 01:23:51,/post/Rubrik-vs-Twilio-jizZwd5p,Twilio
0,Twilio stock,nakku,/company/Microsoft/,nan,Bought @88,1,7,2020-5-13 14:27:37,/post/Twilio-stock-T3iLv7Wb,Twilio
0,Twilio hacker rank coding challenge,Gnoo84,nan,nan,"Hi, Guys, I am taking twilio coding challenge in a couple of days ..any pointers?",1,14,2019-8-14 05:32:39,/post/Twilio-hacker-rank-coding-challenge-LNQJa2xA,Twilio
0,Twilio?,tinkergeek,/company/Zendesk/,nan,Got an offer...comps decent but how's the company culture and business plan?,4,6,2017-4-23 05:45:35,/post/Twilio-yUXFEnET,Twilio
0,[Twilio] culture and worth the change?,sinister00,nan,nan,"Guys i recently went through the interview process for staff SRE for Bangalore. The offer 38l fixed + 20l yearly stockIm not sure if its worth the change. Ive seen a few reviews around PIP culture and bad mgmt, is this true? In what situations do you get into PIP and how is thw work quality?Acc sec teamCurrent TC: 38l all inclusiveYOE 8@twilio#twilio",1,2,2021-5-21 17:04:43,/post/[Twilio]-culture-and-worth-the-change-QAfxbtOr,Twilio
0,Twilio TC target,FungYY,/company/Amazon/,nan,What is the TC target for P4 TPM role with Twilio? Interviewing with them and want to know ranges.Current TC: 210,0,5,2021-3-12 01:09:09,/post/Twilio-TC-target-Fkucwypf,Twilio
0,Twilio Product management levels,dkHB70,/company/Amazon/,nan,"Hi,I am struggling to understand the product manager levels at Twilio. On LinkedIn I see people who are moving from pm to sr. Pm and principal pm. But then I am also seeing a few staff PMsCan folks from twilio throw some light and also how do these map to Amazon levels.",2,2,2021-4-24 06:06:11,/post/Twilio-Product-management-levels-gbBOL6vy,Twilio
0,Twilio senior EM offer ,off2345,/company/DigitalOcean/,nan,Can someone share what does the Twilio Senior EM package look like? #tech,0,8,2021-3-29 22:28:45,/post/Twilio-senior-EM-offer-tvh7wEgN,Twilio
0,Twilio L3,GaEY34,/company/Zebra-Technologies/,nan,I got an L3 interview request with 3+ YOE.Is 3+ enough for Twilio L3.Any suggestions on what the OA prep should be?Tc: 110K#twilio #google #facebook,3,3,2020-11-12 02:36:56,/post/Twilio-L3-872j0f2J,Twilio
0,Twilio yearly RSUs,toiletseat,/company/Sam's-Club/,nan,How much do average software engineer earn every year in RSUs? (Refreshers)#twiliocurrent tc: 125k,0,2,2020-5-21 03:12:29,/post/Twilio-yearly-RSUs-oyFUYOQv,Twilio
0,Twilio Offer Evaluation,t1c,/company/CBS-Interactive/,nan,"Role: Sr. SWEYOE: 6Location: Bay areaBase: 155kRSU: 200k (over 4 yrs but the good news is they said it vests monthly after 1st year)Sign on: $5k (Seriously?! WTF)Bonus & Refreshers: Recruiter said it would depend on performance, any median percentage figures from Twilions would be helpful.TC: $210k+Sad truth: This is better than my current TCHow can I negotiate better? They don't seem to budge.",2,17,2019-5-2 02:11:51,/post/Twilio-Offer-Evaluation-E6ghE8ae,Twilio
0,Twilio TAM salary ,baJg68,/company/Microsoft/,nan,"Hello. I am interviewing for a TAM (technical account manager) role at Twilio for the west coast area. I was looking for insides on what TC (salary, stock) to expect. As well how does the stock refresh looks like?Thank you!Current TC ~145kYOE: 9 (not as a tam - mixed disciplines)Location West Coast",0,1,2021-4-24 20:56:31,/post/Twilio-TAM-salary-YzPx2ngB,Twilio
0,Microsoft vs. Twilio PM offers,vYWp03,/company/Microsoft/,nan,"Posting for a friend.Currently a Product Marketing Manager in a large tech looking to get into PM. YoE 3.5MSFT offer: L61 PM 2 with the Bing team. TC ~$155k, based in RedmondTwilio offer: L3, TC ~$240k+ (140k base, 180k RSU, no bonus, annual refresh = 30-40% initial RSU). The product is super niche (buying phone numbers from telcos and reselling via API). Based in SF.End goal is FANG PM roles.Although MSFT offer is a lot lower, it is with Bing so will give some relevant ads experience. I’m worried the Twilio product is too niche and I can’t go anywhere from there.Thoughts on which offer to take?#microsoft #twilio #productmanager #google #facebook",2,7,2021-3-17 07:08:17,/post/Microsoft-vs-Twilio-PM-offers-mM4z1Pkj,Twilio
0,Twilio yearly bonus,halfmoon,nan,nan,Does twilio pay yearly cash bonus or rsu refreshers?,5,6,2019-5-17 06:20:32,/post/Twilio-yearly-bonus-Q8ZF7avq,Twilio
0,How stable is Twilio?,trva12,/company/Verizon-Media/,Eng,"Were there any layoffs (in the past)? Also, I heard that Twilio is renting space from wework in Dublin. Why not have it’s own building? This gives me an impression that it can anytime shutdown the office and fire all employees in Dublin. Maybe I am wrong but this is just a thought.Some insight into Twilio would be helpful.",5,18,2019-6-18 06:16:23,/post/How-stable-is-Twilio-oXHT5YPv,Twilio
0,Twilio phone interview,zIra24,/company/eClinicalWorks/,nan,"Any insight about questions or patterns for Twilio Phone interview for Senior Software Engineer? what level of Leetcode? will it be one question or two? any help is much appreciated. thanks!TC: 120k, east coast. #leetcode #twilio #amazon #facebook #twitter",0,9,2020-3-3 00:03:02,/post/Twilio-phone-interview-AhTQvLwe,Twilio
0,Twilio culture,bnbhhh,/company/Amazon/,nan,how is Twilio culture?TC : $360K,1,3,2020-6-20 06:21:27,/post/Twilio-culture-a3T74nky,Twilio
0,Twilio VS Microsoft?,PyplCTO,/company/PayPal/,Eng,Got offers from Twilio and Microsoft. Which one to choose? Suggestions plz. - Senior levelTwilio - SF - SeniorTC - 220KMicrosoft (still negotiating) - Redmond - T61TC - 175K,0,18,2018-12-8 02:57:09,/post/Twilio-VS-Microsoft-EJGsK2PH,Twilio
0,Twilio Referral help,xgan24,nan,nan,Can someone please help me with a referral at Twilio? I have a specific role in mind.YoE - 3TC- 38 lac#hiring #referral #twilio,1,5,2021-4-21 21:11:11,/post/Twilio-Referral-help-wxhgwhDv,Twilio
0,Offer Evaluation - Twilio,pfDO07,nan,nan,How does this offer look?This is for L1 in SFYoE: 0Base: 135kStock 120k/4Signing: 10kThoughts? Could I ask for more?,6,4,2020-12-21 22:39:50,/post/Offer-Evaluation---Twilio-qRcn7pRY,Twilio
0,Twilio segment offer eval,glorified,/company/Google/,nan,Senior sweBase : 160kRsu:320kSign on: 20KLocation: remote (east coast)How is it?,0,6,2021-3-23 00:01:18,/post/Twilio-segment-offer-eval-bbhnK8Jq,Twilio
0,Twilio is recruiting,PQTy87,/company/Twilio/,Eng,Multiple positions open around the world. DM for referral#referral,13,39,2020-3-21 20:20:20,/post/Twilio-is-recruiting-tQZvJtRH,Twilio
0,Twilio Bar raiser,amardeep,nan,nan,"Hi folks, I am interviewing for a Solution architect position in Twilio, location is remote and going to be customer-facing with technical capabilities. I have gone through 3-hour hacker rank coding and then in the virtual event for 3 hours with 3 people including a presentation round. I have a Twilio bar raiser interview left,  Can you please suggest that what kind of questions I can expect. This position is within the Twilio professional services group.Please also suggest what kind of offer Base +RSU I can expect if I get selected. Currently, I am based out in Dallas and making 170K (Base + Annual bonus.) #twilio #solutionarchitect #cloud #dallas #remote",1,3,2020-11-28 05:07:07,/post/Twilio-Bar-raiser-JjpXDKTj,Twilio
0,Twilio referral,panamar3d,/company/Amazon/,nan,Hi blinders. I’m looking for help with a Twilio referral for a marketing role. Happy to DM and share more. Thanks all.TC:255kYOE: 10#tech #twilio,1,2,2021-2-14 01:54:41,/post/Twilio-referral-cnyOTt2U,Twilio
0,Twilio Vs Cruise Automation,qtwC34,/company/Lending-Club/,nan,TC first yearTwilio: 170k base + 50k RSU + 10k sign onCruise Automation: 170k base + 30k annual bonus + 30k RSU + 10k sign onYOE: 2.5.Level: ic2 (L4/swe II at other companies) both offers.Please let me know your opinions on comp and the companies themselves. I’d appreciate specific feedback.,1,22,2018-11-21 05:21:55,/post/Twilio-Vs-Cruise-Automation-8RRnTdUm,Twilio
0, twilio denver,QcTD43,/company/Visa/,nan,"how is twilio’s denver office. want to know a little about culture, work/life balance and perks? #tech",0,6,2020-8-13 05:32:29,/post/twilio-denver-5Jg2fxpm,Twilio
0,Twilio Vs Visa,canyoudoit,/company/Hitachi-Vantara/,nan,Finally got a call from Twilio's recruiter yesterday that I cleared the virtual on-site interview. Visa offer is 215k (140k base + 175k/3 stocks + bonus). I am accepting similar number from Twilio.YOE 6Location DenverWhich one should I join ?,1,12,2020-3-24 14:42:44,/post/Twilio-Vs-Visa-BU3y6gdL,Twilio
0,#twilio,KMtg77,/company/Oracle/,nan,Anyone from twilio here? how's the company and it's culture? Do you think there are good chances for career growth here? Please share your experiences.,8,2,2016-11-18 05:16:21,/post/twilio-ThJriUrA,Twilio
0,Twilio staff SRE bangalore,swe_!_,nan,nan,"I am interviewing for twilio bangalore for their SRE role, and done with 2 interviews 2 more to go.Any idea about the  WLB, and compensation?? Have an offer from Palo alto networks 34 +15% + rsu 65k(over 4 years)Current TC. 34lpaYoe 8Which would be a better org to join?",4,9,2021-5-10 09:24:11,/post/Twilio-staff-SRE-bangalore-42UWVfQO,Twilio
0,Giving Twilio Referrals!,olaaa,/company/Twilio/,nan,There are multiple openings for Twilio hiring across a wide experience pool in Bengaluru and Talinn (2+ to ~10+ yoe).Feel free to DM in case someone needs a referral for these or any other location.Cheers.    #hiring #bangalore,3,3,2021-3-16 06:37:10,/post/Giving-Twilio-Referrals-OjKcgTHE,Twilio
0,Twilio hackerrank test,QVgI02,/company/Palo-Alto-Networks/,Eng,How do I prepare for Twilio initial hackerrank test?Is it LC easy/medium or hard?How many questions are asked?#twilio #hackerranktest,3,3,2020-9-4 22:43:21,/post/Twilio-hackerrank-test-FddNGULM,Twilio
0,Twilio eng,Moo!,/company/OpenDoor/,nan,What do Twilio salaries look like? And what are great teams inside of Twilio to join? Considering interviewing.,2,5,2019-9-27 20:16:34,/post/Twilio-eng-y8XBs18x,Twilio
0,"Twilio result is good, but stock going down",CoffeCoke,/company/Amazon/,nan,Twilio results seem to be good but then why the stock price is going down every day.#tech #stockmarket #stock #investments,0,9,2021-5-10 15:37:23,/post/Twilio-result-is-good-but-stock-going-down-w5LTC18n,Twilio
0,Twilio RSUs question.,apps20,/company/eClinicalWorks/,nan,"Hello Twilio folks,I'm in process of getting an offer for a Data Staff Engineer position. No numbers yet.Is it true that initial RSUs get vested monthly after the 1st year. Also how is ESPP program??I can also DM you if thats preferred.Thanks for all the information. Much appreciated!!Current Employer: WayfairTC: 140kYOE: 10#twilio #swe #interview",2,9,2020-7-24 22:15:08,/post/Twilio-RSUs-question-NSE30MQz,Twilio
0,Twilio Stock,HHLm58,/company/Salesforce/,nan,Anyone here think Twilio stock price will go back to it’s heyday? I have stock and im trying to figure out if i should stay or should i go.,2,8,2020-2-27 17:33:50,/post/Twilio-Stock-0XoKB5r1,Twilio
0,Twilio referral ,_cyber_,/company/EY/,nan,Hello folks! I am interested in a role with twilio and looking to get a referral. Happy to dm and appreciate your help with this!,2,13,2020-12-16 21:23:11,/post/Twilio-referral-njKWCKhU,Twilio
0,Twilio is still hiring,Rrrrrrrrra,/company/Twilio/,R&D,I wouldn't haven been in Twilio without a referral. Giving back to the community in these tough times. We're hiring for multiple roles in several offices. Feel free to dm for a referral. https://www.twilio.com/company/jobsEdit:Please share your LinkedIn profile and the job URL of the roles you are interested in dm#hiring #jobopening #recruiting,6,32,2020-4-3 04:00:09,/post/Twilio-is-still-hiring-01hm6OD7,Twilio
0,Twilio WLB/Culture - AI,beeeeefu,/company/Amazon/,nan,Does anyone know anything about the AI department? How is work life balance? How busy is oncall? Any information is appreciated!Role: SDEYOE: 2y,0,1,2021-5-15 02:00:30,/post/Twilio-WLBCulture---AI-s5m1J8j5,Twilio
0,"Deciding team at Twilio, India",wcrossx,/company/Microsoft/,nan,"11yoeHi Twilions,which team among below is good team at Twilio India for Data Science work?1. Customer Engagement Team2. Consumer Products (Trust) TeamRecruiter also gave the info that both are DS oriented teams. 1) Consumer Engagement Team is more towards the products which has interaction with end customers.Customer Engagement Platform : https://boards.greenhouse.io/twilio/jobs/2188412Customer Engagement is a new product strategy for Twilio. We are spinning up a new team to help guide Twilio into our next era of growth. This team will introduce new engagement products and help current teams bridge together existing products into a seamless customer engagement platformThe CEP product is central to Twilio's future transformation. It is the customer engagement platform of the future, enabling companies to engage and retain their target customers. We serve both enterprise customers as well as the developers that work to customize their CEP solution. 2) Consumer Products team is more towards security/fraud/anomoly detection of the profucts of twilio. Consumer Trust : https://boards.greenhouse.io/twilio/jobs/2220198Machine Learning engineers will be responsible for solving various problems to detect fraud/ compute customer trust score in near real time. Business problems that need to be solved include phishing on both email and messaging platforms, risk based authentication, account takeover detection, clustering to name a few. ",1,75,2020-7-10 07:34:36,/post/Deciding-team-at-Twilio-India-r4GGbDjb,Twilio
0,Twilio India - Worklife balance,RAdC42,/company/Amazon/,nan,Thinking of applying to Twilio in India. Can someone share how is the work-life balance at Twilio and the work culture and the environment?Thanks.#twilio #india,4,15,2020-7-14 05:20:57,/post/Twilio-India---Worklife-balance-Vr4Bi6cT,Twilio
0,Twilio Performance Reviews,Jkin,/company/Oath/,nan,"Hey awesome Twilio folks,How often do you have compensation /performance reviews per year? And what's the average salary bump percentage do you get each time in case of good performance?Thanks",4,4,2019-2-12 12:18:36,/post/Twilio-Performance-Reviews-tzKPpC78,Twilio
0,Twilio Segment offer expectation ,MuperSan,/company/Google/,nan,How much should I expect for Segment(Twilio) Senior SWE? I have no numbers yet!Current TC: 340 (Bay Area) not currently in Bay Area however!,0,6,2021-3-10 00:46:16,/post/Twilio-Segment-offer-expectation-wrYFgTxL,Twilio
0,Twilio Interview for EM role India,NSSF07,nan,nan,"This is partly to vent.Joined blind a while back and inspired by you guys and your amazing TCs, started applying for interviews.Wrapped up interview loop with twilio for EM.5 rounds, I felt they went off well, considering this was the first company I interviewed for in almost 5 years. I did not put much effort into prep except for SD.Got positive vibes in all the rounds except the bar raiser. I legit felt I bombed it especially around 1-2 questions but was in denial until I heard from the recruiter.Anyway got rejected and I felt devastated, took it maybe a little too personally because my last rejection in an interview was 10 years ago ! Lol ..Anyway realised it's not a good idea to go in without prep (maybe I was overconfident).Continuing to apply to every single EM opening I see while prepping on SD. Not sure if I need to LC as well, will appreciate any guidance and help for referrals.YOE : 11TC : 29L#twilio #engineering #referral",1,9,2021-5-13 15:00:12,/post/Twilio-Interview-for-EM-role-India-rDMs68Ov,Twilio
0,Offer Eval - Twilio P5 Solution Engineer,Ether999,/company/Salesforce/,nan,Still negotiating ….B: 135 - 145 (OTE ~200 - 210)Sign On: negotiating RSU: 350 / 4YOE: 9,0,7,2021-5-18 19:10:01,/post/Offer-Eval---Twilio-P5-Solution-Engineer-0GyMFV3E,Twilio
0,Twilio hackerrank,maWI30,nan,Data,Anyone here took the hackerrank challenge for MLE position at Twilio? Any insights on what to expect and the level of difficulty or anything pertinent is much appreciated!!Thanks.TC : 0 (New grad),2,14,2019-11-20 02:42:05,/post/Twilio-hackerrank-RSVsXSba,Twilio
0,Staff software engineer in Twilio,pgtwo,/company/Amazon/,nan,What’s the scope of a staff engineer in Twilio?Equivalent to sdeiii in Amazon?,0,1,2021-4-30 19:51:16,/post/Staff-software-engineer-in-Twilio-2UJW8YtN,Twilio
0,Twilio Stock,ozNj21,/company/Amazon/,Other,Why has Twilio’s stock risen so high? Is it still a buy? Why yes or no?,1,6,2018-9-16 07:59:03,/post/Twilio-Stock-eYgUnMPC,Twilio
0,Working at Twilio ! ,tutus,/company/Cisco/,nan,"People who are working at Twilio, can you comment on the culture and the future growth? I see amazon and salesforce are the investors and stock is rallying good. How do you compare the TC and the WLB and reputation of Twilio with that of FANG ?TC:150",7,7,2019-6-2 20:29:58,/post/Working-at-Twilio-6RboC16t,Twilio
0,Twilio PM,sad20,/company/Amazon/,Product,Anyone knows what the PM interview process is at twilio? And what's the TC band for product manager/senior product manager in the US ? (They said it's a remote US role),4,5,2020-8-16 08:14:17,/post/Twilio-PM-U5aK53OS,Twilio
0,Twilio referral,FGXr44,/company/Goldman-Sachs/,nan,"Hi all. Looking for a Twilio referral, happy to share more details through DM.Thanks!#referral #twilio",0,5,2020-10-11 18:32:40,/post/Twilio-referral-kdyhObC2,Twilio
