,post_title,post_user,post_firm,post_position,post_text,post_like,post_comment,post_timestamp,post_url,company
0,Twilio comp,Dfrb67,/company/8x9/,nan,Levels.FYI doesn’t have many samples.  What is a comparable company to benchmark offers against for senior levels? Cisco/PalPal/FAANGs etc?Bay Area,1,13,2021-5-18 03:57:50,/post/Twilio-comp-mJ1OrzGE,Twilio
0,Twilio,JG002,/company/Deloitte/,nan,"I would love to hear about the culture of Twilio - specially work life balance, company focus on well-being, investment in D&I etc. Given the stage of the company, I'm wary that it could to quite chaotic.",4,25,2021-3-22 20:57:58,/post/Twilio-8ke0wdxs,Twilio
0,Twilio engineering management,spybot,/company/Expedia/,nan,"Thinking of applying to Twilio, found a few remote positions that look interesting. Looking at Sr EM positions and wondering what type of TC I should be asking for. Also wondering if anyone is aware of what the various EM levels are and what the expectations are from, say, a director vs a Sr EM. Do Sr EMs manage managers?Looked at a few threads, but hoping for some more up to date information. Already further along in the interview process with other companies in Seattle (full loops coming up), so trying to determine when/if I should apply.YOE: 13Current TC: 300k, aka peanuts",2,19,2021-5-15 19:23:17,/post/Twilio-engineering-management-T3y27R6o,Twilio
0,Twilio culture,fingerchip,/company/Microsoft/,nan,How's the work culture in the Messaging BU at Twilio? How's WLB? Is there PIP?,4,29,2021-4-1 01:41:38,/post/Twilio-culture-dpiWTp1i,Twilio
0,Interviewing at twilio,zungru,/company/Atlassian/,nan,"Hello,Recruiter reached out for bsckend swe position. I am currently sr software engineer at atlassian. YoE : 10TC: 320KI asked for 450k salary but recruiter said L5 at twilio is very difficult. He said to interview at L3 or L4 and of given an offer it would around 350k to 400k max.Can someone share poaitions at twilio, rough salary numbers and expectations?Thanks in advance.#engineering #software #twilio",0,16,2021-5-7 06:27:16,/post/Interviewing-at-twilio-qCgX8EzM,Twilio
0,Twilio onsite?,Jjdd27,/company/Citrix/,nan,Has anyone attended twilio onsite? Please let me know what to expectTC : 160K,2,15,2021-4-27 00:55:20,/post/Twilio-onsite-GDQGCekV,Twilio
0,Coinbase or twilio?,elonbezoss,/company/Amazon/,nan,"Have product management offers from both - coinbase is L5 while Twilio is L4. Pay seems comparable, looking for feedback on cultures and growth potential. Thanks!Coinbase tc - 270k (pm 2)Twilio tc - 260k (staff PM)",0,22,2021-4-26 18:54:11,/post/Coinbase-or-twilio-fFSnNeJZ,Twilio
0,What's It Like at Twilio?,l67on99,/company/Facebook/,nan,"Hello Twilio of Blind Community,I noticed that Twilio is ranked fairly decent in overall score, especially WLB and compensationWould you guys be able to tell me 2-3 best things about working at Twilio and 1 or 2 bad things about working at Twilio?(Skip to comment section at this point if you do not wish to read on about my background)Background:After working at a disastrous team with terrible manager, being backstabbed by a teammate, and hearing confirmation of a neighboring teammate's suicide, I took the courage to seek a different opportunity in hopes of escaping this nightmarish reality.  Ultimately, I did NOT receive offers from my preferred companies, but did receive acceptance to a decent MBA school (Harvard/Stanford/Wharton).Post-MBA, I hope to find a company with great WLB, fair compensation, and most of all, genuine culture with genuine people.Rest assure, I will continue to receive therapy during school so that when I come back to the workforce, I can contribute to the team with the best of my abilitiesThanks in advance, everyone!",6,36,2021-5-3 12:02:26,/post/Whats-It-Like-at-Twilio-iRKuitHF,Twilio
0,Twilio Interview Delay,Godbless20,/company/Booz-Allen-Hamilton/,nan,Interviewed with Twilio more than a week ago and am waiting on next steps. Is anyone familiar with their hiring process and experienced delays? I emailed their HR POC and still no response.,0,14,2021-5-12 17:14:25,/post/Twilio-Interview-Delay-hhmCyE75,Twilio
0,Staff Software Engineer @ Twilio vs VMware,NXGk46,/company/Amazon/,nan,I have offers from Twilio and VMware for a staff software engineer role. How are the refreshers at both companies? If the TC at both is similar which one would you choose and why?Twilio offer : 365kVMware offer: 375kLocation: Bay AreaCurrent TC - 260k (without stock appreciation)Update: Accepted Twilio’s offer. Also got an offer for PMTS role @ OCI but was unable to negotiate with them as Twilio’s deadline expired the same day,1,50,2021-5-4 02:41:07,/post/Staff-Software-Engineer-@-Twilio-vs-VMware-TaD0WhVL,Twilio
0,Deciding between Twilio and Thumbtack,sQiy60,/company/Cornerstone/,nan,"Please help me decide which offer to take:Twilio: full stack javascript developer on services operationsBase:$150k, rsu:$200k over 4 yearsTC: $200k per yearPublic companyThumbtack: frontend developerBase: $160k, equity: $280k over 4 yearsSign on bonus :$15kTC: $245k first year.Pre ipo so equity is just on papers.Both positions are remote and I'm planning to move to Austin after I accept the job.Current TC:$135kTotal yoe:8 Mid level engineer #offers #twilio #thumbtack #softwareengineersalary",2,18,2021-5-14 21:41:37,/post/Deciding-between-Twilio-and-Thumbtack-JMpdCooz,Twilio
0,Thoughts on Twilio,cjbb2020,/company/BCG/,nan,"Considering a Twilio offer. How well-respected is Twilio as a brand name? Any thoughts on culture, WLB, upside potential for the stock?TC: 230YOE: 4",2,31,2021-4-3 13:25:07,/post/Thoughts-on-Twilio-0v7cRsHa,Twilio
0,Offer Eval India... Expedia vs Twilio,Moodi Ji,/company/Adobe/,nan,"Expedia gurgaon sde3 TC 42L  Base 35LTwilio bangalore sde3 TC 47L  Base 28LYoe 4.8Current TC 24LWhich one to choose?Twilio conTwilio's team is little weird, they do SDK and helper libraries development and not backend development. I've experience and interest in backend distributed systems.Expedia conCurrent pandemic situation and layoffs.Extremely confused between the two since 3 days, kindly help.PS : not in Adobe, took friends account",2,53,2021-4-26 07:54:47,/post/Offer-Eval-India-Expedia-vs-Twilio-tkQbj42S,Twilio
0,Twilio Offer Eval,jVcB67,/company/Twilio/,nan,"I recently received an offer as a Software Engineer L1 @ Twilio. Salary: 128,900Equity: 120k over 4 yearsI know some other ppl who were hired as L1's in previous years who received at least 130k salary, same equity.I was told by HR that the cost of labor went down in SF. That seemed sketchy so is there another L1 who recently got hired that can tell me what their offer was, or someone else who would know the current L1 rate at Twilio?",4,7,2021-5-14 18:16:40,/post/Twilio-Offer-Eval-BQAEUtFR,Twilio
0,Twilio Culture,vYWp03,/company/Microsoft/,nan,How’s it like working for Twilio? How is the internal mobility (and specifically for PMs)?Is there PIP / how bad is it?Would love to get your thoughts!,5,10,2021-3-26 16:15:09,/post/Twilio-Culture-kJtoHyLn,Twilio
0,Twilio offer,urKF08,/company/Cvent/,nan,I have a offer from Twilio for working as remote in Dallas. My base salary is 122k and stock option of 135k which will vest over a period of 4 years. Is this amount under paid or is quite ok. Also working remotely at Twilio will impact performance or my impression on manager.,0,10,2021-3-21 00:51:18,/post/Twilio-offer-3ZQwVDA6,Twilio
0,Twilio culture and stock growth,CellBreak,/company/Amazon/,nan,Twilio recruiter contacted me for the staff engineer opening at Twilio Bangalore. It seems like a good opportunity.How is Twilio Bangalore culture?How is the engineering team culture at Twilio Bangalore?Do you think there is any growth in Twilio stock for the next 1-2 years?YoE - 6TC - 45 lakhs (recently promoted to SDE-II) #twilio #softwareengineer #culture #wlb #amazon #techcareer,2,7,2021-5-19 11:15:43,/post/Twilio-culture-and-stock-growth-S1ju3Oec,Twilio
0,Twilio M4 salary,SaveOcean,/company/Amazon/,nan,"Hello,Can someone share information about the salary range in the US for M4 (Sr. EM) level at Twilio?How is the working environment?YoE - 12Location - SFTC - 330k#salarynegotiation #salaries #twilio",0,14,2021-4-20 04:50:00,/post/Twilio-M4-salary-JSUmcLAO,Twilio
0,Offer Evaluation Twilio vs Doordash,zsc,/company/Amazon/,nan,Role: Sr. Engineering ManagerTwilio TC: 460 K  220K base 240K RSUDoordash TC: 550 K 225k base 325 k RSUPlease advise. #techcareer #offers #engineeringmanagercomp #software #hiring #jobhunt ,6,18,2021-5-1 12:35:43,/post/Offer-Evaluation-Twilio-vs-Doordash-QRWZByhy,Twilio
0,Twilio Sales,QmGkJZ,/company/Tableau-Software/,nan,"#twilio #sales #enterprisesalesWhat is a good offer for a Twilio Enterprise sales role?Salary, RSU, Sign On Bonus?10 years of experience#ae #sales #enterprisesales",2,6,2021-4-11 01:12:05,/post/Twilio-Sales-PfhL8Uz1,Twilio
0,Twilio Millionaire,ygritt,/company/Sam's-Club/,nan,"I have heard few stories about SDEs joining Twilio pre-ipo, now their TC is worth 1M+Not sure if this is just an exaggeration.Twilions any interesting stories you want to share?#twilio #tech #tcYOE 2TC 170k",9,44,2020-6-25 00:03:53,/post/Twilio-Millionaire-YzemhdYX,Twilio
0,Twilio,fbemployee,/company/Facebook/,nan,"I received an offer to work at Twilio and would love to know more about the company!How is the overall culture? Since the CEO comes from Amazon, is it similar to there?How is the performance culture? Is it easy to get into PIP if performing badly?How is the transfer culture? Easy to transfer to a different team? What about transfers between offices?How easy is it to travel to other offices? Does it require a lot of approvals or pretty easy? Do people fly business or economy?Thanks guys!IC5 TC: 250k",4,20,2019-9-6 15:26:23,/post/Twilio-8Fykw2b7,Twilio
0,Twilio,SVK007,/company/BetterWorks/,nan,Anybody here work at Twilio and can share how it is working there?,4,15,2019-6-5 02:14:34,/post/Twilio-dxSuwhnS,Twilio
0,Paypal vs Twilio,ytoz56,/company/Informatica/,nan,"Interviews going on for this two companies. Between I like to know which company is better for growth, brand and culture. #engineering #paypal #twilioLocation: Bangalore",1,36,2020-9-20 03:12:44,/post/Paypal-vs-Twilio-7BqxXZxn,Twilio
0,Nvidia vs Twilio,2s4h6r8,/company/The-Home-Depot/,nan,"I have offers from NVidia (Infra team) and Twilio (Big Data team).Comp from Nvidia: $153K base, $240K stocks (vests in 4 years), $10K sign on, NO YEARLY BONUS which makes it to $213K TC excluding sign onComp from Twilio: $155K base, $160K stocks (vests in 4 years), $15K sign on, 10% yearly bonus which makes it to $210K TC excluding sign onI have pit both companies against each other and there is no scope for anymore negotiation.YOE: 5 yearsLocation: Austin for bothCurrent TC: $170K- Which company should I opt for? Both companies are performing extremely good in their space and hence I’m getting confused. - I really like the Twilio position considering the stack they are using. Lots of learning involved. - With Nvidia, there will be lots of learning too considering I don’t have any experience in the Infra side of the things.Also, how much refreshers do people get at Nvidia and Twilio?#engineering #software #nvidia #twilio",3,43,2020-7-31 05:10:40,/post/Nvidia-vs-Twilio-uyfYCxNj,Twilio
0,RSU at Twilio ,gbSF41,/company/Capital-One/,nan,"Hi all,I recently got a verbal offer from Twilio. I wonder what is the price of stock I will get. Is that the price of vesting day or the price of the day I sign the contract.Current TC: 100kOffer: base 110k, RSU: 150k for 4 years.#twilio #engineering #software #swe #rsu",2,11,2021-1-29 03:43:09,/post/RSU-at-Twilio-gts2spT2,Twilio
0,Twilio vs Amazon,Leetchod,/company/Veritas/,Eng,"Have offers from both of them.From work, manager, and team perspective Twilio is exciting but Amazon TC is 25% higher than Twilio and no more negotiation with Twilio. Don't know more details about work, manager, the team at Alexa yet.Being early in the career, care more about learning opportunities.Which one would you choose and why?Edit:I have other competing offers (Msft, Didi, Salesforce, OCI) which are paying much higher than Twilio but considering factors shown above in the table, Twilio and Alexa are the top 2 picks. Others are in the next columns. Edit 2:TC:Amazon Seattle TC = (1.25) * Twilio Bay Area TC Base: SameEquity: Same amount, different vesting schedule Signon: Twilio (0) vs Amazon (80k 1st year and 60k 2nd) paid monthly which is standard Amazon practice ",4,87,2018-11-3 05:45:00,/post/Twilio-vs-Amazon-73PZkzW4,Twilio
0,Twilio vs Stripe,Ether999,/company/Salesforce/,nan,"Keeping TC aside and considering Stripe’s new RSU policy, a bit difficult to decide. Great platform, great teams and really good people as well.Totally split ...",0,6,2021-5-11 21:00:36,/post/Twilio-vs-Stripe-KoeC0wAX,Twilio
0,Offer evaluation - Twilio,canyoudoit,/company/Hitachi-Vantara/,nan,"Got the numbers, not what I was expectingBase 130kRSU'S 140k/4 yearsYOE 6 yearsLocation DenverI have another offer 140k base + 10% bonus + 175k/3 stocks, same locationI really like twilio profile and the company! But the offer seems low.Can Twilio match the other offer and what do you think about the offer? Any help is appreciated",2,32,2020-3-25 03:48:29,/post/Offer-evaluation---Twilio-jfFy05su,Twilio
0,Oracle OCI vs Twilio Segment (Bangalore),Lcoder,nan,nan,"Hello, blinders,I am having following offers, which one would be better considering overall career growth and WLB.Current TC: 20lpaExp: 8yrsTwilio(Segment)Offered TC: 69lpa (base 42 + Stock 23 + Signon 4)Role: Staff software engineerTech Stack: Golang, AWSOracle(OCI)Got positive feedback from the interview loop. Quoted the Twilio offer numbers.I doubt if they will match the offer. But in case if they match.Role: IC3 (Media Services)TechStack: Mostly Java and Devops workLooking at the glassdoor review it seems like Twilio (Segment) has better employee culture. #engineering #twilio #segment #oracle #oci #indiasalary #bangalore",2,18,2021-5-24 15:27:04,/post/Oracle-OCI-vs-Twilio-Segment-Bangalore-0TMqHF3E,Twilio
0, Stripe / Twilio / Spotify Offers Eval,rogue-1,nan,nan,Have 3 offers so far on the table and 1 more decision pending.Base | Stock | Bonus / Sign-on:Spotify (L2): 180k | 40kStripe (L2):   175k | 105k | 17.5k | 35kTwilio (Segment) (IC3):  175k | 85k | (Still negotiating)All offers are remote. I'm on the east coast (Not NYC) with not so expensive COL.YOE: 4Current TC: 140kLC: Hardly 4-5Stripe being pre-IPO does have a somewhat higher upside. Not sure how the current $95B valuations will play out. Am I missing a lot on the growth? Is it too late? How's the WLB at Stripe internal-facing teams?Twilio seems to have a good future as well but I'm not sure if this is the right time to join given the fact that their stock has shot up a lot already in 2020. I'm kinda torn between Stripe and Twilio. If I managed to get similar comp at Twilio do you think it's worth joining instead of Stripe? How much growth you think Twilio will have in a couple of years? How is Segment overall? Is it worth joining after acquisition?#stripe #twilio #spotify #segment #offers #comp #salary #salarycomparison #compensation,2,10,2021-3-12 19:05:11,/post/Stripe-Twilio-Spotify-Offers-Eval-ykUqB5qf,Twilio
0,Twilio Staff Engineer,eADl56,/company/Grab/,nan,I got selected in Twilio as Staff Engineer in Bangalore Office.What is the Salary I can expect?YOE - 12#twilio #bangalore #ic4,4,50,2020-7-7 06:40:43,/post/Twilio-Staff-Engineer-FOTDmK0U,Twilio
0,Twilio Levels,Help!,nan,nan,Can someone give information about the levels in Twilio and the salary range in the US? What's level 3 equivalent?#technicalprojectmanager,3,9,2020-10-7 06:54:15,/post/Twilio-Levels-X8g5MYay,Twilio
0,Twilio stocks grant,bananabow,/company/eClinicalWorks/,nan,"Hello, I received offer from Twilio last week. Question to guys who joined Twilio this year - I was told the stock grant price will be average of 30 days. Is the 30 day period after I join or before? Please clarify. My Recruiter has no info on this unfortunately. If I join on oct 26th, what is the 30 day period considered? Twilio stock is sky rocketing, and I’m worried.Location: Bay AreaOffered TC total: senior - 220k ( includes 240k stocks for 4 years)#engineering #software #swe #twilio",3,11,2020-10-17 22:36:35,/post/Twilio-stocks-grant-OEneAp7v,Twilio
0,Layoffs likely in twilio ?,LCForTC,/company/Twilio/,Eng,"With the current situation with covid 19 threat and the upcoming recession, is it likely that there would be mass layoffs in twilio ? it looks like the online services business should do well in these times but then again we saw yelp, Groupon etc.",8,63,2020-4-14 20:41:21,/post/Layoffs-likely-in-twilio-jaqYViFd,Twilio
0,Twilio vs Datastax,__z,/company/Capital-One/,nan,"I really dislike my team and what I'm working on now so would like to jump ship asap. I currently have 2 offers on the tableTwilio L2 - 120k, 35k/year RSU, 20k sign onDatastax L3 - 130k, 18,000 stock options, 10% bonusDS don't know when they will IPO/be bought but probably in the next couple years. Also heard they are pretty diluted as isTC - 120YOE - 2Is it worth the lower TC for the stock options at datastax? Both positions are remote and currently live in a low col area",3,5,2021-4-29 16:48:54,/post/Twilio-vs-Datastax-ZtBBJFCb,Twilio
0,Twilio Equity?,YUhg97,/company/Flexport/,nan,Does Twilio offer equity to new employees in offers? Looking into jobs but nothing is mentioned.,5,11,2018-9-18 22:59:48,/post/Twilio-Equity-1fOwPith,Twilio
0,Twilio vs Zoom,kap9292,/company/Maersk/,nan,"Got an offer from IT team of @Twilio Bangalore with fixed component and stocks vesting over 4yrs . Interview for the same position is going on in @Zoom Bangalore . Considering zoom offers the same salary and stocks as compared to twilio , which company will be better to join from job security and growth point of view .How is @Twilio Bangalore in terms of job security , work culture or technical growth ?YOE - 6Twilio offer - 30 lpa including pf + 65k USD stocks vesting over 4 yrs",2,8,2021-1-13 19:59:21,/post/Twilio-vs-Zoom-sqy7MSSh,Twilio
0,Learning tools at twilio,anwo,/company/ServiceNow/,nan,Does twilio provide subscriptions for pluralsight? What other learning portals are available for employees at twilio?,0,5,2021-5-16 16:47:13,/post/Learning-tools-at-twilio-QzNMMntV,Twilio
0,Twilio Benefits,apps20,/company/eClinicalWorks/,nan,"Hello Twilio folks,I'm in process of getting an offer for a Data Staff Engineer position. No numbers yet. I got the below questions:1. Is it true that initial RSUs get vested monthly after the 1st year. 2. How are annual refreshers?2. How are other benefits? any ESPP options? 3. How about 401k match?4. What's the range for sign on bonuses?I can also DM you if thats preferred.Thanks for all the information. Much appreciated!!Current Employer: WayfairTC: 140kYOE: 10#twilio #interview #softwaredevelopersalary #swe #software #engineering",4,5,2020-7-24 00:00:45,/post/Twilio-Benefits-8f5WhHVs,Twilio
0,Twilio offer and refreshers,rogue-1,nan,nan,"Have an offer from Twilio (IC3, remote):base: 175k; equity: 340k / 4 years; Sign-on: 30kRecruiter claims that there are no yearly bonuses but annual refreshers can go around 25-35% of the original grant (25-35% of 340k) depending on the performance. That seems too high for me to believe. How realistic is it? Does everyone who ""Meets Expectations"" get these many refreshers?Entering Twilio at this price seems a bit gamble. After being up 300% in 2020 do you think the growth will continue at the same rate?Edit: Only Twilio employees vote, please. Would appreciate if you could drop a line or two in the comments. Thanks. #twilio #segment #offer #eval #salary #comp",2,6,2021-3-17 04:55:40,/post/Twilio-offer-and-refreshers-paiaYOr3,Twilio
0,Twilio or Arcesium?,starkwayne,/company/VMware/,nan,"Please help in deciding which company to join (India).Comp and level wise it's equivalent.Important considerations since comp is similar:- WLB- Learning- Growth- WFH and flexibility- Twilio stock already high?- Is there on call/pagerduty at Twilio/Arcesium?- Tech stack at Twilio/Arcesium?- (Potential internal europe movement in future, possible at Twilio?)Leaning towards Twilio. There's AI/ML work opportunities in Twilio which I want to try out, assuming good learning too. Based on interviews, Arcesium team's work sounds comfortable and easy with same as current work, so can do well easily but less learning. They did say it's not typical 9-6 job so wlb might not be that great.Yoe: 9+TC: 40 lpa#offer #tech",0,26,2020-8-24 17:06:12,/post/Twilio-or-Arcesium-QD5WwtQk,Twilio
0,Cloudflare vs Twilio,ashwn,/company/VMware/,nan,Twilio is much bigger in terms of headcount and revenue while Cloudflare is still growing and much smaller. But why do I feel like Cloudflare is more well known? Which company is more well regarded within the industry? Which has more upside?Which would you choose and why if both offer very similar TC?YoE 3.,1,14,2020-6-12 03:58:39,/post/Cloudflare-vs-Twilio-B3N8eAhe,Twilio
0,Twilio,sg12345,nan,nan,How is Twilio India? Any tips to prep for the interview?,3,6,2020-4-18 02:02:15,/post/Twilio-QQ1z2XpB,Twilio
0,Twilio,snoozetime,/company/Salesforce/,nan,"Hey, anyone here from twilio. Is it a good tome to join. I am in management so will be at director level. What’s the culture like and what are directors expected to do. Thanks.",5,5,2019-5-11 05:20:08,/post/Twilio-zTX2udk4,Twilio
0,Twilio Offer. Please Help,demoworld,/company/VMware/,Eng,"Title. I keep reading that Twilio isn't going anywhere? Can someone help me on this?Offer: 120k base, 50k/4years stocks @ Colorado location 10% bonus annualTC: 150kYoE: 2Updated Offer: 120k base, 120k stocks @ Colorado.They clarified that it wasn't annual bonus, it was performance base max. Recruiter said they also do a lot of refreshers after year 2. Thoughts???#engineering #software #swe",2,48,2020-11-3 04:00:52,/post/Twilio-Offer-Please-Help-xvnxefa6,Twilio
0,Twilio messaging team,jump_ship,/company/Walmart/,nan,Interviewing for Twilio messaging team for Staff engineer role. Looking for work culture and feedback for this team. Also how’s working for Twilio in general?Is it a good time to join considering the stock is so high?. #twilioYOE - 11+TC ~300k,3,11,2021-3-31 23:27:21,/post/Twilio-messaging-team-64Fq8xpQ,Twilio
0,"POLL: Dataminr, Redfin, Twilio",tbh👱🏼‍♀️,/company/Capital-One/,nan,"Hey blinders, have offers from these companies which one do you recommend and why(please comment)Dataminr : TC : 230 Senior swe Twilio: 240 Senior swe Redfin: 280 Senior sweI am on a visa so stability of the company and future of the company is important along with WLB and good work.Edit: please comment if you are choosing Redfin, if it is because comp or something else",2,16,2021-4-24 15:48:12,/post/POLL-Dataminr-Redfin-Twilio-7Pi4eAb8,Twilio
0,Twilio recruiting system,✈️🌎,/company/Sutter-Health/,nan,"#Twilio uses greenhouse for their recruiting system. I noticed a job posting via LinkedIn and I can apply, but when I try to access the job posting via their careers page, the posting doesn’t exist. Are there any twilio recruiters on here?? Seems sketchy so I don’t want to be submitting my personal details if their own careers page says the job posting doesn’t exist",1,3,2021-5-3 22:08:08,/post/Twilio-recruiting-system-4NrmNVJo,Twilio
0,Offer eval - Splunk vs Twilio,wfNP24,/company/Twilio/,nan,"Asking for a friend :#splunk #twilio Splunk Base : 170kBonus : 20%RSU : 140k / 3TwilioBase : 155kRSU : 255k/4Vote based on company culture, wlb , $ and state whyRole : non-swe ",1,9,2021-3-6 04:04:50,/post/Offer-eval---Splunk-vs-Twilio-TAayeUqZ,Twilio
0,How is Twilio India,MoodiJi,/company/Adobe/,nan,Planning to make a switch. How's twilio bangalore?Having wlb issues in Adobe DXIs Twilio a downgrade compared to Adobe? TC: 40LYoe:5,2,12,2021-3-25 07:48:57,/post/How-is-Twilio-India-moJpvJ0a,Twilio
0,Twilio interview,canyoudoit,/company/Hitachi-Vantara/,nan,"I have a technical phone interview with Twilio in a couple of days. This is for a Security role mostly related to operations. I'll really appreciate if someone can help me with what topics I should focus on and prepare for. Also, if you have any onsite recommendations I'll appreciate that as well.Thanks",0,4,2020-3-10 18:32:11,/post/Twilio-interview-ORN8sjQ1,Twilio
0,Twitter vs Twilio,Trees18,/company/Twilio/,Other,"Have accepted an offer as a partner engineer at Twitter. Am way more interested in Twitter's product and business than I am in Twilio's and believe I can learn more at TwitterAdditionally, Twitter role has little to no travel requirement offering me bettrr WLB. While at Twilio I have to travel extensivelyFinancially however, Twilio stock and revenue has been on the up while Twitter seems to be struggling.Which company overall do you think has better long term career value?Update: For the folks voting Twilio. Why?",1,42,2018-5-26 16:13:32,/post/Twitter-vs-Twilio-YzSVLgVR,Twilio
0,Twilio vs GoDaddy,DomainMane,/company/GoDaddy/,nan,"Currently I have a new grad offer for GoDaddy and I got a verbal offer from Twilio recently and I’m considering going there.Twilio TC:Base: 135kStock: 120k/4Bonus: 0 Signing: 10kRelo: 10kTC year 1: 185k TC: year 2+ 165kOverall I’m mainly focused on growth opportunities, mentorship, engineering culture and wlb.YoE 0LCOLTC 105k",0,8,2021-1-8 17:51:46,/post/Twilio-vs-GoDaddy-xBmB0Wtc,Twilio
0,Twilio or Zendesk,festo,nan,nan,"T: 240 base / 20% bonus / 300k RSUsZ: 210 base / no bonus  / 400k RSUsT also offering a better sign on bonus.Heard prospects at Twilio are better but got better vibes from ZendeskNon engineering, strategy role",1,21,2019-9-27 04:02:16,/post/Twilio-or-Zendesk-QnCi34oS,Twilio
