,post_title,post_user,post_firm,post_position,post_text,post_like,post_comment,post_timestamp,post_url,company
0,WeWork Senior Software Engineer Phone Interview,kMCb80,nan,nan,Can anyone shed some light on what to expect during the phone interview with Wework?I set bounties of $30 to get an answer:https://www.rooftopslushie.com/request/WeWork-Senior-Software-Engineer-Phone-Interview-697,4,6,2019-9-9 01:57:56,/post/WeWork-Senior-Software-Engineer-Phone-Interview-1Gbm7Vqc,WeWork
0,Is WeWork changing its name? ,QzCHkd,/company/TD-Ameritrade/,nan,Heard from someone that we work is changing its name to “the We Company” is that correct??,1,9,2019-1-11 00:57:00,/post/Is-WeWork-changing-its-name-CC3qNbvT,WeWork
0,How's WeWork perceived as a tech company? ,VHCF40,/company/Capital-One/,nan,"Uber, Airbnb, Lyft, etc are drawing lots of ex-Googlers. Is WeWork doing the same?",1,13,2019-5-17 00:12:11,/post/Hows-WeWork-perceived-as-a-tech-company-fEeCutM4,WeWork
0,We all missed WeWork apparently ,up down,/company/Uber/,nan,This is insane. Congrats on anyone who made $$$http://www.cnbc.com/2017/02/26/softbank-set-to-invest-more-than-3-billion-in-wework.html,8,4,2017-2-27 01:10:30,/post/We-all-missed-WeWork-apparently-NkNyEXcM,WeWork
0,What is current TC for WeWork,testvppp,/company/Asurion/,nan,I was contacted by recruiter at WeWork and recruiter asked my expected TC. Can someone share the compensation range that I should ask.YOE : 10yrs Role : senior softwareThanks,1,13,2019-8-5 15:50:36,/post/What-is-current-TC-for-WeWork-sVpppVFO,WeWork
0,Is WeWork the most overvalued startup in the world?,aatw,nan,nan,"I'm curious, I did a little bit of reading and found out that WeWork is essentially valued at $47B while Regus who has way more square footage is valued at significantly less. Put on top of that the fact that what they are essentially doing is playing middle man to their clients and the land lord and vastly underpricing the actual value of their square footage (basically placing a bet that property value will inevitably rise and that their customers who are primarily startups will be around forever) how long before that $2B investment from SoftBank goes bye bye provided we don't enter a recession for the next few years.",8,17,2019-2-2 16:52:19,/post/Is-WeWork-the-most-overvalued-startup-in-the-world-xYY6v5Mn,WeWork
0,"WeWork is reportedly cutting 2,000 jobs as soon as this week",V.Y,/company/Deloitte/,Product,https://www.businessinsider.com/wework-reportedly-cutting-2000-jobs-staff-turning-on-ceo-adam-neumann-2019-10,9,9,2019-10-15 16:08:28,/post/WeWork-is-reportedly-cutting-2000-jobs-as-soon-as-this-week-WMp1tdLT,WeWork
0,Solutions Consultant at Wework,GwND41,/company/Deloitte/,nan,I’m interviewing for a Solutions Consultant role at WeWork!What are the kind of questions I can expect and package information? Thanks in advance!,2,1,2019-6-11 02:07:29,/post/Solutions-Consultant-at-Wework-4dGLXOGg,WeWork
0,WeWork stop giving stock options? ,yvKJ65,/company/Bloomberg/,nan,Can anyone inside share some lights?,4,5,2019-3-4 19:19:51,/post/WeWork-stop-giving-stock-options-cuz6Bspz,WeWork
0,Salary Senior Product Marketing @ WeWork,vrBp02,/company/American-Express/,nan,"What are the more recently salary offers? I know the recruiter will ask once we chat, so I want to be equipped beforehand.",2,8,2019-9-7 18:04:28,/post/Salary-Senior-Product-Marketing-@-WeWork-E7wk06CY,WeWork
0,Insight into wework TC and culture,FNuK77,/company/Amazon/,nan,"I’m looking at a potential role at WeWork (either senior director or VP in tech). Anyone have any insight into what the TC might be approx? I currently am on about ~400k as a target (although about 650k actual this year). I would also be leaving about 1.5m on the table I’m invested stock. I can’t see an offer competitive enough to make me leave, but I would appreciate any insights.Also any inputs into the culture would be welcome.",1,9,2019-6-6 01:11:42,/post/Insight-into-wework-TC-and-culture-Spp1GOaX,WeWork
0,WeWork - Gulfstream G650 Tail Number,BobSmith29,nan,nan,Subject line says it all. Does anyone know Adam Neumann’s tail #? Would like to watch the roadshow...,1,0,2019-8-9 06:12:17,/post/WeWork---Gulfstream-G650-Tail-Number-NdRLXss3,WeWork
0,WeWork NYC Data Scientist (revenue optimization),antelope3,/company/Clover-Health/,nan,Approached by a recruiter - what’s the TC range?YOE 2years,2,5,2019-9-10 23:45:58,/post/WeWork-NYC-Data-Scientist-revenue-optimization-aXHMZOBF,WeWork
0,Let’s talk about the WeWork lawsuit,🌚🌝we🌝🌚,/company/WeWork/,Mktg,Going to leave this here:https://www.vox.com/the-goods/2018/10/12/17969190/wework-lawsuit-sexual-assault-harassment-retaliation,2,9,2018-10-13 02:57:19,/post/Lets-talk-about-the-WeWork-lawsuit-uD8QryzE,WeWork
0,"L7 at WeWork, what to expect out there",WaWQ70,/company/WeWork/,nan,"Hi everyobe. Currently a L7 at WeWork. Been there for a while and one of the earlier employees, so dont have a good sense of the current job market out there. What sort of compensation package can I expect if starting to look around? NY based. Over 15 years of experience as both IC as well as manager/director. Current TC is 245k (plus vested options, but who knows what those are worth anymore)",4,13,2019-10-4 00:02:48,/post/L7-at-WeWork-what-to-expect-out-there-twPAe8wZ,WeWork
0,Were people naive to take jobs at WeWork?,c9a4b,/company/Intuit/,nan,"I wonder how much rank and file employees would have known, say 2 years ago, when considering job offers from the company.",2,15,2019-11-18 21:05:25,/post/Were-people-naive-to-take-jobs-at-WeWork-7Np25TcZ,WeWork
0,Looking for referral WeWork Singapore,koochikoo,nan,Eng,6yoe currently working in SG,2,8,2019-6-9 06:07:07,/post/Looking-for-referral-WeWork-Singapore-881WCLZP,WeWork
0,Sooo WeWork IPO...,🌚🌝we🌝🌚,/company/WeWork/,Other,Thoughts?,3,8,2019-4-29 19:04:39,/post/Sooo-WeWork-IPO-gCn0H6kU,WeWork
0, wework data science interview style / questions?,rmse,/company/Honey/,nan,"anyone know what wework's interview process is like for data science roles? I've done the call with hiring manager and getting deeper into the process. I'm expecting it to cover basic foundations for data sci but some companies are heavily bent towards case studies, others toward behavioral, others all technical, etc.any insights? would also love to chat with anyone that works in WeWork's data science org, if they're willing.thanks!!",1,10,2019-7-17 00:55:10,/post/wework-data-science-interview-style-questions-sadbW2it,WeWork
0,Need referral for WeWork,Logmkh,/company/Amazon/,nan,Please PM me if you are able to refer,1,2,2019-4-2 05:59:20,/post/Need-referral-for-WeWork-ghRhz45k,WeWork
0,Does WeWork hire entry-level SWE?,EiRN17,/company/Fullstack-Academy/,nan,All of their openings seem to be for more experienced/senior-level SWEs - does WeWork also hire entry/junior-level SWEs (esp. in NYC)?,1,3,2019-6-6 06:17:27,/post/Does-WeWork-hire-entry-level-SWE-TrfkP2Rn,WeWork
0,Will there be a WeWork class action lawsuit?,jkl776,/company/Jet/,nan,https://markets.businessinsider.com/news/stocks/wework-ex-employee-sues-adam-neumann-2-billion-leaving-deal-2019-11-1028675038,7,17,2019-11-10 01:05:15,/post/Will-there-be-a-WeWork-class-action-lawsuit-EbadjfkJ,WeWork
0,SDET interview at wework ,@Apple2013,/company/Apple/,nan,What to expect? It’s full day interview with ~6 engineers in NYC. I’m really nervous. Did anyone interview and got an offer?,2,6,2019-5-13 16:23:02,/post/SDET-interview-at-wework-SUvawdAC,WeWork
0,Why is WeWork in Tech Lounge?,bob it boy,/company/Google/,nan,explain,8,14,2019-10-10 17:12:12,/post/Why-is-WeWork-in-Tech-Lounge-Ls4RROFQ,WeWork
0,Does WeWork have Green Card Policy?,grWk56,nan,nan,Are you able to apply from day 1?,4,14,2019-5-19 12:17:20,/post/Does-WeWork-have-Green-Card-Policy-VoTWhyGv,WeWork
0,WeWork postponed layoffs because it's too broke to pay severance,wmr,/company/Amazon/,nan,Woofhttps://amp.insider.com/wework-reportedly-delayed-layoffs-because-its-short-on-cash-2019-10,8,15,2019-10-22 03:54:02,/post/WeWork-postponed-layoffs-because-its-too-broke-to-pay-severance-i2BNq7CT,WeWork
0,Design strategist interview at WeWork,r@ndomuser,/company/Yelp/,Eng,Has anyone interviewed as a design strategist or a similar role at WeWork?What does the interview process look like? How many rounds of interview are there and how long does the entire process take?What are the kind of questions asked?,0,1,2019-3-6 02:22:50,/post/Design-strategist-interview-at-WeWork-XJ3nBYsp,WeWork
0,What is WLB like at WeWork for eng?,jhddh,/company/Spotify/,nan,When do you come in/leave? Do you feel overworked?,3,56,2019-5-25 04:23:36,/post/What-is-WLB-like-at-WeWork-for-eng-M4BBYBL6,WeWork
0,WeWork NYC marketing employee looking for new opportunities,xNNE53,/company/WeWork/,nan,"hello all,as everyone knows im sure, WeWork is most likely having mass layoffs soon. ive been poking around and it seems difficult to find any marketing roles, so if anyone knows of any anywhere you’re willing to refer, please comment below!im ok with opportunities in other locations if the company is willing to relocate. im a single person, so it works.appreciate your time!",3,7,2019-11-19 13:18:45,/post/WeWork-NYC-marketing-employee-looking-for-new-opportunities-G7AO8iav,WeWork
0,Anyone read this book about the WeWork guy?,KTyx56,nan,nan,https://www.theatlantic.com/magazine/archive/2020/11/wework-reeves-wiedeman-billion-dollar-loser/616477/Sounds like #lifegoals for the Blind max-my-TC crew.,1,2,2020-10-14 14:52:27,/post/Anyone-read-this-book-about-the-WeWork-guy-O1JWfbrk,WeWork
