,post_title,post_user,post_firm,post_position,post_text,post_like,post_comment,post_timestamp,post_url,company
0,Wework bans hazardous phone booths,tqe,nan,nan,"Wework just removed tons of “phone booths” that release a carcinogen “formaldehyde”.Phone booths are common in many office spaces.- does your office have such phone booths? - how much time do you spend in such phone booths? - I find this concerning and am now worried about the quality of phone booths used in my office as I do tend to spend quite a while maybe few hours there as its quiet and enclosed.Instead of critisizing wework, lets focus on this issue at our offices, any thoughts?https://techcrunch.com/2019/10/14/wework-pulls-thousands-of-phone-booths-out-of-service-over-formaldehyde-scare/",2,18,2019-10-15 09:18:46,/post/Wework-bans-hazardous-phone-booths-KxRtqRqA,WeWork
0,WeWork - what's it like now?,theylied,/company/Uber/,nan,"I saw a position for Area Director (non-tech). Wondering how sentiment is within the company right now with everything going on.Not necessarily worried about if company will be around 3 years from now, just curious about position, pay and vibe.",5,12,2020-5-21 00:57:27,/post/WeWork---whats-it-like-now-N4yRifbs,WeWork
0,WeWork NYC,cpsD68,nan,nan,How's the culture at WeWork? I have an on-site coming up and was wondering is it worth going.,4,13,2019-9-10 21:53:28,/post/WeWork-NYC-sA5eMpHT,WeWork
0,"WeWork blinders, where you at?",Spidey™🕸️,/company/Adobe/,R&D,I barely ever see any of you on here. How's life now that Neumann's finally gone?,8,40,2019-9-27 12:12:33,/post/WeWork-blinders-where-you-at-dG4t125Z,WeWork
0,"WeWork lays off 2,400 employees",Ceeker,/company/Deloitte/,Data,https://www.cnbc.com/2019/11/21/wework-lays-off-2400-employees.html,3,6,2019-11-21 19:34:40,/post/WeWork-lays-off-2400-employees-qjQJjgr1,WeWork
0,New WeWork CEO,__init__(),/company/Akamai-Technologies/,Eng,New CEO from WeWork. Expecting any positive changes?https://www.cnn.com/2020/02/02/business/wework-ceo-sandeep-mathrani/index.html,3,6,2020-2-3 07:32:25,/post/New-WeWork-CEO-kNgGop1a,WeWork
0,Wework - as a company?,offer007,nan,nan,Would appreciate some expert feedback on Wework as a company and its “NON-COMPETITION” and “NON-SOLICITATION” agreement that forbids new employment with competing businesses in future for 6 months after leaving Wework anytime.Which companies ideally fall into this category? Don’t want to fall into legal issues in future due to this clause. ,1,20,2019-4-24 07:12:43,/post/Wework---as-a-company-ZHwHaiVo,WeWork
0,WeWork cutting 1/3 of their tech employees,Mars 2020,nan,nan,WeWork to cut third of tech employees - report https://seekingalpha.com/news/3504623,6,10,2019-10-8 23:02:28,/post/WeWork-cutting-13-of-their-tech-employees-iJZvEB4J,WeWork
0,Wework l6 Staff Software Engineer,wipG30,/company/Amazon/,nan,Does any one knows what is total comp range for L6 Staff Software Engineer IC role at wework ?,6,16,2019-3-22 19:30:53,/post/Wework-l6-Staff-Software-Engineer-3Q7yZUZq,WeWork
0,WeWorkers...back to work in Sept.,el chapo69,/company/American-Express/,nan,"Talking to a few friends at WeWork and they have to go back into the office next month...That is so bonkers!! We don’t even know when we’ll have a vaccine. How do you guys feel about it? More and more companies are delaying the in-person requirements....and at least at Amex, we don’t go back until next year, and we will alternate weeks and not be at full capacity.How are you coping with this mentally? Are they at least gonna allow you to WFH for half of the week? Yikes!!#remotework #wfh",4,19,2020-8-17 04:57:55,/post/WeWorkersback-to-work-in-Sept-UhJHY8Hy,WeWork
0,WeWork eng management,hellogood,nan,nan,Is there anyone here who is an Eng Manager at WeWork? I'm considering joining them and I wonder if I can ask some frank questions. Thank you very much in advance!,1,7,2019-4-24 19:25:15,/post/WeWork-eng-management-HSasbnQo,WeWork
0,How is wework company??,Sonos1,/company/Amazon/,nan,Lot of people quitting and joining we work??Anyone has any idea how the company is?Heard they are paying damn good that people are quitting senior roles at amazon and joining we work.,3,19,2019-3-21 21:09:51,/post/How-is-wework-company-SF0j4TZz,WeWork
0,VP Level/Comp at WeWork,Bob2992,nan,nan,"Looking at a possible VP role at We. Technical field.What “Level” would this be, and what would typical comp be?Base -RSUs - Signing Bonus -NYC BasedNever been at a company with RSU-based comp structure before. Any tips are welcome. Thanks.",2,15,2019-6-14 03:55:50,/post/VP-LevelComp-at-WeWork-3kMeGUqQ,WeWork
0,Are layoffs coming to wework?,weslack,/company/Amazon/,nan,As above.,0,12,2019-10-25 02:06:53,/post/Are-layoffs-coming-to-wework-B85gdXKH,WeWork
0,WeWork SF ,AsYK38,nan,nan,What's the office culture like? How is swe management? What are current projects like? Wlb?Thanks!,3,1,2019-4-27 04:53:54,/post/WeWork-SF-Vw7Dn7z3,WeWork
0,Will WeWork IPO this year?,Lirik,/company/Sony-Electronics/,nan,"If no, how do you feel about CEO selling $700M of stock while employee options become worthless?",1,8,2019-9-9 17:06:44,/post/Will-WeWork-IPO-this-year-M2B0o0KT,WeWork
0,Switch to Wework - An option?,Guardian,/company/Infosys/,Data,Is wework an option to switch to for a guy in Tech?#wework,0,4,2021-2-5 17:45:06,/post/Switch-to-Wework---An-option-E4z8mcA2,WeWork
0,is WeWork going to die?,hungover1,/company/Genentech/,nan,"Given that everybody is working from home because of the global pandemic, and their failed IPO, I think they’ve been given a death sentence (I also think this will have huge implications for the commercial real estate market).",2,5,2020-3-16 18:26:45,/post/is-WeWork-going-to-die-ZOOOPC31,WeWork
0,Is Flexport the next WeWork?,asphalt,/company/Box/,nan,Another SoftBank investment making big promises,4,7,2019-10-27 05:33:38,/post/Is-Flexport-the-next-WeWork-i02QvxSA,WeWork
0,WSJ: Softbank taking control of WeWork,democracy,/company/Juniper/,nan,"SoftBank ""has prepared a financing package that would give it majority (50%+) control of WeWork and further sideline its founder Adam Neumann in exchange for relieving the shared-office startup’s looming cash crunch.""Looks like Softbank had no choice but to dig deeper.",3,7,2019-10-13 23:04:29,/post/WSJ-Softbank-taking-control-of-WeWork-JtZxa3gF,WeWork
0,WeWork employees - how much are you in the hole on WeWork toilet paper stock?,hpBF22,/company/Akamai-Technologies/,nan,Were you enticed to join w/ a gigantic RSU or ISO package that is now worth 0?Did you spend significant $ early exercising your stock options and now have toilet paper shares that you spent 50k or 100k+ for?Lets hear the stories.,4,26,2019-10-1 15:06:32,/post/WeWork-employees---how-much-are-you-in-the-hole-on-WeWork-toilet-paper-stock-2b7qnFQK,WeWork
0,Sharing a wework account,m_p_c,/company/Google/,nan,"Thinking about buying a single room in a wework and splitting it with a coworker on alternating days so we can both safely work from an office a few days a week. Will WeWork allow this? Or if not, will they at let me acquire two access cards so I can do it anyway? Never used WeWork before.TC: like 200k but not super relevant",2,7,2020-6-15 19:32:12,/post/Sharing-a-wework-account-MEhw7WU3,WeWork
0,Is this a lowball offer from wework?,HsOm43,/company/State-Street/,Eng,I just started interviewing and actually haven't applied to any NYC based companies (I'm based in Boston) but got a call from Wework so thought let's try. My goal is to move to NYC within next yr. Onsite went well and got this offer after some long negotiation:Base: 190k + 5k reloRSUs: 180k vested over 3yrsNo sign-on bonusYOE: 7I'm currently a Lead/Principal Engineer architecting a big application but getting downlevelled to Software Engineer L4I have another offer in Boston which i don't like much and have another onsite interview in Boston. I just started applying to other NYC based companies.Should I take the offer or keep looking for better ones in NYC?,3,22,2019-6-6 01:05:34,/post/Is-this-a-lowball-offer-from-wework-F5O8KMdG,WeWork
0,Thoughts about WeWork On Demand? ,mskc,nan,nan,Curious about the future of WeWork post pandemic and their on demand venture.  #tech #wework,2,4,2021-2-4 14:38:22,/post/Thoughts-about-WeWork-On-Demand-iAaedDF0,WeWork
0,Solutions Consultant at Wework,GwND41,/company/Deloitte/,nan,I’m interviewing for a Solutions Consultant role at WeWork!What are the kind of questions I can expect and package information? Thanks in advance!,3,2,2019-6-11 02:06:58,/post/Solutions-Consultant-at-Wework-ndYQmdnd,WeWork
0,Reasonable WeWork Senior Marketing Comp,uktg07,/company/American-Express/,nan,Almost 10 years of experience...what’s a reasonable salary expectation for WeWork in a senior marketing role - saw an open Senior Email Marketing role.  They don’t give bonuses FYI. What’s the scoop?,1,17,2019-6-18 22:13:01,/post/Reasonable-WeWork-Senior-Marketing-Comp-VebvsExG,WeWork
0,Using Wework or Industrious,FakeEng🤫,/company/Apple/,nan,I’m getting bored on working from home and I want a little change. Been thinking on purchasing a membership for wework or industrious. Trying to get some reviews on them.Have you used them during these COVID times? if so how did it go? Do people try to network with you? (They force to give employer name).Was it quiet enough for you to be able to work?,1,0,2021-2-15 17:37:11,/post/Using-Wework-or-Industrious-YahF52bH,WeWork
0,How can I short WeWork stock?,n3s9k,/company/Intuit/,nan,Once it IPOs. I will take great pleasure on making money off of how wrong Adam Neumann is. Will Robinhood work?,8,26,2019-9-15 19:17:54,/post/How-can-I-short-WeWork-stock-NN8ch3Ay,WeWork
0,Could WeWork Survive a Recession?,not Lloyd,/company/Goldman-Sachs/,Project,Real estate company or ponzi scheme tailored toward millenials?,4,13,2019-8-30 00:48:51,/post/Could-WeWork-Survive-a-Recession-Ms7QSXRL,WeWork
0,"WeWork career, wlb, TC",bugrama,/company/American-Express/,nan,A friend has interview scheduled with WeWork for sales role (non-eng) in managerial position (around L6/L7). He has had terrible wlb - 65+ work week - in his current company and desperately wants to leave. Can anyone share what can he expect around:1. TC2. Wlb3. career growth & opportunities4. how is WeWork doing itself and growth of the companyYour inputs are appreciated 🙏Engineers can chime in as well on point#4,2,4,2019-4-26 03:30:03,/post/WeWork-career-wlb-TC-USnV2g5u,WeWork
0, wework tc wlb,FnXK68,/company/Pantos/,nan,"Does anyone have a range of what either a swe, data engineer, data scientist would make at carta at the nyc location for either entry, mid, senior? Would love to get a bit more insight about their culture. Im not to familiar what thr going rate is for the area for startups, financial companies, media or tech.yoe: ~5tc: 110k",1,18,2019-7-25 21:36:29,/post/wework-tc-wlb-du18wxwX,WeWork
0,"WeWork- The good, the bad?",Doubleblah,/company/Amazon/,nan,A recruiter reached out. I want understand more about the company from the community before I respond to her.I’m a biz tech leader at Amazon.Sr Manager - L7Tc - 547k Yoe: 12,5,8,2018-6-9 18:37:29,/post/WeWork--The-good-the-bad-AkHXynTf,WeWork
0,Wework layoffs and closing of outside US business,kingww,nan,nan,OH large massive layoff in coming weeks or days#layoff #wework #itstheend,2,5,2020-3-26 14:03:14,/post/Wework-layoffs-and-closing-of-outside-US-business-NjzbahAb,WeWork
0,WeWork Raises & Salary bump w/ Promotions,uktg07,/company/American-Express/,nan,"Can anyone shed some light on what the typical raise is at WeWork, as well as bump in pay with promotion?i",2,14,2019-9-6 02:21:54,/post/WeWork-Raises-Salary-bump-w-Promotions-TvK8MgBT,WeWork
0,Wework Interview - Finance Strategic Projects,dmYN22,/company/JPMorgan/,Finance,Hi guys - I have interview with Finance strategic projects department within Wework. Are there any tips or guidance throughout the interview process ? Any experiences that anyone would like to share ?,1,2,2019-7-27 23:33:17,/post/Wework-Interview---Finance-Strategic-Projects-uzO87JRP,WeWork
0,Is Compass real estate the next WeWork?,meme9,nan,nan,"Massive funding round by Softbank; ""we're a tech company"" but not really; massive industry but with low gross margins, etc",6,18,2019-10-1 03:35:52,/post/Is-Compass-real-estate-the-next-WeWork-ntdjkutV,WeWork
0,WeWork Bans Meat at Company,recurse,/company/Slack/,nan,https://amp.businessinsider.com/wework-bans-meat-2018-7Seems pretty ridiculous to me.,8,22,2018-7-17 10:47:07,/post/WeWork-Bans-Meat-at-Company-d7VywjNo,WeWork
0,WeWork SDE Interview ,Maddy1,/company/Expedia/,nan,Do they ask LC Hard/Medium/Easy? What is interview pattern like? Thanks!TC-145k,1,3,2019-5-19 04:10:46,/post/WeWork-SDE-Interview-waOmAhib,WeWork
0,WeWork Snr Mgr compensation Seattle,fthfrru,/company/Amazon/,nan,Currently L6 SDM. Looking for expected compensation for Senior Mgr at WeWork in Seattle.Also would it be a good move? I know they are expanding very fast in Seattle.TC 310K,1,4,2019-7-12 03:38:17,/post/WeWork-Snr-Mgr-compensation-Seattle-GLTKGiVZ,WeWork
0,WeWork is planning to lay off 25% of its employees,klnxxs,nan,nan,"""WeWork executives haven't yet finalized the specific cuts, but the numbers will be ""in the thousands"" – though less than the 3,000 to 5,000 layoffs that had been laid out in earlier media reports, said the source. ""https://www.businessinsider.com/wework-plans-thousands-of-job-cuts-shelving-initial-public-offering-2019-10",11,23,2019-10-3 22:05:47,/post/WeWork-is-planning-to-lay-off-25-of-its-employees-s4UpqzY1,WeWork
0,Is it worth working at WeWork?,jhj107,/company/Postmates/,Design,"I saw that they’re hiring in NYC, but I’m afraid of being someone who’ll be laid off 😅.Do you think there is a future for WeWork?",1,18,2020-1-31 00:18:58,/post/Is-it-worth-working-at-WeWork-rrUXMkGL,WeWork
0,WeWork TC at L6 and L7,mody,/company/Groupon/,nan,I hear that We work is trying to compete with FAANG  and comp continues to evolve. Appreciate the latest comp for L6/L7. ThanksAlso any color on L6 at FAANG or Pinterest/Uber/Airbnb would be super helpful,8,3,2019-4-3 02:03:05,/post/WeWork-TC-at-L6-and-L7-Vv6mAGQP,WeWork
0,"WeWork employees, brace yourself for a mass layoff this week!",kdfzajk,nan,nan,I hope you are able to find a job quicklyhttps://www.cnn.com/2019/11/18/tech/wework-layoffs/index.html,6,15,2019-11-19 17:19:59,/post/WeWork-employees-brace-yourself-for-a-mass-layoff-this-week-O1oJWPv8,WeWork
0,Do you consider WeWork a tech company?,wxLq01,/company/Lime/,nan,Curious about engineer's thoughts after reading the S1.,1,16,2019-8-15 21:59:03,/post/Do-you-consider-WeWork-a-tech-company-owhbJBXY,WeWork
0,WeWork health insurance and dental ,iwik71,/company/Spotify/,nan,"I have an offer and it is not bad. But, I am in a condition where these insurances are important to me and I need to continue to see current doctors. So I need to check they take the insurance. I know, it is Aetna POS for health, and Met Life for dental. Does anyone know specific details, like exact name of plans, and if dental is dhmo or ppo. I can ask to recruiter but would rather avoid it. Thanks.",4,15,2019-3-14 03:59:19,/post/WeWork-health-insurance-and-dental-yh4Gzrs8,WeWork
0,Starting a WeWork thread...,xLUl74,nan,nan,Surprised there weren't any search results for them given the experience there. Any questions/comments?,2,13,2017-7-27 16:22:09,/post/Starting-a-WeWork-thread-5BmYp3Tf,WeWork
0,Is WeWork a technology company?,Xbdjssi,/company/LinkedIn/,nan,I have seen at least one good engineer go to WeWork over the past year.   Is it a company that is working on solving interesting technology problems?  I’m particularly interested in the software angle.,4,14,2019-9-24 17:23:15,/post/Is-WeWork-a-technology-company-otAw4pqA,WeWork
0,Wework SDE salary/level,que-que,/company/Amazon/,nan,anyone has insight on Wework SDE salary? also the level comparison with major tech companies like Facebook or google or amazon,4,3,2019-8-1 05:04:07,/post/Wework-SDE-salarylevel-aVq1Eif0,WeWork
0,laid off (wework) new opportunities? NYC,xNNE53,/company/WeWork/,nan,"hello all,marketing / experiential events / community engagement expert here looking for new opportunities in the new year.if you are hiring, or know of any promising opportunities in the fields listed above, please let me know! im open to relocating as well for the right opportunity.thanks!",2,5,2019-12-31 20:33:52,/post/laid-off-wework-new-opportunities-NYC-mJWW0iLQ,WeWork
0,Raise and RSU refresh at WeWork,sdsmdr,/company/Salesforce/,nan,Can anyone share what the raise percentage and RSU refresh amount are for engineering org at WeWork?,3,9,2019-7-28 00:59:40,/post/Raise-and-RSU-refresh-at-WeWork-Z4D62o2z,WeWork
0,Working FROM a WeWork right now,gEwH42,/company/Walmart/,nan,I am having a lot of connectivity issues and distractions at my home and get free WeWork access from Walmart. I would like to work from a WeWork. Is anyone doing it? They are apparently open. I could use a hot desk :P,3,4,2020-5-9 07:23:54,/post/Working-FROM-a-WeWork-right-now-OpXCGfVe,WeWork
0,Softbank pulls the plug on WeWork bailout!,ladybug 🐞 ,/company/Facebook/,nan,does it mean that Mr. Neumann is peniless now?,5,9,2020-4-2 04:32:40,/post/Softbank-pulls-the-plug-on-WeWork-bailout-adeoRNr2,WeWork
0,Has WeWork completely stopped hiring in tech?,j2La8i,/company/Amazon/,nan,Don't see any openings in tech. I feel WeWork is going to be big in this world of remote working if it manages to turn it profitable.,7,16,2020-6-10 18:34:12,/post/Has-WeWork-completely-stopped-hiring-in-tech-UwNxZQFb,WeWork
0,Wework valued at $2.9B down from $47B a year ago,getaroom,/company/Booking.com/,nan,https://www.cnbc.com/2020/05/18/softbank-ceo-calls-wework-investment-foolish-valuation-falls-to-2point9-billion.html?__source=iosappshare%7Cnet.whatsapp.WhatsApp.ShareExtension,9,11,2020-5-18 20:12:44,/post/Wework-valued-at-29B-down-from-47B-a-year-ago-8p0aThSw,WeWork
0,Wework machine learning engineer,CvKO84,/company/Microsoft/,nan,Any info about the machine learning engineer onsite for Wework?,1,4,2019-8-15 16:40:53,/post/Wework-machine-learning-engineer-NKo0FRNg,WeWork
0,SoftBank is taking control of wework,Ab44,nan,nan,"https://techcrunch.com/2019/10/21/report-softbank-is-taking-control-of-wework-at-an-8b-valuationIs the ""tech company"" scam finally getting it's real valuation?",3,4,2019-10-22 09:46:56,/post/SoftBank-is-taking-control-of-wework-78RfMafA,WeWork
0,WeWork work from home,uktg07,/company/American-Express/,nan,Can you? What’s their policy on this?,1,7,2019-9-4 14:34:47,/post/WeWork-work-from-home-RvKUdAYK,WeWork
0,WeWork - How senior is Director level? ,Bay Bae,/company/Grab/,Other,What would it be L6/L7 role? (Non tech),4,7,2018-10-3 01:45:23,/post/WeWork---How-senior-is-Director-level-Eu1wcw5J,WeWork
0,Wework Bangalore EM openings,kp1857,/company/Oracle/,IT,Folks I saw on LinkedIn that we work started hiring in India BLR...any ideas on profiles and kind  of work they have here ?,1,4,2019-8-24 06:29:04,/post/Wework-Bangalore-EM-openings-rrjAJGRc,WeWork
0,WeWork raises $3b at $42b,Fleabee,/company/Apple/,Eng,https://techcrunch.com/2018/11/13/wework-picks-up-another-3b-from-softbank/,5,12,2018-11-14 01:16:25,/post/WeWork-raises-3b-at-42b-kmqYY8AG,WeWork
0,WeWork Senior tech manager offer,pawUI,/company/Amazon/,Eng,Expecting an offer from WeWork as an L5/6 tech manager in Seattle. What is a solid offer range?YOE 15TC 450k,1,14,2019-8-21 19:43:42,/post/WeWork-Senior-tech-manager-offer-mnJfPYe3,WeWork
0,How is WeWork still in business?,aahh,/company/Twitch/,Eng,I imagine COVID had a large impact in the little money that was coming in. How are they staying afloat?,4,7,2020-7-8 02:27:00,/post/How-is-WeWork-still-in-business-dchiAvAn,WeWork
0,"Wework employees, how are things?",Tzeentch99,/company/Microsoft/,nan,Are there still massive layoffs coming? Things better?,2,4,2020-1-4 05:45:05,/post/Wework-employees-how-are-things-ttzYdO3c,WeWork
0,WeWork VS Compass. Which one would you pick?,DraXxX,/company/Amazon/,Eng,"if you have an offer from both wework and compass and you HAVE TO pick one.1) Which one would you pick ? 2) Why would you pick that?3) Based on Evaluation, which one would suck like Uber at IPO?Please enlighten me. Thanks a lot for your opinions wirh facts :)",3,21,2019-8-29 10:47:29,/post/WeWork-VS-Compass-Which-one-would-you-pick-aGCvKPHK,WeWork
0,What's the current status with WeWork?,tfoj41,/company/Applied-Materials/,nan,Should we apply?,3,11,2020-1-7 17:15:04,/post/Whats-the-current-status-with-WeWork-TCiD2VWJ,WeWork
0,WeWork vs Walmart as potential employer,ATxg85,/company/Overstock/,Data,"Hi, I currently have two offers one from Walmart and another from WeWork. Though WeWork offer looks good on paper i think Walmart could be better choice for my future.views from Walmart and wework folks will be highly appreciated.",1,15,2019-4-25 03:33:43,/post/WeWork-vs-Walmart-as-potential-employer-h4ohLgac,WeWork
0,WeWork senior engineer role referral,true-doh,/company/Microsoft/,nan,Would anyone be willing to help out with a referral for a senior SWE role at WeWork. The role matches my background. I tried messaging a few employees on LinkedIn but it looks like they haven't checked their messages in a few days.,2,7,2019-4-10 21:52:39,/post/WeWork-senior-engineer-role-referral-XA6J8o2A,WeWork
0,Report: WeWork expected to cut 500 tech roles,blindman04,/company/The-Walt-Disney-Company/,nan,https://tcrn.ch/2VqXDc3More layoffs That's sad,2,13,2019-10-11 04:44:58,/post/Report-WeWork-expected-to-cut-500-tech-roles-qXoBqNZW,WeWork
0,How is the compensation and culture at Wework ?,Lucy,/company/Oath/,nan,Plan to interview at Wework . How is the work culture ? How long have you been with wework? What are the future prospects ? What is the compensation like for software engineer and senior software engineer? What is the next level after senior software engineer? Would you recommend to join Wework ?,5,3,2018-10-7 08:38:35,/post/How-is-the-compensation-and-culture-at-Wework-7p0yBbef,WeWork
0, wework RSU value change in light of IPO valuation change?,wwwework,/company/Honey/,nan,"I am very close to accepting an offer at WeWork as a data scientist in their NYC office but in light of their IPO valuation dropping, I am unsure what this means for the value of the RSUs as part my offer.https://www.cnbc.com/amp/2019/09/05/wework-is-dramatically-slashing-its-ipo-valuation-because-of-weak-demand.htmlMy offer includes 1000 RSUs over 3 years, or about $110,000 based on 1RSU=$110. But that $110 price is pegged to WeWork's previous valuation of $47 billion... with their new valuation of ~$25 billion, has the value of my RSU package essentially halved? Should I bring this up with my recruiter and try to negotiate more? I've already done one back and forth with recruiting and was happy enough with the offer after that. Fwiw I have a competing offer from Uber that's comparable in RSUs (except ofc that Uber is public so their RSUs are concrete).Would appreciate any advice, thanks in advance.",3,29,2019-9-6 03:27:56,/post/wework-RSU-value-change-in-light-of-IPO-valuation-change-gkvGhdYx,WeWork
0, wework employees - did you exercise your options?,hpBF22,/company/Akamai-Technologies/,nan,how many shares did you buy and what is it now worth?how much are you in the hole? did you have to pay significant taxes to exercise paper that is now worth less than soiled toilet paper?did you “invest” your kids college fund in hopes of striking rich but now you are left with nothing?,3,18,2019-10-26 13:14:56,/post/wework-employees---did-you-exercise-your-options-VZdEgpNs,WeWork
0,WeWork Data Engineer compensation range?,HUYN58,/company/Amazon/,Eng,"Hi there Blinders,I am curious to know how much do Data Engineers at WeWork make?",0,1,2017-10-7 00:13:18,/post/WeWork-Data-Engineer-compensation-range-X2cbCoKc,WeWork
0,SoftBank urges WeWork to shelve IPO,JohnMcPee,/company/McAfee/,nan,Looks like they finally caught in on the scam.https://www.businessinsider.com/wework-pressured-by-softbank-to-shelve-ipo-report-2019-9,7,5,2019-9-9 23:05:32,/post/SoftBank-urges-WeWork-to-shelve-IPO-dREtYyxe,WeWork
0,WEWORK Layoffs- Post your roles and we can put in the referrals. ,jmkL35,/company/Amazon/,nan,"If you are affected by the layoffs then post roles and companies you are interested in, Blind community can help you",26,51,2019-11-21 15:51:18,/post/WEWORK-Layoffs--Post-your-roles-and-we-can-put-in-the-referrals-wj8xdxv4,WeWork
0,Help! WeWork marketing comp - stuck?,uktg07,/company/American-Express/,nan,"So I very recently interviewed with WeWork for a senior marketing role. Asked my salary expectation and my range was just over $120K, but I didn’t have the guts to ask for more or ask for the range which was dumb on my part, especially since I currently get a good bonus and 401K match and excellent benefits.Can I redeem myself? Should have asked for the range. I have a feeling I could have asked for more. Is it in poor form to do so now, considering I now know about the lack of financial benefits I currently have? Am I better off just trying to get higher RSUs? Is it possible to get an offer higher than my range? Thanks!!",1,5,2019-8-27 19:37:28,/post/Help-WeWork-marketing-comp---stuck-kVC17JyE,WeWork
0,Should I get a WeWork private office?,i<3office,/company/Robinhood/,nan,"I hate working from my studio, and I’m considering getting a 1 person private office in a local WeWork. I can’t focus in my room and I’m going crazy being in the same place 24/7. Has anyone else considered going the WeWork route for the rest of our WFH period?(Prices for a private office I’m seeing are around 800 per month, which I am honestly fine just biting the bullet for).#mentalhealth #covid-19 #wfh",2,6,2020-9-19 09:31:31,/post/Should-I-get-a-WeWork-private-office-bRX7yKgw,WeWork
