,comment_date,comment_text,comment_like,comment_user,comment_firm,comment_position,comment_url,company
6,"Jul 8, 2020",Thanks,0,wisejester,/company/Oracle/,SEND PRIVATE MESSAGE,/post/Accenture-Procurement-Contract-Analyst-Salary-k0vu8wmK,Accenture
7,"Jul 14, 2020",I’ve been at Accenture for 8 years and they have treated me very well. My salary has tripled in that time. Benefits are good. You will eventually get 27 days off. Once you have been there long enough your first 6% of 401k will be matched. Health care plan is only ok. Decent health rewards. (Gift cards)Your experience there all depends on your account. You won’t get FANG money but it isn’t bad. I’ve been on two accounts with a great work life balance.,0,Naota,/company/Accenture/,SEND PRIVATE MESSAGE,/post/Accenture-Procurement-Contract-Analyst-Salary-k0vu8wmK,Accenture
0,"Mar 15, 2020","Its a great program to start your career, like any other career you got to drive it yourself. Overall it’s a great program",1,SaaSCons,/company/Accenture/,Consultant,/post/Accenture-Analyst-Development-Program-2EyEaxX8,Accenture
1,"Mar 12, 2020","What negative things have you heard? Experiencing it, I think it’s great purely because it gives you the flexibility to experience a variety of roles without having to align to an industry. It’s not very hands on, has some good programming you’re not required to go to but outside of that is essentially a 2 year pass to work where you want if you can get the Role.",0,Kanaan,/company/Accenture/,SEND PRIVATE MESSAGE,/post/Accenture-Analyst-Development-Program-2EyEaxX8,Accenture
0,"Apr 30, 2020","Don't take it. Taxes are high and you are going to end up paying more than half your salary in housing. Dublin is expensive and it is not even a nice city. If you want to move to Europe, at least go to Berlin, London or Paris. I make  €80k base in Dublin and it is not worth it. You can make €52k in Brussels and have a higher quality of life. There is a housing crisis in Dublin.",4,gnutella,/company/Facebook/,SEND PRIVATE MESSAGE,/post/Job-offer-in-Dublin-at-Accenture---Salary-fair-ktQG7xPX,Accenture
1,"Jun 8, 2020","FB? €80k bass? I am looking at business roles in big tech so I will either target London or Dublin. London is extremely competitive, expensive and high tax. No visibility regarding Dublin though",0,kjnL21,nan,SEND PRIVATE MESSAGE,/post/Job-offer-in-Dublin-at-Accenture---Salary-fair-ktQG7xPX,Accenture
2,"Apr 28, 2020",Wow. There’s a huge difference!,1,bladespire,nan,SEND PRIVATE MESSAGE,/post/Job-offer-in-Dublin-at-Accenture---Salary-fair-ktQG7xPX,Accenture
3,"Apr 29, 2020",I always find it confusing on the pay variance. Wish we could make the same regardless of location!,1,Love3000,/company/Amazon/,SEND PRIVATE MESSAGE,/post/Job-offer-in-Dublin-at-Accenture---Salary-fair-ktQG7xPX,Accenture
4,"May 4, 2020",Good insights! I must say that I’m living the US now. I’m trying to transition into consulting from industry and really want to take a good opportunity to work in consulting (in there innovation lab “The Dock”). So I could be willing to pay the pay loss for experience and entry point,1,bladespire,nan,SEND PRIVATE MESSAGE,/post/Job-offer-in-Dublin-at-Accenture---Salary-fair-ktQG7xPX,Accenture
5,"May 4, 2020",Is Accenture headquartered in Dublin for any other reason that tax breaks? It’s pretty common for such companies to set up shells with little valuable work done,0,keepOff,/company/Groupon/,SEND PRIVATE MESSAGE,/post/Job-offer-in-Dublin-at-Accenture---Salary-fair-ktQG7xPX,Accenture
6,"May 4, 2020","Well I would be working in the headquarter for global innovation centers, which is pretty great",0,bladespire,nan,SEND PRIVATE MESSAGE,/post/Job-offer-in-Dublin-at-Accenture---Salary-fair-ktQG7xPX,Accenture
7,"May 3, 2020","I have done the reverse journey so can provide more insights. CoL is ridiculously lower and things like healthcare, dental or student loans are a non issue. Salaries are much lower and any stock or additional income can mostly be ignored given the super high tax brackets for those so don’t factor those in. I also would assume equally expensive childcare if that’s a concern. Also, if you’re working for a company headquartered our of Ireland you can do quite well but will never reach the decision echelons. However you’ll probably have a lot more fun!",1,keepOff,/company/Groupon/,SEND PRIVATE MESSAGE,/post/Job-offer-in-Dublin-at-Accenture---Salary-fair-ktQG7xPX,Accenture
8,"Jun 8, 2020",Nowhere can match the US pay,0,kjnL21,nan,SEND PRIVATE MESSAGE,/post/Job-offer-in-Dublin-at-Accenture---Salary-fair-ktQG7xPX,Accenture
9,"Jun 8, 2020",Don’t even use it as a benchmark,0,kjnL21,nan,SEND PRIVATE MESSAGE,/post/Job-offer-in-Dublin-at-Accenture---Salary-fair-ktQG7xPX,Accenture
0,"Sep 18, 2017",Why not just dev?,0,dkdjt7rr2,/company/Oracle/,Eng,/post/Accenture-Technical-Consulting-Recommend-SNTuhSTK,Accenture
1,"Sep 18, 2017",Career progression and longevity. Straight Dev work just isn't fulfilling to me.,0,Vista4life,/company/Microsoft/,SEND PRIVATE MESSAGE,/post/Accenture-Technical-Consulting-Recommend-SNTuhSTK,Accenture
2,"Sep 18, 2017","I'm told consulting is patchwork, not a full product?",0,dkdjt7rr2,/company/Oracle/,Eng,/post/Accenture-Technical-Consulting-Recommend-SNTuhSTK,Accenture
3,"Sep 19, 2017","Was a consultant for acn, pay sucks hours and travel are horrible. Absolutely no work life balance. Ping me for more info",0,yVLH68,/company/Amazon/,SEND PRIVATE MESSAGE,/post/Accenture-Technical-Consulting-Recommend-SNTuhSTK,Accenture
4,"Sep 19, 2017",It's probably different per team. Plus don't you get paid hourly?,0,randrover,/company/Amazon/,SEND PRIVATE MESSAGE,/post/Accenture-Technical-Consulting-Recommend-SNTuhSTK,Accenture
5,"Sep 19, 2017","My roommate is a ""technical architect"" at Accenture.Sounds like a load of bullshit to me since the dude doesn't code, doesn't need to take care of ops/maintenance, and just ""architects"" shit for code monkeys to implement.Dunno why they don't just let the developers own the design process.",0,randrover,/company/Amazon/,SEND PRIVATE MESSAGE,/post/Accenture-Technical-Consulting-Recommend-SNTuhSTK,Accenture
0,"Jun 27, 2019",They hired me recently as a technology analyst— basically they train you to do IT implementation. I was a math and Econ major and most analysts in technology are more math heavy stem majors or management information systems majors. I think Accenture is good for the right kind of person. You really have to network here in order to be successful.,3,anagr19,/company/Accenture/,Consultant,/post/Best-job-for-new-grads-at-Accenture-wosXXOYY,Accenture
1,"Jun 27, 2019","I recently got an offer for the Technology Analyst position as well but I was also told that there would also be opportunities to work in project/program management, change management and business analyst type positions. Can anyone confirm this fact?",1,GoldenLoop,/company/US%20Navy/,SEND PRIVATE MESSAGE,/post/Best-job-for-new-grads-at-Accenture-wosXXOYY,Accenture
2,"Jun 27, 2019",You’re going to have very little control over your projects; and getting leadership to listen to you in terms of the skills you want to develop? Good luck.,1,newbieSF,/company/Accenture/,SEND PRIVATE MESSAGE,/post/Best-job-for-new-grads-at-Accenture-wosXXOYY,Accenture
3,"Jun 27, 2019",I’m technically on the PMO track but tbh at the analyst level PMO is mostly tracking excel spreadsheets— you’re not gonna be doing anything super impactful,0,angr,/company/Accenture/,SEND PRIVATE MESSAGE,/post/Best-job-for-new-grads-at-Accenture-wosXXOYY,Accenture
4,"Jun 27, 2019",Friends don’t let friends work at Accenture,1,newbieSF,/company/Accenture/,SEND PRIVATE MESSAGE,/post/Best-job-for-new-grads-at-Accenture-wosXXOYY,Accenture
5,"Jun 27, 2019",(I just quit. Yay!),1,newbieSF,/company/Accenture/,SEND PRIVATE MESSAGE,/post/Best-job-for-new-grads-at-Accenture-wosXXOYY,Accenture
6,"Jun 27, 2019",Where are you going?,0,yiVV51,/company/Accenture/,SEND PRIVATE MESSAGE,/post/Best-job-for-new-grads-at-Accenture-wosXXOYY,Accenture
7,"Jun 27, 2019",you have to hustle. self study. knock out projects and leave good impression to the client and peers. learn the consulting and overall business model of accenture.you can start networking by joining programs like the MDA (master data architect) then people will just come after you for SME adviceif you perform like a level 6 while you are level 10-11 then you'll get noticed and get rewardedbtw for new grads check out our ESPP,0,yqw,/company/Accenture/,SEND PRIVATE MESSAGE,/post/Best-job-for-new-grads-at-Accenture-wosXXOYY,Accenture
8,"Jun 27, 2019",Mind if I PM you?,0,angr,/company/Accenture/,SEND PRIVATE MESSAGE,/post/Best-job-for-new-grads-at-Accenture-wosXXOYY,Accenture
9,"Jun 27, 2019",sure!,0,yqw,/company/Accenture/,SEND PRIVATE MESSAGE,/post/Best-job-for-new-grads-at-Accenture-wosXXOYY,Accenture
0,"Aug 26, 2019","The recruiter confirmed it is a level 6. They also increased the offer to 160k base, 60k first year bonus. 48k second year bonus and 77 RSUs. Is that a reasonable offer?",2,ozKp43,/company/Accenture/,Mgmt,/post/Accenture-SM-to-AWS-senior-customer-solutions-manager-Should-I-switch-fyzEYiWy,Accenture
1,"Sep 5, 2019",Did you end up taking the offer?,0,xhMh55,/company/Accenture/,SEND PRIVATE MESSAGE,/post/Accenture-SM-to-AWS-senior-customer-solutions-manager-Should-I-switch-fyzEYiWy,Accenture
2,"Sep 5, 2019",I did,0,ozKp43,/company/Accenture/,Mgmt,/post/Accenture-SM-to-AWS-senior-customer-solutions-manager-Should-I-switch-fyzEYiWy,Accenture
3,"Aug 13, 2019",I got couple of offers with TC over 350k  in amazon and one of the Seattle based product company. Base is 160 in amazon and 200 in other company. I am in data science domain and level 8 at Accenture with base 130k in Seattle,0,Ir0nm3n,/company/Accenture/,SEND PRIVATE MESSAGE,/post/Accenture-SM-to-AWS-senior-customer-solutions-manager-Should-I-switch-fyzEYiWy,Accenture
4,"Aug 14, 2019",My Transfer is in progress 😜,0,Ir0nm3n,/company/Accenture/,SEND PRIVATE MESSAGE,/post/Accenture-SM-to-AWS-senior-customer-solutions-manager-Should-I-switch-fyzEYiWy,Accenture
5,"Aug 15, 2019","Lol jeeez, I'm level 10 and only making 67k in San Francisco. Can't wait to leave Accenture.",0,Pachinko91,/company/Accenture/,Data,/post/Accenture-SM-to-AWS-senior-customer-solutions-manager-Should-I-switch-fyzEYiWy,Accenture
6,"Aug 13, 2019",SDE at  L5 makes 250-300k as TC in Amazon and AWS customer solution manager would be nothing but handling customer issues and managing team.If you really want to go to sales continue at Accenture else try to get more than 200 base which would be still low at your experience.,0,Ir0nm3n,/company/Accenture/,SEND PRIVATE MESSAGE,/post/Accenture-SM-to-AWS-senior-customer-solutions-manager-Should-I-switch-fyzEYiWy,Accenture
7,"Aug 14, 2019",Thanks. I have heard 165-175k is typically the base for this level. I have 10 years of experience,0,ozKp43,/company/Accenture/,Mgmt,/post/Accenture-SM-to-AWS-senior-customer-solutions-manager-Should-I-switch-fyzEYiWy,Accenture
8,"Aug 14, 2019",Yes Amazon says 160 is max base but that is level 5. I got similar calls for AWS support but they pay at least 40-50% less than SDEs.,0,Ir0nm3n,/company/Accenture/,SEND PRIVATE MESSAGE,/post/Accenture-SM-to-AWS-senior-customer-solutions-manager-Should-I-switch-fyzEYiWy,Accenture
9,"Aug 14, 2019",What level?,0,TheStreets,/company/Amazon/,Product,/post/Accenture-SM-to-AWS-senior-customer-solutions-manager-Should-I-switch-fyzEYiWy,Accenture
10,"Aug 14, 2019",The recruiter hasn't told what level. Is that something I can ask?,0,ozKp43,/company/Accenture/,Mgmt,/post/Accenture-SM-to-AWS-senior-customer-solutions-manager-Should-I-switch-fyzEYiWy,Accenture
11,"Aug 14, 2019",Yoe?,0,qwertyca,/company/Medallia/,SEND PRIVATE MESSAGE,/post/Accenture-SM-to-AWS-senior-customer-solutions-manager-Should-I-switch-fyzEYiWy,Accenture
12,"Aug 14, 2019",10 years,0,ozKp43,/company/Accenture/,Mgmt,/post/Accenture-SM-to-AWS-senior-customer-solutions-manager-Should-I-switch-fyzEYiWy,Accenture
0,"Jul 2, 2020",Those aren't tech companies they are body shops.,49,stephfurry,/company/Zoox/,SEND PRIVATE MESSAGE,/post/Why-are-there-not-many-TCS-accenture-Cognizant-IBM-HP-employees-on-Blind-dpiW6PAD,Accenture
1,"Jul 8, 2020","This is why no one likes developers, they act  like they are the only ones in the world doing anything worthwhile... Everyone else is just extra, or in their way.  There are many sides to tech, and these are some of the biggest companies in tech today... It's insane to say they aren't tech.",8,tcxs,/company/TJX/,IT,/post/Why-are-there-not-many-TCS-accenture-Cognizant-IBM-HP-employees-on-Blind-dpiW6PAD,Accenture
2,"Jul 13, 2020",Have worked at such a body shop. I don't think I ever did any kind of engineering while I was there.,1,dilf,/company/Facebook/,SEND PRIVATE MESSAGE,/post/Why-are-there-not-many-TCS-accenture-Cognizant-IBM-HP-employees-on-Blind-dpiW6PAD,Accenture
3,"Jul 2, 2020",They don't comment for the fear of getting trolled by FAANG'ers,77,TContbutor,/company/Deloitte/,SEND PRIVATE MESSAGE,/post/Why-are-there-not-many-TCS-accenture-Cognizant-IBM-HP-employees-on-Blind-dpiW6PAD,Accenture
4,"Jul 2, 2020",^^ Look who is talking about trolling here? Deloittful post.,19,hankluf ,/company/PwC/,SEND PRIVATE MESSAGE,/post/Why-are-there-not-many-TCS-accenture-Cognizant-IBM-HP-employees-on-Blind-dpiW6PAD,Accenture
5,"Jul 6, 2020","FAANGers may not, Deloitte most likely",4,rcm76,/company/IBM/,SEND PRIVATE MESSAGE,/post/Why-are-there-not-many-TCS-accenture-Cognizant-IBM-HP-employees-on-Blind-dpiW6PAD,Accenture
6,"Jul 2, 2020","There are some, but mainly discussing about h1b and GC, instead of TC",38,-[ಠ_ಠ]-,/company/Ironclad/,SEND PRIVATE MESSAGE,/post/Why-are-there-not-many-TCS-accenture-Cognizant-IBM-HP-employees-on-Blind-dpiW6PAD,Accenture
7,"Jul 5, 2020","Let’s troll me: SQA, 3 yoe, TC 62k, not H1B. Wanna cry and quit.",15,mcfish,/company/Accenture/,QA,/post/Why-are-there-not-many-TCS-accenture-Cognizant-IBM-HP-employees-on-Blind-dpiW6PAD,Accenture
8,"Jul 13, 2020",😢,0,dilf,/company/Facebook/,SEND PRIVATE MESSAGE,/post/Why-are-there-not-many-TCS-accenture-Cognizant-IBM-HP-employees-on-Blind-dpiW6PAD,Accenture
9,"Jul 15, 2020","Bruh Avanade is the Accenture’s child company, and I got 72K as a new grad with no internships, then 82K in less than a year. Not H1B either. So wtf are you doing? I guess the only difference is I’m full stack and you’re SQA but that still doesn’t justify your salary at all.",0,gitPullAll,/company/Avanade/,Consultant,/post/Why-are-there-not-many-TCS-accenture-Cognizant-IBM-HP-employees-on-Blind-dpiW6PAD,Accenture
10,"Jul 2, 2020",Those guys are busy working 16 hrs getting their ass fried everyday and no time for family,13,X AE A-Xii,/company/Cisco/,Eng,/post/Why-are-there-not-many-TCS-accenture-Cognizant-IBM-HP-employees-on-Blind-dpiW6PAD,Accenture
11,"Jul 8, 2020","Ehhh might feel like the same working hours but we have to use extra hours to talk about you/clients, do our +1s, RFPs, and biz dev just so we can get the chance to even have a conversation about promotion",0,pebble3911,/company/Accenture/,SEND PRIVATE MESSAGE,/post/Why-are-there-not-many-TCS-accenture-Cognizant-IBM-HP-employees-on-Blind-dpiW6PAD,Accenture
12,"Jul 11, 2020",Is this supposed to be a sarcastic comment? Cause my job is great I keep my work stuff separated from my personal devices.,0,Iluvpizza,/company/IBM/,SEND PRIVATE MESSAGE,/post/Why-are-there-not-many-TCS-accenture-Cognizant-IBM-HP-employees-on-Blind-dpiW6PAD,Accenture
0,"May 13, 2019","I had a fizzbuzz interview and easy leetcode questions. Followup phone interview with the tech lead was just talking about my past experience and getting a chance to ask questions about their stack. The interviewer liked my questions, which I think sealed it for me, since the recruiter explicitly mentioned this to me after the interview. Overall, pretty easy, but I'm guessing the actual questions will vary greatly as it seems up to whatever the project leads want to discuss. Also, this wasn't a front-end position.",1,Mulch,/company/Accenture/,SEND PRIVATE MESSAGE,/post/Accenture-Frontend-Software-Engineer-interview-tomorrow---advice-OMp0AWv5,Accenture
1,"May 13, 2019",Thank you. How can apply for a govt contract job? I need apply at Accenture?,0,vxefcdrvsw,/company/Microsoft/,SEND PRIVATE MESSAGE,/post/Accenture-Frontend-Software-Engineer-interview-tomorrow---advice-OMp0AWv5,Accenture
2,"May 13, 2019",Basically when you work at Accenture you need to apply for a project to bill hours to. I didn't have to do this because I was hired directly to the project. So it depends on the job opening.,0,Mulch,/company/Accenture/,SEND PRIVATE MESSAGE,/post/Accenture-Frontend-Software-Engineer-interview-tomorrow---advice-OMp0AWv5,Accenture
3,"May 13, 2019",TC 106k with 3.5 YOE,0,plackers123,/company/Accenture/,SEND PRIVATE MESSAGE,/post/Accenture-Frontend-Software-Engineer-interview-tomorrow---advice-OMp0AWv5,Accenture
4,"May 13, 2019","It was a video interview over a chat interface like Skype. I forget the actual software we used. The guy just had me type in my code through the chat lol. I wouldn't worry too much about the interview, just make sure you're well rested. Not much you can do at this point other than making sure you feel good.",0,Mulch,/company/Accenture/,SEND PRIVATE MESSAGE,/post/Accenture-Frontend-Software-Engineer-interview-tomorrow---advice-OMp0AWv5,Accenture
5,"May 13, 2019",Ok great!  Thanks for the info.,0,XOIS14,nan,SEND PRIVATE MESSAGE,/post/Accenture-Frontend-Software-Engineer-interview-tomorrow---advice-OMp0AWv5,Accenture
0,Mar 29,I could recommend you to EPAM.,1,GKIT10,/company/EPAM-Systems/,SEND PRIVATE MESSAGE,/post/Accenture-EPAM-Luxoft-referral-please-oQgnTQ4f,Accenture
1,Apr 1,DM for accenture,0,opah121,/company/Accenture/,SEND PRIVATE MESSAGE,/post/Accenture-EPAM-Luxoft-referral-please-oQgnTQ4f,Accenture
2,Mar 31,DM for PayPal,0,Kisofdeath,/company/PayPal/,SEND PRIVATE MESSAGE,/post/Accenture-EPAM-Luxoft-referral-please-oQgnTQ4f,Accenture
0,"Oct 23, 2019",i can give u. DM me,1,Bxpe83,/company/Accenture/,SEND PRIVATE MESSAGE,/post/Looking-for-a-referral-@Accenture-GbwQPejo,Accenture
1,"Oct 23, 2019",Thanks! DM,0,Accen,/company/Blue-Cross-Blue-Shield/,SEND PRIVATE MESSAGE,/post/Looking-for-a-referral-@Accenture-GbwQPejo,Accenture
2,"May 10, 2020",Any chance you are still doing referrals? I'm looking for a consulting position at the moment,0,DyOk12,nan,SEND PRIVATE MESSAGE,/post/Looking-for-a-referral-@Accenture-GbwQPejo,Accenture
3,"Oct 23, 2019",Want to travel 90% of the time?,1,SwoleRon,nan,SEND PRIVATE MESSAGE,/post/Looking-for-a-referral-@Accenture-GbwQPejo,Accenture
4,"Oct 23, 2019",Yeah,0,Accen,/company/Blue-Cross-Blue-Shield/,SEND PRIVATE MESSAGE,/post/Looking-for-a-referral-@Accenture-GbwQPejo,Accenture
0,"Jun 12, 2019",TC/YOE?,0,🏃🏻🐠🌳🌴🍄🌝🔥☂,/company/Microsoft/,SEND PRIVATE MESSAGE,/post/How-is-Accenture-Digital-Applied-Intelligence-team-bgYHvVzF,Accenture
1,"Jun 12, 2019",15 YOE TC 320k USD,0,PlBV44,/company/Apple/,SEND PRIVATE MESSAGE,/post/How-is-Accenture-Digital-Applied-Intelligence-team-bgYHvVzF,Accenture
0,Jan 28,They are not public but they charge anywhere from $200 to $500 per hour or even more,0,IuDA63,/company/Salesforce/,SEND PRIVATE MESSAGE,/post/Accenture-Slalom-client-fees-sVyTMcYQ,Accenture
0,"Aug 7, 2017","You will get access to most perks. If you're a vendor there is a higher chance of being converted. There is a special post thread for Google affiliated emails in this app. Yes, there are groups, since you're not a white badge you won't be able to see them. They seriously cracked down. 😒",5,Kitty🐱,/company/Google/,Eng,/post/just-hired-at-Accenture-as-a-Google-contractor-any-advice-FOiArtVF,Accenture
1,"Aug 8, 2017",It has very very little to do with skill and is exclusively a headcount issue.,0,ungoogley,/company/Google/,Eng,/post/just-hired-at-Accenture-as-a-Google-contractor-any-advice-FOiArtVF,Accenture
2,"Sep 11, 2017",Accenture likes to subcontract its Human Resources so you technically don't even work for Accenture. So you can convert to Accenture if you really kiss ass and go on smoke breaks with the stressed out Accenture jerks.  If you do work for Accenture direct it's not too bad.  Googlers seem to be more professionally mature and seem to not like Accenture which is funny,0,BIHP46,nan,SEND PRIVATE MESSAGE,/post/just-hired-at-Accenture-as-a-Google-contractor-any-advice-FOiArtVF,Accenture
3,"Aug 8, 2017","Don't get your hopes up. They will use you and treat you like a second class citizen. They love it when you are seen and not heard. Don't step on a real Googler's toes. Just because they lack experience and intelligence, their ideas are worth far more than yours. You will not be hired by Google, those days are over. If you are lucky you might just get to work your whole two years, maybe. Don't worry if you seen to be working harder for less than your Google counterpart or leader, you are. It's in the handbook. Don't get any ideas about anything other than what the thought leaders at Google tell you you should think, especially don't write a manifesto about it. BTW, all the cool nerds went to work somewhere other than Google.",5,relgoog,/company/Google/,Product,/post/just-hired-at-Accenture-as-a-Google-contractor-any-advice-FOiArtVF,Accenture
4,"Aug 8, 2017","I'm Canadian/American dual citizen, technically that makes me an immigrant.  Other than that, just a reasonably talented white dude.",1,I0I-655321,nan,Mktg,/post/just-hired-at-Accenture-as-a-Google-contractor-any-advice-FOiArtVF,Accenture
5,"Aug 8, 2017",fellow Libertarian here. keep your mouth shut and head down. everything relgoog says is true,3,ungoogley,/company/Google/,Eng,/post/just-hired-at-Accenture-as-a-Google-contractor-any-advice-FOiArtVF,Accenture
6,"Aug 7, 2017",don't post any manifestos,12,S Nutеlla,/company/VMware/,SEND PRIVATE MESSAGE,/post/just-hired-at-Accenture-as-a-Google-contractor-any-advice-FOiArtVF,Accenture
7,"Aug 7, 2017","Don't disagree too wildly with the established opinions, particularly with regards to ideological meritocracy, because it can't be distinguished fairly from legitimate sexism. It hasn't ended well for everyone lately who has done that. Don't take food home (a slice of pizza left out is OK, but don't take home a frozen pizza). All the best to you.",10,Trotwood,/company/Microsoft/,Eng,/post/just-hired-at-Accenture-as-a-Google-contractor-any-advice-FOiArtVF,Accenture
8,"Aug 7, 2017","I was talking more about groups that meet in the Google Plex or somewhere, even on my own time.  I was told there might be a group that discusses or a committee that somehow works with YouTube in things like policy, procedure, the future of the platform, etc. The work equivalent of an extra curricular activity.",0,I0I-655321,nan,Mktg,/post/just-hired-at-Accenture-as-a-Google-contractor-any-advice-FOiArtVF,Accenture
9,"Aug 8, 2017","I just want to hang out, learn, and listen to the full Googlers and help where I can.  Youtube has changed the world and I want  to help.  I will pay my dues until I can be one of them.",1,I0I-655321,nan,Mktg,/post/just-hired-at-Accenture-as-a-Google-contractor-any-advice-FOiArtVF,Accenture
10,"Mar 30, 2019",Go to the Google gym and take some if the classes there,0,helloooo1,nan,SEND PRIVATE MESSAGE,/post/just-hired-at-Accenture-as-a-Google-contractor-any-advice-FOiArtVF,Accenture
0,"Dec 21, 2019",Good for you.  Yesterday was my last day after 16 years at level=Partner-1 with a consulting company (and not the first).  Moving on to AWS on Monday... will be a refreshing change.,2,dmodemd,/company/Capco/,SEND PRIVATE MESSAGE,/post/I-just-resigned-from-my-Accenture-job-and-couldnt-be-happier-u5VQotLQ,Accenture
1,"Dec 22, 2019","It was a good career, always some pros and cons.  I would recommend though depending on your location and willingness to travel.",1,dmodemd,/company/Capco/,SEND PRIVATE MESSAGE,/post/I-just-resigned-from-my-Accenture-job-and-couldnt-be-happier-u5VQotLQ,Accenture
2,"Dec 22, 2019","The US HQ is NYC, so OP, look them up if you are looking for a switch again.",1,dmodemd,/company/Capco/,SEND PRIVATE MESSAGE,/post/I-just-resigned-from-my-Accenture-job-and-couldnt-be-happier-u5VQotLQ,Accenture
3,"Dec 20, 2019",Why do you feel that way? Is it just cause of TC?,3,BRY47,/company/Infosys/,Eng,/post/I-just-resigned-from-my-Accenture-job-and-couldnt-be-happier-u5VQotLQ,Accenture
4,"Dec 20, 2019","Yeah I was underpaid by $20k, I started off at a lower level despite having experience and was told my level and sector don’t actually matter. And I was stuck with the same client for two years even though I was constantly asking for a different client or to be transferred back home.",1,yellow95,/company/Accenture/,SEND PRIVATE MESSAGE,/post/I-just-resigned-from-my-Accenture-job-and-couldnt-be-happier-u5VQotLQ,Accenture
5,"Dec 20, 2019",Congrats buddy and have a great year ahead 🎉😁,1,🧘‍♂️ 🧘‍♀️ ,/company/MathWorks/,SEND PRIVATE MESSAGE,/post/I-just-resigned-from-my-Accenture-job-and-couldnt-be-happier-u5VQotLQ,Accenture
6,"Dec 20, 2019",Thank you so much!! You too buddy!!,1,yellow95,/company/Accenture/,SEND PRIVATE MESSAGE,/post/I-just-resigned-from-my-Accenture-job-and-couldnt-be-happier-u5VQotLQ,Accenture
7,"Dec 20, 2019",Congrats! Where’s your new job at?,1,dontgiveaf,/company/Thomson-Reuters/,SEND PRIVATE MESSAGE,/post/I-just-resigned-from-my-Accenture-job-and-couldnt-be-happier-u5VQotLQ,Accenture
8,"Dec 20, 2019",Thanks!! I’ll be joining a smaller tech  consulting firm in New York City!,1,yellow95,/company/Accenture/,SEND PRIVATE MESSAGE,/post/I-just-resigned-from-my-Accenture-job-and-couldnt-be-happier-u5VQotLQ,Accenture
