,comment_date,comment_text,comment_like,comment_user,comment_firm,comment_position,comment_url,company
6,"Jul 11, 2019","Agree with commenters here. Big 4 today is overrated. Pay is ok not great for the expectations they have. Long hours and 1/3 will leave within 1-2 years. 2/3 will leave by 3-4th year. Remaining will get stuck at mid management level for life or until they get kicked out. Only 1 in maybe 100 make it to partner after slogging out for 12-15 years.Used to be a great career path when consulting was looked as a prestigious profession. Like pilots and cabin crew, times have changed and clients no longer value consulting. They would rather hire internally at a fraction of consulting fees. And with the perks they offer, the smart ones are now going internal than consulting.",3,Gfes23,/company/Deloitte/,Consultant,/post/Consultinganalyst---Deloitte-or-Accenture-EJEHWqwF,Accenture
7,"Jul 12, 2019","You talk like it’s different anywhere else. The space at the top is scarce in any company, most people (90%) will end up stuck in middle management or below. If you think 12 to 15 years to get to a partner position is a long time, do you have any idea how long it takes to attain an equivalent position in the industry? A lot longer, and you will have to slog a lot more if you want those positions.",0,uAag27,/company/Deloitte/,SEND PRIVATE MESSAGE,/post/Consultinganalyst---Deloitte-or-Accenture-EJEHWqwF,Accenture
8,"Jul 10, 2019",Having worked for both Deloitte and now Accenture. I recommend Deloitte,3,akijangun,/company/Accenture/,SEND PRIVATE MESSAGE,/post/Consultinganalyst---Deloitte-or-Accenture-EJEHWqwF,Accenture
9,"Jul 12, 2019","If you are looking for an entry level job, you may have a chance, however you are out of the target audience that Deloitte hires in entry level positions (college grads). Your degree is not helping you either.If you want MBB, you should try them out of the bat. They do consider a lot of people with advanced degrees in their hiring process. Don’t waste time at Deloitte or Accenture.Also, if you want feedback from more people in consulting, join fishbowl. Blind is full of programmers and software engineers that only like to talk and lie about their total compensation.",2,uAag27,/company/Deloitte/,SEND PRIVATE MESSAGE,/post/Consultinganalyst---Deloitte-or-Accenture-EJEHWqwF,Accenture
0,"Nov 9, 2018","Do consultant code? If they do you are gravely underpaid, even for Texas.",1,5nm,/company/AMD/,SEND PRIVATE MESSAGE,/post/IBM-to-Accenture-r0d2on6Y,Accenture
1,"Nov 9, 2018","No, not heavy coding... It's minimal...using and implementing existing tooling/solutions.",1,obdybbtu,/company/IBM/,SEND PRIVATE MESSAGE,/post/IBM-to-Accenture-r0d2on6Y,Accenture
2,"Nov 9, 2018",Accenture > IBM,0,✌🏻✌🏻✌🏻,/company/Cisco/,SEND PRIVATE MESSAGE,/post/IBM-to-Accenture-r0d2on6Y,Accenture
3,"Nov 9, 2018",I know that but what about 'ibm senior consultant' compared to just 'consultant' at Accenture? I'm looking for numbers please.... Salary and years of experience for each.,0,obdybbtu,/company/IBM/,SEND PRIVATE MESSAGE,/post/IBM-to-Accenture-r0d2on6Y,Accenture
4,"Nov 9, 2018","Dude if you’re a “senior” consultant making 85k, you’re underpaid. Vastly.Accenture pays more and isn’t slowly dying like IBM. Go. Accenture on your resume > IBM",0,✌🏻✌🏻✌🏻,/company/Cisco/,SEND PRIVATE MESSAGE,/post/IBM-to-Accenture-r0d2on6Y,Accenture
5,"Apr 10, 2019",What kind of tools? AI artificial intelligence or Accenture calls or applied intelligence,0,sfstreets,nan,SEND PRIVATE MESSAGE,/post/IBM-to-Accenture-r0d2on6Y,Accenture
6,"Nov 9, 2018",Ai consultant?  That's something I've never heard about.,0,TCPolice,/company/IBM/,SEND PRIVATE MESSAGE,/post/IBM-to-Accenture-r0d2on6Y,Accenture
7,"Nov 9, 2018",What do you consul on AI on,0,Vdzlw,/company/Google/,SEND PRIVATE MESSAGE,/post/IBM-to-Accenture-r0d2on6Y,Accenture
0,"Feb 12, 2019",Explains the multitude of clone posts 😂,2,IAMSlayer,/company/Bloomberg/,SEND PRIVATE MESSAGE,/post/Interviewing-with-Accenture-32ydgRcQ,Accenture
1,"Feb 12, 2019",Hahahahahaha ^,0,unemployd,/company/Airbnb/,Other,/post/Interviewing-with-Accenture-32ydgRcQ,Accenture
2,"Feb 12, 2019","Ask interviewer any technical question. If they answer then join and if they don’t answer, you know what to do!!Stay away from Accenture, Infy, CTS, TCS for peaceful life.",4,hsLy13,/company/Wells-Fargo/,SEND PRIVATE MESSAGE,/post/Interviewing-with-Accenture-32ydgRcQ,Accenture
3,"Feb 12, 2019",Did you mean to post this five times?,4,randUser,/company/Gap/,Eng,/post/Interviewing-with-Accenture-32ydgRcQ,Accenture
4,"Feb 12, 2019","Hey, worked at ACN for two years in the management consulting division in the Bay Area, had a large healthcare client, happy to share my thoughts etc. Message me if you're interested",0,unemployd,/company/Airbnb/,Other,/post/Interviewing-with-Accenture-32ydgRcQ,Accenture
0,"Jan 26, 2020",Probably about 80-85k. Consulting pays low,1,floraad,/company/DocuSign/,SEND PRIVATE MESSAGE,/post/Accenture-Security-Analyst-Salary-2FoJhLr0,Accenture
1,"Jan 26, 2020",Thats around the numbers I was thinking. Thanks,0,uVaf12,nan,SEND PRIVATE MESSAGE,/post/Accenture-Security-Analyst-Salary-2FoJhLr0,Accenture
2,"Jan 26, 2020",Location?,1,fgmflkfdj,/company/Microsoft/,SEND PRIVATE MESSAGE,/post/Accenture-Security-Analyst-Salary-2FoJhLr0,Accenture
3,"Jan 26, 2020",It’s in the Seattle location,0,uVaf12,nan,SEND PRIVATE MESSAGE,/post/Accenture-Security-Analyst-Salary-2FoJhLr0,Accenture
4,"Jan 26, 2020","Take what you can to get experience, unless you have competing offers. Once you have a couple years under your belt, the skys the limit",1,gvyhnf,/company/Heap/,SEND PRIVATE MESSAGE,/post/Accenture-Security-Analyst-Salary-2FoJhLr0,Accenture
5,Mar 31,What was the offer?,0,LSkr86,/company/Verizon/,SEND PRIVATE MESSAGE,/post/Accenture-Security-Analyst-Salary-2FoJhLr0,Accenture
6,"Feb 27, 2020",They should have given you that information when they gave you a verbal offer...,0,Drgz71,/company/Accenture/,SEND PRIVATE MESSAGE,/post/Accenture-Security-Analyst-Salary-2FoJhLr0,Accenture
0,Jan 26,No such thing as OPT visa,1,fi1ibuster,/company/NVIDIA/,SEND PRIVATE MESSAGE,/post/Accenture-OPT-Oenv32G7,Accenture
1,Jan 26,F1 visa my bad lol,1,Dhound,nan,SEND PRIVATE MESSAGE,/post/Accenture-OPT-Oenv32G7,Accenture
2,Jan 26,No day 1 CPT is necessary. Jk probably everyone in the country hire OPT students.,1,kraft-m&c,nan,Eng,/post/Accenture-OPT-Oenv32G7,Accenture
3,Jan 26,Thanks lol,0,Dhound,nan,SEND PRIVATE MESSAGE,/post/Accenture-OPT-Oenv32G7,Accenture
4,Jan 26,I think they do as long as they don’t have to sponsor for H1B.,1,fckoracle,/company/Oracle/,SEND PRIVATE MESSAGE,/post/Accenture-OPT-Oenv32G7,Accenture
5,Jan 26,I'm quite sure that they don't for the vast majority of their positions,1,BVYH51,/company/McKinsey/,SEND PRIVATE MESSAGE,/post/Accenture-OPT-Oenv32G7,Accenture
0,"Apr 6, 2020",I used to work at Accenture. You will never get as much as a $6k annual bonus. The new CEO is nuts and the company is going downhill. Stay where you are.,3,ElonThrust,/company/IBM/,SEND PRIVATE MESSAGE,/post/Accenture-VS-small-company-yej6ihZN,Accenture
1,"Apr 16, 2020",Why do you think the new CEO is crazy?,0,Drgz71,/company/Accenture/,SEND PRIVATE MESSAGE,/post/Accenture-VS-small-company-yej6ihZN,Accenture
2,"May 14, 2020",Julie is great - she is respected in many circles.  I’ve had bonuses anywhere from maybe 5% in a bad year to 27% when I rated ATVT.  Does travel play into this as in you will travel at either?  Also what is your path at the smaller company?,0,ciexpert,/company/Accenture/,SEND PRIVATE MESSAGE,/post/Accenture-VS-small-company-yej6ihZN,Accenture
3,"Apr 6, 2020","Money is not eveything, be humbled and blessed you have a job.  Over 7 millions had filed for unemployment.",2,rbhuta4988,nan,IT,/post/Accenture-VS-small-company-yej6ihZN,Accenture
4,"Apr 6, 2020","Thanks for your comment. I am very grateful, especially during this time. I was stuck in limbo for a while with many companies on a hiring freeze. I do agree with you that money isn't everything, hence why I'm posting on Blind to get several opinions",1,oXt88,/company/Booz-Allen-Hamilton/,SEND PRIVATE MESSAGE,/post/Accenture-VS-small-company-yej6ihZN,Accenture
5,"Apr 6, 2020","You are welcome, plus if you ever need extra money lot of part time remote opportunities are popping up!",0,rbhuta4988,nan,IT,/post/Accenture-VS-small-company-yej6ihZN,Accenture
6,"Apr 28, 2020","Accenture is not a great company to work for. They don't have cutting edge technology work and the work culture is cannibalistic.If you choose to go with them, stay there for a brief period of time and then leave for something better.",2,Time2020,/company/Ancestry/,SEND PRIVATE MESSAGE,/post/Accenture-VS-small-company-yej6ihZN,Accenture
7,"Apr 6, 2020",Accenture offer in BayArea?,0,re@lDTrump,/company/Microsoft/,SEND PRIVATE MESSAGE,/post/Accenture-VS-small-company-yej6ihZN,Accenture
8,"Apr 6, 2020",YOE?,0,re@lDTrump,/company/Microsoft/,SEND PRIVATE MESSAGE,/post/Accenture-VS-small-company-yej6ihZN,Accenture
9,"Apr 6, 2020",9,0,oXt88,/company/Booz-Allen-Hamilton/,SEND PRIVATE MESSAGE,/post/Accenture-VS-small-company-yej6ihZN,Accenture
10,"May 7, 2020",Do you mind sharing the name of the small company ?,0,AzMt25,/company/ClearDATA/,SEND PRIVATE MESSAGE,/post/Accenture-VS-small-company-yej6ihZN,Accenture
0,"Oct 1, 2019",Stop me if I am off base..Accenture is a huge company built by many acquisitions every year. If you are joining one of the recently acquired it depends on what the company was before it was aquired or you'll be dumped into some on site client engagement and that really depends on your team.I guess what I am trying to say is you will probably feel like me. A tiny minnow in the ocean that is Accenture,1,plackers123,/company/Accenture/,SEND PRIVATE MESSAGE,/post/Accenture-Situational-Interview-OTJreDfd,Accenture
1,"Sep 30, 2019",Will be general behavioral - accomplishment or challenge and then the deep dive follow up questions,0,xhMh55,/company/Accenture/,SEND PRIVATE MESSAGE,/post/Accenture-Situational-Interview-OTJreDfd,Accenture
2,"Sep 30, 2019",Why are you moving out?,0,xhMh55,/company/Accenture/,SEND PRIVATE MESSAGE,/post/Accenture-Situational-Interview-OTJreDfd,Accenture
0,Jan 6,"I just started at Accenture at SM. 7 YOE. Joined three weeks ago. Absolutely hate the culture, deal types and scope of projects. Should I run?Base: 200kBonus: 18+20%RSU: ???",2,fQJT72,/company/Accenture/,SEND PRIVATE MESSAGE,/post/Whats-next-after-SM-at-Accenture-cHdfca5X,Accenture
1,Apr 1,Location?,0,LrIr37,/company/Accenture/,Eng,/post/Whats-next-after-SM-at-Accenture-cHdfca5X,Accenture
2,Apr 4,I made more at a tier 3 tech as a low SWE,0,ExGrouponr,/company/Groupon/,SEND PRIVATE MESSAGE,/post/Whats-next-after-SM-at-Accenture-cHdfca5X,Accenture
3,Jan 5,what’s your yoe? i was an accenture consultant before jumping.i have some friends who stayed and are now SM and I hear some never make it to MDpersonally i’ve been happy with the switch into industry,0,breakwall,/company/Tesla/,SEND PRIVATE MESSAGE,/post/Whats-next-after-SM-at-Accenture-cHdfca5X,Accenture
4,Jan 5,"really depends what it means for you to get to MD...if u really enjoy accenture id say just go for it and stay. if it’s for the TC, there are greener pastures at tech companies",3,breakwall,/company/Tesla/,SEND PRIVATE MESSAGE,/post/Whats-next-after-SM-at-Accenture-cHdfca5X,Accenture
5,Jan 5,happy to chat more if needed as i have quite a few friends still at ACN. what city are you in and TC as a fourth year sm?,1,breakwall,/company/Tesla/,SEND PRIVATE MESSAGE,/post/Whats-next-after-SM-at-Accenture-cHdfca5X,Accenture
6,Jan 6,Leave!  Now!  I just did and almost doubled my TC and came in at a higher level.,2,XOHb72,/company/Accenture/,SEND PRIVATE MESSAGE,/post/Whats-next-after-SM-at-Accenture-cHdfca5X,Accenture
7,Jan 6,where’d u go and TC?,1,breakwall,/company/Tesla/,SEND PRIVATE MESSAGE,/post/Whats-next-after-SM-at-Accenture-cHdfca5X,Accenture
8,Jan 6,Tech company.  $410,0,XOHb72,/company/Accenture/,SEND PRIVATE MESSAGE,/post/Whats-next-after-SM-at-Accenture-cHdfca5X,Accenture
9,Jan 6,"I feel like I’ve lost my edge after being at SM for so long, all I do is PPT all day and put out fires, and it’s been ages since I last coded... starting to forget everything I learned. Should I be worried?",1,cnslt450,/company/Accenture/,Consultant,/post/Whats-next-after-SM-at-Accenture-cHdfca5X,Accenture
10,Jan 6,10 YoE and 190 TC,0,cnslt450,/company/Accenture/,Consultant,/post/Whats-next-after-SM-at-Accenture-cHdfca5X,Accenture
11,Jan 6,If you are ok making ppts and putting out fires. If you want to learn and grow then look elsewhere,1,GCmW31,/company/Accenture/,SEND PRIVATE MESSAGE,/post/Whats-next-after-SM-at-Accenture-cHdfca5X,Accenture
12,Mar 31,"Tbh I left BCG as an Associate and tripled my TC going to Google. One of the things I realized was that in consulting, there was this bubble that perceived “industry” as bad. Incompetent clients, slow processes, toxic work environments. What I realized was that this is actually selection bias - companies don’t hire consulting firms, even BCG, for their most important projects or in their best performing business units. They put consultants on the projects they couldn’t convince anyone internally to do.Things are a billion times better outside consulting. Or at least three times better.",2,h6hbb2,/company/Google/,SEND PRIVATE MESSAGE,/post/Whats-next-after-SM-at-Accenture-cHdfca5X,Accenture
0,"Mar 8, 2017",About $400k+ and no life.,2,⚔,/company/Amazon/,SEND PRIVATE MESSAGE,/post/Accenture-director-salary-jgixVKA1,Accenture
1,"Mar 9, 2017","Define chill?Similar sized company as Amazon - about 300k employees globally. Lots of regular enterprise red tape.If you get up to a Director level at Accenture, you have lived the ""consultants life"" for awhile.At that level, you might be used to ensuring every part of your day is billable, balancing home life and travel to clients sites. So in that regard if you make Director or above at Accenture it might be pretty ""chill"" compared to other roles at ACN.Perfect job if you are single and love to travel and network with folks. Not so much if you have a family, tired of traveling and would rather dev away from people in a dark, cold room with headphones on.Source: worked at Accenture for 8 years before joining AWS",4,⚔,/company/Amazon/,SEND PRIVATE MESSAGE,/post/Accenture-director-salary-jgixVKA1,Accenture
2,"Mar 2, 2019","This hit close to home. Spent almost 3 years at Accenture and can't imagine what 8 would have been like.I have to admit it did set me up for AWS, didn't have issues adjusting to the pace compared to peers who came from cushy banks or in house corporate IT departments",0,cloudjunki,/company/Amazon/,SEND PRIVATE MESSAGE,/post/Accenture-director-salary-jgixVKA1,Accenture
3,"Mar 10, 2017",I turned down several Accenture offers because I worked closely with many from the company including partners.  My morals and ethics got in the way after seeing their almost criminal behavior. I wouldn't have been able to sleep at night working for them.  But there are plenty that do.,1,KFqe18,/company/Oracle/,SEND PRIVATE MESSAGE,/post/Accenture-director-salary-jgixVKA1,Accenture
4,"Mar 8, 2017",5 million,0,⬅️,/company/Amazon/,SEND PRIVATE MESSAGE,/post/Accenture-director-salary-jgixVKA1,Accenture
5,"Mar 8, 2017",in India,0,⬅️,/company/Amazon/,SEND PRIVATE MESSAGE,/post/Accenture-director-salary-jgixVKA1,Accenture
6,"Mar 8, 2017",Mumbai,0,⬅️,/company/Amazon/,SEND PRIVATE MESSAGE,/post/Accenture-director-salary-jgixVKA1,Accenture
7,"Mar 9, 2017",Thanks I haven't worked in consulting before So this is going to be a new experience How does Accenture break down salaries? So they give RSUs every year ? Is bonus a big portion of that 400k you mentioned?Thinking of applying to Accenture as the possible next move to get some varied experience,0,1234sw,/company/PayPal/,SEND PRIVATE MESSAGE,/post/Accenture-director-salary-jgixVKA1,Accenture
0,"Nov 1, 2019",get the offer and share the number so we can judge it. Don't count your chickens before they hatch,4,🦙 Alpaca,/company/Cisco/,SEND PRIVATE MESSAGE,/post/Accenture-M-level-compensation-uQY07LZP,Accenture
1,"Nov 1, 2019",Accenture is shit 💩,2,random25 ⚽️,/company/AT&T/,SEND PRIVATE MESSAGE,/post/Accenture-M-level-compensation-uQY07LZP,Accenture
2,"Nov 1, 2019",M is 130-160. A top MBA can swing this up by <=10% though,1,sslc,/company/Aura/,SEND PRIVATE MESSAGE,/post/Accenture-M-level-compensation-uQY07LZP,Accenture
3,"Nov 1, 2019",What's your experience and which practice? Accenture is huge so it varies a lot,0,umlw17,/company/Accenture/,SEND PRIVATE MESSAGE,/post/Accenture-M-level-compensation-uQY07LZP,Accenture
4,"Nov 2, 2019",Oracle middleware 13+ yoe,0,fris-b,/company/Cognizant/,IT,/post/Accenture-M-level-compensation-uQY07LZP,Accenture
0,"Nov 27, 2019",My first year at L7 was at $172k. With signing bonus of $25k. Accenture tends to give you as little as you ask so give yourself some credit and then some.,1,brewhacker,/company/Accenture/,SEND PRIVATE MESSAGE,/post/Accenture-L7-for-San-Francisco-a48WedcO,Accenture
1,"Nov 20, 2019",first year L7 at $168k,0,tetopoteto,/company/Accenture/,Consultant,/post/Accenture-L7-for-San-Francisco-a48WedcO,Accenture
2,"Nov 20, 2019",How much shd I ask as joining bonus ?,0,gqKd20,/company/Bio-Rad%20Laboratories/,SEND PRIVATE MESSAGE,/post/Accenture-L7-for-San-Francisco-a48WedcO,Accenture
3,"Nov 20, 2019",10-15k is pretty common,0,tetopoteto,/company/Accenture/,Strategy,/post/Accenture-L7-for-San-Francisco-a48WedcO,Accenture
4,"Dec 9, 2019","I’m L8 with a base of $153k, not in the Bay Area though. My salary adjusted for Bay Area cost of living would be around $190k. I’d say that you should come in around $200k or more and let them counter.",0,acncon,/company/Accenture/,SEND PRIVATE MESSAGE,/post/Accenture-L7-for-San-Francisco-a48WedcO,Accenture
5,"Nov 20, 2019",Thanks,0,gqKd20,/company/Bio-Rad%20Laboratories/,SEND PRIVATE MESSAGE,/post/Accenture-L7-for-San-Francisco-a48WedcO,Accenture
6,"Nov 19, 2019","when i was L6 here nyc, my base salary is 178K",0,dfjqieb,/company/Accenture/,SEND PRIVATE MESSAGE,/post/Accenture-L7-for-San-Francisco-a48WedcO,Accenture
0,"Nov 5, 2020","Yeah, that’s low. Just ask for more and be willing to walk. Other good job offers will come. You have momentum now.",1,1234dmrs!,/company/Capital-One/,SEND PRIVATE MESSAGE,/post/Successfully-negotiate-an-Accenture-offer-oEMa33NX,Accenture
1,"Nov 5, 2020",They’ll try to push you as low as they can. Saves them money. Just ask for more.,0,1234dmrs!,/company/Capital-One/,SEND PRIVATE MESSAGE,/post/Successfully-negotiate-an-Accenture-offer-oEMa33NX,Accenture
2,Feb 11,I’m In the same situation. Did you end up negotiating ? How much did they end up paying you ?,0,blindsees,/company/Boeing/,SEND PRIVATE MESSAGE,/post/Successfully-negotiate-an-Accenture-offer-oEMa33NX,Accenture
3,"Nov 5, 2020","They won’t negotiate with new college grads but absolutely will for experienced hires. 79.5k is pretty much their starting salary, I would aim even higher tbh. Wouldn’t surprise me if they take you in at 100k",1,dfhijlm,/company/KPMG/,SEND PRIVATE MESSAGE,/post/Successfully-negotiate-an-Accenture-offer-oEMa33NX,Accenture
4,"Nov 5, 2020",This is way too low but if you are not client and market then it kind of makes sense :/,0,AIgf01,/company/Amazon/,SEND PRIVATE MESSAGE,/post/Successfully-negotiate-an-Accenture-offer-oEMa33NX,Accenture
5,"Nov 5, 2020",What do you mean by “Client and market “?,0,RLHD04,/company/Boeing/,SEND PRIVATE MESSAGE,/post/Successfully-negotiate-an-Accenture-offer-oEMa33NX,Accenture
6,"Nov 5, 2020",Client and market is consulting side with higher pay and the other is client delivery and ops which is tech side - much lower pay and harder for promotions,0,AIgf01,/company/Amazon/,SEND PRIVATE MESSAGE,/post/Successfully-negotiate-an-Accenture-offer-oEMa33NX,Accenture
7,"Nov 5, 2020",YOE?,0,hrdworker,/company/Adobe/,SEND PRIVATE MESSAGE,/post/Successfully-negotiate-an-Accenture-offer-oEMa33NX,Accenture
8,"Nov 5, 2020",2yrs of engineering consulting,0,RLHD04,/company/Boeing/,SEND PRIVATE MESSAGE,/post/Successfully-negotiate-an-Accenture-offer-oEMa33NX,Accenture
0,"Nov 4, 2019",More time attending daily status meeting with india teams from 530am to 8am over things that could just be read in a few lines over emails. Nore sure why the team i work with loves stand up meetings so much,8,doNeedful,nan,Eng,/post/Software-Engineers-@-Accenture-wBt6hLZB,Accenture
1,"Nov 4, 2019",You can work to change that..,0,ttahee,/company/Boeing/,SEND PRIVATE MESSAGE,/post/Software-Engineers-@-Accenture-wBt6hLZB,Accenture
2,"Nov 4, 2019",How are the salary levels in the bay area for Deloitte and Accenture for someone with 10 yoe?,1,SphF25,/company/HP/,IT,/post/Software-Engineers-@-Accenture-wBt6hLZB,Accenture
0,"Jan 30, 2019",Manager is the squeeze title.They always try to bring people in at manager. That are experience and not give them Se Manager. You’ll be spinning ur wheels trying to get Sr Manager.,2,others,/company/Activision-Blizzard/,SEND PRIVATE MESSAGE,/post/Accenture-Compensation-for-Experienced-Hire-EQC3ceZ8,Accenture
1,"May 3, 2019",ACN pays awfully compared to the rest of the industry. They seem to think their brand has so much value.,1,wrqR15,nan,SEND PRIVATE MESSAGE,/post/Accenture-Compensation-for-Experienced-Hire-EQC3ceZ8,Accenture
2,"Jan 30, 2019",Look it up on glass door. I think max TC would be near $200K for a manager.,0,A-b-c-d-e,/company/T-Mobile/,SEND PRIVATE MESSAGE,/post/Accenture-Compensation-for-Experienced-Hire-EQC3ceZ8,Accenture
3,"Jan 30, 2019",Thanks but I've found Glassdoor to be all over the place.,0,ujrott,/company/Citrix/,SEND PRIVATE MESSAGE,/post/Accenture-Compensation-for-Experienced-Hire-EQC3ceZ8,Accenture
4,"Feb 6, 2019",Came in as lvl 8 Azure engineer making 132k + allegedly a 20k end of year bonus. US citizen.,0,kittenroof,/company/Accenture/,SEND PRIVATE MESSAGE,/post/Accenture-Compensation-for-Experienced-Hire-EQC3ceZ8,Accenture
5,"Feb 6, 2019","Push for Senior Manager. Experienced hires are often brought in for lower than their value so the company can get more margin off of them. Trying to move from manager to senior manager, even with outside experience will take many, many years. (3-5 years) and each year you’ll be missing out on senior manager level raises. They will do their best to meet or exceed your salary from your old company which is nice. They’ll do a true up to their current ranges of salary for your salary after your first performance review.",0,dadreaded1,/company/Accenture/,SEND PRIVATE MESSAGE,/post/Accenture-Compensation-for-Experienced-Hire-EQC3ceZ8,Accenture
0,Mar 18,Can he get a new job in Accenture USA? Ask Accenture USA if they are able to.Having a visa is not enough to get the job in different location as each place has its own jobs/salary.,1,Ayanokōji,nan,SEND PRIVATE MESSAGE,/post/Accenture-India-to-accenture-seattle-L2-EAD-Vh7xLGxG,Accenture
1,Mar 20,Lol okay,0,piedPiper#,/company/Amazon/,SEND PRIVATE MESSAGE,/post/Accenture-India-to-accenture-seattle-L2-EAD-Vh7xLGxG,Accenture
2,Mar 19,I know who you are since you posted such questions on AMAZON BLIND channel as well.DM if you want to talk further about L1 visa,0,rajpalyadv,/company/Amazon/,SEND PRIVATE MESSAGE,/post/Accenture-India-to-accenture-seattle-L2-EAD-Vh7xLGxG,Accenture
0,"Jun 7, 2020",Dm me,0,pJwc45,/company/Accenture/,SEND PRIVATE MESSAGE,/post/Accenture-Referral-gcbmDSa6,Accenture
1,"Jun 4, 2020","Happy to help. Outside of very specific roles, hiring is currently in a freeze.",0,MjGo15,/company/Accenture/,SEND PRIVATE MESSAGE,/post/Accenture-Referral-gcbmDSa6,Accenture
2,"Jun 3, 2020",Lol why...?,0,cockydev,/company/StockX/,Eng,/post/Accenture-Referral-gcbmDSa6,Accenture
0,"Nov 12, 2020",Which role? YOE? Tc breakdown?,0,motivated!,/company/Microsoft/,SEND PRIVATE MESSAGE,/post/Accenture-L7-to-AWS-L6-ZgWtSx1C,Accenture
1,"Nov 12, 2020","That's a huge bump, congrats!",1,QKUJ58,/company/Certain-Affinity/,Product,/post/Accenture-L7-to-AWS-L6-ZgWtSx1C,Accenture
2,"Nov 12, 2020",Appreciate it! Thank you!,0,23cvs,/company/Accenture/,SEND PRIVATE MESSAGE,/post/Accenture-L7-to-AWS-L6-ZgWtSx1C,Accenture
3,"Nov 12, 2020",WLB is much better in AWS Sales related roles and retention is super highAll the stories that you hear on Blind - 90% of them are for SDE roles,3,eos$block,/company/Amazon/,Eng,/post/Accenture-L7-to-AWS-L6-ZgWtSx1C,Accenture
4,"Nov 12, 2020",Can confirm. I work in ProServe as an L6 and I love it. I started at the beginning of the year and was offered similar TC package. Congratulations on your offer and excited to have you on the team! :),1,el_nerdist,/company/Amazon/,SEND PRIVATE MESSAGE,/post/Accenture-L7-to-AWS-L6-ZgWtSx1C,Accenture
5,"Nov 12, 2020",Thank you!! Great to hear that :),1,23cvs,/company/Accenture/,SEND PRIVATE MESSAGE,/post/Accenture-L7-to-AWS-L6-ZgWtSx1C,Accenture
6,"Nov 20, 2020","OP, I’m interviewing for a biz dev role in AWS. Mind if I dm you to chat about the interview process?",0,level UP!,nan,Strategy,/post/Accenture-L7-to-AWS-L6-ZgWtSx1C,Accenture
7,"Nov 21, 2020",Yes feel free to DM,1,23cvs,/company/Accenture/,SEND PRIVATE MESSAGE,/post/Accenture-L7-to-AWS-L6-ZgWtSx1C,Accenture
0,"May 29, 2019",Why would you go from Oracle to Accenture???,1,Gachon,/company/Accenture/,Data,/post/Accenture-CMT-rUNKnJgt,Accenture
1,"May 18, 2019",Is there a reason you would go from sales at Oracle to Accenture? Don’t understand that transition.,0,GWOz11,/company/Micro-Focus/,Product,/post/Accenture-CMT-rUNKnJgt,Accenture
