,comment_date,comment_text,comment_like,comment_user,comment_firm,comment_position,comment_url,company
3,"Jun 24, 2019",Not even in an alternate reality,1,ST8izGr8,/company/Apple/,SEND PRIVATE MESSAGE,/post/Will-Accenture-beat-Apple-INC-share-prices-in-a-year-or-two-A3rSSOod,Accenture
4,"Jul 12, 2019",Accenture share prices are just $7.08 short of AAPL today.Any shift in thoughts?,0,automateit,/company/Cognizant/,SEND PRIVATE MESSAGE,/post/Will-Accenture-beat-Apple-INC-share-prices-in-a-year-or-two-A3rSSOod,Accenture
5,"Jul 12, 2019","Again, literally not how it works.The price is meaningless. It’s the float that counts.Amazon at $2k is not 10 times as valuable as AAPL at $200Cheers",0,DuQvV7y,nan,Other,/post/Will-Accenture-beat-Apple-INC-share-prices-in-a-year-or-two-A3rSSOod,Accenture
0,"Oct 27, 2020","I wasn't in Big 4, but consulting at a boutique. I work as a PM and enjoy the work. You actually get to build something other than PowerPoint decks. Imagine that...",7,d38sd,/company/Microsoft/,Product,/post/Folks-that-got-into-Faang-Microsoft-from-consulting-companies-like-Accenture-Deloitte-Capgemini-How-does-it-feel-qQeMOfwi,Accenture
1,"Oct 28, 2020","Haha, are you a gate keeper?",0,rbUI28,/company/Accenture/,SEND PRIVATE MESSAGE,/post/Folks-that-got-into-Faang-Microsoft-from-consulting-companies-like-Accenture-Deloitte-Capgemini-How-does-it-feel-qQeMOfwi,Accenture
2,"Oct 27, 2020",Feels great when you dont have to take the 5AM red eye to fly across 2 timezones week in week out,2,V.Y,/company/Deloitte/,Product,/post/Folks-that-got-into-Faang-Microsoft-from-consulting-companies-like-Accenture-Deloitte-Capgemini-How-does-it-feel-qQeMOfwi,Accenture
0,"Oct 4, 2019",Why do you want to go abroad then based on that one can answer,1,MrMyme,nan,SEND PRIVATE MESSAGE,/post/Is-it-a-good-idea-to-trade-my-Engineering-Manager-role-with-Associate-manager-to-work-in-Accenture-abroad-130cKq15,Accenture
1,"Oct 5, 2019",To relocate to Europe,0,SO99,nan,Eng,/post/Is-it-a-good-idea-to-trade-my-Engineering-Manager-role-with-Associate-manager-to-work-in-Accenture-abroad-130cKq15,Accenture
2,"Oct 5, 2019",Why,0,MrMyme,nan,SEND PRIVATE MESSAGE,/post/Is-it-a-good-idea-to-trade-my-Engineering-Manager-role-with-Associate-manager-to-work-in-Accenture-abroad-130cKq15,Accenture
3,"Oct 5, 2019","Having worked with people from the middle East and Europe while at Accenture here is my advice.Yes you are taking a downgrade in title but if your goal is to head to Accenture to learn how to Execute / deliver large projects then the trade off is well worth it.You are getting a downgrade in title for two reasons.  The EU has a huge backlog of highly skilled people who want to make manager.  This means that in some countries it will take a person 8 years to make mgr.The other reason is that a mgr in Accenture is expected to be excellent at 1) technology 2) project MGMT and 3) business / client development.  They should also be able to handle just about any sitaution.  One final point about expectations, you are expected to do this in the manner that Accenture delivers work.  Not the way you did it at your old company (this is what makes them good at delivering globally large projects).My guess is that you have the tech well covered. But you don't have the other two covered as well and you definitely don't know how Accenture delivers.One final comment, my best exit opportunities came while I was at Accenture as a mgr.",1,dcb4,/company/Google/,SEND PRIVATE MESSAGE,/post/Is-it-a-good-idea-to-trade-my-Engineering-Manager-role-with-Associate-manager-to-work-in-Accenture-abroad-130cKq15,Accenture
4,"Oct 4, 2019","Stay away from Accenture & other WITCH (Wipro, Infy, TCS, CTS, HCL) COMPANIES if you can!",0,Chetkahs,/company/Wells-Fargo/,SEND PRIVATE MESSAGE,/post/Is-it-a-good-idea-to-trade-my-Engineering-Manager-role-with-Associate-manager-to-work-in-Accenture-abroad-130cKq15,Accenture
5,"Oct 4, 2019",TC ?,0,tETj16,/company/Riverbed-Technology/,SEND PRIVATE MESSAGE,/post/Is-it-a-good-idea-to-trade-my-Engineering-Manager-role-with-Associate-manager-to-work-in-Accenture-abroad-130cKq15,Accenture
0,"Apr 25, 2019",This happens everyday in the IT consultant world.,10,URFired,/company/LinkedIn/,SEND PRIVATE MESSAGE,/post/Accenture-gets-sued-for-charging-32mil-and-not-being-able-to-deliver-a-web-site-for-Hertz-RknwZmWh,Accenture
1,"Apr 25, 2019",Well maybe they shouldn't hire shit like Accenture and Tata Consultancy,1,scoops34,/company/Amazon/,Eng,/post/Accenture-gets-sued-for-charging-32mil-and-not-being-able-to-deliver-a-web-site-for-Hertz-RknwZmWh,Accenture
0,"Jul 15, 2020",Resume review?YoE?Referrals?,0,repocalyse,/company/Roku/,SEND PRIVATE MESSAGE,/post/friendnon-cs-degreworkin-as-SEAccentureNo-moneyvalue-to-resumeStudying-from-geeks4geeksnot-getting-callsAdvice-n6ORQREM,Accenture
1,"Jul 16, 2020","Make post on blind ask nicely. Someone might offer to do it for free. You can also pay professional resume writers, but at your friend’s level I don’t think they need a professional writer.If getting rejected before interviews, a bad resume seems likely. Just have someone look it over to check for some glaring mistakes etc.",2,repocalyse,/company/Roku/,SEND PRIVATE MESSAGE,/post/friendnon-cs-degreworkin-as-SEAccentureNo-moneyvalue-to-resumeStudying-from-geeks4geeksnot-getting-callsAdvice-n6ORQREM,Accenture
2,"Jul 16, 2020",Thanks @repocalyse for this effort,1,DP😈,/company/PayPal/,SEND PRIVATE MESSAGE,/post/friendnon-cs-degreworkin-as-SEAccentureNo-moneyvalue-to-resumeStudying-from-geeks4geeksnot-getting-callsAdvice-n6ORQREM,Accenture
0,Feb 18,"Stupid post, why do you really need 1m/year? What are you hoping to prove? Stop measuring your d@ck daily",136,easters,/company/Netflix/,SEND PRIVATE MESSAGE,/post/At-what-age-did-your-TC-reach-1M-e3ZWvWVK,Accenture
1,Mar 22,So they can save expenses by dying earlier,0,defb,/company/Walmart/,SEND PRIVATE MESSAGE,/post/At-what-age-did-your-TC-reach-1M-e3ZWvWVK,Accenture
2,Mar 22,"Accenture, “there is always one like this” - you perfectly describe it. The problem is you, you are the one.My TC is very close to your target but that’s not the point, you are too ignorant to realize that",19,fibby19,/company/Netflix/,SEND PRIVATE MESSAGE,/post/At-what-age-did-your-TC-reach-1M-e3ZWvWVK,Accenture
3,Feb 18,Targeting 1M TC by 26. I’m 26 right now,68,UiPatch,/company/UiPath/,SEND PRIVATE MESSAGE,/post/At-what-age-did-your-TC-reach-1M-e3ZWvWVK,Accenture
4,Apr 16,What do you do at uipath!,0,FQJQ33,/company/UiPath/,SEND PRIVATE MESSAGE,/post/At-what-age-did-your-TC-reach-1M-e3ZWvWVK,Accenture
5,Apr 16,Whatever’s happened happened.,0,laid-back,/company/Amazon/,SEND PRIVATE MESSAGE,/post/At-what-age-did-your-TC-reach-1M-e3ZWvWVK,Accenture
6,Feb 18,Never. I will retire early before making 1M/yr,138,UfIO03,/company/Facebook/,SEND PRIVATE MESSAGE,/post/At-what-age-did-your-TC-reach-1M-e3ZWvWVK,Accenture
7,Apr 3,Yep. I am way below 1 million and still feel blessed,1,rd42boot,/company/Intuit/,SEND PRIVATE MESSAGE,/post/At-what-age-did-your-TC-reach-1M-e3ZWvWVK,Accenture
8,Feb 18,30,11,hurrrdurr,/company/Google/,SEND PRIVATE MESSAGE,/post/At-what-age-did-your-TC-reach-1M-e3ZWvWVK,Accenture
9,Mar 28,Would have been 40 but divorced and started over again.You hear that you folks wanting to get married.  Your wife will use current standard of living and get it.  You will be fkd.  But she keeps spending your money for quite a whileReset and back to it at 52,6,bikemonkey,/company/Intel/,SEND PRIVATE MESSAGE,/post/At-what-age-did-your-TC-reach-1M-e3ZWvWVK,Accenture
10,Mar 28,Username checks out,4, j,/company/Facebook/,SEND PRIVATE MESSAGE,/post/At-what-age-did-your-TC-reach-1M-e3ZWvWVK,Accenture
11,Feb 18,Most new grads make more than 1M (10 Lakhs) in India in INR though.,63,br🌑ke,/company/Oracle/,SEND PRIVATE MESSAGE,/post/At-what-age-did-your-TC-reach-1M-e3ZWvWVK,Accenture
12,Feb 18,Thats the kind of response this post deserves.,38,br🌑ke,/company/Oracle/,SEND PRIVATE MESSAGE,/post/At-what-age-did-your-TC-reach-1M-e3ZWvWVK,Accenture
13,Apr 16,Your username says it all,0,FQJQ33,/company/UiPath/,SEND PRIVATE MESSAGE,/post/At-what-age-did-your-TC-reach-1M-e3ZWvWVK,Accenture
0,"Oct 20, 2020","Is that what they told you, or what you speculate? In any case, nah it’s not discrimination. And no, I did not come from a well known school",44,mznxbvc ,/company/Amazon/,SEND PRIVATE MESSAGE,/post/Anyone-else-think-that-firms-recruiting-from-target-schools-is-a-form-of-serious-discrimination-vX1axiuJ,Accenture
1,"Dec 12, 2020",Should just allocate jobs by lottery,0,sjML65,/company/Airbnb/,SEND PRIVATE MESSAGE,/post/Anyone-else-think-that-firms-recruiting-from-target-schools-is-a-form-of-serious-discrimination-vX1axiuJ,Accenture
2,"Dec 28, 2020","If the Pru laughs at a company, it's a double joke.",0,Hank Hill,/company/Speedway/,Eng,/post/Anyone-else-think-that-firms-recruiting-from-target-schools-is-a-form-of-serious-discrimination-vX1axiuJ,Accenture
3,"Oct 20, 2020","It's not discrimination. Companies want to select the most qualified candidates that will join them. Companies also don't have unlimited recruiting resources, so they focus efforts on a list of target schools that they think will yield the best results for the recruiting effort.Does that mean they miss some highly qualified candidates from non-target schools? Absolutely, and that is their loss. But it's not discrimination.Every company will draw the line somewhere. E.g. how many community-college or state-school resumes does McKinsey look at? None--they're all going in the trash. It's just that not every company is as upfront about it as Accenture seems to be.",54,KoQt41,nan,SEND PRIVATE MESSAGE,/post/Anyone-else-think-that-firms-recruiting-from-target-schools-is-a-form-of-serious-discrimination-vX1axiuJ,Accenture
4,"Oct 21, 2020","Ha! I did get an offer but turned it down. Purely based on the premise that they hardcore claimed to be a meritocracy, but wouldn't let me interview with the Strategy group based on where I went to school, not my merits....",2,PhDick,/company/Maven-Wave/,SEND PRIVATE MESSAGE,/post/Anyone-else-think-that-firms-recruiting-from-target-schools-is-a-form-of-serious-discrimination-vX1axiuJ,Accenture
5,"Oct 21, 2020","It’s not bile. If you’re in a position to do it, you recruit from target schools because the chance of success is higher. Period.",2,hQlx67,/company/Scotiabank/,SEND PRIVATE MESSAGE,/post/Anyone-else-think-that-firms-recruiting-from-target-schools-is-a-form-of-serious-discrimination-vX1axiuJ,Accenture
6,"Oct 20, 2020","Believe me, as someone who went to a non-target school, it's super annoying. MBB/IB don't only care about what school you went to, they want the clients to be impressed by the background of schools when they go up and present themselves. That's why they're so picky.I originally wanted to do consulting, but saw how elitist some people were and decided to go with tech instead. I ended up really loving tech and now I can make more than most consultants, with less experience, while working less hours.Regardless though, the fact of the matter is smarter people tend to go to better schools, and recruiters have limited time. This is why it matters what school you go to - so it gives you that benefit of the doubt. (I wish I could tell my 18 year old self this when I didn't apply to a single Ivy League because I didn't want to go to a pretentious school and ended up going to the whitest and preppiest school out there...) However, for a recruiter to reject you based solely on your school is absolute BS.",39,tNLm70,/company/Mastercard/,SEND PRIVATE MESSAGE,/post/Anyone-else-think-that-firms-recruiting-from-target-schools-is-a-form-of-serious-discrimination-vX1axiuJ,Accenture
7,"Dec 7, 2020",Sour about your 18 yr old self,0, Your Mom,/company/Apple/,SEND PRIVATE MESSAGE,/post/Anyone-else-think-that-firms-recruiting-from-target-schools-is-a-form-of-serious-discrimination-vX1axiuJ,Accenture
8,"Oct 20, 2020",Strat Consulting is a BS industry that’s all about credentials. They can’t bill their clients thousands of dollars an hour if they can’t show “how many ivy grads are working on the problem “. This is why Tech is a much better industry. Doesn’t matter what your background is as long as you can build (somewhat) reliable products,27,21$aVaG3,/company/Bloomberg/,SEND PRIVATE MESSAGE,/post/Anyone-else-think-that-firms-recruiting-from-target-schools-is-a-form-of-serious-discrimination-vX1axiuJ,Accenture
9,"Oct 21, 2020","I'd agree, seems to be an outdated boomer industry to me.   I know one dude on consultant track and he's a terrible engineer, yet was top of the entire cohort in the degree.  Literally 80%-90% grades, unheard of.   He was a complete over-achiever, did 6 rounds of interviews just for an internship at McKinsey.It's really just a clique for private school kids who have no ideas or strategies of their own, but being part of the track in a consulting firm gives them the feeling of superiority and achievment they desperately desire.I earn more than him.",8,AJyf46,/company/Arm/,SEND PRIVATE MESSAGE,/post/Anyone-else-think-that-firms-recruiting-from-target-schools-is-a-form-of-serious-discrimination-vX1axiuJ,Accenture
10,"Dec 22, 2020","Former BCG here, too many of my colleagues were comfortable with being “non-technical” while their clients were getting eaten by tech companies. I see MBB in its current incarnation not surviving the next few decades.",1,sisyphus01,/company/Google/,SEND PRIVATE MESSAGE,/post/Anyone-else-think-that-firms-recruiting-from-target-schools-is-a-form-of-serious-discrimination-vX1axiuJ,Accenture
11,"Oct 20, 2020",The sense of entitlement on this post is off the chart.Perhaps you came off as such when you asked to be interviewed,30,D0k2,/company/Visa/,SEND PRIVATE MESSAGE,/post/Anyone-else-think-that-firms-recruiting-from-target-schools-is-a-form-of-serious-discrimination-vX1axiuJ,Accenture
12,"Oct 21, 2020",What's the point you're trying to make - that none of these groups are more entitled than OP?,0,echosmith,/company/Amazon/,SEND PRIVATE MESSAGE,/post/Anyone-else-think-that-firms-recruiting-from-target-schools-is-a-form-of-serious-discrimination-vX1axiuJ,Accenture
13,"Oct 21, 2020","So a bit more context here. We had a big batch of Accenture interns in the Accenture Consulting group. The Accenture Strategy group came to our group looking for interns to interview. I asked to be one of those candidates, but was denied. So it had nothing to do with my skills/background/approach. The decision to not allow me to interview was purely based on the school I went to.",2,PhDick,/company/Maven-Wave/,SEND PRIVATE MESSAGE,/post/Anyone-else-think-that-firms-recruiting-from-target-schools-is-a-form-of-serious-discrimination-vX1axiuJ,Accenture
0,3d,"I would say first get a call, Crack thr interview and then think/discuss about target TC based on the company and location.Use levels.fyi for salary range reference",68,wohoo/-,/company/PayPal/,SEND PRIVATE MESSAGE,/post/Salary-ranges-kiwOsJrr,Accenture
1,3d,Thank you souch for this website.,0,PANHEAD,/company/Palo-Alto-Networks/,SEND PRIVATE MESSAGE,/post/Salary-ranges-kiwOsJrr,Accenture
2,3d,"Can we Start saying:""TC and Location. Or GTFO"" instead of just TC? Location matters so much and some people aren't in silicon valley or NYC 🤣",11,UIArctech,/company/Samsung/,SEND PRIVATE MESSAGE,/post/Salary-ranges-kiwOsJrr,Accenture
3,2d,@sudo rofl,0,skilseeker,/company/Gap/,SEND PRIVATE MESSAGE,/post/Salary-ranges-kiwOsJrr,Accenture
4,5h,A/S/L?,0,jky,/company/United-Airlines/,SEND PRIVATE MESSAGE,/post/Salary-ranges-kiwOsJrr,Accenture
5,7d,i left after L9 tech consultant as well. i got package TC of 180k at my next company. current TC at apple is 310k,15,breakwall,/company/Tesla/,SEND PRIVATE MESSAGE,/post/Salary-ranges-kiwOsJrr,Accenture
6,3d,Nice. Which role are you at 🍎 and which location?,0,#includeme,/company/Accenture/,SEND PRIVATE MESSAGE,/post/Salary-ranges-kiwOsJrr,Accenture
7,3d,"epm, cupertino",0,breakwall,/company/Tesla/,SEND PRIVATE MESSAGE,/post/Salary-ranges-kiwOsJrr,Accenture
8,3d,Apply for Amazon l9 role,8,ShartMeNot,/company/Amazon/,SEND PRIVATE MESSAGE,/post/Salary-ranges-kiwOsJrr,Accenture
9,3d,woooosh,2,ShartMeNot,/company/Amazon/,SEND PRIVATE MESSAGE,/post/Salary-ranges-kiwOsJrr,Accenture
10,3d,There's a bit difference in Amazon L9 and Accenture L9... they don't align,1,Pseudyx,/company/Amazon/,SEND PRIVATE MESSAGE,/post/Salary-ranges-kiwOsJrr,Accenture
11,3d,What is MPA?,3,@&&,/company/Accenture/,SEND PRIVATE MESSAGE,/post/Salary-ranges-kiwOsJrr,Accenture
12,Yesterday,Savage dude,0,LbUn73,/company/Accenture/,SEND PRIVATE MESSAGE,/post/Salary-ranges-kiwOsJrr,Accenture
13,Yesterday,Masters in public administration though… its like an mba for government people,0,LbUn73,/company/Accenture/,SEND PRIVATE MESSAGE,/post/Salary-ranges-kiwOsJrr,Accenture
0,3d,"Beyond top of the band for L6, afaik, which means a solid offer",1,gilmaa,/company/Intel/,Eng,/post/Blind-community-please-help-me-evaluate-this-role-at-AWS-tVSzqJpN,Accenture
1,3d,"Thanks, I think for non SDE role that is the case as well",0,achilles49,/company/Accenture/,Project,/post/Blind-community-please-help-me-evaluate-this-role-at-AWS-tVSzqJpN,Accenture
2,3d,no.,0,eo4u🤪💪🏻,nan,SEND PRIVATE MESSAGE,/post/Blind-community-please-help-me-evaluate-this-role-at-AWS-tVSzqJpN,Accenture
3,3d,What are the cons for this offer?,0,achilles49,/company/Accenture/,Project,/post/Blind-community-please-help-me-evaluate-this-role-at-AWS-tVSzqJpN,Accenture
4,3d,"Your spirit, soul, life and moral character. Seriously, not an exaggeration. Do a search here on company culture.",0,eo4u🤪💪🏻,nan,SEND PRIVATE MESSAGE,/post/Blind-community-please-help-me-evaluate-this-role-at-AWS-tVSzqJpN,Accenture
5,3d,More like gayws,0,PENISSS,/company/Goldman-Sachs/,SEND PRIVATE MESSAGE,/post/Blind-community-please-help-me-evaluate-this-role-at-AWS-tVSzqJpN,Accenture
6,3d,But what do you think about the offer,0,achilles49,/company/Accenture/,Project,/post/Blind-community-please-help-me-evaluate-this-role-at-AWS-tVSzqJpN,Accenture
7,3d,"Idk anything about BDM pay, but if it were SWE it seems low for 16YOE in NYC.",0,PENISSS,/company/Goldman-Sachs/,SEND PRIVATE MESSAGE,/post/Blind-community-please-help-me-evaluate-this-role-at-AWS-tVSzqJpN,Accenture
8,3d,You could get more. Recently was offered 400TC 215 first year sign on with 155K base. Got for at least 50K more via stocks/sign on,0,meJg43,nan,SEND PRIVATE MESSAGE,/post/Blind-community-please-help-me-evaluate-this-role-at-AWS-tVSzqJpN,Accenture
9,3d,Did you take it?,0,achilles49,/company/Accenture/,Project,/post/Blind-community-please-help-me-evaluate-this-role-at-AWS-tVSzqJpN,Accenture
10,3d,What is a BDM? It is a good TC for an L6 in general .. mostly cash for first year . Jump ship after,0,wHKv16,/company/Amazon/,SEND PRIVATE MESSAGE,/post/Blind-community-please-help-me-evaluate-this-role-at-AWS-tVSzqJpN,Accenture
11,3d,Business development management,0,achilles49,/company/Accenture/,Project,/post/Blind-community-please-help-me-evaluate-this-role-at-AWS-tVSzqJpN,Accenture
0,"May 28, 2020",Easy transition for me - I went to professional services at AWS,8,dpwj30cs0a,/company/Amazon/,SEND PRIVATE MESSAGE,/post/How-did-you-switch-from-service-based-it-companies-like-tcs-infosys-to-product-based-companies-C7vuTeLV,Accenture
1,"May 28, 2020",Isn’t that still service based,2,blindmaxin,nan,SEND PRIVATE MESSAGE,/post/How-did-you-switch-from-service-based-it-companies-like-tcs-infosys-to-product-based-companies-C7vuTeLV,Accenture
2,"May 28, 2020",AWS is product based company.,1,dpwj30cs0a,/company/Amazon/,SEND PRIVATE MESSAGE,/post/How-did-you-switch-from-service-based-it-companies-like-tcs-infosys-to-product-based-companies-C7vuTeLV,Accenture
3,"May 28, 2020","Well I started from Infosys and it wasn't easy. Had to join a startup just to get away from the toxic infy culture and had good learning opportunities there, worked hard on my DS algo skills and was able to crack multiple product based companies. I'd suggest keep 6 months for dedicated preparation and aim for solving 3-5 DS, Algo questions everyday. Revise weekdays questions on weekends. Repeat. Maintain a good leetcode/code forces profile, it'll definitely help you for resume shortlisting. Good luck!",7,const>let,/company/Walmart/,Eng,/post/How-did-you-switch-from-service-based-it-companies-like-tcs-infosys-to-product-based-companies-C7vuTeLV,Accenture
4,"May 28, 2020",Thanks for sharing,0,gupta212,/company/Tieto/,SEND PRIVATE MESSAGE,/post/How-did-you-switch-from-service-based-it-companies-like-tcs-infosys-to-product-based-companies-C7vuTeLV,Accenture
5,"May 28, 2020","Gave a lot of practice interviews with companies I had no intention of joining, even ones that weren’t sponsoring. and finally didn’t need to prepare for Amazon’s interview when the recruiter reached out. The hardest part was to get an opportunity to interview at companies I was interested in. Been at amazon for 3.5 yrs now and heading to FB - just accepted their offer",5,hello :),/company/Amazon/,SEND PRIVATE MESSAGE,/post/How-did-you-switch-from-service-based-it-companies-like-tcs-infosys-to-product-based-companies-C7vuTeLV,Accenture
6,"May 28, 2020",This ^^.. great way to get over the interview nervousness and be ready for the companies that you intend to join.. all the best for your FB stint!,0,RozMryMrlo,/company/Apple/,Data,/post/How-did-you-switch-from-service-based-it-companies-like-tcs-infosys-to-product-based-companies-C7vuTeLV,Accenture
7,"May 28, 2020",Service role at product company?,0,FieldLover,/company/Boeing/,SEND PRIVATE MESSAGE,/post/How-did-you-switch-from-service-based-it-companies-like-tcs-infosys-to-product-based-companies-C7vuTeLV,Accenture
0,Feb 11,Seems low tbh for the location,5,dynasty002,/company/Facebook/,Eng,/post/Is-this-TC-good-iGs5oPB1,Accenture
1,Feb 11,Be aware that if you are not single it'll be difficult to live in the Bay with that TC.,4,.:,/company/Google/,Eng,/post/Is-this-TC-good-iGs5oPB1,Accenture
2,Feb 11,Really low,2,(o)n^n,/company/Oracle/,R&D,/post/Is-this-TC-good-iGs5oPB1,Accenture
3,Feb 12,Anything with pertaining to software development in SF under 200k is low. I don’t think you understand how expensive it is in SFBA,0,(o)n^n,/company/Oracle/,R&D,/post/Is-this-TC-good-iGs5oPB1,Accenture
4,Feb 17,Seems low for SF,0,PuAD32,/company/Accenture/,SEND PRIVATE MESSAGE,/post/Is-this-TC-good-iGs5oPB1,Accenture
5,Feb 11,"San Francisco is quite expensive, for that matter the whole bayarea is expensive. 110k will be stretching yourself a lot.Look up cost of living in Bay Area.",0,Ch3,/company/Ivalua/,Eng,/post/Is-this-TC-good-iGs5oPB1,Accenture
6,Feb 11,"https://www.apartmentguide.com/blog/how-much-rent-can-i-afford/Calculate in reverse based on the living situation you want (live alone, roomies) and factor in monthly expenses and loans, etc.",0,clumps,/company/Google/,Product,/post/Is-this-TC-good-iGs5oPB1,Accenture
7,Feb 11,"idk the market rate for your role (check levels.fyi?), so I’m not sure how close to max you are with this offer. You could make it work at 10k/month (~120k) but you’d be spread thin, especially after expenses and if you want to save anything up.",0,clumps,/company/Google/,Product,/post/Is-this-TC-good-iGs5oPB1,Accenture
8,Feb 11,What’s the benefits? I got the same offer from systek to keep my same job function at Boeing.,0,muskyElon,/company/Boeing/,SEND PRIVATE MESSAGE,/post/Is-this-TC-good-iGs5oPB1,Accenture
9,Feb 11,4% match on 401k n basics health benefits . That’s about it. No stock options,0,blindsees,/company/Boeing/,SEND PRIVATE MESSAGE,/post/Is-this-TC-good-iGs5oPB1,Accenture
0,3d,Lol the fact that they would even threaten this ... she just needs to leave and never come back,26,eGDp11,/company/Google/,SEND PRIVATE MESSAGE,/post/Infosys-HR-blackmailing-to-stay-back-in-the-company-h557Y6TR,Accenture
1,3d,I don’t know anything about employment in India but I hear employers really do care about those marks?,0,OnlyFans💩,/company/Microsoft/,SEND PRIVATE MESSAGE,/post/Infosys-HR-blackmailing-to-stay-back-in-the-company-h557Y6TR,Accenture
2,3d,"Sure but one cannot choose to live their life this way. If she agrees to this threat she will be under their thumb forever, and she already has a better alternative lined up",0,eGDp11,/company/Google/,SEND PRIVATE MESSAGE,/post/Infosys-HR-blackmailing-to-stay-back-in-the-company-h557Y6TR,Accenture
3,3d,Collect the evidence and tell them that you’re going to public shame the manager and HR on LinkedIn and proceed legally if they continue doing this. They will run for their lives.,6,WtVX07,/company/eBay/,SEND PRIVATE MESSAGE,/post/Infosys-HR-blackmailing-to-stay-back-in-the-company-h557Y6TR,Accenture
4,3d,"Unfortunately everything is verbal with no email conversations. As she didn’t receive/sign any papers for hike and with good ratings in the past, I don’t think they can really do anything but one can’t be certain. I feel bad for her with all the cheap tricks Infosys is playing right now after working for 10 years for the same company.",0,Ynfl34,/company/Perficient/,SEND PRIVATE MESSAGE,/post/Infosys-HR-blackmailing-to-stay-back-in-the-company-h557Y6TR,Accenture
5,3d,"Leave Infosys, the company deserves to die. Peanuts TC and they treat you like crap. I quite literally walked out on my job at Infosys. Had to return later to give back equipment and I verbally quit about 3 weeks later by answering HR calls and telling them. At will clauses rock, I feel sorry for the 3 month notice people in India have to give.",3,BRY47,/company/Infosys/,SEND PRIVATE MESSAGE,/post/Infosys-HR-blackmailing-to-stay-back-in-the-company-h557Y6TR,Accenture
