,comment_date,comment_text,comment_like,comment_user,comment_firm,comment_position,comment_url,company
1,"Apr 2, 2020",Thank you for the advice!!! Super helpful. Was able to negotiate to 220K TC with 15K sign-on :)(This is OP. I lost access to my other account so have to use my friend's),0,PagK86,/company/Google/,SEND PRIVATE MESSAGE,/post/Tiktok-NYC-Initial-Offer-UvPAAO54,Citi
2,"Mar 30, 2020",200K min for that yoe,3,DEcL21,/company/Amazon/,Data,/post/Tiktok-NYC-Initial-Offer-UvPAAO54,Citi
3,"Mar 30, 2020",In NYC too?,0,DFmz03,nan,SEND PRIVATE MESSAGE,/post/Tiktok-NYC-Initial-Offer-UvPAAO54,Citi
4,"Mar 30, 2020","Guys, on a serious note,  what's a reasonable TC for NYC? And I know it looks low.",1,DFmz03,nan,SEND PRIVATE MESSAGE,/post/Tiktok-NYC-Initial-Offer-UvPAAO54,Citi
5,"Mar 30, 2020",I see China undercuts onshore salaries too!,1,JimmyJams,/company/Macquarie/,SEND PRIVATE MESSAGE,/post/Tiktok-NYC-Initial-Offer-UvPAAO54,Citi
6,"Mar 30, 2020",No equity? Wtf?,1,several,/company/Google/,SEND PRIVATE MESSAGE,/post/Tiktok-NYC-Initial-Offer-UvPAAO54,Citi
0,"Nov 13, 2020",TC or get the fuck out,1,to the moon,/company/Snap/,SEND PRIVATE MESSAGE,/post/Hows-life-at-Citi-in-Dallas-TX-i1xr5DdF,Citi
1,"Nov 13, 2020",You’re on blind. TC or Gtfo,1,HkM,/company/Google/,SEND PRIVATE MESSAGE,/post/Hows-life-at-Citi-in-Dallas-TX-i1xr5DdF,Citi
2,"Nov 13, 2020",Actuallly just gtfo,1,HkM,/company/Google/,SEND PRIVATE MESSAGE,/post/Hows-life-at-Citi-in-Dallas-TX-i1xr5DdF,Citi
3,"Nov 13, 2020",Are you a leftard? Don’t come if you are!,3,HkM,/company/Google/,SEND PRIVATE MESSAGE,/post/Hows-life-at-Citi-in-Dallas-TX-i1xr5DdF,Citi
4,"Nov 13, 2020",What is the offer? Want all the advice but wouldn’t share information?,1,yUzB25,/company/Salesforce/,SEND PRIVATE MESSAGE,/post/Hows-life-at-Citi-in-Dallas-TX-i1xr5DdF,Citi
5,"Nov 13, 2020","Citi life is chill, in a team of 10 people usually 1-2 work, rest of the people just warm up the chairs. I managed to stay there for 4 years, just spending 1-2 hours on the work related things, spent rest of the time in reading technical articles online. I was always home by 5pm.Which group are you joining?",1,yUzB25,/company/Salesforce/,SEND PRIVATE MESSAGE,/post/Hows-life-at-Citi-in-Dallas-TX-i1xr5DdF,Citi
6,"Nov 14, 2020",Wealth Tech. Any idea about it?,0,HiByte,/company/BlackRock/,SEND PRIVATE MESSAGE,/post/Hows-life-at-Citi-in-Dallas-TX-i1xr5DdF,Citi
7,"Nov 13, 2020",Stay away from Banks,0,Evv,/company/Verizon/,SEND PRIVATE MESSAGE,/post/Hows-life-at-Citi-in-Dallas-TX-i1xr5DdF,Citi
8,"Nov 14, 2020",why?,0,HiByte,/company/BlackRock/,SEND PRIVATE MESSAGE,/post/Hows-life-at-Citi-in-Dallas-TX-i1xr5DdF,Citi
9,"Nov 15, 2020","Banks do mass layoffs after every few years. Current tien is difficult for banks And you will see some layoffs. Plus life at banks in general sucks . Too much hierarchies , extra work, tight deadlines, busy weekends and low pay ..",1,Evv,/company/Verizon/,SEND PRIVATE MESSAGE,/post/Hows-life-at-Citi-in-Dallas-TX-i1xr5DdF,Citi
10,"Nov 13, 2020",Usually <= 40 hours per week with release weekends once per month where you’ll spend a couple hours on Saturday and most of Sunday morning.,1,random20,/company/Citi/,SEND PRIVATE MESSAGE,/post/Hows-life-at-Citi-in-Dallas-TX-i1xr5DdF,Citi
0,Mar 13,DM Me,0,Copper🔸,/company/Citi/,SEND PRIVATE MESSAGE,/post/Looking-for-Citibank-referral-QFCv1WFx,Citi
1,Mar 17,Hi @cooper: I saw a role that is a good fit for me at CITI. Would you be able to provide a referral ??,0,Data Ninja,/company/eBay/,Data,/post/Looking-for-Citibank-referral-QFCv1WFx,Citi
2,Mar 17,DM for PayPal,0,Kisofdeath,/company/PayPal/,SEND PRIVATE MESSAGE,/post/Looking-for-Citibank-referral-QFCv1WFx,Citi
0,Mar 17,"I remember this interesting story about how to transport fish. People wanted to transport fish alive in order to keep them fresh before delivering to restaurants. But they had a hard time keeping them alive in a tank for a long period of time. It wasn’t the issue of oxygen or food. They just kept dying mysteriously from what they only could explain as boredom. You know how they solved it, OP? By throwing in a few octopi. By the end of a long journey through pacific ocean, some fish died as victims of those octopi. But majority survived. Because of a presence of an existential threat.Let me guess. Do you have children?You need an existential threat, OP.",201,fransisk11,/company/Amazon/,Eng,/post/I-want-to-quit-and-live-my-life-which-city-in-the-US-tWj5Fok5,Citi
1,Mar 22,Amaslaves at it again.,0,Locker,/company/Twilio/,SEND PRIVATE MESSAGE,/post/I-want-to-quit-and-live-my-life-which-city-in-the-US-tWj5Fok5,Citi
2,May 6,"And btw, this is true for the entire millennial gen, and esp the wokes.",0,Wags,/company/Apple/,SEND PRIVATE MESSAGE,/post/I-want-to-quit-and-live-my-life-which-city-in-the-US-tWj5Fok5,Citi
3,Mar 17,Oh poor you. 35 and a millionaire. You know people served in multiple wars doubleYour age and risked their lives and still have to work while on VA funds? I don’t feel bad for your “burnt out” ass. Grow up and quit whining you puss,19,vm1106,/company/Verizon-Media/,SEND PRIVATE MESSAGE,/post/I-want-to-quit-and-live-my-life-which-city-in-the-US-tWj5Fok5,Citi
4,Mar 18,How does cracking interview mean anything about being good or effective at your job. I think some people here on blind really get their expectations set straight,3,fch,/company/Amazon/,SEND PRIVATE MESSAGE,/post/I-want-to-quit-and-live-my-life-which-city-in-the-US-tWj5Fok5,Citi
5,Mar 20,"Who cares? World Wars are 75+ years ago. The world stopped getting in those. I respect the people who serve, but getting ahead in life isn't about joining the military anymore, so honestly why compare to them? OP did well. They can retire and live off of those funds if they want.",0,iFan4Apple,/company/Apple/,SEND PRIVATE MESSAGE,/post/I-want-to-quit-and-live-my-life-which-city-in-the-US-tWj5Fok5,Citi
6,Mar 16,Burnt out at Google? I thought everyone is retired there?,105,QXYQ46,/company/Facebook/,SEND PRIVATE MESSAGE,/post/I-want-to-quit-and-live-my-life-which-city-in-the-US-tWj5Fok5,Citi
7,Mar 17,Our stock is doing pretty good for a bunch of retirees,0,🍑☁️,/company/Google/,Eng,/post/I-want-to-quit-and-live-my-life-which-city-in-the-US-tWj5Fok5,Citi
8,Mar 17,"Even microsoft stock is doing good, and they retired 20 years ago 😅",5,uggo,/company/Facebook/,SEND PRIVATE MESSAGE,/post/I-want-to-quit-and-live-my-life-which-city-in-the-US-tWj5Fok5,Citi
9,Mar 16,Go to Thailand or other cheap + nature scenic countries. Get some gig job and enjoy life,75,FedPrinter,/company/BlackRock/,SEND PRIVATE MESSAGE,/post/I-want-to-quit-and-live-my-life-which-city-in-the-US-tWj5Fok5,Citi
10,Mar 17,Go turkey,3,snowpower,/company/ServiceNow/,SEND PRIVATE MESSAGE,/post/I-want-to-quit-and-live-my-life-which-city-in-the-US-tWj5Fok5,Citi
11,Mar 17,Or Vietnam,4,CvIA30,/company/EasyPost/,SEND PRIVATE MESSAGE,/post/I-want-to-quit-and-live-my-life-which-city-in-the-US-tWj5Fok5,Citi
12,Mar 17,Please don’t come to Texas,26,beansalad,nan,SEND PRIVATE MESSAGE,/post/I-want-to-quit-and-live-my-life-which-city-in-the-US-tWj5Fok5,Citi
13,Mar 17,"Amazon, get some truth, wrong  on AG.Gov is a rhino though, yes, needs to go",1,gcFy12,/company/Forcepoint/,SEND PRIVATE MESSAGE,/post/I-want-to-quit-and-live-my-life-which-city-in-the-US-tWj5Fok5,Citi
14,Mar 17,What's wrong with rhinos 🦏 are you speciest,2,qadwed,/company/SpaceX/,SEND PRIVATE MESSAGE,/post/I-want-to-quit-and-live-my-life-which-city-in-the-US-tWj5Fok5,Citi
0,Feb 23,Stripe. Lots of open roles in NYC.,4,WhCJ67,/company/Stripe/,SEND PRIVATE MESSAGE,/post/High-tc-nyc-employers-CaomgWrC,Citi
1,Feb 23,You made that shit move with RSU pricing though?,13,gamaken,/company/Volvo/,R&D,/post/High-tc-nyc-employers-CaomgWrC,Citi
2,Feb 23,"Don’t join stripe.With their 1 year RSU policy, you don’t have any stock upside over long term.If any company offers you a 4 year RSU with an annual tc ~-$50k less than Stripe, then still don’t choose stripe.You have no idea how much you lose over 4 years by not having any upside.",8,QikR38,/company/Uber/,SEND PRIVATE MESSAGE,/post/High-tc-nyc-employers-CaomgWrC,Citi
3,Feb 23,"Since Stripe is currently private, the RSU you get now would still be base on the private valuation which would be lower than eventual IPO valuation, so there's still upside?",0,ARKK,/company/Citadel/,SEND PRIVATE MESSAGE,/post/High-tc-nyc-employers-CaomgWrC,Citi
4,Feb 23,Rockstar Games,2,nbellic,nan,SEND PRIVATE MESSAGE,/post/High-tc-nyc-employers-CaomgWrC,Citi
5,Feb 23,whats the TC like? do y'all hire juniors?,1,hmmm_okay,/company/Facebook/,SEND PRIVATE MESSAGE,/post/High-tc-nyc-employers-CaomgWrC,Citi
6,Feb 23,"Dropbox, Brex, Doordash, Airtable, Coinbase",2,gsirb,/company/Dropbox/,Eng,/post/High-tc-nyc-employers-CaomgWrC,Citi
7,Feb 23,Unfortunately NYC isn’t place for tech. Most of trading firm/investment bank sees tech as cost center. Even if someone match your tc upwards mobility will be very restricted.,0,exit2020,/company/Morgan-Stanley/,SEND PRIVATE MESSAGE,/post/High-tc-nyc-employers-CaomgWrC,Citi
8,Feb 23,How can I flag a comment as fake news,8,AznSWE,/company/Bloomberg/,SEND PRIVATE MESSAGE,/post/High-tc-nyc-employers-CaomgWrC,Citi
9,Feb 24,BB peeps post your tc and last 3 years growth,0,exit2020,/company/Morgan-Stanley/,SEND PRIVATE MESSAGE,/post/High-tc-nyc-employers-CaomgWrC,Citi
0,"May 16, 2019","Bloomberg, don’t think it has any money problems.",4,Eukw16,/company/Bloomberg/,Eng,/post/NYC-TECH-SCENE-r3ggFvQy,Citi
1,"May 16, 2019",No layoffs as far as engineering dept is concerned.,1,bloombon,/company/Bloomberg/,SEND PRIVATE MESSAGE,/post/NYC-TECH-SCENE-r3ggFvQy,Citi
2,"May 24, 2019",Bloomberg gives negative pay increases to some employees with bad ratings so I hear......,0,venomous,/company/Comcast/,Product,/post/NYC-TECH-SCENE-r3ggFvQy,Citi
3,"May 16, 2019",Bloomberg never lay offs engineers otherwise who will work for them lol.,4,agilecoach,/company/Bloomberg/,SEND PRIVATE MESSAGE,/post/NYC-TECH-SCENE-r3ggFvQy,Citi
4,"Sep 10, 2019",Why so negative? Engineer at bbg really suck?,0,hutg64jr,/company/Google/,SEND PRIVATE MESSAGE,/post/NYC-TECH-SCENE-r3ggFvQy,Citi
5,"May 16, 2019","Check out this post! ""NYC Tech Scene (Tech Careers)""https://us.teamblind.com/s/ncS70PzB",1,ps.ily,/company/Amazon/,SEND PRIVATE MESSAGE,/post/NYC-TECH-SCENE-r3ggFvQy,Citi
6,"May 16, 2019",Lol OP is jobless,0,bloombon,/company/Bloomberg/,SEND PRIVATE MESSAGE,/post/NYC-TECH-SCENE-r3ggFvQy,Citi
7,"May 16, 2019",Yep no lay offs. Infact Bloomberg is hiring. And they continue to increase revenue every year,0,cap777,/company/Bloomberg/,SEND PRIVATE MESSAGE,/post/NYC-TECH-SCENE-r3ggFvQy,Citi
0,"Aug 19, 2020",Sorry to say this .. but I dont think city is the problem here !,116,wwjd2me,/company/eBay/,SEND PRIVATE MESSAGE,/post/Best-wfh-city-for-tinder-prospects-eoAHYXYf,Citi
1,Jan 22,5'9 is short. See if you can negotiate higher,15,JimmyJams,/company/Macquarie/,SEND PRIVATE MESSAGE,/post/Best-wfh-city-for-tinder-prospects-eoAHYXYf,Citi
2,Feb 7,🤣🤣,0,WallStBets,nan,SEND PRIVATE MESSAGE,/post/Best-wfh-city-for-tinder-prospects-eoAHYXYf,Citi
3,"Aug 19, 2020",You couldn’t find a girlfriend on Hinge? Bumble? ... lol dude 🤡,7,BlackGirl,/company/Cisco/,SEND PRIVATE MESSAGE,/post/Best-wfh-city-for-tinder-prospects-eoAHYXYf,Citi
4,"Aug 21, 2020","Pick a very specific area, set max distance low (~1 or 2 miles) as a dealbreaker, spam x until you're interested",0,leetoryeet,/company/Google/,SEND PRIVATE MESSAGE,/post/Best-wfh-city-for-tinder-prospects-eoAHYXYf,Citi
5,"Dec 6, 2020","@JefsWeiner I noticed that Hinge’s algorithm puts you in a bucket w/ people of similar attractiveness to you, so...",0,klhX17,/company/Bloomberg/,SEND PRIVATE MESSAGE,/post/Best-wfh-city-for-tinder-prospects-eoAHYXYf,Citi
6,"Aug 19, 2020","Quarantine is a great reason to focus on yourself first, the dates will follow. Think about the girls that you would want to go on a date with, what would they likely be looking for in a guy? Don't let other people determine your self worth, tinder is temporary TC is forever",17,leetoryeet,/company/Google/,SEND PRIVATE MESSAGE,/post/Best-wfh-city-for-tinder-prospects-eoAHYXYf,Citi
7,"Aug 20, 2020","TC is forever? Um.. that statement is way false. TC is only around if you have a job or dont die. Dont fool yourselfAnd there's no proof/evidence that if you focus on yourself the dates will follow. Sounds like the ""buy more/save more"" nonsense.Tinder is all about looks, then money. Period",1,dumbN-woke,/company/Microsoft/,SEND PRIVATE MESSAGE,/post/Best-wfh-city-for-tinder-prospects-eoAHYXYf,Citi
8,"Aug 20, 2020",___ is temporary ___ is forever is a meme,3,leetoryeet,/company/Google/,SEND PRIVATE MESSAGE,/post/Best-wfh-city-for-tinder-prospects-eoAHYXYf,Citi
9,"Aug 19, 2020","Oh I see you mentioned Tinder. Obviously you’re searching for hoes. Yeah SF isn’t where you will find those. All the girls you meet here are too busy dating more serious men. You can try LA though. It’s a good start. Afterwards, move to Miami. More tinder girls there.",11,BlackGirl,/company/Cisco/,SEND PRIVATE MESSAGE,/post/Best-wfh-city-for-tinder-prospects-eoAHYXYf,Citi
10,Jan 14,Plenty hoes in the bay. Especially around summer break,1,interlude,nan,SEND PRIVATE MESSAGE,/post/Best-wfh-city-for-tinder-prospects-eoAHYXYf,Citi
11,Jan 14,Intern season..,2,interlude,nan,SEND PRIVATE MESSAGE,/post/Best-wfh-city-for-tinder-prospects-eoAHYXYf,Citi
12,"Aug 26, 2020",In SF you're batting on the wrong team OP.  Go on grindr and you'll get 10 dates immediately.,11,Keycaps,/company/IBM/,SEND PRIVATE MESSAGE,/post/Best-wfh-city-for-tinder-prospects-eoAHYXYf,Citi
0,"Oct 29, 2019","tldr gigantic waste of my time. Spent 20 hours working on a take home only to get rejected because it turned out I wasn’t an expert product manager plus visual designer plus software engineer.I am the latter, for the record, but I’m not all of those things. Also, search elsewhere on here: their offers are not competitive.",5,c9a4b,/company/Intuit/,SEND PRIVATE MESSAGE,/post/City-Storage-Systems-interview-vyb7xaE6,Citi
1,"Nov 13, 2019",Can you guys share what was the take home that took that long?,0,QTR,/company/WeWork/,SEND PRIVATE MESSAGE,/post/City-Storage-Systems-interview-vyb7xaE6,Citi
2,"Nov 13, 2019","Something about calculating orders and temperatures. It wasn't necessarily that it seemed extremely long, I just have never had good experiences with take homes.",0,foony,/company/Google/,SEND PRIVATE MESSAGE,/post/City-Storage-Systems-interview-vyb7xaE6,Citi
3,"Oct 29, 2019","Similar to Intuit, I spent a long time on the take home, did a bang up job if I do say so myself, and was then ghosted by the recruiter. Assigning a massive multithreaded take home is not good form IMO.",4,n0p705h,/company/Cornerstone/,SEND PRIVATE MESSAGE,/post/City-Storage-Systems-interview-vyb7xaE6,Citi
4,"Oct 31, 2019",They asked me for onsite interview which includes some 3hr assignment on the system. Do y’all know what kind of assignments do they give ?,0,joker->,/company/Microsoft/,SEND PRIVATE MESSAGE,/post/City-Storage-Systems-interview-vyb7xaE6,Citi
5,"Jan 4, 2020",Also sent you an pm Cornerstone,1,QaPu04,/company/Airbnb/,SEND PRIVATE MESSAGE,/post/City-Storage-Systems-interview-vyb7xaE6,Citi
6,"Jan 26, 2020","@Cornerstone, was it In Java?",0,vimboy,/company/Amazon/,SEND PRIVATE MESSAGE,/post/City-Storage-Systems-interview-vyb7xaE6,Citi
7,"Jun 10, 2020",Anyone got an offer lately? How’s the comp look like?,3,1234325,nan,SEND PRIVATE MESSAGE,/post/City-Storage-Systems-interview-vyb7xaE6,Citi
8,"Apr 3, 2020",The problem takes a few hours.  I went onsite,1,qqhuh,/company/Airbnb/,SEND PRIVATE MESSAGE,/post/City-Storage-Systems-interview-vyb7xaE6,Citi
9,"Apr 5, 2020",You went onsite during a pandemic?,0,OMvd16,nan,SEND PRIVATE MESSAGE,/post/City-Storage-Systems-interview-vyb7xaE6,Citi
10,"Apr 6, 2020",No last year,0,qqhuh,/company/Airbnb/,SEND PRIVATE MESSAGE,/post/City-Storage-Systems-interview-vyb7xaE6,Citi
0,"Jul 28, 2020",Tell them u are open for relocation- its gonna be work from home till Summer 2021,3,usvscug,nan,SEND PRIVATE MESSAGE,/post/Google-NYC-Team-Matching-vWYAoSw2,Citi
1,"Jul 28, 2020",Well since Google is WFH till next July. Couldn’t you just choose any cities that has openings and try to transfer after a year?,2,vbaiyf,/company/Indeed/,SEND PRIVATE MESSAGE,/post/Google-NYC-Team-Matching-vWYAoSw2,Citi
2,"Jul 28, 2020","My concern is that if I'm not able to transfer than I may loose the job. I have suggested to the recruiter that I am open to working remotely for a team in a different city, but that wasn't an option.My understanding is that a different city is only an option if I'm willing to relocate. And I won't be able to make that commitment as my circumstances are unlikely to change.",0,ATOo73,nan,Eng,/post/Google-NYC-Team-Matching-vWYAoSw2,Citi
3,"Jul 28, 2020",If you’re open to SWE-SRE roles you can see if your recruiter can find those for you? Might be hard since iirc you would’ve needed to show strong signals in your system design interview but could be worth a shot,1,yogoogle,/company/Google/,SEND PRIVATE MESSAGE,/post/Google-NYC-Team-Matching-vWYAoSw2,Citi
4,"Jul 29, 2020","That's worth a shot. I'll float the idea by the recruiter. The SRE book (https://landing.google.com/sre/sre-book/toc) piqued my interested in the role, but it seemed like it could be a stretch of my experience. I also don't think I did particularly well in the system design interview. Even though I naively thought I have plenty of experience designing/building systems. :)",0,ATOo73,nan,Eng,/post/Google-NYC-Team-Matching-vWYAoSw2,Citi
5,"Aug 3, 2020","Same boat mate , completed my onsite waiting since March for team match . Recruiter told me not to get my hopes high before October but now after google recent announcement I don’t think anything will happen before Mar-May 2021.That sucks but nothing to do about it .I tried applying to other roles as well but the recruiter told me that there is a complete freeze on hiring (last I spoke to him was in April)",0,eWvQ30,nan,SEND PRIVATE MESSAGE,/post/Google-NYC-Team-Matching-vWYAoSw2,Citi
6,"Aug 3, 2020","Sorry to hear that. It is a difficult position to be in. I am planning to have another conversation with my recruiter soon. If hiring is still slow with no sign of recovery, then I'm thinking to start interviewing again.Are you interviewing with other companies? My fear is that my interviewing shape will further decline if I keep on waiting. And I keep seeing a fair amount of negative sentiment about Google in general here. Of course, I'd prefer to make my own opinion. But I think I do have to factor that into the decision making.",0,ATOo73,nan,Eng,/post/Google-NYC-Team-Matching-vWYAoSw2,Citi
7,"Aug 3, 2020",Most definitely keep on interviewing.Shitty times .,0,eWvQ30,nan,SEND PRIVATE MESSAGE,/post/Google-NYC-Team-Matching-vWYAoSw2,Citi
8,"Dec 29, 2020","OP, what's latest with your situation",0,vPNL31,/company/JPMorgan/,SEND PRIVATE MESSAGE,/post/Google-NYC-Team-Matching-vWYAoSw2,Citi
0,"Jul 1, 2020",Take what you think it should be and divide by 2,4,zzzff,/company/Spotify/,SEND PRIVATE MESSAGE,/post/Spotify-NYC-salary-ts34x6B4,Citi
1,"Jul 1, 2020",Did you get an offer?,0,iheartpups,/company/Spotify/,Mktg,/post/Spotify-NYC-salary-ts34x6B4,Citi
2,"Jul 1, 2020",Probably 80k,0,tkmp43,/company/Spotify/,SEND PRIVATE MESSAGE,/post/Spotify-NYC-salary-ts34x6B4,Citi
0,"Mar 17, 2020",Wuhan,75,V.Y,/company/Deloitte/,Product,/post/Best-city-for-quarantine-M412SoK5,Citi
1,"Apr 5, 2020",Definitely safer than the US in general. At least people are wearing masks!,0,[COVID-19],nan,SEND PRIVATE MESSAGE,/post/Best-city-for-quarantine-M412SoK5,Citi
2,"Apr 12, 2020",Capital One is probably a CPC sympathizer.,0,tc130yoe5,/company/Northrop-Grumman/,Eng,/post/Best-city-for-quarantine-M412SoK5,Citi
3,"Mar 17, 2020","Your home.Look, you guys really shouldn’t worry too much on supply in US... especially in the Bay Area.",13,pwr2hw2sw,/company/Qualcomm/,SEND PRIVATE MESSAGE,/post/Best-city-for-quarantine-M412SoK5,Citi
4,"Mar 20, 2020",I knew the time travelers would reveal themselves eventually! Thanks for the heads up,22,yrYc64,/company/Citadel/,Eng,/post/Best-city-for-quarantine-M412SoK5,Citi
5,"Mar 18, 2020","Traveling right now presents a risk to the greater public health, especially given how many cases appear to be asymptomatic. Would recommend abiding by the shelter in place policy",28,ag56.3d5s,/company/Barclays-Investment-Bank/,SEND PRIVATE MESSAGE,/post/Best-city-for-quarantine-M412SoK5,Citi
6,"Mar 18, 2020","I am actually planning to go to Hawaii. It is a wonderful time to take advantage of cheap flights, not gonna lie.",1,mambamam,/company/EY/,SEND PRIVATE MESSAGE,/post/Best-city-for-quarantine-M412SoK5,Citi
7,"Mar 20, 2020",But you will be sick when you reach,1,wvWE27,/company/PayPal/,SEND PRIVATE MESSAGE,/post/Best-city-for-quarantine-M412SoK5,Citi
8,"Mar 20, 2020",Do not go to Hawaii. This is how the virus spreads. Stick your ass to where you are.,24,R174453,/company/PayPal/,SEND PRIVATE MESSAGE,/post/Best-city-for-quarantine-M412SoK5,Citi
9,"Mar 18, 2020",Hawaii for sure,0,bain1,/company/Bain&Company/,SEND PRIVATE MESSAGE,/post/Best-city-for-quarantine-M412SoK5,Citi
10,"Mar 20, 2020",Do not go to Hawaii. This is how the virus spreads. Stick your ass to where you are.,18,R174453,/company/PayPal/,SEND PRIVATE MESSAGE,/post/Best-city-for-quarantine-M412SoK5,Citi
11,"Mar 20, 2020",R it's a little late for that,0,Monrovia,/company/Esurance/,SEND PRIVATE MESSAGE,/post/Best-city-for-quarantine-M412SoK5,Citi
0,Feb 21,"For goodness sakes 90,000 or 900,000. Your welcome.",1,xyzxxxyxy,/company/Salesforce/,SEND PRIVATE MESSAGE,/post/90000-in-New-York-City-on5ru3bY,Citi
1,Feb 21,*you’re — you’re welcome.,8,neuralnets,/company/Lyft/,SEND PRIVATE MESSAGE,/post/90000-in-New-York-City-on5ru3bY,Citi
2,Feb 21,Found the Reddit user,0,not_max,/company/Affirm/,SEND PRIVATE MESSAGE,/post/90000-in-New-York-City-on5ru3bY,Citi
3,Feb 21,Enough to live ok but it will be nearly impossible to save for anything like a house,9,cool-bean,/company/Pandora/,SEND PRIVATE MESSAGE,/post/90000-in-New-York-City-on5ru3bY,Citi
4,Feb 21,Take into account most of blind users are delusional techies who think if you aren’t saving 100k+ a year you’re hopeless.  Find myself guilty of it sometimes too ngl,7,mjasw1,/company/Postmates/,SEND PRIVATE MESSAGE,/post/90000-in-New-York-City-on5ru3bY,Citi
5,Feb 21,"Remember NYC also taxes income. Just calculated take home pay (no 401k, etc. Deductions). It's $62,463 per year or $5205 per month. Rents are crazy high in NYC. Factor in transportation costs, food, electricity, water, etc. At best you might be left with 1000 to 1500 dollars a month if you scrimp and save. Now, the question is - do you think it's worth it?",6,Acbxzy,nan,SEND PRIVATE MESSAGE,/post/90000-in-New-York-City-on5ru3bY,Citi
6,Feb 22,"NYC taxes income on top of the state tax 😭 ridiculous, so glad I don't live there anymore",0,💩poop💩,/company/Goldman-Sachs/,SEND PRIVATE MESSAGE,/post/90000-in-New-York-City-on5ru3bY,Citi
7,Feb 22,"> At best you might be left with 1000 to 1500 dollars a month if you scrimp and save.Wut, where is the other 4k going? You can get a 2BR for $2k in Manhattan right now..Don't listen OP, I spend <$60k per year (after tax money) in NYC, living alone, no scrimping.",0,UYze18,/company/Yext/,SEND PRIVATE MESSAGE,/post/90000-in-New-York-City-on5ru3bY,Citi
8,Feb 21,Hell no,4,too_ligma,/company/Two-Sigma/,SEND PRIVATE MESSAGE,/post/90000-in-New-York-City-on5ru3bY,Citi
0,"Apr 11, 2018",You left Lyft for FB? Why?,3,Lleoiww,/company/Facebook/,SEND PRIVATE MESSAGE,/post/Facebook-NYC-Office-aND6sZGO,Citi
1,"Apr 11, 2018","That's ironic, the Lyft NYC office was largely bootstrapped by poaching from FBNY.",4,gJJA84,/company/Facebook/,Eng,/post/Facebook-NYC-Office-aND6sZGO,Citi
2,"Apr 11, 2018",Yes I was gonna say. Ex FB presence at Lyft NYC and a chance for you to shape that office. I’d jump at that opportunity imo.,5,Lleoiww,/company/Facebook/,SEND PRIVATE MESSAGE,/post/Facebook-NYC-Office-aND6sZGO,Citi
3,"Apr 11, 2018",Just been there once. Really nice location beside East Village. Much more nightlife than MPK.,1,JRiQ73,/company/Facebook/,Eng,/post/Facebook-NYC-Office-aND6sZGO,Citi
4,"Apr 13, 2018",Nightlife at MPK = grinding in office.Nightlife at NYC = partying,4,ti83bx,/company/Facebook/,SEND PRIVATE MESSAGE,/post/Facebook-NYC-Office-aND6sZGO,Citi
5,"May 5, 2018",Is the comp at nyc different from sf?,0,YSwn87,/company/AQR/,Eng,/post/Facebook-NYC-Office-aND6sZGO,Citi
6,"Apr 11, 2018","NYC is pretty great, I think FB  Seattle is beating us now though. More infra roles and The Dexter office is awesome.",0,gJJA84,/company/Facebook/,Eng,/post/Facebook-NYC-Office-aND6sZGO,Citi
7,"Apr 11, 2018","Agree with the previous poster. It's a good office, only real downside is that there are fewer teams to choose from and Facebook is very MPK-centric.Fortunately there seem to be more teams to choose from lately. But the MPK-centrism... that's still an issue.",0,cBFV47,/company/Facebook/,SEND PRIVATE MESSAGE,/post/Facebook-NYC-Office-aND6sZGO,Citi
8,"Apr 11, 2018","It's mostly just little things. For example, regular Q&A's with Mark are usually held at 7 PM Eastern time.",0,cBFV47,/company/Facebook/,SEND PRIVATE MESSAGE,/post/Facebook-NYC-Office-aND6sZGO,Citi
9,"Apr 11, 2018","It's getting better though, and much better than Google's MV-centrism. At least from what ex-Googlers have told me.",0,gJJA84,/company/Facebook/,Eng,/post/Facebook-NYC-Office-aND6sZGO,Citi
