,comment_date,comment_text,comment_like,comment_user,comment_firm,comment_position,comment_url,company
0,"Jun 10, 2018","Most of them are garbage and full of people looking for jobs out of boot camps. If you belong to minority groups, I’ve heard some of the women, Asian, Latino, etc. developer and product oriented groups are pretty good.NY Tech Meetup - general talks from other tech companies in the NYC area with a nice mixer at the endHackerNest - people at startups looking for funding and engineersDesigners + Geeks - intersection between design and tech",2,jPwrH2,/company/Squarespace/,Eng,/post/NYC-Tech-Networking-7Nqx6Uzr,Citi
1,"Jun 12, 2018","Is there ANYTHING good in terms of meetups in the city or LI? Was thinking about HackerNest as a pure ""hey let's make friends in the NY dev community"" thing but I'm not gonna show up just to be solicited by BLOKCHAINE startup loons. NYTM's next meetup is about political lgbt stuff I don't give a shit about.Not directly related to my question, but the last NYC .NET Devs was cold: show up, listen, leave. If this one is more of the same I'm just gonna stop using meetup.com and stop trying to interact with dev communities.",1,scorch1262,/company/Clever-Devices/,Eng,/post/NYC-Tech-Networking-7Nqx6Uzr,Citi
2,"Jun 4, 2018","Firneo (more geared towards tech BD folks) but PMs, DataSci, and Marketing growing ",1,YNlm64,/company/Quora/,SEND PRIVATE MESSAGE,/post/NYC-Tech-Networking-7Nqx6Uzr,Citi
3,"Jun 4, 2018",Awesome. Is it free to join?,0,YoloJenkin,/company/Yelp/,Other,/post/NYC-Tech-Networking-7Nqx6Uzr,Citi
4,"Sep 13, 2019",Can we get a name for referral,0,bJmS38,nan,SEND PRIVATE MESSAGE,/post/NYC-Tech-Networking-7Nqx6Uzr,Citi
5,"Sep 12, 2019",Kx has the best meetups. Friendly Irish people everywhere,0,Jams,/company/Oz-Management/,Eng,/post/NYC-Tech-Networking-7Nqx6Uzr,Citi
6,"Sep 12, 2019",Meetups are for the knowledge and the food. Try kaggle nyc if youre into data science,0,bJmS38,nan,SEND PRIVATE MESSAGE,/post/NYC-Tech-Networking-7Nqx6Uzr,Citi
0,"Apr 8, 2020",Didn’t know we had Sr. Associates at JPMC.,1,FJUq12,/company/JPMorgan/,SEND PRIVATE MESSAGE,/post/Citigroup-SVP-Salary-NYC-oeWTpz6K,Citi
1,"Apr 9, 2020",You really trying to rag on someone for calling themselves a Sr. Associate when JP hands out VP titles like candy on Halloween?,6,oneml,/company/Merrill-Lynch/,Finance,/post/Citigroup-SVP-Salary-NYC-oeWTpz6K,Citi
2,"May 6, 2020","If you’re in management and you’ve never heard of a 602 then you may consider improving your knowledge of your company’s hiring and pay structure. But then again, you wouldn’t be the first manager that doesn’t know what they’re doing at JPM.",0,Shabi,/company/JPMorgan/,SEND PRIVATE MESSAGE,/post/Citigroup-SVP-Salary-NYC-oeWTpz6K,Citi
3,"Apr 8, 2020","Citi SVP is $300K+ in model risk, I highly doubt you can get the offer as a sr associate from JPM",5,YmrR72,/company/Freddie-Mac/,SEND PRIVATE MESSAGE,/post/Citigroup-SVP-Salary-NYC-oeWTpz6K,Citi
4,Jan 20,Top SVP salary is 250k at Citi,0,bBfF72,/company/Citi/,SEND PRIVATE MESSAGE,/post/Citigroup-SVP-Salary-NYC-oeWTpz6K,Citi
5,Jan 21,Yes the highest tc SVP can get is 250k.,0,rey3,/company/Citi/,Product,/post/Citigroup-SVP-Salary-NYC-oeWTpz6K,Citi
6,"Apr 7, 2020",$175K-$200K,14,OutofMem,/company/Citi/,Product,/post/Citigroup-SVP-Salary-NYC-oeWTpz6K,Citi
7,"Apr 16, 2020",Base but the bonus fluctuates a lot,0,OutofMem,/company/Citi/,Product,/post/Citigroup-SVP-Salary-NYC-oeWTpz6K,Citi
8,"Apr 16, 2020","Yeah, a friend of mine works in Citi as avp dev who got exceed ratings this year, but only got 7.5k cash bonus.",0,linkk,/company/Amazon/,Eng,/post/Citigroup-SVP-Salary-NYC-oeWTpz6K,Citi
9,"Apr 8, 2020",Jeez why is bank comp so low?,8,Aloominium,/company/Apple/,SEND PRIVATE MESSAGE,/post/Citigroup-SVP-Salary-NYC-oeWTpz6K,Citi
10,"Apr 27, 2020",SAP is filled with these “Global Director/SVP” folks who either:1. Have no direct reports2. Are middle managers,0,TMDs27,/company/SAP/,SEND PRIVATE MESSAGE,/post/Citigroup-SVP-Salary-NYC-oeWTpz6K,Citi
11,"Apr 28, 2020",Titles have no meaning unless you are in C-suite,0,OutofMem,/company/Citi/,Product,/post/Citigroup-SVP-Salary-NYC-oeWTpz6K,Citi
12,"Apr 8, 2020",SVP zone 1 (nyc and sf) max 200k Bonus max 20%No way 300k Next level is director or c15,8,JzoY02,/company/Bank-of-the-West/,Other,/post/Citigroup-SVP-Salary-NYC-oeWTpz6K,Citi
13,"Apr 8, 2020","Interesting - was at Citi in nyc in the early 10s, VP at C14.",0,MasterFlap,/company/U.S.Bank/,SEND PRIVATE MESSAGE,/post/Citigroup-SVP-Salary-NYC-oeWTpz6K,Citi
14,"Apr 10, 2020","So promotions to Director and MD start with the higher C grade and salary for a year and then the officer title a year later after collegial review. So you could see an SVP as a C15 or a Director that is C16 who has just started the multi-year process.The only scenario where below SVP that that shift makes sense might be for like markets if you had to pay a higher than normal salary band but wanted the lower officer grade for like spending controls or something, but that seems more like an exception than the norm.",0,noisyedge,/company/Citi/,Data,/post/Citigroup-SVP-Salary-NYC-oeWTpz6K,Citi
0,Jan 10,Dm me . Lets chat. Might be able to help,2,techie.e,/company/Microsoft/,SEND PRIVATE MESSAGE,/post/NYC-SWE-roles-5tJkAOmc,Citi
1,Jan 11,Because I work in Microsoft does not mean I can help someone for a role in Microsoft only 🙏,3,techie.e,/company/Microsoft/,SEND PRIVATE MESSAGE,/post/NYC-SWE-roles-5tJkAOmc,Citi
2,Jan 16,"Can I also get your help, desperate finding a job in NYC",0,GhEv15,/company/Collins-Aerospace/,SEND PRIVATE MESSAGE,/post/NYC-SWE-roles-5tJkAOmc,Citi
3,Jan 11,"I can help with the LinkedIn referral. Please email me with this info: up to 3 desired job postings, your resume, your LinkedIn profile and a third-person intro of yourself.My email: linkedinreferrals@gmail.com(Other folks are also welcome if interested)",1,Jbnt46,/company/LinkedIn/,SEND PRIVATE MESSAGE,/post/NYC-SWE-roles-5tJkAOmc,Citi
4,Jan 11,Thank you will do,0,Bahv07,nan,SEND PRIVATE MESSAGE,/post/NYC-SWE-roles-5tJkAOmc,Citi
5,Jan 11,DM for Google,0,ov3hyg,/company/Google/,SEND PRIVATE MESSAGE,/post/NYC-SWE-roles-5tJkAOmc,Citi
0,Feb 13,"No point putting SF bay in the poll, Silicon Valley is always going to be the leader for foreseeable future.",6,code_lover,/company/Oracle/,SEND PRIVATE MESSAGE,/post/Best-tech-cities-b2CaqhtT,Citi
1,Feb 13,"Yeah, haven’t been to Boise but the COL seems high relative to what I’d expect based on the reading I’ve done.",1,HzkN46,/company/Expedia/,SEND PRIVATE MESSAGE,/post/Best-tech-cities-b2CaqhtT,Citi
2,Feb 14,"I pay state income and sales taxes to Idaho and remaining income taxes to California, plus property tax to Boise. I don’t bring jobs directly though. Population growth is very high. Rent and property value increases are high. Job increases are actually high too, though. Some of the highest in the country I saw recently. Still going to cause income disparity.",0,hPoy04,nan,SEND PRIVATE MESSAGE,/post/Best-tech-cities-b2CaqhtT,Citi
3,Feb 13,Austin will be #1 within the next five years? What are you people smoking?,6,IB40,/company/Pure-Storage/,SEND PRIVATE MESSAGE,/post/Best-tech-cities-b2CaqhtT,Citi
4,Feb 13,Elon weeeed,2,jcFi47d,/company/Amazon/,SEND PRIVATE MESSAGE,/post/Best-tech-cities-b2CaqhtT,Citi
5,Feb 13,Pittsburgh ftw,2,djistar,/company/NVIDIA/,SEND PRIVATE MESSAGE,/post/Best-tech-cities-b2CaqhtT,Citi
6,Feb 13,CMU FTW. Thanks for the reply.,1,MoarMoolah,/company/Google/,SEND PRIVATE MESSAGE,/post/Best-tech-cities-b2CaqhtT,Citi
7,Feb 13,Pittsburgh is booming. COL is fucking low,1,sanpan,/company/Google/,SEND PRIVATE MESSAGE,/post/Best-tech-cities-b2CaqhtT,Citi
8,Feb 13,"Research Triangle Park, Raleigh-Durham NC. Cloud expanding there will bring more companies to the area.",2,MoarMoolah,/company/Google/,SEND PRIVATE MESSAGE,/post/Best-tech-cities-b2CaqhtT,Citi
9,Feb 13,"I’ve been considering a move to Charlotte, but haven’t been to Raleigh. Do you know how it compares to Austin or Denver in terms of tech scene? Is it where they were 5 years ago? More?",0,HzkN46,/company/Expedia/,SEND PRIVATE MESSAGE,/post/Best-tech-cities-b2CaqhtT,Citi
10,Feb 14,Wow I see Austin to be topmost. I expected Bay Area,0,bv_ram,nan,SEND PRIVATE MESSAGE,/post/Best-tech-cities-b2CaqhtT,Citi
11,Feb 15,Austin is booming like anything.. main attraction is Tesla giga factory.Real estate going high.,0,iiSt67,/company/Continental/,Eng,/post/Best-tech-cities-b2CaqhtT,Citi
0,Mar 30,"Toss-up between Anchorage Alaska, Asuncion Paraguay or Gary Indiana.What kind of answer are you expecting with no context on your wants and needs from an area.Edit: looks like you changed the prompt from where to move to ""best city?"". Still a stupidly personal question.",9,little_oof,/company/Plaid/,SEND PRIVATE MESSAGE,/post/Best-city-aL2d7v6Y,Citi
1,Mar 31,What is the city with the best slums ?,0,public3,/company/Facebook/,SEND PRIVATE MESSAGE,/post/Best-city-aL2d7v6Y,Citi
2,Mar 30,"Lol who are these people voting Seattle, it’s gloomy 8-9 months in a year 😂😂",4,TwmJ38,/company/Microsoft/,SEND PRIVATE MESSAGE,/post/Best-city-aL2d7v6Y,Citi
3,Mar 30,"But lush green, skiing, beach, local produce, hiking spots, etc makes things up for it",0,Refer Me,/company/Boeing/,SEND PRIVATE MESSAGE,/post/Best-city-aL2d7v6Y,Citi
4,Mar 31,I love it like that,0,aadhibund,/company/Amazon/,SEND PRIVATE MESSAGE,/post/Best-city-aL2d7v6Y,Citi
5,Mar 30,England is you city,2,__weiji,/company/Amazon/,SEND PRIVATE MESSAGE,/post/Best-city-aL2d7v6Y,Citi
6,Mar 30,Else US would be shitty,0,GTRfann,/company/Amazon/,SEND PRIVATE MESSAGE,/post/Best-city-aL2d7v6Y,Citi
7,Mar 30,None of the above.,2,Hrgf72,/company/Microsoft/,SEND PRIVATE MESSAGE,/post/Best-city-aL2d7v6Y,Citi
8,Mar 30,Where are you coming from?,1,Refer Me,/company/Boeing/,SEND PRIVATE MESSAGE,/post/Best-city-aL2d7v6Y,Citi
0,"Dec 19, 2020",citibank or not his salary is dogshit and he should be looking for new opportunities.,1,lyIw84,/company/Amazon/,SEND PRIVATE MESSAGE,/post/Citi-AVP-Salary-Toronto-Inquiry-gYGDU4vz,Citi
1,"Dec 19, 2020",Heard new grads in non tech for Canada get 60-75k as eng.,1,iTroll,/company/Credit-Karma/,SEND PRIVATE MESSAGE,/post/Citi-AVP-Salary-Toronto-Inquiry-gYGDU4vz,Citi
2,"Dec 19, 2020",Damn citi is paying AVPs new grad pay. Yoe?,0,threshing,/company/Microsoft/,Eng,/post/Citi-AVP-Salary-Toronto-Inquiry-gYGDU4vz,Citi
3,"Dec 19, 2020",Levels.fyi is your friend,0,threshing,/company/Microsoft/,Eng,/post/Citi-AVP-Salary-Toronto-Inquiry-gYGDU4vz,Citi
4,"Dec 19, 2020",Unfortunately not much there,0,PiP-er,/company/Amazon/,SEND PRIVATE MESSAGE,/post/Citi-AVP-Salary-Toronto-Inquiry-gYGDU4vz,Citi
5,"Dec 20, 2020","AVP is specific to the company, i worked in finance and any AVPs base comp is 120-180k",0,Toadxyz,/company/Sun-Life-Financial/,SEND PRIVATE MESSAGE,/post/Citi-AVP-Salary-Toronto-Inquiry-gYGDU4vz,Citi
0,4d,Let’s get the offer first buddy,14,buqP33,/company/Google/,SEND PRIVATE MESSAGE,/post/FB-back-to-office-NYC-i02Q4fa2,Citi
1,4d,Almost there!!!! Positive thinking 😂,0,NVsv03,/company/C.H.Robinson/,SEND PRIVATE MESSAGE,/post/FB-back-to-office-NYC-i02Q4fa2,Citi
2,4d,Think of all the free food...,2,nReC18,/company/Facebook/,SEND PRIVATE MESSAGE,/post/FB-back-to-office-NYC-i02Q4fa2,Citi
3,4d,One can make the same argument about prison.,2,cheeky🐿,/company/OnDeck/,SEND PRIVATE MESSAGE,/post/FB-back-to-office-NYC-i02Q4fa2,Citi
4,4d,Man I wish I could go to office from tomorrow,4,zJfN60,/company/Facebook/,SEND PRIVATE MESSAGE,/post/FB-back-to-office-NYC-i02Q4fa2,Citi
5,4d,"There’s a rubric for evaluating when to open offices, but they aren’t open yet. No specific timeline has been shared.",1,UITS46,/company/Facebook/,SEND PRIVATE MESSAGE,/post/FB-back-to-office-NYC-i02Q4fa2,Citi
6,Yesterday,Any expected approximate timeline for mpk?Would it only be a few days a week in office first?,0,t5469,/company/Intel/,SEND PRIVATE MESSAGE,/post/FB-back-to-office-NYC-i02Q4fa2,Citi
7,4d,"Don’t worry. You will only have to go 4 days per week, since they have wfh Wednesdays. Bad news is, you’ll probably stay at work so late on Tuesdays, that you might as well stay there on most Wednesdays. 🤣",1,cheeky🐿,/company/OnDeck/,SEND PRIVATE MESSAGE,/post/FB-back-to-office-NYC-i02Q4fa2,Citi
0,Apr 19,Only E3s getting into NYC are the very highest performing interns. You’ll need to wait until at least E4,2,rand.rand,/company/Facebook/,SEND PRIVATE MESSAGE,/post/Google-nyc-or-fbny-WNJ1Hkg4,Citi
1,Apr 19,"darn, okay :((((",0,potatostik,/company/Microsoft/,SEND PRIVATE MESSAGE,/post/Google-nyc-or-fbny-WNJ1Hkg4,Citi
2,May 5,"I recently transferred from bay area back to NYC. L4 SWE Googler.There are limited open positions and the competition is intense. As I am interested in the infra projects and corresponding teams’ bar is relatively high, it took 3m to get an offer",1,O.O 0.0,/company/Google/,SEND PRIVATE MESSAGE,/post/Google-nyc-or-fbny-WNJ1Hkg4,Citi
3,May 5,Holy crap. Can I dm you when it may come time?? I really want to go back to nyc,0,potatostik,/company/Microsoft/,SEND PRIVATE MESSAGE,/post/Google-nyc-or-fbny-WNJ1Hkg4,Citi
4,Apr 19,"i think FB only hires E5 and plus for now? I might be wrong, but their head count for e3,4 is very low.",1,lowTCSDE,nan,Eng,/post/Google-nyc-or-fbny-WNJ1Hkg4,Citi
5,Apr 19,"Thanks, good to know",0,potatostik,/company/Microsoft/,SEND PRIVATE MESSAGE,/post/Google-nyc-or-fbny-WNJ1Hkg4,Citi
0,"Oct 11, 2020",Citi hiring freezed in US? Is it true?,1,loganbos,/company/Bank-of-America/,SEND PRIVATE MESSAGE,/post/Is-Citi-in-hiring-freeze-5aS1sTaR,Citi
1,"Oct 11, 2020","I was told by hiring manager in Consumer  about hiring freeze in US, not sure if this is global freeze",0,WYK81,/company/Citi/,SEND PRIVATE MESSAGE,/post/Is-Citi-in-hiring-freeze-5aS1sTaR,Citi
2,"Oct 11, 2020",when did this happen? I still see so many postings online for Citi US,0,loganbos,/company/Bank-of-America/,SEND PRIVATE MESSAGE,/post/Is-Citi-in-hiring-freeze-5aS1sTaR,Citi
3,"Oct 9, 2020","Fyi - if visa transfer required, it will take 6-7 months till you join.",0,Cit,/company/Citi/,SEND PRIVATE MESSAGE,/post/Is-Citi-in-hiring-freeze-5aS1sTaR,Citi
4,"Oct 9, 2020",well but at least they need to give an offer or rejection right?,0,pulubun,/company/Bank-of-America/,SEND PRIVATE MESSAGE,/post/Is-Citi-in-hiring-freeze-5aS1sTaR,Citi
5,"Oct 9, 2020",Yes.But in Very rare case with approval still happening.,0,Cit,/company/Citi/,SEND PRIVATE MESSAGE,/post/Is-Citi-in-hiring-freeze-5aS1sTaR,Citi
6,"Oct 22, 2020",Just accepted an offer with citi. Can I DM a few questions about the company?,0,dogrocks,/company/American-Express/,SEND PRIVATE MESSAGE,/post/Is-Citi-in-hiring-freeze-5aS1sTaR,Citi
7,"Oct 15, 2020","I’m in research, interviewed for a position last week, MD said it’s more challenging to get approvals to add headcount so late in the year, but no hard freeze.",0,zabL08,/company/Goldman-Sachs/,SEND PRIVATE MESSAGE,/post/Is-Citi-in-hiring-freeze-5aS1sTaR,Citi
0,"Sep 24, 2020",Gosh you’re what 22. Pick one and see what you actually like. Also you’re playing the game wrong. Aim to get in management. Coding is like welding. It’s a trade skill. Leetcode is for losers.,24,AppleCri1,/company/Jet/,SEND PRIVATE MESSAGE,/post/NYC-tech-or-finance-OJSi1czn,Citi
1,"Sep 25, 2020",Second half of the advice is garbage. Management is fine if you want to sit in meeting and never code a thing. If you want to stay technical you can go the architect route which pays similar to upper management. Also absolutely nothing wrong with staying in a senior role if you like what you do.,14,xyzabc22,/company/Affirm/,SEND PRIVATE MESSAGE,/post/NYC-tech-or-finance-OJSi1czn,Citi
2,"Sep 25, 2020",It’s good to hear this as a 23 year old doing BA/project management work on software engineering team. I really want to get into management in tech,2,kWey64,/company/Bank-of-America/,SEND PRIVATE MESSAGE,/post/NYC-tech-or-finance-OJSi1czn,Citi
3,"Sep 24, 2020",Just say you’re at Columbia or stern and go 😂,13,potatostik,/company/Microsoft/,SEND PRIVATE MESSAGE,/post/NYC-tech-or-finance-OJSi1czn,Citi
4,"Sep 24, 2020","Of the ppl I know who went into “high finance” out of undergrad (quant and non quant), 80% have left finance 5 years out. Remaining 20% are in golden handcuffs and not fulfilled. Agree with the above post, what will be most interesting, enjoyable work for you?",9,pattern,nan,SEND PRIVATE MESSAGE,/post/NYC-tech-or-finance-OJSi1czn,Citi
5,"Sep 24, 2020","I’m in that boat. If I had to do a redo I’d just go tech. Active management is dying, assholes are more tolerated in finance and generally tech folks within finance unless quant are unfairly viewed as second class citizens (kind of like finance ppl at google).",1,ebitchda,nan,SEND PRIVATE MESSAGE,/post/NYC-tech-or-finance-OJSi1czn,Citi
6,"Sep 25, 2020","There’s a lot of CS/Stats innovations happening in fintech, like lending for example. You may sit in Data Science/Engineering.",0,pattern,nan,SEND PRIVATE MESSAGE,/post/NYC-tech-or-finance-OJSi1czn,Citi
7,"Sep 25, 2020","Generally, megafunds and top hedge funds pay more than FANG (not initially but 3-5 years out), but the median person in tech probably makes more than the median person in finance.",5,Uwkb45,/company/KKR%20&%20Co.%20Inc./,SEND PRIVATE MESSAGE,/post/NYC-tech-or-finance-OJSi1czn,Citi
8,"Sep 25, 2020",I didn’t even know kkr posted jobs online. Experienced hires are usually through recruiters,0,Uwkb45,/company/KKR%20&%20Co.%20Inc./,SEND PRIVATE MESSAGE,/post/NYC-tech-or-finance-OJSi1czn,Citi
9,"Sep 25, 2020","Yeah, it's not accessible through the website, I had to use the ""power"" of Google search lmao but I guess there's no point in applying there since hiring is through recruiters",0,sadcat45,/company/Jefferies/,SEND PRIVATE MESSAGE,/post/NYC-tech-or-finance-OJSi1czn,Citi
10,"Sep 25, 2020",More open SWE roles paying 300k TC vs quant roles paying 300k TC,4,gMjt83,/company/Capital-One/,SEND PRIVATE MESSAGE,/post/NYC-tech-or-finance-OJSi1czn,Citi
0,"Sep 6, 2020",NYC is what I'm going for,31,Throughput,/company/Amazon/,Eng,/post/Best-cities-to-move-to-bUavuW4h,Citi
1,"Dec 22, 2020",Completely agree with LDbs78. I feel safer in NYC than Seattle. Seattle is disgusting; it had its rough spots before big tech took over but it’s like the mayor and the crazy City Council want to drive small businesses out and make it look like a movie set for a worn-torn country.,5,ChillMaadi,/company/SAP/,SEND PRIVATE MESSAGE,/post/Best-cities-to-move-to-bUavuW4h,Citi
2,"Dec 24, 2020","Yeah, completely agreed. SF has 1000x more homeless than NYC.",2,farcical,/company/Google/,Eng,/post/Best-cities-to-move-to-bUavuW4h,Citi
3,"Sep 6, 2020",Los Angeles or San Diego,20,bhe:7:$,/company/Tableau-Software/,SEND PRIVATE MESSAGE,/post/Best-cities-to-move-to-bUavuW4h,Citi
4,Jan 13,Vote for SD,0,gtrB43,/company/IBM/,SEND PRIVATE MESSAGE,/post/Best-cities-to-move-to-bUavuW4h,Citi
5,Jan 27,moved from Seattle to LA and love it here.,0,zWzt31,/company/Snap/,SEND PRIVATE MESSAGE,/post/Best-cities-to-move-to-bUavuW4h,Citi
6,"Sep 6, 2020",Come to Tokyo for a real adventure.,14,indiiiiiid,/company/Indeed/,SEND PRIVATE MESSAGE,/post/Best-cities-to-move-to-bUavuW4h,Citi
7,"Dec 19, 2020",Tokyo is great for visiting not so great for being gaijin salaryman,6,nunyabeeswa,/company/Amazon/,SEND PRIVATE MESSAGE,/post/Best-cities-to-move-to-bUavuW4h,Citi
8,"Dec 19, 2020","Meh I've been here for 10 years and am not from the US, no desire to ever move there and try to look past pure TC personally. The comp is very competitive locally and I have an amazing life here. Sure it's not as much on paper as SF/NYC etc but for cost of living, all the other perks, it's incredibly well paid against the local market. Even if you just do it for a few years and then head somewhere else, it's a great experience.",3,gachtes,/company/Indeed/,SEND PRIVATE MESSAGE,/post/Best-cities-to-move-to-bUavuW4h,Citi
9,"Sep 6, 2020","Austin, TXBostonSan Diego",10,Phoenix-,nan,Product,/post/Best-cities-to-move-to-bUavuW4h,Citi
10,"Dec 28, 2020","No mountains or ocean water.. city parks, sure.",0,YMry77,/company/Google/,SEND PRIVATE MESSAGE,/post/Best-cities-to-move-to-bUavuW4h,Citi
11,"Dec 30, 2020","Boston, MA is where the new money is at 🤘",1,Peezy,nan,Cust. Srv.,/post/Best-cities-to-move-to-bUavuW4h,Citi
12,"Sep 6, 2020","Anyone has insights on Colorado, Carolinas, or Dallas?",4,jakcksn,/company/Microsoft/,SEND PRIVATE MESSAGE,/post/Best-cities-to-move-to-bUavuW4h,Citi
13,Jan 2,Hate to break it to you but there are a lot of states that voted blue full of gun-toting racists too. The characteristics of the community in which you live are FAR more important than the state’s overall political lean.,2,sksnbbh877,/company/Microsoft/,SEND PRIVATE MESSAGE,/post/Best-cities-to-move-to-bUavuW4h,Citi
14,Feb 15,Dallas is good for family too. Colorado has a lot of microbrewery and dispensers so I am not sure if it is good for family.,0,Troll Food,/company/Western-Digital/,Eng,/post/Best-cities-to-move-to-bUavuW4h,Citi
0,Feb 15,Hyd,26,workation,/company/Capital-One/,IT,/post/Best-city-to-live-in-India-1ZjOZLQH,Citi
1,Apr 18,"Might not be everyone's experience but been there three years and enjoyed my life ,may be because i was a bachelor too when i was there .  ""Light lo"" attitude gets you chilled out , unlimited food options , people are total movie buffs regardless of language.. these are some of the positive experiences i had. Again i haven't been to all parts of the city since it's pretty big city like any metro.",2,workation,/company/Capital-One/,IT,/post/Best-city-to-live-in-India-1ZjOZLQH,Citi
2,Apr 22,liiite ustaad,0,JdhxnJbdnh,/company/Microsoft/,SEND PRIVATE MESSAGE,/post/Best-city-to-live-in-India-1ZjOZLQH,Citi
3,Feb 15,Pune?,15,forwarder,/company/Tower-Research-Capital/,SEND PRIVATE MESSAGE,/post/Best-city-to-live-in-India-1ZjOZLQH,Citi
4,Mar 25,No. Pune is still the best.  We need to explore and exploit that place a lot more.  Hidden gem. Go for it.,1,koXR37,/company/RYOT/,SEND PRIVATE MESSAGE,/post/Best-city-to-live-in-India-1ZjOZLQH,Citi
5,Apr 11,"Pune is a good one for access to natural beauty within a couple of hours. A growing food scene and better weather (the winter is nice, and summer doesn’t get waaay too humid). Stay in the metropolitan areas — and not the core Marathi speaking areas where you’d feel like an outsider always. Also people out there suck hard.Don’t bank on infrastructure or public transport. The city has nothing of that.",0,krazy-8,/company/LinkedIn/,SEND PRIVATE MESSAGE,/post/Best-city-to-live-in-India-1ZjOZLQH,Citi
6,Feb 17,"Mysore. Clean, peaceful and a lot cheaper than Blore. Also, just 2.5hrs from Bangalore.",10,njghjig,/company/Snap/,SEND PRIVATE MESSAGE,/post/Best-city-to-live-in-India-1ZjOZLQH,Citi
7,Mar 26,Accepts hindi? You accept the local language first moron.,4,manAF,/company/Microsoft/,SEND PRIVATE MESSAGE,/post/Best-city-to-live-in-India-1ZjOZLQH,Citi
8,Apr 6,Nice to see ppl from Mysore in Blind! I would say Mysoreans should be hostile like Chennai ppl to avoid making Mysore into another Bangalore.. I know it is unethical but more ppl means more ruins.. :(,0,mysore,/company/MathWorks/,SEND PRIVATE MESSAGE,/post/Best-city-to-live-in-India-1ZjOZLQH,Citi
9,Feb 15,Coimbatore,15,stif,/company/Box/,SEND PRIVATE MESSAGE,/post/Best-city-to-live-in-India-1ZjOZLQH,Citi
10,Feb 16,"You're working from coimbatore, NtHz50?",0,ItIsThatIs,/company/Microsoft/,SEND PRIVATE MESSAGE,/post/Best-city-to-live-in-India-1ZjOZLQH,Citi
11,Apr 25,I m from Coimbatore too 😍,0,dayZer00,/company/Amazon/,SEND PRIVATE MESSAGE,/post/Best-city-to-live-in-India-1ZjOZLQH,Citi
12,Feb 15,"Anywhere in Himachalor Bangalore, if you want crowd",9,tamatar 🍅,/company/Rubrik/,SEND PRIVATE MESSAGE,/post/Best-city-to-live-in-India-1ZjOZLQH,Citi
13,Mar 31,"Not really. For example electric scooters, luxury cars and all tech junk first hits banglore.",0,poWbj8,/company/Microsoft/,SEND PRIVATE MESSAGE,/post/Best-city-to-live-in-India-1ZjOZLQH,Citi
14,Apr 4,All tech junk pretty much hits all tier 1 cities first,1,workation,/company/Capital-One/,IT,/post/Best-city-to-live-in-India-1ZjOZLQH,Citi
0,May 8,Manhattan only has 12% Trump supporters. Should be very safe for Asians in the street? Don’t worry.,10,~Laputa~,/company/Uber/,SEND PRIVATE MESSAGE,/post/Anti-asian-hate-crimes-in-NYC-eaYQBcVH,Citi
1,May 9,of course. They are Dark White Supremacists.Seemly F and G have both terribly lowered their hiring bars for general smartness.,4,~Laputa~,/company/Uber/,SEND PRIVATE MESSAGE,/post/Anti-asian-hate-crimes-in-NYC-eaYQBcVH,Citi
2,May 9,"@Uber, using irony to mock leftist views stopped working around 2005, I think. The left has embraced craziness and it's impossible to tell any crazy mockery you could possibly come up with from a genuine leftist view.",4,SXEh12,nan,SEND PRIVATE MESSAGE,/post/Anti-asian-hate-crimes-in-NYC-eaYQBcVH,Citi
3,May 9,Gotta love the anti black racism in these posts. Lots of tough guys here. Wouldnt dare say such trash in front of the millions of law abiding hard working black people some of you pass every day. Guessing most of you were not even born in the USA. Continue on incels.,6,z34df9fs,/company/Facebook/,SEND PRIVATE MESSAGE,/post/Anti-asian-hate-crimes-in-NYC-eaYQBcVH,Citi
