,comment_date,comment_text,comment_like,comment_user,comment_firm,comment_position,comment_url,company
2,Jan 1,"I lived in both cities.....London of course is (or at least feels) more vibrant than Amsterdam because it is much bigger and crowded, it’s definitely a city with endless options in entertainment, culture, career etc, similar in lifestyle to NYC, and it is also more diverse.However I have to say that, while living there, I’ve also wondered several times what all the hype about London as a lively and exciting city was about. The main things that killed the whole “global lively capital” thing for me were opening hours and distances.Everything closes so damn early compared to continental European capitals or NYC. There are a few clubs that stay open until very late but they are not many and you have to like clubbing, you definitely won’t be able to just chill with your friends in a cool bar/pub until late, something which is super normal for example in Berlin or New York, the cities where I had lived before moving to London. Same thing for having a bite late at night, after 9:30/10pm you’ll start having a hard time finding a table in a good restaurant and after midnight even fast food is hard to find except for a few McDonald’s that are open all night (this is shocking to people living in Berlin or NYC). I had high expectations for this to change with the start of the Night Tube (24h subway at weekends, which again the other cities I mentioned have since ages ago) but there was only a very slight improvement. All of this obviously doesn’t matter much right now during a pandemic but we can only compare pre-Covid lives and I guess we can assume things will more or less go back to how they were before even in terms of local culture and preferences.As for distances, London is just so big and spread out that it takes forever to go anywhere and this, in my experience, takes a huge toll on your social life. It’s hard to meet, plan things and hang out with people that don’t live in your area. While this is more or less true in every city, it’s literally taken to the extreme in London (for example I find NYC way more compact and easier to navigate). Despite the excellent public transport infrastructure, you’ll find yourself in the end rarely getting out of your area and almost never going into central London (the part that every tourist usually gets excited about). Going to a different area will feel like a small trip, which is great for weekend explorations maybe but honestly takes a toll on you in your everyday life (let’s not even talk about the awful commutes, since for now you won’t need to do that at least).Overall I enjoyed my time in London and I still love it but these two factors greatly reduced my excitement for living there and the appeal of the city for me. I think Amsterdam, relatively to its much smaller size, punches well above its weight in terms of being lively and an interesting/fun place, while also being a much less stressful city where to live",14,hyyms,/company/Uber/,SEND PRIVATE MESSAGE,/post/Better-City-London-or-Amsterdam-i21pH612,Citi
3,Jan 1,Why only London or Amsterdam? Between the 2 I'd go with London because Amsterdam is so far in the north and it actually be easier to hop on a flight in London to visit Europe on the weekend .,0,GritGrit,/company/BMW/,SEND PRIVATE MESSAGE,/post/Better-City-London-or-Amsterdam-i21pH612,Citi
4,Jan 1,Lol “so far in the north”.....please take another look at a map of Europe,8,hyyms,/company/Uber/,SEND PRIVATE MESSAGE,/post/Better-City-London-or-Amsterdam-i21pH612,Citi
5,Jan 1,"Flight times and choices to main European destinations are very similar between London and Amsterdam. I’d actually almost say I prefer flying from Amsterdam cause the airport is SO incredibly close to the city and very convenient, with all airlines and destinations available in one place. Schiphol is a good airport! In London you have several airports but each of them (except City Airport) is likely to be quite far from where you live and require significant travel",4,hyyms,/company/Uber/,SEND PRIVATE MESSAGE,/post/Better-City-London-or-Amsterdam-i21pH612,Citi
6,Jan 1,Visit both before deciding?  Personally I’d choose Amsterdam over London without giving it a second thought.,6,sgcx252xcv,/company/Apple/,SEND PRIVATE MESSAGE,/post/Better-City-London-or-Amsterdam-i21pH612,Citi
7,Jan 1,I hope you're considering the presence of tech companies in each location and salaries too apart from lifestyle and travelling aspect.,4,NotActive,/company/Goldman-Sachs/,Eng,/post/Better-City-London-or-Amsterdam-i21pH612,Citi
8,Jan 1,Yes I'm talking with market making firms in both places,0,snidely,/company/Google/,Other,/post/Better-City-London-or-Amsterdam-i21pH612,Citi
9,Jan 1,"Cool. I earlier assumed you are in Tech, but maybe you are not, as your job category is Other.",0,NotActive,/company/Goldman-Sachs/,Eng,/post/Better-City-London-or-Amsterdam-i21pH612,Citi
10,Jan 1,"I personally love Amsterdam. London is way too big and crowded and overwhelming. But if you like living somewhere such as NYC, you might prefer London.",4,NEPT14,/company/AppDynamics/,SEND PRIVATE MESSAGE,/post/Better-City-London-or-Amsterdam-i21pH612,Citi
0,6d,Don’t be fucking lazy and learn to cook,2,wogkz6,nan,SEND PRIVATE MESSAGE,/post/Chef-or-fresh-meal-services-in-NYC-kpa2bCXr,Citi
1,5d,"@yeeeezy, what do you typically cook for daily meals?",0,AzmX30,/company/Amazon/,SEND PRIVATE MESSAGE,/post/Chef-or-fresh-meal-services-in-NYC-kpa2bCXr,Citi
2,5d,"Whatever I’m in the mood for, usually involves a pan so I can cook it all in there. Stir fry, one pan pasta, steak, etc. I just discovered Thai salad dressing so will be doing a shrimp salad for lunch today",0,yeeeezy,nan,SEND PRIVATE MESSAGE,/post/Chef-or-fresh-meal-services-in-NYC-kpa2bCXr,Citi
3,6d,CookUnity in NYC - $160/week chef made meals they are very good I never go hungry,0,epgt03,/company/Google/,SEND PRIVATE MESSAGE,/post/Chef-or-fresh-meal-services-in-NYC-kpa2bCXr,Citi
4,6d,Thanks! Might be moving to NY soon. Will give it a go,0,Tarzan 12,/company/Amazon/,SEND PRIVATE MESSAGE,/post/Chef-or-fresh-meal-services-in-NYC-kpa2bCXr,Citi
5,6d,Much better than any competitors I’ve tried here tbh and I’ve lived here 4 years,0,epgt03,/company/Google/,SEND PRIVATE MESSAGE,/post/Chef-or-fresh-meal-services-in-NYC-kpa2bCXr,Citi
6,6d,Have you tried hello fresh?,0,JlMD57,/company/Ingram-Micro/,SEND PRIVATE MESSAGE,/post/Chef-or-fresh-meal-services-in-NYC-kpa2bCXr,Citi
7,6d,No - any good?,0,AzmX30,/company/Amazon/,SEND PRIVATE MESSAGE,/post/Chef-or-fresh-meal-services-in-NYC-kpa2bCXr,Citi
8,6d,I have liked it. The meals come out to be around $15. The only thing is that you would have to cook it yourself,1,JlMD57,/company/Ingram-Micro/,SEND PRIVATE MESSAGE,/post/Chef-or-fresh-meal-services-in-NYC-kpa2bCXr,Citi
9,6d,Is the 1500 for yourself or including spouse/people you take out?,1,yeeeezy,nan,SEND PRIVATE MESSAGE,/post/Chef-or-fresh-meal-services-in-NYC-kpa2bCXr,Citi
10,6d,"Just myself but includes dinners twice a week with friends($150 per weekend), so normal food costs are $900 or $30 per day",0,AzmX30,/company/Amazon/,SEND PRIVATE MESSAGE,/post/Chef-or-fresh-meal-services-in-NYC-kpa2bCXr,Citi
11,4d,I order Shef every week in NYC and there are tons of awesome healthy options. Are you ordering right?,0,JwGG75,/company/Uber/,SEND PRIVATE MESSAGE,/post/Chef-or-fresh-meal-services-in-NYC-kpa2bCXr,Citi
12,4d,Can you suggest some good Shefs?I browsed the website and it looked mostly like a bunch of unhealthy Indian food 😆 I’m looking for Paleo / low-carb.,0,AzmX30,/company/Amazon/,SEND PRIVATE MESSAGE,/post/Chef-or-fresh-meal-services-in-NYC-kpa2bCXr,Citi
13,4d,Same Indian food is high fat,0,epgt03,/company/Google/,SEND PRIVATE MESSAGE,/post/Chef-or-fresh-meal-services-in-NYC-kpa2bCXr,Citi
0,"Mar 7, 2020",why nyc,0,ztn,/company/LinkedIn/,SEND PRIVATE MESSAGE,/post/Google-NYC-Headcount-AjPbWp57,Citi
1,"Mar 8, 2020",Is that even a question ztn,0,Enig16,/company/Bloomberg/,SEND PRIVATE MESSAGE,/post/Google-NYC-Headcount-AjPbWp57,Citi
2,"Mar 8, 2020",It’s like asking if water is wet,6,Enig16,/company/Bloomberg/,SEND PRIVATE MESSAGE,/post/Google-NYC-Headcount-AjPbWp57,Citi
3,"Mar 7, 2020","They are hiring L3/L4, your recruiter is lying to you. I know multiple people who started at Google NYC in the last couple months and starting this month at L3/L4",8,gmeY28,nan,SEND PRIVATE MESSAGE,/post/Google-NYC-Headcount-AjPbWp57,Citi
4,"Mar 8, 2020","To clarify, the recruiter who said this was a technical sourcer. Once I passed the technical screen, she sent my profile around to NYC senior recruiters and the feedback she received is that they are focused on recruiting candidates with 5+ years of experience (L5+ probably).But that's a good sign if new L3s and L4s have started recently. It means there are a few spots in NYC office and I've got a chance at getting one. Thanks for sharing!",0,ogh,/company/Facebook/,Eng,/post/Google-NYC-Headcount-AjPbWp57,Citi
5,"Mar 7, 2020","Literally everyone wants to be in NYC, but the space is very limited. Unless they build new buildings it will remain impossible to get in there.",1,cqNn46,/company/Google/,Eng,/post/Google-NYC-Headcount-AjPbWp57,Citi
6,"Mar 8, 2020",Thank you for the assurance! I'll give both a shot.,0,ogh,/company/Facebook/,Eng,/post/Google-NYC-Headcount-AjPbWp57,Citi
7,"Mar 8, 2020",do u know which teams are hiring in nyc??,0,ztn,/company/LinkedIn/,SEND PRIVATE MESSAGE,/post/Google-NYC-Headcount-AjPbWp57,Citi
8,"Mar 7, 2020","It’s pretty impacted space wise, so that’s probably the main limiting factor. L5+ and higher is a bit less common to hire so there are probably just less candidates filling those spots.That being said there are L3/4 joining regularly so I don’t think there are 0. Just there’s a lot of competition for those spots.",1,vmPw71,/company/Google/,SEND PRIVATE MESSAGE,/post/Google-NYC-Headcount-AjPbWp57,Citi
9,"Mar 8, 2020","If you wouldn’t take a Bay Area position they’ll only try to match you with nyc teams, but it won’t prioritize you with nyc teams afaik. And regarding networking, it might help but it isn’t a silver bullet.Unfortunately you’ll probably just have to wait it out to try to get a match, and you may end up having to cut it short and go with another company if you get other good offers.Do you know what level you would be coming in as? I think there are more L4 positions compared to L3 that I’ve seen (I could be wrong though).",1,vmPw71,/company/Google/,SEND PRIVATE MESSAGE,/post/Google-NYC-Headcount-AjPbWp57,Citi
10,"Mar 8, 2020","Gotcha, that's too bad to hear. I'll try both tactics regardless. I could always just do some contract work and wait it out for a year, though I've heard of people waiting that long without any luck.I never had the leveling conversation with my recruiter but I'm pretty sure I would be an L3.A friend of mine got an L4 in December, but insisted on NYC and did three team matching interviews in January, but they were all filled with internal candidates. I'd be glad to hear if more have opened up in the last few months.",0,ogh,/company/Facebook/,Eng,/post/Google-NYC-Headcount-AjPbWp57,Citi
11,"Mar 8, 2020","I've been in team matching for 2 months+ for L4.  I was told a month ago that there were no L4 positions currently in Google NYC, but that they were expecting this to change eventually.  They wouldn't be forthcoming with me on when exactly this would happen.  Ended up taking an Amazon offer instead.",1,YUvU30,/company/Intercontinental-Exchange/,SEND PRIVATE MESSAGE,/post/Google-NYC-Headcount-AjPbWp57,Citi
12,"Mar 8, 2020","That's too bad to hear, though hopefully you're happy at Amazon. Did you give them an ultimatum such as ""find me something in NY soon or else I'm going to Amazon?"" Or did you just get fed up with waiting?And were you always interviewing for the NYC office or were you open to others?",0,ogh,/company/Facebook/,Eng,/post/Google-NYC-Headcount-AjPbWp57,Citi
0,"Aug 22, 2019",following,0,codesnot,/company/Uber/,SEND PRIVATE MESSAGE,/post/CITI-Refinance-Agent-Reference-0uObhr2w,Citi
0,"Sep 10, 2020",It feels pretty normal to poop in the streets. It feels just like SF!,11,wake123,/company/Capital-One/,SEND PRIVATE MESSAGE,/post/Hows-NYC-these-days-1gFQcGm1,Citi
1,"Sep 10, 2020","I left my Soho apartment back in March, and moved back to East Village in August. There are some really cute blocks lined with street dining, and it’s quite lively on the weekends (until 11:30-12). Then it starts to fizzle down really quickly. The parks during the daytime are nice too, everyone has a blanket and hangs out with some friends on the grass. But it’s really quiet at night and people seem kind of scared of the homeless. There’s a notable increase since pre-covid nyc. I actually recommend not living in Manhattan these days because of how much homeless are here. Brooklyn heights, Cobble hill, Park slope are much more desirable and safe at night to walk around. Manhattan isn’t really worth it these days and it’s hard to meet people (obviously). Let me know if you want more info!",6,_tiddy,/company/Memorial-Sloan/,SEND PRIVATE MESSAGE,/post/Hows-NYC-these-days-1gFQcGm1,Citi
2,"Sep 11, 2020","It’s quiet. Hard to explain - lots of people out and about, but it just doesn’t have that insane bustling feel that used to be there. Outdoor dining is fun. Lots of people hanging out in the parks on evenings and weekends. A noticeable increase in homeless in certain parts of Manhattan (in particular I’d completely avoid the Times Square/Herald Square area). However the increasing crime is a bit overblown - it’s mostly gang related with some random violence thrown in but overall it’s still a safe city. The only difference is you should exercise basic street smarts, which is a skill that many transplants never developed because they’re so used to the city being ridiculously safe.",5,22PM,/company/Bloomberg/,SEND PRIVATE MESSAGE,/post/Hows-NYC-these-days-1gFQcGm1,Citi
3,"Sep 10, 2020","Yep still less people, crime is up tho",2,mNmF34,nan,SEND PRIVATE MESSAGE,/post/Hows-NYC-these-days-1gFQcGm1,Citi
4,"Sep 10, 2020","Streets are pretty quiet, but there's out door dining that's pretty lively,  indoor dining will be back Sept 20 You can find several clips on YouTube on the current level of activity on the streets in various neighborhoods",2,avxim,/company/Dell/,SEND PRIVATE MESSAGE,/post/Hows-NYC-these-days-1gFQcGm1,Citi
0,May 8,"The big ones seem to primarily focus on industry hires there, so might be tough.",1,rchik,/company/Amazon/,SEND PRIVATE MESSAGE,/post/Companies-In-NYC-hiring-new-grads-wyxmQZVn,Citi
1,May 9,Twitter,0,Us4BG,/company/Twitter/,SEND PRIVATE MESSAGE,/post/Companies-In-NYC-hiring-new-grads-wyxmQZVn,Citi
0,"Apr 17, 2020","If you’re OK living in a very liberal city, Seattle’s Eastside (Bellevue, Kirkland) has great schools. Enough good jobs in the area to stay afloat.",9,88🎹,/company/Microsoft/,SEND PRIVATE MESSAGE,/post/Best-cities-to-raise-children-KC8ZVmtQ,Citi
1,"Apr 23, 2020",Yes.,0,RMuh72,/company/Cerner/,SEND PRIVATE MESSAGE,/post/Best-cities-to-raise-children-KC8ZVmtQ,Citi
2,"Apr 29, 2020",Seattle is double shock - bullshit weather plus  its getting expansive.... I would say still 10/15% cheaper thn Bay area plus 10% less tax,0,jVWl55,/company/Microsoft/,Eng,/post/Best-cities-to-raise-children-KC8ZVmtQ,Citi
3,"Apr 17, 2020",Vienna or Zurich,8,ShitShow💩,/company/Amazon/,Eng,/post/Best-cities-to-raise-children-KC8ZVmtQ,Citi
4,"Apr 17, 2020",Minneapolis for sure. The city is highly underrated.,8,AT556,/company/SugarCRM/,SEND PRIVATE MESSAGE,/post/Best-cities-to-raise-children-KC8ZVmtQ,Citi
5,"Apr 21, 2020","Minneapolis, Nashville, Charlotte, Atlanta, Des Moines",4,RMuh72,/company/Cerner/,SEND PRIVATE MESSAGE,/post/Best-cities-to-raise-children-KC8ZVmtQ,Citi
6,"Apr 29, 2020","bcoin_jake, mea culpa. Forgot to read the trailing post.",0,Skeptic20,/company/SAP/,SEND PRIVATE MESSAGE,/post/Best-cities-to-raise-children-KC8ZVmtQ,Citi
7,"Apr 30, 2020","Nashville is great, come live here!",0,bcoin_jake,/company/Amazon/,SEND PRIVATE MESSAGE,/post/Best-cities-to-raise-children-KC8ZVmtQ,Citi
0,"Dec 4, 2020","Stay at current job, have a baby and definitely get out. I took 5 years and had 3 kids. Took a dull and easy job to focus on that. It took me 15 months to catch up and back in the thick of things at a new company with a great TC and exciting future.",61,yQxw35,/company/OpenText/,SEND PRIVATE MESSAGE,/post/Advice-needed---mid-30sparentnyc-bvKYJhq0,Citi
1,"Dec 4, 2020",OpenText called it perfectly.,1,redfant,/company/OnDeck/,SEND PRIVATE MESSAGE,/post/Advice-needed---mid-30sparentnyc-bvKYJhq0,Citi
2,"Dec 26, 2020",Good advice,0,ayushmaank,/company/Google/,SEND PRIVATE MESSAGE,/post/Advice-needed---mid-30sparentnyc-bvKYJhq0,Citi
3,"Dec 4, 2020","Definitely stay. Imagine having a job that requires you to work 10hrs a day, and how that would affect your kid",22, эээ,/company/PayPal/,SEND PRIVATE MESSAGE,/post/Advice-needed---mid-30sparentnyc-bvKYJhq0,Citi
4,"Dec 4, 2020","Both! Stay where you are, try to pop out another kid quickly, but start lightly putting the feelers out there and see if anything amazing comes along that seems better than the current situation. I started a new job right after having my second baby and it was hard- I was trying to prove myself, and pump, and when the kids were sick it really sucked having to run out at a new job with a boss who didn’t know my work ethic and dedication yet. Going back where you’re already known is much easier. For me, an extra $50k in comp or whatever isn’t worth the stress and being miserable while my kids are really little, balance is important.",17,BlueSkies4,/company/Prudential-Financial/,SEND PRIVATE MESSAGE,/post/Advice-needed---mid-30sparentnyc-bvKYJhq0,Citi
5,"Dec 4, 2020","It's all about what you want. You can have a nanny and minimize your time with your second kid and devote yourself to your new job (one extreme). Or, you can stay where you are and take it easy there and maybe even work part time (other extreme). Both are feasible. Or you can find some sort of middle ground. My general advice is, do what feels right for you and your husband, have the kid when you feel is the right time and then make everything else work around it (ie, don't postpone having a baby because of a job). But also don't forget it takes a while to get pregnant and then it takes a while to give birth so you are probably at minimum 1 year away from even actually having the 2nd kid .. 1 year being demotivated and bored would be too much for me personally. Best of luck with this decision!!!",10,truffleshu,/company/Google/,Other,/post/Advice-needed---mid-30sparentnyc-bvKYJhq0,Citi
6,"Dec 4, 2020","Adding advice- look for the opportunities while you get pregnant. If better option is available, switch before you get pregnant.If you get pregnant before you find switch just stay where you are. I personally feel that if atleast either of personal or professional life is sorted another can be sorted too.Good luck!!",3,Paytm,/company/Paytm/,SEND PRIVATE MESSAGE,/post/Advice-needed---mid-30sparentnyc-bvKYJhq0,Citi
7,Feb 19,This is an excellent advice,0,rsky,/company/Apple/,SEND PRIVATE MESSAGE,/post/Advice-needed---mid-30sparentnyc-bvKYJhq0,Citi
8,"Dec 4, 2020","I am one of those who actually took the option to move assuming grass would be greener. But sadly, it’s not the case. Yes, I am being paid much more (450k comp) but am working like crazy and guess what? We are expecting our 2nd one soon now and I don’t know how we will manage next year!!I also realized one thing. Once you make over 200k, any more amount of money will not help improve your life or your lifestyle. I saw no change in my lifestyle or happiness before / after making the job change with a higher comp.",9,verynice!,/company/Amazon/,SEND PRIVATE MESSAGE,/post/Advice-needed---mid-30sparentnyc-bvKYJhq0,Citi
0,"Nov 17, 2018",We have 3 primary offices in NY:jfk14 / jfk18 near empire state buildingjfk19 near Hudson yardsNo clue on moving.,2,NOYb77,/company/Amazon/,SEND PRIVATE MESSAGE,/post/Amazon-NYC-location-Ss8ZrZxM,Citi
1,"Nov 17, 2018",jfk18 is a wework building that’s just all amazon so they’ll probably move the people in jfk18 to Long Island city first. No idea when but my best guess is first half of 2019,1,Uwg8U,/company/Amazon/,SEND PRIVATE MESSAGE,/post/Amazon-NYC-location-Ss8ZrZxM,Citi
2,"Sep 11, 2019",Is the wework office temporary?,0,kioo37,nan,Eng,/post/Amazon-NYC-location-Ss8ZrZxM,Citi
3,"Nov 17, 2018",I saw hiring starts in 2019. Anyone have more info on that?,1,GzFG12,/company/ConocoPhillips/,SEND PRIVATE MESSAGE,/post/Amazon-NYC-location-Ss8ZrZxM,Citi
0,Apr 9,"Atlanta, Raleigh, Dallas",6,SVAM67,/company/Reckitt-Benckiser/,SEND PRIVATE MESSAGE,/post/Ranking-US-cities-by-saving-potential-CGzNbpuh,Citi
1,Apr 9,"I think working in NY city and living in NJ suburb gives you the best in savings. If both spouses are working in a FAANG, Bay Area trumps because of unlimited upside.",2,yEfg02,/company/Bloomberg/,SEND PRIVATE MESSAGE,/post/Ranking-US-cities-by-saving-potential-CGzNbpuh,Citi
2,Apr 9,what towns in nj? The commute sucks,0,🌝ayaya,/company/Facebook/,SEND PRIVATE MESSAGE,/post/Ranking-US-cities-by-saving-potential-CGzNbpuh,Citi
3,Apr 9,"Bay Area. No comparison if you’re working at Apple, Google, or FB. A lot of people are just thinking short term here. Think long term. The best opportunities are at the headquarters and your best odds of going higher are there as well. Not to say it’s not possible outside of the BA but it’s definitely no where near as likely.",2,zsdskejd,/company/Google/,SEND PRIVATE MESSAGE,/post/Ranking-US-cities-by-saving-potential-CGzNbpuh,Citi
4,Apr 9,"If you can live frugal with cheap rent in not-so-desirable areas then Seattle and Austin are your best options. Both have zero state income tax, but sales and property tax can surpass that if you are a big spender. I advise diving into a well known company, gain some experience, then use that resume booster to find a remote friendly gig and move somewhere cheaper to continue saving.",2,kmSQ73,/company/Amazon/,SEND PRIVATE MESSAGE,/post/Ranking-US-cities-by-saving-potential-CGzNbpuh,Citi
5,Apr 9,"Basically just the most expensive cities. If you’re good (can get into FAANG/one of those other companies that pays 350k+ for senior/L5) and rent instead of buying, the TC will dominate COL.",1,jhunter2,/company/Snap/,SEND PRIVATE MESSAGE,/post/Ranking-US-cities-by-saving-potential-CGzNbpuh,Citi
0,Jan 8,Depends on the offer and team. What’s the oscar breakdown?,0,zbtdefdef,/company/Oscar-Health/,SEND PRIVATE MESSAGE,/post/NYC-OFFERS---Apple-vs-Oscar-health-mRyCe66J,Citi
1,Jan 13,190k + 70k stock options for oscar vs 310K TC for Apple. How much will 70k stock options shoot up after 4 years?,0,umWt35,/company/Microsoft/,SEND PRIVATE MESSAGE,/post/NYC-OFFERS---Apple-vs-Oscar-health-mRyCe66J,Citi
2,Jan 14,"Hard to say. Who knows how the stock will do? I think you should consider your risk tolerance, but ultimately it should come down to what opportunity—based on the role, team, etc—attracts you more",2,zbtdefdef,/company/Oscar-Health/,SEND PRIVATE MESSAGE,/post/NYC-OFFERS---Apple-vs-Oscar-health-mRyCe66J,Citi
3,Jan 8,"Don'y think you'll get options. Probably RSU in Oscar. Also it's pretty hard to get promo from senior to staff here. Before and future. Anyone got promoted from senior to staff less than 1.5 years here, they must be a rock star in their functional area. You can count them with one hand",1,YLak23,/company/Oscar-Health/,SEND PRIVATE MESSAGE,/post/NYC-OFFERS---Apple-vs-Oscar-health-mRyCe66J,Citi
4,Jan 24,Have we started giving RSU now?,0,Jzimeolaj$,/company/Oscar-Health/,SEND PRIVATE MESSAGE,/post/NYC-OFFERS---Apple-vs-Oscar-health-mRyCe66J,Citi
5,Jan 8,"I think the promotions are still possible. You’ll see that a lot at startups. Though since we’re trying to go public now, you’ll likely see that less and less, especially from senior to staff. Tbh i don’t think we’re gonna pop like dash or abnb, but since you’ll be granted options and not RSUs i’m guessing your shares will be worth 2x of the cost of acquiring them. That’s my guess at least.",1,zbtdefdef,/company/Oscar-Health/,SEND PRIVATE MESSAGE,/post/NYC-OFFERS---Apple-vs-Oscar-health-mRyCe66J,Citi
6,Jan 7,Depends on the Oscar offer,0,bEJL61,/company/Oscar-Health/,SEND PRIVATE MESSAGE,/post/NYC-OFFERS---Apple-vs-Oscar-health-mRyCe66J,Citi
7,Jan 13,190k + 70k stock options for oscar vs 310K TC for Apple. How much will 70k stock options shoot up after 4 years?,0,umWt35,/company/Microsoft/,SEND PRIVATE MESSAGE,/post/NYC-OFFERS---Apple-vs-Oscar-health-mRyCe66J,Citi
8,Jan 7,Offer breakdown for Apple and Oscar health?,0,livinlyf,/company/Sonos/,SEND PRIVATE MESSAGE,/post/NYC-OFFERS---Apple-vs-Oscar-health-mRyCe66J,Citi
9,Jan 7,"No number yet. But according to levels.fyi, median TC for Apple ICT4 is around 300k",0,umWt35,/company/Microsoft/,SEND PRIVATE MESSAGE,/post/NYC-OFFERS---Apple-vs-Oscar-health-mRyCe66J,Citi
0,"Jan 11, 2020","Seattle is also getting loud, crowded and dirty. If you can’t find friends or dates in NYC, don’t think it will be better in Seattle.",19,punchman,/company/Facebook/,SEND PRIVATE MESSAGE,/post/Facebook-Seattle-vs-NYC-fYdCeG8C,Citi
1,"Jan 12, 2020",@tomatosan how would you describe the mindset difference?,0,0x4e,nan,SEND PRIVATE MESSAGE,/post/Facebook-Seattle-vs-NYC-fYdCeG8C,Citi
