,comment_date,comment_text,comment_like,comment_user,comment_firm,comment_position,comment_url,company
0,Jan 14,Come on boys. Share some numbers,142,QR ·,nan,SEND PRIVATE MESSAGE,/post/Citi-Morgan-Stanley-bonus-UEOMoL3h,Citi
1,Jan 14,Only 26k.  Can’t compare with tech,45,EvuH78,/company/Morgan-Stanley/,SEND PRIVATE MESSAGE,/post/Citi-Morgan-Stanley-bonus-UEOMoL3h,Citi
2,Mar 24,What’s L5 at Google equivalent to in terms of yoe?,0,rrage,/company/RBC-Capital-Markets/,SEND PRIVATE MESSAGE,/post/Citi-Morgan-Stanley-bonus-UEOMoL3h,Citi
3,Mar 29,Bonuses cannot be compared between finance and tech because finance gives 🥜 equity and tech gives 🥜 cash bonus.,0,dCOw25,/company/Moveworks/,Eng,/post/Citi-Morgan-Stanley-bonus-UEOMoL3h,Citi
4,Jan 15,This shit is making me sad...,14,pipMeister,/company/Amazon/,Eng,/post/Citi-Morgan-Stanley-bonus-UEOMoL3h,Citi
5,Jan 15,"No I'm sad for them because I'm in the same boat as you.  But, unlike you, I'm not an asshole",65,pipMeister,/company/Amazon/,Eng,/post/Citi-Morgan-Stanley-bonus-UEOMoL3h,Citi
6,Jan 15,🍻 🍻,0,Beef jazos,/company/Amazon/,SEND PRIVATE MESSAGE,/post/Citi-Morgan-Stanley-bonus-UEOMoL3h,Citi
7,Jan 15,front office - $10k...,19,yoyo112233,/company/Citi/,SEND PRIVATE MESSAGE,/post/Citi-Morgan-Stanley-bonus-UEOMoL3h,Citi
8,Jan 20,Working in PB Operations in Warsaw Office does not make you a front office,8,UBAC85,/company/Goldman-Sachs/,SEND PRIVATE MESSAGE,/post/Citi-Morgan-Stanley-bonus-UEOMoL3h,Citi
9,Jan 20,No chance front office,1,BVDd66,/company/Citi/,SEND PRIVATE MESSAGE,/post/Citi-Morgan-Stanley-bonus-UEOMoL3h,Citi
10,Jan 15,Total comp up 40% from last year. Mainly in the bonus. Base up 15%,33,^_^~,/company/Morgan-Stanley/,SEND PRIVATE MESSAGE,/post/Citi-Morgan-Stanley-bonus-UEOMoL3h,Citi
11,Jan 16,What is the difference?,0,/\_/\,/company/Morgan-Stanley/,SEND PRIVATE MESSAGE,/post/Citi-Morgan-Stanley-bonus-UEOMoL3h,Citi
12,Jan 16,MS would take the bonus you just found out about + 2020 salary and compare that to bonus you were told in Jan 2020 + 2019 salary to calculate % up. IRS would be 2021 new salary + bonus you just heard about vs 2020 salary and bonus from Jan 2020.,2,kEmH28,/company/Morgan-Stanley/,SEND PRIVATE MESSAGE,/post/Citi-Morgan-Stanley-bonus-UEOMoL3h,Citi
0,Feb 8,Both firms suck...stick to porn,53,jamespine,nan,SEND PRIVATE MESSAGE,/post/Citi-SVP-to-JP-Morgan-VP-Transition-4ZNCUjRE,Citi
1,Feb 9,TC or gtfo,17,djsjkwkn,/company/PathAI/,SEND PRIVATE MESSAGE,/post/Citi-SVP-to-JP-Morgan-VP-Transition-4ZNCUjRE,Citi
2,Feb 9,"Leo23, 200-250 k is L3/L4 in FAANG",0,L Farquaad,/company/Uber/,Property Dev,/post/Citi-SVP-to-JP-Morgan-VP-Transition-4ZNCUjRE,Citi
3,Feb 9,Ok,0,Leo23,/company/Citi/,SEND PRIVATE MESSAGE,/post/Citi-SVP-to-JP-Morgan-VP-Transition-4ZNCUjRE,Citi
4,Feb 8,Does the VP role offers higher compensation? That’s all that matters to me. They can call me specialist if they want as long as they pay good money.,10,sTeH34,/company/Barclaycard/,SEND PRIVATE MESSAGE,/post/Citi-SVP-to-JP-Morgan-VP-Transition-4ZNCUjRE,Citi
5,Feb 9,I disagree. Titles are very fluid and mean nothing. A SVP / VP title in finance does not equate to that same title in other companies and recruiters know just as much. That’s why people ask for YOE on Blind and not job titles.,0,sTeH34,/company/Barclaycard/,SEND PRIVATE MESSAGE,/post/Citi-SVP-to-JP-Morgan-VP-Transition-4ZNCUjRE,Citi
6,Feb 9,Answer below the question. Created an EDIT section to answer all queries together.,0,Leo23,/company/Citi/,SEND PRIVATE MESSAGE,/post/Citi-SVP-to-JP-Morgan-VP-Transition-4ZNCUjRE,Citi
7,Feb 9,Citi inflates titles cuz they can’t get anyone to go there otherwise. I used to recruit for JP and had to explain this all the time. It’s pretty lateral and plus JP is overall the place to be. Citi is just...well...Take the job offer,6,abf85,nan,SEND PRIVATE MESSAGE,/post/Citi-SVP-to-JP-Morgan-VP-Transition-4ZNCUjRE,Citi
8,Feb 9,"Don't get tricked by ""global head"". I have a bunch of former colleagues at D/ED level with made up global head of whatever small team they lead on LinkedIn.",2,sweeeeee,/company/Facebook/,Eng,/post/Citi-SVP-to-JP-Morgan-VP-Transition-4ZNCUjRE,Citi
9,Feb 9,Answer below the question. Created an EDIT section to answer all queries together.,0,Leo23,/company/Citi/,SEND PRIVATE MESSAGE,/post/Citi-SVP-to-JP-Morgan-VP-Transition-4ZNCUjRE,Citi
10,Feb 9,"SVP with 200k TC. Sorry I lol'd hard at this. You bank guys and your inflated titles, it's like fucking medieval times. What next ""Sirs"" and ""Lords""? Sheez",0,samosalove,/company/Microsoft/,SEND PRIVATE MESSAGE,/post/Citi-SVP-to-JP-Morgan-VP-Transition-4ZNCUjRE,Citi
11,Feb 11,Take the humor and leave the venom people,0,samosalove,/company/Microsoft/,SEND PRIVATE MESSAGE,/post/Citi-SVP-to-JP-Morgan-VP-Transition-4ZNCUjRE,Citi
12,Feb 13,"GTFO Microsoft! it’s not humor, it’s just lame tech geek",1,king 🤴,/company/Union-Bank/,SEND PRIVATE MESSAGE,/post/Citi-SVP-to-JP-Morgan-VP-Transition-4ZNCUjRE,Citi
0,Apr 15,it’s a bank. do with that info what you will.,0,sableye,/company/Citi/,SEND PRIVATE MESSAGE,/post/Citibank-HrxEvcCX,Citi
1,Apr 15,the analytics org is a shitshow. I’m a PM — it’s just a lot of meetings and governance red tape. but there are some cool projects (google plex). cant say for other places but they never struck me as any different,0,sableye,/company/Citi/,SEND PRIVATE MESSAGE,/post/Citibank-HrxEvcCX,Citi
2,Apr 15,How is the culture? Work life balance/wfh flexibility? Pertaining to the business operations organization,0,blindo007,nan,SEND PRIVATE MESSAGE,/post/Citibank-HrxEvcCX,Citi
3,Apr 14,You need to specify which group within Citi,0,monblank,nan,Finance,/post/Citibank-HrxEvcCX,Citi
4,Apr 15,"WFH depends on the group but the new CEO has said for most employees, 3 days in office / 2 days at home.",0,LBpa80,/company/Citi/,Finance,/post/Citibank-HrxEvcCX,Citi
5,Apr 15,"I don’t understand how this 3+2 benefits anyone except parents(maybe) and those commuting &gt1 hour.Although for a bank, I should say that’s progress",0,PeHY64,/company/TransUnion/,SEND PRIVATE MESSAGE,/post/Citibank-HrxEvcCX,Citi
6,Apr 15,Any ideas on comp range for avps?,0,BM3,/company/Bank-of-America/,SEND PRIVATE MESSAGE,/post/Citibank-HrxEvcCX,Citi
7,Apr 15,Lol I would guess 60k in ops in Tampa to 350k in M&A so the title doesn't tell you much,0,yamihere2,/company/Citi/,SEND PRIVATE MESSAGE,/post/Citibank-HrxEvcCX,Citi
8,Apr 15,"Much appreciated, interviewing with CREB side next week.",0,BM3,/company/Bank-of-America/,SEND PRIVATE MESSAGE,/post/Citibank-HrxEvcCX,Citi
9,Apr 15,Ehhh,0,FARTSTINK,/company/Citi/,HR,/post/Citibank-HrxEvcCX,Citi
10,Apr 15,It's paradise,0,FARTSTINK,/company/Citi/,HR,/post/Citibank-HrxEvcCX,Citi
11,Apr 19,"I do not understand why people are so focused on culture. It’s a bank. They will throw you under the bus when needed and lay you off whenever they want. If you want great culture; empowerment; great leaders etc, be your own boss and work for yourself.",0,YTfg56,/company/Citi/,SEND PRIVATE MESSAGE,/post/Citibank-HrxEvcCX,Citi
0,"Sep 15, 2020",Citigroup is a lay-off champion,6,Aloominium,/company/Apple/,Mgmt,/post/Citi-Announcing-layoffs-LyyXOPgZ,Citi
1,"Sep 16, 2020",how is 1% considered a lay off news when Amazon routinely pip 15% and no news?,2,mulida,/company/Bank-of-America/,SEND PRIVATE MESSAGE,/post/Citi-Announcing-layoffs-LyyXOPgZ,Citi
2,"Sep 16, 2020","It’s law related. If the company is laying off, it needs to be publicly disclosed. While Amazon is “performance related”.",0,GDTJ58,/company/Bank-of-America/,SEND PRIVATE MESSAGE,/post/Citi-Announcing-layoffs-LyyXOPgZ,Citi
3,"Sep 15, 2020","“The new cuts affect less than 1% of the workforce, and with recent hiring, it says overall headcount likely won't show declines.” Sounds like a return to BAU.",1,sableye,/company/Citi/,SEND PRIVATE MESSAGE,/post/Citi-Announcing-layoffs-LyyXOPgZ,Citi
4,"Sep 15, 2020","Oh, Citi always job cuts? Is it annually or quarterly?",0,GDTJ58,/company/Bank-of-America/,SEND PRIVATE MESSAGE,/post/Citi-Announcing-layoffs-LyyXOPgZ,Citi
5,"Sep 15, 2020","oh i don’t know, i thought most companies turnover some small % of workforce during regular times",0,sableye,/company/Citi/,SEND PRIVATE MESSAGE,/post/Citi-Announcing-layoffs-LyyXOPgZ,Citi
6,"Sep 16, 2020",Business as usual and I fee like the push to less expensive cities was happening even before Covid,1,709568,/company/Citi/,SEND PRIVATE MESSAGE,/post/Citi-Announcing-layoffs-LyyXOPgZ,Citi
7,"Sep 15, 2020",https://www.cnbc.com/2020/03/27/bank-of-america-ceo-doesnt-want-employees-worrying-about-their-jobs.html,1,rabb1Ts,/company/Bank-of-America/,Finance,/post/Citi-Announcing-layoffs-LyyXOPgZ,Citi
0,May 10,Which team and role?,0,twigg2,/company/Citi/,SEND PRIVATE MESSAGE,/post/Citi-Interview-5L3qpyto,Citi
1,May 11,"After a week of interview, if you don’t get a reply, you can ask the HR",0,FllO80,/company/Citi/,SEND PRIVATE MESSAGE,/post/Citi-Interview-5L3qpyto,Citi
2,May 12,"AVP cannot reach 170K, it is out of band",0,cJmf02,/company/Citi/,SEND PRIVATE MESSAGE,/post/Citi-Interview-5L3qpyto,Citi
3,6d,Don’t join Citi,0,UHDn48,/company/Citi/,SEND PRIVATE MESSAGE,/post/Citi-Interview-5L3qpyto,Citi
4,3d,Why ?,0,fndR84,/company/JPMorgan/,SEND PRIVATE MESSAGE,/post/Citi-Interview-5L3qpyto,Citi
0,4d,Sun sets sooner in Seattle (more darkness),1,QR‎,nan,SEND PRIVATE MESSAGE,/post/Which-city-has-worse-weather-NYC-or-Seattle-eSkTwwqB,Citi
1,4d,Yeah for a few months of the year the only time I’d see the sun was on weekends or if I went to a cafeteria in a different building.,0,teqsc,/company/Microsoft/,SEND PRIVATE MESSAGE,/post/Which-city-has-worse-weather-NYC-or-Seattle-eSkTwwqB,Citi
2,4d,But long days in summer…,1,FjlU05,/company/Facebook/,SEND PRIVATE MESSAGE,/post/Which-city-has-worse-weather-NYC-or-Seattle-eSkTwwqB,Citi
3,4d,"Having lived in both, weather is much better in Seattle. Same amount of rain (really, it’s true). No snow and better summers.",10,hechalch,/company/TripActions/,SEND PRIVATE MESSAGE,/post/Which-city-has-worse-weather-NYC-or-Seattle-eSkTwwqB,Citi
4,4d,"Lol. I’ve lived in both cities for several years. This isn’t even a question. Nobody who’s lived in both cities for more than a year or two would even ask such a question.NYC weather is mostly good, besides a month or two of very cold weather.Seattle weather is literally the worst weather in the world.",7,C🦠r🦠na,/company/Bloomberg/,SEND PRIVATE MESSAGE,/post/Which-city-has-worse-weather-NYC-or-Seattle-eSkTwwqB,Citi
5,4d,NYC is much better than gloomy Seattle,6,JJHJ58,/company/Comcast/,SEND PRIVATE MESSAGE,/post/Which-city-has-worse-weather-NYC-or-Seattle-eSkTwwqB,Citi
6,4d,NYC gets too hot and you’re expected to wear a suit year round. No thank you.,3,teqsc,/company/Microsoft/,SEND PRIVATE MESSAGE,/post/Which-city-has-worse-weather-NYC-or-Seattle-eSkTwwqB,Citi
7,3d,"This is why linen suits are made, teqsc.",0,rounder,/company/Microsoft/,Eng,/post/Which-city-has-worse-weather-NYC-or-Seattle-eSkTwwqB,Citi
8,2d,No one in engineering has to wear a suit in NYC. Not sure where your getting that impression..,0,fetty1738,/company/Bloomberg/,SEND PRIVATE MESSAGE,/post/Which-city-has-worse-weather-NYC-or-Seattle-eSkTwwqB,Citi
0,Mar 28,"No doubt. Like any Democrat-run city , it’s overrun by scam artists and thugs. Welcome to Biden’s America",20,SeattleNE,/company/Hewlett-Packard-Enterprise/,SEND PRIVATE MESSAGE,/post/NYC-Top-scam-cities-in-the-world-jugnChdj,Citi
1,Mar 28,There's a lot of really good content if you look in the right places. The default subs are trash.,1,slothario,nan,SEND PRIVATE MESSAGE,/post/NYC-Top-scam-cities-in-the-world-jugnChdj,Citi
2,Mar 29,"OP posts about NYC, 40% comments are about politics, another 40% about India, and remaining 20% actually about NYC lol. Classic Blind",2,855f938,/company/BNP-Paribas/,SEND PRIVATE MESSAGE,/post/NYC-Top-scam-cities-in-the-world-jugnChdj,Citi
3,Mar 28,"Never had issues in any of the cities you mentioned tbh, but I've seen all sorts of nonsense in Rome.",17,amogusus,/company/Google/,SEND PRIVATE MESSAGE,/post/NYC-Top-scam-cities-in-the-world-jugnChdj,Citi
4,Mar 29,Roma Caput Mundi,0,Pzfm75,/company/Bumble/,Eng,/post/NYC-Top-scam-cities-in-the-world-jugnChdj,Citi
5,Apr 2,"Rome is too bad, don't go there, only for vacations",0,altoguiso,/company/Amazon/,SEND PRIVATE MESSAGE,/post/NYC-Top-scam-cities-in-the-world-jugnChdj,Citi
6,Mar 28,"Can someone point me to a giant *western* city that doesn't have it's share of sketchy stuff? Morons here making it out to be democrat thing. It's part of living in a big city and always has. it's not all artisanal cupcakes and yogo and never has been. If you dont like it, GTFO and move back to the suburbs",15,eehhhh,/company/Mastercard/,SEND PRIVATE MESSAGE,/post/NYC-Top-scam-cities-in-the-world-jugnChdj,Citi
7,Mar 28,Have you been to New orleans? NYC will feellike a super safe place if you stay there for some time..,13,amaa zan,/company/Amazon/,SEND PRIVATE MESSAGE,/post/NYC-Top-scam-cities-in-the-world-jugnChdj,Citi
8,Mar 28,No I haven’t been to New Orleans.,0,MrMicro,/company/Microsoft/,SEND PRIVATE MESSAGE,/post/NYC-Top-scam-cities-in-the-world-jugnChdj,Citi
9,Mar 28,"Can't say about NY but I've had a very negative experience with landlords and dentists in SF, something I didn't notice in the rest of the Bay.",13,gamaken,/company/Volvo/,R&D,/post/NYC-Top-scam-cities-in-the-world-jugnChdj,Citi
10,Mar 28,"I have an amazing dentist in SF - top quality, super honest. He is unique, I suppose.",0,⛑,/company/Facebook/,Creative,/post/NYC-Top-scam-cities-in-the-world-jugnChdj,Citi
0,"Oct 6, 2020",Usually 1 coding + 2 technical discussion + 1 hiring manager round + 1 independent assessment,1,mm@nerd,/company/Citi/,SEND PRIVATE MESSAGE,/post/Citi-recruitment-process-PzWXxPYp,Citi
1,"Oct 6, 2020","thanks, so it is like behavioral interview",0,wfhnude,/company/Bank-of-America/,SEND PRIVATE MESSAGE,/post/Citi-recruitment-process-PzWXxPYp,Citi
2,"Oct 6, 2020","Contact the recruiter, he/she will give you an update or seek to get you one.Good luck!",0,c_on_sk,/company/Citi/,SEND PRIVATE MESSAGE,/post/Citi-recruitment-process-PzWXxPYp,Citi
3,"Oct 10, 2020",Can someone provide Citi TC please for a software engineer? Include yoe as you know,0,c1ceo,/company/Capital-One/,SEND PRIVATE MESSAGE,/post/Citi-recruitment-process-PzWXxPYp,Citi
4,"Oct 31, 2020",How about an svp or a director .. what are the salary  brackets for these roles in tech,0,nfnY63,/company/Morgan-Stanley/,SEND PRIVATE MESSAGE,/post/Citi-recruitment-process-PzWXxPYp,Citi
5,"Oct 31, 2020","svp 200K + 30%, Director TC 500K",0,popbunny,/company/Bank-of-America/,SEND PRIVATE MESSAGE,/post/Citi-recruitment-process-PzWXxPYp,Citi
6,"Oct 6, 2020",Took me 6 months from offer to on boarding. Damn slow...,1,crqx16,/company/Citi/,SEND PRIVATE MESSAGE,/post/Citi-recruitment-process-PzWXxPYp,Citi
7,"Oct 6, 2020","wow that is insane, but you need to give them anticipated start date right?",0,wfhnude,/company/Bank-of-America/,SEND PRIVATE MESSAGE,/post/Citi-recruitment-process-PzWXxPYp,Citi
8,"Oct 6, 2020",Yeah. That doesn’t matter though. Sometime budget takes longer to get approved.,0,crqx16,/company/Citi/,SEND PRIVATE MESSAGE,/post/Citi-recruitment-process-PzWXxPYp,Citi
9,"Oct 6, 2020","Applied September, one phone call in October, then invited to interview in December. Got offer letter exactly 7 days later",1,3M LIBOR,/company/Citi/,SEND PRIVATE MESSAGE,/post/Citi-recruitment-process-PzWXxPYp,Citi
10,"Oct 6, 2020",Gave offer right away. Gave me 24 hours to decide,0,3M LIBOR,/company/Citi/,SEND PRIVATE MESSAGE,/post/Citi-recruitment-process-PzWXxPYp,Citi
11,"Oct 6, 2020","oh I see, do they give you anticipated start date or you can select a day?",0,wfhnude,/company/Bank-of-America/,SEND PRIVATE MESSAGE,/post/Citi-recruitment-process-PzWXxPYp,Citi
12,"Oct 7, 2020",Treat it like you got rejected.. focus on other ops,1,jLjF70,nan,SEND PRIVATE MESSAGE,/post/Citi-recruitment-process-PzWXxPYp,Citi
13,"Oct 8, 2020",I agree - then any other news is either a confirmation or a plus,0,fskB53,/company/Everfi/,SEND PRIVATE MESSAGE,/post/Citi-recruitment-process-PzWXxPYp,Citi
0,"Oct 2, 2020",Had “business review” before for weeks until it turned to “process completed”. No offer was made. Automated rejection after weeks in business review status. I think it can go both ways - offer or none.,1,aHhi53,/company/JPMorgan/,SEND PRIVATE MESSAGE,/post/Application-status-change-for-citi-bank-zVRrmMJ6,Citi
1,"Nov 29, 2020",And process complete means you’ve been rejected.,0,YTfg56,/company/Citi/,SEND PRIVATE MESSAGE,/post/Application-status-change-for-citi-bank-zVRrmMJ6,Citi
2,"Oct 3, 2020","It means the recruiter sent your resume to the hiring manager... he/she is checking it out. In case, the HM is interested on you, you'll have a first screen... Otherwise, your application's status would change to Process Complete",0,bitUS,/company/Amazon/,SEND PRIVATE MESSAGE,/post/Application-status-change-for-citi-bank-zVRrmMJ6,Citi
3,"Oct 2, 2020","That's the least helpful status in the entire process. It'll stay that way till you finish all your interviews, get an offer, sign it, and the background check is finished.",0,shittybank,/company/Citi/,SEND PRIVATE MESSAGE,/post/Application-status-change-for-citi-bank-zVRrmMJ6,Citi
4,"Oct 1, 2020",Sounds like it just went from sitting in the pile to actually on someone’s desk and being reviewed. Agreed that one shouldn’t read too into it though,0,47802,/company/Citi/,SEND PRIVATE MESSAGE,/post/Application-status-change-for-citi-bank-zVRrmMJ6,Citi
0,May 12,Background check is a pretty long process. Mine came back after 2 months. You can start the job even when the background check still in process.,1,FllO80,/company/Citi/,SEND PRIVATE MESSAGE,/post/Citi-background-check-Aftxe7im,Citi
1,May 13,I had discussion with recruiter last week about compensation. I have not received any offer till now. How much time does it take from compensation discussion to getting offer ?,0,fndR84,/company/JPMorgan/,SEND PRIVATE MESSAGE,/post/Citi-background-check-Aftxe7im,Citi
2,May 13,Generally in a week or 2,0,FllO80,/company/Citi/,SEND PRIVATE MESSAGE,/post/Citi-background-check-Aftxe7im,Citi
3,4d,"It can take some time for the final offer letter to come to you as there are multiple steps involved to get the letter out. So I would say, stay connected with your recruiter for updates. Background checks obviously take time but you are allowed to start after basic info has been verified, subject to background clearance eventually coming through.",0,int.gypsy,/company/Citi/,SEND PRIVATE MESSAGE,/post/Citi-background-check-Aftxe7im,Citi
4,4d,"Challenge I have offer from other institute and I have join it soon. I prefer this opportunity over other as I got to know from someone who worked in that team , they are using outdated technologies. Whereas I was told they are revamping to new tech stack. If I join other company it will reflect in background check and not sure what should I tell recruiter in Citibank",0,fndR84,/company/JPMorgan/,SEND PRIVATE MESSAGE,/post/Citi-background-check-Aftxe7im,Citi
0,Jan 7,You’re actually taking a pay cut. NYC is a lot more expensive,62,gtlate,/company/Facebook/,SEND PRIVATE MESSAGE,/post/NYC-vs-LA-Cpdh065m,Citi
1,Jan 8,"Whattono12, are you out of your mind (or not leaving the Chelsea bubble at all)?",2,Leroy,/company/eBay/,SEND PRIVATE MESSAGE,/post/NYC-vs-LA-Cpdh065m,Citi
2,Jan 8,"2600 now gets you a 1bd even in Soho and Greenwich village. Or a 2bd in nolita, Chinatown, and certain parts of Williamsburg.",0,Leroy,/company/eBay/,SEND PRIVATE MESSAGE,/post/NYC-vs-LA-Cpdh065m,Citi
3,Jan 8,"I'm surprised to see so much love for LA here to be honest. I moved nyc to la and back. NYC is more expensive for an apartment depending on what your standards are but there are tons of new high rises and you can get s great deal right now.LA is just a massive suburb with lots of great stuff but so spread out. I always felt i needed a plan to do things. And it's a day time city for the most part thanks in part to the weather.NYC in the other hand is a true city. It's massive and small at the same time. Live in most any neighborhood close to Manhattan (including in one of the other boroughs) and it's easy to get anywhere. Yes it can get cold in winter and humid in the summer ... Idk it's weather you deal, in fact the hole city changes from season to season. Rooftops and patios in the summer. Mulled wine and hot toddys in the winter. Being the city that never sleeps there is always things to do and lots of events coming to the city. Lastly my favorite part: new experiences tend to find you on the street. You just walk into the most amazing wine bar or spontaneous street band... Things that are harder to do in LA where you're in the car constantly and everything is a bit more closed.Idk LA just never gave me that. In the end it's a personal choice. But if you're in for some excitement I think NYC is a great place.Btw ask for s TC bump. NYC/SF is worth at least 10K more then LA",69,akvashi,/company/Square/,SEND PRIVATE MESSAGE,/post/NYC-vs-LA-Cpdh065m,Citi
4,Feb 24,People often forget that you can enjoy outdoor activities in NY if you have a car.,1,Twttr,/company/Twitter/,Eng,/post/NYC-vs-LA-Cpdh065m,Citi
5,Feb 26,Lived in NYC for a summer. Agree with you 100%. My best 4 months of my life,0,naandri,/company/LinkedIn/,SEND PRIVATE MESSAGE,/post/NYC-vs-LA-Cpdh065m,Citi
6,Jan 8,"You're moving from shitty heaven to fun hell, do it",59,m_p_c,/company/Google/,SEND PRIVATE MESSAGE,/post/NYC-vs-LA-Cpdh065m,Citi
7,Jan 13,"26 y/o in LA PWM speaking: the analogy works because LA is paradise on fire. This city wasn’t built for ~25-30+ million people. NYC is very very fun, however it gets cold as a mother fucker and is much more dense from a population standpoint if you’re talking about Manhattan. Pick your poison",4,hamishloch,/company/UBS/,SEND PRIVATE MESSAGE,/post/NYC-vs-LA-Cpdh065m,Citi
8,Jan 14,"La is way to fake, but nyc is way tooooo real. Love it. Live there for a while and you’ll never regret the experience. But be prepared, the city will knock you out every chance it gets.",0,hQlx67,/company/Scotiabank/,SEND PRIVATE MESSAGE,/post/NYC-vs-LA-Cpdh065m,Citi
9,Jan 7,Buy some winter clothes and prepare for some nasty humidity in the summer,52,snap,/company/Snap/,SEND PRIVATE MESSAGE,/post/NYC-vs-LA-Cpdh065m,Citi
10,Jan 8,and stinky Manhattan,1,zorro13,/company/Rubicon%20Project/,SEND PRIVATE MESSAGE,/post/NYC-vs-LA-Cpdh065m,Citi
11,Jan 8,True that,0,Haldas,/company/Wayfair/,SEND PRIVATE MESSAGE,/post/NYC-vs-LA-Cpdh065m,Citi
12,Jan 8,More interesting and smart people in NYC than LA.,29,LiQj16,/company/Tala/,SEND PRIVATE MESSAGE,/post/NYC-vs-LA-Cpdh065m,Citi
13,Jan 11,This. People never mention this.,4,rCcK45,nan,SEND PRIVATE MESSAGE,/post/NYC-vs-LA-Cpdh065m,Citi
14,Jan 21,+1 After living in LA many years and NYC 5 years I would also argue that NYC people on average are also more friendly with less judgement (nobody cares about what other people do) despite the reputations. As long as you know how to walk.,16,wdfvfr22,/company/IBM/,SEND PRIVATE MESSAGE,/post/NYC-vs-LA-Cpdh065m,Citi
0,"Nov 7, 2020",I think you should worry about high balling your title too !! Seriously VP ? As in Vice President ??,1,blasphemy!,/company/Intuit/,SEND PRIVATE MESSAGE,/post/VP-Salary-compensation-band-at-Citibank-Corporate-Finance-O3iGKZ4P,Citi
1,"Nov 17, 2020",At JPMC VPs make anywhere from $120k to $800k.,0,Hank Hill,/company/Speedway/,Eng,/post/VP-Salary-compensation-band-at-Citibank-Corporate-Finance-O3iGKZ4P,Citi
2,"Nov 25, 2020",In finance the VP title isn't that high up. You're not taking over if the president dies.,0,tooQ10,/company/Rakuten/,Ops,/post/VP-Salary-compensation-band-at-Citibank-Corporate-Finance-O3iGKZ4P,Citi
3,"Nov 9, 2020",Came across with this salary range sheet from the other post in Blind. Hope this helps,19,ykhp,/company/Citi/,SEND PRIVATE MESSAGE,/post/VP-Salary-compensation-band-at-Citibank-Corporate-Finance-O3iGKZ4P,Citi
4,"Nov 28, 2020",Aka jump ship every few years to get any proper raise,0,YTfg56,/company/Citi/,SEND PRIVATE MESSAGE,/post/VP-Salary-compensation-band-at-Citibank-Corporate-Finance-O3iGKZ4P,Citi
5,"Nov 28, 2020","Both of those figures are _way_ ahead of what I get doing generic operations/trade settlement work, so I'm trying to figure out what a job like mine would map to at Citibank and what it would pay.  Do levels like C5 and B10 fit with operations jobs?",0,tooQ10,/company/Rakuten/,Ops,/post/VP-Salary-compensation-band-at-Citibank-Corporate-Finance-O3iGKZ4P,Citi
6,"Nov 9, 2020",A VP in FPA/Corp finance should be 150+ base and then a 20%+ bonus. You are lowballing,1,hQlx67,/company/Scotiabank/,SEND PRIVATE MESSAGE,/post/VP-Salary-compensation-band-at-Citibank-Corporate-Finance-O3iGKZ4P,Citi
7,"Nov 10, 2020",Yep. That's probably the plan at this point especially since they've been screwing me in pay for a couple of years already...Hoping to get the promo and then to use it as a stepping stone,0,WhyAmIPoor,/company/Citi/,SEND PRIVATE MESSAGE,/post/VP-Salary-compensation-band-at-Citibank-Corporate-Finance-O3iGKZ4P,Citi
8,"Nov 10, 2020",It’s a bank. They’ll always screw you unless you have an MD vouching for you.,2,hQlx67,/company/Scotiabank/,SEND PRIVATE MESSAGE,/post/VP-Salary-compensation-band-at-Citibank-Corporate-Finance-O3iGKZ4P,Citi
