,comment_date,comment_text,comment_like,comment_user,comment_firm,comment_position,comment_url,company
0,"May 1, 2020",I got my signing bonus about two weeks before my start date.,2,crux007,/company/Goldman-Sachs/,SEND PRIVATE MESSAGE,/post/Goldman-Sachs-Incoming-Class-2020-ojiRkRAV,Goldman-Sachs
1,"May 1, 2020",Yes that's what they told me when I asked. Engineering.,0,crux007,/company/Goldman-Sachs/,SEND PRIVATE MESSAGE,/post/Goldman-Sachs-Incoming-Class-2020-ojiRkRAV,Goldman-Sachs
2,"May 1, 2020",That’s solid. Which office?,0,donhu,/company/Apple/,SEND PRIVATE MESSAGE,/post/Goldman-Sachs-Incoming-Class-2020-ojiRkRAV,Goldman-Sachs
3,"May 1, 2020",98% of GS employees are working from home now. expect delays.,2,ftnt,/company/Fortinet/,SEND PRIVATE MESSAGE,/post/Goldman-Sachs-Incoming-Class-2020-ojiRkRAV,Goldman-Sachs
4,"May 1, 2020",Sign-on bonus comes with first pay cheque,1,votedfeet,/company/Microsoft/,SEND PRIVATE MESSAGE,/post/Goldman-Sachs-Incoming-Class-2020-ojiRkRAV,Goldman-Sachs
5,"May 1, 2020",They said we would get it after clearing background check,0,donhu,/company/Apple/,SEND PRIVATE MESSAGE,/post/Goldman-Sachs-Incoming-Class-2020-ojiRkRAV,Goldman-Sachs
6,"May 2, 2020","Fair, didn’t happen to me at GS.",0,votedfeet,/company/Microsoft/,SEND PRIVATE MESSAGE,/post/Goldman-Sachs-Incoming-Class-2020-ojiRkRAV,Goldman-Sachs
7,"May 7, 2020","The Bonus shall be handed out once your background check is complete.If your bank details are already on file with them( probably if you interned prior ), you’ll get it then.But I assume, if that’s not the case, you should get it with your paycheck.I got my bonus amount in the pay cycle just preceding my joining.Also, feel free to reach out to your recruiter to enquire about it. They’re very co-operative with all this, from my experience.",0,qctp42,/company/Goldman-Sachs/,SEND PRIVATE MESSAGE,/post/Goldman-Sachs-Incoming-Class-2020-ojiRkRAV,Goldman-Sachs
8,"May 7, 2020","i assume it is after tax net payment, right?",0,ftnt,/company/Fortinet/,SEND PRIVATE MESSAGE,/post/Goldman-Sachs-Incoming-Class-2020-ojiRkRAV,Goldman-Sachs
9,"May 7, 2020",@ftnt yes it is 😭,0,crux007,/company/Goldman-Sachs/,SEND PRIVATE MESSAGE,/post/Goldman-Sachs-Incoming-Class-2020-ojiRkRAV,Goldman-Sachs
10,"May 12, 2020",Try for other company in parallel. We can guarantee any thing in this uncertain times,0,harryPot,/company/Cisco/,SEND PRIVATE MESSAGE,/post/Goldman-Sachs-Incoming-Class-2020-ojiRkRAV,Goldman-Sachs
0,Jan 20,"There's a meeting that usually happens one day after super day where all candidates are discussed and decisions are made. So you should hear back by Friday. Sometimes it takes longer for some candidates when they pass the bar but their skillet might not be suited to the interviewing teams for that day, so HCM tries to place them elsewhere.Keep in mind it's bonus day tomorrow so I'd give it until Monday anyway.",0,RAhU54,/company/Goldman-Sachs/,SEND PRIVATE MESSAGE,/post/Goldman-Sachs-super-day-xiZAPFEi,Goldman-Sachs
1,Jan 22,It all depends....I don't like the whole process and gs can do much better when hiring. When it's a definite no from the team they would've given that feedback to HCM in the debrief call which happens the day after super day. Is it for an engineering role?,0,RAhU54,/company/Goldman-Sachs/,SEND PRIVATE MESSAGE,/post/Goldman-Sachs-super-day-xiZAPFEi,Goldman-Sachs
2,Jan 24,"Gotcha. It’s for a finance role, and I don’t know why it’s taking so long or if they just put me on waitlist...",0,CJDx76,/company/Deloitte/,SEND PRIVATE MESSAGE,/post/Goldman-Sachs-super-day-xiZAPFEi,Goldman-Sachs
3,Jan 20,Usually no response is a no. But reach out to your recruiter for updates to see. Sometimes it depends on the team,0,IB-Ops,/company/Goldman-Sachs/,SEND PRIVATE MESSAGE,/post/Goldman-Sachs-super-day-xiZAPFEi,Goldman-Sachs
4,Jan 20,Yeah I’m thinking reaching out this week.,0,CJDx76,/company/Deloitte/,SEND PRIVATE MESSAGE,/post/Goldman-Sachs-super-day-xiZAPFEi,Goldman-Sachs
5,Jan 20,"For me, it took a day, had super day Thursday, heard back Friday. But I don’t think there is a standard that confirms delay means “no”",0,msp4,/company/Goldman-Sachs/,Eng,/post/Goldman-Sachs-super-day-xiZAPFEi,Goldman-Sachs
6,Jan 20,That’s quick! I had mine last Thursday but no response yet. I’m really in limbo now...,0,CJDx76,/company/Deloitte/,SEND PRIVATE MESSAGE,/post/Goldman-Sachs-super-day-xiZAPFEi,Goldman-Sachs
7,Jan 20,lol for me it took like 2 months,0,binaryd,/company/Goldman-Sachs/,SEND PRIVATE MESSAGE,/post/Goldman-Sachs-super-day-xiZAPFEi,Goldman-Sachs
8,Jan 20,This gives me some hope lol. Did you follow up during the time or just wait 2 months straight for the result?,0,CJDx76,/company/Deloitte/,SEND PRIVATE MESSAGE,/post/Goldman-Sachs-super-day-xiZAPFEi,Goldman-Sachs
0,Feb 15,No.GS is far worse than Amazon. And Amazon gets a bad rap on blind.,13,Iol,/company/Goldman-Sachs/,SEND PRIVATE MESSAGE,/post/Moving-from-Amazon-to-Goldman-Sachs-aZrO5GDN,Goldman-Sachs
1,Feb 15,so how come y’all do not get bad rep on blind?,1,twsted,nan,SEND PRIVATE MESSAGE,/post/Moving-from-Amazon-to-Goldman-Sachs-aZrO5GDN,Goldman-Sachs
2,Feb 15,We live up to our reputation as a wall street bank. Amazon missed the mark as a tech company by the way it treats its employers. Dont go to walk street if you want to be treated like a toddler,3,peen,/company/Goldman-Sachs/,SEND PRIVATE MESSAGE,/post/Moving-from-Amazon-to-Goldman-Sachs-aZrO5GDN,Goldman-Sachs
3,Feb 15,Don't.,9,QsfD8K,/company/Goldman-Sachs/,SEND PRIVATE MESSAGE,/post/Moving-from-Amazon-to-Goldman-Sachs-aZrO5GDN,Goldman-Sachs
4,Feb 16,Don’t ever ever ever!,6,xorxx,/company/Goldman-Sachs/,SEND PRIVATE MESSAGE,/post/Moving-from-Amazon-to-Goldman-Sachs-aZrO5GDN,Goldman-Sachs
5,Feb 15,VP is mid level at GS. It’s not prestigious. Everyone is a VP,1,🤑PaisaBro🤑,/company/Amazon/,SEND PRIVATE MESSAGE,/post/Moving-from-Amazon-to-Goldman-Sachs-aZrO5GDN,Goldman-Sachs
6,Feb 16,"VP has nothing to with Role. It's just a fancy title.Me, my manager and his manager all are VP.Internally, we act as senior engg, tech lead and engg mgr respectively.",1,ToTheMars,/company/Goldman-Sachs/,SEND PRIVATE MESSAGE,/post/Moving-from-Amazon-to-Goldman-Sachs-aZrO5GDN,Goldman-Sachs
7,Feb 18,I'm not a VP either,0,* *,/company/Goldman-Sachs/,Eng,/post/Moving-from-Amazon-to-Goldman-Sachs-aZrO5GDN,Goldman-Sachs
8,Feb 16,"I haven’t met many VPs that could consistently break $300k in TC. I think VPs on that pay grade are normally on track to make MD, or likely serving in some managerial capacity.They’ll give you a package that looks good the first year, but trust me that doesn’t mean it’ll be that the next year. It might even be less.",4,gsguy,/company/Goldman-Sachs/,SEND PRIVATE MESSAGE,/post/Moving-from-Amazon-to-Goldman-Sachs-aZrO5GDN,Goldman-Sachs
0,"Sep 18, 2019",Bachelor nyc,1,eljE63,/company/Regeneron/,SEND PRIVATE MESSAGE,/post/Goldman-Sachs-TC-Za0FYGr2,Goldman-Sachs
1,"Sep 18, 2019",I guess not bad,1,eljE63,/company/Regeneron/,SEND PRIVATE MESSAGE,/post/Goldman-Sachs-TC-Za0FYGr2,Goldman-Sachs
2,"Oct 25, 2019",Do you know how much is for Master NYC and 10 YOE?,0,gdaO18,/company/Wayfair/,SEND PRIVATE MESSAGE,/post/Goldman-Sachs-TC-Za0FYGr2,Goldman-Sachs
3,"Sep 18, 2019",But don't expect much for year 2/3 or later. That's how GS gets you.They have top talent - they just don't know how to retain it,3,kach1947,/company/Goldman-Sachs/,SEND PRIVATE MESSAGE,/post/Goldman-Sachs-TC-Za0FYGr2,Goldman-Sachs
4,"Sep 18, 2019",Can you explain more,1,eljE63,/company/Regeneron/,SEND PRIVATE MESSAGE,/post/Goldman-Sachs-TC-Za0FYGr2,Goldman-Sachs
5,"Sep 18, 2019",Master's or bachelor or PhD?,0,l33tcode1,/company/Goldman-Sachs/,SEND PRIVATE MESSAGE,/post/Goldman-Sachs-TC-Za0FYGr2,Goldman-Sachs
6,"Sep 18, 2019",+ location,0,MRgw62,/company/Goldman-Sachs/,SEND PRIVATE MESSAGE,/post/Goldman-Sachs-TC-Za0FYGr2,Goldman-Sachs
0,Apr 23,"Yes, Even received official approval confirmation. GS is really slow in the process.Did you confirm your team? After that it would take more than a week. I wrote emails and called no response. They will respond very slowly.",0,v!s@,/company/Visa/,IT,/post/Goldman-Sachs-offer-timeline-WzX2rveg,Goldman-Sachs
1,Apr 23,The recruiter coincidently got in touch with me on the same day. Offer was extended and some other formalities are pending.I think its mainly the approval process for the TC that takes time.,0,warrior4$,/company/Wayfair/,SEND PRIVATE MESSAGE,/post/Goldman-Sachs-offer-timeline-WzX2rveg,Goldman-Sachs
2,Apr 23,Yea I think it’s gonna take time.For what position you got selected? What was your YOE?,0,v!s@,/company/Visa/,IT,/post/Goldman-Sachs-offer-timeline-WzX2rveg,Goldman-Sachs
3,Apr 23,Why are you moving from wayfair to GS?,0,alreadypip,/company/Amazon/,SEND PRIVATE MESSAGE,/post/Goldman-Sachs-offer-timeline-WzX2rveg,Goldman-Sachs
4,Apr 23,I havent said I accepted the offer!,0,warrior4$,/company/Wayfair/,SEND PRIVATE MESSAGE,/post/Goldman-Sachs-offer-timeline-WzX2rveg,Goldman-Sachs
5,Apr 19,Just went through the process myself and it took about a week to 10 days. Are you finished with the interview process?,0,NYCtoTX16,nan,SEND PRIVATE MESSAGE,/post/Goldman-Sachs-offer-timeline-WzX2rveg,Goldman-Sachs
6,Apr 23,"Yes, GMS has a process that takes time. Keep in touch with your recruiter for updates. They're helpful.",0,warrior4$,/company/Wayfair/,SEND PRIVATE MESSAGE,/post/Goldman-Sachs-offer-timeline-WzX2rveg,Goldman-Sachs
0,Mar 10,"For 1 Yoe, you would probably have 2 DS rounds, 1 system design/past work and 1 HM round",1,|\m/|,/company/Goldman-Sachs/,SEND PRIVATE MESSAGE,/post/Goldman-Superday-Reviews-6pcuFmoU,Goldman-Sachs
1,Mar 10,I used to do the super day interviews (not for tech though). Each interviewer focuses on different competencies and at least 1-2 (but probably half) will ask technical questions.,1,hQlx67,/company/Scotiabank/,SEND PRIVATE MESSAGE,/post/Goldman-Superday-Reviews-6pcuFmoU,Goldman-Sachs
0,"Feb 21, 2020","I graduated from one of the premier institutes and joined as a Strat in one of the ""revenue generating functions"" in Bangalore. I was paid ""NORTH"" of 70L with around 5-6 years experience. It was all cash including bonus. The work was okay. I wouldn't say it was very challenging. Everyone were grossly overpaid and it's very hard to find another company which will pay as much. Most of the critical work happens only in NY/LDN and work is pretty mundane in Bangalore. To put things in perspective, people even in support functions in GS Bangalore get paid north of 50L and the people in the team are not even good. If u want to get rich quick and ok doing some serious junk work, GS Bangalore is THE place to work in. Even though I would easily be paid more than 1 Cr if I ever decide to re-join GS Bangalore, the work is so brain numbing that I would rather stay jobless.",4,jaygarrick,/company/Goldman-Sachs/,SEND PRIVATE MESSAGE,/post/Goldman-Sachs-India-Comp-70-lacs-PSEfDYN5,Goldman-Sachs
1,"Mar 28, 2020",I get that work can go on late into night because of meetings in US day time but why should folks stay back in office. Why can't they attend the meetings from home$,0,naja,/company/PayPal/,Eng,/post/Goldman-Sachs-India-Comp-70-lacs-PSEfDYN5,Goldman-Sachs
2,"Mar 29, 2020",It's not just calls late at night. People start their day quite late and work late into the night. Most of the guys were bachelors so ended up staying at work.,1,jaygarrick,/company/Goldman-Sachs/,SEND PRIVATE MESSAGE,/post/Goldman-Sachs-India-Comp-70-lacs-PSEfDYN5,Goldman-Sachs
3,"Feb 20, 2020",What's strats?,4,DireCrates,/company/Air-Liquide/,Data,/post/Goldman-Sachs-India-Comp-70-lacs-PSEfDYN5,Goldman-Sachs
4,"Feb 20, 2020","Strats are known to work 70+ hours a week too!Btw, most of core tech for GS is moving to Dallas, Bangalore and SLC so not surprising that you will see many of these high paying roles in future too. Marcus is completely built out of Bangalore with only the heads of division sitting in NY.",2,/_-_/,/company/Goldman-Sachs/,Eng,/post/Goldman-Sachs-India-Comp-70-lacs-PSEfDYN5,Goldman-Sachs
5,Jan 28,How is the wlb and work culture in consumer division?,0,thangbali,/company/Adobe/,SEND PRIVATE MESSAGE,/post/Goldman-Sachs-India-Comp-70-lacs-PSEfDYN5,Goldman-Sachs
6,"Feb 20, 2020","Uh what! Are they working in strats? When GS came to my college in India in 2016, they were offering 20 for SDE.Even Tower might not be paying that much to it’s engineers in Gurgaon.",1,klokov_v3,/company/Esri/,SEND PRIVATE MESSAGE,/post/Goldman-Sachs-India-Comp-70-lacs-PSEfDYN5,Goldman-Sachs
7,"Feb 20, 2020","Yeah, that’s the only plausible explanation.",0,klokov_v3,/company/Esri/,SEND PRIVATE MESSAGE,/post/Goldman-Sachs-India-Comp-70-lacs-PSEfDYN5,Goldman-Sachs
8,"Feb 20, 2020",But these are strats in non-revenue teams who are basically software devs for the most part.,0,Willyvanka,/company/Goldman-Sachs/,SEND PRIVATE MESSAGE,/post/Goldman-Sachs-India-Comp-70-lacs-PSEfDYN5,Goldman-Sachs
9,"Mar 28, 2020","Of the 70L what is the typical guarented base & what is the bonus. Because I understand banks are heavy on bonus.If it's 50-50, then having a base of 35L is not uncommon. US tech companies also give RSUs of 15-20L a year. So 50-55L with a decent sustainable WLB.",1,naja,/company/PayPal/,Eng,/post/Goldman-Sachs-India-Comp-70-lacs-PSEfDYN5,Goldman-Sachs
0,"Apr 5, 2019","Just for practice, never go to bank IT",7,kkawii,/company/Amazon/,SEND PRIVATE MESSAGE,/post/Goldman-Sachs-Marcus-CmgbyZ4C,Goldman-Sachs
1,"Apr 5, 2019","If you’re going to go to a bank, GS is one of the better ones.And the Marcus product would probably be a better experience in terms of liking what you do, compared to all the other mundane stuff that goes on in bank tech divisions.",0,sixty60,/company/Microsoft/,SEND PRIVATE MESSAGE,/post/Goldman-Sachs-Marcus-CmgbyZ4C,Goldman-Sachs
2,"Apr 5, 2019",Bank IT is for lost souls who love low TC,0,MojaveX,/company/Apple/,SEND PRIVATE MESSAGE,/post/Goldman-Sachs-Marcus-CmgbyZ4C,Goldman-Sachs
3,"Apr 5, 2019",Met with a data engineering manager at Marcus. Was clueless about data engineering,1,NcEf26,nan,SEND PRIVATE MESSAGE,/post/Goldman-Sachs-Marcus-CmgbyZ4C,Goldman-Sachs
4,"Apr 5, 2019",Lmao,0,agEA34,nan,SEND PRIVATE MESSAGE,/post/Goldman-Sachs-Marcus-CmgbyZ4C,Goldman-Sachs
5,"Apr 5, 2019","I wrote the core real time data engineering at another bank. We executed it really well, interviewed at Marcus, showed them our architecture. Their response was that docker, ansible, and spark streaming was “fancy”. Engineering manager was curious about a migration to aws from internal servers, but was clueless about the solutions I provided. I could go on...",1,NcEf26,nan,SEND PRIVATE MESSAGE,/post/Goldman-Sachs-Marcus-CmgbyZ4C,Goldman-Sachs
6,"Apr 5, 2019","Pretty sure Goldman fires the bottom 15% every year, just like Amazon fires the bottom 5-10%, depending on the dept.Like Amazon, this interview and potential offer should be for practice and TC negotiation only, respectively.",2,iVX372,/company/Bloomberg/,Eng,/post/Goldman-Sachs-Marcus-CmgbyZ4C,Goldman-Sachs
7,"Apr 6, 2019",You mean interview with amazon is still for practice?,0,8jah,/company/Amazon/,SEND PRIVATE MESSAGE,/post/Goldman-Sachs-Marcus-CmgbyZ4C,Goldman-Sachs
8,"Apr 6, 2019",Both companies should only be for practice and TC negotiation,0,iVX372,/company/Bloomberg/,Eng,/post/Goldman-Sachs-Marcus-CmgbyZ4C,Goldman-Sachs
9,"Apr 5, 2019",Marcus is the name of your recruiter?,2,PartyStick,/company/Rubrik/,SEND PRIVATE MESSAGE,/post/Goldman-Sachs-Marcus-CmgbyZ4C,Goldman-Sachs
10,"Apr 5, 2019",https://www.marcus.com/us/en/savings,0,JusVirtual,/company/Microsoft/,SEND PRIVATE MESSAGE,/post/Goldman-Sachs-Marcus-CmgbyZ4C,Goldman-Sachs
11,"Apr 5, 2019",GS cloud,0,JusVirtual,/company/Microsoft/,Eng,/post/Goldman-Sachs-Marcus-CmgbyZ4C,Goldman-Sachs
12,"Apr 5, 2019","TC!! But again, if work is in NY.. think about living cost and blah blah, in short.. nothing !",0,JusVirtual,/company/Microsoft/,SEND PRIVATE MESSAGE,/post/Goldman-Sachs-Marcus-CmgbyZ4C,Goldman-Sachs
13,"Apr 5, 2019",They contacted me before but I ignored them. Don’t want more leetcode!,0,🐨koala,/company/Oscar-Health/,SEND PRIVATE MESSAGE,/post/Goldman-Sachs-Marcus-CmgbyZ4C,Goldman-Sachs
0,"Aug 19, 2020","Does GS pay SWE well? Always bamboozled by people wanting to work there, isn’t it only prestigious for Investment Banking?",0,rocij,/company/Google/,Eng,/post/Goldman-Sachs-superday-internship-Fm3WW5Lx,Goldman-Sachs
1,"Aug 20, 2020",It’s a super posh intern experience as well. Interns get housed in a ritzy hotel for a like a week or something then corporate housing. Tons of networking events. Food and booze. Then it all dies if you get employed here.,1,maae11,/company/Goldman-Sachs/,SEND PRIVATE MESSAGE,/post/Goldman-Sachs-superday-internship-Fm3WW5Lx,Goldman-Sachs
2,"Aug 20, 2020",No more corporate housing. Not in 2020 or 2019.It all does die down lol,0,blah8w8w,/company/Goldman-Sachs/,SEND PRIVATE MESSAGE,/post/Goldman-Sachs-superday-internship-Fm3WW5Lx,Goldman-Sachs
0,Feb 14,"Team has great people, and being in SLC means even when things go wrong you won’t be working too late (since NYC is ahead) If you are comped well for the work you do, then it’s a challenging solid team.",0,CJUk51,/company/Goldman-Sachs/,SEND PRIVATE MESSAGE,/post/Goldman-sachs-team-tDjTcCqX,Goldman-Sachs
1,Feb 20,The team that I will be interviewing is futures client engineeriing operations team.Any idea about the team,0,rookie1235,/company/Visa/,SEND PRIVATE MESSAGE,/post/Goldman-sachs-team-tDjTcCqX,Goldman-Sachs
2,Feb 13,What is fco,0,rookie1235,/company/Visa/,SEND PRIVATE MESSAGE,/post/Goldman-sachs-team-tDjTcCqX,Goldman-Sachs
3,Feb 14,“Fees and commissions Operations”,0,CJUk51,/company/Goldman-Sachs/,SEND PRIVATE MESSAGE,/post/Goldman-sachs-team-tDjTcCqX,Goldman-Sachs
4,Feb 13,Futures on the FCO team?,0,:)),/company/Goldman-Sachs/,SEND PRIVATE MESSAGE,/post/Goldman-sachs-team-tDjTcCqX,Goldman-Sachs
0,"Aug 20, 2020",HCM takes centuries to get back to you don't worry.,3,thetraedro,/company/Goldman-Sachs/,SEND PRIVATE MESSAGE,/post/Goldman-Sachs-Interview-k1ZTsf7n,Goldman-Sachs
1,"Aug 27, 2020",Perhaps it tells you about their company/team's culture? There are many veteran academicians in an HFT firm that I just interned. I would imagine you would be a good fit. Also some of them are making big bucks these days and are hiring aggressively. It could be a good time jumping to the buyside.,1,LtSd06,/company/Amazon/,SEND PRIVATE MESSAGE,/post/Goldman-Sachs-Interview-k1ZTsf7n,Goldman-Sachs
2,"Aug 27, 2020","Probably. But where I live, there aren't many HFT firms. Wouldn't mind moving to other country, but it seem to be a distant thing given the current scenario.",1,yXMW62,/company/Deutsche-Bank/,SEND PRIVATE MESSAGE,/post/Goldman-Sachs-Interview-k1ZTsf7n,Goldman-Sachs
3,"Aug 20, 2020",Would say wait at least 3 to 5 business days before you start to get nervous,0,OfferSide1,/company/Citi/,Finance,/post/Goldman-Sachs-Interview-k1ZTsf7n,Goldman-Sachs
4,"Aug 20, 2020",More like 3-10 business days.,1,blah8w8w,/company/Goldman-Sachs/,SEND PRIVATE MESSAGE,/post/Goldman-Sachs-Interview-k1ZTsf7n,Goldman-Sachs
5,"Aug 19, 2020",What kinds of questions did they ask for quant?,0,dunnoman,/company/Google/,Eng,/post/Goldman-Sachs-Interview-k1ZTsf7n,Goldman-Sachs
6,"Aug 20, 2020","Nothing profound, usual puzzles (algorithms, probabilistic, game theory).",1,yXMW62,/company/Deutsche-Bank/,SEND PRIVATE MESSAGE,/post/Goldman-Sachs-Interview-k1ZTsf7n,Goldman-Sachs
7,"Aug 20, 2020","for IB it's usually very soon after (a couple days), not sure for quant",1,jiya5,/company/Credit-Suisse/,SEND PRIVATE MESSAGE,/post/Goldman-Sachs-Interview-k1ZTsf7n,Goldman-Sachs
0,"Jun 26, 2019",I would say stay at “New”,4,aCCX36,/company/Microsoft/,SEND PRIVATE MESSAGE,/post/Goldman-sachs-vs-JP-Morgan-Chase-Tv025QES,Goldman-Sachs
1,"Jun 26, 2019",As in where I currently am?,0,kinwea,nan,SEND PRIVATE MESSAGE,/post/Goldman-sachs-vs-JP-Morgan-Chase-Tv025QES,Goldman-Sachs
2,"Jun 26, 2019",Bingo. Both are horrible places to work at.,3,aCCX36,/company/Microsoft/,SEND PRIVATE MESSAGE,/post/Goldman-sachs-vs-JP-Morgan-Chase-Tv025QES,Goldman-Sachs
3,"Jun 27, 2019","- salary range that these companies offer: Just base salary, bonuses are purely discretionary so no guarantees on amount- expected number of work hours: Depends on the team - if you're working with traders you'll need to be there for market hours plus before and after, so at least 8-4- free food? Probably not, maybe at quarterly town halls & similar.- PTOs? Actually the one place we're very good - I have ~36 days of PTO- market reputation - depends on consumer vs. investment banking- any layoff trend? More likely to fire contractors - harder to fire full-times.- expectations from an SDE in a financial firm? you're sort of the business's slaveboy, so it can suck at times.",4,raintrapd,/company/JPMorgan/,SEND PRIVATE MESSAGE,/post/Goldman-sachs-vs-JP-Morgan-Chase-Tv025QES,Goldman-Sachs
4,"Jun 27, 2019",Thanks for that! Any idea of GS vs JPMORGAN ? Which has better culture?,0,vqmwe,nan,SEND PRIVATE MESSAGE,/post/Goldman-sachs-vs-JP-Morgan-Chase-Tv025QES,Goldman-Sachs
5,"Jun 26, 2019",Both gonna be shitty. Rather go to quants/hedge. Banks usually are in the low range of TC unless you are in senior management/IB etc,3,Thizzy,/company/Peloton/,Other,/post/Goldman-sachs-vs-JP-Morgan-Chase-Tv025QES,Goldman-Sachs
6,"Dec 9, 2019","Recently accepted an offer from JPMC, and I'd say that it depends hell a lot on the team.If you're working in the back office, you're gonna be underpaid and the culture is too laid back.I am joining the Algorithmic trading team and the TC is as good as Jump Trading or Citadel.A lot of people joining from Google, FB etc. because of the 'newness' of this team and the challenges faced by the devs and quants.TC: 210KLocation: NY",2,Google⠀,/company/Arm/,Eng,/post/Goldman-sachs-vs-JP-Morgan-Chase-Tv025QES,Goldman-Sachs
7,"Oct 23, 2020",What could the compensation be for ml engineer at jpmc?,0,FxaT87,/company/HelloFresh/,SEND PRIVATE MESSAGE,/post/Goldman-sachs-vs-JP-Morgan-Chase-Tv025QES,Goldman-Sachs
8,"Jun 26, 2019",Both suck ! All banks suck !,2,CodeGall,nan,SEND PRIVATE MESSAGE,/post/Goldman-sachs-vs-JP-Morgan-Chase-Tv025QES,Goldman-Sachs
0,"Nov 19, 2020","You’re an engineer, not an IB analyst. Goldman only brings clout if you’re in IB or something fancy like that. Stick to tech companies.",3,хакерман,/company/Google/,SEND PRIVATE MESSAGE,/post/Paypal-vs-goldman-analysis-N8ztHbPh,Goldman-Sachs
1,"Nov 20, 2020","Agree with this. Have been there, suffered dearly",0,stresdsoul,/company/VMware/,SEND PRIVATE MESSAGE,/post/Paypal-vs-goldman-analysis-N8ztHbPh,Goldman-Sachs
2,"Nov 19, 2020","Depends, usually the hops bring the most money. I like Goldman, some teams have very good WLB and high compensation (above analyst level) they beat my indeed offer by a lot and I get to work with the latest tech. Like most companies though, they will not give you raises that can match a job hop. Happiness is number 1.",1,BonusBoy,/company/Goldman-Sachs/,Eng,/post/Paypal-vs-goldman-analysis-N8ztHbPh,Goldman-Sachs
3,"Nov 19, 2020",Didn't quite get u. What do u suggest,0,bsbxbx,/company/Goldman-Sachs/,SEND PRIVATE MESSAGE,/post/Paypal-vs-goldman-analysis-N8ztHbPh,Goldman-Sachs
4,"Nov 19, 2020",Is goldman one of the big four in it's field or domain,0,bsbxbx,/company/Goldman-Sachs/,SEND PRIVATE MESSAGE,/post/Paypal-vs-goldman-analysis-N8ztHbPh,Goldman-Sachs
5,"Nov 24, 2020",PayPal,0,theniceguy,/company/PayPal/,SEND PRIVATE MESSAGE,/post/Paypal-vs-goldman-analysis-N8ztHbPh,Goldman-Sachs
6,"Nov 20, 2020",Paypal base is 121k and 40rsu . Goldman 80k base + bonus being 0-100% but in utah,0,bsbxbx,/company/Goldman-Sachs/,SEND PRIVATE MESSAGE,/post/Paypal-vs-goldman-analysis-N8ztHbPh,Goldman-Sachs
0,May 7,"Why GS, one of the worst companies for SWE",4,AWPm07,/company/Akamai-Technologies/,SEND PRIVATE MESSAGE,/post/How-to-join-Goldman-Sachs-as-a-fresher-WWjcoDqq,Goldman-Sachs
1,May 14,"Are you in the US, Akamai?",0,Lovely.,/company/Goldman-Sachs/,Eng,/post/How-to-join-Goldman-Sachs-as-a-fresher-WWjcoDqq,Goldman-Sachs
2,May 14,That was Bangalore office,0,AWPm07,/company/Akamai-Technologies/,SEND PRIVATE MESSAGE,/post/How-to-join-Goldman-Sachs-as-a-fresher-WWjcoDqq,Goldman-Sachs
3,May 7,"Please don't do it.Don't even think of joining GS, you will regret",4,mt19937_64,/company/Goldman-Sachs/,IT,/post/How-to-join-Goldman-Sachs-as-a-fresher-WWjcoDqq,Goldman-Sachs
4,May 7,Why?,0,checking..,nan,SEND PRIVATE MESSAGE,/post/How-to-join-Goldman-Sachs-as-a-fresher-WWjcoDqq,Goldman-Sachs
5,May 7,"I interned there and it was the worst experience of my life. Underwhelming tech, overwhelming office politics. Wouldn’t recommend even as a last resort.",3,QoGShj,/company/Microsoft/,SEND PRIVATE MESSAGE,/post/How-to-join-Goldman-Sachs-as-a-fresher-WWjcoDqq,Goldman-Sachs
6,May 7,Lol don’t.,2,😸dog,/company/Goldman-Sachs/,SEND PRIVATE MESSAGE,/post/How-to-join-Goldman-Sachs-as-a-fresher-WWjcoDqq,Goldman-Sachs
7,May 7,Why do you want to join GS for an SDE role lol,1,tiwlakvd,/company/VMware/,SEND PRIVATE MESSAGE,/post/How-to-join-Goldman-Sachs-as-a-fresher-WWjcoDqq,Goldman-Sachs
8,May 7,Their CTC was good. Should I not join that,0,checking..,nan,SEND PRIVATE MESSAGE,/post/How-to-join-Goldman-Sachs-as-a-fresher-WWjcoDqq,Goldman-Sachs
9,May 7,"I'd advise you to look into other factors apart from the TC. Look at what you'll get to learn, scope for growth, work culture, benefits and management. If you want to learn about finance, go ahead. If you just want a sde role, there are better options.",0,tiwlakvd,/company/VMware/,SEND PRIVATE MESSAGE,/post/How-to-join-Goldman-Sachs-as-a-fresher-WWjcoDqq,Goldman-Sachs
