,comment_date,comment_text,comment_like,comment_user,comment_firm,comment_position,comment_url,company
0,Apr 2,What is your range?,0,IB-Ops,/company/Goldman-Sachs/,SEND PRIVATE MESSAGE,/post/Goldman-Sachs-Offer-3XUsAcdc,Goldman-Sachs
1,Apr 2,Actually probably less than that since it's ops. How many direct reports and do any of them have direct reports?,1,IB-Ops,/company/Goldman-Sachs/,SEND PRIVATE MESSAGE,/post/Goldman-Sachs-Offer-3XUsAcdc,Goldman-Sachs
2,Apr 2,"130-150, is that a base comp, and what would be the bonus percentage",0,Dito27,/company/Deloitte/,SEND PRIVATE MESSAGE,/post/Goldman-Sachs-Offer-3XUsAcdc,Goldman-Sachs
3,Apr 2,"Yeah with 6 YOE you'll barely be VP level. In SLC ops 1-2 year VPs probably average 120-130k all in, maybe a bit more in a good bonus year. Dallas is similar in comp to slc",2,IB-Ops,/company/Goldman-Sachs/,SEND PRIVATE MESSAGE,/post/Goldman-Sachs-Offer-3XUsAcdc,Goldman-Sachs
4,Apr 4,Is this a project role or operations daily activity role like trade operations?I'd ask about 170 base plus 20- 30% bonus.  For a TC of 215k+  your numbers are spot on even if they try to say 150k is max base..it's not... not even for Dallas standards. Lots of banks have moved roles to Dallas and it's getting to be a competitive mkt.,0,Lionheart9,/company/Bank-of-America/,SEND PRIVATE MESSAGE,/post/Goldman-Sachs-Offer-3XUsAcdc,Goldman-Sachs
5,Apr 4,PM I would imagine would pay more than daily activity ops roles which are up to 130-150k depending on experience. Did they already give you an offer?,0,Lionheart9,/company/Bank-of-America/,SEND PRIVATE MESSAGE,/post/Goldman-Sachs-Offer-3XUsAcdc,Goldman-Sachs
6,Apr 4,"Thanks, no offer yet. Still going through the interviews.So it would be fair to ask for 160k and 20-30% bonus. For 6 YOE??",0,Dito27,/company/Deloitte/,SEND PRIVATE MESSAGE,/post/Goldman-Sachs-Offer-3XUsAcdc,Goldman-Sachs
7,Apr 7,"I think it's fair, but remember their goal is to hire as cheap as possible so if you  target is 160 go to 170-175. They will bring it down.",0,Lionheart9,/company/Bank-of-America/,SEND PRIVATE MESSAGE,/post/Goldman-Sachs-Offer-3XUsAcdc,Goldman-Sachs
0,"Jul 27, 2018","Chomu, don't use your real name on blind. One search and I had your LinkedIn and GitHub profile. Especially if you plan to work at places like Goldman Sachs which are anal about posting most things on social media even tangentially related to the company.",18,sbw13j,/company/Uber/,SEND PRIVATE MESSAGE,/post/Goldman-Sachs-technical-questions-DcR1EmpL,Goldman-Sachs
1,"Jul 27, 2018","I am yet to give the test.. But thanks anyways..Any idea, what kind of questions do they mostly concentrate on?I dont want to do any mistake in the test/ interview.",0,Randomboy,/company/SITA/,SEND PRIVATE MESSAGE,/post/Goldman-Sachs-technical-questions-DcR1EmpL,Goldman-Sachs
2,"May 14, 2019",Easy questions on the hackerrank or coderpad,0,vinutd,/company/Bank-of-America/,SEND PRIVATE MESSAGE,/post/Goldman-Sachs-technical-questions-DcR1EmpL,Goldman-Sachs
3,"Jul 27, 2018",I got GS eng offer this year 375k tc in NY/NJ.  Stayed at Google though.,7,snidely,/company/Google/,Other,/post/Goldman-Sachs-technical-questions-DcR1EmpL,Goldman-Sachs
4,"Jul 27, 2018",Better to be in a tech company rather than in a company where tech is seen as a cost center,2,Xvw,/company/Amazon/,SEND PRIVATE MESSAGE,/post/Goldman-Sachs-technical-questions-DcR1EmpL,Goldman-Sachs
5,"Dec 18, 2018",This is the truth. Banks tend to view tech as a cost center.,2,scottstots,/company/Capital-One/,Eng,/post/Goldman-Sachs-technical-questions-DcR1EmpL,Goldman-Sachs
6,"Jul 27, 2018","If you know it's wrong, should you do it anyway if adequately compensated?",2,SEJ184,/company/Okta/,SEND PRIVATE MESSAGE,/post/Goldman-Sachs-technical-questions-DcR1EmpL,Goldman-Sachs
7,"Jul 27, 2018","Blind 101: Its called Blind for a reason. Never use your real name.Regarding hacker rank, standard algorithm and DS stuff with focus on performance and testing. There is a math test as well if you want to go into strats division",1,arfW67,/company/Goldman-Sachs/,SEND PRIVATE MESSAGE,/post/Goldman-Sachs-technical-questions-DcR1EmpL,Goldman-Sachs
8,"Jul 27, 2018",Thanks a lot..,0,Randomboy,/company/SITA/,SEND PRIVATE MESSAGE,/post/Goldman-Sachs-technical-questions-DcR1EmpL,Goldman-Sachs
0,"Jan 27, 2020",Are u stupid Mint? How the hell is MSFT fang? Do u see an M in FANG?,6,gbsfjsiw,/company/Wayfair/,SEND PRIVATE MESSAGE,/post/Microsoft-offer-vs-Goldman-8Kqffgwp,Goldman-Sachs
1,"Jan 28, 2020",I do not work at Wayfair. Also worked at a hedge fund mate. Thanks.,0,gbsfjsiw,/company/Wayfair/,SEND PRIVATE MESSAGE,/post/Microsoft-offer-vs-Goldman-8Kqffgwp,Goldman-Sachs
2,"Jan 28, 2020","Nice. I worked on buy side, front office and pnl computation. The tech is trash at most finance firms",3,Wtfreall,/company/Amazon/,Eng,/post/Microsoft-offer-vs-Goldman-8Kqffgwp,Goldman-Sachs
3,"Jan 27, 2020",Microsoft. The bonuses at banks are empty promises,27,OutofMem,/company/Citi/,Product,/post/Microsoft-offer-vs-Goldman-8Kqffgwp,Goldman-Sachs
4,"Jan 28, 2020",Plenty of 0 bonuses at GS Securities and investment management this year...I would take Microsoft,1,fake engineer,/company/Goldman-Sachs/,SEND PRIVATE MESSAGE,/post/Microsoft-offer-vs-Goldman-8Kqffgwp,Goldman-Sachs
5,"Feb 6, 2020","Bonus is pretty variable here imo, from the people I've talked to (about 7 in NY) got between 25-45k bonus this year with 2.5 years experience",0,jDKr57,/company/Goldman-Sachs/,SEND PRIVATE MESSAGE,/post/Microsoft-offer-vs-Goldman-8Kqffgwp,Goldman-Sachs
6,"Jan 27, 2020",Goldman has a horrid culture. Microsoft is a top tier tech firm that you can then use as a trampoline to get into FANG. Good luck getting into tech after Goldman...,12,grubster,/company/Grubhub/,SEND PRIVATE MESSAGE,/post/Microsoft-offer-vs-Goldman-8Kqffgwp,Goldman-Sachs
7,"Jan 28, 2020",What’s wrong with gs culture?,1,cbEV72,/company/E-TRADE/,Finance,/post/Microsoft-offer-vs-Goldman-8Kqffgwp,Goldman-Sachs
8,"Jan 29, 2020",Very toxic. Dog eat dog. Use and throw out. However depends on org and manager for sure.,1,maae11,/company/Goldman-Sachs/,SEND PRIVATE MESSAGE,/post/Microsoft-offer-vs-Goldman-8Kqffgwp,Goldman-Sachs
9,"Jan 27, 2020","Microsoft is a better career path, sde has higher upside than analyst. They also have yearly bonus which you don’t have in your calculation.",16,PMzt66,/company/Redfin/,SEND PRIVATE MESSAGE,/post/Microsoft-offer-vs-Goldman-8Kqffgwp,Goldman-Sachs
10,"Jan 27, 2020",Oh right Ill update it,0,MGMK72,/company/Comcast/,Eng,/post/Microsoft-offer-vs-Goldman-8Kqffgwp,Goldman-Sachs
11,"Jan 27, 2020",I was once in a similar situation after finishing grad school and trying to make up my mind between Msft and a company in the financial domain. Here’s what my mentor had told me“As an engineer you will always be a second class citizen in a finance driven company while at Msft you would be a first class citizen as an engineer”,12,NewFolder,/company/Microsoft/,SEND PRIVATE MESSAGE,/post/Microsoft-offer-vs-Goldman-8Kqffgwp,Goldman-Sachs
0,May 13,70k?,2,wet_yssup,/company/Cisco/,SEND PRIVATE MESSAGE,/post/Goldman-Sachs-TC-hbTbRO7j,Goldman-Sachs
1,May 13,Waaat.!! They offer just 70K for associate? I heard they do above 100K ?? 😳,1,black_hole,nan,SEND PRIVATE MESSAGE,/post/Goldman-Sachs-TC-hbTbRO7j,Goldman-Sachs
2,May 13,What's full stack backend ?,1,curious__,/company/Goldman-Sachs/,SEND PRIVATE MESSAGE,/post/Goldman-Sachs-TC-hbTbRO7j,Goldman-Sachs
3,May 14,"They mentioned it involves working on both front end and backend, but majority is backend.",0,black_hole,nan,SEND PRIVATE MESSAGE,/post/Goldman-Sachs-TC-hbTbRO7j,Goldman-Sachs
4,May 13,"Is salt lake city comp like Dallas if yes than roughly 100k base + 20k cash bonus, although just keep in mind bonus is very much variable on your performance and BU earnings, I have heard people getting as much as base comp. if not like dallas you can scale it. Typically no stocks. You can negotiate your joining bonus. Relocation is quite good, enough for the move.",1,trCU05,/company/Goldman-Sachs/,SEND PRIVATE MESSAGE,/post/Goldman-Sachs-TC-hbTbRO7j,Goldman-Sachs
5,May 13,Thank you! That’s helpful,0,black_hole,nan,SEND PRIVATE MESSAGE,/post/Goldman-Sachs-TC-hbTbRO7j,Goldman-Sachs
6,May 14,I think dallas associate (2-5yr exp) maxes out at 150k TC,1,BonusBoy,/company/Goldman-Sachs/,Eng,/post/Goldman-Sachs-TC-hbTbRO7j,Goldman-Sachs
7,May 14,"As people said, bonus depends on division and your perf. Also it will be prorated based on your joining date.",0,UTJr16,/company/Goldman-Sachs/,SEND PRIVATE MESSAGE,/post/Goldman-Sachs-TC-hbTbRO7j,Goldman-Sachs
0,Apr 6,GS is NEVER the right answer. Get the Amazon brand name on your resume and figure things out in 3-4 years if you don’t like it. Thank me later.,9, yolo,/company/Goldman-Sachs/,SEND PRIVATE MESSAGE,/post/Amazon-vs-Goldman-Sachs-bWSUXSYo,Goldman-Sachs
1,Apr 7,Lol.. so question here is does GS title matters? L4 v/s VPGoing to L5 in Amazon will be another year and half... GS VP is very stagnant.. not sure how fast VP level progresses..,0,nd9,/company/Goldman-Sachs/,SEND PRIVATE MESSAGE,/post/Amazon-vs-Goldman-Sachs-bWSUXSYo,Goldman-Sachs
2,Apr 7,Yeah you’ll remain a VP for 15 years (statistically speaking) before you’ll get the next title which is Managing director.,2, yolo,/company/Goldman-Sachs/,SEND PRIVATE MESSAGE,/post/Amazon-vs-Goldman-Sachs-bWSUXSYo,Goldman-Sachs
3,Apr 6,Continue interviewing,8,sweetchill,/company/Twitter/,SEND PRIVATE MESSAGE,/post/Amazon-vs-Goldman-Sachs-bWSUXSYo,Goldman-Sachs
4,Apr 20,"God it’s like picking between dog shit and human shit.In all seriousness, Goldman might give slightly better WLB than amazon, but Amazon will make you a much better engineer.Either way, expect to possibly be incredibly miserable at either. I’d continue interviewing if possible.Also, it looks like you currently work at GS and they’re countering. Be careful if they counter with bonus. GS will habitually pay future leavers a good counter via bonus to get them to stay, and then not pay them next year.",1,gsguy,/company/Goldman-Sachs/,SEND PRIVATE MESSAGE,/post/Amazon-vs-Goldman-Sachs-bWSUXSYo,Goldman-Sachs
5,Apr 20,At least Amazon pays you better and the pay is more predictable. GS paid tech employees crap even when the company made a shit ton of money.,1, 👩‍✈️ ,/company/Goldman-Sachs/,SEND PRIVATE MESSAGE,/post/Amazon-vs-Goldman-Sachs-bWSUXSYo,Goldman-Sachs
6,Apr 6,GS SRE is a solid place to be from what I've heard. I wouldn't roll the Amazon dice and end up another horror story if that counter offer comes back with similar TC,2,YoloCalls,/company/Goldman-Sachs/,SEND PRIVATE MESSAGE,/post/Amazon-vs-Goldman-Sachs-bWSUXSYo,Goldman-Sachs
7,Apr 6,😂,0, yolo,/company/Goldman-Sachs/,SEND PRIVATE MESSAGE,/post/Amazon-vs-Goldman-Sachs-bWSUXSYo,Goldman-Sachs
8,Apr 20,Hard pass on GS.,2, 👩‍✈️ ,/company/Goldman-Sachs/,SEND PRIVATE MESSAGE,/post/Amazon-vs-Goldman-Sachs-bWSUXSYo,Goldman-Sachs
0,"Oct 28, 2020",this is low for US,0,0_____0___,/company/Goldman-Sachs/,SEND PRIVATE MESSAGE,/post/Goldman-sachs-offer-taking-too-long-KgZio8CW,Goldman-Sachs
1,"Oct 29, 2020",excellent for salt lake,8,oliojgt,/company/Amazon/,SEND PRIVATE MESSAGE,/post/Goldman-sachs-offer-taking-too-long-KgZio8CW,Goldman-Sachs
2,"Dec 12, 2020",I was in SLC. That's a good offer for the place.,2,gYls28,/company/Tableau-Software/,SEND PRIVATE MESSAGE,/post/Goldman-sachs-offer-taking-too-long-KgZio8CW,Goldman-Sachs
3,"Nov 23, 2020",Welcome to the first of many disappointments with the GS experience ;),5,fake engin,/company/Goldman-Sachs/,SEND PRIVATE MESSAGE,/post/Goldman-sachs-offer-taking-too-long-KgZio8CW,Goldman-Sachs
4,"Nov 24, 2020",Even before joining it seems I might start looking elsewhere,1,JobSearchH,/company/Costco-Travel/,SEND PRIVATE MESSAGE,/post/Goldman-sachs-offer-taking-too-long-KgZio8CW,Goldman-Sachs
5,"Dec 19, 2020",Starting in Feb atlast everything went through,0,JobSearchH,/company/Costco-Travel/,SEND PRIVATE MESSAGE,/post/Goldman-sachs-offer-taking-too-long-KgZio8CW,Goldman-Sachs
6,"Dec 19, 2020",Nice! Similar thing happened with me. Waited for a long time.,1,Some  Name,/company/Goldman-Sachs/,SEND PRIVATE MESSAGE,/post/Goldman-sachs-offer-taking-too-long-KgZio8CW,Goldman-Sachs
7,"Oct 27, 2020","Interview was pretty straight forward, concentrate on leet code problems. Keep your camera on from the get go. When is your onsite and which team are you interviewing for?",2,JobSearchH,/company/Costco-Travel/,SEND PRIVATE MESSAGE,/post/Goldman-sachs-offer-taking-too-long-KgZio8CW,Goldman-Sachs
8,"Nov 9, 2020",Webcam* keep it on it shows you are trustworthy,0,JobSearchH,/company/Costco-Travel/,SEND PRIVATE MESSAGE,/post/Goldman-sachs-offer-taking-too-long-KgZio8CW,Goldman-Sachs
9,Jan 21,I mean keeping your webcam on for a job interview should go without saying lol,0,user _,nan,SEND PRIVATE MESSAGE,/post/Goldman-sachs-offer-taking-too-long-KgZio8CW,Goldman-Sachs
10,"Oct 29, 2020","Relax, These things takes time. It took me 2 months to join GS after I was said I had cleared on-site.Regarding your offer, you got low balled.",1,elon_mask,/company/Goldman-Sachs/,SEND PRIVATE MESSAGE,/post/Goldman-sachs-offer-taking-too-long-KgZio8CW,Goldman-Sachs
11,"Oct 30, 2020","Offer location is Salt lake city, not NYC",1,What'sUp?,/company/Deutsche-Bank/,SEND PRIVATE MESSAGE,/post/Goldman-sachs-offer-taking-too-long-KgZio8CW,Goldman-Sachs
0,"Aug 10, 2019",I have no idea. But I can say that it’s less than FAANG.With 10 YOE at FAANG you can fetch 500-600k. (More is possible but rare.) Just saying.,1,2muchblind,/company/Uber/,SEND PRIVATE MESSAGE,/post/Goldman-Sachs-Salaries-zdYDtkgO,Goldman-Sachs
1,"Aug 10, 2019",@Op - dude where are you getting you data from ? Only start performers make MD in 11-15 years,0,AOoB63,/company/Softvision/,SEND PRIVATE MESSAGE,/post/Goldman-Sachs-Salaries-zdYDtkgO,Goldman-Sachs
2,"Aug 10, 2019","Right, the % of MDs would be an interesting statistic. Because Directors and above at most large tech companies make between $1-10M+ as well.",0,2muchblind,/company/Uber/,SEND PRIVATE MESSAGE,/post/Goldman-Sachs-Salaries-zdYDtkgO,Goldman-Sachs
3,"Aug 10, 2019","The salaries pale in comparison to FANG for the most part.What’s all the hype about these consulting companies and top MBA, if you can’t even make as much as FANG?!",1,ex-fb,/company/LinkedIn/,SEND PRIVATE MESSAGE,/post/Goldman-Sachs-Salaries-zdYDtkgO,Goldman-Sachs
4,"Aug 10, 2019","@LinkedIn The hype comes from before around 5-6 years ago when it was common for entry-level CS grads to make less than 6 figures (or barely crack it).The high TCs in tech are thanks to the high stock prices, which is a pretty recent thing. Our base salaries haven’t gone up as significantly.",0,2muchblind,/company/Uber/,SEND PRIVATE MESSAGE,/post/Goldman-Sachs-Salaries-zdYDtkgO,Goldman-Sachs
5,"Aug 10, 2019","“Our base salaries haven’t gone up as significantly”.A lot of people at Blind missed this. If you work for FAANG or other popular company like Salesforce, almost half of your TC is from stock.Take that away or work for a startup that hasn’t gone public yet and your actual take home is much smaller.",1,walala,/company/Gusto/,SEND PRIVATE MESSAGE,/post/Goldman-Sachs-Salaries-zdYDtkgO,Goldman-Sachs
6,"Aug 10, 2019",First of all there is no ED title at Goldman 🙄Secondly ... you lost me at “am about to begin work at Goldman Sachs” followed by “in the next few years” ?,1,AOoB63,/company/Softvision/,SEND PRIVATE MESSAGE,/post/Goldman-Sachs-Salaries-zdYDtkgO,Goldman-Sachs
7,"Aug 10, 2019","I am aware of that by the way, and I have just rejigged the wording to make it more understandable",0,WPJoseph,nan,SEND PRIVATE MESSAGE,/post/Goldman-Sachs-Salaries-zdYDtkgO,Goldman-Sachs
8,"Aug 10, 2019",Ok .... also once again ...  there is no ED title at Goldman .... and 3 years of VP title isn’t worth shit .. you can practically retire as a VP without ever being promoted to MD level ..,0,AOoB63,/company/Softvision/,SEND PRIVATE MESSAGE,/post/Goldman-Sachs-Salaries-zdYDtkgO,Goldman-Sachs
9,"Aug 10, 2019",It is indeed IB,0,WPJoseph,nan,SEND PRIVATE MESSAGE,/post/Goldman-Sachs-Salaries-zdYDtkgO,Goldman-Sachs
10,"Aug 10, 2019",Are you in NY or UT?,0,M.L.Eng,nan,Eng,/post/Goldman-Sachs-Salaries-zdYDtkgO,Goldman-Sachs
11,"Aug 10, 2019",I will probably decide to be based in NY,0,WPJoseph,nan,SEND PRIVATE MESSAGE,/post/Goldman-Sachs-Salaries-zdYDtkgO,Goldman-Sachs
0,Mar 23,Yes. The honor of working for Goldman Sachs is worth 300k.,8,zH6he3F,/company/JPMorgan/,SEND PRIVATE MESSAGE,/post/Goldman-Sachs-lowball-LW34UG8L,Goldman-Sachs
1,Mar 23,Should be grateful they don’t charge you for the privilege of working there!,2,erUs71,/company/Siemens/,Mgmt,/post/Goldman-Sachs-lowball-LW34UG8L,Goldman-Sachs
2,Mar 23,This is one of the reasons I mentioned in another thread that I will never apply there.,4,Keycaps,/company/IBM/,SEND PRIVATE MESSAGE,/post/Goldman-Sachs-lowball-LW34UG8L,Goldman-Sachs
3,Mar 23,Texas is low col right? Still seems like a downgrade from 180k in KC,0,fatcat420,/company/Amazon/,SEND PRIVATE MESSAGE,/post/Goldman-Sachs-lowball-LW34UG8L,Goldman-Sachs
4,Mar 23,"Yeah, I think Texas is generally considered low COL. But KC is even lower & Dallas specifically is much more expensive than KC.",0,AhLX56,nan,SEND PRIVATE MESSAGE,/post/Goldman-Sachs-lowball-LW34UG8L,Goldman-Sachs
5,Mar 23,"If they don't eat ass kick them to the grass, and this tc ain't even 1st base",0,fatcat420,/company/Amazon/,SEND PRIVATE MESSAGE,/post/Goldman-Sachs-lowball-LW34UG8L,Goldman-Sachs
6,Mar 23,Which company in KC do you work for?,0,kiraak,/company/Cerner/,SEND PRIVATE MESSAGE,/post/Goldman-Sachs-lowball-LW34UG8L,Goldman-Sachs
7,Mar 23,"I actually work remote for Dell now. But, I am moving to Dallas for personal reasons. I have received or worked for better offers at SelectQuote & Warehouse Quote 2 Local KC companies.TC for those are between 110K -> 135K (bonus dependent)Other companies where I have heard of better than avg comps are Spring Venture (you have to prove senior level), CBOE, TradeBot, C2FOI have largely worked at startups, or companies that needed very confident system design/framework focused engineers. So if you are aggressive and are confident then I think KC is very competitive (when accounting for COL) compared to most companies that aren't offering great stock options in your TC Nationally.The GS Offer is generally worse than most Mid - Senior Engineer roles in KC. Keep in mind KC is a much smaller market.",0,AhLX56,nan,SEND PRIVATE MESSAGE,/post/Goldman-Sachs-lowball-LW34UG8L,Goldman-Sachs
8,Mar 23,What position is this?,0,lolololob,/company/Capital-One/,SEND PRIVATE MESSAGE,/post/Goldman-Sachs-lowball-LW34UG8L,Goldman-Sachs
9,Mar 23,The position was as an Associate (potentially VP they honestly weren't clear about it)  within either GIR or Marcus teams as an Engineer.,0,AhLX56,nan,SEND PRIVATE MESSAGE,/post/Goldman-Sachs-lowball-LW34UG8L,Goldman-Sachs
0,"Oct 22, 2020","Just finished reading the book about this,""Billion Dollar Whale"". They should probably pay more than this for facilitating such a heist with full knowledge + some jail time for Tim Leissner but Wallstreet always get away with murder.",16,tailrecurs,/company/BlackRock/,SEND PRIVATE MESSAGE,/post/Goldman-Sachs---1MDB-Scandal-hAdchrcq,Goldman-Sachs
1,"Oct 22, 2020",Watch Dirty Money on Netflix. There is one episode about this 1MDB funds. I was so upset after watching this.,7,tn168,/company/Freddie-Mac/,SEND PRIVATE MESSAGE,/post/Goldman-Sachs---1MDB-Scandal-hAdchrcq,Goldman-Sachs
2,"Oct 22, 2020","Yes, banks such as Goldman and HSBC.. you will find these banks in most of the financial scandals. And they are two big to fail with ties everywhere",2,Qxyf37,/company/Slalom-Consulting/,SEND PRIVATE MESSAGE,/post/Goldman-Sachs---1MDB-Scandal-hAdchrcq,Goldman-Sachs
3,"Oct 23, 2020",Watch ‘The Big Short’. It’s about Freddie Mac’s loans. I was so upset after watching it.,1,tiYd24,/company/Charles-Schwab/,SEND PRIVATE MESSAGE,/post/Goldman-Sachs---1MDB-Scandal-hAdchrcq,Goldman-Sachs
4,"Oct 22, 2020",Whole Malaysian economy broke down because this Deloitte was also involved in valuation of portfolio.,8,Pljhfctym4,nan,SEND PRIVATE MESSAGE,/post/Goldman-Sachs---1MDB-Scandal-hAdchrcq,Goldman-Sachs
5,"Oct 23, 2020",Deloitte only needs to pay 500k usd. What a joke.,1,3id7w,/company/Apple/,SEND PRIVATE MESSAGE,/post/Goldman-Sachs---1MDB-Scandal-hAdchrcq,Goldman-Sachs
6,"Oct 22, 2020","Yawn, they will pay cash and move on",7,Jkahnwald,/company/American-Express/,SEND PRIVATE MESSAGE,/post/Goldman-Sachs---1MDB-Scandal-hAdchrcq,Goldman-Sachs
7,"Oct 22, 2020","Man, they got off like OJ, 😂.",2,FHAs14,/company/Deloitte/,HR,/post/Goldman-Sachs---1MDB-Scandal-hAdchrcq,Goldman-Sachs
0,"Aug 18, 2018",Worked in GS for 6 years. though not in this team. The gist of it is the following. The company is full of politicians. Most people from the banking site end up as managers of engineering teams. These people are brutal politicians and the culture stinks because of territory marking.You will have to spend more time pleasing your MD (or partner) rather than writing code. Lots of legacy code. Bullshit tool chain and red tape and bureaucracy galore.The culture if of backstabbing and micro management.,9,Arschloch,nan,Eng,/post/Goldman-Sachs-marquee-team-5Vgx1WZ2,Goldman-Sachs
1,"Aug 19, 2018",How likely is that it will change for newly started initiatives such as Marcus. I've heard good things about it. Any insights?,1,Tc&gtfo,/company/Veritas/,Eng,/post/Goldman-Sachs-marquee-team-5Vgx1WZ2,Goldman-Sachs
2,"Aug 16, 2018",I heard it's very competitive to the point your teammates backstab you to get ahead. There's a lot of work and not enough people to get shit done so you focus on small things instead of trying to fix larger problems that cause pain.,4,subasic1,/company/Goldman-Sachs/,SEND PRIVATE MESSAGE,/post/Goldman-Sachs-marquee-team-5Vgx1WZ2,Goldman-Sachs
3,"Aug 16, 2018","I heard they're paying very good salaries, especially annual bonus(even 50+% of base). Is it true?",1,Tc&gtfo,/company/Veritas/,Eng,/post/Goldman-Sachs-marquee-team-5Vgx1WZ2,Goldman-Sachs
4,"Aug 17, 2018","Ohh, it's Marcus I guess. Didn't know these two are different teams.What's your offered tc?",0,Tc&gtfo,/company/Veritas/,Eng,/post/Goldman-Sachs-marquee-team-5Vgx1WZ2,Goldman-Sachs
5,"Aug 17, 2018",Just interviewing. Have onsite scheduled. So wanted to know if I should go for onsite,1,Raj5432,/company/SAP/,Eng,/post/Goldman-Sachs-marquee-team-5Vgx1WZ2,Goldman-Sachs
0,"Dec 28, 2020","Lateral hires don't make MDs? I've been in two teams at GS and in both cases my MDs were lateral hires. One was from Lehman and another from some airlines.I can give more examples:- Atte Lahtiranta, our Chief Technology Officer came from Verizon- Marco Argenti, our Co-Chief Information Officer came from AWS- Dzevad Trumic, our Head of SRE came from Google",1,goldman_ma,/company/Goldman-Sachs/,SEND PRIVATE MESSAGE,/post/Goldman-Sachs-Compensation-Bands-iop8XTKQ,Goldman-Sachs
1,"Dec 28, 2020",I think Dzevad is not partner,1,WpnY61,/company/Goldman-Sachs/,SEND PRIVATE MESSAGE,/post/Goldman-Sachs-Compensation-Bands-iop8XTKQ,Goldman-Sachs
2,"Dec 29, 2020","Yep, I don't know him and left the firm this year",1,mae11,/company/Goldman-Sachs/,SEND PRIVATE MESSAGE,/post/Goldman-Sachs-Compensation-Bands-iop8XTKQ,Goldman-Sachs
3,"Dec 28, 2020","What can someone expect in terms of annual raise on base, bonus? And what are some qualities to ace to be considered for making a MD?",1,njnj47,/company/Goldman-Sachs/,SEND PRIVATE MESSAGE,/post/Goldman-Sachs-Compensation-Bands-iop8XTKQ,Goldman-Sachs
4,"Dec 28, 2020",No standard raise but generally speaking they do COL raises. MDs are either people who print money for the bank or can rally a base of MDs and partners behind them to get the promotion so politically saavy and smooth operators.,1,mae11,/company/Goldman-Sachs/,SEND PRIVATE MESSAGE,/post/Goldman-Sachs-Compensation-Bands-iop8XTKQ,Goldman-Sachs
0,"Nov 17, 2020","The 6 months wait is worth only if you are interviewing for Analyst level now and you want to interview for Associate level (which usually requires 3+ YoE).But, even for Analyst level, your TC will jump up quite a lot, if you make it.",1,ProfSergio,/company/Goldman-Sachs/,Eng,/post/Goldman-Sachs-Interview-bQtJ4nkr,Goldman-Sachs
1,"Nov 17, 2020","For 2-2.5 YoE, 21-23 LPA base is certainly the standard for Analyst irrespective of college. Bonus is pretty variable and depends on company, team and individual performance.",0,ProfSergio,/company/Goldman-Sachs/,Eng,/post/Goldman-Sachs-Interview-bQtJ4nkr,Goldman-Sachs
2,"Nov 17, 2020","For the people quoting the good numbers for the freshers are not applicable for a lateral hire unfortunately. Gs notoriously downgrades laterals for whom the base salary don't go beyond a 30%.. get a competing offer and you might get a good comp from People from tier 1 unis make 31 L, out of which 22 is base. People from tier 2 unis make 22 L, out of which 16 is base.Not much of an idea about the bonuses though. But if you get through, the hike can be really enormous!gs. All d best",0,stresdsoul,/company/VMware/,SEND PRIVATE MESSAGE,/post/Goldman-Sachs-Interview-bQtJ4nkr,Goldman-Sachs
3,"Nov 17, 2020","To ABAP or to Slang, that is the question. A tragic choice indeed.",1,uMhf88,/company/JPMorgan/,SEND PRIVATE MESSAGE,/post/Goldman-Sachs-Interview-bQtJ4nkr,Goldman-Sachs
4,"Nov 17, 2020",At least he'll get paid good if he does Slang,0,ProfSergio,/company/Goldman-Sachs/,Eng,/post/Goldman-Sachs-Interview-bQtJ4nkr,Goldman-Sachs
5,"Nov 17, 2020",True 😟,0,dukhi,/company/SAP/,R&D,/post/Goldman-Sachs-Interview-bQtJ4nkr,Goldman-Sachs
6,"Nov 17, 2020",Did they contact you on LinkedIn?,0,Mr1,/company/Colmore/,SEND PRIVATE MESSAGE,/post/Goldman-Sachs-Interview-bQtJ4nkr,Goldman-Sachs
