,comment_date,comment_text,comment_like,comment_user,comment_firm,comment_position,comment_url,company
6,"Nov 5, 2020","Capital 1 tech internship is wayyyy better. You’ll learn soooo much more. Goldman pays more, sure, but you can go full time there. Capital One will teach you more stuff and you’ll build a real project for corporate use by the end of the internship. You may even walk away with an AWS certification if you try. I work at cap 1 and my sister and college roommate both have done tech and GS. My roommate wants out, and my sister left after 1.5 years.",10,1234dmrs!,/company/Capital-One/,SEND PRIVATE MESSAGE,/post/Capital-One-vs-Goldman-Sachs-SQSVRJXh,Goldman-Sachs
7,"Nov 7, 2020",I could be a tiny bit biased but C1 for sure,6,wake123,/company/Capital-One/,SEND PRIVATE MESSAGE,/post/Capital-One-vs-Goldman-Sachs-SQSVRJXh,Goldman-Sachs
8,"Nov 6, 2020",Depends on which team at Goldman and what do you want to do with your career. If you want a fintech route then GS offers more opportunities. If you want pure swe and later go to faang then C1 is better. The blowback for reneging aint that bad other than pissing of campus recruiting. So it's up to you,6,yeez,/company/Goldman-Sachs/,SEND PRIVATE MESSAGE,/post/Capital-One-vs-Goldman-Sachs-SQSVRJXh,Goldman-Sachs
0,Jan 20,Unless it’s in your bank account nothing is guaranteed.,2,GSCS,/company/Goldman-Sachs/,SEND PRIVATE MESSAGE,/post/Goldman-Sachs-bonus-and-resignation-1UUrSQQa,Goldman-Sachs
1,Jan 18,whats the TC at Goldman for SWE? curious to know.is it base + annual cash bonus + stocks?,1,ag og,/company/JPMorgan/,SEND PRIVATE MESSAGE,/post/Goldman-Sachs-bonus-and-resignation-1UUrSQQa,Goldman-Sachs
2,Jan 18,It’s base + annual cash bonus,0,saladEater,/company/Goldman-Sachs/,SEND PRIVATE MESSAGE,/post/Goldman-Sachs-bonus-and-resignation-1UUrSQQa,Goldman-Sachs
3,Jan 18,how much for 10 yoe senior SWE?,0,ag og,/company/JPMorgan/,SEND PRIVATE MESSAGE,/post/Goldman-Sachs-bonus-and-resignation-1UUrSQQa,Goldman-Sachs
4,Jan 18,Leave after bonus deposits into account.,1,gMjt83,/company/Capital-One/,SEND PRIVATE MESSAGE,/post/Goldman-Sachs-bonus-and-resignation-1UUrSQQa,Goldman-Sachs
5,Jan 18,Updated the question further. I might be in a situation where I’ll have to resign before the bonus hits the bank account,0,saladEater,/company/Goldman-Sachs/,SEND PRIVATE MESSAGE,/post/Goldman-Sachs-bonus-and-resignation-1UUrSQQa,Goldman-Sachs
6,Jan 18,How far is the overlap? Starting in Feb and bonus paid in March situation?Can you hold both jobs simultaneously? Are you wfh for both?,0,gMjt83,/company/Capital-One/,SEND PRIVATE MESSAGE,/post/Goldman-Sachs-bonus-and-resignation-1UUrSQQa,Goldman-Sachs
7,Jan 18,Visa status would not allow for both the jobs to be held simultaneously. Overlap is of a few days. Bonus paid in last week of January. Starting of the new job is in first week of February,0,saladEater,/company/Goldman-Sachs/,SEND PRIVATE MESSAGE,/post/Goldman-Sachs-bonus-and-resignation-1UUrSQQa,Goldman-Sachs
8,Jan 18,Is it too late to negotiate sign on bonus to compensate for missed bonus?,0,gMjt83,/company/Capital-One/,SEND PRIVATE MESSAGE,/post/Goldman-Sachs-bonus-and-resignation-1UUrSQQa,Goldman-Sachs
9,Jan 18,"Yes. It can be, you should receive bonus soon after its revealed to you. Take it and leave.What's your PATC this year? Role? YOE?",0,motivated!,/company/Microsoft/,SEND PRIVATE MESSAGE,/post/Goldman-Sachs-bonus-and-resignation-1UUrSQQa,Goldman-Sachs
10,Jan 18,OP’s question is that what if he leaves before the announced bonus is credited to his account🤦🏾‍♂️,0,NEPT14,/company/Oracle/,SEND PRIVATE MESSAGE,/post/Goldman-Sachs-bonus-and-resignation-1UUrSQQa,Goldman-Sachs
11,Jan 18,Yes.Updated the question further for better clarity. I might be in a situation where I’ll have to resign before the bonus is credited into my bank account. 2.5YOE in Tech,0,saladEater,/company/Goldman-Sachs/,SEND PRIVATE MESSAGE,/post/Goldman-Sachs-bonus-and-resignation-1UUrSQQa,Goldman-Sachs
0,Apr 29,"That's very early from manager to inform your friend, lol. Did the friend join GS as a grad?",1,GoodGame..,/company/Goldman-Sachs/,Eng,/post/Goldman-Sachs-Analyst-to-Associate-Promotion-Hike-VvVFvPD8,Goldman-Sachs
1,Apr 29,"No, he's lateral hire. Regarding early information, this is just verbal confirmation, he has good bonding with manager. Nobody is 100% sure whether that actually happens or not!!!",0,directi,/company/Media.net/,SEND PRIVATE MESSAGE,/post/Goldman-Sachs-Analyst-to-Associate-Promotion-Hike-VvVFvPD8,Goldman-Sachs
2,May 2,"I agree, this is a bit too early and although analyst to associate should be straightforward, no one can guarantee a promotion.As for comp, it doesn't have much to do with promotion. On the contrary, I've seen MDs promote employee A and pay employee B more for not promoting them...",2,RAhU54,/company/Goldman-Sachs/,SEND PRIVATE MESSAGE,/post/Goldman-Sachs-Analyst-to-Associate-Promotion-Hike-VvVFvPD8,Goldman-Sachs
3,Apr 30,"From what I know, their is no special increment with promotion. Best time to switch is now.P.S leaving soon for Google",2,djsolomon,/company/Goldman-Sachs/,SEND PRIVATE MESSAGE,/post/Goldman-Sachs-Analyst-to-Associate-Promotion-Hike-VvVFvPD8,Goldman-Sachs
4,Apr 30,With so hectic WLB..how did you got time to prepare ?,0,allhand,/company/Amazon/,Eng,/post/Goldman-Sachs-Analyst-to-Associate-Promotion-Hike-VvVFvPD8,Goldman-Sachs
5,May 2,@dj - What topics were you asked in the coding rounds? And what org are you joining?,0,qrks45,/company/Goldman-Sachs/,SEND PRIVATE MESSAGE,/post/Goldman-Sachs-Analyst-to-Associate-Promotion-Hike-VvVFvPD8,Goldman-Sachs
6,Apr 29,"Wait to get promoted and then switch. I know a few people who were manager favourites but didn't get promoted because the new team already had a few people they wanted to promote from analyst to associate.Another alternative is, get confirmation from your new manager that you ll get promoted and then switch",1,fOtk32,/company/Goldman-Sachs/,SEND PRIVATE MESSAGE,/post/Goldman-Sachs-Analyst-to-Associate-Promotion-Hike-VvVFvPD8,Goldman-Sachs
7,Apr 29,You can expect 5 to 10 percent of increment unless you are your manager's favourite,0,MEsA22,/company/Goldman-Sachs/,SEND PRIVATE MESSAGE,/post/Goldman-Sachs-Analyst-to-Associate-Promotion-Hike-VvVFvPD8,Goldman-Sachs
8,Apr 30,Tech,0,qpowie,/company/Goldman-Sachs/,SEND PRIVATE MESSAGE,/post/Goldman-Sachs-Analyst-to-Associate-Promotion-Hike-VvVFvPD8,Goldman-Sachs
9,Apr 30,"So we have bell curve and everyone has to fit in. Just 5-10% of team will be in top and it has nothing to do with promotion. In my team, manager should put in turn bases. So I think 1 in 4/5 years, you may get in top band.",0,qpowie,/company/Goldman-Sachs/,SEND PRIVATE MESSAGE,/post/Goldman-Sachs-Analyst-to-Associate-Promotion-Hike-VvVFvPD8,Goldman-Sachs
10,May 4,"No special increment on promotion, hike will be similar to what you'd get if you perform well as an analyst in a regular year. Have generally seen people get bw 10-15% increment. Depends on the division though",0,krypto_,/company/Goldman-Sachs/,SEND PRIVATE MESSAGE,/post/Goldman-Sachs-Analyst-to-Associate-Promotion-Hike-VvVFvPD8,Goldman-Sachs
0,"Jan 7, 2020",Lol I interviewed with Marquee once and they were the most stressed type A assholes I have ever encountered in an interview setting. Made Amazon look like Microsoft.But I don't doubt they're doing cool stuff and maybe my interviewers woke up on the wrong side of the bed.,8,NoCK75,/company/JPMorgan/,SEND PRIVATE MESSAGE,/post/Tech-to-Goldman-Sachs-dolam31E,Goldman-Sachs
1,"Jan 6, 2020",When I worked at Amazon I worked with a lot of stressed weirdos. Nice knowledgeable people but I interviewed at Goldman and it was nice seeing personable people and some decent tooling like gitlab being used.Unless you can get VP pay isn't competitive and they're stupidly mum on how much bonuses will be. So I didn't want to move to a more expensive city to less pay so I said no even though I enjoyed the process and team.,7,NoCK75,/company/JPMorgan/,SEND PRIVATE MESSAGE,/post/Tech-to-Goldman-Sachs-dolam31E,Goldman-Sachs
2,"Jan 6, 2020","Avoid Slang like the plague, also probably a good idea to avoid any teams that aren't trade execution systems (this is a marketable skill to higher paying prop trading shops) or Marquee (everyone is over leveled here so the pay can compete with big tech).",5,fake engineer,/company/Goldman-Sachs/,SEND PRIVATE MESSAGE,/post/Tech-to-Goldman-Sachs-dolam31E,Goldman-Sachs
3,"Jan 6, 2020",I loved GS. Give it a shot. Loads of ex-FAANG there.,3,wackwack,/company/Microsoft/,SEND PRIVATE MESSAGE,/post/Tech-to-Goldman-Sachs-dolam31E,Goldman-Sachs
4,"Jan 6, 2020",If it’s a good team it’s a fine decision.  Just don’t end up in some team using Slang or stuck in a C++98 codebase full of macros or something.,3,Kristaps11,/company/Susquehanna/,Eng,/post/Tech-to-Goldman-Sachs-dolam31E,Goldman-Sachs
0,"Feb 17, 2019","Yep, me to",0,dytA68,/company/The-Home-Depot/,SEND PRIVATE MESSAGE,/post/Goldman-Sachs-Ktrsgy61,Goldman-Sachs
1,"Feb 17, 2019","Yes, pm if you want",0,amazoha,/company/Amazon/,SEND PRIVATE MESSAGE,/post/Goldman-Sachs-Ktrsgy61,Goldman-Sachs
0,"Aug 20, 2020",98k? Sounds low for a VP.,17,SuperlowTC,/company/Uber/,SEND PRIVATE MESSAGE,/post/Goldman-Sachs-Tech-VP-Salary-1WE74tcF,Goldman-Sachs
1,"Aug 20, 2020",VP is a common title in finance. I know a couple of guys who have VP title but they are  Senior Developers.,6,SVAM67,/company/Reckitt-Benckiser/,SEND PRIVATE MESSAGE,/post/Goldman-Sachs-Tech-VP-Salary-1WE74tcF,Goldman-Sachs
2,"Aug 20, 2020","VP in a bank can be anything from a senior teller (VP title for customer cred) to a division head. Risk VP should be somewhere in between.These days they usually have AVP, SVP, EVP to distinguish more",0,fincoder,/company/CME-Group/,SEND PRIVATE MESSAGE,/post/Goldman-Sachs-Tech-VP-Salary-1WE74tcF,Goldman-Sachs
3,"Aug 20, 2020","Lol, GS VPs, I earn in INR, and somehow I feel richer than these black suit VPs",4,BigButts,/company/Intuit/,SEND PRIVATE MESSAGE,/post/Goldman-Sachs-Tech-VP-Salary-1WE74tcF,Goldman-Sachs
4,"Aug 20, 2020","Fyi, people no longer dress all formal at GS. That stereotype no longer holds up",2,pMTe71,/company/Goldman-Sachs/,SEND PRIVATE MESSAGE,/post/Goldman-Sachs-Tech-VP-Salary-1WE74tcF,Goldman-Sachs
5,"Aug 20, 2020","I know dude, I was just making fun of their job levels ...",0,BigButts,/company/Intuit/,SEND PRIVATE MESSAGE,/post/Goldman-Sachs-Tech-VP-Salary-1WE74tcF,Goldman-Sachs
6,"Aug 20, 2020","You are getting absolutely screwed. Base should be 150-250, patc from 250-400. Obviously the top ends are for senior VPs. You will not be able to negotiate your base. You can threaten to leave and IF you are high value your manager can go to bat but HCM decides bases and manager allocates bonus.",5,maae11,/company/Goldman-Sachs/,SEND PRIVATE MESSAGE,/post/Goldman-Sachs-Tech-VP-Salary-1WE74tcF,Goldman-Sachs
7,"Aug 20, 2020","I know it’s very low and I’m getting screwed that’s why I’m looking to get more info on what others make before I approach my manager about it. I’m basically at my breaking point, if I don’t get upped to at least 125k base I’ll leave to a different firm",0,pMTe71,/company/Goldman-Sachs/,SEND PRIVATE MESSAGE,/post/Goldman-Sachs-Tech-VP-Salary-1WE74tcF,Goldman-Sachs
8,"Aug 28, 2020",Can’t negotiate without leverage. Get external offers,0, 🐍.py,/company/Intel/,SEND PRIVATE MESSAGE,/post/Goldman-Sachs-Tech-VP-Salary-1WE74tcF,Goldman-Sachs
9,"Aug 20, 2020",Joined right after my bachelors degree,0,pMTe71,/company/Goldman-Sachs/,SEND PRIVATE MESSAGE,/post/Goldman-Sachs-Tech-VP-Salary-1WE74tcF,Goldman-Sachs
10,"Aug 20, 2020",Didn't you say you are in risk division? I'm in tech but work closely with risk folks  no offence but all they do is punch cards.,0,HPNb38,/company/Goldman-Sachs/,SEND PRIVATE MESSAGE,/post/Goldman-Sachs-Tech-VP-Salary-1WE74tcF,Goldman-Sachs
11,"Aug 20, 2020","I interviewed at GS last year for swe and they offered me 200k associate TC. I don’t have yoe so was confused, possibly they were trying to match google/amazon and needed to slot me for a higher level. I had applied for the experienced position and some wires seemed to be crossed so it was mostly a system design interview. Luckily I studied for system design bc another interview required it.In any case you are way underpaid. I believe it was 140 base and 60 bonus for the breakdown for 200. I hear VP should be 250-300k+. Not sure how your tc is that low.",4,mok,/company/Google/,SEND PRIVATE MESSAGE,/post/Goldman-Sachs-Tech-VP-Salary-1WE74tcF,Goldman-Sachs
12,"Aug 20, 2020","Thanks, this is really helpful.",0,pMTe71,/company/Goldman-Sachs/,SEND PRIVATE MESSAGE,/post/Goldman-Sachs-Tech-VP-Salary-1WE74tcF,Goldman-Sachs
13,"Aug 20, 2020",Np! Good luck and let us know how it goes!,0,mok,/company/Google/,SEND PRIVATE MESSAGE,/post/Goldman-Sachs-Tech-VP-Salary-1WE74tcF,Goldman-Sachs
0,"Sep 15, 2020","🤷🏻‍♂️ depends on the team, but generally if you are a strictly engineering SWE its flexible but if you are aligned to a finance division they're much more ruthless",3,PAUL ALLEN,/company/Goldman-Sachs/,SEND PRIVATE MESSAGE,/post/Goldman-Sachs-Culture-6bdXNWzp,Goldman-Sachs
1,"Sep 15, 2020",Both amazon and gs wlb sucks...only 💲💲💲💰💰,2,ssoic,/company/Salesforce/,IT,/post/Goldman-Sachs-Culture-6bdXNWzp,Goldman-Sachs
2,"Sep 14, 2020",At any company culture varies from team to team but I would choose a good team over more money any day. Unless you make more at GS to have someone else take care of your dad.,2,WLyA20,/company/Lockheed-Martin/,SEND PRIVATE MESSAGE,/post/Goldman-Sachs-Culture-6bdXNWzp,Goldman-Sachs
3,"Sep 14, 2020",Can I DM you? How did you get an interview at GS Singapore?,2,gallagher_,/company/Amazon/,SEND PRIVATE MESSAGE,/post/Goldman-Sachs-Culture-6bdXNWzp,Goldman-Sachs
4,"Sep 15, 2020",GS TC please,1,lalalola,nan,SEND PRIVATE MESSAGE,/post/Goldman-Sachs-Culture-6bdXNWzp,Goldman-Sachs
0,"Nov 11, 2018",A Goldman Sachs recruiter told me they have higher bar than Google. I was speechless.,26,Apollon,nan,Eng,/post/Goldman-Sachs-guys-is-this-true-YNWekxBP,Goldman-Sachs
1,"Nov 11, 2018",@public2 I suspect your friends are bullshitting you. 7 figures for non-business or MD isn't a thing. Which group are they in?,6,'' '' '' ',/company/Morgan-Stanley/,Mgmt,/post/Goldman-Sachs-guys-is-this-true-YNWekxBP,Goldman-Sachs
2,"Nov 11, 2018",My interview for GS was harder than for Google,2,arElend,/company/Goldman-Sachs/,IT,/post/Goldman-Sachs-guys-is-this-true-YNWekxBP,Goldman-Sachs
3,"Nov 11, 2018",Well even Tinder says that you’ll meet the best person in your life very soon who will provide you absolute joy and happiness.We all know how it actually is for the majority.,49,JohnMcPee,/company/McAfee/,SEND PRIVATE MESSAGE,/post/Goldman-Sachs-guys-is-this-true-YNWekxBP,Goldman-Sachs
4,"Nov 11, 2018","Let me translate the email for you:""we do a lot of IPOs and we saw people getting rich doing this 'tech' thing. We are smart and we want in too.Our CEO read the lean startup by Eric reiss and got some budget to hire a bunch of Junior engineers to run around and hopefully something will stick.Meanwhile, our newest 2018 partner class of 70 MVPs consists of 25 investment bankers, 25 traders, and 20 from other random areas, including TWO technologists.This highlights our C-level commitment to be a tech company, just like Google. In fact, we now have casual Fridays and free bananas.We heard Facebook knows how to hire people who know computers. Please come be our lab rat.Sincerely,External recruiter who we hired to spin our story""",48,loveyoumom,/company/Google/,SEND PRIVATE MESSAGE,/post/Goldman-Sachs-guys-is-this-true-YNWekxBP,Goldman-Sachs
5,"Nov 11, 2018",This,0,dksm,/company/Google/,SEND PRIVATE MESSAGE,/post/Goldman-Sachs-guys-is-this-true-YNWekxBP,Goldman-Sachs
6,"Nov 11, 2018",Lol,0,leet4job,nan,SEND PRIVATE MESSAGE,/post/Goldman-Sachs-guys-is-this-true-YNWekxBP,Goldman-Sachs
7,"Nov 11, 2018","If your CEO dresses in a suit and has never written a line of code, you are probably not a tech company. GS is a bank.",26,loveyoumom,/company/Google/,SEND PRIVATE MESSAGE,/post/Goldman-Sachs-guys-is-this-true-YNWekxBP,Goldman-Sachs
8,"Nov 11, 2018",Bezos has never written code either.,0,@zzz,/company/Microsoft/,Product,/post/Goldman-Sachs-guys-is-this-true-YNWekxBP,Goldman-Sachs
9,"Nov 11, 2018",Bezos majored computer science in Princeton and probably coded like crazy for projects.,7,/_-\,/company/Microsoft/,SEND PRIVATE MESSAGE,/post/Goldman-Sachs-guys-is-this-true-YNWekxBP,Goldman-Sachs
10,"Nov 11, 2018","https://www.bloomberg.com/news/articles/2018-11-07/goldman-names-69-new-partners-as-ceo-solomon-reins-in-promotions""Traders and investment bankers made up 71 percent of the firm’s latest partner class, the highest proportion in at least eight years. The back-office staff and asset-management division bore the brunt of a decline in the overall size in the class.""FYI, the technology department is in the ""back office"" category.Tech firm lol!",18,loveyoumom,/company/Google/,SEND PRIVATE MESSAGE,/post/Goldman-Sachs-guys-is-this-true-YNWekxBP,Goldman-Sachs
11,"Nov 11, 2018",@OP should reply to the message with this.,1,599,/company/State-Farm/,Eng,/post/Goldman-Sachs-guys-is-this-true-YNWekxBP,Goldman-Sachs
12,"Nov 11, 2018",Back office or back orifice?,0,ioUp78,/company/Ayasdi/,SEND PRIVATE MESSAGE,/post/Goldman-Sachs-guys-is-this-true-YNWekxBP,Goldman-Sachs
0,"Feb 3, 2020",I had the exact same offers. What's your YoE?,0,stale,/company/Arcesium/,SEND PRIVATE MESSAGE,/post/Microsoft-Hyderabad-vs-Goldman-Sach-Bangalore-7QhK54OQ,Goldman-Sachs
1,"Feb 4, 2020",I meant the companies not the TC,0,stale,/company/Arcesium/,SEND PRIVATE MESSAGE,/post/Microsoft-Hyderabad-vs-Goldman-Sach-Bangalore-7QhK54OQ,Goldman-Sachs
2,"Feb 21, 2020",Moron,11,aqa,/company/Amazon/,SEND PRIVATE MESSAGE,/post/Microsoft-Hyderabad-vs-Goldman-Sach-Bangalore-7QhK54OQ,Goldman-Sachs
3,"Feb 3, 2020",Negotiate at MSFT. Plus MSFT stock is bound to do well. Your bonus at GS is not guaranteed but your stock is along with the upward appreciation.Plus MSFT is a tech company while GS is a bank. Where do you think you would get challenging work? That's a question that you can answer.,7,nero2020,/company/Amazon/,SEND PRIVATE MESSAGE,/post/Microsoft-Hyderabad-vs-Goldman-Sach-Bangalore-7QhK54OQ,Goldman-Sachs
4,"Feb 3, 2020",Challenging work at msft haha joke of the day.,3,राईता,/company/Microsoft/,Eng,/post/Microsoft-Hyderabad-vs-Goldman-Sach-Bangalore-7QhK54OQ,Goldman-Sachs
5,"Feb 3, 2020",GS base is too good and high to leave,3,tacaret,/company/Oracle/,SEND PRIVATE MESSAGE,/post/Microsoft-Hyderabad-vs-Goldman-Sach-Bangalore-7QhK54OQ,Goldman-Sachs
6,"Feb 3, 2020",YoE: 9.5:years,0,devil3435,/company/Flipkart/,SEND PRIVATE MESSAGE,/post/Microsoft-Hyderabad-vs-Goldman-Sach-Bangalore-7QhK54OQ,Goldman-Sachs
7,"Feb 3, 2020",Looks a lvl 63 in msft to me. Guessing around 8 yoe. Op can correct me,3,Ebricantwe,/company/Uber/,SEND PRIVATE MESSAGE,/post/Microsoft-Hyderabad-vs-Goldman-Sach-Bangalore-7QhK54OQ,Goldman-Sachs
8,"Feb 3, 2020",YoE: 9.5:years,0,devil3435,/company/Flipkart/,SEND PRIVATE MESSAGE,/post/Microsoft-Hyderabad-vs-Goldman-Sach-Bangalore-7QhK54OQ,Goldman-Sachs
9,"Feb 3, 2020",YoE?,3,greatnext,/company/Bloomberg/,SEND PRIVATE MESSAGE,/post/Microsoft-Hyderabad-vs-Goldman-Sach-Bangalore-7QhK54OQ,Goldman-Sachs
10,"Feb 3, 2020",YoE: 9.5:years,0,devil3435,/company/Flipkart/,SEND PRIVATE MESSAGE,/post/Microsoft-Hyderabad-vs-Goldman-Sach-Bangalore-7QhK54OQ,Goldman-Sachs
0,Feb 4,"Low ball, 500k at GS is really more like 350 elsewhere. Read the stock award agreement carefully, there are vesting and selling restrictions, basically you only get the stock portion of year 1, in full, if you stay 7 years. If you leave, they cancel your stock and you lose that compensation (even though you worked for it). It is basically a scam.",2,WpnY61,/company/Goldman-Sachs/,SEND PRIVATE MESSAGE,/post/Goldman-VP-eng-TC-Is-500k-reasonable-m5Om38sj,Goldman-Sachs
1,Feb 5,"Yep, I am certain.. Not sure about the exact formula but 20% of comp above 250 sounds about right.",0,GSlut,/company/Goldman-Sachs/,SEND PRIVATE MESSAGE,/post/Goldman-VP-eng-TC-Is-500k-reasonable-m5Om38sj,Goldman-Sachs
2,Feb 6,"This is true. If you are comparing with other tech companies, expect only 75% of bonus.",0,spju46,/company/Goldman-Sachs/,SEND PRIVATE MESSAGE,/post/Goldman-VP-eng-TC-Is-500k-reasonable-m5Om38sj,Goldman-Sachs
3,Feb 4,GS has over 12K VPs. 1 in ~4 employee is a VP.  Your salary depends on relevant experience. The range is fairly broad. Do you have a offer ?,0,wachowski,/company/Oracle/,SEND PRIVATE MESSAGE,/post/Goldman-VP-eng-TC-Is-500k-reasonable-m5Om38sj,Goldman-Sachs
4,Feb 7,Bonus can vary though... You may or may not hit the same number every year,0,vptr,/company/Credit-Suisse/,SEND PRIVATE MESSAGE,/post/Goldman-VP-eng-TC-Is-500k-reasonable-m5Om38sj,Goldman-Sachs
5,Feb 7,"Generally for meeting expectations, people will make same amount as last year and it will increase if exceeding performance.",0,ballet,/company/Goldman-Sachs/,SEND PRIVATE MESSAGE,/post/Goldman-VP-eng-TC-Is-500k-reasonable-m5Om38sj,Goldman-Sachs
6,Feb 4,It’s reasonable if your experience is similar to a typical L6 FANG. There are some engineers significantly higher.,1,ekJr28,/company/Goldman-Sachs/,SEND PRIVATE MESSAGE,/post/Goldman-VP-eng-TC-Is-500k-reasonable-m5Om38sj,Goldman-Sachs
7,Feb 4,"I’ve seen VPs make <$200k, I’ve seen VPs make >$500kAverages aren’t reliable cause VP at GS spans so wide",1,gsguy,/company/Goldman-Sachs/,SEND PRIVATE MESSAGE,/post/Goldman-VP-eng-TC-Is-500k-reasonable-m5Om38sj,Goldman-Sachs
8,Feb 4,"It is possible but unlikely. VP/ED at goldman is very wide, going from a newly minted senior engineer to org leaders that haven't made it to MD yet.",0,sweeeeee,/company/Facebook/,Eng,/post/Goldman-VP-eng-TC-Is-500k-reasonable-m5Om38sj,Goldman-Sachs
0,"Sep 12, 2020",POS.Good engineers will interview and leave. Those who can’t find job elsewhere will stay. GS will get what it deserves.,28,cruelIa,/company/Roku/,SEND PRIVATE MESSAGE,/post/Opinion-about-Goldman-Sachs-return-to-office-policy-pSTLNN5G,Goldman-Sachs
1,"Sep 14, 2020","By that logic, GS engineering headcount in Asia should have been decimated by now.",0,goldman_ma,/company/Goldman-Sachs/,SEND PRIVATE MESSAGE,/post/Opinion-about-Goldman-Sachs-return-to-office-policy-pSTLNN5G,Goldman-Sachs
2,"Sep 14, 2020",A lot of people are too nervous and scared to make that jump,2,biotin,/company/PwC/,SEND PRIVATE MESSAGE,/post/Opinion-about-Goldman-Sachs-return-to-office-policy-pSTLNN5G,Goldman-Sachs
3,"Sep 13, 2020",Honestly don’t think engineering should be forced to go. We’re just as productive if not moreso at home. Without the hours of commute.,9,fWRn37,/company/Goldman-Sachs/,Eng,/post/Opinion-about-Goldman-Sachs-return-to-office-policy-pSTLNN5G,Goldman-Sachs
4,"Sep 14, 2020",When you get back in the office zoom your boss from your desk just to spite them.,0,ProphetPZ,/company/Blend/,SEND PRIVATE MESSAGE,/post/Opinion-about-Goldman-Sachs-return-to-office-policy-pSTLNN5G,Goldman-Sachs
5,"Sep 14, 2020",If your work is operable even if you work from home you should be able to do so,0,biotin,/company/PwC/,SEND PRIVATE MESSAGE,/post/Opinion-about-Goldman-Sachs-return-to-office-policy-pSTLNN5G,Goldman-Sachs
6,"Sep 12, 2020","I don’t think people should be FORCED to return, especially for those with extenuating health circumstances. However, I do think a lot of people are ready to return. A lot of the banks have been utilizing surveys to make their decisions on returning to office.",7,igk65,/company/Morgan-Stanley/,SEND PRIVATE MESSAGE,/post/Opinion-about-Goldman-Sachs-return-to-office-policy-pSTLNN5G,Goldman-Sachs
7,"Sep 14, 2020","It should at least be based on personal decision, this impacts health so you should have the flexibility to choose",0,biotin,/company/PwC/,SEND PRIVATE MESSAGE,/post/Opinion-about-Goldman-Sachs-return-to-office-policy-pSTLNN5G,Goldman-Sachs
8,"Sep 18, 2020",YEa only thing is you will likely lose your job if you're the only one NOT there...,0,swimmer 🏊 ,nan,SEND PRIVATE MESSAGE,/post/Opinion-about-Goldman-Sachs-return-to-office-policy-pSTLNN5G,Goldman-Sachs
9,"Sep 13, 2020",Seems pretty dumb. Unsurprising that once again GS leads the way in not gaf about its employees,7,PAUL ALLEN,/company/Goldman-Sachs/,SEND PRIVATE MESSAGE,/post/Opinion-about-Goldman-Sachs-return-to-office-policy-pSTLNN5G,Goldman-Sachs
10,"Sep 14, 2020","The firm comes first, second, and last",1,cointoss2,/company/Jefferies/,IT,/post/Opinion-about-Goldman-Sachs-return-to-office-policy-pSTLNN5G,Goldman-Sachs
11,"Sep 18, 2020",Hey I think JPM did it first though,0,swimmer 🏊 ,nan,SEND PRIVATE MESSAGE,/post/Opinion-about-Goldman-Sachs-return-to-office-policy-pSTLNN5G,Goldman-Sachs
12,"Sep 12, 2020",Very selfish and hasty,8,'-',/company/Deutsche-Bank/,Eng,/post/Opinion-about-Goldman-Sachs-return-to-office-policy-pSTLNN5G,Goldman-Sachs
0,"Apr 24, 2020",Avoid banks. Trust me. AVOID!,8,iDon’t,/company/Apple/,IT,/post/Goldman-Sachs-vs-Ebay-J8XRQAH0,Goldman-Sachs
1,"Apr 25, 2020",I fully endorse the message above.,1,dexderp,/company/Goldman-Sachs/,SEND PRIVATE MESSAGE,/post/Goldman-Sachs-vs-Ebay-J8XRQAH0,Goldman-Sachs
2,"Apr 24, 2020","If engineering, EBay is definitely better  than GS.",3,Marcus_❤️,/company/Goldman-Sachs/,SEND PRIVATE MESSAGE,/post/Goldman-Sachs-vs-Ebay-J8XRQAH0,Goldman-Sachs
3,"Apr 25, 2020",BS.which crappy part of Marcus do you work on?,1,modi-jee,/company/Goldman-Sachs/,SEND PRIVATE MESSAGE,/post/Goldman-Sachs-vs-Ebay-J8XRQAH0,Goldman-Sachs
4,"Apr 25, 2020",For SWE go with eBay.,1,dexderp,/company/Goldman-Sachs/,SEND PRIVATE MESSAGE,/post/Goldman-Sachs-vs-Ebay-J8XRQAH0,Goldman-Sachs
