,comment_date,comment_text,comment_like,comment_user,comment_firm,comment_position,comment_url,company
7,"Oct 7, 2018","For APB, it depends on your initial APB rating while you’re hired. QPB will be announced after each quarter Corp performance (typical is few days of your daily salary).",0,QQpapa,/company/Google/,SEND PRIVATE MESSAGE,/post/Intel-tc-jjvwUVJn,Intel
8,"Oct 7, 2018","Higher than globalfoundries, lower than market",0,fm5,/company/Intel/,SEND PRIVATE MESSAGE,/post/Intel-tc-jjvwUVJn,Intel
9,"Oct 7, 2018",That’s subjective ;) gf was a good payer tbh,0,rm -rf *,/company/GLOBALFOUNDRIES/,SEND PRIVATE MESSAGE,/post/Intel-tc-jjvwUVJn,Intel
10,"Oct 6, 2018",No idea about that as I got the offer for 6 verbally by the hiring manager but they were gonna give me the numbers later. I got another offer which was well above I wanted so I took that so never got those numbers.,0,6’4 Indian,/company/Qualcomm/,SEND PRIVATE MESSAGE,/post/Intel-tc-jjvwUVJn,Intel
11,"Oct 6, 2018",Aah okay. What location was that,0,rm -rf *,/company/GLOBALFOUNDRIES/,SEND PRIVATE MESSAGE,/post/Intel-tc-jjvwUVJn,Intel
0,"Nov 6, 2018",OP would you mind to share why you are leaving? Is it all about TC and jumping the ship? I am considering to join Intel as an Architect!,0,Dude02,/company/Dell/,R&D,/post/Pay-Back-Intel-Signing-Bonus-hSNYdPKQ,Intel
1,"Nov 7, 2018","It has IR (improvement required) focal rating or SSL4 (stock share level, your RSU refreshers, SSL3 is for meet expectations, SSL4 is barely any RSUs) for Grade 7 and above, which marks you as targeted for the next large layoff. It's pretty hard to get IR unless your manager doesn't like you. But getting SSL4 is possible. The hilarious this was that in the last large layoff (in 2016 called ACT - Accelerating Change and Transformation LOL) of 12-15k people, the criteria was either IR or SSL4 in the past couple of years, managers had no clue that giving a report an SSL4 meant cya. NO IDEA. So some people who unfortunately got SSL4 had to be walked out, with the manager and report both dumbfounded at what happened.There was an ex-poster/high level manager here by the name of nononsense who had to walk his report out, then successfully appealed that decision and rehired the report because he had no idea SSL4 meant ""out on your ass."" HR decided to conduct training AFTER ACT to realign focal expectations and consequences. I remember the MCM (CEO and inner circle high level execs) said in a townhall something to the effect of ""tough luck, you should have known that SSL4 meant f u, cya"" to a manager who complained about this. There is a huge disconnect between the MCM and front line managers here.Fuck Intel and Fuck BK, but congrats to BK on his new job! But seriously, fuck that Insider Traitor.",2,(⌐■_■),/company/Intel/,SEND PRIVATE MESSAGE,/post/Pay-Back-Intel-Signing-Bonus-hSNYdPKQ,Intel
2,"Nov 7, 2018","Not a great place to work unfortunately (contrary to their claims). Very old school, very political, not the best place to learn and grow for an early career professional.",2,gpuguy,/company/Intel/,SEND PRIVATE MESSAGE,/post/Pay-Back-Intel-Signing-Bonus-hSNYdPKQ,Intel
3,"Oct 26, 2018","Yeah, pretty sure there is a payback clause. But, congrats on GTFO! What was the straw that broke the camel's back? Many straws, I know.",7,BK'sBoyToy,/company/Intel/,SEND PRIVATE MESSAGE,/post/Pay-Back-Intel-Signing-Bonus-hSNYdPKQ,Intel
4,"Oct 26, 2018","I resigned after working there for a month. There was not anything written in offer or anywhere in the final documents indicating we have to return the bonus. I left 3 weeks ago and got my final paycheck within 72 hours, they have not asked for sign on bonus yet.",2,Eaaefvl,/company/Intel/,SEND PRIVATE MESSAGE,/post/Pay-Back-Intel-Signing-Bonus-hSNYdPKQ,Intel
5,"Oct 26, 2018",How much was your signing bonus if you don't mind my asking?,0,gpuguy,/company/Intel/,SEND PRIVATE MESSAGE,/post/Pay-Back-Intel-Signing-Bonus-hSNYdPKQ,Intel
6,"Oct 26, 2018",20k,0,Eaaefvl,/company/Intel/,SEND PRIVATE MESSAGE,/post/Pay-Back-Intel-Signing-Bonus-hSNYdPKQ,Intel
7,"Oct 26, 2018",Exit interview? They do those at Intel? I’d just skip that interview,3,PhilSchill,/company/Blackberry/,Other,/post/Pay-Back-Intel-Signing-Bonus-hSNYdPKQ,Intel
8,"Oct 26, 2018","If there is no clause or the decision to leave was Intel’s, you shouldn’t have to pay a dime",2,PhilSchill,/company/Blackberry/,Other,/post/Pay-Back-Intel-Signing-Bonus-hSNYdPKQ,Intel
9,"Oct 26, 2018","There is no clause, which is in your favor. No need to let them know",0,PhilSchill,/company/Blackberry/,Other,/post/Pay-Back-Intel-Signing-Bonus-hSNYdPKQ,Intel
10,"Oct 26, 2018",Thanks PhilSchill!,0,gpuguy,/company/Intel/,SEND PRIVATE MESSAGE,/post/Pay-Back-Intel-Signing-Bonus-hSNYdPKQ,Intel
0,"Sep 26, 2020","The general rule of thumb is 4-5 years to jump grade at Intel. But 8 to 9 is usually harder, I think 7-8 seems about common. The average grade at Intel is 7.",3,IntelTME19,/company/Intel/,Eng,/post/Intel-AI---Time-to-promo-from-Grade-8-to-Grade-9-in-Intel-AI-RD-Software-team-3ypWa44r,Intel
1,"Sep 27, 2020","Intel burnt a ton of money hiring people to work on nervana projects in 2016; the hiring packages were close to faang. Well, it ended up letting those people go.",1,lbve43,/company/Apple/,SEND PRIVATE MESSAGE,/post/Intel-AI---Time-to-promo-from-Grade-8-to-Grade-9-in-Intel-AI-RD-Software-team-3ypWa44r,Intel
2,"Oct 9, 2020",I don’t think they were let go. They were integrated into movidius or something,0,bwnavelwp,/company/Oracle/,SEND PRIVATE MESSAGE,/post/Intel-AI---Time-to-promo-from-Grade-8-to-Grade-9-in-Intel-AI-RD-Software-team-3ypWa44r,Intel
3,"Sep 26, 2020",about 10 years,2,Eat it,/company/Apple/,SEND PRIVATE MESSAGE,/post/Intel-AI---Time-to-promo-from-Grade-8-to-Grade-9-in-Intel-AI-RD-Software-team-3ypWa44r,Intel
4,"Oct 5, 2020",What was your TC bump from 8-9?,0,bs do,/company/Google/,SEND PRIVATE MESSAGE,/post/Intel-AI---Time-to-promo-from-Grade-8-to-Grade-9-in-Intel-AI-RD-Software-team-3ypWa44r,Intel
5,"Oct 6, 2020","11% promo raise, nothing too amazing (it is Intel after all). Right now 230-240k TC, which isn’t bad for Oregon (and I’m in the lower end for my job role and grade).",1,dontaskivy,/company/Intel/,SEND PRIVATE MESSAGE,/post/Intel-AI---Time-to-promo-from-Grade-8-to-Grade-9-in-Intel-AI-RD-Software-team-3ypWa44r,Intel
6,"Sep 26, 2020","For a promo, you need to be already performing at grade 9 level and there has to be a business need for a higher grade role in the team. And in general, it tends to get more tougher to go higher up in the grades, above grade 8. Make sure your compa ratio is good and you are getting good RSU’s.",3,userabc,/company/Intel/,SEND PRIVATE MESSAGE,/post/Intel-AI---Time-to-promo-from-Grade-8-to-Grade-9-in-Intel-AI-RD-Software-team-3ypWa44r,Intel
7,"Sep 26, 2020",Thanks userabc and pfel15. Really valuable info.,1,The_Batman,/company/Adobe/,SEND PRIVATE MESSAGE,/post/Intel-AI---Time-to-promo-from-Grade-8-to-Grade-9-in-Intel-AI-RD-Software-team-3ypWa44r,Intel
8,"Oct 4, 2020",Whats is good enough comp ratio at any given grade?,0,wnmx47,/company/Intel/,SEND PRIVATE MESSAGE,/post/Intel-AI---Time-to-promo-from-Grade-8-to-Grade-9-in-Intel-AI-RD-Software-team-3ypWa44r,Intel
9,"Oct 5, 2020","By the time you are ready for promo, the group might cease to exist...",5,ghantaa,/company/Google/,SEND PRIVATE MESSAGE,/post/Intel-AI---Time-to-promo-from-Grade-8-to-Grade-9-in-Intel-AI-RD-Software-team-3ypWa44r,Intel
10,"Sep 27, 2020","10 years is way too much unless we’re talking total yoe. I’m planning on getting 9 next year with 10 yoe and starting at 3. I would agree with the politics comment, it definitely helps if you’ve saved some fellows out of some tight spots.",1,AQdM01,/company/Intel/,SEND PRIVATE MESSAGE,/post/Intel-AI---Time-to-promo-from-Grade-8-to-Grade-9-in-Intel-AI-RD-Software-team-3ypWa44r,Intel
11,"Sep 27, 2020","No papers, right, you definitely need folks advocating for you outside your team. Try to pickup some work outside your team with something that’s time to market critical. Things take course from there.",1,AQdM01,/company/Intel/,SEND PRIVATE MESSAGE,/post/Intel-AI---Time-to-promo-from-Grade-8-to-Grade-9-in-Intel-AI-RD-Software-team-3ypWa44r,Intel
12,"Sep 27, 2020",Thanks AQdM01. That makes sense. I am quite new to Intel. This advice is really helpful.,0,The_Batman,/company/Adobe/,SEND PRIVATE MESSAGE,/post/Intel-AI---Time-to-promo-from-Grade-8-to-Grade-9-in-Intel-AI-RD-Software-team-3ypWa44r,Intel
0,"Sep 3, 2020",🔮,4,PlSj28,/company/Qualcomm/,SEND PRIVATE MESSAGE,/post/Intel-stock-5YQLc6a8,Intel
1,"Sep 3, 2020","If people could accurately predict that, they'd not be salaried employees. Don't listen to these clowns thinking they can guess it",2,hzzh73,/company/Intel/,SEND PRIVATE MESSAGE,/post/Intel-stock-5YQLc6a8,Intel
2,Jan 13,There’s your 60 in about 3.5 months! Now we know who the clown is 🤡,1,hmm19,/company/Wellington-Management/,SEND PRIVATE MESSAGE,/post/Intel-stock-5YQLc6a8,Intel
3,"Sep 3, 2020",Don't sell Intel.. it will hit 60+ very soon.. its a great stock to own,1,LuvWalStrt,/company/SAP/,SEND PRIVATE MESSAGE,/post/Intel-stock-5YQLc6a8,Intel
4,"Sep 3, 2020","If you can wait till Feb 2021, it will. Before that stock market is very volatile.",1,manAF,/company/Microsoft/,SEND PRIVATE MESSAGE,/post/Intel-stock-5YQLc6a8,Intel
0,"Nov 10, 2020",Don't take it! Intel is a horrible place to work.,3,DrBelle,/company/Intel/,SEND PRIVATE MESSAGE,/post/Intel-offer-eval-help-zZHVukGv,Intel
1,"Nov 10, 2020",These days outsides equally bad too. Just little more money. 😰,0,rEoN64,/company/Cadence-Design-Systems/,SEND PRIVATE MESSAGE,/post/Intel-offer-eval-help-zZHVukGv,Intel
2,"Nov 9, 2020","Thank you. What normal range is for RSU new hire at grade 8? Also, does Intel give pp regular RSU , which is vested in 4 years , in every focal ? Or , it is not guaranteed for regular RSU ? How much is it  for regular RSU at Grade 8?",0,uUkE20,/company/Western-Digital/,SEND PRIVATE MESSAGE,/post/Intel-offer-eval-help-zZHVukGv,Intel
3,"Nov 12, 2020",Second asking for this. If not more.,0,Heyllo,/company/Intel/,SEND PRIVATE MESSAGE,/post/Intel-offer-eval-help-zZHVukGv,Intel
4,"Nov 9, 2020",Not bad,0,rEoN64,/company/Cadence-Design-Systems/,SEND PRIVATE MESSAGE,/post/Intel-offer-eval-help-zZHVukGv,Intel
5,"Nov 9, 2020","Thank you. What normal range is for RSU new hire at grade 8? Also, does Intel give pp regular RSU , which is vested in 4 years , in every focal ? Or , it is not guaranteed for regular RSU ? How much is it  for regular RSU at Grade 8?",0,uUkE20,/company/Western-Digital/,SEND PRIVATE MESSAGE,/post/Intel-offer-eval-help-zZHVukGv,Intel
0,"Jul 20, 2018",Initial rsus are given as 40k which will vest over 4 years. Which is around 10k per year. I assume every year we will get that ?,0,TeamBlindG,/company/Qualcomm/,SEND PRIVATE MESSAGE,/post/Intel-Refresher-stocks-TmuSGJtp,Intel
1,"Jul 20, 2018",The refreshes would be half or so.,0,Then what,/company/Qualcomm/,SEND PRIVATE MESSAGE,/post/Intel-Refresher-stocks-TmuSGJtp,Intel
2,"Aug 1, 2018",Hi Can you share what the Base looks like for that kind of Initial RSU?Thanks,0,alank,/company/Microchip-Technology/,SEND PRIVATE MESSAGE,/post/Intel-Refresher-stocks-TmuSGJtp,Intel
3,"Jul 20, 2018",Barely 25k. More like 10-20. Source: I was a manager with gr8. Oh..I am an 8 IC now.,0,Stillwater,/company/Intel/,SEND PRIVATE MESSAGE,/post/Intel-Refresher-stocks-TmuSGJtp,Intel
4,"Jul 20, 2018",Grade 8 seems around 25k worth each year.,0,Then what,/company/Qualcomm/,SEND PRIVATE MESSAGE,/post/Intel-Refresher-stocks-TmuSGJtp,Intel
5,"Jul 20, 2018",What's your TC?,0,Jake96,/company/IBM/,SEND PRIVATE MESSAGE,/post/Intel-Refresher-stocks-TmuSGJtp,Intel
6,"Jul 20, 2018",What do they have on the offer letter?,0,Kefjjnc,/company/Apple/,SEND PRIVATE MESSAGE,/post/Intel-Refresher-stocks-TmuSGJtp,Intel
0,Mar 23,"About 20-25% when you factor in base and refreshers. I’d wait to see how intel does with the new CEO before taking the leap. Going out of Bay Area is easy coming back is not especially if you get stuck at intel and the company continues to decline as it did in the past decade. If you had started in Oregon 10 years ago maybe, but not now unless you are close to retirement age.",0,isdera,/company/Apple/,SEND PRIVATE MESSAGE,/post/Salary-adjustment-from-INTEL-Santa-Clara-gtgt-INTEL-Oregon-hPHDtBTk,Intel
1,Mar 22,Geo difference was ~13% (g7) in 2018,0,facetran,/company/Intel/,SEND PRIVATE MESSAGE,/post/Salary-adjustment-from-INTEL-Santa-Clara-gtgt-INTEL-Oregon-hPHDtBTk,Intel
0,"Oct 17, 2017",Should be around 25-30lakhs easily. 5yrs work ex after Bachelor in India earns 25laks for top tier companies like Samsung Intel QCom TI in India,1,hwguy,/company/Oracle/,Eng,/post/Intel-India-Salary-62jzZ3yW,Intel
1,"Oct 18, 2017",Yes,0,hwguy,/company/Oracle/,Eng,/post/Intel-India-Salary-62jzZ3yW,Intel
2,"Oct 18, 2017",25-30 total? Inclusive of stocks and bonus?,1,Ewbc56,/company/Intel/,SEND PRIVATE MESSAGE,/post/Intel-India-Salary-62jzZ3yW,Intel
3,"Oct 18, 2017",This is Intel not Google (or Microsoft).,1,bhgf,/company/Intel/,SEND PRIVATE MESSAGE,/post/Intel-India-Salary-62jzZ3yW,Intel
4,"Oct 18, 2017","My friend with 5 years of experience in US (Intel, Cali) was offered 22.5 lpa at Bangalore.",0,laidoff777,/company/Oracle/,SEND PRIVATE MESSAGE,/post/Intel-India-Salary-62jzZ3yW,Intel
5,"Nov 6, 2017",One of my friends did some interviews recently to get a feel of the mkt . Avg in VLSI was 30lpa and max was 35 . He had 4 yrs of exp,1,Oakenty,/company/Apple/,SEND PRIVATE MESSAGE,/post/Intel-India-Salary-62jzZ3yW,Intel
6,"Oct 18, 2017",How about 15 years exp gr9 architect?,0,snoopdoggi,/company/Intel/,SEND PRIVATE MESSAGE,/post/Intel-India-Salary-62jzZ3yW,Intel
0,"Jul 23, 2020",My TC at Intel: 196k. My current TC at FAANG: 405k. That’s it.,26,inzon,/company/Intel/,SEND PRIVATE MESSAGE,/post/So-many-Intel-employees-jumping-to-Apple-cAqHN1ux,Intel
1,"Jul 28, 2020",Location before and after?,0,fk-ccp,/company/Intel/,SEND PRIVATE MESSAGE,/post/So-many-Intel-employees-jumping-to-Apple-cAqHN1ux,Intel
2,"Jul 29, 2020",Both in Bay Area.,0,inzon,/company/Intel/,SEND PRIVATE MESSAGE,/post/So-many-Intel-employees-jumping-to-Apple-cAqHN1ux,Intel
3,"Jul 23, 2020","For every 2 Apple engineers that go to intel, 98 intel engineers go to Apple. This is not new OP",3,     .,/company/Intel/,SEND PRIVATE MESSAGE,/post/So-many-Intel-employees-jumping-to-Apple-cAqHN1ux,Intel
4,"Jul 24, 2020",I understand this. But I don't see as many posts of say AMD folks jumping to FAANG.,1,otHE06,/company/Intel/,SEND PRIVATE MESSAGE,/post/So-many-Intel-employees-jumping-to-Apple-cAqHN1ux,Intel
5,"Jul 24, 2020","AMD doesnt have that many people. The other thing is, blind is such a small sample space. Most people who are doing well and happy with their work won't come to blind",4,hCBP31,/company/Apple/,SEND PRIVATE MESSAGE,/post/So-many-Intel-employees-jumping-to-Apple-cAqHN1ux,Intel
6,"Jul 23, 2020","The longer you stay at Intel, the lower your pay compared with Market rate.",11,eeeeeeee,/company/Intel/,SEND PRIVATE MESSAGE,/post/So-many-Intel-employees-jumping-to-Apple-cAqHN1ux,Intel
7,"Jul 24, 2020",^this is so painfully true,0,LakeTravis,/company/Intel/,Eng,/post/So-many-Intel-employees-jumping-to-Apple-cAqHN1ux,Intel
8,"Jul 23, 2020",Apple TC is much higher for Intel engineer with grade 9 or below.,9,eeeeeeee,/company/Intel/,SEND PRIVATE MESSAGE,/post/So-many-Intel-employees-jumping-to-Apple-cAqHN1ux,Intel
9,"Jul 23, 2020","I spent 20 years at Intel without meeting a single former Apple employee.  Wait, just mike bell.  Only 1",8,tTpx65,/company/Apple/,SEND PRIVATE MESSAGE,/post/So-many-Intel-employees-jumping-to-Apple-cAqHN1ux,Intel
10,"Jul 23, 2020",To run CEO’s pet proejct,0,lbve43,/company/Apple/,SEND PRIVATE MESSAGE,/post/So-many-Intel-employees-jumping-to-Apple-cAqHN1ux,Intel
0,"Sep 17, 2020",Right now we have a freeze on external hiring unless it is someone with really special skills ( needs VP level approval) or an executive level job that cannot be filled internally.,1,Tiger Lake,/company/Intel/,SEND PRIVATE MESSAGE,/post/Intel-interview-process-LQOYFgvS,Intel
1,"Sep 18, 2020",I know many of the teams are actively interviewing both external and internal candidates...,2,gLss47,/company/Intel/,SEND PRIVATE MESSAGE,/post/Intel-interview-process-LQOYFgvS,Intel
2,"Sep 18, 2020",DCG  TMG and NSG  are frozen AFIK,0,Tiger Lake,/company/Intel/,SEND PRIVATE MESSAGE,/post/Intel-interview-process-LQOYFgvS,Intel
3,"Sep 16, 2020",are you moving because of covid shift policy?,0,fckHockAss,/company/Broadcom/,SEND PRIVATE MESSAGE,/post/Intel-interview-process-LQOYFgvS,Intel
4,"Sep 17, 2020",Yes thinking about it,0,amikondiro,/company/Broadcom/,SEND PRIVATE MESSAGE,/post/Intel-interview-process-LQOYFgvS,Intel
5,"Sep 18, 2020",What is covid shift policy?,0,NVLC71,/company/Intel/,SEND PRIVATE MESSAGE,/post/Intel-interview-process-LQOYFgvS,Intel
0,"Jun 13, 2019",no intel on this sorry,9,hsvakjdnwi,/company/Faircom/,Eng,/post/Intel-bought-barefoot-networks-xfPOF8S0,Intel
1,"Jun 13, 2019",250mil,0,()(),/company/Cisco/,SEND PRIVATE MESSAGE,/post/Intel-bought-barefoot-networks-xfPOF8S0,Intel
2,"Jun 18, 2019","It’s really bad if it is 350mil, guess folks haven’t made much.",0,tronp,/company/NVIDIA/,SEND PRIVATE MESSAGE,/post/Intel-bought-barefoot-networks-xfPOF8S0,Intel
3,"Jun 19, 2019","Yeah, some of my frnds were unhappy who worked at barefoot before They run out of money, so they forced for this buy. They might get good deal if they wait for couple more years.Just my thoughts",0,()(),/company/Cisco/,SEND PRIVATE MESSAGE,/post/Intel-bought-barefoot-networks-xfPOF8S0,Intel
4,"Jun 13, 2019","They make wine, right?",1,UseDeFeet,/company/Microsoft/,SEND PRIVATE MESSAGE,/post/Intel-bought-barefoot-networks-xfPOF8S0,Intel
5,"Jun 13, 2019",No just the bottle,0,ghsoibv,/company/eBay/,SEND PRIVATE MESSAGE,/post/Intel-bought-barefoot-networks-xfPOF8S0,Intel
6,"Jun 14, 2019",Damn looks like no SDN startup is going to make it to ipo,1,AsYK38,nan,SEND PRIVATE MESSAGE,/post/Intel-bought-barefoot-networks-xfPOF8S0,Intel
7,"Jun 15, 2019",340M,0,pITS32,/company/Facebook/,Eng,/post/Intel-bought-barefoot-networks-xfPOF8S0,Intel
8,"Jun 16, 2019",That seems very low,0,tronp,/company/NVIDIA/,SEND PRIVATE MESSAGE,/post/Intel-bought-barefoot-networks-xfPOF8S0,Intel
0,Apr 6,DM,0,andornot,/company/Intel/,SEND PRIVATE MESSAGE,/post/Referral-at-intel-4aGcJtes,Intel
1,Apr 17,"Hello, can I too dm you for the referral?",0,tdTS88,nan,SEND PRIVATE MESSAGE,/post/Referral-at-intel-4aGcJtes,Intel
2,Apr 19,Sure,0,andornot,/company/Intel/,SEND PRIVATE MESSAGE,/post/Referral-at-intel-4aGcJtes,Intel
3,Apr 4,Ping me,0,epnp,/company/Intel/,R&D,/post/Referral-at-intel-4aGcJtes,Intel
4,Apr 17,"Hello, can I too dm you for the referral?",0,tdTS88,nan,SEND PRIVATE MESSAGE,/post/Referral-at-intel-4aGcJtes,Intel
5,Apr 4,DM for PayPal,0,Kisofdeath,/company/PayPal/,SEND PRIVATE MESSAGE,/post/Referral-at-intel-4aGcJtes,Intel
0,"Dec 19, 2018",ARM. It's the best gen. X86 is legacy,6,NotInQ,/company/Qualcomm/,SEND PRIVATE MESSAGE,/post/Arm-vs-Intel-fyyLrzm6,Intel
1,"Dec 19, 2018",I work at intel and have friends who work at arm. So i cam give you a good advice. NEVER WORK AT INTEL!,5,feliz,/company/Intel/,SEND PRIVATE MESSAGE,/post/Arm-vs-Intel-fyyLrzm6,Intel
2,"Dec 20, 2018",Pick ARM. Intel cafeteria food is terrible and over priced.,2,scdrb,/company/Intel/,SEND PRIVATE MESSAGE,/post/Arm-vs-Intel-fyyLrzm6,Intel
3,"Dec 20, 2018","Had a colleague who moved from Intel to ARM earlier last year when our division got cut and told me about how much of a breathe of fresh air it was compared to Intel. I stayed for 1,5 years got promoted etc. Now I'm leaving for ARM too tired of Intel politics...",1,myriad,/company/Intel/,SEND PRIVATE MESSAGE,/post/Arm-vs-Intel-fyyLrzm6,Intel
4,"Dec 19, 2018","I worked at intel and the politics sucked , go to ArM",1,JustMeHa,/company/Bose-Corporation/,SEND PRIVATE MESSAGE,/post/Arm-vs-Intel-fyyLrzm6,Intel
0,"Oct 31, 2017",I'd guess base+bonus around $130k.  rsu would add a few thousand at that grade.,6,sillycon,/company/Intel/,SEND PRIVATE MESSAGE,/post/Intel-software-engineer-j86vY0bW,Intel
1,"Nov 1, 2017",This,0,JnxH15,/company/Intel/,Eng,/post/Intel-software-engineer-j86vY0bW,Intel
2,"Oct 31, 2017",It seems very unlike Intel will offer that much for someone with 7 years experience even if it's in the bay area.  Your friend is likely to be very disappointed.,3,FizzBuzz1,/company/Intel/,SEND PRIVATE MESSAGE,/post/Intel-software-engineer-j86vY0bW,Intel
3,"Oct 31, 2017",Any idea of range,0,cleveland,/company/Facebook/,SEND PRIVATE MESSAGE,/post/Intel-software-engineer-j86vY0bW,Intel
4,"Nov 1, 2017",Grade 6 or 7 isn't going to make 200k. I started as G7 with a PhD and my starting base was 120k. I fail to see how you get an extra 80k off of that lol. Even as SSL 1 that is 26k or so,2,zDAg88,/company/Intel/,SEND PRIVATE MESSAGE,/post/Intel-software-engineer-j86vY0bW,Intel
5,"Nov 5, 2017",How has it progressed from there?,0,pfID9198,/company/Intel/,SEND PRIVATE MESSAGE,/post/Intel-software-engineer-j86vY0bW,Intel
6,"Nov 2, 2017",Grade 7 is no where near 200k.  120 maybe.,1,3003green,/company/Intel/,SEND PRIVATE MESSAGE,/post/Intel-software-engineer-j86vY0bW,Intel
7,"Oct 31, 2017",Which grade?,0,JzuW42,/company/Intel/,SEND PRIVATE MESSAGE,/post/Intel-software-engineer-j86vY0bW,Intel
8,"Oct 31, 2017",6 to 7,0,cleveland,/company/Facebook/,SEND PRIVATE MESSAGE,/post/Intel-software-engineer-j86vY0bW,Intel
0,"Oct 16, 2019",HW or SW and YOE and current TC?,0,ablc,/company/Apple/,SEND PRIVATE MESSAGE,/post/Intel-Grade-9---TC-xxOruBff,Intel
1,"Oct 24, 2019",Intel can beat that TC in SC. Source - me.,1,mtbf,/company/Intel/,SEND PRIVATE MESSAGE,/post/Intel-Grade-9---TC-xxOruBff,Intel
2,"Feb 29, 2020",Yes intel can easily beat that number in SC with the latest pay grade changes,0,😎 diehard,/company/Intel/,SEND PRIVATE MESSAGE,/post/Intel-Grade-9---TC-xxOruBff,Intel
3,"Oct 16, 2019",Where ?,0,hrtl ,/company/Intel/,SEND PRIVATE MESSAGE,/post/Intel-Grade-9---TC-xxOruBff,Intel
4,"Oct 17, 2019","$20-50k RSU/yr on the old system. Bonuses can be higher than that, closer to 30%. $300k TC is reasonable in SC for G9, especially for new hires.",0,iSpyPi,/company/Intel/,SEND PRIVATE MESSAGE,/post/Intel-Grade-9---TC-xxOruBff,Intel
5,"Feb 26, 2020",Yes 300k makes sense for new hires.,0,😎 diehard,/company/Intel/,SEND PRIVATE MESSAGE,/post/Intel-Grade-9---TC-xxOruBff,Intel
6,"Oct 18, 2019",The median TC for Intel G9 is $247K. RSU sucks but the bonuses are big for G9.https://www.levels.fyi/SE/Intel/Google/Facebook,3,headbanger,/company/Broadcom/,Eng,/post/Intel-Grade-9---TC-xxOruBff,Intel
7,"Oct 18, 2019",Didn't know Intel pays this high for Grade 9 folks.  Just wow!!,2,DV_GUY,/company/Intel/,SEND PRIVATE MESSAGE,/post/Intel-Grade-9---TC-xxOruBff,Intel
8,"Oct 17, 2019",300 to 400K,0,errorh,/company/NVIDIA/,SEND PRIVATE MESSAGE,/post/Intel-Grade-9---TC-xxOruBff,Intel
9,"Oct 19, 2019",This would be G10.,1,RIDL,/company/Intel/,SEND PRIVATE MESSAGE,/post/Intel-Grade-9---TC-xxOruBff,Intel
0,"Oct 18, 2020",Simple - starve R&D spending with HC reductions to satisfy short term shareholder goals.  Implications not immediately evident but devastating over a couple generations.  If they can stop crooked Wall Street finance philosophies running the company maybe it will turn around but it’s getting to the tipping point.,4,rune35,/company/Intel/,SEND PRIVATE MESSAGE,/post/Intel-what-went-wrong-yNcDfrMB,Intel
1,"Oct 18, 2020",Bingo. Oh boy does that $10B stock buyback piss off the technicians. But this is exactly what you should expect when a CFO from eBay is in charge.,2,DK Country,/company/Intel/,SEND PRIVATE MESSAGE,/post/Intel-what-went-wrong-yNcDfrMB,Intel
2,"Oct 19, 2020","TLDR: management is milking the cow as long as they can, employees are visa slaves, incompetent or have no other tech company around.Intel fails for the same reason countries fail: failure to create strong institutions with checks and balances. Corruption creeps in at all levels and people start acting in their own benefit instead of the company's.Innovation is not encouraged and execution is not rewarded. Only perception, loyalty and managing up is rewarded so people start gaming the system pretending to work and screwing around with endless PowerPoints and calls until the inevitable reorg comes which resets the counters, people get shuffled around and accountability is lost.If you challenge the status quo about what and how it's done you'll get marginalized or managed out. Everybody in middle management hides their org's lack of results behind the fact that Intel has the biggest market share in CPUs even if they haven't contributed at all.",5,pleb,/company/Intel/,Eng,/post/Intel-what-went-wrong-yNcDfrMB,Intel
3,"Oct 19, 2020",I'm trying to understand the whole essay and trying to find truth in it. Please help with examples.,0,pfel15,/company/Intel/,Eng,/post/Intel-what-went-wrong-yNcDfrMB,Intel
4,"Oct 19, 2020",Are you for real ? You want me to give names and situations in a public forum ?,0,pleb,/company/Intel/,Eng,/post/Intel-what-went-wrong-yNcDfrMB,Intel
5,"Oct 18, 2020","I'm optimistic that things will get better in next 2/3 years but have to deliver on 7nm after that. There is underlying strength in various areas that will shine again as 10nm gets full steam ..ipc, enterprise level reliability and soon more capacity with additional fabs. There are positive cultural changes that seem to be insipred with Microsoft's own transformation post balmer.. now if 7nm could deliver on time that will certainly keep me optimistic",3,pfel15,/company/Intel/,Eng,/post/Intel-what-went-wrong-yNcDfrMB,Intel
