,comment_date,comment_text,comment_like,comment_user,comment_firm,comment_position,comment_url,company
8,"Mar 8, 2019",If you have an offer it’s valid. But likely non negotiable,0,JDDr47,/company/NVIDIA/,SEND PRIVATE MESSAGE,/post/Leave-Intel-for-NVIDIA-2wUXyO8z,Intel
9,"Mar 8, 2019","Where is the Nvidia team located, Santa Clara? Did you talk about scheduling visits to the main office, or will the position be remote 100% of time?",2,V6ene,/company/Intel/,SEND PRIVATE MESSAGE,/post/Leave-Intel-for-NVIDIA-2wUXyO8z,Intel
10,"Mar 8, 2019",You must be rock star in order for tuem to allow that.,0,orient,/company/Intel/,SEND PRIVATE MESSAGE,/post/Leave-Intel-for-NVIDIA-2wUXyO8z,Intel
11,"Mar 10, 2019",It is not super uncommon at NVIDIA,1,careerrc,/company/NVIDIA/,SEND PRIVATE MESSAGE,/post/Leave-Intel-for-NVIDIA-2wUXyO8z,Intel
12,"Mar 7, 2019",Nvidia is a great company if you end up in a good team. I am happy with my team and manager. WLB can be as good or bad as you want it to be. They are very solid and still the industry leader despite lots of competition.,4,bdei51,/company/NVIDIA/,SEND PRIVATE MESSAGE,/post/Leave-Intel-for-NVIDIA-2wUXyO8z,Intel
13,"Mar 8, 2019",Which team is that? What makes it shitty for them?,0,l|ll||lll|,/company/Intel/,SEND PRIVATE MESSAGE,/post/Leave-Intel-for-NVIDIA-2wUXyO8z,Intel
14,"Mar 8, 2019",Bad manager. They came from a nepotistic tech company and brought those bad traits over,0,420_Blaze,/company/NVIDIA/,SEND PRIVATE MESSAGE,/post/Leave-Intel-for-NVIDIA-2wUXyO8z,Intel
0,"Jul 26, 2020",There is no point of increasing hiring standards when you can't pay more than Qualcomm and AMD. Intel HR is proud of 65% percentile market pay.  Anyone can be replaced mentality should change,28,INTC🐻,/company/Intel/,SEND PRIVATE MESSAGE,/post/Hiring-Standards-@-Intel-gVngmswz,Intel
1,"Jul 27, 2020",@eat it. Same at AMD. Was told i need to be in my current role minimum years for promo even though they agreed i deserve next level. @voo; well 10% is high too. I got 7% for just DE2 to SDE promo on 90k base lol.,1,mariokart,/company/AMD/,Eng,/post/Hiring-Standards-@-Intel-gVngmswz,Intel
2,"Jul 28, 2020","@mario.....if things didn’t work here at AMD, I will jump ship in 4 years. That is my plan. I am quick at ramping and if my hard work doesn’t pay well, its time.",2,VOOorSPY,/company/AMD/,SEND PRIVATE MESSAGE,/post/Hiring-Standards-@-Intel-gVngmswz,Intel
3,"Jul 26, 2020","Being a former manager who would not lower the bar, it was impossible to hire anyone in the past few years. Tier 1 graduates don’t bother with Intel any more unlike 20 years ago everyone was flocking to an Intel interview.",14,tTpx65,/company/Apple/,SEND PRIVATE MESSAGE,/post/Hiring-Standards-@-Intel-gVngmswz,Intel
4,"Jul 29, 2020","For process folks, intel pay is not bad. Who pays more besides small group at apple works on display?",0,你-我,/company/Intel/,SEND PRIVATE MESSAGE,/post/Hiring-Standards-@-Intel-gVngmswz,Intel
5,"Aug 7, 2020",@pathfwd It is absolutely true. I’ve been told explicitly by a hiring manager running an interview board I was on that we could lower the bar for applicants that tick certain boxes.,2,heOi05,/company/Intel/,SEND PRIVATE MESSAGE,/post/Hiring-Standards-@-Intel-gVngmswz,Intel
6,"Jul 26, 2020",Intel will get to do that once they start paying more and improve their image in the market in general,33,hCBP31,/company/Apple/,SEND PRIVATE MESSAGE,/post/Hiring-Standards-@-Intel-gVngmswz,Intel
7,"Aug 8, 2020","Not true apple, i know someone who was only a grade 5 working like a grade 7 leading a team. He had good relationships with everyone too. He told his manager his pay was too less and would have to leave over pay and the manager did convince him a lot to stay but kept saying his hands were tied wrt pay",0,bose99,/company/Bose-Corporation/,SEND PRIVATE MESSAGE,/post/Hiring-Standards-@-Intel-gVngmswz,Intel
8,"Aug 9, 2020","My boss adjusted my pay in the middle of the year and promoted me in focal with good raise, so i know they can do things. But expecting that pay to match apple nvidia is not realistic.",0,cookcook,/company/Apple/,SEND PRIVATE MESSAGE,/post/Hiring-Standards-@-Intel-gVngmswz,Intel
9,"Jul 26, 2020",Yes.,29,mariokart,/company/AMD/,Eng,/post/Hiring-Standards-@-Intel-gVngmswz,Intel
10,"Jul 26, 2020",Hiring standards will automatically go up once Intel increases pay.,17,UAjJ54,/company/Intel/,SEND PRIVATE MESSAGE,/post/Hiring-Standards-@-Intel-gVngmswz,Intel
0,"Oct 24, 2020","Well no you certainly have valid points OP and it didn’t hurt at least my feelings at all. All engineers, manufacturing technicians, architect etc.. have been screaming out loud in our internal forums as well as on blind but sadly our pleas are not getting heard. I mean how stupid one needs to be when upper management can clearly see people are not happy but rather than doing something about it to focus on innovation, bringing competitive products to the market with higher quality, all we care about is buy back of stocks and how can we make Wall Street happy. To hell with customers and their timeline. Really hope we can turn this thing around but without significant overhaul specially in the middle management, I don’t see things changing anytime soon. Will we be dead? Probably not because we are only one of the top 2-3 companies who can manufacture complex semiconductor devices at a scale that out customers need so we will still be around but unless and until we have a visionary CEO who can provide focus, leadership and passion to worker bees, we will never grow. Robert Noyce, Andy Groove must be rolling in their graves",40,eifje,/company/Intel/,SEND PRIVATE MESSAGE,/post/Intel-Future-with-Bean-counter-CEO-1iF3XZUR,Intel
1,"Oct 25, 2020",A new 7nm to 5nm fab cost like 20B. Intel is trying their best to postpone this investment and finally falls behind.,11,Troll Food,/company/Western-Digital/,Eng,/post/Intel-Future-with-Bean-counter-CEO-1iF3XZUR,Intel
2,"Oct 27, 2020","I would agree that Intel pay is far below the average.  I stay just over 13yrs and figured this out when leaving.  Lesson learned, jump every 3-4 yrs and demand a 30-40% with the new company. You get the most money coming into a company, not growing up with one.",23,hLMB24,/company/Lenovo/,SEND PRIVATE MESSAGE,/post/Intel-Future-with-Bean-counter-CEO-1iF3XZUR,Intel
3,"Oct 24, 2020","Ex-intel here -> Intel has been paying employees on the low side (target 60% of market) , on top of that since BK days they have ben doing layoffs and reorgs non stop.: so yeah .: people leave if they can. You get what you pay for. Most People in intel are there because a) stuck because of visa b) unable or unwilling to switch c) great at politics and doing well.",86,bosebose,/company/Bose-Corporation/,SEND PRIVATE MESSAGE,/post/Intel-Future-with-Bean-counter-CEO-1iF3XZUR,Intel
4,"Nov 23, 2020","So, it’s dying",1,dvNS42,nan,SEND PRIVATE MESSAGE,/post/Intel-Future-with-Bean-counter-CEO-1iF3XZUR,Intel
5,Jan 18,Clean up old school HR and intel will be fine.,0,hbyh36,/company/Broadcom/,SEND PRIVATE MESSAGE,/post/Intel-Future-with-Bean-counter-CEO-1iF3XZUR,Intel
6,"Oct 27, 2020","Looking at your descriptions, certainly looks like you are ex-Intel. I might be wrong 😶As far as how Intel is doing, remember AMD struggled for years before it could stand next to Intel. Every company has ups and downs. We as Intel are definitely down right now. But once your behind is under fire, you have no choice but to step up and again become the leader 🏆 (or crash and burn)I am not just being extremely optimistic. I have seen the change in people over the last couple of years. Losers gtfo but most people who are still here and are good, their pride is hurt and they are working hard to gain our leadership",28,lookhere,/company/Intel/,SEND PRIVATE MESSAGE,/post/Intel-Future-with-Bean-counter-CEO-1iF3XZUR,Intel
7,"Nov 3, 2020",So when are you guys splitting up fab like AMD? Without that this falling behind BS will keep happening on a regular basis.,0,Troll Food,/company/Western-Digital/,Eng,/post/Intel-Future-with-Bean-counter-CEO-1iF3XZUR,Intel
8,"Nov 13, 2020",why msft so salty?,0,noobiesam,/company/Oracle/,SEND PRIVATE MESSAGE,/post/Intel-Future-with-Bean-counter-CEO-1iF3XZUR,Intel
9,"Oct 27, 2020","I want to be clear bc there is a lot of sentiment that intel doesn’t pay “market” rate.  Intel can’t compete with Apple, period.  But for Hardware roles, Intel is quite competitive.  Sure, they’ll take advantage of engineers if they let them but look on levels.fyi.  The bonus and salary was very competitive with AMD, Samsung, ARM, Qcom.  They aren’t competing with Nvidia right now bc the stock went through the roof over the last few years.  But even AMD is notoriously stingy with stocks and doesn’t shower employees with shares.  Maybe people who paid their dues when AMD was struggling and they got $20k a year back at $10/share... and never sold.",4,BobIsRight,/company/Intel/,SEND PRIVATE MESSAGE,/post/Intel-Future-with-Bean-counter-CEO-1iF3XZUR,Intel
10,"Oct 29, 2020",Doesn't bump pay significantly with promotion either. Its sad cause the thought to move wouldn't have crossed my mind if they had.,1,narkid,/company/NVIDIA/,SEND PRIVATE MESSAGE,/post/Intel-Future-with-Bean-counter-CEO-1iF3XZUR,Intel
11,"Oct 29, 2020",That's der. But that seems to be  the only way. N if u r in geo zone where other companies r taking people away like msft in oregon.,0,ni4040,/company/Intel/,SEND PRIVATE MESSAGE,/post/Intel-Future-with-Bean-counter-CEO-1iF3XZUR,Intel
12,"Oct 25, 2020",good PE ratio though,1,KingSky,/company/Booking.com/,SEND PRIVATE MESSAGE,/post/Intel-Future-with-Bean-counter-CEO-1iF3XZUR,Intel
13,"Nov 5, 2020",P/E ratio is one of the most misused metrics. Low PE = avoid. It’s low for a reason. You aren’t smarter than the collective market participants,3,10bagger,/company/Facebook/,SEND PRIVATE MESSAGE,/post/Intel-Future-with-Bean-counter-CEO-1iF3XZUR,Intel
14,"Dec 4, 2020","Not always. Apple had a low PE ratio in 2018. Buffett has also bought into numerous low PE companies. But yeah, PE ratio is mostly fools gold. Earnings =/ FCFF",2,KScx67,/company/Microsoft/,SEND PRIVATE MESSAGE,/post/Intel-Future-with-Bean-counter-CEO-1iF3XZUR,Intel
0,Feb 1,None of the above. Welcome to Intel🤣,23,cturtle,/company/Intel/,Other,/post/Intel-Rewards-evaluation-Pj3GLYku,Intel
1,Feb 1,That was serious feedback...,7,ICanHazTC?,/company/Intel/,Finance,/post/Intel-Rewards-evaluation-Pj3GLYku,Intel
2,Feb 2,Even when manager told me that let me go work with management to see if we can do out of cycle increase ... nothing happened ... so yeah during/after is too late ... in one rewards year I told manager in May what I am shooting for that year and followed up in July and Dec and only then I got it in the next year...,0,Sw_108,/company/Intel/,SEND PRIVATE MESSAGE,/post/Intel-Rewards-evaluation-Pj3GLYku,Intel
3,Feb 2,"Ur only reward with Intel is a good work life balance. Make the best use of that, it’s better than any TC",15,Qjtr43,/company/Intel/,SEND PRIVATE MESSAGE,/post/Intel-Rewards-evaluation-Pj3GLYku,Intel
4,Feb 4,No WLB where I am at. More work and long hours are quite normal,0,Si_tech,/company/Intel/,SEND PRIVATE MESSAGE,/post/Intel-Rewards-evaluation-Pj3GLYku,Intel
5,Feb 4,The myth of Intel WLB is primarily a matter of one's political standing.,2,Eat it,/company/Apple/,SEND PRIVATE MESSAGE,/post/Intel-Rewards-evaluation-Pj3GLYku,Intel
6,Feb 1,Can you reject a rewards? What happens if you reject it?,4,Intel007,/company/Intel/,SEND PRIVATE MESSAGE,/post/Intel-Rewards-evaluation-Pj3GLYku,Intel
7,Feb 1,"Nothing. It's take it or leave it. Of course you can contest and try to involve HR, but it won't end up good of the hr deems it correct what your manager did. By doing so you are taking on your manager.",2,cturtle,/company/Intel/,Other,/post/Intel-Rewards-evaluation-Pj3GLYku,Intel
8,Feb 1,"In all seriousness, you need an external offer and be ready to leave.  And at that point you probably should consider it",5,VHarkonnen,/company/Intel/,SEND PRIVATE MESSAGE,/post/Intel-Rewards-evaluation-Pj3GLYku,Intel
9,Feb 2,PE should be ict5?,0,finfet,/company/Intel/,SEND PRIVATE MESSAGE,/post/Intel-Rewards-evaluation-Pj3GLYku,Intel
10,Feb 2,"Yes, but I think both hard to get hired external into.",0,VHarkonnen,/company/Intel/,SEND PRIVATE MESSAGE,/post/Intel-Rewards-evaluation-Pj3GLYku,Intel
11,Feb 1,"1) 2.5-3% is normal for satisfactory performance.2) APB only adjusts once G7+. Company APB goal would multiply your personal apb %. So 10 %APB * 110% company apb goal would net you 11% APB. Also, no you can’t negotiate during rewards.3) no.4) No again.5) One time cash payouts can be given if your compa-ratio is > 110% of median for your grade. No you cannot negotiate during rewards.Rewards are essentially final now. What you’re gonna get is what you’re gonna get at this point.",5,ICanHazTC?,/company/Intel/,Finance,/post/Intel-Rewards-evaluation-Pj3GLYku,Intel
0,Jan 13,"As I said in the Intel chat, this kills my GTFO vibe.",4,VHarkonnen,/company/Intel/,SEND PRIVATE MESSAGE,/post/Congrats-Intel-folks-ZKUjbViH,Intel
1,Jan 13,But it’s not like he will pay you guys more drastically ?,1,v_God,/company/VMware/,SEND PRIVATE MESSAGE,/post/Congrats-Intel-folks-ZKUjbViH,Intel
2,Jan 14,"Probably not drastically, but TC isn't my main focus.",1,VHarkonnen,/company/Intel/,SEND PRIVATE MESSAGE,/post/Congrats-Intel-folks-ZKUjbViH,Intel
3,Jan 13,"Bob was dealt with a bad hand. In my opinion he deserves credit for some positive changes he brought to the company. May not be the best CEO for Intel at this juncture, but he for sure is an excellent leader.",10,andornot,/company/Intel/,SEND PRIVATE MESSAGE,/post/Congrats-Intel-folks-ZKUjbViH,Intel
4,Jan 13,"+1 Really good news for Intel, was getting worried for this company. Need Intel to continue to be a leader - was always too big to fail in my mind.",8,12332,/company/Cadence-Design-Systems/,SEND PRIVATE MESSAGE,/post/Congrats-Intel-folks-ZKUjbViH,Intel
5,Jan 16,Intel has way too many employees causing sluggishness .. companies like AMD/nvidia do a much better job with less than half the employees.. only way Pat is changing Intel bad culture and reputation is by layoff .. either way loose - loose situation for us! So I’m still Trying to GTFO,1,notp,/company/Intel/,R&D,/post/Congrats-Intel-folks-ZKUjbViH,Intel
6,Jan 16,"Not if you're one of the higher performers.  If Intel divests money losing businesses, layoff 20% of lowest performers, then give 20% raise to all the remaining people, it will be a more nimble company and be able to attract and retain better talent.  The challenge is it's hard to identify the 20%.",0,$2021$,/company/Nike/,SEND PRIVATE MESSAGE,/post/Congrats-Intel-folks-ZKUjbViH,Intel
7,Jan 13,News link?,0,qwaszx17,/company/Apple/,SEND PRIVATE MESSAGE,/post/Congrats-Intel-folks-ZKUjbViH,Intel
8,Jan 13,"It's all over the news today, bro.",0,epycboy,/company/AMD/,SEND PRIVATE MESSAGE,/post/Congrats-Intel-folks-ZKUjbViH,Intel
0,"Aug 23, 2019","I’m in Intel San Diego - do NOT come here. While the CVCG group is new and pretty nice, the Apple acquisition is gonna throw things for a loop. If you’re  looking for stability and a return offer, San Jose is the way to go. Most of the people in this building are from the modem group which is being acquired by Apple. As of now, rumor is Apple is going to take the whole building, so the other Intel teams will probably get kicked out (Nervana/CVCG/NGS).No one knows where they’ll be after that - will Intel move everyone to the VC campus in SD? Might be too small. Will they get another building? who knows. They might just force everyone to relocate.Go with SJ for stability/return offer!!",1,bobertswan,/company/Intel/,SEND PRIVATE MESSAGE,/post/Intel-Teams-Tufr43sv,Intel
1,"Aug 23, 2019",Damn. I was aware about the Apple acquisition but I didn't know the full extent of its ramifications on the SD office as a whole. Thank you!!,0,been1810,/company/Juniper/,SEND PRIVATE MESSAGE,/post/Intel-Teams-Tufr43sv,Intel
2,"Aug 25, 2019","OP you shouldn’t care about stability honestly. Take some risk in life at this age, it will pay off in unexpected ways.",1,dr amazing,/company/Apple/,SEND PRIVATE MESSAGE,/post/Intel-Teams-Tufr43sv,Intel
3,"Aug 23, 2019",I would have picked PSG.Also maybe in San Jose with more number of teams conversion to full time might be easier if that matters to you,3,loyalguy,/company/Intel/,SEND PRIVATE MESSAGE,/post/Intel-Teams-Tufr43sv,Intel
4,"Aug 23, 2019","It does. I graduate in December, so, I am looking for a full time position.It's just that the CVCG group is working with cutting edge Tech like IoT, GPUs and stuff which is great..",0,hope_intel,/company/Juniper/,SEND PRIVATE MESSAGE,/post/Intel-Teams-Tufr43sv,Intel
5,"Aug 23, 2019",Cvcg is better team i was in psg previously loved the work and also you are in core silicon valley so you have a better shot for career change in future too...,1,Nick Fury,/company/Apple/,SEND PRIVATE MESSAGE,/post/Intel-Teams-Tufr43sv,Intel
6,"Aug 23, 2019",Don’t take PSG. I’m from the same group. You can take second opinion about PSG but personally I wouldn’t recommend going to PSG,3,🔜 !,/company/Intel/,SEND PRIVATE MESSAGE,/post/Intel-Teams-Tufr43sv,Intel
7,"Aug 23, 2019",Don't do psg if it's a customer facing role. None of me peers who ended up in psg were super competent.,0,liev,/company/Microsoft/,Eng,/post/Intel-Teams-Tufr43sv,Intel
8,"Aug 23, 2019","Engineering usually doesn't face the customer, and certainly not interns, don't worry about it.",1,LKLA78,/company/Xilinx/,SEND PRIVATE MESSAGE,/post/Intel-Teams-Tufr43sv,Intel
9,"Aug 23, 2019","Just to be clear, customer facing != Consumer facing. At a company like Intel, if you were in a customer facing role you would be interacting with the Dells and HPs of the world.",0,STX Puts,/company/Toshiba/,Eng,/post/Intel-Teams-Tufr43sv,Intel
10,"Aug 24, 2019",Just forget Intel.  Going full time there would be a mistake.,2,myhC22,/company/Micron-Technology/,Design,/post/Intel-Teams-Tufr43sv,Intel
11,"Aug 27, 2019",Micron I guess !!,0,😎 diehard,/company/Intel/,SEND PRIVATE MESSAGE,/post/Intel-Teams-Tufr43sv,Intel
12,"Aug 27, 2019","Micron has a hiring freeze right now, but so does Intel!",0,been1810,/company/Juniper/,SEND PRIVATE MESSAGE,/post/Intel-Teams-Tufr43sv,Intel
0,Apr 29,It's usually 2 to 3 months after joining for most large tech firms. Makes it harder for you to time the market with your start date.,1,modobestia,/company/Juniper/,SEND PRIVATE MESSAGE,/post/Intel-RSU-Grant-wHUwzkSv,Intel
1,Apr 29,You ideally get it within 2 months .,0,rEoN64,/company/Cadence-Design-Systems/,SEND PRIVATE MESSAGE,/post/Intel-RSU-Grant-wHUwzkSv,Intel
2,Apr 29,So it’s not approved on joining?,0,intel_10,/company/Intel/,SEND PRIVATE MESSAGE,/post/Intel-RSU-Grant-wHUwzkSv,Intel
3,Apr 29,Lol no. There are specific dates for this as well.,0,rEoN64,/company/Cadence-Design-Systems/,SEND PRIVATE MESSAGE,/post/Intel-RSU-Grant-wHUwzkSv,Intel
4,Apr 29,Grade and yoe?,0,bkmbkmbkm,/company/Intel/,SEND PRIVATE MESSAGE,/post/Intel-RSU-Grant-wHUwzkSv,Intel
5,Apr 29,G6,0,intel_10,/company/Intel/,SEND PRIVATE MESSAGE,/post/Intel-RSU-Grant-wHUwzkSv,Intel
6,May 8,Intel is offering 60k stocks for G6 now?Which location? And what was your base?Great job,0,donglover,/company/Apple/,SEND PRIVATE MESSAGE,/post/Intel-RSU-Grant-wHUwzkSv,Intel
0,"Nov 13, 2020","Intel lost the lead in fab manufacturing, no doubt there. But assuming it will die a slow death is very very immature and honestly not justified. Fist off, intel revenue by far is much much higher than AMD, same goes for profit margin. A slight hiccup does not justify company dying. Second, Apple transition will have minimal impact as they only account for 4% of Intel revenue. Split that over 3 years, come on that’s like 0.9B per year, which ain’t much when revenue is hitting $70+ next year. Third, bob swan did change compensation dramatically this year and offers are very competitive now. I would argue and say equivalent to faang.Lastly, there is too much negative sediment against intel in general in this form. Everyone here is bias toward FAANG.They will be fine!!!",7,KingsMen,/company/Amazon/,Eng,/post/Sad-about-Intel-Ky4jbFSX,Intel
1,"Dec 13, 2020","Layoffs are good if ppl are just collecting a paycheck. Intel will be fine, more players in the semiconductor industry is not a bad thing, they won’t be number one but they will be fine.Also, brianroy why are you still with intel if your assumption is true?",0,KingsMen,/company/Amazon/,Eng,/post/Sad-about-Intel-Ky4jbFSX,Intel
2,"Dec 14, 2020",I am in transition moving to a different company,0,Brianroy,/company/Intel/,SEND PRIVATE MESSAGE,/post/Sad-about-Intel-Ky4jbFSX,Intel
3,"Nov 14, 2020","Why feel pain?  Intel deserves to die because of the toxic management and endless politics.  Even the technical leadership is totally pathetic, liars and backstabbers at senior PE/fellow positions everywhere.",8,Eat it,/company/Apple/,SEND PRIVATE MESSAGE,/post/Sad-about-Intel-Ky4jbFSX,Intel
4,"Nov 15, 2020",LOL Intel HR to the rescueI did notice Intel took down the pages listing all the baby VP's and fellows... must look bad to investors for the stock to be in the gutter but still have 300+ non-technical/political VP shitting up the place.,5,Eat it,/company/Apple/,SEND PRIVATE MESSAGE,/post/Sad-about-Intel-Ky4jbFSX,Intel
5,"Nov 23, 2020",I approve what he said. Intc is toxic,2,EOtr62,/company/Microsoft/,SEND PRIVATE MESSAGE,/post/Sad-about-Intel-Ky4jbFSX,Intel
6,"Nov 15, 2020","Shintel has worst possible management and worst hiring practices, and obviously with shit pay you get shit folks. Worst place to work. Avoid intel like a plague.",5,rJEK23,/company/AMD/,SEND PRIVATE MESSAGE,/post/Sad-about-Intel-Ky4jbFSX,Intel
7,"Nov 19, 2020",Their chiplet design is neat. Not only drives the total cost down but also opens up lots of opportunities in the next few years. Hats off to Lisa!,0,lbve43,/company/Apple/,SEND PRIVATE MESSAGE,/post/Sad-about-Intel-Ky4jbFSX,Intel
8,"Nov 19, 2020","In the past 30 years, AMD had better chips in some years and Intel had better chips in some years. Some people still are not getting it that a better design will not cut it. It is only now that Intel’s Manufacturing is 2 generations behind that customers are forced to consider AMD because the gap is too big. This is just how business works.So, AMD’s stock price is purely due to TSMC’s lead over Intel.",1,blueca,/company/Apple/,SEND PRIVATE MESSAGE,/post/Sad-about-Intel-Ky4jbFSX,Intel
9,"Nov 13, 2020","Intel and AMD have a long history of this rivalry... and Intel has always bounced back before. AMD Athlon 64 beat Intel Pentium 4, but then Intel hit back hard with the Core processors. Might be time for another one of those resets. The Core brand is getting a bit old anyways!Apple’s own M1 looks very compelling based on the leaked benchmarks. Looking forward to reading  some reviews for the new Macs next week.",5,uTBx83,/company/Google/,SEND PRIVATE MESSAGE,/post/Sad-about-Intel-Ky4jbFSX,Intel
10,"Nov 13, 2020",Yeah but Apple or Nvidia were not eating Intel’s lunch. Neither Microsoft or Amazon or Google were trying to make their own chips.,5,zbSv46g,/company/Apple/,SEND PRIVATE MESSAGE,/post/Sad-about-Intel-Ky4jbFSX,Intel
11,"Nov 14, 2020",What are you talking about? All 3 of them are making their own chips. The applications vary though.,0,Alpha_7,nan,SEND PRIVATE MESSAGE,/post/Sad-about-Intel-Ky4jbFSX,Intel
12,"Nov 13, 2020","This is what happens when you rest on your laurels.I used to be a huge Intel fanboy, but have been running AMD for the past few years.",10,d38sd,/company/Microsoft/,Product,/post/Sad-about-Intel-Ky4jbFSX,Intel
0,"Dec 14, 2020",First mistake you made was coming to Intel to innovate.,12,iwntmympp,/company/Intel/,SEND PRIVATE MESSAGE,/post/Intel-team-sucks-iWOubBhr,Intel
1,"Dec 14, 2020",Sad :( but that’s the company I got after PhD graduation. I didn’t get Google after campus in March :( but got this so jus felt like okay watever. But I feel bad now not going more interviews :(,3,balde7,/company/Intel/,SEND PRIVATE MESSAGE,/post/Intel-team-sucks-iWOubBhr,Intel
2,"Dec 14, 2020","if you are writing code, why intel can be your dream? They are almost the worst for software engineers.",10,vtQq15,/company/Facebook/,SEND PRIVATE MESSAGE,/post/Intel-team-sucks-iWOubBhr,Intel
3,"Dec 14, 2020",Thanks Bro. LCing hard for the last 2 weeks. I need to get back to LC. I used to solve medium-hard problems now I hav to start again from zero,0,balde7,/company/Intel/,SEND PRIVATE MESSAGE,/post/Intel-team-sucks-iWOubBhr,Intel
4,"Dec 14, 2020",I thought I can crack solving LC in 2 months Atleast solve basic 50 problems but any ideas or suggestions would be great 👍🏼,0,balde7,/company/Intel/,SEND PRIVATE MESSAGE,/post/Intel-team-sucks-iWOubBhr,Intel
5,"Dec 14, 2020","Onboarding is hit and miss in WFH unfortunately.  Have you talked to your manager about how you're not sure who to go to for help?  Wish he know how to code, but you should still approach him on where to get help.  Don't assume he knows you need it.",1,VHarkonnen,/company/Intel/,SEND PRIVATE MESSAGE,/post/Intel-team-sucks-iWOubBhr,Intel
6,"Dec 15, 2020","3 people work on the codebase and the task assigned to me is associated to one developer. And boy he didn’t respond to multiple pings, mails and my manager says he Shld not be disturbed. You hav to figure out the code yourself. I was struggling but got some data analysis done but he was not happy. He said can you verify why the data looks like this. I told I’m not sure what’s really happening 🤷🏻‍♂️I vaguely know the big picture. He told me to do the data analysis and measurements again lol. Such a stupid week",0,balde7,/company/Intel/,SEND PRIVATE MESSAGE,/post/Intel-team-sucks-iWOubBhr,Intel
