,comment_date,comment_text,comment_like,comment_user,comment_firm,comment_position,comment_url,company
3,Mar 31,JPMC is worse,11,deadman1,/company/Capital-One/,SEND PRIVATE MESSAGE,/post/JPMC-vs-Capital-one-culture-which-one-is-better-kcCwKfXe,JPMorgan
4,Mar 31,Google it.,0,CEWA41,/company/Capital-One/,Eng,/post/JPMC-vs-Capital-one-culture-which-one-is-better-kcCwKfXe,JPMorgan
5,Mar 31,"Thx, I did just that and yes it's horrid here",1,coftactn18,/company/Capital-One/,SEND PRIVATE MESSAGE,/post/JPMC-vs-Capital-one-culture-which-one-is-better-kcCwKfXe,JPMorgan
6,Mar 31,"I don’t know JPMC but having been at CapOne, I thought the culture sucked big time.",13,PBsL14,/company/BCG/,SEND PRIVATE MESSAGE,/post/JPMC-vs-Capital-one-culture-which-one-is-better-kcCwKfXe,JPMorgan
7,Mar 31,What don’t you like about the culture?,0,🍊🧃Simpson,/company/Capital-One/,SEND PRIVATE MESSAGE,/post/JPMC-vs-Capital-one-culture-which-one-is-better-kcCwKfXe,JPMorgan
8,Mar 31,"Culture at C1 is getting progressively less good.  There’s no accountability for anyone.  If you don’t mind coworkers that are only looking to make themselves look good for mid year / EOY and have zero accountability if they screw up, you’ll be fine.",11,JpNL42,/company/Capital-One/,SEND PRIVATE MESSAGE,/post/JPMC-vs-Capital-one-culture-which-one-is-better-kcCwKfXe,JPMorgan
9,Mar 31,"JPMC is actually trying to follow Capital One's footsteps. This is an effort lead by Gillhaus (forgot the spelling) who left capital one recently to JP, and is leading a cloud transformation similar to capital one. They're actually making an active effort to specifically hire capital one people.I think you might be able to net more pay (and that's a maybe), but JP is still very behind capital one in terms of culture. Maybe the transformation will take them there, but I would only take it knowing he risks of worse WLB and culture, and only if the pay difference is large enough to make it worthwhile.",9,Card<Comm,/company/Capital-One/,SEND PRIVATE MESSAGE,/post/JPMC-vs-Capital-one-culture-which-one-is-better-kcCwKfXe,JPMorgan
10,Mar 31,Truth on the active recruitment. Recruiter pinged me....,0,gijyfxcb14,/company/Capital-One/,SEND PRIVATE MESSAGE,/post/JPMC-vs-Capital-one-culture-which-one-is-better-kcCwKfXe,JPMorgan
11,Apr 1,"Gill is the worst. Constantly self aggrandizing, temper tantrums, and self serving decision making. Only after his next promo, and he left behind a few stooges that operate in the same way, chasing promos while not leading their teams. Avoid both.",1,hTgi5794,/company/Capital-One/,SEND PRIVATE MESSAGE,/post/JPMC-vs-Capital-one-culture-which-one-is-better-kcCwKfXe,JPMorgan
0,Jan 25,Stay at Uber dude. Or join another better start up.,2,f1ntech,/company/JPMorgan/,Eng,/post/Interview-tips-for-JPMC-DQJvGRc6,JPMorgan
1,Jan 27,Why would you say that?,0,kULp15,/company/Uber/,SEND PRIVATE MESSAGE,/post/Interview-tips-for-JPMC-DQJvGRc6,JPMorgan
2,Jan 28,Uber is a better company and brand name than jpmc. You’ll also have more opportunities for growth at Uber.,0,f1ntech,/company/JPMorgan/,Eng,/post/Interview-tips-for-JPMC-DQJvGRc6,JPMorgan
3,Jan 25,Umm why would you want to go from Uber to JPMC?,1,newwwwew,/company/JPMorgan/,SEND PRIVATE MESSAGE,/post/Interview-tips-for-JPMC-DQJvGRc6,JPMorgan
4,Jan 28,"I hate my job here, there hasn't been anything new or intersting here, would love to explore new domains considering my previous experience in the same field",0,kULp15,/company/Uber/,SEND PRIVATE MESSAGE,/post/Interview-tips-for-JPMC-DQJvGRc6,JPMorgan
5,Jan 27,I am not sure of your role in Uber. But I have a hunch that your role in Uber is better. Don't just think of the bucks. It's a trap,1,Spod1267,/company/JPMorgan/,SEND PRIVATE MESSAGE,/post/Interview-tips-for-JPMC-DQJvGRc6,JPMorgan
6,Jan 25,Don't do this ch***ti****pa going from Uber to jpmc just for the sake few extra coins,1,whatrways,/company/JPMorgan/,SEND PRIVATE MESSAGE,/post/Interview-tips-for-JPMC-DQJvGRc6,JPMorgan
7,Jan 25,Know the difference between LoBs/how each generates revenue,0,krIE87,/company/JPMorgan/,SEND PRIVATE MESSAGE,/post/Interview-tips-for-JPMC-DQJvGRc6,JPMorgan
0,"Sep 29, 2019",Capital one is pennies,4,mooreslaw,/company/Capital-One/,SEND PRIVATE MESSAGE,/post/[SWE]-JPMC-Barclays-Capital-One-TC-HxVn3JV4,JPMorgan
1,"Sep 28, 2019","What is 58, 70, 80 and 100",3,AmYe88,/company/Microsoft/,Eng,/post/[SWE]-JPMC-Barclays-Capital-One-TC-HxVn3JV4,JPMorgan
2,"Sep 28, 2019",Pay rages of jr to senior developers,0,'-@-@-',/company/JPMorgan/,SEND PRIVATE MESSAGE,/post/[SWE]-JPMC-Barclays-Capital-One-TC-HxVn3JV4,JPMorgan
3,"Oct 10, 2019",What is TC mean?,1,auto_net,/company/Barclays-Investment-Bank/,SEND PRIVATE MESSAGE,/post/[SWE]-JPMC-Barclays-Capital-One-TC-HxVn3JV4,JPMorgan
4,"Oct 10, 2019",Total compensation but this isn't including health and bonuses,0,'-@-',/company/JPMorgan/,SEND PRIVATE MESSAGE,/post/[SWE]-JPMC-Barclays-Capital-One-TC-HxVn3JV4,JPMorgan
5,"Sep 30, 2019",Barclays is 110 for new grad/junior analyst software engineer (most offers are in Whippany/NJ),0,mothepro,/company/Barclays-Investment-Bank/,Eng,/post/[SWE]-JPMC-Barclays-Capital-One-TC-HxVn3JV4,JPMorgan
6,"Feb 28, 2020",AVP SWE less than 135? Most people I’ve heard got 135+ at least  what’s your tc ?,0,swoog,/company/Barclays-Investment-Bank/,Eng,/post/[SWE]-JPMC-Barclays-Capital-One-TC-HxVn3JV4,JPMorgan
7,"Mar 4, 2020",TC is 140.,0,arNX65,/company/Barclaycard/,SEND PRIVATE MESSAGE,/post/[SWE]-JPMC-Barclays-Capital-One-TC-HxVn3JV4,JPMorgan
8,"Sep 30, 2019","Is 58-105k for associate? 70-118k for AVP? 80-132k for VP? 100-195k Senior VP?If so, how hard is it to get higher ranges in VP or Senior VP?",0,f4rm,/company/State-Farm/,Eng,/post/[SWE]-JPMC-Barclays-Capital-One-TC-HxVn3JV4,JPMorgan
9,"Oct 1, 2019","Jr dev, associate, Sr associate, VP",0,'-@-',/company/JPMorgan/,SEND PRIVATE MESSAGE,/post/[SWE]-JPMC-Barclays-Capital-One-TC-HxVn3JV4,JPMorgan
10,"Oct 1, 2019",Thanks. Is that for all locations or HCOL areas like New York?How hard is it to get VP with a salary near 195k?,0,f4rm,/company/State-Farm/,Eng,/post/[SWE]-JPMC-Barclays-Capital-One-TC-HxVn3JV4,JPMorgan
0,"Aug 9, 2020",Why jpmc? Try fang.,1,jpmcoolie,/company/JPMorgan/,SEND PRIVATE MESSAGE,/post/Seeking-JPMC-referral-450-LC-JSmQEaDF,JPMorgan
1,"Aug 9, 2020",He is doing it for competing offers so that he has a leverage during negotiations.,4,DLJQ24,nan,SEND PRIVATE MESSAGE,/post/Seeking-JPMC-referral-450-LC-JSmQEaDF,JPMorgan
2,"Aug 9, 2020",Same in usa. All indians.,3,vUEH82,/company/JPMorgan/,SEND PRIVATE MESSAGE,/post/Seeking-JPMC-referral-450-LC-JSmQEaDF,JPMorgan
3,"Aug 9, 2020",I could refer you. Please dm me,1,blue08,/company/JPMorgan/,SEND PRIVATE MESSAGE,/post/Seeking-JPMC-referral-450-LC-JSmQEaDF,JPMorgan
4,"Aug 9, 2020",@chase can I DM you too?,0,NQpa87,nan,SEND PRIVATE MESSAGE,/post/Seeking-JPMC-referral-450-LC-JSmQEaDF,JPMorgan
5,Mar 27,"Hello, can I also dm you for referral?",0,tdTS88,nan,SEND PRIVATE MESSAGE,/post/Seeking-JPMC-referral-450-LC-JSmQEaDF,JPMorgan
6,"Aug 9, 2020",Why JPMC? And why Europe or SG?,0,SickMaDuck,/company/Uber/,SEND PRIVATE MESSAGE,/post/Seeking-JPMC-referral-450-LC-JSmQEaDF,JPMorgan
7,"Aug 9, 2020",Don't want to live in India. Mostly to brag among friends. Prestige and stuff.Maybe want to experience a different culture but reality will hit him when he finds out 90% of his team is Indian there.,1,wRYP72,nan,SEND PRIVATE MESSAGE,/post/Seeking-JPMC-referral-450-LC-JSmQEaDF,JPMorgan
8,"Aug 12, 2020","@New, I am sure you are writing this sitting in a different country than India. He wants to go for the same reason you came and stayed.",0,f’em bches,/company/JPMorgan/,SEND PRIVATE MESSAGE,/post/Seeking-JPMC-referral-450-LC-JSmQEaDF,JPMorgan
9,"Aug 30, 2020","You don't want to work at JPMC as a dev. I have been for 3 years and can tell you they are stingy AF. Also, JPMC has the least talented devs I've worked with at any company. The only thing keeping me at JPMC is the strict 9-5 hours. I never have to work too hard. I guess on a hourly basis they pay decently 🤷‍♂️",1,boozehound,/company/JPMorgan/,SEND PRIVATE MESSAGE,/post/Seeking-JPMC-referral-450-LC-JSmQEaDF,JPMorgan
0,"Aug 26, 2020",I don’t think you’ll get more than 100k from JP there.,1,elcoder,/company/Google/,SEND PRIVATE MESSAGE,/post/JPMC-601-SWE-salary-Tampa-34wPGXR1,JPMorgan
1,"Aug 26, 2020","Shit it’s been a while...is 601 Analyst or Associate? If it’s the latter you can get close to 100k (have friends who went from Analyst to Associate there recently). If it’s the former, then yeah 80k sounds about right",0,elcoder,/company/Google/,SEND PRIVATE MESSAGE,/post/JPMC-601-SWE-salary-Tampa-34wPGXR1,JPMorgan
2,"Aug 26, 2020","Well, 601 is analyst but now days 601 n 602 r called associates..603 is VP i guess..Below 603 everything sucks",0,Aadil..,/company/Verizon/,SEND PRIVATE MESSAGE,/post/JPMC-601-SWE-salary-Tampa-34wPGXR1,JPMorgan
3,"Aug 27, 2020",What’s the salary for 604 or even ED in Tampa?,0,divoc91,/company/Capital-One/,SEND PRIVATE MESSAGE,/post/JPMC-601-SWE-salary-Tampa-34wPGXR1,JPMorgan
4,"Aug 27, 2020",601 associate,0,RRzY08,/company/JPMorgan/,SEND PRIVATE MESSAGE,/post/JPMC-601-SWE-salary-Tampa-34wPGXR1,JPMorgan
0,Apr 2,TC disqualifies you. ( Same for ESPP),0,balalalala,/company/Amazon/,SEND PRIVATE MESSAGE,/post/401k-match-at-JPMC-1xGzENiw,JPMorgan
1,Apr 2,Ok seems a little unfair? Not even matched upto 250k?,0,rey4,/company/Citi/,SEND PRIVATE MESSAGE,/post/401k-match-at-JPMC-1xGzENiw,JPMorgan
0,Jan 25,"Full time WFH till Q3 at least. Manager hinted at 3 days in / 2 out being the norm, because they've hired more people now than they have seats anyway.",2,lbdl48,/company/JPMorgan/,SEND PRIVATE MESSAGE,/post/JPmorgan-JPMC-work-from-home-3kyB6EMg,JPMorgan
1,Jan 27,NYC,1,lbdl48,/company/JPMorgan/,SEND PRIVATE MESSAGE,/post/JPmorgan-JPMC-work-from-home-3kyB6EMg,JPMorgan
2,Feb 6,Where have they added headcount? Sure isn’t anywhere near me,0,ChaseIsSux,/company/JPMorgan/,SEND PRIVATE MESSAGE,/post/JPmorgan-JPMC-work-from-home-3kyB6EMg,JPMorgan
3,Jan 26,"For NYC CIB, they're trying to force people back as 1 week in, 2 home, but it's ""optional"", though they put your name on a calendar and management clearly pressures you to go in. They just had a Covid case in 383 last week, not going back until herd immunity.",0,nyc3000,/company/JPMorgan/,SEND PRIVATE MESSAGE,/post/JPmorgan-JPMC-work-from-home-3kyB6EMg,JPMorgan
0,"Aug 18, 2017",What makes you say that Glassdoor info is shit?,0,Hurricane,nan,Sales,/post/JPMC-Culture-TJF6oraD,JPMorgan
1,"Aug 18, 2017","It's not relevant. It's all financial analysts. Not much on the IT side, and when it is, it tends to be offshore fixed term contractors.",3,slythr,nan,Design,/post/JPMC-Culture-TJF6oraD,JPMorgan
2,"Aug 18, 2017","Culture is what you'd expect from a giant bank. I think it also depends on your immediate team and business. For me the culture is more dictated by the business than anything because I'm in payments and it's more niche, everybody knows everybody in the industry kind of thing",1,Whhw60,/company/JPMorgan/,Other,/post/JPMC-Culture-TJF6oraD,JPMorgan
3,"Aug 18, 2017",What location and business? Join with your @chase.com email address. We just need one more for our own board,0,Whhw60,/company/JPMorgan/,Other,/post/JPMC-Culture-TJF6oraD,JPMorgan
4,"Aug 18, 2017","Like mortgage, investment bank, card, etc. JPMC has a lot of ""businesses"". I think pretty much all of them are represented in Columbus. We have like 10k employees there or something.",0,Whhw60,/company/JPMorgan/,Other,/post/JPMC-Culture-TJF6oraD,JPMorgan
5,"Aug 18, 2017",I'm going to say investment banking but not 100%,0,slythr,nan,Design,/post/JPMC-Culture-TJF6oraD,JPMorgan
6,"Nov 21, 2019","Nasty place, specially for tech stuff.",0,curcur,nan,Eng,/post/JPMC-Culture-TJF6oraD,JPMorgan
7,"Nov 2, 2019","The middle management is pretty shitty. Lower level managers vary greatly. Not sure about your specific group but can vary from pretty shitty to great. *In some areas* they're suspicious of developers who ""know too much"" so your deployments are strongly controlled like you'll have work with a dummy and they'll ask a zillion questions even if you slightly veer off the deployment plan.Generally not a place for creativity. If you Google you'll find things about them setting up surveillance-type things. While it's shutdown long after it backfired, it's pretty telling of their culture.If you're going there have a plan on what to do if that doesn't pan out. But like I said for *certain* areas within IT, if you're even somewhat creative, it's better to look away.",0,qiEe55,nan,SEND PRIVATE MESSAGE,/post/JPMC-Culture-TJF6oraD,JPMorgan
0,Feb 25,You have recently joined and asking such questions. Enjoy job n life,1,bLsp30,/company/Microsoft/,SEND PRIVATE MESSAGE,/post/CulturePromotion-at-JPMC-1HWKKNOv,JPMorgan
1,Feb 25,Want to know what I am walking into 😅,0,ubergeek4,nan,SEND PRIVATE MESSAGE,/post/CulturePromotion-at-JPMC-1HWKKNOv,JPMorgan
2,Feb 26,"From my experience (finance, aligned to tech) it's a year of being ""on the promotion radar"" and then a 2 year process to get promoted. And you have to own it from start to finish",1,ugnome,/company/JPMorgan/,SEND PRIVATE MESSAGE,/post/CulturePromotion-at-JPMC-1HWKKNOv,JPMorgan
3,Mar 2,"I’m 2 years at JPM. I’ll say, it’s really tough to get promoted from VP to ED. Some people stay at VP pretty much their entire career at JPM. For that matter, one guy in my group was an associate for like 14 years, but I’m guessing JPM had him by the balls as they were getting his green card. Now that he has a GC, they suddenly promoted him to VP.To be frank, it’s not a terrible place to work at, but the people in higher levels aren’t there because they’re the best, they’re there because they’ve watched all their colleagues leave and they’re the last ones standing. JPM has really incredible brand recognition in and out of the industry. I mean, who hasn’t heard of Chase? Sure, it’s not a FAANG, and yeah, we’re a fucking bank at the end of the day, but it’ll help.The benefits kind of suck overall. I came from a much smaller company and the benefits were phenomenal. Chase benefits are what you would expect a big ass company to have. Vacation is in line with other financial services and throw in a few random bank holidays.Good luck. What group are you joining?",0,gfy603,/company/JPMorgan/,SEND PRIVATE MESSAGE,/post/CulturePromotion-at-JPMC-1HWKKNOv,JPMorgan
0,Jan 21,What did the offer end up being?,0,rey3,/company/Citi/,Product,/post/Executive-director-TC-at-JPMC-LcH41DfK,JPMorgan
1,Jan 22,Thanks.. Any stock? Or base + bonus?,0,rey3,/company/Citi/,Product,/post/Executive-director-TC-at-JPMC-LcH41DfK,JPMorgan
2,Jan 23,"$250 base, $180 bonus, $70 stock",1,turntman,/company/McKinsey/,SEND PRIVATE MESSAGE,/post/Executive-director-TC-at-JPMC-LcH41DfK,JPMorgan
3,"Oct 18, 2020",300?,0,momala25,/company/JPMorgan/,SEND PRIVATE MESSAGE,/post/Executive-director-TC-at-JPMC-LcH41DfK,JPMorgan
4,"Oct 18, 2020",Really? That’s super low. I was thinking closer to 500-600 TC,0,turntman,/company/McKinsey/,SEND PRIVATE MESSAGE,/post/Executive-director-TC-at-JPMC-LcH41DfK,JPMorgan
5,"Oct 19, 2020",Unless you are in trading or an investment banker making deals you can expect it to be much lower. I know vps that are making 150k,0,nlihdn,/company/JPMorgan/,SEND PRIVATE MESSAGE,/post/Executive-director-TC-at-JPMC-LcH41DfK,JPMorgan
6,"Oct 23, 2020","If you are in S&T, IB, or Cap Mkts, strong EDs can make close to and in some cases over $1mm in TC. Given you are Mckinsey currently, I assume its a corp strategy / development type role within JPM, which will pay very strongly...would think somewhere in the 500-700 range",0,Broome52,/company/MUFG/,SEND PRIVATE MESSAGE,/post/Executive-director-TC-at-JPMC-LcH41DfK,JPMorgan
7,"Oct 27, 2020","Got it v helpful, thanks",0,turntman,/company/McKinsey/,SEND PRIVATE MESSAGE,/post/Executive-director-TC-at-JPMC-LcH41DfK,JPMorgan
8,"Oct 18, 2020","Add more info, what kind of ED role? Is it tech manager or investment side..? And which location?",0,jpm007,/company/JPMorgan/,SEND PRIVATE MESSAGE,/post/Executive-director-TC-at-JPMC-LcH41DfK,JPMorgan
9,"Oct 18, 2020",Strategy in NYC,0,turntman,/company/McKinsey/,SEND PRIVATE MESSAGE,/post/Executive-director-TC-at-JPMC-LcH41DfK,JPMorgan
10,"Oct 23, 2020",Wow didn’t know that!,0,donut90210,/company/JPMorgan/,SEND PRIVATE MESSAGE,/post/Executive-director-TC-at-JPMC-LcH41DfK,JPMorgan
0,Apr 10,"They may try to counter, depends how valuable you are to them. It's hard to say",1,PipPopper,/company/Amazon/,SEND PRIVATE MESSAGE,/post/Negotiation-on-Exit-JPMC-iKEKds3j,JPMorgan
1,Apr 10,Ok thank you 😊,0,YeHE58,/company/JPMorgan/,SEND PRIVATE MESSAGE,/post/Negotiation-on-Exit-JPMC-iKEKds3j,JPMorgan
2,Apr 10,100k gbp,0,YeHE58,/company/JPMorgan/,SEND PRIVATE MESSAGE,/post/Negotiation-on-Exit-JPMC-iKEKds3j,JPMorgan
3,Apr 10,What’s your competing offer?,0,Cryptonyte,nan,SEND PRIVATE MESSAGE,/post/Negotiation-on-Exit-JPMC-iKEKds3j,JPMorgan
0,Apr 15,I interviewed with them a long time ago for a role in LA. 130K is possible as a “senior consultant”. Not sure about the pay difference vs Chicago but I wouldn’t go because they seem to drink too much koolaid.,1,hzbo84,/company/Facebook/,SEND PRIVATE MESSAGE,/post/Slalom-vs-JPMC-SWE---Chicago-z8dw6OYb,JPMorgan
1,Apr 16,Slalom Build? With 2 yoe they'll probably offer you 85-95k base tops plus 7%~ bonus. Very chill work life balance and lots of opportunities to thrive and grow if you want to go that route.,0,420blaze,/company/Slalom-Consulting/,SEND PRIVATE MESSAGE,/post/Slalom-vs-JPMC-SWE---Chicago-z8dw6OYb,JPMorgan
0,"Aug 14, 2019",110K TC Dallas,1,MarkBezos,/company/JPMorgan/,SEND PRIVATE MESSAGE,/post/JPMC-Salary-in-Bay-Area-hAnDHVas,JPMorgan
1,"Aug 14, 2019",Might as well update the post instead of putting it here.Sorry I don’t have much of a answer for ur question. But it should be a big increase from 110 to come to Bay Area.Is this for swe? How many yoe?,0,cJKu57,/company/BYTON/,SEND PRIVATE MESSAGE,/post/JPMC-Salary-in-Bay-Area-hAnDHVas,JPMorgan
2,"Aug 14, 2019",Current TC or gtfo.I am not saying. Just that others will say this. 😂,0,cJKu57,/company/BYTON/,SEND PRIVATE MESSAGE,/post/JPMC-Salary-in-Bay-Area-hAnDHVas,JPMorgan
0,Apr 6,"I’d say part-time sales force because you need to focus on studies, networking with classmates, career fairs, alumni events, etc in your University. Full-time at JPM, means you’ll work 40+ hours, with deadlines. Enjoy your University life, have fun, while you can. You’ll have rest of your life to work full time.",1,New.User,/company/JPMorgan/,Finance,/post/JPMC-fulltime-job-vs-Salesforce-internship-4pa1BhhW,JPMorgan
1,Apr 6,"Thats a good point, thank you",0,XNtN46,nan,SEND PRIVATE MESSAGE,/post/JPMC-fulltime-job-vs-Salesforce-internship-4pa1BhhW,JPMorgan
2,Mar 30,"If I were you, I’d go with SF.I suppose it won’t affect your study.",0,appazon,/company/Apple/,SEND PRIVATE MESSAGE,/post/JPMC-fulltime-job-vs-Salesforce-internship-4pa1BhhW,JPMorgan
3,Mar 30,"Why, better brand?",0,XNtN46,nan,SEND PRIVATE MESSAGE,/post/JPMC-fulltime-job-vs-Salesforce-internship-4pa1BhhW,JPMorgan
4,Mar 30,"Better than JPMC. If you are trying to break into FAANG you should be focusing on working at software companies, not banks.",0,MYfC12,/company/Salesforce/,SEND PRIVATE MESSAGE,/post/JPMC-fulltime-job-vs-Salesforce-internship-4pa1BhhW,JPMorgan
0,Jan 30,"Honestly a lot of chAse crowd is coming to Wells at leadership level. Wells used to be nice guy crowd, becoming chaseified now.",3,TpJW54,/company/Wells-Fargo/,SEND PRIVATE MESSAGE,/post/Wells-Fargo-vs-JPMC-techengineering-20Yguc5N,JPMorgan
1,Feb 1,"Yes, a little more rude",0,TpJW54,/company/Wells-Fargo/,SEND PRIVATE MESSAGE,/post/Wells-Fargo-vs-JPMC-techengineering-20Yguc5N,JPMorgan
2,Feb 1,"I'm rather new to this industry, but I've been told to expect things to move at a faster pace!",0,IPaw58,/company/Wells-Fargo/,SEND PRIVATE MESSAGE,/post/Wells-Fargo-vs-JPMC-techengineering-20Yguc5N,JPMorgan
3,Feb 1,Top performers in the team got some raise. 2-4%,2,akvpt,/company/Wells-Fargo/,SEND PRIVATE MESSAGE,/post/Wells-Fargo-vs-JPMC-techengineering-20Yguc5N,JPMorgan
4,Feb 7,How many of you get a base package >$170k and how many >$250k?,1,TpJW54,/company/Wells-Fargo/,SEND PRIVATE MESSAGE,/post/Wells-Fargo-vs-JPMC-techengineering-20Yguc5N,JPMorgan
5,Mar 14,"What is See in the jobs page is 120-140 some 170, maybe one was doe",0,pow75,/company/Wells-Fargo/,SEND PRIVATE MESSAGE,/post/Wells-Fargo-vs-JPMC-techengineering-20Yguc5N,JPMorgan
6,Feb 1,"From what I have heard raises for those who make less than 150k, those above didnt see any.",0,mowgli12,/company/Wells-Fargo/,SEND PRIVATE MESSAGE,/post/Wells-Fargo-vs-JPMC-techengineering-20Yguc5N,JPMorgan
7,Feb 1,Not really true,0,akvpt,/company/Wells-Fargo/,SEND PRIVATE MESSAGE,/post/Wells-Fargo-vs-JPMC-techengineering-20Yguc5N,JPMorgan
8,Feb 1,What I was told as well,0,KKei88,/company/Wells-Fargo/,SEND PRIVATE MESSAGE,/post/Wells-Fargo-vs-JPMC-techengineering-20Yguc5N,JPMorgan
9,Feb 28,"To echo, there's a lot of management from Chase and continuing to come over in tech. Wells is following Chase's footsteps in several ways these days.",0,aNRL05,/company/Wells-Fargo/,SEND PRIVATE MESSAGE,/post/Wells-Fargo-vs-JPMC-techengineering-20Yguc5N,JPMorgan
0,"Sep 3, 2020",Long live the covid 🙂 wfh for life,3,vUEH82,/company/JPMorgan/,SEND PRIVATE MESSAGE,/post/WFH-in-JPMC-dm4E6WWJ,JPMorgan
1,"Sep 3, 2020","Honestly I would go back to the office if it meant I could go back to having a life. That’s not a trade I’m willing to make, but to each their own.",4,-egg-,/company/JPMorgan/,SEND PRIVATE MESSAGE,/post/WFH-in-JPMC-dm4E6WWJ,JPMorgan
2,"Sep 3, 2020",To each their own 🥂,2,vUEH82,/company/JPMorgan/,SEND PRIVATE MESSAGE,/post/WFH-in-JPMC-dm4E6WWJ,JPMorgan
3,"Sep 3, 2020",Brooklyn office going back oct 4,0,dgdhsb,/company/JPMorgan/,SEND PRIVATE MESSAGE,/post/WFH-in-JPMC-dm4E6WWJ,JPMorgan
4,"Sep 6, 2020",Just in time for the fall wave!,1,RVer52,/company/JPMorgan/,SEND PRIVATE MESSAGE,/post/WFH-in-JPMC-dm4E6WWJ,JPMorgan
5,"Sep 3, 2020",Wfh for life indeed,1,CKMU37,/company/JPMorgan/,SEND PRIVATE MESSAGE,/post/WFH-in-JPMC-dm4E6WWJ,JPMorgan
6,"Sep 3, 2020",So far RTTO is voluntary in my location. Permanent wfh is really up to your manager / team,1,Ybon06,/company/JPMorgan/,SEND PRIVATE MESSAGE,/post/WFH-in-JPMC-dm4E6WWJ,JPMorgan
7,"Sep 3, 2020",what group are you in?,0,etks,/company/Credit-Suisse/,SEND PRIVATE MESSAGE,/post/WFH-in-JPMC-dm4E6WWJ,JPMorgan
0,"Oct 14, 2020",Salesforce and it’s not close,11,hmnabj ,/company/LinkedIn/,SEND PRIVATE MESSAGE,/post/Salesforce-vs-JPMorgan-Chase-SWE-Internship-XOf7PqnF,JPMorgan
1,"Oct 14, 2020","Don't go to a bank for software engineer if you can help it. Inferior compensation, career growth, work-life balance, tech stack, bureaucracy, office politics, engineering culture, and even dress code. You'll always be a support role to the bankers and other financial and managerial professionals, who are the real stars of the show.",7,1mnbvcxz24,nan,SEND PRIVATE MESSAGE,/post/Salesforce-vs-JPMorgan-Chase-SWE-Internship-XOf7PqnF,JPMorgan
2,"Oct 15, 2020","Salesforce, duh....Their return new grad offer is one of the highest",4,stuck_in,/company/Oracle/,SEND PRIVATE MESSAGE,/post/Salesforce-vs-JPMorgan-Chase-SWE-Internship-XOf7PqnF,JPMorgan
3,"Oct 14, 2020",Salesforce,4,JcWv04,/company/JPMorgan/,SEND PRIVATE MESSAGE,/post/Salesforce-vs-JPMorgan-Chase-SWE-Internship-XOf7PqnF,JPMorgan
4,"Oct 14, 2020",Salesforce 1000%. This isn’t even close,2,qGYV13,/company/Samsara/,SEND PRIVATE MESSAGE,/post/Salesforce-vs-JPMorgan-Chase-SWE-Internship-XOf7PqnF,JPMorgan
0,Mar 29,Also you dint need to disclose where you are heading,64,itrice,/company/Microsoft/,SEND PRIVATE MESSAGE,/post/Going-from-jpmc-to-capital-one-Will-i-be-asked-to-leave-work-the-same-day-when-i-resign-wxMenewM,JPMorgan
1,Mar 29,Just don’t tell where you’re heading,16,JackHarlow,/company/Workday/,SEND PRIVATE MESSAGE,/post/Going-from-jpmc-to-capital-one-Will-i-be-asked-to-leave-work-the-same-day-when-i-resign-wxMenewM,JPMorgan
2,Mar 29,That's a good answer,0,frailish,/company/Expedia/,SEND PRIVATE MESSAGE,/post/Going-from-jpmc-to-capital-one-Will-i-be-asked-to-leave-work-the-same-day-when-i-resign-wxMenewM,JPMorgan
3,Apr 3,Better answer is going on a vacation for 1 month and will then think about working.,1,JPoV40,/company/Palo-Alto-Networks/,SEND PRIVATE MESSAGE,/post/Going-from-jpmc-to-capital-one-Will-i-be-asked-to-leave-work-the-same-day-when-i-resign-wxMenewM,JPMorgan
4,Mar 29,"They kick you out and give you a 2 week paid vacation. Do it, STFU and leetcode.",10,x4k3y1,/company/Zillow/,SEND PRIVATE MESSAGE,/post/Going-from-jpmc-to-capital-one-Will-i-be-asked-to-leave-work-the-same-day-when-i-resign-wxMenewM,JPMorgan
5,Mar 29,"Ask your wife's boyfriend, he leetcodes.",7,x4k3y1,/company/Zillow/,SEND PRIVATE MESSAGE,/post/Going-from-jpmc-to-capital-one-Will-i-be-asked-to-leave-work-the-same-day-when-i-resign-wxMenewM,JPMorgan
6,Mar 29,Lol zillow. You clearly don't have a life outside of leetcoding,3,cheepotle,/company/Zoom/,SEND PRIVATE MESSAGE,/post/Going-from-jpmc-to-capital-one-Will-i-be-asked-to-leave-work-the-same-day-when-i-resign-wxMenewM,JPMorgan
7,Mar 28,"Depends on the manager, I stayed for the two weeks to reassign my work.",34,BM3,/company/Bank-of-America/,SEND PRIVATE MESSAGE,/post/Going-from-jpmc-to-capital-one-Will-i-be-asked-to-leave-work-the-same-day-when-i-resign-wxMenewM,JPMorgan
8,Mar 29,Make preparations as if you will be escorted out as soon as you give notice. But then give 2 weeks and see what happens.,23,OqbU02,/company/Facebook/,SEND PRIVATE MESSAGE,/post/Going-from-jpmc-to-capital-one-Will-i-be-asked-to-leave-work-the-same-day-when-i-resign-wxMenewM,JPMorgan
