,comment_date,comment_text,comment_like,comment_user,comment_firm,comment_position,comment_url,company
4,Apr 7,Yes VP is third level. ED is who I would report to.,0,lookingTC,nan,SEND PRIVATE MESSAGE,/post/Help-me-Evaluate-my-JP-Morgan-offer-BFiGNt7F,JPMorgan
5,Apr 7,3rd quartile means (roughly) one quarter of all NYC software engineer VPs have a higher TC. Nothing to do with reporting levels,1,JimDiGriz,/company/JPMorgan/,SEND PRIVATE MESSAGE,/post/Help-me-Evaluate-my-JP-Morgan-offer-BFiGNt7F,JPMorgan
6,Apr 6,Is VP meaningful at JPM or are there a million of them? How many reports would you have? I think you can go higher personally..,1,bodhisa₶va,nan,SEND PRIVATE MESSAGE,/post/Help-me-Evaluate-my-JP-Morgan-offer-BFiGNt7F,JPMorgan
7,Apr 6,"Vp doesn’t mean anything. But this TC is good, especially for the location. Perhaps negotiate a bit more? My tc barely increases after I join.",0,SVeQ70,/company/JPMorgan/,SEND PRIVATE MESSAGE,/post/Help-me-Evaluate-my-JP-Morgan-offer-BFiGNt7F,JPMorgan
8,Apr 11,VP is the equivalent of senior dev or junior manager.,1,DaimeJimon,/company/JPMorgan/,SEND PRIVATE MESSAGE,/post/Help-me-Evaluate-my-JP-Morgan-offer-BFiGNt7F,JPMorgan
9,Apr 7,"It's not bad, but we need to move the market to the 175k realm for tech VPs in TX (Houston or Dallas). In Dallas there are a ton folks who got here from India and took a 90k salary.... royally fking up the local market and benchmark. Source: h1bdata & interviews",3,Lionheart9,/company/Bank-of-America/,SEND PRIVATE MESSAGE,/post/Help-me-Evaluate-my-JP-Morgan-offer-BFiGNt7F,JPMorgan
10,Apr 7,Yeah I do agree. I am thinking on asking more. Trying to push for the 180k base hopefully.,0,lookingTC,nan,SEND PRIVATE MESSAGE,/post/Help-me-Evaluate-my-JP-Morgan-offer-BFiGNt7F,JPMorgan
11,Apr 6,That's a kick-ass tc for that location.,0,taxEvasion,nan,Eng,/post/Help-me-Evaluate-my-JP-Morgan-offer-BFiGNt7F,JPMorgan
0,"Dec 29, 2020",System design. For a staff level that's more important,1,kqU32x,/company/Google/,SEND PRIVATE MESSAGE,/post/Virtual-onsite-coming-up-jBoPJzHW,JPMorgan
1,"Dec 29, 2020",Depends on the company but educative system design is kind of shallow for staff level. It can get you senior but for staff you need more details. I recommend reading blogs/books. Designing data intensive applications is a good start.,0,kqU32x,/company/Google/,SEND PRIVATE MESSAGE,/post/Virtual-onsite-coming-up-jBoPJzHW,JPMorgan
2,"Dec 29, 2020",Thank you 🙏🏻 Data intensive book is pretty neat book!,1,peckydarn,/company/Synchronoss-Technologies/,Design,/post/Virtual-onsite-coming-up-jBoPJzHW,JPMorgan
3,Jan 2,Op can you share your stripe interview experience  ?,1,cCmp15,/company/Amazon/,Eng,/post/Virtual-onsite-coming-up-jBoPJzHW,JPMorgan
4,Jan 8,Stripe is yet to happen. Done with JPMC! It’s pretty standard! One managerial round followed by 2 tech round! System Design & related to JD,1,peckydarn,/company/Synchronoss-Technologies/,Design,/post/Virtual-onsite-coming-up-jBoPJzHW,JPMorgan
5,Mar 11,Mind sharing your onsite with slack? Thx,1,SShV71,/company/Paytm/,SEND PRIVATE MESSAGE,/post/Virtual-onsite-coming-up-jBoPJzHW,JPMorgan
6,Feb 10,How did it go OP?,1,JmQh43,/company/Squarespace/,Eng,/post/Virtual-onsite-coming-up-jBoPJzHW,JPMorgan
7,"Dec 29, 2020","To get into system design round, I have to go through code pairing session which is typically 1st round in virtual onsite! I went through phone screening + coding assessment & HM rounds so far!",0,peckydarn,/company/Synchronoss-Technologies/,Design,/post/Virtual-onsite-coming-up-jBoPJzHW,JPMorgan
0,Mar 8,Less competition in US. India is competitive as hell. Why do you think people move to US? Way easier to get into companies than in India.Btw I live in the US. Unfortunate because I think my counterparts in India are smarter than I am,4,donthireme,/company/Charles-Schwab/,SEND PRIVATE MESSAGE,/post/Help-Discriminatory-promotion-policy-yngnUxfM,JPMorgan
1,Mar 8,"Agreed 100%, that’s discrimination asf",3,donthireme,/company/Charles-Schwab/,SEND PRIVATE MESSAGE,/post/Help-Discriminatory-promotion-policy-yngnUxfM,JPMorgan
2,Mar 10,"Is US really less competitive than India because US attracts top talent from all across the globe. My perception was that US has similar competition to India, but more job opportunities due to economic development.",0,clmO08,/company/JPMorgan/,SEND PRIVATE MESSAGE,/post/Help-Discriminatory-promotion-policy-yngnUxfM,JPMorgan
3,Mar 8,"Yes similar experience here, working in JPMC India. It is so bad, looks like colonialism in 21st century.",4,DIuI18,/company/JPMorgan/,SEND PRIVATE MESSAGE,/post/Help-Discriminatory-promotion-policy-yngnUxfM,JPMorgan
4,Mar 8,Looks like we are being systematically pushed behind.,0,clmO08,/company/JPMorgan/,SEND PRIVATE MESSAGE,/post/Help-Discriminatory-promotion-policy-yngnUxfM,JPMorgan
5,Mar 9,"More like offshoring tax, vote with your feet - show them the beauty of the job market.",2,echosmith,/company/Amazon/,SEND PRIVATE MESSAGE,/post/Help-Discriminatory-promotion-policy-yngnUxfM,JPMorgan
6,Mar 8,Vote with your feet,4,lnikki,/company/Amazon/,Eng,/post/Help-Discriminatory-promotion-policy-yngnUxfM,JPMorgan
7,Mar 8,Do the US employees get promoted before having 6 years of experience?,1,100+LC/mo,/company/JB-Hunt/,Eng,/post/Help-Discriminatory-promotion-policy-yngnUxfM,JPMorgan
8,Mar 8,"Yes, I know people having similar education background and experience getting promoted in 4 years.",1,clmO08,/company/JPMorgan/,SEND PRIVATE MESSAGE,/post/Help-Discriminatory-promotion-policy-yngnUxfM,JPMorgan
9,Mar 8,Dang. I hope you find something better. :(,1,100+LC/mo,/company/JB-Hunt/,Eng,/post/Help-Discriminatory-promotion-policy-yngnUxfM,JPMorgan
10,Mar 8,"AFAIK, this is not the case in Goldman",2,kkblinder,/company/Goldman-Sachs/,SEND PRIVATE MESSAGE,/post/Help-Discriminatory-promotion-policy-yngnUxfM,JPMorgan
11,Mar 8,What do you recommend? How should I handle this situation?,0,clmO08,/company/JPMorgan/,SEND PRIVATE MESSAGE,/post/Help-Discriminatory-promotion-policy-yngnUxfM,JPMorgan
12,Mar 8,My Indian Local Manager said that I should not expect to become a VP before 6 years because these are the policies set by HR.,0,clmO08,/company/JPMorgan/,SEND PRIVATE MESSAGE,/post/Help-Discriminatory-promotion-policy-yngnUxfM,JPMorgan
0,"Aug 18, 2017",Update: I took JPMC 112K - Thanks all!,21,slythr,nan,Design,/post/UX-Salary-1CFy6ssB,JPMorgan
1,"Aug 1, 2017",95k in the Midwest is a better quality if life than 150k in SF.,9,smilidon,/company/McKesson/,Other,/post/UX-Salary-1CFy6ssB,JPMorgan
2,"Aug 1, 2017",Hope you r young to move for just a 3 month contract - I assume you will find a permanent job and just want to make a move to change your location ....otherwise it seems a little foolish.  But as Steve jobs says...stay young and foolish.,1,fernando,/company/Yelp/,SEND PRIVATE MESSAGE,/post/UX-Salary-1CFy6ssB,JPMorgan
3,"Aug 1, 2017","I moved for the girl, not the contract.",6,slythr,nan,Design,/post/UX-Salary-1CFy6ssB,JPMorgan
4,"Jul 31, 2017","you can probably get more from JPMC, but it's a good offer. Any cash bonus?",3,ackn,/company/Atlassian/,SEND PRIVATE MESSAGE,/post/UX-Salary-1CFy6ssB,JPMorgan
5,"Jul 31, 2017",It's 3month contract to hire so I'm flying blind.,0,slythr,nan,Design,/post/UX-Salary-1CFy6ssB,JPMorgan
6,"Aug 11, 2017","Hahahahah....... yeah I guess ""surprisingly techy"" is accurate....In Cols. mid level 95k is ok.....for like 5+ yrs experience...10-15 yrs experience...110k",2,OHcN13,/company/L-Brands/,SEND PRIVATE MESSAGE,/post/UX-Salary-1CFy6ssB,JPMorgan
0,"Oct 18, 2020","I think the scope of the role matters quite a bit here. You may already know this but while your title at BLK will be core PM, it's mostly an execution role. Core PM is a title given to those who handle operational bits, compliance, order raising, portfolio construction, hedging while PM's (without the 'Core' bit) are the ones making the actual investment decisions.",7,tGRE21,/company/BlackRock/,SEND PRIVATE MESSAGE,/post/Blackrock-vs-JPMorgan-bkuWq8S1,JPMorgan
1,"Oct 19, 2020",This is interesting for sure - any idea on the progression to PM? Is it more straightforward than JPM?,0,AmZn199,/company/Amazon/,SEND PRIVATE MESSAGE,/post/Blackrock-vs-JPMorgan-bkuWq8S1,JPMorgan
2,"Oct 19, 2020","I haven’t worked in JPM so can’t really compare, but JPM S&T is highly likely the better choice from a pure TC perspective. Also, it may be different within fixed income, but for equity and multi asset, core PM is separate from actual PM and there isn’t a sort of set trajectory from core PM -> PM, i.e. you’d still have to fight for it with external candidates and other internal candidates. If I could do it all over again, I would’ve started on the sell side rather than on the buy side, but hey, grass is always greener on the other side",0,tGRE21,/company/BlackRock/,SEND PRIVATE MESSAGE,/post/Blackrock-vs-JPMorgan-bkuWq8S1,JPMorgan
3,"Oct 18, 2020",Would you rather be a number at JP or be different at BLK? Definitely go Blackrock.,7,WbMo21,/company/BlackRock/,SEND PRIVATE MESSAGE,/post/Blackrock-vs-JPMorgan-bkuWq8S1,JPMorgan
4,"Oct 18, 2020",why not create a pull?,0,underdog03,/company/BlackRock/,Eng,/post/Blackrock-vs-JPMorgan-bkuWq8S1,JPMorgan
5,"Nov 7, 2020",This is so called typo my dear friends,1,underdog03,/company/BlackRock/,Eng,/post/Blackrock-vs-JPMorgan-bkuWq8S1,JPMorgan
6,"Nov 7, 2020",How do you know for sure,0,iscbjorfhj,/company/Facebook/,SEND PRIVATE MESSAGE,/post/Blackrock-vs-JPMorgan-bkuWq8S1,JPMorgan
7,"Oct 18, 2020",Buy side lol,4,edlax26,/company/JPMorgan/,SEND PRIVATE MESSAGE,/post/Blackrock-vs-JPMorgan-bkuWq8S1,JPMorgan
8,"Oct 19, 2020","Is it smart to start on the buy side? Or do you think it might be better to get sell side experience first - I was very curious on this. Also, how would you consider that NYC/SF divide?",0,AmZn199,/company/Amazon/,SEND PRIVATE MESSAGE,/post/Blackrock-vs-JPMorgan-bkuWq8S1,JPMorgan
9,"Oct 19, 2020","You always have a greater impact on the buy side since there is a performance mandate. The sell side thrives on its clientele and charging spread/commission so there is less incentive overall to do truly meaningful work. But again others have mentioned that PMs might be very executional, so I’m not quite sure what that would entail for you either. Another important variable is what product you’re placed in JPM trading. As for NYC vs SF, they’re similarly expensive...I suppose after COVID passes, NYC would provide more networking opportunities but as of right now there’s no big diff",0,edlax26,/company/JPMorgan/,SEND PRIVATE MESSAGE,/post/Blackrock-vs-JPMorgan-bkuWq8S1,JPMorgan
10,"Oct 19, 2020","it sounds like you have no idea what you want to do if you are asking buy vs. sell side and want people to tell you what you should do. You need to do some soul searching and figure out what you want to do after 2-3 years. If money is all you care, go with jpm.",2,D0k2,/company/Visa/,SEND PRIVATE MESSAGE,/post/Blackrock-vs-JPMorgan-bkuWq8S1,JPMorgan
11,"Oct 20, 2020","You are correct, I do not. I just know I'm good at fixed income roles hahaha",2,AmZn199,/company/Amazon/,SEND PRIVATE MESSAGE,/post/Blackrock-vs-JPMorgan-bkuWq8S1,JPMorgan
0,Feb 11,"Yes, same thing happened to me. Interviewer did eventually reach out to me. Timeframes vary quite a bit. When I first joined JPMC the whole interview process took a couple of months. Then I needed another couple of months to sort visa / background checks etc.5 years later I boomeranged back and cleared the interview + background check process in 3 weeks (it was an urgent role and I already have settlement status). Just wait for the recruiter.",1,VP-ED-MD,/company/JPMorgan/,SEND PRIVATE MESSAGE,/post/JP-Morgan-recruiter-texted-me-WDD0Mv2P,JPMorgan
1,Feb 11,"No worries. Yeah, I thought that it was weird when they reached out to me as well. Be careful anyway, specially if it's an external recruiter. If he's internal don't be afraid of asking him for his email address (or ask him to forward something to your email. Official emails are @jpmorgan.com & @chase.com).",1,VP-ED-MD,/company/JPMorgan/,SEND PRIVATE MESSAGE,/post/JP-Morgan-recruiter-texted-me-WDD0Mv2P,JPMorgan
2,Feb 18,"Irrelevant to the convo, but maybe relevant. I was approached via LinkedIn and followed up with an email from the recruiter. She setup a phone screen with her and then with the MD a few days later.I then had an in person interview loop that took about 2 hours. I had some follow up questions for the MD which took me a bit longer for them to get back to me on.I think for me, it took about 8 weeks from interview to offer. Then the background check could take another 15 days.From end to end, it was about 90 days from initial contact to starting on Day 1.",0,itmfie83,/company/JPMorgan/,SEND PRIVATE MESSAGE,/post/JP-Morgan-recruiter-texted-me-WDD0Mv2P,JPMorgan
0,"Apr 5, 2019",There is actually no data. Not much. You have a rare chance to create the culture.,4,fomoed,/company/Amazon/,SEND PRIVATE MESSAGE,/post/How-is-Haven-Healthcare-bT3pN1jt,JPMorgan
1,"Apr 5, 2019",Thanks! Will consider it a big opportunity.,0,🐨koala,/company/Oscar-Health/,SEND PRIVATE MESSAGE,/post/How-is-Haven-Healthcare-bT3pN1jt,JPMorgan
2,"Apr 5, 2019",Are they hiring for any technical role?,0,Yoho,/company/CVS-Pharmacy/,SEND PRIVATE MESSAGE,/post/How-is-Haven-Healthcare-bT3pN1jt,JPMorgan
3,"Apr 5, 2019",https://jobs.lever.co/healthproject?commitment=Full%20time,1,🐨koala,/company/Oscar-Health/,SEND PRIVATE MESSAGE,/post/How-is-Haven-Healthcare-bT3pN1jt,JPMorgan
4,"Apr 5, 2019",Thanks so much!,0,Yoho,/company/CVS-Pharmacy/,SEND PRIVATE MESSAGE,/post/How-is-Haven-Healthcare-bT3pN1jt,JPMorgan
5,"Apr 5, 2019",I know someone who worked there. Good bonuses didn't seem like a bad place,1,namastayyy,/company/IBM/,Eng,/post/How-is-Haven-Healthcare-bT3pN1jt,JPMorgan
6,"Apr 5, 2019",What role?,1,zUPv00,/company/IBM/,SEND PRIVATE MESSAGE,/post/How-is-Haven-Healthcare-bT3pN1jt,JPMorgan
7,"Apr 5, 2019",Good luck 🐨🍀,1,🌾👩🏽‍🌾🌾,nan,Biz Dev,/post/How-is-Haven-Healthcare-bT3pN1jt,JPMorgan
0,"Apr 29, 2019",Don’t do it. Terrible culture.,2,datajockey,/company/Invesco/,Data,/post/Jp-Morgan-Chase-Big-data-Engineer-M4YNFCjA,JPMorgan
1,"May 3, 2019","Hey, My experience is 3+ years. He offered me a total compensation which is just base salary as 130k . Nothing more just base salary.Wondering what more And how I can negotiate.",0,hyKe02,/company/Johnson&Johnson/,Admin,/post/Jp-Morgan-Chase-Big-data-Engineer-M4YNFCjA,JPMorgan
2,"May 6, 2019",That’s weird. My base is 120 and bonus 12k,0,datajockey,/company/Invesco/,Data,/post/Jp-Morgan-Chase-Big-data-Engineer-M4YNFCjA,JPMorgan
3,"Apr 29, 2019",Yoe?,0,dotvector,/company/JPMorgan/,Creative,/post/Jp-Morgan-Chase-Big-data-Engineer-M4YNFCjA,JPMorgan
4,"Apr 29, 2019",how long did you wait after onsite to get the offer?,0,4irigkskq,nan,SEND PRIVATE MESSAGE,/post/Jp-Morgan-Chase-Big-data-Engineer-M4YNFCjA,JPMorgan
0,"Apr 21, 2020",They haven’t started on the drawing board,1,BadaBoom12,/company/JPMorgan/,QA,/post/JPMorgan-employees-going-back-to-work-laBY6vA4,JPMorgan
1,"May 3, 2020","Stopped by the building on Friday. There were about 5-6 people working on the floor, not sure what group or capacity.NFW you’ll find me there. That being said, my MD is in the office.",0,RVer52,/company/JPMorgan/,SEND PRIVATE MESSAGE,/post/JPMorgan-employees-going-back-to-work-laBY6vA4,JPMorgan
2,"Apr 21, 2020",Memo = Tweets,0,nystfu,/company/JPMorgan/,SEND PRIVATE MESSAGE,/post/JPMorgan-employees-going-back-to-work-laBY6vA4,JPMorgan
3,"Apr 21, 2020",No formal plans to return yet,0,iconstixs,nan,SEND PRIVATE MESSAGE,/post/JPMorgan-employees-going-back-to-work-laBY6vA4,JPMorgan
4,"Apr 21, 2020",Not worth it,0,NBuG12,/company/Prudential-Financial/,SEND PRIVATE MESSAGE,/post/JPMorgan-employees-going-back-to-work-laBY6vA4,JPMorgan
0,"Aug 28, 2019","PCA is basically just a branch advisor for people with more than $250k in liquid assets. Comp is the same as most other shops. I think once you cap out your AUM the split is 50% of fees. Can’t recall the AUM needed to hit 50% split. Expect a terrible base, mostly commission.",1,ptgi36,/company/JPMorgan/,SEND PRIVATE MESSAGE,/post/Chase-market-expansion-S2TK5wm5,JPMorgan
1,"Aug 28, 2019","That’s exactly the info I needed, appreciate it",0,314680,/company/Merrill-Lynch/,Sales,/post/Chase-market-expansion-S2TK5wm5,JPMorgan
0,"Mar 5, 2020",ED to L6 😃,4,pehfbn,/company/Amazon/,SEND PRIVATE MESSAGE,/post/Moving-to-Amazon-from-JPMorgan-BwM2vvUA,JPMorgan
1,"Mar 7, 2020",Hasan - that’s only partially true. Getting to a ED and MD is still quiet significant at banks. It’s akin making L7 at FAANG.,0,teamdj,/company/JPMorgan/,SEND PRIVATE MESSAGE,/post/Moving-to-Amazon-from-JPMorgan-BwM2vvUA,JPMorgan
2,"Mar 7, 2020",Oh.,1,HasanMinaj,nan,Creative,/post/Moving-to-Amazon-from-JPMorgan-BwM2vvUA,JPMorgan
3,"Mar 5, 2020","Just for 10% compensation change, I won’t recommend the change. Amazon vacation are 6 national holidays and 15 vacations including sick that increases to 20 after 1 year. Based on stock growth potential though, you might be making more that 10% difference in Amazon though.",5,ukjK20,nan,SEND PRIVATE MESSAGE,/post/Moving-to-Amazon-from-JPMorgan-BwM2vvUA,JPMorgan
4,"Mar 6, 2020",True. At JPM the equity is not guaranteed. There had been cases when the equity portion is greatly pull down. But the probability of making to an MD from ED is almost less than 5%. It would take a minimum 5 years to get promoted. I heard at Amazon L6-L7 is doable in 2-4 yrs.,0,teamdj,/company/JPMorgan/,SEND PRIVATE MESSAGE,/post/Moving-to-Amazon-from-JPMorgan-BwM2vvUA,JPMorgan
5,"Mar 5, 2020",But how’s the food?,3,razorlab,/company/Netflix/,SEND PRIVATE MESSAGE,/post/Moving-to-Amazon-from-JPMorgan-BwM2vvUA,JPMorgan
6,"Mar 5, 2020",Free bananas are so tasty!!,1,kjfhn,/company/Amazon/,SEND PRIVATE MESSAGE,/post/Moving-to-Amazon-from-JPMorgan-BwM2vvUA,JPMorgan
7,"Mar 6, 2020","Cafeteria food. No free food in JPM. No cups in break room. They have 2 coffee machines at each floor and that’s that. Cafeteria food is as expensive as food at street (typical lunch and drink will be 10-12$, breakfast 5-8$). The team dinner and happy hours are good and at discretion of managers. I take my team once a month and my manager takes about once every 2 months. Usually there will be an ‘occasion’. I had been to google to visit and it is nothing like that. We have vending machines with some fresh food available and those are a bit pricier than the mall vending machines. So in short - Most banks don’t supply free food.",0,teamdj,/company/JPMorgan/,SEND PRIVATE MESSAGE,/post/Moving-to-Amazon-from-JPMorgan-BwM2vvUA,JPMorgan
8,"Mar 5, 2020",TC?,2,de5i,/company/Amazon/,SEND PRIVATE MESSAGE,/post/Moving-to-Amazon-from-JPMorgan-BwM2vvUA,JPMorgan
9,"Mar 6, 2020","JPM -330, Amzn 365.",1,teamdj,/company/JPMorgan/,SEND PRIVATE MESSAGE,/post/Moving-to-Amazon-from-JPMorgan-BwM2vvUA,JPMorgan
10,"Mar 29, 2020",Not worth the change for just 10% more,0,coolbatman,/company/Intel/,SEND PRIVATE MESSAGE,/post/Moving-to-Amazon-from-JPMorgan-BwM2vvUA,JPMorgan
11,"Mar 9, 2020","JPM is desperate for good managers in India.  If that is what you are being brought on for, ask for more.  Certain areas have high turn over.  That is usually a sign of management issues at the top.",1,chaasif,/company/JPMorgan/,SEND PRIVATE MESSAGE,/post/Moving-to-Amazon-from-JPMorgan-BwM2vvUA,JPMorgan
12,"Mar 9, 2020",Yep. Not just JPM but most MNC financial institutions in India has a good demand for senior leadership. But it is not the case in the US. There are a few positions in Plano that are opening up but I don’t think they are worth the long term to relocate there.,1,teamdj,/company/JPMorgan/,SEND PRIVATE MESSAGE,/post/Moving-to-Amazon-from-JPMorgan-BwM2vvUA,JPMorgan
0,"Feb 26, 2019",9/11 is like 18 years ago by now. Who has that kind of DP,4,🚕📲❗️,/company/Uber/,SEND PRIVATE MESSAGE,/post/Any-one-whos-H1-got-transferred-Successfully-after-sep-11-Te1Ga5Rq,JPMorgan
1,"Feb 26, 2019",Yes. Applied in December and approved in early feb. Know few other people with similar timelines.,0,yellowsk42,nan,SEND PRIVATE MESSAGE,/post/Any-one-whos-H1-got-transferred-Successfully-after-sep-11-Te1Ga5Rq,JPMorgan
2,"Feb 26, 2019",Was filed in which center ?,0,small org,/company/Walmart/,SEND PRIVATE MESSAGE,/post/Any-one-whos-H1-got-transferred-Successfully-after-sep-11-Te1Ga5Rq,JPMorgan
3,"Feb 26, 2019",California. All 3.,0,yellowsk42,nan,SEND PRIVATE MESSAGE,/post/Any-one-whos-H1-got-transferred-Successfully-after-sep-11-Te1Ga5Rq,JPMorgan
4,"Feb 26, 2019",That’s good to hear.,0,small org,/company/Walmart/,SEND PRIVATE MESSAGE,/post/Any-one-whos-H1-got-transferred-Successfully-after-sep-11-Te1Ga5Rq,JPMorgan
5,"Feb 26, 2019",Yes.,0,tadh,/company/Veritas/,SEND PRIVATE MESSAGE,/post/Any-one-whos-H1-got-transferred-Successfully-after-sep-11-Te1Ga5Rq,JPMorgan
0,"Oct 2, 2019",We can't trust your word without your TC.BTW what is horriable?,7,SrZeroCool,nan,Mktg,/post/Do-not-apply-7ZFPTKir,JPMorgan
1,"Oct 2, 2019","Possibly due to hiring freezes?  Jobs are posted but can't hire until the freeze is over.  Managers don't want to take them down because they are budgeted for the position.It would help if you used spell check, you write terrible, maybe that's why you can't get a job there?",5,0b1,/company/JPMorgan/,SEND PRIVATE MESSAGE,/post/Do-not-apply-7ZFPTKir,JPMorgan
2,"Oct 2, 2019",Invest in spellcheck. They also post jobs solely to allow an internal candidate or contractor to apply to it. Another scenario is posting it for an H1-B candidate who is applying for their green card as a formality when they have no real intention of hiring someone for the role.,3,init 1,/company/JPMorgan/,SEND PRIVATE MESSAGE,/post/Do-not-apply-7ZFPTKir,JPMorgan
3,"Oct 2, 2019",You parked in the back blocking the mail trucks? I heard of you,2,'-@-',/company/JPMorgan/,SEND PRIVATE MESSAGE,/post/Do-not-apply-7ZFPTKir,JPMorgan
4,"Oct 30, 2019",It can also be an actual posing but they are looking for fit / not urgent need.,0,wwVM54,nan,SEND PRIVATE MESSAGE,/post/Do-not-apply-7ZFPTKir,JPMorgan
0,"Dec 19, 2020",Atlassian hands down,6,HooliRich,/company/Atlassian/,SEND PRIVATE MESSAGE,/post/Best-WLB-quality-work-Pay-iFwFBqjX,JPMorgan
1,"Dec 19, 2020",Blind already publishes this result,6,BpqE5,/company/Stripe/,SEND PRIVATE MESSAGE,/post/Best-WLB-quality-work-Pay-iFwFBqjX,JPMorgan
2,"Dec 19, 2020",Tesla does not have work-life-balance. It's not part of it's culture.,5,YHwS33,/company/Amazon/,SEND PRIVATE MESSAGE,/post/Best-WLB-quality-work-Pay-iFwFBqjX,JPMorgan
3,"Dec 19, 2020","Adobe- 5,3,3.5",5,Shahzada,/company/Microsoft/,Data,/post/Best-WLB-quality-work-Pay-iFwFBqjX,JPMorgan
4,"Dec 19, 2020","Redfin - 5, 4, 3.5",4,Redfinian,/company/Redfin/,Eng,/post/Best-WLB-quality-work-Pay-iFwFBqjX,JPMorgan
0,"Sep 30, 2019","Hey, I work at JPM in Plano (finance). Do you have a specific role you need a referral for?",0,ifvQ22,/company/JPMorgan/,SEND PRIVATE MESSAGE,/post/Referral-Request-zR1PVAtb,JPMorgan
1,"Sep 30, 2019",This is the job posting: https://jobs.jpmorganchase.com/ShowJob/Id/237153,0,sethmohit,/company/JCPenney/,Eng,/post/Referral-Request-zR1PVAtb,JPMorgan
2,"Sep 30, 2019","Ok, I should be able to do it if you want to PM me and give me some details.",0,ifvQ22,/company/JPMorgan/,SEND PRIVATE MESSAGE,/post/Referral-Request-zR1PVAtb,JPMorgan
0,"Dec 22, 2020",I think directors are generally 200-250k base + 15-30% bonus (for non-revenue generating). Not sure if this is true for all back/middle office functions.Big kicker is 34 days PTO though.,1,@BNP,/company/BNP-Paribas/,Finance,/post/BNP-Paribas-IT-Director-Salary-bJhUDgcF,JPMorgan
1,"Dec 22, 2020",Thank you!,0,stari,/company/Deloitte/,SEND PRIVATE MESSAGE,/post/BNP-Paribas-IT-Director-Salary-bJhUDgcF,JPMorgan
2,Feb 22,No RSUs for directors. Even Managing directors are seeing less equity incentives,0,qesb82,/company/BNP-Paribas/,SEND PRIVATE MESSAGE,/post/BNP-Paribas-IT-Director-Salary-bJhUDgcF,JPMorgan
3,"Dec 22, 2020",Anyone? #bnpparibas,0,stari,/company/Deloitte/,SEND PRIVATE MESSAGE,/post/BNP-Paribas-IT-Director-Salary-bJhUDgcF,JPMorgan
0,"Aug 28, 2020",Yes they do... I am on H4 EAD currently working for JPM...,1,prince__,/company/JPMorgan/,SEND PRIVATE MESSAGE,/post/JPM-H4-EAD-HzR72GX5,JPMorgan
1,"Sep 3, 2020",Thanks. Did you opt for future start date of H4 COS and  EAD? I want to minimize the employment gap and not sure if JPM would allow me to take unpaid leave.,0,eWhK75,/company/JPMorgan/,Finance,/post/JPM-H4-EAD-HzR72GX5,JPMorgan
2,"Aug 28, 2020",Yes there was employment gap for few months but luckily I had good contacts in JPM and so it worked for me getting back to JPM...,0,prince__,/company/JPMorgan/,SEND PRIVATE MESSAGE,/post/JPM-H4-EAD-HzR72GX5,JPMorgan
3,"Aug 28, 2020",Thanks. Did you ever face employment gap? Any idea if we can take unpaid leave in that case or do we need to terminate the employment?,0,eWhK75,/company/JPMorgan/,Finance,/post/JPM-H4-EAD-HzR72GX5,JPMorgan
4,"Aug 28, 2020",Which location which tech?,0,whatrways,/company/JPMorgan/,SEND PRIVATE MESSAGE,/post/JPM-H4-EAD-HzR72GX5,JPMorgan
0,Apr 6,"Why not move to a pre-IPO startup or a mature financial tech company like a Bloomberg, Mastercard, PayPal, etc? JPM might pay you more cash but the red tape that comes with banking will eat at your soul.",0,Cryptonyte,nan,SEND PRIVATE MESSAGE,/post/Stay-with-start-ups-or-JP-Morgan-Chase-0w8sO3CC,JPMorgan
1,Apr 7,Interesting. Thanks a lot for the insights,0,a-z0-9,nan,Eng,/post/Stay-with-start-ups-or-JP-Morgan-Chase-0w8sO3CC,JPMorgan
2,Apr 7,Check out this article. It’s timely given this topic: https://www.finextra.com/newsarticle/37808/fintech-is-here-to-stay-says-jpmorgan-chief-jamie-dimon,1,Cryptonyte,nan,SEND PRIVATE MESSAGE,/post/Stay-with-start-ups-or-JP-Morgan-Chase-0w8sO3CC,JPMorgan
