,comment_date,comment_text,comment_like,comment_user,comment_firm,comment_position,comment_url,company
6,Feb 2,Is this ‘lower faith’ a red flag for you? How confident are you that you’ll become manager this year? Answers to these questions along with TC considerations will likely help you decide,0,notsur,/company/Roku/,SEND PRIVATE MESSAGE,/post/Should-I-consider-the-offer-or-stay-at-Roku-zWuN7S6W,Roku
7,Feb 4,How long you have been at Roku?,0,sensii ,/company/Roku/,SEND PRIVATE MESSAGE,/post/Should-I-consider-the-offer-or-stay-at-Roku-zWuN7S6W,Roku
8,Feb 4,"About 2 yrs, why do u ask?",0,rich-stoc,/company/Roku/,SEND PRIVATE MESSAGE,/post/Should-I-consider-the-offer-or-stay-at-Roku-zWuN7S6W,Roku
9,Feb 1,"Just because the companies you are targeting have a potential to make big, would recommend moving out! Are you in Ads?",0,goAd74,/company/Roku/,SEND PRIVATE MESSAGE,/post/Should-I-consider-the-offer-or-stay-at-Roku-zWuN7S6W,Roku
10,Feb 1,Not in Ads but work very closely with that team. Roku is not bad but I just don’t feel like missing out on the money i can make,0,rich-stoc,/company/Roku/,SEND PRIVATE MESSAGE,/post/Should-I-consider-the-offer-or-stay-at-Roku-zWuN7S6W,Roku
0,"Oct 24, 2018",WLB is very good. Pay is very good too.,2,•🥚 🐣🐥🐤,/company/Roku/,SEND PRIVATE MESSAGE,/post/Hows-work-at-Roku-fBr4Fv50,Roku
1,"Oct 25, 2018",What’s the base pay and TC for SDE’s ? YOE: 2,0,Jaffa🙏🏼,nan,Eng,/post/Hows-work-at-Roku-fBr4Fv50,Roku
2,"Oct 22, 2018",Tc Or Gtfo,2,Sylver,/company/Sauce-Labs/,Eng,/post/Hows-work-at-Roku-fBr4Fv50,Roku
3,"Oct 22, 2018",Base Pay : 0TC: 0.0Share your base pay and compensation first.,1,Scrg McDck,/company/Ringcentral/,Eng,/post/Hows-work-at-Roku-fBr4Fv50,Roku
4,"Oct 22, 2018",Currently my base pay is $105000.  If they ask about the numbers how much base pay and TC are you expecting ? How much do I need to mention base pay and TC ?,0,Jaffa🙏🏼,nan,Eng,/post/Hows-work-at-Roku-fBr4Fv50,Roku
5,"Oct 22, 2018",They were spun off of Netflix so I hear they have similar work/comp philosophies but I don’t know for sure.,0,Lovers,/company/Netflix/,SEND PRIVATE MESSAGE,/post/Hows-work-at-Roku-fBr4Fv50,Roku
0,"Mar 3, 2020","I don't know about compensation from Roku across those two locations. On general comparison side, I would choose Austin versus bayarea, because you may have to pay north of $3K for similar apt you have been staying in Connecticut for good schooling dist. For long term settlement like buying a house is expensive too, and Austin is better for that too.",1,lJjI60,/company/Hewlett-Packard-Enterprise/,SEND PRIVATE MESSAGE,/post/Roku-Bay-Area-vs-Austin-4p8yrZHp,Roku
1,"Mar 3, 2020","I don't really plan to stay long term in Bay area, may be 2-4 yrs and move to Austin or mid west etc, are you saying in Bay area I would expect to pay $3k or is that for Austin?",0,Vodka?,nan,SEND PRIVATE MESSAGE,/post/Roku-Bay-Area-vs-Austin-4p8yrZHp,Roku
2,"Mar 3, 2020","Sorry, if I wasn't clear but I have already cleared phone interviews. I updated my question, Would you like to provide any useful answer now?",1,Vodka?,nan,SEND PRIVATE MESSAGE,/post/Roku-Bay-Area-vs-Austin-4p8yrZHp,Roku
3,"Jun 23, 2020","Hi, Can I DM you to know your onsite Roku experience? Thanks!",0,zIra24,/company/eClinicalWorks/,SEND PRIVATE MESSAGE,/post/Roku-Bay-Area-vs-Austin-4p8yrZHp,Roku
4,"May 30, 2020","Hi ops, was your phone interview LC based?",0,mattll,/company/Bazaarvoice/,SEND PRIVATE MESSAGE,/post/Roku-Bay-Area-vs-Austin-4p8yrZHp,Roku
5,"Mar 7, 2020",Do bay area to get started. Lock in higher tc and lvl. Then do whatever you want if you need to relo,0,HXwF46,nan,SEND PRIVATE MESSAGE,/post/Roku-Bay-Area-vs-Austin-4p8yrZHp,Roku
0,"Jun 28, 2019",I have 6 yoe and I make 440k at current uber stock. So why are you worried asking for 450k with 12 yoe ?? Just go for it.,3,maadte,/company/Uber/,SEND PRIVATE MESSAGE,/post/Roku-Engineering-Manager-offer-xK5WoBFt,Roku
1,"Jun 29, 2019",Thanks! I am asking to avoid low balling myself as I do not have compensation data for Roku. Can Roku employees chime in here?,0,zigzagg,/company/Qualcomm/,Mgmt,/post/Roku-Engineering-Manager-offer-xK5WoBFt,Roku
2,"Jun 29, 2019",What is a good TC for an engineering manager?,0,zigzagg,/company/Qualcomm/,Mgmt,/post/Roku-Engineering-Manager-offer-xK5WoBFt,Roku
3,"Jun 29, 2019",Their number is similar to Netflix and their culture too.,0,drthvader,/company/NortonLifeLock/,SEND PRIVATE MESSAGE,/post/Roku-Engineering-Manager-offer-xK5WoBFt,Roku
0,Mar 1,Welcome to the family:),5,crueIla,/company/Roku/,SEND PRIVATE MESSAGE,/post/Roku-acquires-Nielsens-Ad-Video-Ad-Unit-s1i1knaF,Roku
1,Mar 15,Some comments here from folks who were acquired in 2019: https://us.teamblind.com/s/cEN2xCBL,3,ashburton,/company/Roku/,SEND PRIVATE MESSAGE,/post/Roku-acquires-Nielsens-Ad-Video-Ad-Unit-s1i1knaF,Roku
2,Mar 17,Thank you so much. I wonder what kind of TC will a new PHD get in Roku working in recommender system? Maybe like Google L5 or Facebook E5 level or maybe less?,0,charlink1,nan,SEND PRIVATE MESSAGE,/post/Roku-acquires-Nielsens-Ad-Video-Ad-Unit-s1i1knaF,Roku
3,Mar 17,Not sure how those compare.  What I can say is that the comp is very competitive and that we win against Google and Facebook more than we lose.,0,ashburton,/company/Roku/,SEND PRIVATE MESSAGE,/post/Roku-acquires-Nielsens-Ad-Video-Ad-Unit-s1i1knaF,Roku
4,Mar 1,"The ad team is mostly good, you should be fine. Not sure how the TC policy works post acquisition but Roku seems to pay above market average",1,Mlrn24,/company/Roku/,SEND PRIVATE MESSAGE,/post/Roku-acquires-Nielsens-Ad-Video-Ad-Unit-s1i1knaF,Roku
5,Mar 1,"There are reviews on Roku, about bias towards H1B employees and Gender bias. Are these edge cases?",2,69rkr,/company/Nielsen/,SEND PRIVATE MESSAGE,/post/Roku-acquires-Nielsens-Ad-Video-Ad-Unit-s1i1knaF,Roku
6,Mar 1,"That's why I mentioned ""mostly"". Most folks are competent and mean well but you might have to navigate your way when dealing with edge cases, i.e. if and when you have to work with them :( There is no culture/ HR policy out there that can ensure things are smooth. You are on your own, so eventually, it's a matter of luck",0,Mlrn24,/company/Roku/,SEND PRIVATE MESSAGE,/post/Roku-acquires-Nielsens-Ad-Video-Ad-Unit-s1i1knaF,Roku
7,Mar 13,I wonder what is the TC in Roku? How is it compared to FB E4 or google L4?,0,charlink1,nan,SEND PRIVATE MESSAGE,/post/Roku-acquires-Nielsens-Ad-Video-Ad-Unit-s1i1knaF,Roku
0,"May 5, 2018",Run!,3,nflx&chill,/company/Netflix/,SEND PRIVATE MESSAGE,/post/Hows-life-at-roku-wkCfUGmZ,Roku
1,"May 5, 2018",Far away!,0,nflx&chill,/company/Netflix/,SEND PRIVATE MESSAGE,/post/Hows-life-at-roku-wkCfUGmZ,Roku
2,"May 5, 2018",Why? What’s wrong with roku? Financials seem ok,0,Atlashrug,/company/Facebook/,SEND PRIVATE MESSAGE,/post/Hows-life-at-roku-wkCfUGmZ,Roku
3,"May 5, 2018",Hire and fire culture. Management can be bossy and can take decisions for you. WLB depends on the project phase and team. Some managers encourage preventing burn out.@poopjuice says coworkers don't get close and friendly.,1,fMMA78,/company/Roku/,SEND PRIVATE MESSAGE,/post/Hows-life-at-roku-wkCfUGmZ,Roku
4,"Jun 19, 2018",Are you still there? Is the culture pretty toxic? Or pretty decent (aside from hire and fire)? What’s work life balance like?,0,LennyMice,/company/Facebook/,SEND PRIVATE MESSAGE,/post/Hows-life-at-roku-wkCfUGmZ,Roku
5,"Jun 20, 2018",Not there anymore. I liked the people and culture and thought it was decent place that pays well It’s all about the team you are on. Work life balance was not good imo. That can change depending on what you are working on and the time of the season regarding the consumer electronics space.,0,TaNF42,/company/Square/,SEND PRIVATE MESSAGE,/post/Hows-life-at-roku-wkCfUGmZ,Roku
6,"May 5, 2018",Yes,0,Omgomgomg1,/company/Netflix/,Eng,/post/Hows-life-at-roku-wkCfUGmZ,Roku
7,"May 5, 2018",Yes to which one?,1,Atlashrug,/company/Facebook/,SEND PRIVATE MESSAGE,/post/Hows-life-at-roku-wkCfUGmZ,Roku
8,"May 5, 2018","It’s so funny to see people think of FANG as a thing. It’s really not a converged entity with the exact same culture, they’re all different companies (I’m sure you know that).",1,ITnm34,/company/Google/,SEND PRIVATE MESSAGE,/post/Hows-life-at-roku-wkCfUGmZ,Roku
9,"May 5, 2018","Tc is good, not sure about wlb",0,Oraafhptd,/company/Oracle/,Eng,/post/Hows-life-at-roku-wkCfUGmZ,Roku
10,"May 5, 2018",How do you know the TC is good but aren’t sure about WLB? Did you get an offer from there?,0,Atlashrug,/company/Facebook/,SEND PRIVATE MESSAGE,/post/Hows-life-at-roku-wkCfUGmZ,Roku
0,"Jun 22, 2020",No place has no politics.. sounds like a naive statement,15,y0lo3,/company/Redfin/,SEND PRIVATE MESSAGE,/post/Does-ROKU-really-have-no-politics-5r6o101v,Roku
1,"Jun 22, 2020",Shouldn’t you be telling us this?,7,doll$h,/company/Okta/,SEND PRIVATE MESSAGE,/post/Does-ROKU-really-have-no-politics-5r6o101v,Roku
2,"Jun 22, 2020",So there is internal blind channel too. I am new to blind still learning.,0,wjhi62,/company/Roku/,SEND PRIVATE MESSAGE,/post/Does-ROKU-really-have-no-politics-5r6o101v,Roku
3,"Jun 22, 2020",Yes. Click that Roku tab right next to Topics on your Blind home page,0,doll$h,/company/Okta/,SEND PRIVATE MESSAGE,/post/Does-ROKU-really-have-no-politics-5r6o101v,Roku
4,"Jun 22, 2020","LOL. Roku has a lot of politics, just like any other company.",4,altruist,/company/Roku/,SEND PRIVATE MESSAGE,/post/Does-ROKU-really-have-no-politics-5r6o101v,Roku
5,"Jun 22, 2020",Yes. Get back to work,2,DumpThTurd,/company/Microsoft/,SEND PRIVATE MESSAGE,/post/Does-ROKU-really-have-no-politics-5r6o101v,Roku
6,"Jun 22, 2020","Whenever there is a power, there will be politics.",1,new-cruise,/company/Cruise/,SEND PRIVATE MESSAGE,/post/Does-ROKU-really-have-no-politics-5r6o101v,Roku
0,"Sep 20, 2019",Look at their stock the last few days.,0,DukeofEarl,/company/Oracle/,SEND PRIVATE MESSAGE,/post/Roku-Comp-Negotiations-Z2NUocpU,Roku
0,"May 28, 2019",Roku still exists?,0,86753on,/company/Activision-Blizzard/,SEND PRIVATE MESSAGE,/post/Roku-swe-onsite-interview-format-7MSRLRQp,Roku
1,"Aug 15, 2019",1 in 4 American households have Roku,0,u$rN@?€,/company/Roku/,SEND PRIVATE MESSAGE,/post/Roku-swe-onsite-interview-format-7MSRLRQp,Roku
2,"Oct 5, 2019",What are you talking about? Roku will be valued more than Netflix soon.,1,sjdxxs,nan,SEND PRIVATE MESSAGE,/post/Roku-swe-onsite-interview-format-7MSRLRQp,Roku
3,"May 29, 2019","Normal stuff, some design, algorithms, maybe scaling a service, hardware problems, ml etc",1,gdhdhch,/company/Roku/,SEND PRIVATE MESSAGE,/post/Roku-swe-onsite-interview-format-7MSRLRQp,Roku
4,"May 28, 2019",I’ve done it once. Austin or Los Gatos?,0,kuulcoder,/company/Chevron/,SEND PRIVATE MESSAGE,/post/Roku-swe-onsite-interview-format-7MSRLRQp,Roku
5,"May 28, 2019",Can’t help you there. My Austin one was 4 interviews. 2 technical 2 talking about projects/behavioral. There was a small quiz at the beginning the director made me take with brainteasers. No lunch break inbetween. Technical ones were asking random questions about C++ since it was more of a firmware engineer,0,kuulcoder,/company/Chevron/,SEND PRIVATE MESSAGE,/post/Roku-swe-onsite-interview-format-7MSRLRQp,Roku
6,"May 28, 2019","No problem, but anything out of the ordinary, or something different from regular swe interviews?",0,Hshdjek,/company/eBay/,SEND PRIVATE MESSAGE,/post/Roku-swe-onsite-interview-format-7MSRLRQp,Roku
7,Feb 16,What is the Roku timeline after interview ?,0,qMcV06,nan,SEND PRIVATE MESSAGE,/post/Roku-swe-onsite-interview-format-7MSRLRQp,Roku
8,Mar 23,How was your experience? Mind sharing ?,0,YXeT70,/company/HERE-Technologies/,SEND PRIVATE MESSAGE,/post/Roku-swe-onsite-interview-format-7MSRLRQp,Roku
0,Apr 6,"I am currently working at Roku and love every moment so far. The negative experience can narrow down to team by team basis. And that applies pretty much every company.In regard to the interview process, you can reach out to HR directly about that. They are on your side and will try their best to help you succeed in the interview.Good luck!",1,monk1234,/company/Walmart/,Eng,/post/Onsite-interview-Senior-SWE-Web-at-Roku-M3WD8KU7,Roku
1,Apr 6,"Fake, horrible pay structure, no benefit  worst in valley, no HSA , NO ESPP, high insurance, no hike, constant fear of getting fired, no support during pandemics.",0,dilmagemo,/company/Roku/,SEND PRIVATE MESSAGE,/post/Onsite-interview-Senior-SWE-Web-at-Roku-M3WD8KU7,Roku
2,Apr 6,"I empathy for your situation Dilmagemo and agree with the downside of benefits. However, I disagree on “constant fear of getting fired”. If you feel that way then it is probably just within your team/org. You can’t generalize your personal experience as the entire company’s culture/experience.",0,monk1234,/company/Walmart/,Eng,/post/Onsite-interview-Senior-SWE-Web-at-Roku-M3WD8KU7,Roku
3,Apr 4,"Do not come here, if u are h1b. Really tough life if your manager is Indian, he only hire Indian , because he can exploit them, might sound funny but true",1,dilmagemo,/company/Roku/,SEND PRIVATE MESSAGE,/post/Onsite-interview-Senior-SWE-Web-at-Roku-M3WD8KU7,Roku
4,Apr 4,What if the manager is not Indian?,0,Corepunk,/company/PayPal/,Eng,/post/Onsite-interview-Senior-SWE-Web-at-Roku-M3WD8KU7,Roku
5,Apr 4,Which Indian manager?,0,mpmpm,/company/Google/,SEND PRIVATE MESSAGE,/post/Onsite-interview-Senior-SWE-Web-at-Roku-M3WD8KU7,Roku
6,Apr 6,Dilmage more you were definitely PIPd for talking nonsense,0,Gotham!,/company/Roku/,SEND PRIVATE MESSAGE,/post/Onsite-interview-Senior-SWE-Web-at-Roku-M3WD8KU7,Roku
7,Apr 6,"I am pretty sure the advice asked for in this post was related to the interview expectations, and not about work culture. Interviewing at a company doesn't put you under any obligation to join a company.  Who knows, may be he is interviewing at Roku for practise. I have a few friends at Roku, and I am sure they dont echo the  sentiments of dilmagemore, on the contrary, they are pretty happy at Roku.",0,laddulover,/company/Automation-Anywhere/,Eng,/post/Onsite-interview-Senior-SWE-Web-at-Roku-M3WD8KU7,Roku
0,Apr 9,Why would you join Roku? Not worth it. Poor managers.,0,ridhdh,/company/Roku/,SEND PRIVATE MESSAGE,/post/Need-Referral-at-ROKU-buuTPx0m,Roku
1,Apr 1,DM me..,0,ukor,/company/Roku/,SEND PRIVATE MESSAGE,/post/Need-Referral-at-ROKU-buuTPx0m,Roku
2,Mar 31,DM for PayPal,0,Kisofdeath,/company/PayPal/,SEND PRIVATE MESSAGE,/post/Need-Referral-at-ROKU-buuTPx0m,Roku
0,"Apr 27, 2020",Wtf is that Roku base ?,14,YgBoost,/company/Lyft/,SEND PRIVATE MESSAGE,/post/Machine-Learning-Engineer-AppleSeattle-vs-RokuSan-Jose-eECtUqVz,Roku
1,"Apr 27, 2020",+1 lol.. how?,0,CloudSmith,/company/Microsoft/,Product,/post/Machine-Learning-Engineer-AppleSeattle-vs-RokuSan-Jose-eECtUqVz,Roku
2,"Apr 27, 2020",This is typical base at Roku,0,bulldawg,/company/Roku/,SEND PRIVATE MESSAGE,/post/Machine-Learning-Engineer-AppleSeattle-vs-RokuSan-Jose-eECtUqVz,Roku
3,"Apr 28, 2020","OP - Congratulations on offer. I used to be at Apple before moving to Roku. It depends on what you want long term vs short term benefit. For short term - Roku is looking better because you get cash upfront but remember stock refreshers at Roku don't exist. No 401k. Health insurance is really expensive. Maternity / paternity is bad. HR doesn't help you with personal issues. Your fate is practically being held by your manager or VP of your org.If you are going to work for old timers at Roku, I would suggest don't even think about coming here. Old timer VPs are way too arrogant to work for. Also, you cannot move to other team at Roku. They don't have culture to grow people professionally. It's going to be a hit or miss opportunity. If it's a miss you are screwed. If you are on H1b you are even more screwed. Also, current circumstances for H1b are not looking good.Apple lets you move internally within different teams. Refreshers are really good. If you perform well you can get up to 100% of base in refreshers every year. Add bonus, 401k, better health insurance on top of it.if you get promoted in future, you are looking at more money.Most importantly you will work at cutting edge stuff at Apple. Roku is 20 years behind in tech and you cannot sell this experience anywhere else.ML is either Search and Recommendations, Ads or Voice team. Unless it's ads team, don't even consider other teams. Those teams are being run very ineffeciently.At the end of day, decide if you are in this game for short term or long term.",9,Dr Trump,/company/Roku/,SEND PRIVATE MESSAGE,/post/Machine-Learning-Engineer-AppleSeattle-vs-RokuSan-Jose-eECtUqVz,Roku
4,"Apr 27, 2020",Apple level?,1,colla,/company/Salesforce/,SEND PRIVATE MESSAGE,/post/Machine-Learning-Engineer-AppleSeattle-vs-RokuSan-Jose-eECtUqVz,Roku
5,"Apr 27, 2020",???? So - it’s tc you look at not rsu,2,YgBoost,/company/Lyft/,SEND PRIVATE MESSAGE,/post/Machine-Learning-Engineer-AppleSeattle-vs-RokuSan-Jose-eECtUqVz,Roku
6,"May 16, 2020",@lyft TC includes RSU (the yearly ones that got vested). Thats why its called Tc not salary.But yea in this case his Apple TC is 250 and still less than Roku’s,0,InMc36,/company/Apple/,SEND PRIVATE MESSAGE,/post/Machine-Learning-Engineer-AppleSeattle-vs-RokuSan-Jose-eECtUqVz,Roku
7,"Apr 27, 2020","305K seems awfully high base for a 2 YoE, irrespective of how good your interview was, unless you have some very niche skill. Else, its almost reckless for Roku to offer that high pay.",2,pdEs13,/company/EATON/,SEND PRIVATE MESSAGE,/post/Machine-Learning-Engineer-AppleSeattle-vs-RokuSan-Jose-eECtUqVz,Roku
8,"Apr 27, 2020",^lol that was a very quick change in tone. Congrats OP,1,carmax,/company/Apple/,SEND PRIVATE MESSAGE,/post/Machine-Learning-Engineer-AppleSeattle-vs-RokuSan-Jose-eECtUqVz,Roku
9,"Apr 27, 2020",What will you be doing as a Machine Learning Engineer?,0,Alpha_7,nan,SEND PRIVATE MESSAGE,/post/Machine-Learning-Engineer-AppleSeattle-vs-RokuSan-Jose-eECtUqVz,Roku
10,"Apr 27, 2020",Go to Apple. Roku is a shit show. Too much politics and no career growth. You will thrive in Apple for a significant period.,5,tyuer,/company/Roku/,SEND PRIVATE MESSAGE,/post/Machine-Learning-Engineer-AppleSeattle-vs-RokuSan-Jose-eECtUqVz,Roku
11,"Apr 27, 2020",Oh what? Is this a recent thing?,0,carmax,/company/Apple/,SEND PRIVATE MESSAGE,/post/Machine-Learning-Engineer-AppleSeattle-vs-RokuSan-Jose-eECtUqVz,Roku
12,"May 5, 2020","100% Agree. Also recently left Roku. Tons of issues: mismgmt problems, no raises in 3+ years, no growth opp, no team switching, lots of nepotism/politics.",0,Qnvm46,nan,SEND PRIVATE MESSAGE,/post/Machine-Learning-Engineer-AppleSeattle-vs-RokuSan-Jose-eECtUqVz,Roku
0,"Aug 15, 2019",Cruise just pushed out the launch date of its ride sharing service by a year. If it’s not the first to launch it’s screwed.,1,Vfdw66,/company/Postmates/,SEND PRIVATE MESSAGE,/post/cruise-vs-roku-0SRsUuYd,Roku
1,"Aug 15, 2019",Isn't it owned by gm and backed by honda?Why would they be screwed in that case?,0,cJKu57,/company/BYTON/,SEND PRIVATE MESSAGE,/post/cruise-vs-roku-0SRsUuYd,Roku
2,"Aug 15, 2019",Honda owns 5% and GM owns around 70%. Best case scenario for cruise if it doesn’t launch its ride share is GM brings it back in-house. I guess that’s fine if you want to lose your RSUs and become a GM employee.,0,Vfdw66,/company/Postmates/,SEND PRIVATE MESSAGE,/post/cruise-vs-roku-0SRsUuYd,Roku
3,"Aug 15, 2019",What’s your offer for both companies,1,momo🤘,/company/Proofpoint/,SEND PRIVATE MESSAGE,/post/cruise-vs-roku-0SRsUuYd,Roku
4,"Aug 15, 2019","Roku, the streaming industry is booming. Ride sharing doesn't make money.",1,fraang,/company/Roku/,Eng,/post/cruise-vs-roku-0SRsUuYd,Roku
5,"Aug 15, 2019",Probably Roku since it's more stable,1,Vaporeon ,/company/Amazon/,SEND PRIVATE MESSAGE,/post/cruise-vs-roku-0SRsUuYd,Roku
0,"Sep 4, 2020","Stay away, you will regret as I do",0,usudjh,/company/Roku/,SEND PRIVATE MESSAGE,/post/PM-referral-at-Roku-QQT226Zg,Roku
1,"Sep 4, 2020",Why? What’s wrong there?,0,OPnd70,/company/Oath/,SEND PRIVATE MESSAGE,/post/PM-referral-at-Roku-QQT226Zg,Roku
2,"Sep 4, 2020",I don’t regret working at Roku. If somebody regrets working at Roku they seriously have some problem with themselves. Roku is the most chill and highest paying company.,2,pitbull69,/company/Roku/,SEND PRIVATE MESSAGE,/post/PM-referral-at-Roku-QQT226Zg,Roku
3,"Sep 4, 2020","Options #2,3 I guess 🤥",1,🏇🏻🥇..,/company/Amazon/,Product,/post/PM-referral-at-Roku-QQT226Zg,Roku
4,"Sep 4, 2020",OP. I agree option2&3 are way way more important that #1. And that’s precisely why Roku doesn’t have referral bonus.,0,cruelIa,/company/Roku/,SEND PRIVATE MESSAGE,/post/PM-referral-at-Roku-QQT226Zg,Roku
5,"Sep 3, 2020",Why do you work on there?,0,OPnd70,/company/Oath/,SEND PRIVATE MESSAGE,/post/PM-referral-at-Roku-QQT226Zg,Roku
6,"Sep 3, 2020",?,0,🏇🏻🥇..,/company/Amazon/,Product,/post/PM-referral-at-Roku-QQT226Zg,Roku
7,"Sep 3, 2020",At Amazon,0,OPnd70,/company/Oath/,SEND PRIVATE MESSAGE,/post/PM-referral-at-Roku-QQT226Zg,Roku
8,"Sep 4, 2020",Happy to refer you. You can DM me,0,pitbull69,/company/Roku/,SEND PRIVATE MESSAGE,/post/PM-referral-at-Roku-QQT226Zg,Roku
9,"Sep 4, 2020",Thank you! I’ll send you a DM shortly. 👍🏼,0,🏇🏻🥇..,/company/Amazon/,Product,/post/PM-referral-at-Roku-QQT226Zg,Roku
10,"Sep 5, 2020",Dm me,0,Tbtv34,/company/Roku/,SEND PRIVATE MESSAGE,/post/PM-referral-at-Roku-QQT226Zg,Roku
0,"Jan 3, 2020",They dont get back if its a reject! For me they sent onsite invite the next day,1,print(‘f’),/company/Juniper/,SEND PRIVATE MESSAGE,/post/Roku-Technical-Phone-Interview-1tN5EB5c,Roku
1,"Jan 3, 2020",Just sent a follow-up mail and ask for the feedback,0,20200,/company/Apple/,Eng,/post/Roku-Technical-Phone-Interview-1tN5EB5c,Roku
2,"Jan 3, 2020",I just did yesterday but no response till now,0,Tech165,/company/PwC/,SEND PRIVATE MESSAGE,/post/Roku-Technical-Phone-Interview-1tN5EB5c,Roku
3,"Jan 4, 2020",Wait for a few more days and send again,0,20200,/company/Apple/,Eng,/post/Roku-Technical-Phone-Interview-1tN5EB5c,Roku
4,"May 30, 2020","Hey OP, was your phone interview LC based?",0,mattll,/company/Bazaarvoice/,SEND PRIVATE MESSAGE,/post/Roku-Technical-Phone-Interview-1tN5EB5c,Roku
5,"Jan 3, 2020",Holiday season my friend!,0,madChinese,/company/Intuit/,SEND PRIVATE MESSAGE,/post/Roku-Technical-Phone-Interview-1tN5EB5c,Roku
0,"Nov 3, 2019",Did you finish the interview? Do they ask leetcode easy medium or hard questions for telephonic interview,1,FTbC33,/company/247ai/,SEND PRIVATE MESSAGE,/post/Roku-qa-automation-interview-3gxAha3k,Roku
1,"Oct 16, 2020","@op, would you mind sharing your interview experience?",0,$$$guy,/company/Fujitsu-Global/,SEND PRIVATE MESSAGE,/post/Roku-qa-automation-interview-3gxAha3k,Roku
0,"Sep 4, 2020",Is apple Siri still used? Thought it was sunset.,3,baklavas,/company/Walmart/,SEND PRIVATE MESSAGE,/post/Roku-Vs-Apple-Siri-yWtueVvu,Roku
1,"Sep 5, 2020",Roku is a shit product. See their Glassdoor and Blind reviews. People don't seem happy there. Apple for the long term is good.,0,readyornot,/company/Google/,SEND PRIVATE MESSAGE,/post/Roku-Vs-Apple-Siri-yWtueVvu,Roku
2,"Sep 5, 2020",You and your stupid Android TV will never be ready!,0,pitbull69,/company/Roku/,SEND PRIVATE MESSAGE,/post/Roku-Vs-Apple-Siri-yWtueVvu,Roku
3,"Sep 5, 2020",?What is immi_g ?,0,readyornot,/company/Google/,SEND PRIVATE MESSAGE,/post/Roku-Vs-Apple-Siri-yWtueVvu,Roku
4,"Sep 4, 2020",I like Roku only coz of Cruella,1,Faang API,/company/Cypress-Semiconductor/,SEND PRIVATE MESSAGE,/post/Roku-Vs-Apple-Siri-yWtueVvu,Roku
5,"Sep 4, 2020","TC? Also before I read TC, Apple Siri org is very bad.",1,yIhi17,nan,SEND PRIVATE MESSAGE,/post/Roku-Vs-Apple-Siri-yWtueVvu,Roku
6,"Sep 4, 2020",Roku for short term. Apple for long term. Also depends on TC.,1,Pinterest?,/company/Roku/,SEND PRIVATE MESSAGE,/post/Roku-Vs-Apple-Siri-yWtueVvu,Roku
0,"Nov 2, 2018",Any insights from anyone working a roku,0,Pearman,/company/Oracle/,SEND PRIVATE MESSAGE,/post/Working-at-Roku-n3gROR0C,Roku
1,"Oct 19, 2018",Will also like to know more details about the same,0,Pearman,/company/Oracle/,SEND PRIVATE MESSAGE,/post/Working-at-Roku-n3gROR0C,Roku
0,"Nov 27, 2018","Thanks for sharing! I thought it would be higher for a director role, like 800k+, since people keep saying roku pays similar to Netflix and Netflix pays senior engineers 500k.",1,cmdgc,/company/Amazon/,SEND PRIVATE MESSAGE,/post/Analytics-Director-at-Roku-JbedqLRC,Roku
1,"Nov 27, 2018",Way way overpaid,0,supichai,/company/Facebook/,SEND PRIVATE MESSAGE,/post/Analytics-Director-at-Roku-JbedqLRC,Roku
2,"Nov 27, 2018",Yea... depends on where you set the baseline. Same could be said about pay scale in FANG when you compare it to the national average.,0,cmdgc,/company/Amazon/,SEND PRIVATE MESSAGE,/post/Analytics-Director-at-Roku-JbedqLRC,Roku
3,"Nov 27, 2018","Dude you are only 10 yoe , unless you started a startup or are some super hot data scientist Roku isn’t going to give you 500K",1,hiringData,/company/Bose-Corporation/,SEND PRIVATE MESSAGE,/post/Analytics-Director-at-Roku-JbedqLRC,Roku
4,"Nov 28, 2018",Exactly,0,supichai,/company/Facebook/,SEND PRIVATE MESSAGE,/post/Analytics-Director-at-Roku-JbedqLRC,Roku
5,"Nov 27, 2018",250 to 300,1,supichai,/company/Facebook/,SEND PRIVATE MESSAGE,/post/Analytics-Director-at-Roku-JbedqLRC,Roku
6,"Nov 27, 2018",Is this only base ? Or total comp ?,0,max78,nan,SEND PRIVATE MESSAGE,/post/Analytics-Director-at-Roku-JbedqLRC,Roku
7,"Nov 27, 2018",Exp is leas but 275 should be base.,1,GSW,/company/Bank-of-the-West/,Consultant,/post/Analytics-Director-at-Roku-JbedqLRC,Roku
8,"Nov 30, 2018",I think it is a good offer. Their stock went down currently but if it goes up stock would double.,0,Duck-Bezos,/company/Ringcentral/,Eng,/post/Analytics-Director-at-Roku-JbedqLRC,Roku
