,comment_date,comment_text,comment_like,comment_user,comment_firm,comment_position,comment_url,company
0,Apr 5,200K RSU - you mean RSUs worth 200K or 200K shares? 200K shares are worth 60M at current share price.,0,mrNe27,/company/Roku/,SEND PRIVATE MESSAGE,/post/Square-Vs-Roku-mMRKXE4W,Roku
1,Apr 6,Ask yourself that question again and see if you can guess what the correct answer would be? After that think if you really had to ask this question. 🙄,23,abcdefk,/company/eBay/,SEND PRIVATE MESSAGE,/post/Square-Vs-Roku-mMRKXE4W,Roku
2,Apr 7,Lol. There us no such thing as stupid question. This is a prime example of one,3,NYyv73,/company/Zillow/,SEND PRIVATE MESSAGE,/post/Square-Vs-Roku-mMRKXE4W,Roku
3,Mar 18,"Roku does not have ANY type of bonus, no Espp, they pay min for health insurance (so your premium would mostly jump).and there are NO holidays. You will see meetings scheduled on national holidays as well.",6,hhfdib,/company/Roku/,SEND PRIVATE MESSAGE,/post/Square-Vs-Roku-mMRKXE4W,Roku
4,Apr 12,What’s the objective behind hiring H1B and putting them through PIP? How is this benefiting the managers?,1,Ch3,/company/Ivalua/,Eng,/post/Square-Vs-Roku-mMRKXE4W,Roku
5,Apr 21,Meeting scheduled on national holidays? Is it legal,0,asishsi,/company/Google/,SEND PRIVATE MESSAGE,/post/Square-Vs-Roku-mMRKXE4W,Roku
6,Mar 16,"You mentioned 280k base on another post, what a guy",3,aajdDjdk,/company/Roku/,SEND PRIVATE MESSAGE,/post/Square-Vs-Roku-mMRKXE4W,Roku
7,Mar 16,What a gal then.. sorry about the confusion but that does not answer my question.,0,aajdDjdk,/company/Roku/,SEND PRIVATE MESSAGE,/post/Square-Vs-Roku-mMRKXE4W,Roku
8,Mar 16,Sorry edited,0,pi.l,/company/Snap/,SEND PRIVATE MESSAGE,/post/Square-Vs-Roku-mMRKXE4W,Roku
9,Apr 27,Compensation i will let you do the math ...Rest WLB and stability are big turn down at Roku ...,3,Hulk-Lite,/company/Roku/,SEND PRIVATE MESSAGE,/post/Square-Vs-Roku-mMRKXE4W,Roku
10,Apr 27,Omg! Such a crap company. I hope you and your parents are doing good.,0,chXQ76,/company/Cadence-Design-Systems/,SEND PRIVATE MESSAGE,/post/Square-Vs-Roku-mMRKXE4W,Roku
11,May 6,Roku is low politics environment.  And nobody fired without a reason. People do get fired but extremely rare,0,nʞoɹ,/company/Roku/,SEND PRIVATE MESSAGE,/post/Square-Vs-Roku-mMRKXE4W,Roku
12,Mar 16,Wow... Roku pays $380k base for Sr SWE?,1,ufudjrvv,/company/eBay/,SEND PRIVATE MESSAGE,/post/Square-Vs-Roku-mMRKXE4W,Roku
13,Mar 17,Didn’t know they have tc structure similar to Netflix. Is the firing culture same as Netflix as well?,2,ufudjrvv,/company/eBay/,SEND PRIVATE MESSAGE,/post/Square-Vs-Roku-mMRKXE4W,Roku
14,Apr 11,Square is good.,0,rnsse,/company/Renesas-Electronics/,SEND PRIVATE MESSAGE,/post/Square-Vs-Roku-mMRKXE4W,Roku
0,May 8,"Roku is terrible place to work. The managers have high egos and they don't care a hoot, it's a hire and fire culture.",5,lodwvxjj,/company/Amazon/,SEND PRIVATE MESSAGE,/post/Roku-compared-to-Netflix-HLGaytnx,Roku
1,May 15,Janitor?,0,mmccss,/company/Roku/,SEND PRIVATE MESSAGE,/post/Roku-compared-to-Netflix-HLGaytnx,Roku
2,May 15,Roku tv customer?,0,ZuckerMark,/company/Microsoft/,SEND PRIVATE MESSAGE,/post/Roku-compared-to-Netflix-HLGaytnx,Roku
3,May 7,Netflix is not Google.,5,rchik,/company/Amazon/,SEND PRIVATE MESSAGE,/post/Roku-compared-to-Netflix-HLGaytnx,Roku
4,May 11,Yeah the day that we have as much red tape as Google I am out of here,9,gQaF50,/company/Netflix/,SEND PRIVATE MESSAGE,/post/Roku-compared-to-Netflix-HLGaytnx,Roku
5,May 8,I actually wonder how Roku is still in biz. I’ve worked with some people at Roku and they’re so incompetent. I had other friends from diff company/function sharing the same feeling about diff group of people at Roku. And one of my ex colleagues who i know is full of bs started at Roku.It’s prob either of two. 1. They’re on their way down to fail unless they change how and who they work drastically 2. Somehow very few talented ppl there are carrying all the burden and cleaning up the mess.,4,lmfao123,/company/NBCUniversal/,SEND PRIVATE MESSAGE,/post/Roku-compared-to-Netflix-HLGaytnx,Roku
6,May 14,I’m not eng and I’m not a recruiter,0,malc ,/company/Roku/,SEND PRIVATE MESSAGE,/post/Roku-compared-to-Netflix-HLGaytnx,Roku
7,May 14,It’s weird that you think there’s only eng and recruiting that exists at a company.,0,malc ,/company/Roku/,SEND PRIVATE MESSAGE,/post/Roku-compared-to-Netflix-HLGaytnx,Roku
8,May 16,"current employee at Roku (but planning on leaving soon hopefully for Netflix where I have an onsite in 2 weeks)NO ROKU IS NOT A HIRE & FIRE/SINK or SWIM COMPANY ! By no mean ! (and that might be the issue) lodwvxjj is right (I know who are you talking for the director of product who got fired and who ended up getting back to Google his first name starts with A), but those are exceptions.Below is the truth about Roku :Roku doesnt have a culture (like Netflix for example) with no (real) memo defining it, no processes (no performance evaluation, no feedback of any sorts outside of your 1-1s, no promo/raises ...) or no/little events/club/perks etc.Therefore at Roku, more than anywhere else, your boss is ""the culture"" and YMMV on how you get treated since anyways there is no other performance evaluation process . That said, the expectations for employees here is VERY LOW, many of them are coasting/lifers while making tons of money thanks to roku stock 10x ing in 2 years and they are not even trying to pretend that they care.Let me set that straight : if Roku was a company that was incline to fire people, employees would get slaughtered left and right. (per my previous gig culture/expectations 35% of Roku employees should get fired (and I would include myself since Roku taught me to do the bare minimum) )Also for the same reasons mentioned above (your boss can do whatever he/she wants with you) it is very political too. So some terminations are on the arbitrary side, but overall you have my word that Roku is a secure place (just be a good soldier who say yes to people in which case you can work there 10 years and easily get away or even progress while working 35hours/week and make decent money)Pros/cons to work at Roku VS NetflixPros: -job security/I've heard Netflix firing-machine gun is for real !-low pace/low pressure (this being a pro depends on your ambition, but Roku typical employees enjoy that)-WLBCons:-Netflix comp is untouchable (though Roku starting TC is good too in a sense, but keep in mind that there are no raises at Roku, and stock is unlikely to 10x again)- Roku employees tend to be older/have families, they aren't passionate about their jobs anymore. Those people don't encourage innovation/disruption cuz that would mean more work for them. Working at Netflix is probably a lot more exciting/engaging.-Resume : Netflix is the top, Roku is mehhh-AHRAB - ALL HR ARE BASTARDS ! Everyone at Roku I spoke to hates HR.-Roku boss roulette make sure you spend time to grill your hiring manager during interviews to make sure its a match. You should even ask him/her behavioral questions IMO given how important he/she gonna be.",4,Sevran,/company/Roku/,SEND PRIVATE MESSAGE,/post/Roku-compared-to-Netflix-HLGaytnx,Roku
9,6d,"Christ this grammarUseful post, though.",0,UnknownUzr,nan,SEND PRIVATE MESSAGE,/post/Roku-compared-to-Netflix-HLGaytnx,Roku
10,May 11,"Interviewed for a role at Roku and found the culture to be sink or swim - someone in my interview actually told me “this isn’t google so if you want hand holding, go there”",3,QqpB53,/company/T-Mobile/,SEND PRIVATE MESSAGE,/post/Roku-compared-to-Netflix-HLGaytnx,Roku
11,May 16,Seems terrible,1,rtvb h,/company/Google/,SEND PRIVATE MESSAGE,/post/Roku-compared-to-Netflix-HLGaytnx,Roku
0,Apr 15,Read Twitter blind and you'd join roku,7,woot2,/company/Twitter/,Eng,/post/Twitter-Vs-Roku-mw7LqSb5,Roku
1,Apr 26,Agree. I wonder anyone will join if they can see our blind board.,1,h00pie,/company/Twitter/,SEND PRIVATE MESSAGE,/post/Twitter-Vs-Roku-mw7LqSb5,Roku
2,Apr 26,What’s everyone saying over there?,0,Corepunk,/company/PayPal/,Eng,/post/Twitter-Vs-Roku-mw7LqSb5,Roku
3,Apr 16,Do yourself a favor and don’t join Twitter.,5,ok cool,/company/Twitter/,SEND PRIVATE MESSAGE,/post/Twitter-Vs-Roku-mw7LqSb5,Roku
4,Apr 16,Reasons please!,0,Corepunk,/company/PayPal/,Eng,/post/Twitter-Vs-Roku-mw7LqSb5,Roku
5,Apr 16,"Fantastic engineers, the worst, most clueless leadership of any major tech co. Infra is pretty bad too.",7,ok cool,/company/Twitter/,SEND PRIVATE MESSAGE,/post/Twitter-Vs-Roku-mw7LqSb5,Roku
6,Apr 17,"Do not get fooled by high base, no espp and 401k . Culture is bad in apps team. Lots of firing. We asked many time in company meeting about espp, but leadership is deaf,   One of worst leadership team in Bay Area, Netflix base is high and they have 401k match and espp",7,olo2,/company/Roku/,SEND PRIVATE MESSAGE,/post/Twitter-Vs-Roku-mw7LqSb5,Roku
7,Apr 15,Go for Roku.,7,crueIla,/company/Roku/,SEND PRIVATE MESSAGE,/post/Twitter-Vs-Roku-mw7LqSb5,Roku
8,Apr 17,"Roku is the next google, smarted people on earth works at roku. Come join us 😉 (wink wink)",0,rokukor,/company/Roku/,SEND PRIVATE MESSAGE,/post/Twitter-Vs-Roku-mw7LqSb5,Roku
9,Apr 21,@ligcs I second that 😀,0,rokukor,/company/Roku/,SEND PRIVATE MESSAGE,/post/Twitter-Vs-Roku-mw7LqSb5,Roku
10,Apr 21,"😆 No, an engineer",1,edgypirate,/company/Roku/,SEND PRIVATE MESSAGE,/post/Twitter-Vs-Roku-mw7LqSb5,Roku
0,Apr 12,"Adobe. Best place I’ve ever worked at/for.Bennies, two 2-week shutdowns, ESPP, people, unlimited vacation, ESPP, and bonus.",1,Orangecrsh,/company/SAP/,SEND PRIVATE MESSAGE,/post/Roku-Vs-Adobe-Dw8WdHR1,Roku
1,Apr 18,You did everything right; just sit tight and best of luck.,0,Orangecrsh,/company/SAP/,SEND PRIVATE MESSAGE,/post/Roku-Vs-Adobe-Dw8WdHR1,Roku
2,Apr 18,Thank you sir or maam. I will let you know :),1,kiryu,/company/VMware/,SEND PRIVATE MESSAGE,/post/Roku-Vs-Adobe-Dw8WdHR1,Roku
3,Apr 11,Adobe.,1,farmerOP,/company/TuSimple/,Eng,/post/Roku-Vs-Adobe-Dw8WdHR1,Roku
4,Apr 11,"I’ve gotten 75k per year refresher every year I have been here, it’s a very common reward",0,jPNe68,/company/Adobe/,SEND PRIVATE MESSAGE,/post/Roku-Vs-Adobe-Dw8WdHR1,Roku
5,Apr 11,You might be a top performer or it’s very specific to your org or your role?,0,moksha27,/company/eBay/,Eng,/post/Roku-Vs-Adobe-Dw8WdHR1,Roku
6,Apr 11,"Senior SWE, maybe top performer maybe not",0,jPNe68,/company/Adobe/,SEND PRIVATE MESSAGE,/post/Roku-Vs-Adobe-Dw8WdHR1,Roku
7,Apr 11,Make it a poll,0,matoo,/company/Galileo-Financial-Technologies/,SEND PRIVATE MESSAGE,/post/Roku-Vs-Adobe-Dw8WdHR1,Roku
0,Apr 21,TC?,5,jump_ship,/company/Walmart/,SEND PRIVATE MESSAGE,/post/Roku-culture-1yPBZ0Bj,Roku
1,Apr 22,This is the most important question,1,Gotham!,/company/Roku/,SEND PRIVATE MESSAGE,/post/Roku-culture-1yPBZ0Bj,Roku
2,Apr 23,"Why? Read Roku reviews. Not a great culture - constant threat of firing, poor leadership that claims to celebrate failure but then fires if a project gets delayed, and no comp adjustments till you die. They own your ass after they have paid for you once.",2,uhtdxh,/company/Roku/,SEND PRIVATE MESSAGE,/post/Roku-culture-1yPBZ0Bj,Roku
3,Apr 23,The reviews are mixed. How long you working there? Are you in SWE/ML?,0,kv79,/company/Amazon/,SEND PRIVATE MESSAGE,/post/Roku-culture-1yPBZ0Bj,Roku
4,May 9,"Horrible culture, do not join, no pay hike and high health insurance cost,  meeting during holiday",1,lollipopc,/company/Roku/,SEND PRIVATE MESSAGE,/post/Roku-culture-1yPBZ0Bj,Roku
5,Apr 23,Why asked about culture? Most comments about roku culture are super negative here. Maybe its at least better than Amazon’s culture?,1,guahs,/company/Google/,SEND PRIVATE MESSAGE,/post/Roku-culture-1yPBZ0Bj,Roku
0,Apr 3,"Not worth joining roku,   Once you join you will never see any hike, leadership team is very stingy. Hire and fire culture, my manager only hire only Indian and scar us with firing news with every month with other team.",1,coolmool,/company/Roku/,SEND PRIVATE MESSAGE,/post/Stay-at-Walmart-vs-Roku-KYh1vmxq,Roku
1,Apr 10,"There will always be the “good” and “not so good” for every company... However, we can’t generalize certain bad experience as an entire company culture/way of working.",1,monk1234,/company/Walmart/,Eng,/post/Stay-at-Walmart-vs-Roku-KYh1vmxq,Roku
2,Apr 10,"I had an opportunity to talk openly with a friend who happened to be in same team. Fortunately, he has positive  reviews for my team. I am not sure about overall culture at Roku but I am going to go with team specific reviews this time. :)",4,spacexx,/company/Walmart/,IT,/post/Stay-at-Walmart-vs-Roku-KYh1vmxq,Roku
3,Apr 2,If you are already in your warm up time then keep looking for better. It seems you are x5 and if you are in SV then that 300K is too low.If you don’t want to hunt more then Roku package is worth switching if compared with where WMT will be heading further.,2,AFamilyMan,/company/Walmart/,SEND PRIVATE MESSAGE,/post/Stay-at-Walmart-vs-Roku-KYh1vmxq,Roku
4,Apr 2,"I just got promoted to X5, hence 300k. I read not so good things about Roku. But still want to give it a try considering my own personal growth which is quite stagnant in Walmart as far as learnings are concerned.",1,spacexx,/company/Walmart/,IT,/post/Stay-at-Walmart-vs-Roku-KYh1vmxq,Roku
5,Apr 2,"Hmmm, that explains 300K. Your plan is on right track, best time to jump is after promotion and that number is fairly stagnant along with stagnant growth. Talk to your HM in Roku openly about what opportunities and roadmap looks like. You have nothing to loose. Any other tech stock has better upside potential and better vesting cycle than WMT stock.",2,AFamilyMan,/company/Walmart/,SEND PRIVATE MESSAGE,/post/Stay-at-Walmart-vs-Roku-KYh1vmxq,Roku
6,Apr 3,When’s the next WMT pay day?,1,Taxacct12,/company/EY/,SEND PRIVATE MESSAGE,/post/Stay-at-Walmart-vs-Roku-KYh1vmxq,Roku
7,Apr 2,290K base for 7 years experience! Wow! The base is too high to refuse.,1,ShieldTV,/company/NVIDIA/,SEND PRIVATE MESSAGE,/post/Stay-at-Walmart-vs-Roku-KYh1vmxq,Roku
8,Apr 2,What is x5? What do you do for Walmart for that kind of salary?,0,OAbo12,/company/AMD/,SEND PRIVATE MESSAGE,/post/Stay-at-Walmart-vs-Roku-KYh1vmxq,Roku
9,Apr 2,X5 is level. Walmart e-commerce,0,spacexx,/company/Walmart/,IT,/post/Stay-at-Walmart-vs-Roku-KYh1vmxq,Roku
0,Apr 27,Location?,1,YQdK55,/company/Twilio/,SEND PRIVATE MESSAGE,/post/Roku-offer-evaluation-xt7YUgJo,Roku
1,Apr 27,San jose,0,frutlover,/company/Virtusa/,SEND PRIVATE MESSAGE,/post/Roku-offer-evaluation-xt7YUgJo,Roku
2,Apr 27,Seems good. What’s the split for 310k?,0,v_ruud,/company/Qualcomm/,SEND PRIVATE MESSAGE,/post/Roku-offer-evaluation-xt7YUgJo,Roku
3,Apr 27,"85-15 or 80-20 in favor of base-equity, depends on my choice.",0,frutlover,/company/Virtusa/,SEND PRIVATE MESSAGE,/post/Roku-offer-evaluation-xt7YUgJo,Roku
0,Apr 15,Run away,3,Shahzada,/company/Microsoft/,Data,/post/Roku-virtual-onsite---Waiting-period-Tudr7beX,Roku
1,Apr 19,"@Gotham, I don't remember when anyone from msft was not offered 401K match, Espp, promotion, refreshers (not the box refreshers at Roku), and we don't fire anyone (rarely, might), but aren't these rampant at Roku ? Ummm, so I don't know what's your point.And you guys spend so much on insurance. Here at MSFT, insurance is peanuts, and so many more benefits from childcare to generous parental leaves.You people don't even get annual bonus. Roku doesn't even increase your base stating that the stock prices have increased. Duh!!And don't get me started on your horrible wlb and toxic management. I rejected Roku's offer this Jan, after I met the toxic manager and the team (TRC)And as mentioned in later comments, they even rescind offers if you negotiate (not always).Roku, no matter how well their stocks do, or how well their product is, is the Ultimate epitome of shit out there for employees.",2,Shahzada,/company/Microsoft/,Data,/post/Roku-virtual-onsite---Waiting-period-Tudr7beX,Roku
2,Apr 19,Btw. Roku stock drop like s* recently,0,pilkhv,/company/Google/,SEND PRIVATE MESSAGE,/post/Roku-virtual-onsite---Waiting-period-Tudr7beX,Roku
3,Apr 15,"I had a recruiter named Petra Pino work with me for 2 months for a position at Roku. She used to take atleast 2 weeks between two emails. Over phone calls she used to dilly dally, and eventually at the very last after 2 weeks of back/forth and they stuck to their initial offer of 300k (just to call her bluff), i accepted it, she got stumped over the call and said..Hiring team does not want to pursue any further because they didnt like me negotiating the numbers 😂I was not looking to join them anyways because i could tell after talking to the hiring mgr and the skip that both were clueless douchebags 😆",4,salesfurce,/company/Splunk/,SEND PRIVATE MESSAGE,/post/Roku-virtual-onsite---Waiting-period-Tudr7beX,Roku
4,Apr 15,"YeahI knew they would find some excuse because i had been negotiating with them for 2 weeks and they didnt move. And it gave me an idea that there is some other person that is quoting well below, these guys are just waiting for that person to sign the offer.To have fun, i accepted their offer as-is, after 2 weeks..and she had no clue how to handle the situation..just muttered the excuse and got away 😁",4,salesfurce,/company/Splunk/,SEND PRIVATE MESSAGE,/post/Roku-virtual-onsite---Waiting-period-Tudr7beX,Roku
5,Apr 16,Oh my .....,0,gffjp,/company/Google/,SEND PRIVATE MESSAGE,/post/Roku-virtual-onsite---Waiting-period-Tudr7beX,Roku
6,Apr 21,Hey op how was your interview? Was it lc kinda questions,0,crustypizz,/company/Visa/,SEND PRIVATE MESSAGE,/post/Roku-virtual-onsite---Waiting-period-Tudr7beX,Roku
7,Apr 21,Nope. I already did. Goodluck! There interview is easy/medium leetcode.,0,chXQ76,/company/Cadence-Design-Systems/,SEND PRIVATE MESSAGE,/post/Roku-virtual-onsite---Waiting-period-Tudr7beX,Roku
8,Apr 21,Just dmd you,0,crustypizz,/company/Visa/,SEND PRIVATE MESSAGE,/post/Roku-virtual-onsite---Waiting-period-Tudr7beX,Roku
9,Apr 15,Heard the offers are at/above market value. But not soo sure :),0,mowgmeg,nan,SEND PRIVATE MESSAGE,/post/Roku-virtual-onsite---Waiting-period-Tudr7beX,Roku
0,Mar 16,"The recruiter told me that they can match my $400K offer. It will be 10 % as a stock and the remaining as cash. I think this is pretty cool. However, I am a bit worried about work culture.Roku Engineer:Can you please share your thoughts? Is it firing happen like in Netflix?",0,chXQ76,/company/Cadence-Design-Systems/,SEND PRIVATE MESSAGE,/post/Salary-for-Sr-Software-Engineer-@Roku-kwDb5FAT,Roku
1,Apr 5,"That is a very good deal for Boston. Very interested to know if you get it on writing. I may ping my recuiter, ask for bay area and then see if I can stay here. What team if you don't mind me asking?",1,ipED28,/company/Amazon/,SEND PRIVATE MESSAGE,/post/Salary-for-Sr-Software-Engineer-@Roku-kwDb5FAT,Roku
2,Apr 5,Haha.. you will know after joining  it 😉,0,chXQ76,/company/Cadence-Design-Systems/,SEND PRIVATE MESSAGE,/post/Salary-for-Sr-Software-Engineer-@Roku-kwDb5FAT,Roku
3,Mar 16,I don't know anything about roku but how the hell is the Blind rating even worse than Amazon's 🤦‍♂️,3,jHeu73hx,/company/Amazon/,SEND PRIVATE MESSAGE,/post/Salary-for-Sr-Software-Engineer-@Roku-kwDb5FAT,Roku
4,Mar 24,So u should move a move to roku. Lol. At least better than amazon.  I heard roku pip every month,0,waihshd,/company/Google/,SEND PRIVATE MESSAGE,/post/Salary-for-Sr-Software-Engineer-@Roku-kwDb5FAT,Roku
5,Mar 23,The other post many ppl there said pip every month,0,gffghhvv,/company/Google/,SEND PRIVATE MESSAGE,/post/Salary-for-Sr-Software-Engineer-@Roku-kwDb5FAT,Roku
6,Mar 24,Once in a blue moon. If you do something crazy then you will get fired.,0,🍎 🍎 Apple ,/company/Roku/,SEND PRIVATE MESSAGE,/post/Salary-for-Sr-Software-Engineer-@Roku-kwDb5FAT,Roku
7,Mar 24,Sounds high turnover rate,0,gffghhvv,/company/Google/,SEND PRIVATE MESSAGE,/post/Salary-for-Sr-Software-Engineer-@Roku-kwDb5FAT,Roku
8,Mar 15,Yoe?,0,🍎 🍎 Apple ,/company/Roku/,SEND PRIVATE MESSAGE,/post/Salary-for-Sr-Software-Engineer-@Roku-kwDb5FAT,Roku
9,Mar 15,7 years,0,pi.l,/company/Snap/,SEND PRIVATE MESSAGE,/post/Salary-for-Sr-Software-Engineer-@Roku-kwDb5FAT,Roku
10,Mar 15,"Well they dont have bonus, refresher, 401k match and the stocks are low for sr engineer",0,pi.l,/company/Snap/,SEND PRIVATE MESSAGE,/post/Salary-for-Sr-Software-Engineer-@Roku-kwDb5FAT,Roku
11,Mar 15,They do have refresher though. It is 15% of your base I believe,0,monk1234,/company/Walmart/,Eng,/post/Salary-for-Sr-Software-Engineer-@Roku-kwDb5FAT,Roku
0,Mar 15,"I was part of a Roku acquisition in late 2019 and I’ve been here ever since. Having been through a number of acquisitions in my career, I can safely say this is one of the best I have been a part of. I work in engineering and myself and other leads were immediately flown to headquarters upon close of the deal to start the integration efforts. This was done in the open with extensive input and participation from members of the acquired company.  We quickly established an aggressive roadmap that would integrate the two stacks and have never looked back. A lot of effort went into preserving a positive culture and in stamping out any “us vs them” mindset or other toxic behaviors that can sometimes develop after an acquisition.To be clear, the pace is fast and the expectations are high, but compensation is excellent and the quality of people you get to work with is exceptional. I have consistently been given great opportunities to grow in my role here and have seen my peers offered similar opportunities regardless of whether they were from the acquired company or Roku native.If you enjoy working on hard problems with smart people, I highly recommend joining Roku.Hope this helps! Good luck with everything.",3,couliope,/company/Roku/,SEND PRIVATE MESSAGE,/post/Acquisition-by-Roku-cEN2xCBL,Roku
1,Mar 15,"Great experience to be acquired by Roku in Nov 2019! Generous comp and much care taken with the transition (e.g. they let things 'settle' after the acquisition to keep managers the same and understand fit before final reorgs).  Very welcoming culture and good communication throughout.  Most tools were integrated in a timely manner so we could collaborate quickly and feel part of the same company.  Although the bulk of this transition has been throughout the pandemic, Roku's done a tremendous job welcoming us and maintaining morale for all employees - old and new.",3,jHnh76,/company/Roku/,SEND PRIVATE MESSAGE,/post/Acquisition-by-Roku-cEN2xCBL,Roku
2,Mar 17,Part of 2019 acquisition. Great experience.  The comp offered was generous. They kept everything the same and took the time to understand how and why we were structured before making any changes.  Even when changes do happen non of them felt arbitrary the leadership team was very transparent re reason.  It was def not a “suck the knowledge dry and throw away the husk” type of acquisition. The pace is def faster but the work had been fulfilling.  Being acquired can be an anxious inducing experience but my personal journey with roku had been a positive one.,2,moo8911,/company/Roku/,SEND PRIVATE MESSAGE,/post/Acquisition-by-Roku-cEN2xCBL,Roku
3,Mar 2,"They pay penny,  pay structure  is horrible , only stock is good, but it is already high",1,Go go,/company/Roku/,SEND PRIVATE MESSAGE,/post/Acquisition-by-Roku-cEN2xCBL,Roku
4,Mar 4,Are you kidding me?,0,🍎 🍎 Apple ,/company/Roku/,SEND PRIVATE MESSAGE,/post/Acquisition-by-Roku-cEN2xCBL,Roku
5,Mar 13,Bull.  Comp is aggressively high.,0,ashburton,/company/Roku/,SEND PRIVATE MESSAGE,/post/Acquisition-by-Roku-cEN2xCBL,Roku
0,Mar 22,Someone called? 😀Sure thing with that stock rise. No questions. Not just sr mgr. even possible for some IC from few years back.,3,crueIla,/company/Roku/,SEND PRIVATE MESSAGE,/post/Roku-TC-khFoZchQ,Roku
1,Mar 22,Where's my gurl @cruela at.,2,trolledIn,/company/Facebook/,SEND PRIVATE MESSAGE,/post/Roku-TC-khFoZchQ,Roku
2,Mar 22,I think even if you join now you can prob still make 1mill plus tc/year if the Director level is equivalent to faang stocks,0,justme99,/company/Uber/,SEND PRIVATE MESSAGE,/post/Roku-TC-khFoZchQ,Roku
3,Mar 22,Maybe.,0,crueIla,/company/Roku/,SEND PRIVATE MESSAGE,/post/Roku-TC-khFoZchQ,Roku
0,May 5,"Before you leave okta, can you share the inclusion council’s word ban list with us?",1,satanclaus,nan,SEND PRIVATE MESSAGE,/post/Roku-onsite-interview-tips-yN3hFgmA,Roku
1,May 8,Wow. And why do u want to reject me?,1,drogokal,/company/Okta/,SEND PRIVATE MESSAGE,/post/Roku-onsite-interview-tips-yN3hFgmA,Roku
2,May 9,Modi this ain't Twitter! You should spread your saffron fueled garbage there!And how about you learn some English while you are at it. Hope you are the only bad apple at Roku.,0,tldr9120,/company/VMware/,SEND PRIVATE MESSAGE,/post/Roku-onsite-interview-tips-yN3hFgmA,Roku
0,Mar 9,"If I do not know in person , I will not refer you.",0,ekta2,/company/Roku/,SEND PRIVATE MESSAGE,/post/Roku-reference-khXisZEi,Roku
0,Mar 17,Yoe ?,0,pleasantov,/company/Veeva/,Eng,/post/Roku-offer-review-ie2fdyGU,Roku
1,Mar 17,5 yoe current tc 145,0,eBzO36,/company/Rakuten/,SEND PRIVATE MESSAGE,/post/Roku-offer-review-ie2fdyGU,Roku
2,Mar 23,That's low if you look it up on levels.fyi,0,gCvQ31,/company/Amazon/,SEND PRIVATE MESSAGE,/post/Roku-offer-review-ie2fdyGU,Roku
0,Mar 14,I like them. R u transferring internally?,0,crueIla,/company/Roku/,SEND PRIVATE MESSAGE,/post/Roku-Cloud-Team-xxKOuEdY,Roku
0,Apr 23,"Being in San Jose is perk lol, less needle and feces and gang crime",2,devfin1,/company/CME-Group/,SEND PRIVATE MESSAGE,/post/Roku-San-Jose-what-are-the-perks-O7YT3HYi,Roku
1,Apr 24,Comment by someone who has never worked the City or San Jose.,0,puff puff,/company/Google/,SEND PRIVATE MESSAGE,/post/Roku-San-Jose-what-are-the-perks-O7YT3HYi,Roku
