,comment_date,comment_text,comment_like,comment_user,comment_firm,comment_position,comment_url,company
2,"Sep 4, 2019",Quite the pump😂,0,limeman,/company/Adobe/,SEND PRIVATE MESSAGE,/post/Thank-You-Roku-Employees-PyXU7XY2,Roku
3,"Sep 4, 2019",Ha ha..you know Apple TV is gonna launch on Roku. Tim Apple must have thought of something right?,0,Kkddyaj,/company/PayPal/,SEND PRIVATE MESSAGE,/post/Thank-You-Roku-Employees-PyXU7XY2,Roku
4,"Sep 5, 2019",My Rokus crash all the fucking time,0,1101110011,/company/Microsoft/,SEND PRIVATE MESSAGE,/post/Thank-You-Roku-Employees-PyXU7XY2,Roku
5,"Sep 4, 2019",I love Roku both my device and the stocks!Btw Roku employees can’t see this as they are not on tech Lounge!,0,Kkddyaj,/company/PayPal/,SEND PRIVATE MESSAGE,/post/Thank-You-Roku-Employees-PyXU7XY2,Roku
6,"Sep 4, 2019",Just buy ROKU and hold for 3 months... its ok you can thank me later,0,1221,/company/Dell/,SEND PRIVATE MESSAGE,/post/Thank-You-Roku-Employees-PyXU7XY2,Roku
0,"Dec 3, 2020","No H1B, stocks done really really well recently and the product direction seems logical and well thought out from what I could gather",0,umvM76,nan,Ops,/post/Roku-TC-product-marketing-manager-v4APMKay,Roku
1,"Dec 3, 2020","Stock is already high, you missed your window.  Since U r not h1b you can try ur luck. But come onboard with with low expectations",0,ukorr,/company/Roku/,SEND PRIVATE MESSAGE,/post/Roku-TC-product-marketing-manager-v4APMKay,Roku
2,"Dec 3, 2020",Stay away from roku if you are h1b. Hire and fire culture. Rest you can read Glassdoor and blind company review.,0,ukorr,/company/Roku/,SEND PRIVATE MESSAGE,/post/Roku-TC-product-marketing-manager-v4APMKay,Roku
0,"Jul 21, 2017",Engineers can make a lot more than managers. And individual contributor life is much more relaxing than a stupid manager's life.,7,Nute!!a,/company/Facebook/,Eng,/post/Google-to-Roku---good-move-03CjB87o,Roku
1,"Jul 21, 2017","if you move it should be for a big bump on paper that the IPO may multiply. When they IPO you won't get to cash out until after the investors and the lockout period, so make the risk worth it (because little innovation from them as you say)",4,Trotwood,/company/Microsoft/,Eng,/post/Google-to-Roku---good-move-03CjB87o,Roku
2,"Jul 21, 2017",If you are asking maybe it's not,2,Shizhi,/company/Adobe/,Eng,/post/Google-to-Roku---good-move-03CjB87o,Roku
3,"Jul 21, 2017",Why are ppl obsessed with management track. I think similar comp on IC track is achievable,1,sqzW18,/company/Uber/,SEND PRIVATE MESSAGE,/post/Google-to-Roku---good-move-03CjB87o,Roku
4,"Jul 21, 2017","If you want to be a manager and this is the only chance then go. Otherwise, I don't think it is a good move. I also feel that Roku has nothing exciting to offer in terms of their products.",1,leavingms,/company/Microsoft/,SEND PRIVATE MESSAGE,/post/Google-to-Roku---good-move-03CjB87o,Roku
0,"Jun 6, 2020",I didn’t get why roku was rising in the first place. What does roku have that any major company doesn’t? Fire stick has the same thing. How will roku make money?,5,ptr->next;,/company/eBay/,SEND PRIVATE MESSAGE,/post/why-is-roku-stock-stagnating-qLAsJuUR,Roku
1,"Jun 6, 2020",Didn’t know Roku did that. That’s dope,0,6ixbuzz,/company/Amazon/,SEND PRIVATE MESSAGE,/post/why-is-roku-stock-stagnating-qLAsJuUR,Roku
2,"Jun 6, 2020",^we should file a tt with the fire tv team to add this feature. 😁,0,nimbupani,/company/Amazon/,SEND PRIVATE MESSAGE,/post/why-is-roku-stock-stagnating-qLAsJuUR,Roku
3,"Jun 6, 2020",There are good days and bad days. We will rise again!,3,YesSayNo,/company/Roku/,SEND PRIVATE MESSAGE,/post/why-is-roku-stock-stagnating-qLAsJuUR,Roku
4,"Jun 6, 2020","I never understood Roku's stock rise and business justification. They are going after 60B TV ads business but more than 90% of consumption on Roku is due to top tier apps like Netflix, YouTube, Amazon, Disney+. I highly suspect if roku gets revshare except placing remote buttons. Maintaining these services + cloud costs must be too high to justify the margins. Infact Roku must be begging to these app providers to place them on their platform.Rest of their apps are trash and probably focused on certain age population.I find it very hard to imagine that their so called free version of AVOD has so much viewership. Just look at their experience. It's so bad that I almost puked one day.See Tubi and Pluto experience instead. It's so nice and clean.They have some ads business (that they claim) but significantly lagging behind the likes of Facebook, Google and Amazon. I highly doubt if advertisers would like to consider Roku for their campaigns.If Roku announces streaming hrs split by non revenue making vs revenue making apps, I am certain stock will tank to $15 (IPO price).Roku has zero international presence despite of being in business for so long. This is exactly where they are going to fail because they don't understand international market.Fitbit failed similarly. They operated on their own and Apple scooped up the entire wearables market.Tivo had good days but stock crashed by 90%. Roku has same destiny as TiVo.Once a great investor said ""If your food taste like others, it's time to shut down the restaurant"".Disclaimer : I have a Roku device but I use it only for Netflix and Prime.",2,gusi,/company/Google/,SEND PRIVATE MESSAGE,/post/why-is-roku-stock-stagnating-qLAsJuUR,Roku
5,"Jun 6, 2020",Go ahead and buy an Android TV. Let me know the experience in a few months. I bet you will want to throw away your TV.,0,YesSayNo,/company/Roku/,SEND PRIVATE MESSAGE,/post/why-is-roku-stock-stagnating-qLAsJuUR,Roku
6,"Jun 6, 2020","Have been using both Android TV and Roku for quite some time . Never had a feeling to throw Android TV.  My usage is different. It's only Netflix and Prime. I don't care if it's Roku, FireTV or Android TV",0,gusi,/company/Google/,SEND PRIVATE MESSAGE,/post/why-is-roku-stock-stagnating-qLAsJuUR,Roku
7,"Jun 6, 2020",Hopefully Android TV doesn’t kill Roku like Apple killed Fitbit.,1,skhdue,/company/Netflix/,SEND PRIVATE MESSAGE,/post/why-is-roku-stock-stagnating-qLAsJuUR,Roku
8,"Jun 6, 2020",Good point. Google is not sitting idle ;),0,Fvzj24,/company/Google/,SEND PRIVATE MESSAGE,/post/why-is-roku-stock-stagnating-qLAsJuUR,Roku
9,"Jun 6, 2020",Because sozen’s comet is right around the corner,1,turrf,/company/Autodesk/,SEND PRIVATE MESSAGE,/post/why-is-roku-stock-stagnating-qLAsJuUR,Roku
0,"May 7, 2020",Looks like you are asking for free insider information before the earnings call,4,LGBO36,/company/Microsoft/,SEND PRIVATE MESSAGE,/post/How-is-Roku-doing-financially-during-Covid-Ctx0ZGfX,Roku
1,"May 7, 2020",Probably very well duh,2,HQSY67,/company/Hulu/,SEND PRIVATE MESSAGE,/post/How-is-Roku-doing-financially-during-Covid-Ctx0ZGfX,Roku
2,"May 7, 2020",Wait for earnings call today,1,_mojojojo_,/company/Salesforce/,SEND PRIVATE MESSAGE,/post/How-is-Roku-doing-financially-during-Covid-Ctx0ZGfX,Roku
3,"May 8, 2020",Doing well. We released quarterly results yesterday. Ads space is shaken up a bit but overall cord cutting is accelerating rapidly benefitting Roku big time.,0,tikto,/company/Roku/,SEND PRIVATE MESSAGE,/post/How-is-Roku-doing-financially-during-Covid-Ctx0ZGfX,Roku
0,"Mar 30, 2020",Msg me?,0,Vodka?,nan,SEND PRIVATE MESSAGE,/post/Embedded-engineer-interview-at-roku-6ch8tsVD,Roku
1,"Jun 4, 2020",Did you give the interview?,0,Alpha_7,nan,SEND PRIVATE MESSAGE,/post/Embedded-engineer-interview-at-roku-6ch8tsVD,Roku
0,"May 10, 2017","Just curious ,Why would you leave fb for Roku?",0,JzuW42,/company/Intel/,SEND PRIVATE MESSAGE,/post/Roku-interview-for-QA-2UO7H2SH,Roku
1,"May 10, 2017",my guess is the OP is a contractor,1,QQov40,/company/Facebook/,SEND PRIVATE MESSAGE,/post/Roku-interview-for-QA-2UO7H2SH,Roku
2,"May 11, 2017",Roku is effing dysfunctional. Avoid!,0,opoF82,/company/Hulu/,SEND PRIVATE MESSAGE,/post/Roku-interview-for-QA-2UO7H2SH,Roku
3,"May 11, 2017",Care to explain why you think Roku is dysfunctional? I am considering interviewing with them.,0,iamout,/company/Salesforce/,SEND PRIVATE MESSAGE,/post/Roku-interview-for-QA-2UO7H2SH,Roku
4,"May 11, 2017","Worked with those folks on a partner program. Bad PMs, eng team is meh and don't care about code quality",0,opoF82,/company/Hulu/,SEND PRIVATE MESSAGE,/post/Roku-interview-for-QA-2UO7H2SH,Roku
5,"May 12, 2017","Ok, thanks!",0,iamout,/company/Salesforce/,SEND PRIVATE MESSAGE,/post/Roku-interview-for-QA-2UO7H2SH,Roku
0,"Dec 20, 2019",You should be able to get 250-350k,2,Cruella!,/company/Roku/,SEND PRIVATE MESSAGE,/post/Roku-SDET-role-jdLcjL84,Roku
1,"Dec 23, 2019",Roku is quite similar to Netflix.  Everyone is senior software Engineer,0,nʞoɹ,/company/Roku/,SEND PRIVATE MESSAGE,/post/Roku-SDET-role-jdLcjL84,Roku
2,"Dec 23, 2019",Thanks!,0,EmNa72,/company/Netflix/,SEND PRIVATE MESSAGE,/post/Roku-SDET-role-jdLcjL84,Roku
3,"Dec 20, 2019",Are you sdet at N?,1,fps_doug,/company/US%20Navy/,Eng,/post/Roku-SDET-role-jdLcjL84,Roku
4,"Dec 20, 2019",Yes.,0,EmNa72,/company/Netflix/,SEND PRIVATE MESSAGE,/post/Roku-SDET-role-jdLcjL84,Roku
5,"Dec 20, 2019",Yoe?,1,Cruella!,/company/Roku/,SEND PRIVATE MESSAGE,/post/Roku-SDET-role-jdLcjL84,Roku
6,"Dec 20, 2019",14 years,0,EmNa72,/company/Netflix/,SEND PRIVATE MESSAGE,/post/Roku-SDET-role-jdLcjL84,Roku
7,"Dec 20, 2019",260 is less for Netflix,0,bajuka,/company/Proofpoint/,SEND PRIVATE MESSAGE,/post/Roku-SDET-role-jdLcjL84,Roku
0,"Jan 2, 2020",I had a technical phone screen for an engineering position 3 days ago. How fast are they in updating the results? I am yet to receive any updates from them,0,Tech165,/company/PwC/,SEND PRIVATE MESSAGE,/post/Roku-Senior-Analyst-Corporate-Analytics-Interview-MEHSCZt8,Roku
1,"Jan 4, 2020",I heard back within 3-4 business days for both my phone interviews,0,nandinin,nan,Data,/post/Roku-Senior-Analyst-Corporate-Analytics-Interview-MEHSCZt8,Roku
2,"Dec 26, 2019",Scanbuy. 130K,0,dat337,nan,Data,/post/Roku-Senior-Analyst-Corporate-Analytics-Interview-MEHSCZt8,Roku
3,"Dec 27, 2019",More than that for sure.,0,charmeIeon,/company/Roku/,SEND PRIVATE MESSAGE,/post/Roku-Senior-Analyst-Corporate-Analytics-Interview-MEHSCZt8,Roku
4,"Jun 2, 2020",What was the sql interview like? The topics covered?,0,GIdh86,/company/Hulu/,SEND PRIVATE MESSAGE,/post/Roku-Senior-Analyst-Corporate-Analytics-Interview-MEHSCZt8,Roku
5,"Dec 27, 2019",How are the interviews?,0,dat337,nan,Data,/post/Roku-Senior-Analyst-Corporate-Analytics-Interview-MEHSCZt8,Roku
6,"Dec 26, 2019",Current company and TC?,0,Cruella!,/company/Roku/,SEND PRIVATE MESSAGE,/post/Roku-Senior-Analyst-Corporate-Analytics-Interview-MEHSCZt8,Roku
0,"Jun 2, 2019",A friend rejected 260k base and 60k RSU per year from Roku; He had 5 years exp. He was at FAANG,3,Yolo!,/company/Amazon/,Eng,/post/How-much-does-roku-pay-for-senior-engineer-yyV6yoip,Roku
1,"Jun 2, 2019",That’s decent but you could get more i. Heard Roku pays competitive to FANG,0,Random¥€,/company/Cisco/,SEND PRIVATE MESSAGE,/post/How-much-does-roku-pay-for-senior-engineer-yyV6yoip,Roku
2,"Jun 16, 2019","Roku pay is about 15-20% less than Netflix. Roku doesn’t pay 450k. The base salary range is 250k-350k at the company for a Senior Software Engineer. Roku WON’T pay 100k/year in RSU. See posts from others, the TC offers for external hires have been 300-340k. I’m yet to see FANG people go to Roku on Blind or through social circles, that might be an interesting metric I don’t have. ~350k is not much for Senior Engineer Standards at FANG. Also, no 401K match sucks, Didn’t know there was a day I could say even Amazon does better than Roku with 401K",0,Yolo!,/company/Amazon/,Eng,/post/How-much-does-roku-pay-for-senior-engineer-yyV6yoip,Roku
3,"Jun 16, 2019",What’s your pay and TC split at Roku?,0,Yolo!,/company/Amazon/,Eng,/post/How-much-does-roku-pay-for-senior-engineer-yyV6yoip,Roku
4,"Jun 2, 2019",Are you a software engineer? How many years of exp? Super low if you have 3+ years of exp as an SDE,2,Yolo!,/company/Amazon/,Eng,/post/How-much-does-roku-pay-for-senior-engineer-yyV6yoip,Roku
5,"Jun 2, 2019",Ok just checking currently make 130 k at my current place,0,technical,/company/Synopsys/,SEND PRIVATE MESSAGE,/post/How-much-does-roku-pay-for-senior-engineer-yyV6yoip,Roku
6,"Jun 2, 2019",Are you an SDE or not?,0,Yolo!,/company/Amazon/,Eng,/post/How-much-does-roku-pay-for-senior-engineer-yyV6yoip,Roku
7,"Jun 2, 2019",7 years but in Eda not in internet firm,2,technical,/company/Synopsys/,SEND PRIVATE MESSAGE,/post/How-much-does-roku-pay-for-senior-engineer-yyV6yoip,Roku
8,"Jun 2, 2019",Yes I am just want to know if it’s relative to current pay or what is the # I should ask ?,1,technical,/company/Synopsys/,SEND PRIVATE MESSAGE,/post/How-much-does-roku-pay-for-senior-engineer-yyV6yoip,Roku
9,"Jun 2, 2019","Super low, so do yourself a favor and interview elsewhere. You could get that as SDE1 at Facebook. Even Amazon top of range for SDE1 is close to 180k. You should accept no less than 250k; if you came from FAANG they would easily start at 300+",0,Yolo!,/company/Amazon/,Eng,/post/How-much-does-roku-pay-for-senior-engineer-yyV6yoip,Roku
0,"Jul 5, 2020",The sublease with Netflix is over so we have to move. And it’s small for 1500+ people anyway. New campus is in SJ near Avaya stadium. Here is the pic 😁,6,ukor,/company/Roku/,SEND PRIVATE MESSAGE,/post/what-happened-to-the-Roku-Los-Gatos-office-BfqbT62r,Roku
1,"Jul 5, 2020",Looks fancy,0,tesla_3,/company/Google/,SEND PRIVATE MESSAGE,/post/what-happened-to-the-Roku-Los-Gatos-office-BfqbT62r,Roku
2,"Jul 5, 2020",New office is very fancy and nice. Miss being in LG however.,4,.jsx,/company/Roku/,SEND PRIVATE MESSAGE,/post/what-happened-to-the-Roku-Los-Gatos-office-BfqbT62r,Roku
3,"Jul 6, 2020","1) We outgrew existing space in LG. The new place provides ample room for growth (up to 5000 people). There is no way we could have squeezed that much in LG.2) Our existing sublease with Netflix was coming to an end. Netflix is also growing and wanted to re-occupy LG buildings.It is a new and fancy building. Although given the recent WFH situation, I wonder how much time will it take us to fill that space.",2,nʞoɹ,/company/Roku/,SEND PRIVATE MESSAGE,/post/what-happened-to-the-Roku-Los-Gatos-office-BfqbT62r,Roku
4,"Jul 5, 2020",They’re by sj airport now,0,purewater,/company/LinkedIn/,SEND PRIVATE MESSAGE,/post/what-happened-to-the-Roku-Los-Gatos-office-BfqbT62r,Roku
5,"Jul 5, 2020",No idea but the new campus is brand new so maybe they wanted something shiny?,0,purewater,/company/LinkedIn/,SEND PRIVATE MESSAGE,/post/what-happened-to-the-Roku-Los-Gatos-office-BfqbT62r,Roku
6,"Jul 5, 2020",Los Gatos office was too small for us.,0,$$🤑$$,/company/Roku/,Eng,/post/what-happened-to-the-Roku-Los-Gatos-office-BfqbT62r,Roku
7,"Jul 5, 2020",I bet the new office is way more expensive,0,$$🤑$$,/company/Roku/,Eng,/post/what-happened-to-the-Roku-Los-Gatos-office-BfqbT62r,Roku
0,"Oct 26, 2018","Did you end up joining roku ? hows the work? how was the comp - base, bonus and rsus ?",2,Pearman,/company/Oracle/,SEND PRIVATE MESSAGE,/post/Is-director-at-Roku-pretty-senior-7vK0BSyL,Roku
1,"May 26, 2018","A director at FANG is like being a chief exec of your own little company. You run the show, but you are responsible for the damage/loss of the product doesn't work/run.Director at medium size companies can also have good autonomy, but there can be cases of micromanagement from C suite level. There may be shared sense of responsibility there.",2,backend,/company/Proofpoint/,Eng,/post/Is-director-at-Roku-pretty-senior-7vK0BSyL,Roku
2,"May 30, 2018",How long ago was this? I map this every morning and it’s like one hour?,0,Poooper,/company/Facebook/,SEND PRIVATE MESSAGE,/post/Is-director-at-Roku-pretty-senior-7vK0BSyL,Roku
3,"May 30, 2018",What route did you take?,0,Poooper,/company/Facebook/,SEND PRIVATE MESSAGE,/post/Is-director-at-Roku-pretty-senior-7vK0BSyL,Roku
0,"Sep 4, 2018","Remember kids, Blind is the best place to take investment advice from.",16,B.arf,/company/Booking.com/,SEND PRIVATE MESSAGE,/post/ROKU-Stock-Buy-Buy-Buy-FC4hnxkN,Roku
1,"Sep 4, 2018",No Reddit? Noob!!,0,iz moss 🐝,/company/AT&T/,SEND PRIVATE MESSAGE,/post/ROKU-Stock-Buy-Buy-Buy-FC4hnxkN,Roku
2,"Sep 4, 2018",iz Moss I got your reference. Kudos,0,@roku,/company/Roku/,SEND PRIVATE MESSAGE,/post/ROKU-Stock-Buy-Buy-Buy-FC4hnxkN,Roku
3,"Sep 4, 2018","Bought in May, when it was 31.57... and still holding them...",1,👀RUseless,/company/eBay/,Eng,/post/ROKU-Stock-Buy-Buy-Buy-FC4hnxkN,Roku
4,"Sep 4, 2018","Awesome!!! Genius!!! You are the Mr. Wizard of investments!!! What’s your target, what are the upcoming drivers in your opinion??",0,Painkiller,nan,Eng,/post/ROKU-Stock-Buy-Buy-Buy-FC4hnxkN,Roku
5,"Aug 10, 2019",Just hit this post.. hats off to you op your year before prediction is true with stock sitting at 125+,1,Truthtable,/company/Amazon/,IT,/post/ROKU-Stock-Buy-Buy-Buy-FC4hnxkN,Roku
6,"Sep 4, 2018",Sell sell sell.,1,Wannabe!,/company/VMware/,SEND PRIVATE MESSAGE,/post/ROKU-Stock-Buy-Buy-Buy-FC4hnxkN,Roku
7,"Sep 5, 2018",Are the rumors true then ?,0,IUQJ80,/company/Roku/,SEND PRIVATE MESSAGE,/post/ROKU-Stock-Buy-Buy-Buy-FC4hnxkN,Roku
8,"Sep 6, 2018","Yes, what rumors and what's the source",0,CsPw57,/company/Roku/,SEND PRIVATE MESSAGE,/post/ROKU-Stock-Buy-Buy-Buy-FC4hnxkN,Roku
9,"Sep 7, 2018",I think he’s just trolling.,0,@roku,/company/Roku/,SEND PRIVATE MESSAGE,/post/ROKU-Stock-Buy-Buy-Buy-FC4hnxkN,Roku
0,"Aug 8, 2019",Yes if you perform well in the interview.,0,dwenig,/company/eBay/,Eng,/post/Roku-for-AI-roles-sqwuP08L,Roku
1,"Aug 1, 2019","Lol, not a chance.",0,Northman,/company/Amazon/,SEND PRIVATE MESSAGE,/post/Roku-for-AI-roles-sqwuP08L,Roku
0,"Jan 19, 2020","280k+, no bonuses, no ESPP, refresher as needed to keep your TC up",3,Rkuo,/company/Roku/,Eng,/post/What-TC-Roku-normally-offers-to-a-Senior-Software-Engineer-KVCeMX6L,Roku
1,"Jan 19, 2020",This,0,charmeIeon,/company/Roku/,SEND PRIVATE MESSAGE,/post/What-TC-Roku-normally-offers-to-a-Senior-Software-Engineer-KVCeMX6L,Roku
2,"Jan 19, 2020",How is career growth at Roku?,0,ctheta,nan,SEND PRIVATE MESSAGE,/post/What-TC-Roku-normally-offers-to-a-Senior-Software-Engineer-KVCeMX6L,Roku
3,"Jan 19, 2020","Senior is a very wide band at roku,  kind of like Netflix.  You get paid at top of your market worth",0,nʞoɹ,/company/Roku/,SEND PRIVATE MESSAGE,/post/What-TC-Roku-normally-offers-to-a-Senior-Software-Engineer-KVCeMX6L,Roku
4,"Feb 2, 2020","Nope, two friends got offers 2x their roku TCs and left. So no, roku does not pay top of market.",1,DRfN64,/company/Roku/,SEND PRIVATE MESSAGE,/post/What-TC-Roku-normally-offers-to-a-Senior-Software-Engineer-KVCeMX6L,Roku
5,"Jul 23, 2020",How’s the TC at roku ??,0,kela-le-lo,/company/Oracle/,SEND PRIVATE MESSAGE,/post/What-TC-Roku-normally-offers-to-a-Senior-Software-Engineer-KVCeMX6L,Roku
6,"Feb 1, 2020",I got 270k TC in mid January. OP: did u get offer? Which team did you interview for ?,1,आवारा,nan,SEND PRIVATE MESSAGE,/post/What-TC-Roku-normally-offers-to-a-Senior-Software-Engineer-KVCeMX6L,Roku
7,"Feb 1, 2020",Yoe?,0,Roku-250,/company/Roku/,SEND PRIVATE MESSAGE,/post/What-TC-Roku-normally-offers-to-a-Senior-Software-Engineer-KVCeMX6L,Roku
8,"Jan 19, 2020",20%,0,liwq67,/company/Roku/,SEND PRIVATE MESSAGE,/post/What-TC-Roku-normally-offers-to-a-Senior-Software-Engineer-KVCeMX6L,Roku
9,"Jan 19, 2020",What’s 20%,0,ctheta,nan,SEND PRIVATE MESSAGE,/post/What-TC-Roku-normally-offers-to-a-Senior-Software-Engineer-KVCeMX6L,Roku
10,"Jan 20, 2020",Annual refresh grant and initial grant at that level,0,liwq67,/company/Roku/,SEND PRIVATE MESSAGE,/post/What-TC-Roku-normally-offers-to-a-Senior-Software-Engineer-KVCeMX6L,Roku
11,"Jan 22, 2020",Max that i have seen HR approve was 350k tc for senior swe. And that was for exceptional hire on a specific team. People getting 210-250 get amortized 376ish w stock appreciation thus far.,0,DRfN64,/company/Roku/,SEND PRIVATE MESSAGE,/post/What-TC-Roku-normally-offers-to-a-Senior-Software-Engineer-KVCeMX6L,Roku
12,"Jan 23, 2020",Do you mean 350k base?,0,nʞoɹ,/company/Roku/,SEND PRIVATE MESSAGE,/post/What-TC-Roku-normally-offers-to-a-Senior-Software-Engineer-KVCeMX6L,Roku
0,"Jul 10, 2019","Yes, no bonus and no 401k match",2,roku!,/company/Roku/,SEND PRIVATE MESSAGE,/post/Roku-TC-YoE-10-Software-development-EURDi8fg,Roku
1,"Jul 10, 2019",Expect TC around 300K,0,roku!,/company/Roku/,SEND PRIVATE MESSAGE,/post/Roku-TC-YoE-10-Software-development-EURDi8fg,Roku
2,"Jul 10, 2019",Yup. 300-320k,0,roku🚀,/company/Roku/,SEND PRIVATE MESSAGE,/post/Roku-TC-YoE-10-Software-development-EURDi8fg,Roku
0,"Nov 2, 2018",Any insights ?,0,Pearman,/company/Oracle/,SEND PRIVATE MESSAGE,/post/Anyone-from-Roku-here-kVoWps6M,Roku
0,"Feb 22, 2019",I got that 500% return 👀,2,Gus888,/company/Cruise/,SEND PRIVATE MESSAGE,/post/Roku-doubled-in-50-days-Dmc7ew6E,Roku
1,"Feb 22, 2019",Did u buy call options?,0,softwa,/company/Cisco/,Eng,/post/Roku-doubled-in-50-days-Dmc7ew6E,Roku
2,"Feb 25, 2019",Come join us if you are interested. We are growing fast and hiring like crazy. Let me know if you need any referrals,2,Mr.Scrooge,/company/Roku/,Eng,/post/Roku-doubled-in-50-days-Dmc7ew6E,Roku
3,"Feb 22, 2019",I accepted an offer around that time and this freaking H1b didn’t let me join them. My visa transfer was denied 😢Could have made double in stocks.,0,fjakahnn,/company/PayPal/,SEND PRIVATE MESSAGE,/post/Roku-doubled-in-50-days-Dmc7ew6E,Roku
4,"Feb 22, 2019",Why was it denied? What role? Could you provide more details please?,0,👩‍💼👠🎓,/company/Comscore/,Other,/post/Roku-doubled-in-50-days-Dmc7ew6E,Roku
5,"Feb 22, 2019",Speciality occupation and non cs background!,0,fjakahnn,/company/PayPal/,SEND PRIVATE MESSAGE,/post/Roku-doubled-in-50-days-Dmc7ew6E,Roku
6,"Feb 22, 2019","But I believe in their tech , one can go long on it.",0,🌟 1,nan,SEND PRIVATE MESSAGE,/post/Roku-doubled-in-50-days-Dmc7ew6E,Roku
7,"Feb 22, 2019","2k@45 , sold today 1k@64",0,🌟 1,nan,SEND PRIVATE MESSAGE,/post/Roku-doubled-in-50-days-Dmc7ew6E,Roku
0,"Jun 1, 2020",Thanks peeps,0,vMWG02,/company/Amazon/,SEND PRIVATE MESSAGE,/post/Roku---Contractors-to-Full-time-j6QneaPk,Roku
1,"May 31, 2020","I got converted from contractor to fulltime, its possible but need approvals. Best way to engage in conversation with manager",0,and gqx,/company/Roku/,SEND PRIVATE MESSAGE,/post/Roku---Contractors-to-Full-time-j6QneaPk,Roku
2,"May 29, 2020","When I was there in 2019, I never saw that happen.",0,TXjG73,nan,SEND PRIVATE MESSAGE,/post/Roku---Contractors-to-Full-time-j6QneaPk,Roku
3,"May 28, 2020",Can I get a referral to Roku?,0,tQtt23,/company/Visa/,SEND PRIVATE MESSAGE,/post/Roku---Contractors-to-Full-time-j6QneaPk,Roku
0,Mar 23,How do u know will be discussing an offer,0,gffghhvv,/company/Google/,SEND PRIVATE MESSAGE,/post/Roku-Senior-Machine-Learning-Engineer-compensation-dLccimGE,Roku
1,Mar 23,They wanted to schedule time to discuss.,0,7)@!?,/company/Amazon/,SEND PRIVATE MESSAGE,/post/Roku-Senior-Machine-Learning-Engineer-compensation-dLccimGE,Roku
2,Mar 23,Hmmm thats weird. Usually recruiter wont say in email that they wanna discuss about offer,0,gffghhvv,/company/Google/,SEND PRIVATE MESSAGE,/post/Roku-Senior-Machine-Learning-Engineer-compensation-dLccimGE,Roku
0,"Jan 29, 2020","Cruella was the queen of blind! Best responses ever! And then one day, she mysteriously disappeared.Per my sources, her ID got locked out.",1,Ticktock3,/company/Amazon/,SEND PRIVATE MESSAGE,/post/roku-cruella-where-are-you-PAcitNcQ,Roku
1,"Jan 29, 2020",+1,1,ghonada,/company/Microsoft/,Eng,/post/roku-cruella-where-are-you-PAcitNcQ,Roku
2,"Feb 9, 2020",I found her!!! 🥰,0,❤️ GSD,/company/Amazon/,SEND PRIVATE MESSAGE,/post/roku-cruella-where-are-you-PAcitNcQ,Roku
3,"Feb 9, 2020",Where?,0,Facebooooo,/company/Google/,Eng,/post/roku-cruella-where-are-you-PAcitNcQ,Roku
4,"Feb 11, 2020","had to change name, people keep reporting and getting her banned. visit blind enough and you will figure out her new account!",0,rainwater ,/company/Indeed/,SEND PRIVATE MESSAGE,/post/roku-cruella-where-are-you-PAcitNcQ,Roku
5,"Jan 29, 2020",What’s that,0,changed4u,/company/Juniper/,SEND PRIVATE MESSAGE,/post/roku-cruella-where-are-you-PAcitNcQ,Roku
0,"Mar 22, 2020","ROKU is a scam, and they haven’t made any money. They will the the poster child of this stock marker crash when looking back.Ask around how many folks use ROKU devices?",4,Luca_apple,/company/Apple/,SEND PRIVATE MESSAGE,/post/Will-Roku-layoff-people-during-this-stock-market-crash-YXonO3rF,Roku
1,"Mar 25, 2020",@luca if apple tv  was just to compliment apple ecosystem then why did apple made it available for roku and firetv users? Seems like it's you who is on koolaid.  Till now iTunes was the only streaming service that was not available for roku. Now roku is the only platform that has everything.,1,nʞoɹ,/company/Roku/,SEND PRIVATE MESSAGE,/post/Will-Roku-layoff-people-during-this-stock-market-crash-YXonO3rF,Roku
2,"Apr 14, 2020","Luca , go home , sleep well",0,ggusgvfjsj,/company/Broadcom/,SEND PRIVATE MESSAGE,/post/Will-Roku-layoff-people-during-this-stock-market-crash-YXonO3rF,Roku
3,"Mar 22, 2020",Why do you care about Roku ? Do you have an offer from us?,1,doko,/company/Roku/,SEND PRIVATE MESSAGE,/post/Will-Roku-layoff-people-during-this-stock-market-crash-YXonO3rF,Roku
4,"Mar 22, 2020",I’m not the one claiming to know about roku’s lay-off plans. You are. Who I am has no bearing on whether or not you’re qualified to actually be informed on this beyond emotions.,1,MySpace1,/company/Roku/,SEND PRIVATE MESSAGE,/post/Will-Roku-layoff-people-during-this-stock-market-crash-YXonO3rF,Roku
5,"Mar 22, 2020",👍🙏,0,mushimu,/company/Roku/,SEND PRIVATE MESSAGE,/post/Will-Roku-layoff-people-during-this-stock-market-crash-YXonO3rF,Roku
