,comment_date,comment_text,comment_like,comment_user,comment_firm,comment_position,comment_url,company
3,"Aug 2, 2020","May be. It's hard to say as the company is highly betting on the TV ads dollars. Last quarter has been very difficult for Ads market to keep things afloat.I don't think Roku makes money from streaming sticks due to high competition from Amazon and other players.If they can prove that ads are back then may be another 5-10% growth.I personally don't believe in Roku stock or growth story. I think they have a good business model but big guys like Netflix, Prime, YouTube, Disney+ are simply living on Roku for free without paying rent. My guess is streaming hrs will be very high but ads Dollar will never follow.",0,fjk21ki,/company/Google/,SEND PRIVATE MESSAGE,/post/ROKU-stock-pi0LDzda,Roku
4,"Aug 2, 2020",All the streaming services pay “rent” to Roku. Try to google why HBO Max is not available on Roku,0,123_Sales,/company/Oracle/,SEND PRIVATE MESSAGE,/post/ROKU-stock-pi0LDzda,Roku
5,"Aug 2, 2020","Based on news I am seeing Roku is now asking for a cut for every HBO max sign up. I don't think they make money from Amazon, Netflix, Disney+ services. If one of the big services is taken away from Roku then Roku is done. People will dump Roku and move to the next streaming device.HBO Max probably want to the same treatment as Netflix.My hypothesis is that Roku will expand but will fail to make money due to no revenue from top streaming apps.",0,fjk21ki,/company/Google/,SEND PRIVATE MESSAGE,/post/ROKU-stock-pi0LDzda,Roku
6,"Dec 29, 2020",The answer is almost always yes in the world of tech stonks,0,es94927,/company/Atlassian/,SEND PRIVATE MESSAGE,/post/ROKU-stock-pi0LDzda,Roku
7,"Aug 16, 2020","I think it will grow but there are too many players in the streaming market. Apple and Amazon already there and Google making significant investment in Android TV. I think Roku will somehow survive in the short term but long term prospects are hard to say.Also, overall Blind reviews on working environment at Roku seems quite bad. I have rarely seen employees being so negative about the company culture.When employees themselves are not happy, companies fail to innovative. Take recent failure and massive firing at Cisco as an example.I would personally stay away from Roku stock. Just put your money in Shopify, Twilio, Apple, Amazon. You will get guaranteed returns.",0,k1j1,/company/Google/,SEND PRIVATE MESSAGE,/post/ROKU-stock-pi0LDzda,Roku
0,"Oct 12, 2018",PHD? What is your role?,2,spidermann,/company/Ringcentral/,Eng,/post/Refresher-at-Roku-oh0uYBrR,Roku
1,"Oct 18, 2018",Hey @php535 let me know if you get any info on refreshers. I just accepted their offer and I was told the same.,0,rsmsj,/company/IBM/,SEND PRIVATE MESSAGE,/post/Refresher-at-Roku-oh0uYBrR,Roku
2,"Oct 18, 2018",Rsmsj- what do you mean “told the same”?,0,Jeknnskks,nan,SEND PRIVATE MESSAGE,/post/Refresher-at-Roku-oh0uYBrR,Roku
3,"Oct 18, 2018",I feel like you’re lumping the entire RSU into your TC,2,qwerty🎉🐦,/company/Microsoft/,Eng,/post/Refresher-at-Roku-oh0uYBrR,Roku
4,"Nov 9, 2018","BS. Even he included entire RSU, I doubt",0,pdduo,/company/Wish/,SEND PRIVATE MESSAGE,/post/Refresher-at-Roku-oh0uYBrR,Roku
5,"Oct 18, 2018",Wtf how is your TC so high with only 1 YOE,0,qwerty🎉🐦,/company/Microsoft/,Eng,/post/Refresher-at-Roku-oh0uYBrR,Roku
6,"Oct 15, 2018",What's the TC breakdown?,0,BeKind12,/company/IBM/,SEND PRIVATE MESSAGE,/post/Refresher-at-Roku-oh0uYBrR,Roku
0,May 2,What team ?,0,6x,/company/Workday/,Product,/post/Roku-Senior-PM-offer-eval-mLoGvksh,Roku
1,May 2,Can't share details over concerns of identification. Does it matter which team it is?,0,ImNotZucc,nan,Product,/post/Roku-Senior-PM-offer-eval-mLoGvksh,Roku
0,Jan 11,What the role and YOE? 200k seems low to me,1,Apple!,/company/Roku/,SEND PRIVATE MESSAGE,/post/Roku-Offer---RSUs-or-Base-salary-8OQ2jQib,Roku
1,Jan 12,Well I do not agree with other Roku employee here. You can be fired at any other company with the same probability. Depends on how you perform.,0,bandits,/company/Roku/,SEND PRIVATE MESSAGE,/post/Roku-Offer---RSUs-or-Base-salary-8OQ2jQib,Roku
2,Jan 12,"@bandits, Totally agree",0,sUMr06,/company/John-Deere-Financial/,SEND PRIVATE MESSAGE,/post/Roku-Offer---RSUs-or-Base-salary-8OQ2jQib,Roku
3,Jan 13,Refreshers are not guaranteed. Make good is nothing guaranteed. Two things to keep in mind.,1,liwq67,/company/Roku/,SEND PRIVATE MESSAGE,/post/Roku-Offer---RSUs-or-Base-salary-8OQ2jQib,Roku
4,Jan 11,I'd also go with max RSU. Your TC may very well drop after 4 years but why not just get another job at that point?,1,seacar,/company/Google/,Eng,/post/Roku-Offer---RSUs-or-Base-salary-8OQ2jQib,Roku
5,Jan 11,It sounds like they want you to choose max RSU because you get upside but no downside?,0,graphnet,/company/Lyft/,SEND PRIVATE MESSAGE,/post/Roku-Offer---RSUs-or-Base-salary-8OQ2jQib,Roku
6,Jan 11,... everything is at an ATH yet somehow keeps going up...,0,seacar,/company/Google/,Eng,/post/Roku-Offer---RSUs-or-Base-salary-8OQ2jQib,Roku
7,Jan 11,"@seacar, That is so true.",0,sUMr06,/company/John-Deere-Financial/,SEND PRIVATE MESSAGE,/post/Roku-Offer---RSUs-or-Base-salary-8OQ2jQib,Roku
8,Jan 12,Does eng at Roku have different levels ? I know on title everyone is engineer or sr engineer. Just wondering whether there are internal levels.,0,🎃dollar ,/company/LinkedIn/,SEND PRIVATE MESSAGE,/post/Roku-Offer---RSUs-or-Base-salary-8OQ2jQib,Roku
9,Jan 12,Only the HR may know that. This information is not shared with the employees.,0,bandits,/company/Roku/,SEND PRIVATE MESSAGE,/post/Roku-Offer---RSUs-or-Base-salary-8OQ2jQib,Roku
0,"May 14, 2017",120K,3,silic_tech,/company/Amazon/,SEND PRIVATE MESSAGE,/post/Roku-148o2So5,Roku
1,"May 14, 2017",So less.,0,Ldnrbsjd,/company/LinkedIn/,SEND PRIVATE MESSAGE,/post/Roku-148o2So5,Roku
2,"May 14, 2017",What's your current one ?,0,ofXn50,/company/Lyft/,SEND PRIVATE MESSAGE,/post/Roku-148o2So5,Roku
0,Feb 9,Next Gamestop. Redditers found a new target to pump a stock without strong fundamentals or dying business.,3,right now,/company/Google/,SEND PRIVATE MESSAGE,/post/What-happened-to-Roku-stock-jYPN3ifF,Roku
1,Feb 9,"@Apple how has your experience at Roku been? I'm sure the TC is great but I've heard odd things on Blind, hire and fire culture etc",0,d-ll-b,/company/Google/,SEND PRIVATE MESSAGE,/post/What-happened-to-Roku-stock-jYPN3ifF,Roku
2,Feb 9,"I see how you are bragging about your new product here which did not get any good media or reviews. Roku was named the best streamer for 2020. Improve your product and stop spying with your products. And STOP BRAGGING!Roku is growing and innovating and I am optimistic that search will improve in the future. Google had their Google voice assistant for years and has a lot of data. I guess you don’t want to be reminded of what your business is based off(hint: search) Roku started as a hardware company and has grown tremendously even after cutting edge competition with Amazon/Google/Apple. Now we are in ads business, etc.Don’t worry but Google won’t be able to disrupt anything with the new Chromecast. It is a SPY machine with nothing fancy.https://www.tomsguide.com/news/tcl-smart-tv-security-flaws“TCL smart TVs running Android seem to have huge security holes and could even be designed to spy on users around the world, two security researchers say. The issues do not affect TCL sets running Roku software.”",2,🍎 🍎 Apple ,/company/Roku/,SEND PRIVATE MESSAGE,/post/What-happened-to-Roku-stock-jYPN3ifF,Roku
3,Feb 9,I got $ROKU from the Robinhood free stock promotion 2-3 years ago. Completely forgot about it since I never really used Robinhood and now it is almost $500,10,John Rock,/company/Twitter/,SEND PRIVATE MESSAGE,/post/What-happened-to-Roku-stock-jYPN3ifF,Roku
4,Feb 10,"That's like finding $20 in your pocket, except 25x better",2,preed,/company/Cognizant/,Eng,/post/What-happened-to-Roku-stock-jYPN3ifF,Roku
5,Feb 9,Dat scale,2,ThePreak,/company/Tableau-Software/,Eng,/post/What-happened-to-Roku-stock-jYPN3ifF,Roku
6,Feb 9,I certainly hope they go 10x from here but they need to keep the momentum which I think will be seen during their next earnings call,1,right now,/company/Google/,SEND PRIVATE MESSAGE,/post/What-happened-to-Roku-stock-jYPN3ifF,Roku
7,Mar 19,Their engineers finally stopped spending all day on Blind and did some work.,0,Bernie4Prz,/company/Capital-One/,Eng,/post/What-happened-to-Roku-stock-jYPN3ifF,Roku
0,Yesterday,Lol ... Wat a question,0,bFOh57,/company/Samsung/,SEND PRIVATE MESSAGE,/post/How-is-Ads-at-Roku-ORMhKtAQ,Roku
0,"Sep 10, 2018","I would not use the words stable and Oath in the same sentence. Roku probably had risks, but Oath, IMO is way more risky. It's a declining business and the parent is just looking to consolidate audiences and squeeze profits. You will because perennially at a risk of getting laid off.",8,cynical.ly,/company/Facebook/,SEND PRIVATE MESSAGE,/post/Oath-vs-Roku-5NayyA6P,Roku
1,"Sep 10, 2018",Not a good moment to join Oath unless the job is for yahoo finance,3,SuBi51,nan,SEND PRIVATE MESSAGE,/post/Oath-vs-Roku-5NayyA6P,Roku
2,"Sep 10, 2018",How about Yahoo answers?,2,rostdAlmnd,/company/IBM/,Other,/post/Oath-vs-Roku-5NayyA6P,Roku
3,"Sep 10, 2018",Or Tumblr,1,SuBi51,nan,SEND PRIVATE MESSAGE,/post/Oath-vs-Roku-5NayyA6P,Roku
4,"Sep 10, 2018","I say Roku, culture is pretty solid there as opposed to a VZW portfolio company where I wouldn't be so sure",4,LukeCage,/company/Netflix/,Eng,/post/Oath-vs-Roku-5NayyA6P,Roku
5,"Sep 10, 2018",Heard great things about roku from people that have left there and joined Facebook. Also not that past stock reflects future but great stock growth over last year.,3,kevgill,/company/Facebook/,Eng,/post/Oath-vs-Roku-5NayyA6P,Roku
6,"Sep 10, 2018",Oath has taken an oath to not be stable - it’s unstable and everyone there knows that,2,Bonee,/company/Microsoft/,Mgmt,/post/Oath-vs-Roku-5NayyA6P,Roku
0,"Sep 3, 2019","I have a friend who is in analytics and is really happy for two reasons1. Roku is growing2. Given the company is still small, there is less politics and high visibility",1,years now,/company/Walmart/,SEND PRIVATE MESSAGE,/post/roku-analytics-2UFWNmZx,Roku
1,"Sep 3, 2019",How’s work life balance ?,0,LifeOfPie,nan,SEND PRIVATE MESSAGE,/post/roku-analytics-2UFWNmZx,Roku
2,"Sep 3, 2019",My friend is busier than usual most days but they like it.,0,years now,/company/Walmart/,SEND PRIVATE MESSAGE,/post/roku-analytics-2UFWNmZx,Roku
3,"Sep 3, 2019",Good time to join,0,Streaming📺,/company/Roku/,SEND PRIVATE MESSAGE,/post/roku-analytics-2UFWNmZx,Roku
4,"Sep 3, 2019",What is your YoE oaxnevb?,0,roku🚀,/company/Roku/,SEND PRIVATE MESSAGE,/post/roku-analytics-2UFWNmZx,Roku
5,"Sep 3, 2019",13 years,0,oaxnevb,nan,SEND PRIVATE MESSAGE,/post/roku-analytics-2UFWNmZx,Roku
6,"Sep 2, 2019",I know the Roku customer service sucks.,0,akcnd,/company/IBM/,SEND PRIVATE MESSAGE,/post/roku-analytics-2UFWNmZx,Roku
7,"Sep 3, 2019",Personal experience?,0,LifeOfPie,nan,SEND PRIVATE MESSAGE,/post/roku-analytics-2UFWNmZx,Roku
8,"Nov 20, 2019",How much of this is due to stock growth vs what was the original offer?,0,nedstarkk,/company/Intuit/,SEND PRIVATE MESSAGE,/post/roku-analytics-2UFWNmZx,Roku
0,"Apr 16, 2020",Tc,1,boboi,/company/Roku/,SEND PRIVATE MESSAGE,/post/Roku-swe-interview-85dhivu5,Roku
1,"Apr 15, 2020",Which team?,0,#rrr,/company/Roku/,SEND PRIVATE MESSAGE,/post/Roku-swe-interview-85dhivu5,Roku
2,"Apr 16, 2020",Ads,0,MaXr60,/company/T-Mobile/,SEND PRIVATE MESSAGE,/post/Roku-swe-interview-85dhivu5,Roku
3,"May 30, 2020","Hey ops, was your phone interview LC based?",0,mattll,/company/Bazaarvoice/,SEND PRIVATE MESSAGE,/post/Roku-swe-interview-85dhivu5,Roku
4,"Apr 15, 2020",Why sour?,0,hrndnj,/company/eBay/,SEND PRIVATE MESSAGE,/post/Roku-swe-interview-85dhivu5,Roku
5,Apr 18,Hey how was your interview! Can you share your experience!,0,UQIS68,nan,SEND PRIVATE MESSAGE,/post/Roku-swe-interview-85dhivu5,Roku
6,"Jun 23, 2020","Hi OP, how was your onsite? and the interview experience?",0,zIra24,/company/eClinicalWorks/,SEND PRIVATE MESSAGE,/post/Roku-swe-interview-85dhivu5,Roku
0,"May 22, 2020",Who care as long as I am getting paid. Company might go to hell. I do not love any company. I love pay.,9,and.com,/company/Roku/,SEND PRIVATE MESSAGE,/post/is-ROKU-BROKU-YOOyKv1x,Roku
1,"May 26, 2020",Whoa,0,puneri,/company/Oracle/,SEND PRIVATE MESSAGE,/post/is-ROKU-BROKU-YOOyKv1x,Roku
2,"May 26, 2020",Do you work in their web team ? (Inferred from your handle ),0,puneri,/company/Oracle/,SEND PRIVATE MESSAGE,/post/is-ROKU-BROKU-YOOyKv1x,Roku
3,"May 22, 2020","Depends how you look at it. Roku continues to be #1 in the US and our recent earnings have proved that we are recession friendly company because people are adopting OTT and dropping cable.However, our leadership is very weak. They are very conservative. There is practically no Innovation here. Our daily job is onboard new steaming apps. As the world moves towards OTT we continue to onboard more streaming apps that benefits our consumers.Our hardware products are great. We have figured out a way to build amazing hardware products for low cost. It takes years and years to get it right.However our user facing products suck.If you are a Netflix, YouTube or Disney user, it doesn't matter if you wanna stream on Roku or Fire or Apple TV. We have no differenciation in comparison to others. Infact we lack there significantly.Take a look at Roku search. It feels like it's being built by interns without any supervision. It's a really crappy experience. Not sure why PMs and engineers still have their jobs for building such a bad product.Look at our voice experience. An 8 year old can build a better experience with open source NLU libraries than a big fat team here.Look at our sign up experience and compare with Android TV or Apple TV. It feels like we have no idea what we are doing with it. Same thing with some other features on the UI. Our homepage experience is same as it was 6-8 years ago. Nothing changed because people are just too scared to introduce changes.Our ""flagship"" product 'The Roku Channel' is so confusing that no one knows what we are offering within the channel.Roku keeps getting lucky because we are in right place at right time. But how long will it continue ? At some point, this will collapse. Our competition will take over because they have Innovation in their DNA.Our VPs are extremely arrogant. They live in a bubble and have no idea what's happening with competition. They are too busy collecting their RSUs and options. If someone wants to do something great, they are fired immediately because it requires adequate hardwork that they don't want to invest.I feel bad for some great people at Roku having amazing ideas but they are scared to openly discuss because of fear of getting fired.Our culture is full of fear. Lots of hire and fire for tiny or no reason. Thumb rule at Roku is never never never break big people's ego. No matter how smart and amazing you are, they will purge you out next minute if you don't agree with them. Recently saw some great people being let go for no reason or for standing up themselves.Roku has racist culture. I see folks from India (on H1b) being treated differently vs Americans. They are given separate treatment when it comes to letting go.Every VP and Director spent 4+ years at Roku should be fired. They are just resting and vesting and carrying huge egos in their head.Yes, we are in a bubble and it will eventually burst because Apple, Amazon, Google and Samsung are our main competition and they will squeeze us in few years.Look at stories on the web comparing Fitbit with Apple watch and how Apple just killed Fitbit in the wearables market. Same with Blackberry failed to adopt Android, stayed in their own bubble and eventually died. I have not come across a single user who is a Roku fan. The only feedback i see ease of use and I get to watch my Netflix, Disney+ and Amazon prime.I won't be surprised if Roku ends up like Fitbit, Groupon , Blackberry (RIM) or GoPro because of lack of innovation and bad leadership across the board.",9,xyros,/company/Roku/,SEND PRIVATE MESSAGE,/post/is-ROKU-BROKU-YOOyKv1x,Roku
4,"May 23, 2020",Dirt cheap quality TVs/hardware really did it for us. People love cheap TVs and don't usually change/upgrade TVs as frequently as other tech. I think being early in the game and building a strong user base is what has gotten us where we are today.I do agree we need to innovate more but I have meet a lot of people how love Roku and at the end of the day an easy way to view content is what people want from a streaming platform.,0,.jsx,/company/Roku/,SEND PRIVATE MESSAGE,/post/is-ROKU-BROKU-YOOyKv1x,Roku
5,"May 23, 2020",Interesting. I’ve never once not voiced my idea,0,anakinn,/company/Roku/,SEND PRIVATE MESSAGE,/post/is-ROKU-BROKU-YOOyKv1x,Roku
6,"May 22, 2020","No! Don’t worry, we have products better than Apple TV!",1,YesSayNo,/company/Roku/,SEND PRIVATE MESSAGE,/post/is-ROKU-BROKU-YOOyKv1x,Roku
7,"May 23, 2020",It’s like you care about you ass because you want to fart 💨,1,Andy2,/company/Roku/,SEND PRIVATE MESSAGE,/post/is-ROKU-BROKU-YOOyKv1x,Roku
8,"May 23, 2020",That too 😁,1,.jsx,/company/Roku/,SEND PRIVATE MESSAGE,/post/is-ROKU-BROKU-YOOyKv1x,Roku
9,"May 22, 2020",As a consumer - it’s better than fire stick and Apple TV and it’s freaking cheap!,5,Hidalgo ,/company/PayPal/,SEND PRIVATE MESSAGE,/post/is-ROKU-BROKU-YOOyKv1x,Roku
10,"May 22, 2020",Yeah baby!,0,YesSayNo,/company/Roku/,SEND PRIVATE MESSAGE,/post/is-ROKU-BROKU-YOOyKv1x,Roku
11,"May 26, 2020","The talent at Roku is quite mediocre. Roku did not succeed because of innovation/people/leadership/strategy. They just got lucky. Being at the right place at the right time. Honestly, I’m very skeptical to hear from the person above that we are doing something new.Can’t see Roku being a big player 5 years from now. It doesn’t belong in this day of technology.",0,altruist,/company/Roku/,SEND PRIVATE MESSAGE,/post/is-ROKU-BROKU-YOOyKv1x,Roku
12,"May 26, 2020","I kind of agree that talent at roku is quite mediocre( I dont know why roku brags that they hire the best).I see it from a different angle. 50Million user- We have already captured the low cost streaming platform by our innovation and people are buying roku at a rapid pace and this will continue to grow. Now we are basically innovating to reach ARPU of 50. So when we already have the user base, we need to monetize that. The new innovation will not be very reflective or visible as it is in Ad business which is not visible to users. But believe me when I say - all ads will be streamed, we are getting ourselves in a great position to get all the $$$ when the companies will start running their campains on OTT in the future. Thats what i can say right now. Unfortunately, this covid situation has put brakes on ad spend otherwise we would have definitely generated new money from our new one view ad platform.",1,{TRC},/company/Roku/,SEND PRIVATE MESSAGE,/post/is-ROKU-BROKU-YOOyKv1x,Roku
0,"Dec 14, 2020",@op - what did you decide?,0,jLeT47,/company/PayPal/,SEND PRIVATE MESSAGE,/post/Roku-TC-Expectations-a3TDtLaZ,Roku
1,"Feb 1, 2020",Congratulations! I have some questions about the Data Engineering org at Rocky. Sent you a DM,0,Ikqf10,/company/BlackRock/,SEND PRIVATE MESSAGE,/post/Roku-TC-Expectations-a3TDtLaZ,Roku
2,"Feb 1, 2020",Pretty reasonable! Good luck. What’s your T level at eBay?,0,ctheta,nan,SEND PRIVATE MESSAGE,/post/Roku-TC-Expectations-a3TDtLaZ,Roku
0,"Jul 12, 2018",Why is a reverse split congratulatory?,1,Mexico!,/company/Facebook/,SEND PRIVATE MESSAGE,/post/Congrats-Roku-8Wkj5h6D,Roku
1,"Oct 13, 2017",1:6.,1,xj6p2m,/company/Adobe/,SEND PRIVATE MESSAGE,/post/Congrats-Roku-8Wkj5h6D,Roku
2,"Oct 17, 2017",What does that mean ? Your options pool has gone down ?,0,Diwali,/company/Google/,SEND PRIVATE MESSAGE,/post/Congrats-Roku-8Wkj5h6D,Roku
3,"Sep 29, 2017",Wow ! Awesome - congrats roku,0,War,/company/Microsoft/,SEND PRIVATE MESSAGE,/post/Congrats-Roku-8Wkj5h6D,Roku
0,"Aug 29, 2019",TC or GTFO,5,NewEndaevo,/company/Amazon/,Eng,/post/Roku-vs-Amazon-YXWfU2PP,Roku
1,"Aug 29, 2019",TC details or gtfo,5,iwantajob,/company/SAP/,SEND PRIVATE MESSAGE,/post/Roku-vs-Amazon-YXWfU2PP,Roku
2,"Aug 30, 2019",TC or GTFO,4,nBiV48,/company/Amazon/,SEND PRIVATE MESSAGE,/post/Roku-vs-Amazon-YXWfU2PP,Roku
3,"Aug 29, 2019",offer details?,3,Fremonter,/company/Google/,Mgmt,/post/Roku-vs-Amazon-YXWfU2PP,Roku
4,"Aug 31, 2019",TC or gtfo,2,momo🤘,/company/Proofpoint/,SEND PRIVATE MESSAGE,/post/Roku-vs-Amazon-YXWfU2PP,Roku
0,"Feb 5, 2020",Just under 100,1,liwq67,/company/Roku/,SEND PRIVATE MESSAGE,/post/Roku---Austin-crESRStR,Roku
1,"Feb 5, 2020",Thank you!,1,aEWs86,/company/Texas-Instruments/,Eng,/post/Roku---Austin-crESRStR,Roku
2,"Jun 4, 2020",What are the teams that are in Austin? How's the work culture there?,0,Alpha_7,nan,SEND PRIVATE MESSAGE,/post/Roku---Austin-crESRStR,Roku
3,"Feb 5, 2020",Austin is bomming,2,life rocks,/company/Microsoft/,SEND PRIVATE MESSAGE,/post/Roku---Austin-crESRStR,Roku
4,"Feb 5, 2020","Austin has many tech companies now, cost of living is also low",1,pjays,/company/Adobe/,SEND PRIVATE MESSAGE,/post/Roku---Austin-crESRStR,Roku
0,"Jul 28, 2018",To be honest there won’t be big TC improvement going to Roku.,2,Hgvmjytf,/company/Apple/,SEND PRIVATE MESSAGE,/post/Expected-TC-@Roku-0yHkki3g,Roku
1,"Jul 30, 2018",It wasn’t a life changing bump. Just a bump.,0,DiGK44,/company/Roku/,SEND PRIVATE MESSAGE,/post/Expected-TC-@Roku-0yHkki3g,Roku
2,"Aug 8, 2018",+30% for a friend that came from a FANG,1,6’ !Indian,/company/Amazon/,Eng,/post/Expected-TC-@Roku-0yHkki3g,Roku
3,"Jul 29, 2018","No matter what they offer, negotiate! Negotiate strong",1,JpRS33,/company/Roku/,SEND PRIVATE MESSAGE,/post/Expected-TC-@Roku-0yHkki3g,Roku
4,"Jul 29, 2018",There is nothing to be negotiated yet as the recruiter just ask me what I expect and said will get that my numbers work out.,0,Xyfr45,/company/Oracle/,SEND PRIVATE MESSAGE,/post/Expected-TC-@Roku-0yHkki3g,Roku
5,"Jul 29, 2018","Just say you expect to be paid at ""Market"" then negotiate",1,JpRS33,/company/Roku/,SEND PRIVATE MESSAGE,/post/Expected-TC-@Roku-0yHkki3g,Roku
6,"Jul 28, 2018",Similar to Google’s comp. https://www.levels.fyi,1,OlO,/company/Roku/,SEND PRIVATE MESSAGE,/post/Expected-TC-@Roku-0yHkki3g,Roku
7,"Jul 28, 2018",Good to know!  Would a principal architect role be comparable to a T6 role at Google then?,0,Xyfr45,/company/Oracle/,SEND PRIVATE MESSAGE,/post/Expected-TC-@Roku-0yHkki3g,Roku
8,"Jul 28, 2018","T7, I would say.",1,OlO,/company/Roku/,SEND PRIVATE MESSAGE,/post/Expected-TC-@Roku-0yHkki3g,Roku
9,"Jul 28, 2018",Tc or gtfo,2,anotherBro,/company/Prosper/,SEND PRIVATE MESSAGE,/post/Expected-TC-@Roku-0yHkki3g,Roku
10,"Jul 28, 2018","tell them market price. always aks them to give the numbers first, and then you can negotiate",0,fhakfywbsk,/company/Facebook/,SEND PRIVATE MESSAGE,/post/Expected-TC-@Roku-0yHkki3g,Roku
11,"Jul 28, 2018",You say market price when they ask for expectations and find out what they offer. And get competitive offers,0,cld-arch,/company/Amgen/,SEND PRIVATE MESSAGE,/post/Expected-TC-@Roku-0yHkki3g,Roku
12,"Jul 28, 2018","“market price"" means these two words. not a number. basically it is a way to let recruitor know, they should tell you the number first",0,fhakfywbsk,/company/Facebook/,SEND PRIVATE MESSAGE,/post/Expected-TC-@Roku-0yHkki3g,Roku
0,"Jul 6, 2020",DM for Roku,1,SushantSR,/company/Roku/,SEND PRIVATE MESSAGE,/post/roku-referral-RLUsrRMv,Roku
1,"Jul 6, 2020",How are you liking Roku?,0,1->2,/company/Medtronic/,Eng,/post/roku-referral-RLUsrRMv,Roku
2,"Jul 6, 2020",Yeah I like  working here. Sure feel free to DM.,0,SushantSR,/company/Roku/,SEND PRIVATE MESSAGE,/post/roku-referral-RLUsrRMv,Roku
3,"Jul 6, 2020","13 , OS / Linux / Storage Systems background , see couple of senior roles  for Roku OS . Interested in those.",0,gajni,/company/Sony-Electronics/,SEND PRIVATE MESSAGE,/post/roku-referral-RLUsrRMv,Roku
4,"Jul 6, 2020",Hows that applicable to Roku? Don’t they need just embedded away engineers,0,ofmrna,/company/eBay/,SEND PRIVATE MESSAGE,/post/roku-referral-RLUsrRMv,Roku
5,"Jul 8, 2020",@gajni can you provide more info on ssd caching work you did. Might be relevant to one of req,0,ofmrna,/company/eBay/,SEND PRIVATE MESSAGE,/post/roku-referral-RLUsrRMv,Roku
6,"Jul 8, 2020","Roku does not pay for referral, so I m not interested in referring you",0,Hulu🙄,/company/Roku/,SEND PRIVATE MESSAGE,/post/roku-referral-RLUsrRMv,Roku
7,"Jul 6, 2020",DM’d,0,shdjfmfk,/company/Sony-Electronics/,SEND PRIVATE MESSAGE,/post/roku-referral-RLUsrRMv,Roku
8,"Jul 6, 2020",Yoe? What’s your background?,0,Phoenix12,/company/Cypress-Semiconductor/,SEND PRIVATE MESSAGE,/post/roku-referral-RLUsrRMv,Roku
0,"Jul 10, 2019",It’s like a shitty version of Apple TV,4,d@t_person,/company/Atlassian/,SEND PRIVATE MESSAGE,/post/Anyone-use-Roku-qefaNveu,Roku
1,"Jul 11, 2019",Maybe I was using an old version but I much prefer Apple TV remote.  Lots of features that most pplDon’t even know about,0,d@t_person,/company/Atlassian/,SEND PRIVATE MESSAGE,/post/Anyone-use-Roku-qefaNveu,Roku
2,"Jul 15, 2019",You have not idea what you are saying - Roku destroys Apple TV in so many ways that is embarrassing - Roku UHD is some of the best streaming devices out there.,1,IqIq58,/company/Netflix/,SEND PRIVATE MESSAGE,/post/Anyone-use-Roku-qefaNveu,Roku
