,comment_date,comment_text,comment_like,comment_user,comment_firm,comment_position,comment_url,company
5,"Aug 31, 2017","Yes, Yahoo holdings was sold to Verizon. The  original Yahoo is renamed to Aabaco and is still listed as a 60B dollar company on Nasdaq",0,T 🤡 A,/company/Yahoo/,Eng,/post/How-much-do-senior-managers-at-yahoo-make-eAjbRe5o,Yahoo
0,"Feb 17, 2016",Every big company is always hiring. There are two threads by FB and Amazon recruiters. You can try contacting them. Good luck.,4,Keenex,/company/Microsoft/,SEND PRIVATE MESSAGE,/post/Yahoo-is-having-massive-layoffs-today-nbrEM7fd,Yahoo
1,"Feb 19, 2016",How can I reach out to you ?,0,linweihs,/company/Yahoo/,SEND PRIVATE MESSAGE,/post/Yahoo-is-having-massive-layoffs-today-nbrEM7fd,Yahoo
2,"Feb 19, 2016",Just direct msg me - I'll give you someone's email at FB for you to reach out to.,0,Eva,/company/Facebook/,SEND PRIVATE MESSAGE,/post/Yahoo-is-having-massive-layoffs-today-nbrEM7fd,Yahoo
3,"Feb 17, 2016",Is this Samuel posting?,4,Amit,/company/Yahoo/,SEND PRIVATE MESSAGE,/post/Yahoo-is-having-massive-layoffs-today-nbrEM7fd,Yahoo
4,"Feb 17, 2016",Yo,3,PMme4ajob,/company/LinkedIn/,SEND PRIVATE MESSAGE,/post/Yahoo-is-having-massive-layoffs-today-nbrEM7fd,Yahoo
5,"Feb 19, 2016",How can I reach out to you guys ? I have resume at hand,2,linweihs,/company/Yahoo/,SEND PRIVATE MESSAGE,/post/Yahoo-is-having-massive-layoffs-today-nbrEM7fd,Yahoo
6,"Feb 20, 2016",Private messaging on blind works pretty well,0,PMme4ajob,/company/LinkedIn/,SEND PRIVATE MESSAGE,/post/Yahoo-is-having-massive-layoffs-today-nbrEM7fd,Yahoo
7,"Feb 20, 2016",Yes. If you are fine with MSFT remote office and familiar with machine learning. pm me.,0,Svcscienti,/company/Microsoft/,SEND PRIVATE MESSAGE,/post/Yahoo-is-having-massive-layoffs-today-nbrEM7fd,Yahoo
8,"Feb 20, 2016","machine learning/deep learning in Seattle area, DM me",2,EPof25,/company/Microsoft/,SEND PRIVATE MESSAGE,/post/Yahoo-is-having-massive-layoffs-today-nbrEM7fd,Yahoo
0,"Nov 9, 2018",Oh god. Dont let yahoo take control of anything,4,so94,/company/Oath/,SEND PRIVATE MESSAGE,/post/Q-Microsoft-people-Yahoo-gang-out-fgO3pw1r,Yahoo
1,"Nov 11, 2018",All those ex yahoos at msft and amzn are incompetent,1,ExFat64,/company/Yahoo/,SEND PRIVATE MESSAGE,/post/Q-Microsoft-people-Yahoo-gang-out-fgO3pw1r,Yahoo
0,"Nov 11, 2019",Does Yahoo still exist?,9,:  🐧,/company/Microsoft/,Other,/post/Microsoft-PM-vs-Yahoo-APM-Offer-GFHj1TJY,Yahoo
1,"Nov 12, 2019","As another product person pointed out above, most people voting for MSFT don't understand the value of APM programs nor the new grad pm landscape. Yahoos' APM program was created by Marissa Mayer, who created THE FIRST APM program during her time at Google, and is a wayy more prestigious new grad role than MSFT’s PM role (not even a program).  Pretty sure Yahoo APM TC is higher as well.That being said, Yahoo(Verizon) obviously has a bleak future and the only thing it has over MSFT is the program itself. Comes down to if you prefer name (MSFT) or experience (Yahoo). If I were you I would take Yahoo APM, rank up after finishing the program and look to elsewhere.",6,lancer,/company/Indeed/,Product,/post/Microsoft-PM-vs-Yahoo-APM-Offer-GFHj1TJY,Yahoo
2,"Nov 13, 2019","Thanks, exactly what i was thinking. That's why didn't want everyone to vote haha. Will keep that in mind",0,TownOSalem,/company/Microsoft/,Product,/post/Microsoft-PM-vs-Yahoo-APM-Offer-GFHj1TJY,Yahoo
3,"Nov 19, 2019","Yeah but on the other hand anyone who actually takes advice from Blind deserves what they get.As others have said the Yahoo APM is a pretty crazy thing. Sr. PM after a few years of rotation? End up with their own product, most with 100k-500k+ daily users is kind of insane if you think about it. But the APMs are smart, if not a bit young to be in 20s with all that responsibility.(Love all the MFST people above getting all offended over the question- get over yourselves!)",1,divisible,/company/Yahoo/,SEND PRIVATE MESSAGE,/post/Microsoft-PM-vs-Yahoo-APM-Offer-GFHj1TJY,Yahoo
4,"Nov 11, 2019","Yahoo APM is way better, not sure why people are voting how they are right now. A Yahoo APM finishes the program as a senior PM and works on way bigger projects than a MS PM ever would",4,KeySize,/company/Workday/,Product,/post/Microsoft-PM-vs-Yahoo-APM-Offer-GFHj1TJY,Yahoo
5,"Nov 12, 2019","people thinking ""Yahoo bad, MSFT good"" - which is true but not in context of APMs/New grad programs",1,lancer,/company/Indeed/,Product,/post/Microsoft-PM-vs-Yahoo-APM-Offer-GFHj1TJY,Yahoo
6,"Nov 11, 2019",Is this a serious question?,2,MMKy42,/company/Microsoft/,SEND PRIVATE MESSAGE,/post/Microsoft-PM-vs-Yahoo-APM-Offer-GFHj1TJY,Yahoo
7,"Nov 11, 2019",Would you rather have MSFT than Yahoo on your resume?That should make your decision for you,1,FkdCompany,/company/Activision-Blizzard/,SEND PRIVATE MESSAGE,/post/Microsoft-PM-vs-Yahoo-APM-Offer-GFHj1TJY,Yahoo
8,"Nov 11, 2019",This is the main question tbh lol,0,GlazedNut,/company/HP/,SEND PRIVATE MESSAGE,/post/Microsoft-PM-vs-Yahoo-APM-Offer-GFHj1TJY,Yahoo
0,"Nov 21, 2019","As far as I know Yahoo's ads are coming from Microsoft, I worked on this specifically on msft side, so if that's still the case, then that team most probably not doing anything exciting",2,tyxS31,/company/VMware/,Eng,/post/Yahoo-Ads-team-vs-Docusign-api-team-xkJhnE8R,Yahoo
1,"Nov 21, 2019","The Bing ads are in search, with isn't the same as the rest of the ads business. There are three different areas of ads: demand, supply, search.",1,.ana.ng,/company/Yahoo/,Eng,/post/Yahoo-Ads-team-vs-Docusign-api-team-xkJhnE8R,Yahoo
2,"Nov 21, 2019","Not only search ads, but Contextual ads too",0,tyxS31,/company/VMware/,Eng,/post/Yahoo-Ads-team-vs-Docusign-api-team-xkJhnE8R,Yahoo
3,"Dec 3, 2019",DocuSign.,2,oTJY71,/company/DocuSign/,SEND PRIVATE MESSAGE,/post/Yahoo-Ads-team-vs-Docusign-api-team-xkJhnE8R,Yahoo
4,"Feb 22, 2020",DocuSign for sure. Wlb is great.,1,Vrea57,/company/DocuSign/,SEND PRIVATE MESSAGE,/post/Yahoo-Ads-team-vs-Docusign-api-team-xkJhnE8R,Yahoo
5,"Dec 4, 2019",DocuSign,1,nomoneynow,/company/DocuSign/,SEND PRIVATE MESSAGE,/post/Yahoo-Ads-team-vs-Docusign-api-team-xkJhnE8R,Yahoo
6,"Dec 6, 2019",What is the level OP ?,0,backlash,/company/Amazon/,SEND PRIVATE MESSAGE,/post/Yahoo-Ads-team-vs-Docusign-api-team-xkJhnE8R,Yahoo
7,"Dec 6, 2019",At Yahoo its ic4 and p4 at Docusign,0,XNBn36,/company/Riverbed-Technology/,SEND PRIVATE MESSAGE,/post/Yahoo-Ads-team-vs-Docusign-api-team-xkJhnE8R,Yahoo
0,"Feb 10, 2016","Send us your resumes, will help in any way possible.",1,[•._.•],/company/Microsoft/,SEND PRIVATE MESSAGE,/post/Yahoo-layoffs-107-employees-today-sJ5prSXj,Yahoo
1,"Feb 11, 2016",You're a recruiter?,0,ig2260,/company/Amazon/,SEND PRIVATE MESSAGE,/post/Yahoo-layoffs-107-employees-today-sJ5prSXj,Yahoo
2,"Feb 11, 2016",Already did.,0,diversity,/company/Yahoo/,SEND PRIVATE MESSAGE,/post/Yahoo-layoffs-107-employees-today-sJ5prSXj,Yahoo
3,"Feb 12, 2016",100% top managers' fault.  Only good severance could redeem them.,1,underdogs,/company/Amazon/,SEND PRIVATE MESSAGE,/post/Yahoo-layoffs-107-employees-today-sJ5prSXj,Yahoo
0,"Aug 3, 2019","220 is less for principal engineer at Yahoo,",0,hoooo,/company/Yahoo/,Property Dev,/post/YahooOathVZM-to-Walmart-Labs-zVkqOapH,Yahoo
1,"Aug 3, 2019","That is the reason for the change, Current management seems not to care about employee retention.",1,buffallo🐃,/company/Yahoo/,SEND PRIVATE MESSAGE,/post/YahooOathVZM-to-Walmart-Labs-zVkqOapH,Yahoo
2,"Aug 3, 2019",Obviously pay will be more. What level at yahoo? Do you have any stock comp at y after the VZ take over?,0,pknbfr,/company/Yahoo/,SEND PRIVATE MESSAGE,/post/YahooOathVZM-to-Walmart-Labs-zVkqOapH,Yahoo
3,"Aug 3, 2019","IC5 at Yahoo, Got some, not very significant",0,buffallo🐃,/company/Yahoo/,SEND PRIVATE MESSAGE,/post/YahooOathVZM-to-Walmart-Labs-zVkqOapH,Yahoo
0,"Mar 6, 2019",Leetcode is rite of passage. That's how boys become men.,0,MagnumPI,/company/Amazon/,Consultant,/post/Onsite-at-yahoo-small-business-oEUt18NU,Yahoo
0,"Mar 28, 2019",Talking about shuttle stops is frowned upon. If you're going to join Yahoo talk to your recruiter,7,tc o salir,/company/DigitalOcean/,SEND PRIVATE MESSAGE,/post/Yahoo-Shuttles-stops-from-east-bay-paEvuhjH,Yahoo
0,"Feb 2, 2016","I think a more focused yahoo is a really good idea. There are amazing things going on herein terms of technology but we need to clear out the cobwebs. And that's what is happening. The new revenue streams are growing very well but it just takes a couple years for that to make a dent in the secular decline of desktop time spent/UUs. The new stuff was like 33% of 2015 revs and this year will be 50 or more so, it's happening. She did a better  job today of explaining that on the live webcast than I've seen her do externally before.",6,Steve6,/company/Yahoo/,SEND PRIVATE MESSAGE,/post/Yahoo-Laying-off-15-of-Workforce-ZUX5fD38,Yahoo
1,"Feb 2, 2016",I agree completely.,0,Maxii,/company/Yahoo/,SEND PRIVATE MESSAGE,/post/Yahoo-Laying-off-15-of-Workforce-ZUX5fD38,Yahoo
2,"Feb 2, 2016",Yahoo has no identity. Sure they have Fantasy Sports and Finance but it's not like they aspire to be ESPN or Bloomberg. They're a far 2nd or 3rd in a bunch of areas. It's hard and I don't envy MM's position. Google has search. FB has the graph. Microsoft dominates in the enterprise space. Yahoo has ??,0,The Fox,/company/Facebook/,SEND PRIVATE MESSAGE,/post/Yahoo-Laying-off-15-of-Workforce-ZUX5fD38,Yahoo
3,"Feb 2, 2016","Hey man, take that back right now. They make the best dang weather app known to man!",5,Iiftm2,/company/Uber/,SEND PRIVATE MESSAGE,/post/Yahoo-Laying-off-15-of-Workforce-ZUX5fD38,Yahoo
4,"Feb 3, 2016",I agree. It's awesome.,0,jesper,/company/Facebook/,SEND PRIVATE MESSAGE,/post/Yahoo-Laying-off-15-of-Workforce-ZUX5fD38,Yahoo
5,"Feb 3, 2016",Some people are just working through it. I'm sure few feel safe but many have been through this before. Yahoo celebrates tenure at 5 year intervals. Lots of loyalty and hope. Whole world has problems and media sure likes to fan the hate. Engineer here looking to celebrate 15 years at yahoo. Hoping those that leave land well (especially if one of em is me !),5,lfSF10,/company/Yahoo/,SEND PRIVATE MESSAGE,/post/Yahoo-Laying-off-15-of-Workforce-ZUX5fD38,Yahoo
6,"Feb 3, 2016",15 years? Man! You've been through it all,0,rJbL36,/company/Yahoo/,SEND PRIVATE MESSAGE,/post/Yahoo-Laying-off-15-of-Workforce-ZUX5fD38,Yahoo
7,"Feb 2, 2016",I'm not sure whether to feel sad or sad,4,cortex,/company/Microsoft/,SEND PRIVATE MESSAGE,/post/Yahoo-Laying-off-15-of-Workforce-ZUX5fD38,Yahoo
8,"Feb 2, 2016",I think you should feel sad,0,SVCEng,/company/Microsoft/,SEND PRIVATE MESSAGE,/post/Yahoo-Laying-off-15-of-Workforce-ZUX5fD38,Yahoo
9,"Feb 2, 2016",Sorry to hear @yahoo folks. Hope you land somewhere quick in this hot market - engineer or not.,4,Word!,/company/Microsoft/,SEND PRIVATE MESSAGE,/post/Yahoo-Laying-off-15-of-Workforce-ZUX5fD38,Yahoo
0,"Mar 1, 2017",Nice of her to sweeten up the soon to come severance package.,2,mom's side,/company/Oracle/,SEND PRIVATE MESSAGE,/post/Yahoo-folks-how-much-money-for-you-XjfB8VuT,Yahoo
1,"Mar 1, 2017",Most companies don't do acquisitions to fire everyone. That's just Oracle.,4,tGE54xy,/company/Yahoo/,SEND PRIVATE MESSAGE,/post/Yahoo-folks-how-much-money-for-you-XjfB8VuT,Yahoo
2,"Mar 1, 2017","^^Oooooh, snap! 😂",0,MsSwizzle,/company/Yahoo/,SEND PRIVATE MESSAGE,/post/Yahoo-folks-how-much-money-for-you-XjfB8VuT,Yahoo
3,"Mar 1, 2017",She chose someone else to become the scapegoat while she gives away a drop from her bucket and gets love from naive employees at the same time.  Master move!,4,raboof,/company/Yahoo/,SEND PRIVATE MESSAGE,/post/Yahoo-folks-how-much-money-for-you-XjfB8VuT,Yahoo
4,"Mar 1, 2017","If cash and stock is around 5 million, that's around $500 per employee",3,seat,/company/eBay/,Eng,/post/Yahoo-folks-how-much-money-for-you-XjfB8VuT,Yahoo
5,"Mar 1, 2017",Her cash and stock is probably more like 50 million,0,public,/company/Facebook/,SEND PRIVATE MESSAGE,/post/Yahoo-folks-how-much-money-for-you-XjfB8VuT,Yahoo
6,"Mar 1, 2017","She will have made +$200 million by the time she leaves. Commendable to do this, but it's a drop in the bucket compared to all the damage she has done.",3,CodeOrDie,/company/Amazon/,SEND PRIVATE MESSAGE,/post/Yahoo-folks-how-much-money-for-you-XjfB8VuT,Yahoo
7,"Mar 1, 2017","So they say 2mil is her bonus, in 2015 she took home 40mil in stock grants in 2015. So conservatively, 42million should be distributed among about 10k employees. So 4,200 per employee..?",2,iWbf35,/company/Yahoo/,SEND PRIVATE MESSAGE,/post/Yahoo-folks-how-much-money-for-you-XjfB8VuT,Yahoo
8,"Mar 1, 2017","Not sure if it's part of bonus or normal comp, but she said she is giving away both her bonus AND her equity for last year, 40mill was just the amount of equity she received in 2015. She may well get more in 2016 because yahoo exceeded all of its revenue goals and stuff..",0,iWbf35,/company/Yahoo/,SEND PRIVATE MESSAGE,/post/Yahoo-folks-how-much-money-for-you-XjfB8VuT,Yahoo
9,"Mar 1, 2017","Oh I see. If every employee gets like 10k, that'd be a very generous bonus",0,seat,/company/eBay/,Eng,/post/Yahoo-folks-how-much-money-for-you-XjfB8VuT,Yahoo
0,"Apr 6, 2019","I think layoffs are probably done (at least big ones) for a while. I agree morale is kinda low but it's chill if you can find a team to just coast and collect a decent paycheck. I think it's possible to get a good ratio of pay to effort (because at least on my old team it was pretty relaxed). I don't think the damage caused in the brief Oath era can be undone, upper management is using Oath/VM as a springboard to a fat severance package or better company. I bet Guru will be brought onto the Verizon mothership soon.I would say that another good thing is that the Yahoo name still carries some weight and the engineering is still recognized as acceptable. I was able to get interviews at a reasonable number of good companies. I have recently left",5,BobBuilder,/company/Oath/,SEND PRIVATE MESSAGE,/post/Work-culture-and-team-morale-in-yahoo-Verizon-media-KOE2ejuB,Yahoo
1,"Apr 6, 2019",Bob we miss you. Where did you go to,0,VOui62,/company/Yahoo/,Product,/post/Work-culture-and-team-morale-in-yahoo-Verizon-media-KOE2ejuB,Yahoo
2,"Apr 6, 2019",Uhhh away :3,0,BobBuilder,/company/Oath/,SEND PRIVATE MESSAGE,/post/Work-culture-and-team-morale-in-yahoo-Verizon-media-KOE2ejuB,Yahoo
3,"Apr 6, 2019","Moral is very low. Constant layoffs (every six months). Low bonuses to no bonuses some times. People are leaving, some office areas are ghost town. Even Verizon regrets buying us",3,Opalumpa,/company/Oath/,SEND PRIVATE MESSAGE,/post/Work-culture-and-team-morale-in-yahoo-Verizon-media-KOE2ejuB,Yahoo
0,"Dec 24, 2020",You will need to pay for real time data. That's what all brokers do.Notice how some brokers show you data for futures (TD Ameritrade) while others like Robinhood don't? That's because they have to pay to get the data and show it to their customers,2,妈妈,/company/LinkedIn/,SEND PRIVATE MESSAGE,/post/How-to-build-a-yahoo-finance-like-website-4FyAtpcX,Yahoo
1,"Dec 23, 2020",doesn't yahoo list their data sources? just pull from them,0,google hr,/company/Google/,SEND PRIVATE MESSAGE,/post/How-to-build-a-yahoo-finance-like-website-4FyAtpcX,Yahoo
2,"Dec 23, 2020",i mean the other numbers like short interest and stuff. just find where they are getting numbers from,0,google hr,/company/Google/,SEND PRIVATE MESSAGE,/post/How-to-build-a-yahoo-finance-like-website-4FyAtpcX,Yahoo
3,"Dec 24, 2020",they get their data from theice.com which looks like a decent provider. it is easy to see how messed up their options data are if you compare to fidelity.,0,givingthx,/company/Facebook/,Eng,/post/How-to-build-a-yahoo-finance-like-website-4FyAtpcX,Yahoo
4,"Dec 23, 2020",Google finance is one of the best in the business!  I have been using it for over 6 years now and haven’t observed any slowness/lag in latest price ever.,0,google hr,/company/Google/,SEND PRIVATE MESSAGE,/post/How-to-build-a-yahoo-finance-like-website-4FyAtpcX,Yahoo
5,"Dec 23, 2020",If you got the engineering bits for backend and front end - I can support the UXR & UXD for the product - dm me if you really about it,0,tc...,nan,SEND PRIVATE MESSAGE,/post/How-to-build-a-yahoo-finance-like-website-4FyAtpcX,Yahoo
0,"Sep 9, 2019","You're the negligent person, if you think you shouldn't diversify your data risks. I would think that a person hedging against Google turning evil, is a smart person.",2,wjwjbs,/company/Booking.com/,SEND PRIVATE MESSAGE,/post/Passing-on-resumes-with-yahoo-emails-qQeFgDHc,Yahoo
1,"Sep 9, 2019","But with Yahoo? Protonmail, hotmail, snail mail, the comments section of an obscure blog post. All better and more respectable.",2,SmkWdEvyDy,/company/Amazon/,Eng,/post/Passing-on-resumes-with-yahoo-emails-qQeFgDHc,Yahoo
2,"Sep 9, 2019",Don't hate on Yahoo.,4,cruella,/company/Roku/,SEND PRIVATE MESSAGE,/post/Passing-on-resumes-with-yahoo-emails-qQeFgDHc,Yahoo
3,"Sep 9, 2019",Justified. Hotmail too.,3,F.U. money,/company/Bloomberg/,Eng,/post/Passing-on-resumes-with-yahoo-emails-qQeFgDHc,Yahoo
4,"Sep 9, 2019",Next level of elitism.,2,Db8db4,/company/Amazon/,Mgmt,/post/Passing-on-resumes-with-yahoo-emails-qQeFgDHc,Yahoo
5,"Sep 9, 2019",Yahoo Rejects your resume if your gpa is below 3.5. how does that feel ?,1,yobaba,/company/SAP/,Eng,/post/Passing-on-resumes-with-yahoo-emails-qQeFgDHc,Yahoo
6,"Sep 9, 2019",Feels really good. Now I know that I have a safeguard against accidentally working there.,0,SmkWdEvyDy,/company/Amazon/,Eng,/post/Passing-on-resumes-with-yahoo-emails-qQeFgDHc,Yahoo
7,"Sep 9, 2019",Not sure how things are now that the Berkeley grad CEO is no longer there.,0,yobaba,/company/SAP/,Eng,/post/Passing-on-resumes-with-yahoo-emails-qQeFgDHc,Yahoo
0,"Jan 21, 2016","Googlers for Google employees, Xooglers or ex-Googlers for previous Googlers no longer at the company, Nooglers for new or onboarding Googlers, Androids for Android Googlers, Nandroids for new or onboarding Android Googlers, Fiberers or Fiberians for Google Fiber Googlers, Spooglers for Googlers' spouses, Googlets for Googlers' children, Carpooglers for Googlers carpooling to work, etc.",3,jKTs63,/company/Google/,SEND PRIVATE MESSAGE,/post/Amazonians-Googlers-Yahoos-other-names-7wCWkQMa,Yahoo
1,"Jan 22, 2016",Don't we have gayglers as well?,2,CF4051,/company/Google/,SEND PRIVATE MESSAGE,/post/Amazonians-Googlers-Yahoos-other-names-7wCWkQMa,Yahoo
2,"Jan 22, 2016",I've heard about that.,0,ques,/company/Quora/,SEND PRIVATE MESSAGE,/post/Amazonians-Googlers-Yahoos-other-names-7wCWkQMa,Yahoo
3,"Jan 20, 2016",What about Oracle?,0,LimtedKims,/company/Microsoft/,SEND PRIVATE MESSAGE,/post/Amazonians-Googlers-Yahoos-other-names-7wCWkQMa,Yahoo
4,"Jan 20, 2016",Orangutans,3,Jan,/company/Amazon/,SEND PRIVATE MESSAGE,/post/Amazonians-Googlers-Yahoos-other-names-7wCWkQMa,Yahoo
5,"Jan 21, 2016",LOL,0,ques,/company/Quora/,SEND PRIVATE MESSAGE,/post/Amazonians-Googlers-Yahoos-other-names-7wCWkQMa,Yahoo
6,"Jan 20, 2016",Pandas,3,bucpp,/company/Pandora/,SEND PRIVATE MESSAGE,/post/Amazonians-Googlers-Yahoos-other-names-7wCWkQMa,Yahoo
7,"Jan 20, 2016",Pandas! Nice one,0,Uu,/company/Yahoo/,SEND PRIVATE MESSAGE,/post/Amazonians-Googlers-Yahoos-other-names-7wCWkQMa,Yahoo
8,"Jan 20, 2016",Weiners' :),2,EI2,/company/LinkedIn/,SEND PRIVATE MESSAGE,/post/Amazonians-Googlers-Yahoos-other-names-7wCWkQMa,Yahoo
9,"Jan 20, 2016",Notice the possessive use of our CEO's name,0,EI2,/company/LinkedIn/,SEND PRIVATE MESSAGE,/post/Amazonians-Googlers-Yahoos-other-names-7wCWkQMa,Yahoo
10,"Jan 20, 2016",Ah yes of course... Should've known that immediately,0,Uu,/company/Yahoo/,SEND PRIVATE MESSAGE,/post/Amazonians-Googlers-Yahoos-other-names-7wCWkQMa,Yahoo
11,"Jan 20, 2016",Sales Forcers :),0,LimtedKims,/company/Microsoft/,SEND PRIVATE MESSAGE,/post/Amazonians-Googlers-Yahoos-other-names-7wCWkQMa,Yahoo
12,"Jan 21, 2016","Forcers. Better yet, Jedi's.",1,ques,/company/Quora/,SEND PRIVATE MESSAGE,/post/Amazonians-Googlers-Yahoos-other-names-7wCWkQMa,Yahoo
13,"Jan 21, 2016",Salesfarts,1,nI5264,/company/Salesforce/,SEND PRIVATE MESSAGE,/post/Amazonians-Googlers-Yahoos-other-names-7wCWkQMa,Yahoo
0,"Jan 21, 2017",Yahoo Principal Engineer = Amazon L2 SDE,5,Tjirbhejjd,/company/Amazon/,SEND PRIVATE MESSAGE,/post/Yahoo---Amazon-level-mapping-RbGmXxGQ,Yahoo
1,"Jan 21, 2017",Most Yahoo roles map to L9.,4,AB-T,/company/Amazon/,SEND PRIVATE MESSAGE,/post/Yahoo---Amazon-level-mapping-RbGmXxGQ,Yahoo
2,"Jan 21, 2017",Yahoo        AMZNIC1-IC2 == L4IC3-IC4 == L5IC5-IC6 == L6M4-M5 == L6,2,🕉️,/company/Amazon/,SEND PRIVATE MESSAGE,/post/Yahoo---Amazon-level-mapping-RbGmXxGQ,Yahoo
3,"Jan 22, 2017",Yahoo levels are about in line with most of the industry. Exceptions are Facebook and Google. Amazon deflates more than anyone. A director at FB and Google comes in as senior something at Amazon.,0,zGt72Xb,/company/Yahoo/,SEND PRIVATE MESSAGE,/post/Yahoo---Amazon-level-mapping-RbGmXxGQ,Yahoo
4,"Jan 22, 2017","Wow. What's wrong with amazon? On a related note, several of my friends have been SDM for more than 4 yrs. That's a long time to just get to senior manager.",0,Grokit,/company/Yahoo/,SEND PRIVATE MESSAGE,/post/Yahoo---Amazon-level-mapping-RbGmXxGQ,Yahoo
0,"Jun 3, 2016",Two failing businesses merging sounds like a great idea...wut?,6,Zaphod,/company/Google/,SEND PRIVATE MESSAGE,/post/Twitter-Yahoo-TwiHoo-Is-this-real-IIrjv6vF,Yahoo
1,"Jun 3, 2016",Come on Yahter is a better name,3,Choc*fish,/company/Amazon/,SEND PRIVATE MESSAGE,/post/Twitter-Yahoo-TwiHoo-Is-this-real-IIrjv6vF,Yahoo
2,"Jun 3, 2016",LOL,1,genius,/company/LinkedIn/,SEND PRIVATE MESSAGE,/post/Twitter-Yahoo-TwiHoo-Is-this-real-IIrjv6vF,Yahoo
3,"Jun 3, 2016",Kara swisher is my only source for info about yahoo.  Her and ppl on this app,0,exchangeme,/company/Microsoft/,SEND PRIVATE MESSAGE,/post/Twitter-Yahoo-TwiHoo-Is-this-real-IIrjv6vF,Yahoo
4,"Jun 3, 2016",Two turkeys something something...,0,S Gudzella,/company/Microsoft/,SEND PRIVATE MESSAGE,/post/Twitter-Yahoo-TwiHoo-Is-this-real-IIrjv6vF,Yahoo
0,"Aug 23, 2018","Wait, what? Yahoo mail still exists?",2,@zzz,/company/Microsoft/,Product,/post/Prospect-at-Yahoo-Mail-for-mobile-dev-t2ntpM8a,Yahoo
1,"Aug 24, 2018",I know nobody who uses windows. Seriously? Windows?,1,गब्बर सिंह,/company/Yahoo/,Eng,/post/Prospect-at-Yahoo-Mail-for-mobile-dev-t2ntpM8a,Yahoo
2,"Aug 27, 2018","Comparing yahoo mail with windows is just wrong. You should compare with hotmail, which is way smaller than yahoo mail by a large scale.",0,verve,/company/Yahoo/,Eng,/post/Prospect-at-Yahoo-Mail-for-mobile-dev-t2ntpM8a,Yahoo
3,"Aug 24, 2018",Thanks for the info mate. ✌️,0,userMcAfee,/company/McAfee/,SEND PRIVATE MESSAGE,/post/Prospect-at-Yahoo-Mail-for-mobile-dev-t2ntpM8a,Yahoo
4,"Aug 24, 2018",Yeah.!! Better than McAfee for sure,0,userMcAfee,/company/McAfee/,SEND PRIVATE MESSAGE,/post/Prospect-at-Yahoo-Mail-for-mobile-dev-t2ntpM8a,Yahoo
5,"Aug 24, 2018",401k matching is weird. It doesn’t vest until 3 years at the company. Make sure you are okay with that.,1,meyO44,/company/Yahoo/,SEND PRIVATE MESSAGE,/post/Prospect-at-Yahoo-Mail-for-mobile-dev-t2ntpM8a,Yahoo
6,"Aug 24, 2018",Oh that sucks..!! Thanks though.,0,userMcAfee,/company/McAfee/,SEND PRIVATE MESSAGE,/post/Prospect-at-Yahoo-Mail-for-mobile-dev-t2ntpM8a,Yahoo
7,"Aug 25, 2018","That said, it is 6% of your base and cash (base and bonus) comp, so it’s can actually get quite high.",1,meyO44,/company/Yahoo/,SEND PRIVATE MESSAGE,/post/Prospect-at-Yahoo-Mail-for-mobile-dev-t2ntpM8a,Yahoo
8,"Aug 23, 2018","Just curious, are u getting Yahoo or Verizon RSUs?   Not sure about Yahoo mail.  I am using gmail and hotmail.",0,Dr.Dre,/company/Apple/,SEND PRIVATE MESSAGE,/post/Prospect-at-Yahoo-Mail-for-mobile-dev-t2ntpM8a,Yahoo
9,"Aug 23, 2018",Haven't reached that stage of discussion yet.. but as far as I know it's gonna be Verizon,0,userMcAfee,/company/McAfee/,SEND PRIVATE MESSAGE,/post/Prospect-at-Yahoo-Mail-for-mobile-dev-t2ntpM8a,Yahoo
10,"Aug 23, 2018",It’s Verizon RSU nowadays,2,xdFq02,/company/Oath/,SEND PRIVATE MESSAGE,/post/Prospect-at-Yahoo-Mail-for-mobile-dev-t2ntpM8a,Yahoo
11,"Aug 24, 2018","Great team, flagship product. Look at benefits and compensation very carefully, VZ is strange.",2,LcCu84,/company/Yahoo/,SEND PRIVATE MESSAGE,/post/Prospect-at-Yahoo-Mail-for-mobile-dev-t2ntpM8a,Yahoo
0,"Apr 3, 2017",I thought we were on oauth2,10,snjsjsisk,/company/Google/,SEND PRIVATE MESSAGE,/post/Oath-a-Verizon-company-Yahoo-AOL-dnf3KUhq,Yahoo
1,"Apr 4, 2017",Due to lack of security they lost u,0,.s,/company/Yahoo/,SEND PRIVATE MESSAGE,/post/Oath-a-Verizon-company-Yahoo-AOL-dnf3KUhq,Yahoo
2,"Apr 4, 2017",Not that I enjoy being here but Yahoo still has a ton of eyeballs day to day. Mostly middle America.,3,digit,/company/Yahoo/,SEND PRIVATE MESSAGE,/post/Oath-a-Verizon-company-Yahoo-AOL-dnf3KUhq,Yahoo
3,"Apr 4, 2017",Agreed. I think last I've read 1b unique visitors and 650m+ mobile?,1,(ーー;),/company/Microsoft/,Sales,/post/Oath-a-Verizon-company-Yahoo-AOL-dnf3KUhq,Yahoo
4,"Apr 3, 2017",Flickr,3,Linkedin@l,/company/LinkedIn/,SEND PRIVATE MESSAGE,/post/Oath-a-Verizon-company-Yahoo-AOL-dnf3KUhq,Yahoo
5,"Apr 3, 2017","What exactly will we miss if both AOL and Yahoo just shut down their servers tomorrow?Did not follow either company, so honest question, what are their valuable products?Yahoo search and mail are irrelevant now, as well as AOL mail.",2,P.Gibbons,/company/Salesforce/,Eng,/post/Oath-a-Verizon-company-Yahoo-AOL-dnf3KUhq,Yahoo
