,comment_date,comment_text,comment_like,comment_user,comment_firm,comment_position,comment_url,company
2,"Mar 6, 2017","It depends on the lifer, as with anything. But even if all lifers were bad, that's not a reason to discount the entire company. And recruiters know how to filter LinkedIn on people hired in the last four years. Point being yahoo is not a detriment to your resume at all.",2,tGE54xy,/company/Yahoo/,SEND PRIVATE MESSAGE,/post/Should-I-leave-Yahoo-tXpNjX1b,Yahoo
3,"Mar 7, 2017","Marissa brought no one! People came for the money, she offered them a lot of money! Many of them didn't believe in the company, nor her leadership! Now, that most of them cashed out their RSUs, they left!Frankly speaking, most, if not all, of the good great talent left, and those who are still there are either waiting for their RSUs to vest (they got a lot of it) or are too stupid they couldn't find a better job! Lastly, without exaggeration, 90% of people (at least engineering folks) are thinking of leaving (even the stupid ones)Please don't make things look better than they really are, don't be fools and don't fool others!Marissa didn't succeed and Yahoo is pretty much over!",0,Genius,/company/Yahoo/,SEND PRIVATE MESSAGE,/post/Should-I-leave-Yahoo-tXpNjX1b,Yahoo
4,"Mar 6, 2017","Stop listening to anyone who says Yahoo looks bad on your resume. All companies are building the same shit and have people with more or less the same IQ. If it were different, Amazon would not have built Fire, Google would not have built G+ and Facebook would not be losing users to Snap...all companies will go through bad times at some point, in spite of hiring ""smartest"" people on the planet...",12,Letsdoit,/company/Microsoft/,SEND PRIVATE MESSAGE,/post/Should-I-leave-Yahoo-tXpNjX1b,Yahoo
5,"Mar 6, 2017",Yahoo? Umm yeah even I wouldn't touch that with a 10ft barge pole,2,JK4562,/company/Microsoft/,SEND PRIVATE MESSAGE,/post/Should-I-leave-Yahoo-tXpNjX1b,Yahoo
6,"Mar 6, 2017",Says the guy at Microsoft.,4,tGE54xy,/company/Yahoo/,SEND PRIVATE MESSAGE,/post/Should-I-leave-Yahoo-tXpNjX1b,Yahoo
7,"Mar 6, 2017",Yep. Imagine  that..,1,JK4562,/company/Microsoft/,SEND PRIVATE MESSAGE,/post/Should-I-leave-Yahoo-tXpNjX1b,Yahoo
8,"Mar 6, 2017","The notion that Yahoo looks bad on a resume is ridiculous. It's the stuff of junior people with no real industry experience. Yahoo has a lot of great people. Many have left recently, but many are still there. If you like what you're doing and like your team, don't leave. Leave when your career ambitions are no longer being fulfilled.",6,tGE54xy,/company/Yahoo/,SEND PRIVATE MESSAGE,/post/Should-I-leave-Yahoo-tXpNjX1b,Yahoo
0,"Feb 2, 2018",Any company is better than Yahoo so they have lots of options :),2,point y,/company/Uber/,SEND PRIVATE MESSAGE,/post/Yahoo-to-where-VGLmjUGr,Yahoo
1,"Feb 2, 2018",You're right. I might have unintentionally trolled.,0,point y,/company/Uber/,SEND PRIVATE MESSAGE,/post/Yahoo-to-where-VGLmjUGr,Yahoo
2,"Feb 3, 2018","Well then we have made progress. :) Through the fog of that trolling, I do hear what you’re saying.",0,vs35deu,/company/Yahoo/,SEND PRIVATE MESSAGE,/post/Yahoo-to-where-VGLmjUGr,Yahoo
3,"Feb 2, 2018","Google and Facebook both have pretty good culture, but safe to say neither has the humble underdog vibe from Yahoo. Seems like half the Yahoo eng I know went to either Google or Facebook or Apple. Definitely avoid Amazon if you liked Yahoo’s culture. Very few perks.",4,vs35deu,/company/Yahoo/,SEND PRIVATE MESSAGE,/post/Yahoo-to-where-VGLmjUGr,Yahoo
4,"Feb 2, 2018",this ^,1,Trollman,/company/Amazon/,SEND PRIVATE MESSAGE,/post/Yahoo-to-where-VGLmjUGr,Yahoo
5,"Feb 2, 2018","Asking for a ""friend"".",5,mahalo2,/company/Fitbit/,SEND PRIVATE MESSAGE,/post/Yahoo-to-where-VGLmjUGr,Yahoo
6,"Feb 2, 2018",Hard to find Yahoo’s good cultureHowever start up companies may provide something closer to that,4,Y^,/company/Yahoo/,SEND PRIVATE MESSAGE,/post/Yahoo-to-where-VGLmjUGr,Yahoo
7,"Feb 2, 2018",I hear AOL is young and hip 😂,3,Snamazon,/company/Amazon/,SEND PRIVATE MESSAGE,/post/Yahoo-to-where-VGLmjUGr,Yahoo
0,"Mar 4, 2020",Good thing Mayer isn't in charge still,3,djrhejn,/company/Credit-Karma/,SEND PRIVATE MESSAGE,/post/WFH-@Yahoo-but-when-tK3Xrm0z,Yahoo
0,"Nov 12, 2019",Whats your yoe? Do you have a masters?,0,NoRhhuhb,/company/Amazon/,SEND PRIVATE MESSAGE,/post/SDE1-@Microsoft-vs-SDE2-@Yahoo-XengCcXV,Yahoo
1,"Nov 12, 2019",Ahhh ok. Cuz thats a great sde1 offer :),0,NoRhhuhb,/company/Amazon/,SEND PRIVATE MESSAGE,/post/SDE1-@Microsoft-vs-SDE2-@Yahoo-XengCcXV,Yahoo
2,"Nov 13, 2019",No wonder the offer package. Congrats!,0,AmazonEng,nan,SEND PRIVATE MESSAGE,/post/SDE1-@Microsoft-vs-SDE2-@Yahoo-XengCcXV,Yahoo
3,"Nov 13, 2019","Yahoo / Verizon is not doing great at the moment. I heard except few teams, there are lot of shitty politics going on in teams. I would stay be away from that.",0,horsepower,/company/Target/,SEND PRIVATE MESSAGE,/post/SDE1-@Microsoft-vs-SDE2-@Yahoo-XengCcXV,Yahoo
4,"Nov 12, 2019",I’m gonna go with Yahoo here cuz of TC.,0,AmazonEng,nan,SEND PRIVATE MESSAGE,/post/SDE1-@Microsoft-vs-SDE2-@Yahoo-XengCcXV,Yahoo
5,"Nov 12, 2019",Easy yahoo,0,dubz888,nan,SEND PRIVATE MESSAGE,/post/SDE1-@Microsoft-vs-SDE2-@Yahoo-XengCcXV,Yahoo
0,Feb 12,"I don't know about employee experience, but Walmart is at least trying to fight with Amazon. Whereas in Yahoo!, I don't think anyone even cares, at this point.",2,cynical.ly,/company/Facebook/,SEND PRIVATE MESSAGE,/post/Walmart-VS-YahooVerizon-Media-bEU4zpmn,Yahoo
1,Feb 12,"Both are meh. But yeah Walmart anyday. Can you share the offer? Bigger bonuses for employees , better business, better stock. VZ stock is useless.",1,Bommppp,/company/Oath/,SEND PRIVATE MESSAGE,/post/Walmart-VS-YahooVerizon-Media-bEU4zpmn,Yahoo
2,Feb 14,This is for internship,0,zealand23,/company/Quicken-Loans/,SEND PRIVATE MESSAGE,/post/Walmart-VS-YahooVerizon-Media-bEU4zpmn,Yahoo
3,Feb 14,Oh ok. If you don't care about salary then I'll say yahoo is not a bad place. Decent problems to solve definitely. But again depends on team though.,0,Bommppp,/company/Oath/,SEND PRIVATE MESSAGE,/post/Walmart-VS-YahooVerizon-Media-bEU4zpmn,Yahoo
4,Feb 12,Walmart. Yahoo has become really bad,1,She’ll ,nan,SEND PRIVATE MESSAGE,/post/Walmart-VS-YahooVerizon-Media-bEU4zpmn,Yahoo
5,Mar 4,Which one did you choose?,0,RFIL60,/company/Cisco/,IT,/post/Walmart-VS-YahooVerizon-Media-bEU4zpmn,Yahoo
0,"Mar 29, 2017","If you are at yahoo why wait for layoff news, find a job right away unless you are waiting to cash on layoff package",4,Seasons,/company/Microsoft/,SEND PRIVATE MESSAGE,/post/LayOffs-Yahoo-VZ-nysY1p4M,Yahoo
1,"Mar 29, 2017","That's means employees don't have to work and wait to get fired - wow , this is  really hard",1,notnutella,/company/Microsoft/,SEND PRIVATE MESSAGE,/post/LayOffs-Yahoo-VZ-nysY1p4M,Yahoo
2,"Mar 29, 2017",Fuckkk what am I doing at Uber 😂,0,#muga,/company/Uber/,Eng,/post/LayOffs-Yahoo-VZ-nysY1p4M,Yahoo
3,"Mar 29, 2017",Let's just say you should be brushing up your CV. Especially after your last data breach. 👍🏻,4,͡° ͜ʖ ͡°,/company/Expedia/,SEND PRIVATE MESSAGE,/post/LayOffs-Yahoo-VZ-nysY1p4M,Yahoo
4,"Mar 29, 2017",You won't find a job after layoffs are announced - market would be flooded with Yahoo!'s,3,notnutella,/company/Microsoft/,SEND PRIVATE MESSAGE,/post/LayOffs-Yahoo-VZ-nysY1p4M,Yahoo
5,"Mar 29, 2017","Not to debate, just remind me one thing. When Yahoo China dismissed, all engineer got pretty sweet layoff package. My new grad classmate, who just accepted yahoo offer and didn't work for yahoo one minute, also had three month salary as offer cancellation compensation. All IT companies set up table right under Yahoo building to hire them. That was crazy.",0,directX,/company/Google/,Eng,/post/LayOffs-Yahoo-VZ-nysY1p4M,Yahoo
6,"Mar 29, 2017",Is that implied ? sooner or later the parent company will have to weigh on projects it seemes makes sense and the ones that doesn't to them,2,Oye!,/company/Uber/,SEND PRIVATE MESSAGE,/post/LayOffs-Yahoo-VZ-nysY1p4M,Yahoo
7,"Mar 29, 2017",If the acquisition is done well...of course,1,public,/company/Facebook/,SEND PRIVATE MESSAGE,/post/LayOffs-Yahoo-VZ-nysY1p4M,Yahoo
0,"Oct 16, 2018","I dont work there, but gotta say I love the product, prbbly the only product where they did better than Google.",5,Xmen007,nan,SEND PRIVATE MESSAGE,/post/Whats-it-like-@-Yahoo-Finance-DC10Zkep,Yahoo
1,"Oct 16, 2018",except for all the 1990s-style ads still plastered all over the site,1,Amoonarriv,/company/Twitter/,SEND PRIVATE MESSAGE,/post/Whats-it-like-@-Yahoo-Finance-DC10Zkep,Yahoo
2,"Oct 17, 2018","I suggest rolling your Blind name to maintain anonymity.We do monitor Blind, and your current company is listed above. It’s also on your resume. Looks like I’m on your panel. Study design patterns and memory management. Good luck!Btw: it’s a GREAT team, in a swanky office, growing fast and perfect time to join.",5,Ronivez,/company/Yahoo/,SEND PRIVATE MESSAGE,/post/Whats-it-like-@-Yahoo-Finance-DC10Zkep,Yahoo
3,"Oct 19, 2018",Yahoo sports is way better,1,exYahoo,/company/Yahoo/,SEND PRIVATE MESSAGE,/post/Whats-it-like-@-Yahoo-Finance-DC10Zkep,Yahoo
4,"Oct 20, 2018",Why do you say so?,0,ood-expert,nan,nan,/post/Whats-it-like-@-Yahoo-Finance-DC10Zkep,Yahoo
5,"Oct 22, 2018","Priority on down from Verizon: Home, Comms, Finance, Sports, and then News. I’d say Sports has little to no potential.",0,gHMd87,nan,nan,/post/Whats-it-like-@-Yahoo-Finance-DC10Zkep,Yahoo
6,"Oct 16, 2018",Not sure anyone actually -works- there,0,BobbleHat,/company/VMware/,SEND PRIVATE MESSAGE,/post/Whats-it-like-@-Yahoo-Finance-DC10Zkep,Yahoo
7,"Oct 17, 2018","Well, I am sure. They have dozens of engineers, PMs, management... it’s a huge product, buddy. In fact it’s still the top finance website, and the top non-bank/broker app. Massive Real-time pipelines, big data crunching, apps, websites, charts, etc.",1,Ronivez,/company/Yahoo/,SEND PRIVATE MESSAGE,/post/Whats-it-like-@-Yahoo-Finance-DC10Zkep,Yahoo
8,"Oct 19, 2018",BE or FE team? Heard they got more budget for hiring...,1,Fat32,/company/Yahoo/,SEND PRIVATE MESSAGE,/post/Whats-it-like-@-Yahoo-Finance-DC10Zkep,Yahoo
0,"Aug 19, 2016",sell,1,Zune Fan,/company/Microsoft/,SEND PRIVATE MESSAGE,/post/Yahoo-stock-iSk36QOC,Yahoo
1,"Aug 20, 2016",Its a proxy for BABA with some tax risk built in,0,Legstrong,/company/Yahoo/,SEND PRIVATE MESSAGE,/post/Yahoo-stock-iSk36QOC,Yahoo
2,"Aug 22, 2016",Risk slash opportunity,0,upsidedown,/company/Yahoo/,SEND PRIVATE MESSAGE,/post/Yahoo-stock-iSk36QOC,Yahoo
3,"Aug 24, 2016",Sell.,0,Patsy,/company/Yahoo/,SEND PRIVATE MESSAGE,/post/Yahoo-stock-iSk36QOC,Yahoo
4,"Aug 22, 2016","Even at this price, yhoo is still testing less than the sum of its parts. Your call.",0,mfva05,/company/Yahoo/,SEND PRIVATE MESSAGE,/post/Yahoo-stock-iSk36QOC,Yahoo
5,"Aug 19, 2016",Depends what you think about alibabas outlook,0,Wonk Wonk,/company/Yahoo/,SEND PRIVATE MESSAGE,/post/Yahoo-stock-iSk36QOC,Yahoo
0,"Mar 24, 2017",Not surprising. Yahoo has been paying way above market to retain talent during a sale. Those giant stock grants from Marissa was the exception not the rule. No one should expect that gravy train to continue. This is fairly common.,12,public,/company/Facebook/,SEND PRIVATE MESSAGE,/post/Verizon-cutting-yahoo-salaries-sCiChzaU,Yahoo
1,"Mar 24, 2017",For the yahoo brand obviously,1,111lll111l,/company/Microsoft/,Eng,/post/Verizon-cutting-yahoo-salaries-sCiChzaU,Yahoo
2,"Mar 25, 2017",It is fairly common for an acquired company to assimilate the acquired employees and adjust their pay accordingly. The biggest shock from my peer group was when Google acquired doubleclick. After all was settled google dropped the doubleclick salaries by -50% to standard google rates.,2,public,/company/Facebook/,SEND PRIVATE MESSAGE,/post/Verizon-cutting-yahoo-salaries-sCiChzaU,Yahoo
3,"Mar 24, 2017",Subscribe,0,⚒,/company/Yahoo/,Eng,/post/Verizon-cutting-yahoo-salaries-sCiChzaU,Yahoo
4,"Mar 25, 2017",You know you can just tap the bell in the corner...,2,bitter,/company/Yelp/,Eng,/post/Verizon-cutting-yahoo-salaries-sCiChzaU,Yahoo
5,"Mar 25, 2017",,7,⚒,/company/Yahoo/,Eng,/post/Verizon-cutting-yahoo-salaries-sCiChzaU,Yahoo
6,"Mar 24, 2017","Ah crap... so Verizon is looking to cut costs, could this mean layoffs?",5,jdjdjdkdj.,/company/Yahoo/,SEND PRIVATE MESSAGE,/post/Verizon-cutting-yahoo-salaries-sCiChzaU,Yahoo
7,"Mar 25, 2017",Deleting the post won't hide the truth.,3,Bleeding,/company/Yahoo/,SEND PRIVATE MESSAGE,/post/Verizon-cutting-yahoo-salaries-sCiChzaU,Yahoo
8,"Mar 25, 2017","I love JBQ but this was not appropriate. What is there to gain from posting that on Twitter except venting? It certainly doesn't help me as a Yahoo employee because there's no context. What does it even mean ""Verizon wants to pay me less""? In the latest year end review process we just had I got a very generous ~20% raise, so it's not like there's some effort to lower salaries across the board, at least not yet.",0,✈️,/company/Yahoo/,Product,/post/Verizon-cutting-yahoo-salaries-sCiChzaU,Yahoo
9,"Mar 25, 2017","Can't tell if it was a good idea from his career perspective. But it is good to see some other person real personality and not just gray faceless company men. There are so many of them at Yahoo (as well as other companies), saying right things, smile, nodding and only carrying about their paycheck deep inside.",2,ca91lf,/company/Yahoo/,SEND PRIVATE MESSAGE,/post/Verizon-cutting-yahoo-salaries-sCiChzaU,Yahoo
0,"Mar 6, 2019",I'm curious how much RSU an NCG gets in Yahoo,1,cantNameMe,/company/Salesforce/,SEND PRIVATE MESSAGE,/post/Yahoo-Software-Development-Engineer-NCG-Salary-TuD0ynHh,Yahoo
1,"Mar 6, 2019",I was hired in November and wasn’t given any equity. This is after Oath was going into Verizon media.,0,do1al36,/company/Veritas/,SEND PRIVATE MESSAGE,/post/Yahoo-Software-Development-Engineer-NCG-Salary-TuD0ynHh,Yahoo
2,"Mar 20, 2019",@pxG40 Dm'ed you,0,u71ghty,/company/Juniper/,Eng,/post/Yahoo-Software-Development-Engineer-NCG-Salary-TuD0ynHh,Yahoo
3,"Mar 5, 2019","Wtf is this ""engg"" business. Indian thing?",1,ae86tofu,/company/Facebook/,SEND PRIVATE MESSAGE,/post/Yahoo-Software-Development-Engineer-NCG-Salary-TuD0ynHh,Yahoo
4,"Mar 5, 2019","Lol, changed",0,u71ghty,/company/Juniper/,Eng,/post/Yahoo-Software-Development-Engineer-NCG-Salary-TuD0ynHh,Yahoo
5,"Mar 8, 2019",Too piqued. Gtfo,0,fyof85,/company/Yahoo/,SEND PRIVATE MESSAGE,/post/Yahoo-Software-Development-Engineer-NCG-Salary-TuD0ynHh,Yahoo
6,"Mar 6, 2019",Excuse my ignorance. What's NCG?,0,pxkG40,/company/Oath/,SEND PRIVATE MESSAGE,/post/Yahoo-Software-Development-Engineer-NCG-Salary-TuD0ynHh,Yahoo
7,"Mar 6, 2019","New College Grad. Either BS, MS, MBA or PhD.",0,.ZhKcv,/company/Yahoo/,Eng,/post/Yahoo-Software-Development-Engineer-NCG-Salary-TuD0ynHh,Yahoo
8,"Mar 9, 2019",Master's,0,u71ghty,/company/Juniper/,Eng,/post/Yahoo-Software-Development-Engineer-NCG-Salary-TuD0ynHh,Yahoo
9,"Mar 9, 2019",NCG isn’t a position. What degree? Bachelors or Masters or PhD? That will dictate what level you start at.,0,xCWI25,/company/Yahoo/,SEND PRIVATE MESSAGE,/post/Yahoo-Software-Development-Engineer-NCG-Salary-TuD0ynHh,Yahoo
0,"Sep 27, 2017",I used to work at Yahoo and use it. Been used for more than 10 years internally with the company and has had multiple iterations. Well battle tested.,6,u4hdi4,/company/Amazon/,SEND PRIVATE MESSAGE,/post/Anyone-use-Yahoo-Vespa-RWgEkNLj,Yahoo
1,"Sep 27, 2017",This is an amazing piece of tech. Extremely well battle tested. Used it for several years. I would recommend it without any qualifications.,4,hBCl85,/company/Yahoo/,SEND PRIVATE MESSAGE,/post/Anyone-use-Yahoo-Vespa-RWgEkNLj,Yahoo
2,"Sep 27, 2017",Old yahoo here who worked on sports.  This reads like the container stuff we used behind yql and then later on yql+ got rebranded.  Sports plus fantasy sports served up to 40k requests a second.  It is not really AI though.  You had to program the queries correctly. This sounds like some crazy branding.  Other yahoos wanna chime in?,3,ILoveOhana,/company/Salesforce/,SEND PRIVATE MESSAGE,/post/Anyone-use-Yahoo-Vespa-RWgEkNLj,Yahoo
3,"Sep 28, 2017",It’s not the best one but it’s definitely a decent one. I work with Sherpa and Vespa and the grid a lot,2,3xcus3M3,/company/Yahoo/,SEND PRIVATE MESSAGE,/post/Anyone-use-Yahoo-Vespa-RWgEkNLj,Yahoo
4,"Oct 1, 2017",What is your take on Sherpa?,0,dmcc37,/company/Yahoo/,SEND PRIVATE MESSAGE,/post/Anyone-use-Yahoo-Vespa-RWgEkNLj,Yahoo
5,"Oct 2, 2017",It destroys elasticsearch for traffic serving and elasticity. ES can’t do shards allocation correctly,2,Ufseuihfrt,/company/Yahoo/,SEND PRIVATE MESSAGE,/post/Anyone-use-Yahoo-Vespa-RWgEkNLj,Yahoo
0,"Aug 9, 2020","Yahoo Finance FTW, I occasionally get premium and balance portfolio",6,dreinstein,/company/Collins%20Aerospace/,SEND PRIVATE MESSAGE,/post/Do-you-still-use-Yahoo-products-aWiKGSGg,Yahoo
1,"Aug 9, 2020",Fantasy Sports,5,jhgdtu,/company/eBay/,SEND PRIVATE MESSAGE,/post/Do-you-still-use-Yahoo-products-aWiKGSGg,Yahoo
2,"Aug 9, 2020",Same,0,das 🥾 ,/company/Uber/,SEND PRIVATE MESSAGE,/post/Do-you-still-use-Yahoo-products-aWiKGSGg,Yahoo
3,"Aug 9, 2020",Haha. 👍,0,badabing!,nan,Consultant,/post/Do-you-still-use-Yahoo-products-aWiKGSGg,Yahoo
4,"Aug 9, 2020",They took off comments so no use for it,2,17302bna,/company/LinkedIn/,SEND PRIVATE MESSAGE,/post/Do-you-still-use-Yahoo-products-aWiKGSGg,Yahoo
5,"Aug 9, 2020",I don't even know how Yahoo survives these days... Seems like its hayday was in the 90s...,1,badabing!,nan,Consultant,/post/Do-you-still-use-Yahoo-products-aWiKGSGg,Yahoo
0,"Oct 12, 2018","Fuck my life I was ic3 at Yahoo with 4 yoe and 128 base, 40/3 rsuBut I would say take Walmart, Yahoo is doomed",5,yEdW78,/company/Apple/,SEND PRIVATE MESSAGE,/post/Yahoo-vs-Walmart-e-commerce---URGENT-Zky1BAVx,Yahoo
1,"Oct 12, 2018","There are a gazillion ic3s at yahoo., you can hint the org! I am guessing it's not ads",0,iGjB72,/company/Yahoo/,SEND PRIVATE MESSAGE,/post/Yahoo-vs-Walmart-e-commerce---URGENT-Zky1BAVx,Yahoo
2,"Oct 12, 2018","Not ads There is heavy nepotism at Yahoo. I have been there long enough to understand stuff. Anyways if you are in ads, get outta there coz bing 7 deal is going to trim ads org heavily. I started at 118 and only reached 128 in 4 years and that too because of promotion bump. Fuck yeah, bonuses slashed by 50% (2015) because company multiplier bangs you. I will be eager to know company multiple for 2018, don’t be surprised if its less than .7",0,yEdW78,/company/Apple/,SEND PRIVATE MESSAGE,/post/Yahoo-vs-Walmart-e-commerce---URGENT-Zky1BAVx,Yahoo
3,"Oct 12, 2018",Stay at ibm,3,shridar,/company/Google/,SEND PRIVATE MESSAGE,/post/Yahoo-vs-Walmart-e-commerce---URGENT-Zky1BAVx,Yahoo
4,"Oct 12, 2018","I think they are both on par. Yahoo is not a prestigious tech company but it is a tech company. Walmart is known to have a decent tech team and they bought Jet. Whichever you join, I bet you'll do a couple years and then go somewhere better. That being said, think I'd go with Sam's.",2,shridar,/company/Google/,SEND PRIVATE MESSAGE,/post/Yahoo-vs-Walmart-e-commerce---URGENT-Zky1BAVx,Yahoo
5,"Oct 12, 2018",Makes sens. Thanks a ton!,0,aloha!!,/company/IBM/,Other,/post/Yahoo-vs-Walmart-e-commerce---URGENT-Zky1BAVx,Yahoo
6,"Oct 12, 2018","You have to pay the toll. Tell us your offer, the IC level if you want answer.",4,Trumpster.,/company/Roku/,Eng,/post/Yahoo-vs-Walmart-e-commerce---URGENT-Zky1BAVx,Yahoo
7,"Oct 12, 2018",Trumpster. can you answer this:https://us.teamblind.com/s/oh0uYBrR,0,spidermann,/company/Ringcentral/,Eng,/post/Yahoo-vs-Walmart-e-commerce---URGENT-Zky1BAVx,Yahoo
8,"Oct 12, 2018","You should go to Walmart and ask for more RSU. Even if they said no, just take Walmart offer. Assuming you are looking to learn more, Walmart is relatively a better place.",1,Trumpster.,/company/Roku/,Eng,/post/Yahoo-vs-Walmart-e-commerce---URGENT-Zky1BAVx,Yahoo
9,"Oct 12, 2018",TC or GTFO,2,spidermann,/company/Ringcentral/,Eng,/post/Yahoo-vs-Walmart-e-commerce---URGENT-Zky1BAVx,Yahoo
10,"Oct 12, 2018",OP deserves IBM now! 😬,1,spidermann,/company/Ringcentral/,Eng,/post/Yahoo-vs-Walmart-e-commerce---URGENT-Zky1BAVx,Yahoo
11,"Oct 12, 2018",Edited. Please stop trolling and help if you can.,0,aloha!!,/company/IBM/,Other,/post/Yahoo-vs-Walmart-e-commerce---URGENT-Zky1BAVx,Yahoo
12,"Oct 12, 2018","Walmart is growing, yahoo shrinking. Surprised by the split!",4,🤓☕️⚡️,/company/Amazon/,SEND PRIVATE MESSAGE,/post/Yahoo-vs-Walmart-e-commerce---URGENT-Zky1BAVx,Yahoo
13,"Oct 12, 2018",Walmart++,1,JohnSnow🐲,/company/Microsoft/,Eng,/post/Yahoo-vs-Walmart-e-commerce---URGENT-Zky1BAVx,Yahoo
0,"Nov 18, 2018","Dude, check ur spelling",1,Asdfqwet,nan,nan,/post/Yahoo-Media-Monitization-team-4E6SX2E5,Yahoo
0,"Sep 19, 2017",Mail is the big one,2,TWXG28,/company/Yahoo/,SEND PRIVATE MESSAGE,/post/iOS-engineer-at-Yahoo-mkAyiy21,Yahoo
1,"Sep 19, 2017",Biggest,0,eanN64,/company/Yahoo/,Eng,/post/iOS-engineer-at-Yahoo-mkAyiy21,Yahoo
2,"Sep 19, 2017","Basically all product lines (Finance, Sports, News, Messenger...)",2,6js8,/company/Yahoo/,Eng,/post/iOS-engineer-at-Yahoo-mkAyiy21,Yahoo
3,"Sep 19, 2017",PM me if u want details,1,Og8fk6,/company/Yahoo/,Eng,/post/iOS-engineer-at-Yahoo-mkAyiy21,Yahoo
4,"Aug 1, 2019",Are you stillIn Yahoo,0,qutnav,/company/Telenav/,SEND PRIVATE MESSAGE,/post/iOS-engineer-at-Yahoo-mkAyiy21,Yahoo
5,"Sep 20, 2017",For an idea of apps head over to App Store and search for Yahoo to get a sense of products but there are engineering efforts and needs across them.,1,❗️,/company/Yahoo/,SEND PRIVATE MESSAGE,/post/iOS-engineer-at-Yahoo-mkAyiy21,Yahoo
6,"Sep 20, 2017",I use their apps daily. Fantasy is going well this year,1,datadicks,/company/Databricks/,Eng,/post/iOS-engineer-at-Yahoo-mkAyiy21,Yahoo
0,"Mar 9, 2016",Better unemployed than working at yahoo. Having Yahoo on resume would stink it up,2,JK4562,/company/Microsoft/,SEND PRIVATE MESSAGE,/post/Working-at-yahoo-qSfLB6GV,Yahoo
1,"Mar 10, 2016",I would hire an engineer from Yahoo anyday over Microsoft. Microsoft is not what it used to be. Most if the good engineers have jumped the ship.,1,DerekJeter,/company/Amazon/,SEND PRIVATE MESSAGE,/post/Working-at-yahoo-qSfLB6GV,Yahoo
2,"Mar 11, 2016","Microsoft is really not what it used to be. Satya's been a breath of fresh air. Personally 3 years ago I would have agreed and left. Today, I laugh at your assessment",0,JK4562,/company/Microsoft/,SEND PRIVATE MESSAGE,/post/Working-at-yahoo-qSfLB6GV,Yahoo
3,"Mar 10, 2016",Anything is better than unemployment though,4,homeless,/company/Yahoo/,SEND PRIVATE MESSAGE,/post/Working-at-yahoo-qSfLB6GV,Yahoo
4,"Mar 10, 2016",Just go ahead and delete that offer email. Trust me on this.,3,amblind,/company/Yahoo/,SEND PRIVATE MESSAGE,/post/Working-at-yahoo-qSfLB6GV,Yahoo
5,"Mar 9, 2016",I wouldn't. Go to a company that's trying to crack advertising like Snapchat or Pinterest.,3,fintech,/company/Facebook/,SEND PRIVATE MESSAGE,/post/Working-at-yahoo-qSfLB6GV,Yahoo
6,"Mar 9, 2016",Don't do it. There's no shortage of jobs out there. Yahoo is a sinking ship.,1,XBxw57,/company/Tumblr/,SEND PRIVATE MESSAGE,/post/Working-at-yahoo-qSfLB6GV,Yahoo
7,"Mar 9, 2016","How much is Tumblr separate from yahoo, if you don't mind me asking? Also a sinking ship? Or a buoy in the sea.",0,vey12,/company/Amazon/,SEND PRIVATE MESSAGE,/post/Working-at-yahoo-qSfLB6GV,Yahoo
0,"Nov 11, 2019","I don’t agree with “political shithole”. (At least not in the team I am). In fact, I like the culture much better than in other companies I have worked before.Regarding the interview, it’s no different than other companies in the Bay Area. System design is possible; depends on each interviewer. Good luck to the op!",1,HG10TW,/company/Verizon-Media/,Eng,/post/Yahoo-ads-onsite-wudN48G1,Yahoo
1,"Nov 11, 2019",Thank you!,0,keen🐥,/company/ADP/,SEND PRIVATE MESSAGE,/post/Yahoo-ads-onsite-wudN48G1,Yahoo
2,"Nov 11, 2019","Ic2 is new college grad with mastersShould be ic3Yahoo is political shitholeSource- ex yahooInterview is team based, no pattern",0,travel4les,/company/Apple/,SEND PRIVATE MESSAGE,/post/Yahoo-ads-onsite-wudN48G1,Yahoo
3,"Nov 19, 2019",Interviews are fine but there’s no consistency from team to team. Maybe your team sucked at it?IC2 don’t need to care about politics anyway.,0,divisible,/company/Yahoo/,SEND PRIVATE MESSAGE,/post/Yahoo-ads-onsite-wudN48G1,Yahoo
0,"Jul 18, 2018",yahoo-Inc email addresses don't exist anymore. We use @oath.com email addresses now.,4,53hu1deqv7,/company/Oath/,SEND PRIVATE MESSAGE,/post/Do-yahoo-employees-use-@yahoocom-email-address-oDsSUfAM,Yahoo
1,"Jul 22, 2018","@Tim'sCook, what is embarrassing? Can you clarify?",0,Lord Vader,/company/Yahoo/,SEND PRIVATE MESSAGE,/post/Do-yahoo-employees-use-@yahoocom-email-address-oDsSUfAM,Yahoo
2,"Jul 22, 2018","In blind world, working for yahoo or oath is considered embarrassing Lord Vader",0,QuickSort,/company/Yahoo/,SEND PRIVATE MESSAGE,/post/Do-yahoo-employees-use-@yahoocom-email-address-oDsSUfAM,Yahoo
3,"Jul 19, 2018","At work we use Gsuite due to security concerns...At home, the only people who use yahoo are 55+ - About the same demographic that does not know how to change its search engine to Google... ",5,Ilove2love,/company/Yahoo/,Sales,/post/Do-yahoo-employees-use-@yahoocom-email-address-oDsSUfAM,Yahoo
4,"Jul 19, 2018","Sooo, not true. But it’s nice that you think this.",0,$3B &%m,/company/Yahoo/,SEND PRIVATE MESSAGE,/post/Do-yahoo-employees-use-@yahoocom-email-address-oDsSUfAM,Yahoo
5,"Jul 19, 2018",I was not aware a 🤡 joined the conversation.,0,Ilove2love,/company/Yahoo/,Sales,/post/Do-yahoo-employees-use-@yahoocom-email-address-oDsSUfAM,Yahoo
