,comment_date,comment_text,comment_like,comment_user,comment_firm,comment_position,comment_url,company
0,4d,"Yahoo is sold , yet again, to private equity",0,teraf,nan,SEND PRIVATE MESSAGE,/post/How-would-you-improve-yahoo-finance-yahoo-sports-DawLOXQR,Yahoo
1,4d,Could be a good thing. They need to shake things up and make some big moves to stay relevant. Verizon wasn't doing them any favors,0,Husavik3,/company/Dell/,SEND PRIVATE MESSAGE,/post/How-would-you-improve-yahoo-finance-yahoo-sports-DawLOXQR,Yahoo
2,4d,By selling these properties to Google!,0,DzJn23,/company/Google/,Eng,/post/How-would-you-improve-yahoo-finance-yahoo-sports-DawLOXQR,Yahoo
3,4d,Tell Sundar,0,yOjl47,/company/Yahoo/,SEND PRIVATE MESSAGE,/post/How-would-you-improve-yahoo-finance-yahoo-sports-DawLOXQR,Yahoo
4,4d,"Cut down on the ads. Yahoo mail is obnoxious and every time I get called by family members to help them use it, it's 5x worse.I'm sure they'll soon find a way to put ads in imap access too.",0,Xlnv45,/company/Apple/,SEND PRIVATE MESSAGE,/post/How-would-you-improve-yahoo-finance-yahoo-sports-DawLOXQR,Yahoo
0,2d,Love it! Best part is the amount of data that’s available,1,VYJa45,/company/Verizon-Media/,SEND PRIVATE MESSAGE,/post/Thoughts-on-Yahoo-Finance-QCyOcugS,Yahoo
1,2d,Totally agree. What would you improve about it?,0,Husavik3,/company/Dell/,SEND PRIVATE MESSAGE,/post/Thoughts-on-Yahoo-Finance-QCyOcugS,Yahoo
2,Yesterday,taller paywall,0,myMgrSucks,/company/Oath/,SEND PRIVATE MESSAGE,/post/Thoughts-on-Yahoo-Finance-QCyOcugS,Yahoo
3,2h,"Also, what do you think of Yahoo Finance becoming its own brokerage like robinhood? Or partnering with the brokerages to allow trades to occur within the Yahoo Finance app?",0,ButtCoin2m,/company/Dell/,SEND PRIVATE MESSAGE,/post/Thoughts-on-Yahoo-Finance-QCyOcugS,Yahoo
4,4m,"it’s bad for the customer and reasonable move for the new owner, YF won’t provide the same similar or even better trading exp, that’s not what the new owner wants YF to be",0,myMgrSucks,/company/Oath/,SEND PRIVATE MESSAGE,/post/Thoughts-on-Yahoo-Finance-QCyOcugS,Yahoo
0,May 13,Don’t go there now. Shit show after private capital deal.,3,ICUseless,/company/Yahoo/,SEND PRIVATE MESSAGE,/post/Yahoo-recruiter-hasnt-replied-for-scheduling-phone-call-2qf0qbPZ,Yahoo
1,May 13,"sure, but at this point it’s all guesswork. we just know which groups make money that have a better shot",0,ICUseless,/company/Yahoo/,SEND PRIVATE MESSAGE,/post/Yahoo-recruiter-hasnt-replied-for-scheduling-phone-call-2qf0qbPZ,Yahoo
2,May 14,So which groups do make money?,0,ehk366,nan,SEND PRIVATE MESSAGE,/post/Yahoo-recruiter-hasnt-replied-for-scheduling-phone-call-2qf0qbPZ,Yahoo
3,May 13,Chill. Most tech recruiters say nothing until they send the meeting invite 24 hours before the day it’s scheduled for.,3,!Included,/company/Microsoft/,SEND PRIVATE MESSAGE,/post/Yahoo-recruiter-hasnt-replied-for-scheduling-phone-call-2qf0qbPZ,Yahoo
4,May 13,You're a Yahoo for applying to Yahoo,1,git out -f,/company/Cisco/,SEND PRIVATE MESSAGE,/post/Yahoo-recruiter-hasnt-replied-for-scheduling-phone-call-2qf0qbPZ,Yahoo
5,May 13,I am surprised you have engagement. Hiring is tight with the sale ongoing. What did you apply for?,0,lurker3210,/company/Yahoo/,SEND PRIVATE MESSAGE,/post/Yahoo-recruiter-hasnt-replied-for-scheduling-phone-call-2qf0qbPZ,Yahoo
6,May 13,"It’s only been two days (plus/minus a few hours), give them 3-5 working days and then follow up.",0,tuckfrumpp,/company/Micron-Technology/,SEND PRIVATE MESSAGE,/post/Yahoo-recruiter-hasnt-replied-for-scheduling-phone-call-2qf0qbPZ,Yahoo
0,Mar 11,"Never underestimate WLB. If you’re already paid well enough, or have a solid trajectory at your existing place of work, to do what you love in life, why care about your resume?",5,Road Head,/company/Lyft/,SEND PRIVATE MESSAGE,/post/Should-I-leave-Yahoo-or-stay-0PGthiSa,Yahoo
1,Mar 11,"Are you in bay area? Try Microsoft, you will get both TC and WLB.",0,79ng5e x j,/company/Microsoft/,SEND PRIVATE MESSAGE,/post/Should-I-leave-Yahoo-or-stay-0PGthiSa,Yahoo
2,Mar 11,"yes, is linkedin considered MSFT?",0,yOjl47,/company/Yahoo/,SEND PRIVATE MESSAGE,/post/Should-I-leave-Yahoo-or-stay-0PGthiSa,Yahoo
3,Mar 11,You didn’t not provide enough info...TC/age/role/location etc are all variables needed to make a call,4,nsIA64,/company/Verizon/,SEND PRIVATE MESSAGE,/post/Should-I-leave-Yahoo-or-stay-0PGthiSa,Yahoo
4,Mar 11,"Go to FAANG, except for Amazon",1,FIRESoon,/company/Google/,SEND PRIVATE MESSAGE,/post/Should-I-leave-Yahoo-or-stay-0PGthiSa,Yahoo
5,Mar 11,"Op, how are we supposed to give you an advice if you haven’t provided any details besides “I work for yahoo and (I think) have good WLB”.Are you sure you can get anywhere else? Do you have offers? What’s their TC? What TC you have? What TC your aiming for? What’s your role? What do you want in the long run in terms of career trajectory?",0,xDesi,/company/Amazon/,Eng,/post/Should-I-leave-Yahoo-or-stay-0PGthiSa,Yahoo
6,Mar 11,"now: 280k, happy at: 350k, no idea unless I try but seems folks from here are able to move. no offers but recruiters reaching out - I feel once I start with my foot out the door, I'm likely to leave. product. want to lead a team, potentially do a startup in some future later.",0,yOjl47,/company/Yahoo/,SEND PRIVATE MESSAGE,/post/Should-I-leave-Yahoo-or-stay-0PGthiSa,Yahoo
7,Mar 11,Just reminiscing how working at Yahoo 15-20 years would be prestigious.,0,$DataDog,nan,SEND PRIVATE MESSAGE,/post/Should-I-leave-Yahoo-or-stay-0PGthiSa,Yahoo
0,Apr 28,Who still uses yahoo and aol?,2,byetimmy,/company/Splunk/,SEND PRIVATE MESSAGE,/post/Verizon-considering-selling-Yahoo-and-AOL-report-says-R6ZFcKUx,Yahoo
1,Apr 28,"I still you use yahoo email, and as my news homepage. Hell, I was a paying customer up until a couple years ago (so I'm not too smart)",0,frostier,/company/Expedia/,SEND PRIVATE MESSAGE,/post/Verizon-considering-selling-Yahoo-and-AOL-report-says-R6ZFcKUx,Yahoo
2,Apr 29,Lots of people. They just don’t overlap with Blind users.,2,zcUT74,/company/Facebook/,SEND PRIVATE MESSAGE,/post/Verizon-considering-selling-Yahoo-and-AOL-report-says-R6ZFcKUx,Yahoo
3,Apr 28,Lol 😂 no one will buy,2,dhrbfosie,/company/Microsoft/,SEND PRIVATE MESSAGE,/post/Verizon-considering-selling-Yahoo-and-AOL-report-says-R6ZFcKUx,Yahoo
4,Apr 28,"Facebook can buy to increase its market share. As such, it is losing its battle to Apple.",1,VGjY81,/company/Verizon/,SEND PRIVATE MESSAGE,/post/Verizon-considering-selling-Yahoo-and-AOL-report-says-R6ZFcKUx,Yahoo
5,Apr 28,Ya hoo?,1,GIwk36,/company/ZipRecruiter/,SEND PRIVATE MESSAGE,/post/Verizon-considering-selling-Yahoo-and-AOL-report-says-R6ZFcKUx,Yahoo
6,Apr 28,Yahoo and AOL is quite a data gold mine.,0,Uigh,/company/LinkedIn/,SEND PRIVATE MESSAGE,/post/Verizon-considering-selling-Yahoo-and-AOL-report-says-R6ZFcKUx,Yahoo
7,Apr 28,Yes all the Yahoo data is on hadoop,0,10 GOTO 10,/company/Microsoft/,SEND PRIVATE MESSAGE,/post/Verizon-considering-selling-Yahoo-and-AOL-report-says-R6ZFcKUx,Yahoo
0,Apr 29,Probably Microsoft.Their ad business is practically dependent on VZ. And we are just as pathetic.,1,Bork14,/company/Microsoft/,SEND PRIVATE MESSAGE,/post/Is-Yahoo-for-sale-again-Any-potential-buyers-EDeGw8dj,Yahoo
1,Apr 29,*crickets*,1,byetimmy,/company/Splunk/,SEND PRIVATE MESSAGE,/post/Is-Yahoo-for-sale-again-Any-potential-buyers-EDeGw8dj,Yahoo
2,May 3,Apollo!,0,rushsem,nan,Finance,/post/Is-Yahoo-for-sale-again-Any-potential-buyers-EDeGw8dj,Yahoo
3,Apr 29,Wouldn’t it be good for yahoo employees if we become part of the Microsoft group ????,0,YA1101,/company/Verizon-Media/,SEND PRIVATE MESSAGE,/post/Is-Yahoo-for-sale-again-Any-potential-buyers-EDeGw8dj,Yahoo
0,Mar 18,"Interviews are team org-specific. I, for instance, have no idea what's that second round you're talking about - in my org there's only one round. You may get better info if you specify what org are you interviewing at.",0,hatchling,/company/Oath/,SEND PRIVATE MESSAGE,/post/Verizon-media-yahoo-SWE-internship-interview-pEWgDVUa,Yahoo
1,Mar 18,I’m interviewing for Verizon media and the team works on content/personalisation platform for yahoo.,0,lazyaf,nan,SEND PRIVATE MESSAGE,/post/Verizon-media-yahoo-SWE-internship-interview-pEWgDVUa,Yahoo
0,Yesterday,Dm me for a VMware referral. Location and role?,1,sm64jy,/company/VMware/,SEND PRIVATE MESSAGE,/post/Looking-for-referrals-vwmZqQ5a,Yahoo
1,11h,Can I dm you as well ? India MTS 1 i have found the job id already,0,ifsegb,/company/American-Express/,SEND PRIVATE MESSAGE,/post/Looking-for-referrals-vwmZqQ5a,Yahoo
2,10h,Please do,0,sm64jy,/company/VMware/,SEND PRIVATE MESSAGE,/post/Looking-for-referrals-vwmZqQ5a,Yahoo
3,Yesterday,HelloI am at Salesforce IndiaIf you want referral then dm me,1,NYCt84,/company/Salesforce/,SEND PRIVATE MESSAGE,/post/Looking-for-referrals-vwmZqQ5a,Yahoo
4,Yesterday,Thank you. Can you refer me to San Francisco location?,0,SystDesign,/company/Microsoft/,SEND PRIVATE MESSAGE,/post/Looking-for-referrals-vwmZqQ5a,Yahoo
5,9h,Yes I can refer you at San Francisco location But don’t know what shall I say to the recruiter how do you know meWhat is your current location?,0,NYCt84,/company/Salesforce/,SEND PRIVATE MESSAGE,/post/Looking-for-referrals-vwmZqQ5a,Yahoo
6,Yesterday,Dm for Cisco,1,G~~~,/company/Cisco/,SEND PRIVATE MESSAGE,/post/Looking-for-referrals-vwmZqQ5a,Yahoo
7,Yesterday,"Thank you, DM’d",0,SystDesign,/company/Microsoft/,SEND PRIVATE MESSAGE,/post/Looking-for-referrals-vwmZqQ5a,Yahoo
8,Yesterday,DM for Instacart. Lots of open roles and actively hiring,1,cartinsta,/company/Instacart/,SEND PRIVATE MESSAGE,/post/Looking-for-referrals-vwmZqQ5a,Yahoo
9,Yesterday,"Sure, thank you. Dm’ed",0,SystDesign,/company/Microsoft/,SEND PRIVATE MESSAGE,/post/Looking-for-referrals-vwmZqQ5a,Yahoo
10,Yesterday,"DM for FB.Also, whats your current role and yoe?",1,uTGi51,/company/Facebook/,SEND PRIVATE MESSAGE,/post/Looking-for-referrals-vwmZqQ5a,Yahoo
11,Yesterday,"I am swe in Microsoft, 8 yoe. DM’d, thank you",0,SystDesign,/company/Microsoft/,SEND PRIVATE MESSAGE,/post/Looking-for-referrals-vwmZqQ5a,Yahoo
0,Mar 30,What if you need to return the car? Will they give you dollars or BTC back? Probably whichever is lower. Why not sell BTC to dollars then buy car with dollars.,4,checkcall1,/company/Facebook/,SEND PRIVATE MESSAGE,/post/Should-I-buy-a-car-with-coins-ViC7yzk8,Yahoo
1,Apr 23,It’s like trying to buy a car directly with stocks. That’ll incur in capital gain taxes as well. It seems too messy to me.,1,notPatrick,/company/Stripe/,Eng,/post/Should-I-buy-a-car-with-coins-ViC7yzk8,Yahoo
2,Apr 25,Buying Tesla with btc is 100% taxable. It is very messy and I don’t recommend doing that.,1,TFGA40,/company/Microsoft/,SEND PRIVATE MESSAGE,/post/Should-I-buy-a-car-with-coins-ViC7yzk8,Yahoo
3,Mar 30,"Buy BTC with fiat, then immediately buy the car to avoid capital gains.Since TSLA HODL’s the bitcoin, you’ve just succeeded in taking more bitcoin off the market and into strong hands",1,vishnj ,/company/Cisco/,SEND PRIVATE MESSAGE,/post/Should-I-buy-a-car-with-coins-ViC7yzk8,Yahoo
4,Apr 12,"Yeah.  Great move for Tesla, but financially imprudent for consumers.",0,hellok8s,/company/Two-Sigma/,SEND PRIVATE MESSAGE,/post/Should-I-buy-a-car-with-coins-ViC7yzk8,Yahoo
5,Apr 12,"If you're bullish on BTC, you're also somewhat bearish on DXY. Why would you buy a car with an asset that (1) you believe will appreciate in value and (2) incurs a capital gains penalty.The play would be to borrow dollars at lowish rates, to buy the Tesla",0,hellok8s,/company/Two-Sigma/,SEND PRIVATE MESSAGE,/post/Should-I-buy-a-car-with-coins-ViC7yzk8,Yahoo
6,Mar 30,Only buy with Dogecoin 🚀🚀🐕🐕😤😤🐕🐕🚀🚀,8,Doiy40,nan,SEND PRIVATE MESSAGE,/post/Should-I-buy-a-car-with-coins-ViC7yzk8,Yahoo
7,Mar 30,Would their be capital gains tax if the car is purchased using BTC?,4,onta31,/company/Yext/,SEND PRIVATE MESSAGE,/post/Should-I-buy-a-car-with-coins-ViC7yzk8,Yahoo
8,Mar 30,I would think there are cap gains no matter what.  There would have to be a specific loophole like there is when you sell a house and buy another within x days.,1,MacKs9,/company/Affirm/,SEND PRIVATE MESSAGE,/post/Should-I-buy-a-car-with-coins-ViC7yzk8,Yahoo
9,Mar 31,"There is capital gains no matter what. There is no like for like in crypto, that was made clear 4 years ago in the US. So even BTC to Bitcoin cash is taxable.",2,checkcall1,/company/Facebook/,SEND PRIVATE MESSAGE,/post/Should-I-buy-a-car-with-coins-ViC7yzk8,Yahoo
10,Mar 30,"I wonder if it saves your tax money when you buy a Tesla in BTC, instead of trading BTC to USD (+capital gain).I've purchased tangible products and paid with BTC years ago (when BTC was around $1k. It was a mistake) and didn't get any tax paper for the transactions.",0,TFtr50,/company/Microsoft/,SEND PRIVATE MESSAGE,/post/Should-I-buy-a-car-with-coins-ViC7yzk8,Yahoo
11,Apr 8,"@checkcall1: I dont own BTC but when I file taxes, they only asked me if I sold BTC but not if I converted it to something else.I understand that we are supposed to pay taxes on anything that you buy but don't think the wording while taxes is so clear about crypto.",0,upxm26,/company/Lyft/,SEND PRIVATE MESSAGE,/post/Should-I-buy-a-car-with-coins-ViC7yzk8,Yahoo
12,Apr 8,Converting it is the same as selling from a tax perspective. TurboTax or whatever you are using to file should be more clear forsure. But that doesn’t absolve you.,2,checkcall1,/company/Facebook/,SEND PRIVATE MESSAGE,/post/Should-I-buy-a-car-with-coins-ViC7yzk8,Yahoo
0,Yesterday,"Yes, there are bots that can do that for you but have you considered writing code yourself?You could ask in http://discord.gg/rdGNaa2AzD ( personal finance chat), many people are fans of APIs to just do this themselves",1,archieneme,/company/Google/,Eng,/post/Receive-alert-when-option-price-reaches-a-level-iXT6ag2b,Yahoo
1,Yesterday,"Ya, I can write code. Is there a API for this?",0,longcall12,/company/Salesforce/,SEND PRIVATE MESSAGE,/post/Receive-alert-when-option-price-reaches-a-level-iXT6ag2b,Yahoo
2,Yesterday,"(answered in discord, but tldr: yes, think or swim, IB and appscript)",1,archieneme,/company/Google/,Eng,/post/Receive-alert-when-option-price-reaches-a-level-iXT6ag2b,Yahoo
3,Yesterday,Why not a limit order?,1,Sabkir,/company/Google/,SEND PRIVATE MESSAGE,/post/Receive-alert-when-option-price-reaches-a-level-iXT6ag2b,Yahoo
4,Yesterday,"Robinhood doesn’t support order cancelling order. I want to sell when price reaches either 4$(profit) or 3$(loss). Because Robinhood doesn’t support it, I am looking for alerts. Once I get alert, I will place order manually.",0,longcall12,/company/Salesforce/,SEND PRIVATE MESSAGE,/post/Receive-alert-when-option-price-reaches-a-level-iXT6ag2b,Yahoo
5,Yesterday,Thanks. Is it available for free or need to be a paid member?,0,longcall12,/company/Salesforce/,SEND PRIVATE MESSAGE,/post/Receive-alert-when-option-price-reaches-a-level-iXT6ag2b,Yahoo
6,Yesterday,You can set alerts in Webull but you’ll need to calculate the option price yourself,0,borgg,/company/Plaid/,SEND PRIVATE MESSAGE,/post/Receive-alert-when-option-price-reaches-a-level-iXT6ag2b,Yahoo
0,Mar 3,"I think it’s a solid buy. I heard the entire earnings call yesterday and it was solid, no complaints whatsoever.",4,6Feet6Inch,/company/Google/,Eng,/post/Is-FUBO-a-buy-1ZGpAkw8,Yahoo
1,Mar 3,These days solid tech earnings = 📉Should have bought an okta put 😡,1,40 GLOCC,/company/Microsoft/,Cust. Srv.,/post/Is-FUBO-a-buy-1ZGpAkw8,Yahoo
2,Mar 3,Took the plunge while with firesale lasts!,1,Big-Four,/company/PwC/,SEND PRIVATE MESSAGE,/post/Is-FUBO-a-buy-1ZGpAkw8,Yahoo
3,Mar 4,Good thing I didn’t buy it yesterday,0,fubo$,/company/Apple/,SEND PRIVATE MESSAGE,/post/Is-FUBO-a-buy-1ZGpAkw8,Yahoo
4,Mar 4,You gotta DCA even if you did. No point in trying to time the bottom.,0,6Feet6Inch,/company/Google/,Eng,/post/Is-FUBO-a-buy-1ZGpAkw8,Yahoo
5,Mar 3,Their business model scares me.,0,ponypnypny,/company/Pony.ai/,SEND PRIVATE MESSAGE,/post/Is-FUBO-a-buy-1ZGpAkw8,Yahoo
6,Mar 3,Buy leaps. Fubo's ER was actually good. The market is astable to play weeklies. Go for leaps and high volume growth stocks,0,TC.Slut,/company/Microsoft/,SEND PRIVATE MESSAGE,/post/Is-FUBO-a-buy-1ZGpAkw8,Yahoo
0,Mar 23,It is always better to enter as a manager. No exception. Everywhere.,10,chsifheos,/company/Oracle/,SEND PRIVATE MESSAGE,/post/better-to-get-in-to-FB-as-a-manager-or-an-IC-rUuAUwxn,Yahoo
1,Mar 24,any reason why?,0,yOjl47,/company/Yahoo/,SEND PRIVATE MESSAGE,/post/better-to-get-in-to-FB-as-a-manager-or-an-IC-rUuAUwxn,Yahoo
2,Mar 24,Definitely manager,2,RoiXL,/company/Facebook/,Product,/post/better-to-get-in-to-FB-as-a-manager-or-an-IC-rUuAUwxn,Yahoo
3,Mar 24,any reason why? are there openings for manager?,0,yOjl47,/company/Yahoo/,SEND PRIVATE MESSAGE,/post/better-to-get-in-to-FB-as-a-manager-or-an-IC-rUuAUwxn,Yahoo
4,Mar 23,"Wow, Yahoo still exists? Seriously though, jump ship asap, yahoo must be toxic on the resume nowadays (unless it's an old exp)",0,kuwabara,/company/Lyft/,SEND PRIVATE MESSAGE,/post/better-to-get-in-to-FB-as-a-manager-or-an-IC-rUuAUwxn,Yahoo
5,Mar 23,trying to get out,0,yOjl47,/company/Yahoo/,SEND PRIVATE MESSAGE,/post/better-to-get-in-to-FB-as-a-manager-or-an-IC-rUuAUwxn,Yahoo
0,Apr 8,Any update on this? You get an interview?,0,Doge2m00n,/company/Dell/,Strategy,/post/APM-referral-Verizon-Media-NZBurpnO,Yahoo
0,May 13,"It’s alive only because of some Indian users. I still remember, they used to ban or take down many responses unnecessarily. Their policy makers are little disappointing",10,Beyblader,nan,Eng,/post/How-is-Quora-still-alive-BDnEwfsW,Yahoo
1,May 13,"Of course Quora used to be good , back in 2013 it was refreshing and obviously new",1,Beyblader,nan,Eng,/post/How-is-Quora-still-alive-BDnEwfsW,Yahoo
2,May 14,"There's a lot of political bs that happens there and weird moderation that removes posts, comments -- even when there weren't political.",0,frankUW,/company/Citi/,SEND PRIVATE MESSAGE,/post/How-is-Quora-still-alive-BDnEwfsW,Yahoo
3,May 13,What you should do is visit myquoracompetitor.com the provide all of the benefits of quora without any of the negatives.Desclaimer I am founder of myquoracompetitor.com,28,oneeyeman,/company/JPMorgan/,SEND PRIVATE MESSAGE,/post/How-is-Quora-still-alive-BDnEwfsW,Yahoo
4,May 13,"The answers on Quora are like Ted talks:: overthought, long-winded, and most of the time they aren't even correct. They just get upvoted for being clever or told with some weird-ass analogy.",23,laprofesso,/company/GE/,SEND PRIVATE MESSAGE,/post/How-is-Quora-still-alive-BDnEwfsW,Yahoo
5,May 13,It used to be pretty good like even 4-5 years ago. Thr policies killed it.,8,Hammerklav,/company/Microsoft/,SEND PRIVATE MESSAGE,/post/How-is-Quora-still-alive-BDnEwfsW,Yahoo
6,May 13,"Second was the no agression policy or something like that, basically if someone is spewing dogshit on every answer, you can't comment that the answer is dogshit",6,Hammerklav,/company/Microsoft/,SEND PRIVATE MESSAGE,/post/How-is-Quora-still-alive-BDnEwfsW,Yahoo
7,May 13,This led to bad answers being up there and good samartians being banned,3,Hammerklav,/company/Microsoft/,SEND PRIVATE MESSAGE,/post/How-is-Quora-still-alive-BDnEwfsW,Yahoo
8,May 13,Quora is another cringe social networking site like TikTok ...No offense to you OP,6,🐈Meow🐈,/company/Intuit/,SEND PRIVATE MESSAGE,/post/How-is-Quora-still-alive-BDnEwfsW,Yahoo
9,May 13,"Yes, TikTok has many cringe vids, but it also has entertaining and funny videos. And a lot of good OC, half of /r/all is just TikTok reposts these days (with the watermark cropped out because edgy Redditors can’t admit they like TikTok). A lot of people enjoy TikTok and find it refreshing and addicting, especially compared to other social networks.But does anyone enjoy Quora? The experience is just bad. TikTok’s value proposition is clear as day, but I can genuinely not understand Quora’s long term business plan. That is where my question lies.",9,frGj56,/company/Tiktok/,SEND PRIVATE MESSAGE,/post/How-is-Quora-still-alive-BDnEwfsW,Yahoo
10,May 13,Curate the contect and personalize for users and sell ads.,0,PJxG70,/company/Microsoft/,Eng,/post/How-is-Quora-still-alive-BDnEwfsW,Yahoo
0,Mar 19,Jeez. You are just at start of your career son.Don’t be so melodramatic. You have lots of time to pick up and start.,59,crueIla,/company/Roku/,SEND PRIVATE MESSAGE,/post/I-feel-like-my-career-has-already-been-killed-How-can-I-save-myself-s0JQfhXT,Yahoo
1,Mar 19,"Wow a wholesome post on blind, wtf is going on",5,ow7b?&$,/company/Amazon/,SEND PRIVATE MESSAGE,/post/I-feel-like-my-career-has-already-been-killed-How-can-I-save-myself-s0JQfhXT,Yahoo
2,Mar 19,Cruella 🥰,0,V_Proud,/company/VMware/,SEND PRIVATE MESSAGE,/post/I-feel-like-my-career-has-already-been-killed-How-can-I-save-myself-s0JQfhXT,Yahoo
3,Mar 19,The only thing that matters is LC in an interview. I had a few patents which has 0 value if you can’t solve a Dijkstra’s algorithm in an interview.🐘,40,V_Proud,/company/VMware/,SEND PRIVATE MESSAGE,/post/I-feel-like-my-career-has-already-been-killed-How-can-I-save-myself-s0JQfhXT,Yahoo
4,Mar 21,"Not really, the bar is crazy high nowadays. They can fail you for many reasons, experience, behavior & thinking process, some random knowledge in design. Even tiny mistake made in problem clarification and testing cases can fail you. Dijkstra is not that hard comparing to those weird lc problems solved by non-algorithm based method.",0,mJfl84,/company/Microsoft/,SEND PRIVATE MESSAGE,/post/I-feel-like-my-career-has-already-been-killed-How-can-I-save-myself-s0JQfhXT,Yahoo
5,Mar 22,Dude I meant like an example man.,1,V_Proud,/company/VMware/,SEND PRIVATE MESSAGE,/post/I-feel-like-my-career-has-already-been-killed-How-can-I-save-myself-s0JQfhXT,Yahoo
6,Mar 19,"Well believe it or not, your career is just started with 3.5 YOE, LC 😊",26,BetaBet,/company/Google/,SEND PRIVATE MESSAGE,/post/I-feel-like-my-career-has-already-been-killed-How-can-I-save-myself-s0JQfhXT,Yahoo
7,Mar 19,Agreed,0,qwertyqq,/company/Zions-Bancorporation/,SEND PRIVATE MESSAGE,/post/I-feel-like-my-career-has-already-been-killed-How-can-I-save-myself-s0JQfhXT,Yahoo
8,Mar 19,Switch team?,13,only fans,/company/Microsoft/,SEND PRIVATE MESSAGE,/post/I-feel-like-my-career-has-already-been-killed-How-can-I-save-myself-s0JQfhXT,Yahoo
9,Mar 19,"Dude, 3.5 YoE and think you ruined your career? You barely have one! Grow up!",9,unwanted,/company/Carta/,SEND PRIVATE MESSAGE,/post/I-feel-like-my-career-has-already-been-killed-How-can-I-save-myself-s0JQfhXT,Yahoo
10,Mar 19,Really liked this,0,zombie tyu,/company/Amazon/,SEND PRIVATE MESSAGE,/post/I-feel-like-my-career-has-already-been-killed-How-can-I-save-myself-s0JQfhXT,Yahoo
11,Mar 20,And is at MSFT with 180k TC....,3,modernopS,/company/Amazon/,SEND PRIVATE MESSAGE,/post/I-feel-like-my-career-has-already-been-killed-How-can-I-save-myself-s0JQfhXT,Yahoo
0,Mar 16,UI engineers are in more demand because there's less good ones in the market (not including bootcamp kids with no experience).There being less UI engineers is a double edged sword. Less political weight as you'll be outnumbered by backend SDE so it'll be harder to have an upward trajectory.Pay will be the same as SDE.Ignore those saying back end is harder. It's all relative to the space you're in. Creating a chat room with web workers will be harder  than pushing pixels on a marketing site.,10,GeofBezmo,/company/Amazon/,SEND PRIVATE MESSAGE,/post/Career-of-a-FrontendUI-engineer-TR4Tnuc8,Yahoo
1,Mar 16,UI is easy ..... and use fake programming languages like JavaScript ..... LOL jk. I think UI/UX just have less demand than backend.,4,AprilLJ,/company/Amazon/,Eng,/post/Career-of-a-FrontendUI-engineer-TR4Tnuc8,Yahoo
2,Mar 16,"Not sure but we have FEE as a specialization.... honestly I personally don’t see much a difference but fronted ultimately has less challenges than backend simply due to scope. I suppose you can now include AR/VR as front end too but that’s basically backend ... cuz it’s not JS, CSS or HTML. To clearly answer, no, I don’t see a diff.",2,AprilLJ,/company/Amazon/,Eng,/post/Career-of-a-FrontendUI-engineer-TR4Tnuc8,Yahoo
3,Mar 16,"AprilLJ, right. I see Amazon's UI to be extremely amazing.",1,leeetchod,/company/Informatica/,R&D,/post/Career-of-a-FrontendUI-engineer-TR4Tnuc8,Yahoo
4,Mar 16,"Yes, I think UI growth is limited. Speaking as a frontender.However being a pure backender also limits projects you can lead plus since there are so many backenders you have a harder time competing for meaningful projects . IMO",6,bGex62,/company/Atlassian/,SEND PRIVATE MESSAGE,/post/Career-of-a-FrontendUI-engineer-TR4Tnuc8,Yahoo
5,Mar 16,"I see, so when do you think UI folks would hit a limit? At UI3 level or staff engineer level or some other level?In my company I don't see UI folks to become directors, the max I saw is till manager, but only a few.A few more in staff level, but with quite some experience say about 10-12 yrs.",0,qzxz76,/company/Flipkart/,SEND PRIVATE MESSAGE,/post/Career-of-a-FrontendUI-engineer-TR4Tnuc8,Yahoo
6,Mar 16,I see staff level frontenders but they are usually full stack to some degree. (Which makes sense.),0,bGex62,/company/Atlassian/,SEND PRIVATE MESSAGE,/post/Career-of-a-FrontendUI-engineer-TR4Tnuc8,Yahoo
7,Mar 16,I have seen teams that is full of UI engineers.,2,leeetchod,/company/Informatica/,R&D,/post/Career-of-a-FrontendUI-engineer-TR4Tnuc8,Yahoo
8,Mar 16,"Yeah, actually in flipkart as well we have some teams full of UI/apps folks, but there are other teams which has mostly SDEs.Like teams usually have about 12 SDEs to 2 UI folks, and I belong to one such team and have observed this trend.",0,qzxz76,/company/Flipkart/,SEND PRIVATE MESSAGE,/post/Career-of-a-FrontendUI-engineer-TR4Tnuc8,Yahoo
