,comment_date,comment_text,comment_like,comment_user,comment_firm,comment_position,comment_url,company
5,"Nov 10, 2020",Yahoo defunct,0,wHgS47,/company/Cisco/,SEND PRIVATE MESSAGE,/post/Any-salary-data-points-on-principal-production-engineer-at-yahooverizon-in-bay-area-330ZEu7K,Yahoo
0,"Mar 16, 2016",Flurry analytics? Meant for mobile app analytics right? I don't have experience but I've heard good things,2,AaET63,/company/Adobe/,SEND PRIVATE MESSAGE,/post/What-do-you-know-about-Flurry-acquired-by-Yahoo-RKixF1ss,Yahoo
1,"Mar 17, 2016","Its the most used in-app analytics platform on iOS apps, and second for Android apps after Google Analyics",1,xtKF32,/company/Yahoo/,SEND PRIVATE MESSAGE,/post/What-do-you-know-about-Flurry-acquired-by-Yahoo-RKixF1ss,Yahoo
2,"Mar 17, 2016","It used to be the best mobile analytics platform. If you've made a mobile app, you know about it",1,cortex,/company/Microsoft/,SEND PRIVATE MESSAGE,/post/What-do-you-know-about-Flurry-acquired-by-Yahoo-RKixF1ss,Yahoo
3,"Mar 16, 2016",Never heard of it,0,bitter,/company/Yelp/,Eng,/post/What-do-you-know-about-Flurry-acquired-by-Yahoo-RKixF1ss,Yahoo
0,"Jul 26, 2016",Host your own email server dude,2,cortex,/company/Microsoft/,SEND PRIVATE MESSAGE,/post/Whats-the-best-free-email-service-now-that-yahoo-is-sold-ZgqsDWHB,Yahoo
1,"Jul 26, 2016","Nice try, Hilary Clinton!",8,•,/company/Amazon/,SEND PRIVATE MESSAGE,/post/Whats-the-best-free-email-service-now-that-yahoo-is-sold-ZgqsDWHB,Yahoo
2,"Jul 26, 2016",Don't know what you guys are fussing about. It's a pretty common practice here at the state department,4,cortex,/company/Microsoft/,SEND PRIVATE MESSAGE,/post/Whats-the-best-free-email-service-now-that-yahoo-is-sold-ZgqsDWHB,Yahoo
3,"Jul 26, 2016",Using Yahoo email is like going to Vegas to find peace and solitude.,9,UMWv70,/company/VMware/,SEND PRIVATE MESSAGE,/post/Whats-the-best-free-email-service-now-that-yahoo-is-sold-ZgqsDWHB,Yahoo
4,"Jul 26, 2016",+1,0,noevilstar,/company/Yahoo/,SEND PRIVATE MESSAGE,/post/Whats-the-best-free-email-service-now-that-yahoo-is-sold-ZgqsDWHB,Yahoo
5,"Jul 26, 2016",Outlook.com is my current favorite.,5,Oracledude,/company/Oracle/,SEND PRIVATE MESSAGE,/post/Whats-the-best-free-email-service-now-that-yahoo-is-sold-ZgqsDWHB,Yahoo
6,"Jul 26, 2016",Outlook.com is great if you have AdBlock installed...,0,UqdL34,/company/Microsoft/,SEND PRIVATE MESSAGE,/post/Whats-the-best-free-email-service-now-that-yahoo-is-sold-ZgqsDWHB,Yahoo
7,"Jul 26, 2016",Outlook is laggy and crowded with ads. Poor spam filter doesn't help. Its only good as a secondary account for porn,2,Verizon,/company/Yahoo/,SEND PRIVATE MESSAGE,/post/Whats-the-best-free-email-service-now-that-yahoo-is-sold-ZgqsDWHB,Yahoo
8,"Jul 26, 2016",Yahoo was never in the top 25,5,LavaFlow,/company/Microsoft/,SEND PRIVATE MESSAGE,/post/Whats-the-best-free-email-service-now-that-yahoo-is-sold-ZgqsDWHB,Yahoo
9,"Jul 26, 2016",I heard Squirrel Mail is nice,4,heyo,/company/Cisco/,SEND PRIVATE MESSAGE,/post/Whats-the-best-free-email-service-now-that-yahoo-is-sold-ZgqsDWHB,Yahoo
10,"Jul 26, 2016",Pine!,0,ana-ng,/company/Yahoo/,SEND PRIVATE MESSAGE,/post/Whats-the-best-free-email-service-now-that-yahoo-is-sold-ZgqsDWHB,Yahoo
0,"Oct 6, 2017",sry,0,blurt,/company/Yahoo/,SEND PRIVATE MESSAGE,/post/Oh-Yahoo---how-I-wish-wed-never-met-xkgXuZPX,Yahoo
0,"Aug 18, 2016",This is fairly obvious but you should goto the company where you get the most responsibility and freedom. No one will care if you have 10 years experience at changing css font sizes at google over some more notable achievement like designing the backend for walmarts new ecommerce platform,4,Legstrong,/company/Yahoo/,SEND PRIVATE MESSAGE,/post/Would-you-encourage-an-intern-to-return-to-Yahoo-GvC0jVp4,Yahoo
1,"Aug 18, 2016",Recommend the intern return to !yahoo,3,Th4tGuy,/company/LinkedIn/,SEND PRIVATE MESSAGE,/post/Would-you-encourage-an-intern-to-return-to-Yahoo-GvC0jVp4,Yahoo
2,"Aug 19, 2016","No try another company. In particular, try the companies that are well respected and as a result will have a lot of rock star people who you'll have a chance to interact withGoogle and Facebook are good examples",0,friedrice,/company/Facebook/,SEND PRIVATE MESSAGE,/post/Would-you-encourage-an-intern-to-return-to-Yahoo-GvC0jVp4,Yahoo
3,"Aug 19, 2016","Yahoo's talent is well respected. Many of us have left for Google, Facebook, and others. Those that haven't get frequent invitations to do so.But the intern should broaden horizons and go elsewhere.",0,fYh37dz,/company/Yahoo/,SEND PRIVATE MESSAGE,/post/Would-you-encourage-an-intern-to-return-to-Yahoo-GvC0jVp4,Yahoo
4,"Aug 24, 2016",Dude you do realize Yahoos talent has filled most SV companies. Look around you. You'll find SOME ex Yahoos amongst you.,1,GarryOtter,/company/Yahoo/,SEND PRIVATE MESSAGE,/post/Would-you-encourage-an-intern-to-return-to-Yahoo-GvC0jVp4,Yahoo
5,"Aug 18, 2016",Recommendation is any other company....,0,UMWv70,/company/VMware/,SEND PRIVATE MESSAGE,/post/Would-you-encourage-an-intern-to-return-to-Yahoo-GvC0jVp4,Yahoo
6,"Aug 18, 2016","Why? I don't want to work at an unknown company where people are just like ""Oh Cool"" everytime I mention it.",0,Hodor_Hold,/company/Yahoo/,SEND PRIVATE MESSAGE,/post/Would-you-encourage-an-intern-to-return-to-Yahoo-GvC0jVp4,Yahoo
7,"Aug 18, 2016",Great people are fleeing Yahoo.  Your best opportunity as a new college grad is to find the best coworkers to learn from.,1,UMWv70,/company/VMware/,SEND PRIVATE MESSAGE,/post/Would-you-encourage-an-intern-to-return-to-Yahoo-GvC0jVp4,Yahoo
8,"Aug 18, 2016","Do Google, Facebook, Twitter, Linkedin, etc. instead.  Your environmental will allow you to grow much quicker in your first 2 years out of school.  You will be better and extremely marketable.The only people left at Yahoo in 6 months will be the people who can't get another decent offer.  Those are not the people to surround yourself with.",0,rKlr70,/company/LinkedIn/,SEND PRIVATE MESSAGE,/post/Would-you-encourage-an-intern-to-return-to-Yahoo-GvC0jVp4,Yahoo
9,"Aug 18, 2016","Agree with above except the part where you clubbed linkedIn and Twitter with Facebook and Google. The talent there aren't substantially better than yahoo at this point. I lost more than half my people to linkedIn and Id say they are on the same level as yahoo employees, maybe marginally higher",0,Legstrong,/company/Yahoo/,SEND PRIVATE MESSAGE,/post/Would-you-encourage-an-intern-to-return-to-Yahoo-GvC0jVp4,Yahoo
0,"Sep 11, 2016","I like it much more than last year's, long over due refresh and parity with desktop. What's not to like? or are you just annoyed by change?",2,usrnm,/company/Facebook/,SEND PRIVATE MESSAGE,/post/Rewritten-Yahoo-Fantasy-App-is-Terrible-This-Year-bSwI4jd7,Yahoo
1,"Sep 11, 2016","is there a means for you to give feedback in the app? what you wrote here is much more actionable than your original post, for sure",0,ana-ng,/company/Yahoo/,SEND PRIVATE MESSAGE,/post/Rewritten-Yahoo-Fantasy-App-is-Terrible-This-Year-bSwI4jd7,Yahoo
2,"Sep 11, 2016",I gave similar feedback through the in-app mechanism.,1,Krachtails,/company/DocuSign/,SEND PRIVATE MESSAGE,/post/Rewritten-Yahoo-Fantasy-App-is-Terrible-This-Year-bSwI4jd7,Yahoo
3,"Sep 11, 2016","Can't be worse than ESPN's, which was down for like 4 hours today.",2,XWFF20,/company/Lyft/,SEND PRIVATE MESSAGE,/post/Rewritten-Yahoo-Fantasy-App-is-Terrible-This-Year-bSwI4jd7,Yahoo
0,"Mar 1, 2016","exp. is not everything. especially with that only 1 year exp, you probably dont have anything to counter. your offer might be similar to a new grad.",2,balanha,/company/Google/,SEND PRIVATE MESSAGE,/post/Google-SDE-3-salary-range-with-1year-exp-at-Yahoo-gI7TcyTw,Yahoo
1,"Mar 1, 2016",How many GSU's typically a new grad gets?,0,IvFR04,/company/Yahoo/,SEND PRIVATE MESSAGE,/post/Google-SDE-3-salary-range-with-1year-exp-at-Yahoo-gI7TcyTw,Yahoo
2,"Mar 1, 2016","With 1 year in, you should be focused on job role and potential impact. Resume experience will pay you far, far more.",2,UJfd38,/company/Yahoo/,SEND PRIVATE MESSAGE,/post/Google-SDE-3-salary-range-with-1year-exp-at-Yahoo-gI7TcyTw,Yahoo
3,"Mar 1, 2016",Salary 100-115kBonus 15%250 GSUs,1,tabloid,/company/Tableau-Software/,SEND PRIVATE MESSAGE,/post/Google-SDE-3-salary-range-with-1year-exp-at-Yahoo-gI7TcyTw,Yahoo
4,"Mar 2, 2016","When saying SDE 3 you're talking about level 4, right?",0,Facebook,/company/Microsoft/,SEND PRIVATE MESSAGE,/post/Google-SDE-3-salary-range-with-1year-exp-at-Yahoo-gI7TcyTw,Yahoo
5,"Mar 3, 2016","It's level 3, given for master's new grad",0,IvFR04,/company/Yahoo/,SEND PRIVATE MESSAGE,/post/Google-SDE-3-salary-range-with-1year-exp-at-Yahoo-gI7TcyTw,Yahoo
6,"Mar 3, 2016","Afaik level 3 is SDE 2, level 4 is SDE 3, and level 5 is senior SDE",0,Facebook,/company/Microsoft/,SEND PRIVATE MESSAGE,/post/Google-SDE-3-salary-range-with-1year-exp-at-Yahoo-gI7TcyTw,Yahoo
7,"Mar 3, 2016","you should clarify what lvl is ""sde 3"".  # looks high for lvl3, so-so for lvl4. You should have offers from other company to bump it up a bit.",0,balanha,/company/Google/,SEND PRIVATE MESSAGE,/post/Google-SDE-3-salary-range-with-1year-exp-at-Yahoo-gI7TcyTw,Yahoo
0,"Jun 20, 2017","Personal decision. Yahoo offered smart co-workers, great culture, interesting problems, and a good lifestyle. But little to no career growth and an uphill battle in terms of company success. Other companies offer some or all of those things. Decide what you want most and make a decision that's right for you.",6,fhdc65,/company/Yahoo/,SEND PRIVATE MESSAGE,/post/Ex-Yahoos-how-is-life-on-the-other-side-rjVNu5K4,Yahoo
1,"Jun 20, 2017",Same money no work,4,☝,/company/Yahoo/,SEND PRIVATE MESSAGE,/post/Ex-Yahoos-how-is-life-on-the-other-side-rjVNu5K4,Yahoo
2,"Jun 21, 2017",which company?,0,ele🐘,/company/Yahoo/,Other,/post/Ex-Yahoos-how-is-life-on-the-other-side-rjVNu5K4,Yahoo
3,"Jun 20, 2017",More money. More work.,4,sangedebl,/company/Yahoo/,Eng,/post/Ex-Yahoos-how-is-life-on-the-other-side-rjVNu5K4,Yahoo
4,"Jun 21, 2017",How many still trapped at yahoo? I thought Microsoft sent lifeboats for rescue a while back,1,Huyt635,/company/Microsoft/,SEND PRIVATE MESSAGE,/post/Ex-Yahoos-how-is-life-on-the-other-side-rjVNu5K4,Yahoo
5,"Jun 21, 2017",What is the latest successful product from Yahoo?,0,Jim Raynor,/company/Microsoft/,SEND PRIVATE MESSAGE,/post/Ex-Yahoos-how-is-life-on-the-other-side-rjVNu5K4,Yahoo
6,"Jun 21, 2017",@Jim Raynor Not interested.,0,fhdc65,/company/Yahoo/,SEND PRIVATE MESSAGE,/post/Ex-Yahoos-how-is-life-on-the-other-side-rjVNu5K4,Yahoo
7,"Jun 22, 2017","Life is pretty good outside Y! I am being more productive and learning lot. However, I do miss MM's leadership and FYI's. You should consider exploring other opportunities.",0,Winterfell,/company/LinkedIn/,SEND PRIVATE MESSAGE,/post/Ex-Yahoos-how-is-life-on-the-other-side-rjVNu5K4,Yahoo
0,"Oct 31, 2020",you need to get a dual intent visa first (H1B),0,popbunny,/company/Bank-of-America/,SEND PRIVATE MESSAGE,/post/Can-I-start-GC-process-on-STEM-OPT-in-YahoooathVM-VbemSMk6,Yahoo
1,"Nov 8, 2020",Do people from RoW countries apply for GC on stem opt or f1 opt? And does applying for GC on f1 opt have an impact on stem opt extension?,0,swutkat,nan,SEND PRIVATE MESSAGE,/post/Can-I-start-GC-process-on-STEM-OPT-in-YahoooathVM-VbemSMk6,Yahoo
2,"Nov 9, 2020",Yes they do. Many get their EAD-AP before they need STEM extension,0,iscbjorfhj,/company/Facebook/,SEND PRIVATE MESSAGE,/post/Can-I-start-GC-process-on-STEM-OPT-in-YahoooathVM-VbemSMk6,Yahoo
3,"Oct 31, 2020","Other companies can do it, not sure about VM.",0,nanochips,/company/Bloomberg/,Eng,/post/Can-I-start-GC-process-on-STEM-OPT-in-YahoooathVM-VbemSMk6,Yahoo
4,"Oct 31, 2020","Curious, based on what criteria would you be filing an I-485. Would you do a direct application based on personal merit?Your employer is not sponsoring you for 485 because you're not eligible from an OPT status. You need to find another path, family based, work based (the wait time is impossible through H1B though) or other categories.If you intend on doing an application based on personal merit you need to have extraordinary case and circumstances.",0,alaoe,/company/Better-Mortgage/,SEND PRIVATE MESSAGE,/post/Can-I-start-GC-process-on-STEM-OPT-in-YahoooathVM-VbemSMk6,Yahoo
0,"Jun 23, 2018","IC3 is M4, correct. I used to make a base of about 175k and bonus of about 25k, stocks of about 25k per year as an M5.",0,KnkG84,/company/Uber/,SEND PRIVATE MESSAGE,/post/How-much-do-managers-M3-and-M4-make-in-yahoo-mail-f3H8V4xa,Yahoo
1,"Jun 23, 2018",2017,0,KnkG84,/company/Uber/,SEND PRIVATE MESSAGE,/post/How-much-do-managers-M3-and-M4-make-in-yahoo-mail-f3H8V4xa,Yahoo
2,"Jun 23, 2018",Hmm I thought ic4 would be M3.,0,💥f,/company/Yahoo/,SEND PRIVATE MESSAGE,/post/How-much-do-managers-M3-and-M4-make-in-yahoo-mail-f3H8V4xa,Yahoo
0,"Jun 14, 2019",So you can do questions you already know the answer to in 45 mins. 👏 Doing more than 10-20 coding questions to prepare for an interview is practically cheating.,1,.......  .,/company/Google/,SEND PRIVATE MESSAGE,/post/Need-Referrals-at-Adobe-LinkedIn-Lyft-and-Oath-Yahoo-Verizon-a7828xos,Yahoo
1,"Jun 14, 2019",But how without practicing you can solve these questions? Writing good software comes with practice and solving interview questions comes also by practise many questions. It's an art which comes by practise. You can't draw like picasso by just drawing 10-20 canvas or by just having all kind of brush and paints. You need to practise. I completely disagree with your point. Hope you can understand where my analogy is pointing to :)Either your,0,avuna,nan,SEND PRIVATE MESSAGE,/post/Need-Referrals-at-Adobe-LinkedIn-Lyft-and-Oath-Yahoo-Verizon-a7828xos,Yahoo
2,"Jun 14, 2019",You learn first principles and apply them during problem solving. 200 LC is cheating.,0,.......  .,/company/Google/,SEND PRIVATE MESSAGE,/post/Need-Referrals-at-Adobe-LinkedIn-Lyft-and-Oath-Yahoo-Verizon-a7828xos,Yahoo
3,"Jul 27, 2019",DM me for Yahoo,0,daddy 😩,/company/Verizon-Media/,SEND PRIVATE MESSAGE,/post/Need-Referrals-at-Adobe-LinkedIn-Lyft-and-Oath-Yahoo-Verizon-a7828xos,Yahoo
4,"Jun 17, 2019",DM me for Uber referral,0,DollarPay,/company/Adobe/,SEND PRIVATE MESSAGE,/post/Need-Referrals-at-Adobe-LinkedIn-Lyft-and-Oath-Yahoo-Verizon-a7828xos,Yahoo
0,"Apr 28, 2019",Just like any other. We evaluate against our bar and ask the same questions we ask everyone else. They either make the cut or they don’t.Yahoo’s decline over the years isn’t because of any individual engineer. There is plenty of great talent at Yahoo.,28,sight,/company/Uber/,Eng,/post/How-do-silicon-valley-look-at-engineers-coming-from-yahoo-in-2019-bcrxSbHt,Yahoo
1,"Apr 28, 2019",No one cares where you come from. Anyone looking down on a Yahoo engineer is just insecure and needs to feel better about themself.,4,SQ,/company/Square/,Eng,/post/How-do-silicon-valley-look-at-engineers-coming-from-yahoo-in-2019-bcrxSbHt,Yahoo
2,"Apr 28, 2019",I heard yahoo paid really well during marisa time. How has that changed when it transformed into ‘oath’,2,no-sql,/company/Microsoft/,SEND PRIVATE MESSAGE,/post/How-do-silicon-valley-look-at-engineers-coming-from-yahoo-in-2019-bcrxSbHt,Yahoo
3,"Apr 28, 2019",Verizon's subsidiary payroll. Limited budget for operations costs.,0,seattle'd,/company/Amazon/,SEND PRIVATE MESSAGE,/post/How-do-silicon-valley-look-at-engineers-coming-from-yahoo-in-2019-bcrxSbHt,Yahoo
4,"Apr 28, 2019","Just like intuit, they know we didn’t get into better ones so we are where we are",1,jirababy,/company/Intuit/,SEND PRIVATE MESSAGE,/post/How-do-silicon-valley-look-at-engineers-coming-from-yahoo-in-2019-bcrxSbHt,Yahoo
0,"Sep 22, 2016","People who live in glass houses shouldn't thrown stones, Microsoft.",2,fYh37dz,/company/Yahoo/,SEND PRIVATE MESSAGE,/post/Congrats-to-Yahoo-for-figuring-out-how-to-kill-your-user-base-DGIvDlbp,Yahoo
1,"Sep 22, 2016",Damn dude.  Learn how to take a compliment. I wish I had the cunning of slick Mariss.,1,S Ballmer,/company/Microsoft/,SEND PRIVATE MESSAGE,/post/Congrats-to-Yahoo-for-figuring-out-how-to-kill-your-user-base-DGIvDlbp,Yahoo
2,"Sep 22, 2016","It is impossible to hack Microsoft at that scale. We inside can barely access our email. MS achieved complete security by having a messy organization with frequent reorgs everywhere, including IT, and their addiction to SharePoint. Nobody can access anything!Now, MS just needs a better name for it than security by frequent reorgs, authorization expiration and SharePoint site lockdown. Let's hire someone from Apple to give it a name!",2,Diu54,/company/Microsoft/,SEND PRIVATE MESSAGE,/post/Congrats-to-Yahoo-for-figuring-out-how-to-kill-your-user-base-DGIvDlbp,Yahoo
3,"Sep 22, 2016",At least she's hot. I'd let her be my CEO any day.,1,Ethical,/company/Microsoft/,SEND PRIVATE MESSAGE,/post/Congrats-to-Yahoo-for-figuring-out-how-to-kill-your-user-base-DGIvDlbp,Yahoo
4,"Sep 23, 2016",And CEO is slang for...,0,JarJar,/company/Microsoft/,SEND PRIVATE MESSAGE,/post/Congrats-to-Yahoo-for-figuring-out-how-to-kill-your-user-base-DGIvDlbp,Yahoo
5,"Sep 23, 2016",inb4 sjws,0,dlvG64,/company/Amazon/,SEND PRIVATE MESSAGE,/post/Congrats-to-Yahoo-for-figuring-out-how-to-kill-your-user-base-DGIvDlbp,Yahoo
6,"Sep 22, 2016",What happened other than the big hack !?,1,Prime,/company/Google/,Eng,/post/Congrats-to-Yahoo-for-figuring-out-how-to-kill-your-user-base-DGIvDlbp,Yahoo
7,"Sep 22, 2016",Allowing for the big hack was their ingenious maneuver,0,S Ballmer,/company/Microsoft/,SEND PRIVATE MESSAGE,/post/Congrats-to-Yahoo-for-figuring-out-how-to-kill-your-user-base-DGIvDlbp,Yahoo
8,"Sep 22, 2016",Master plan of Marissa,0,Unemployed,/company/Uber/,SEND PRIVATE MESSAGE,/post/Congrats-to-Yahoo-for-figuring-out-how-to-kill-your-user-base-DGIvDlbp,Yahoo
0,"Feb 11, 2017",Why are you leaving Microsoft to Yahoo?,0,Hodor_Hold,/company/Yahoo/,SEND PRIVATE MESSAGE,/post/How-are-sales-incentive-compensation-bonuses-calculated-at-Yahoo-rFrYjuP6,Yahoo
1,"Feb 11, 2017",For that free food.,1,¯\_(ツ)_/,/company/Microsoft/,SEND PRIVATE MESSAGE,/post/How-are-sales-incentive-compensation-bonuses-calculated-at-Yahoo-rFrYjuP6,Yahoo
2,"Feb 11, 2017",Whatever out of zero is still zero! What makes you think you can hit the numbers?,0,Pankharapa,/company/Adobe/,SEND PRIVATE MESSAGE,/post/How-are-sales-incentive-compensation-bonuses-calculated-at-Yahoo-rFrYjuP6,Yahoo
0,"Mar 25, 2020",L4,1,pzt4bl,/company/Qualcomm/,SEND PRIVATE MESSAGE,/post/IC4-at-YahooVerizon-total-10-years-exp-What-level-can-I-expect-at-Google-0PCh4fCJ,Yahoo
1,"Apr 1, 2020",And the answer is: L4.Signed!,0,KevS75,/company/Oath/,Eng,/post/IC4-at-YahooVerizon-total-10-years-exp-What-level-can-I-expect-at-Google-0PCh4fCJ,Yahoo
2,"Apr 2, 2020",Congratulations! What TC were you offered?,0,pzt4bl,/company/Qualcomm/,SEND PRIVATE MESSAGE,/post/IC4-at-YahooVerizon-total-10-years-exp-What-level-can-I-expect-at-Google-0PCh4fCJ,Yahoo
3,"Apr 2, 2020","Base ~143k/year, GSUs 150k/4 years,   sign bonus ~28k,  annual bonus target 15%+The location is _not_  US/Europe",0,KevS75,/company/Oath/,Eng,/post/IC4-at-YahooVerizon-total-10-years-exp-What-level-can-I-expect-at-Google-0PCh4fCJ,Yahoo
4,"Mar 25, 2020","How the heck can you be hired as T5 then?  10 yoe, good feedbacks are not enough??",0,KevS75,/company/Oath/,Eng,/post/IC4-at-YahooVerizon-total-10-years-exp-What-level-can-I-expect-at-Google-0PCh4fCJ,Yahoo
5,"Mar 25, 2020",YMMV. All you can do is try :),0,vHqru,/company/Amazon/,Eng,/post/IC4-at-YahooVerizon-total-10-years-exp-What-level-can-I-expect-at-Google-0PCh4fCJ,Yahoo
6,"Mar 28, 2020",L4,0,awwe,/company/Salesforce/,SEND PRIVATE MESSAGE,/post/IC4-at-YahooVerizon-total-10-years-exp-What-level-can-I-expect-at-Google-0PCh4fCJ,Yahoo
7,"Mar 28, 2020",Googs looks down,0,OPnd70,/company/Oath/,SEND PRIVATE MESSAGE,/post/IC4-at-YahooVerizon-total-10-years-exp-What-level-can-I-expect-at-Google-0PCh4fCJ,Yahoo
0,"Mar 13, 2016","People do hire pregnant women. I have seen it happen several times with 6 months pregnant, definitely showing women. Not only is it illegal to discriminate but it's hard to find great talent so if you find a good person that happens to be pregnant you hire that person. People have kids, it's part of life. Not a big deal.",2,Ffffff,/company/Uber/,SEND PRIVATE MESSAGE,/post/I-work-at-Yahoo-snd-just-found-out-im-pregnant-I-am-very-worried-since-JUQ3cKGA,Yahoo
1,"Mar 13, 2016",Pretty sure its much harder though but of course there are some instances where it happens,0,jMHb52,/company/Yahoo/,SEND PRIVATE MESSAGE,/post/I-work-at-Yahoo-snd-just-found-out-im-pregnant-I-am-very-worried-since-JUQ3cKGA,Yahoo
2,"Mar 12, 2016","If layoffs do happen and you plan on returning to work, I don't doubt you'll have a hard time finding a new gig in the tech industry. In today's world, seeing a 1-3 year gap in a women's resume is normal and shouldn't affect you. I know someone who returned to work after taking a 10yr break to be home with their kids.",0,DanTiger,/company/Microsoft/,SEND PRIVATE MESSAGE,/post/I-work-at-Yahoo-snd-just-found-out-im-pregnant-I-am-very-worried-since-JUQ3cKGA,Yahoo
3,"Mar 13, 2016",Yeah but its hard to prove discrimination they can just say you werent the best candidate,1,jMHb52,/company/Yahoo/,SEND PRIVATE MESSAGE,/post/I-work-at-Yahoo-snd-just-found-out-im-pregnant-I-am-very-worried-since-JUQ3cKGA,Yahoo
4,"Mar 14, 2016",Tbh netflix maternity is 'unlimited' which is code for less if you want to keep your job,0,NoRSU,/company/Yahoo/,SEND PRIVATE MESSAGE,/post/I-work-at-Yahoo-snd-just-found-out-im-pregnant-I-am-very-worried-since-JUQ3cKGA,Yahoo
5,"Mar 15, 2016",Why would you even expect to get special treatment because you are pregnant?  They should fire some guy who does better work because he isn't pregnant but six kids?,0,cXo,/company/Microsoft/,SEND PRIVATE MESSAGE,/post/I-work-at-Yahoo-snd-just-found-out-im-pregnant-I-am-very-worried-since-JUQ3cKGA,Yahoo
6,"Mar 16, 2016",^^ jerk,1,Pepelepew,/company/Yahoo/,SEND PRIVATE MESSAGE,/post/I-work-at-Yahoo-snd-just-found-out-im-pregnant-I-am-very-worried-since-JUQ3cKGA,Yahoo
7,"Mar 13, 2016","You should find a new job immediately.  If you are within first 10wks, you still have at least two months before your pregnancy starts showing. The maternity leave at the new company may not be as generous if you only work there for 4-5 months prior to delivery but at least you will have insurance and likely some leave. Good luck finding a job and fighting morning sickness at the same time.",1,o2w4l8,/company/Amazon/,SEND PRIVATE MESSAGE,/post/I-work-at-Yahoo-snd-just-found-out-im-pregnant-I-am-very-worried-since-JUQ3cKGA,Yahoo
8,"Mar 13, 2016",Thats what i was thinking. I hope i get an offer before i start showing. I just found out so maybe 2 months i have...,0,jMHb52,/company/Yahoo/,SEND PRIVATE MESSAGE,/post/I-work-at-Yahoo-snd-just-found-out-im-pregnant-I-am-very-worried-since-JUQ3cKGA,Yahoo
9,"Mar 12, 2016","The law protects you against discrimination, but AFAIK in USA you don't get any protection in case of reduction in forces or mass layoffs. If your entire division is going, the company isn't obligated to manufacture a new position for pregnant people elsewhere. Only you can decide what to do, of course. Practical considerations include whatever social net you have: being in good terms with a spouse with medical insurance, availability of family members to step up and help, your own confidence that your skills are such that you'll find employment elsewhere, etc etc. But once again, when everything is said and done this is 100% your decision and responsibility. Best of luck for everything!!!",1,SpitRoast,/company/Microsoft/,Product,/post/I-work-at-Yahoo-snd-just-found-out-im-pregnant-I-am-very-worried-since-JUQ3cKGA,Yahoo
0,"Dec 1, 2015",It's @yahoo-inc.com,1,jnnyrotten,/company/Yahoo/,SEND PRIVATE MESSAGE,/post/Only-a-few-dozen-more-Yahoos-needed-to-open-the-company-board-2p6JaCln,Yahoo
1,"Nov 21, 2015","I'm curious, what's the domain on yahoo employee email address? Since anyone can get XXX@yahoo.com.",1,Cartman,/company/Microsoft/,SEND PRIVATE MESSAGE,/post/Only-a-few-dozen-more-Yahoos-needed-to-open-the-company-board-2p6JaCln,Yahoo
2,"Nov 19, 2015",I've been here for weeks waiting! They just doubled it a week or so ago.,1,jaycutler,/company/Yahoo/,SEND PRIVATE MESSAGE,/post/Only-a-few-dozen-more-Yahoos-needed-to-open-the-company-board-2p6JaCln,Yahoo
3,"Nov 23, 2015",Well isn't that the same for google and a bunch of other companies?,0,Yup,/company/Yahoo/,SEND PRIVATE MESSAGE,/post/Only-a-few-dozen-more-Yahoos-needed-to-open-the-company-board-2p6JaCln,Yahoo
4,"Nov 23, 2015",I don't know how Google does it either.,0,Cartman,/company/Microsoft/,SEND PRIVATE MESSAGE,/post/Only-a-few-dozen-more-Yahoos-needed-to-open-the-company-board-2p6JaCln,Yahoo
5,"Nov 21, 2015",Get to it people!,0,Heisenberg,/company/Yahoo/,SEND PRIVATE MESSAGE,/post/Only-a-few-dozen-more-Yahoos-needed-to-open-the-company-board-2p6JaCln,Yahoo
0,"Mar 23, 2017",How do you evaluate them? By asking the leetcode type questions? I am sure whoever studies more will look better in those questions. Legendary engineers may fail it while college graduates pass the bar for distinguished engineer level questions.,1,ccccaaaa,/company/Microsoft/,Eng,/post/Whats-the-principal-software-engineer-position-@-yahoo-how-does-it-compare-to-IC-level-and-what-does-the-pay-look-like-eLGdJk2b,Yahoo
1,"Mar 23, 2017","Nope, for senior engineers the interviews focus more on design and architecture. All coding questions we ask are out on Glassdoor anyways.",0,googlerr,/company/Uber/,SEND PRIVATE MESSAGE,/post/Whats-the-principal-software-engineer-position-@-yahoo-how-does-it-compare-to-IC-level-and-what-does-the-pay-look-like-eLGdJk2b,Yahoo
